Красота&VL / Патчи для лица/ пластырь от прыщей и акне/средство точечное/ наклейки от высыпаний гидроколлоидные/,219 ₽,2 отзыва,"Завтра доставит Ozon, продавец Лучший",https://www.ozon.ru/product/krasota-vl-patchi-dlya-litsa-plastyr-ot-pryshchey-i-akne-sredstvo-tochechnoe-nakleyki-ot-550612954/?asb=7YK8jBCJigxb0Tw%252B09TJ9CnpFu13%252Bpt6WZEBerxWYdrV7kw9zezUSq0ieQaj%252FUAT&asb2=5L0RRgyssACEPjdCFSfmEu242v1FKUesxwLlPFa_qxV8l4ckVB1AHY2qP-HEB8E7siPW7BNcwVgnn19HazqCUVu_dv05cemT6PEJbSV-8ckvUzmvJTKKqSfPBYBx3gn5
BrowXenna (Brow Henna) Линейка с натяжением нити,915 ₽,31 отзыв,"Завтра доставит Ozon, продавец Levchuk Professional",https://www.ozon.ru/product/browxenna-lineyka-s-natyazheniem-niti-179659266/?asb=9iQdBlfZymcJKlVvD01nlEozvBDSAjQlOP9zm15MvxYI9D%252FdhB4qtdycXYTojTWe&asb2=qR9JPxl2hBySJgO4NKrfcYH7NWaywkrtaVux2ITJkmilPkPxdbnHoMuHrW1DxkKVtOaMW99Vj0KFXPKio-5rIx-JDJ00DdxvCPM97UFtjc8cmQzMu5fxc-Ph5e9Gzs1BheNOa5BkKPOcQ66E_bSTBA
"Lash&Go Патчи для наращивания и ламинирования ресниц ""Snow White"" (20 пар)(20 упаковок)",899 ₽,3 отзыва,"Завтра доставит Ozon, продавец LashFriends",https://www.ozon.ru/product/lash-go-patchi-dlya-narashchivaniya-resnits-snow-white-20-par-177928766/?asb=EVmmlEyP1uF7e3va02d6loL5kTULOm7zXBxYaLx%252FQtk%253D&asb2=kop9d8a8AV2K53M6MaVhy8dJ96n6bfyGiMxmvrfwKSuljbt4qluuiOO46mw7NrUq
"Формы для наращивания ногтей / Мотылек, 500 шт /нижние формы / шаблоны для моделирования ногтей",599 ₽,1 отзыв,"Завтра доставит Ozon, продавец Veter11",https://www.ozon.ru/product/formy-dlya-narashchivaniya-nogtey-motylek-500-sht-nizhnie-formy-shablony-dlya-modelirovaniya-nogtey-373613020/?asb=7DQMZwu2hqFgc4WS7CZJw9BB9%252B850wVVlry5nB0CD3FV9ic%252BkbO77KPdxx510cvJ&asb2=3-SHPv6l47hAUvhI6HDhPPVza1ZlqNRTZwi5Hw2gz66RENY8a8CzRAyqGV0nNfYn18LesrIvLszPwix5IdVwE2gEh19rKF2k4Dhnw86QMlDKLszlwfBnpQMVIPxu4NtydHiXQxdp0J_M3bObmT0csA
"Набор кистей для макияжа ,12 штук",399 ₽,1 отзыв,"Завтра доставит Ozon, продавец Veter11",https://www.ozon.ru/product/nabor-kistey-dlya-makiyazha-12-shtuk-373778819/?asb=VrsvSqYfAS5%252FwtMjff4NG9D9UUMHh219q3NdmlNFjP0PeoBtYiyWOBBABE16aFnT&asb2=X0tqLxcc1kA945tEThMQkvDZLBHldvLv7QcLKXBpsxuyks46Fh7c1ao-BiUeEv2jHbFypaFqy47dYbR-4jj9cdq-93nlhzolQq2S-SzCWMPPO3s60Y91zVxcbmVrmU11SlFv7BabE1n4vIc_zdxrgQ
Фосфорный пигмент для дизайна ногтей в темноте светится 12шт в наборе,408 ₽,5 отзывов,"9 мая доставит Ozon, продавец Nails Shop_TJ",https://www.ozon.ru/product/fosfornyy-pigment-dlya-dizayna-nogtey-v-temnote-svetitsya-12sht-v-nabore-345818124/?asb=rri3xU4RWZnQ7vleqlOEzTta26%252B4jSzfXRJzO%252BvE9Bo%253D&asb2=9kHGZ88uhWsVgvXJqFebrgErgC7BnTC2CwRQJSRp_lOUgtXtfXxzyuhcfyAmpOWM
