"Альянс Хим, Пакеты для стерилизации инструментов 75x150 мм, из крафт-бумаги, белые, 100 шт",372 ₽,145 отзывов,"13 мая доставит Ozon, продавец Пробахилы.рф",https://www.ozon.ru/product/alyans-him-pakety-dlya-sterilizatsii-instrumentov-75x150-mm-iz-kraft-bumagi-belye-100-sht-347730172/?asb2=-FVhoB-0sCHepeGm1lwUyl2zb-GPylqTRr9Z5nkk7A7cSHvYKa25h2nn4mqp72BO
Liara / Крафт пакеты SteriTimer для стерилизации инструментов / 60x100 мм / 100 шт.,217 ₽,195 отзывов,"Завтра доставит Ozon, продавец Liara",https://www.ozon.ru/product/liara-kraft-pakety-steritimer-dlya-sterilizatsii-instrumentov-60x100-mm-100-sht-389532421/?asb2=qcvzxGfRwnlUUWYOZFcPkDKnLbGDPGw-BxBhYVB7dKZ_Bq6Wutz0jT8L5TPLVCOhj6jcvT2T3AK4-NEzlKmo2w
Бокс-контейнер для стерилизации,345 ₽,92 отзыва,"Завтра доставит Ozon, продавец ONIX SHOP",https://www.ozon.ru/product/boks-konteyner-dlya-sterilizatsii-473695639/?asb2=uxYboZm0E8JucWraYDNP9cKg_XHgRjTltK1PKswLbwbfbMLx-htyadIyVpx8DaZc
"Flower's Queen - Портативная УФ лампа для маникюра, УФ фонарик для гель-лака",490 ₽,55 отзывов,"9 мая доставит Ozon, продавец Flower's Queen",https://www.ozon.ru/product/flower-s-queen-portativnaya-uf-lampa-dlya-manikyura-uf-fonarik-dlya-gel-laka-479792391/?asb2=uO-3EN4ZNSWYHaQhh9sPdSyNGhmyIwK4mre9df6io83PykcGRtp7qZwMyU27914TIFOjhhU2k-xsNH6lhU8G3A
Бокс-контейнер для стерилизации маникюрных инструментов,310 ₽,56 отзывов,"9 мая доставит Ozon, продавец Diamond Shine",https://www.ozon.ru/product/boks-konteyner-dlya-sterilizatsii-manikyurnyh-instrumentov-238484414/?asb2=KLUz3bE5wRI08bkUr3Vv_xKzhUgiqlLwxeng6AD6PT6bzFusLDd_c51WuPFe5jX3
"Лоток для инструментов металлический, малый",189 ₽,134 отзыва,"9 мая доставит Ozon, продавец Diamond Shine",https://www.ozon.ru/product/lotok-dlya-instrumentov-metallicheskiy-malyy-251986117/?asb2=2KlMw53wx8p9lvi8Lcwddf3nZiIk6UEuDQ7FYI6p3la75WuHpAqJRFfJOYxDzXE9
KERIS UV NAIL LAMP 88 Watt Professional/Лампа для маникюра/Лампа для сушки ногтей/Лампа для ногтей/Гибридная лампа для маникюра LED UV/Лампа для гель лака/Лампа для маникюра 88 Вт 18 ламп,648 ₽,101 отзыв,"Завтра доставит Ozon, продавец Keris",https://www.ozon.ru/product/keris-uv-nail-lamp-88-watt-professional-lampa-dlya-manikyura-lampa-dlya-sushki-nogtey-lampa-dlya-479943025/?asb2=iBjwe-gHPkYupoQNBjJBuADzUngKXy_18oe8Z_OzHAG7Oe_qkA13svEbM7UAl75p2E8ahmanHdjY1W4jskLEPw
Liara / Набор фрез для маникюра и педикюра / Фрезы для полировки / 6 шт.,315 ₽,135 отзывов,"Завтра доставит Ozon, продавец Liara",https://www.ozon.ru/product/liara-nabor-frez-dlya-manikyura-i-pedikyura-frezy-dlya-polirovki-6-sht-381786096/?asb2=mphharMSC0p9pzNfKPTsu5GpzDRoMLmXXhuhQeYftLdtwU9vAnU9S2jU8EnLtEREvB4F5-fVzM6yWW_w17XPHA
SUN Лампа для маникюра UV LED SUN X 54W,945 ₽,71 отзыв,"9 мая доставит Ozon, продавец Diamond Shine",https://www.ozon.ru/product/sun-lampa-dlya-manikyura-uv-led-sun-x-54w-236937302/?asb2=_olVIgdLlBn0X_tCf7XMj-ml7VCVFudld8t7Qrs56bGs8gT3TuEGT4V_ZWWIQQCL
Keris Вытяжка настольная для маникюра/Пылесос для маникюра/Настольный пылесос для маникюра/Пылесборник 30W белый,990 ₽,7 отзывов,"Завтра доставит Ozon, продавец Keris",https://www.ozon.ru/product/keris-vytyazhka-nastolnaya-dlya-manikyura-pylesos-dlya-manikyura-nastolnyy-pylesos-dlya-467889289/?asb2=agm4MQDCOBrnMPgNdq-z5Fx1gR5L_61lqHG5G3_jPvUd65P0Q-9S2-eyQgNOliUxcFRWjoZBVkkrbuNXXyDSPg
Steritimer Пакеты для стерилизации инструментов комбинированные крафт бумага/пленка 60х100 мм 100 шт. / Крафт пакет для стерилизации и хранения инструментов / Пакеты для стерилизации с QR-кодом / МедТест / Пакет комбинированный плоский,210 ₽,94 отзыва,"Завтра доставит Ozon, продавец Steritimer",https://www.ozon.ru/product/steritimer-pakety-dlya-sterilizatsii-instrumentov-kombinirovannye-kraft-bumaga-plenka-60h100-mm-100-490395311/?asb2=KL8-LOQRB4ZDoyPiOwXWFfbVIBWXRie4MvM0-nProRcHUMpcN5PnJ2STV3IM9Htn
Фреза конус керамическая для аппаратного маникюра и педикюра. Насадка игла. Цвет синий. FOCSA,145 ₽,100 отзывов,"Завтра доставит Ozon, продавец FOCSA",https://www.ozon.ru/product/freza-konus-keramicheskaya-dlya-apparatnogo-manikyura-i-pedikyura-nasadka-igla-tsvet-siniy-focsa-279204829/?asb2=YeeIpj59dJAvqlsFqOXrVpbMji46GRafbVUnUKFFNB2bAf1bf3ph8s9q-Y-7ZyqA8b5-S_yhwkg0TmzJCL-nWg
"Альянс Хим, Пакеты для стерилизации инструментов 100x200 мм, из крафт-бумаги, белые, 100 шт",430 ₽,145 отзывов,"13 мая доставит Ozon, продавец Пробахилы.рф",https://www.ozon.ru/product/alyans-him-pakety-dlya-sterilizatsii-instrumentov-100x200-mm-iz-kraft-bumagi-belye-100-sht-347728219/?asb2=LWCcunJ1_0Ot5BMRp4dqqbo5h7XV_irsFmV80QBTFIUJSBt4j_v29ACu5YTbN-5P
Фреза Конус твердосплавная для аппаратного маникюра и педикюра. Цвет черный.,196 ₽,171 отзыв,"Завтра доставит Ozon, продавец FOCSA",https://www.ozon.ru/product/freza-konus-tverdosplavnaya-dlya-apparatnogo-manikyura-i-pedikyura-tsvet-chernyy-425544268/?asb2=D14sG5oHJV39cNH53NNTXd0KhoOxUXc7NUph0bXCFues2IxY6jOtB-F9wA9rpWhCXNHjMFHZUCOw09QzrGyuxg
SteriTimer Пакеты для стерилизации инструментов комбинированные крафт бумага/пленка 75х150 мм 100 шт. / Крафт пакет для стерилизации и хранения инструментов / Пакеты для стерилизации с QR-кодом / МедТест / Пакет комбинированный плоский,237 ₽,94 отзыва,"Завтра доставит Ozon, продавец Steritimer",https://www.ozon.ru/product/steritimer-pakety-dlya-sterilizatsii-instrumentov-kombinirovannye-kraft-bumaga-plenka-75h150-mm-100-491345571/?asb2=CnHHXz_1de7_8b0DFn6Jhmeeqgbb00iryhr4ClIlwDeP_7EkKWUC1sRVvPS-szco
Liara / Набор фрез для аппаратного маникюра и педикюра / Фрезы для полировки / 3 шт.,213 ₽,135 отзывов,"Завтра доставит Ozon, продавец Liara",https://www.ozon.ru/product/liara-nabor-frez-dlya-apparatnogo-manikyura-i-pedikyura-frezy-dlya-polirovki-3-sht-381695809/?asb2=6U7Ax6iHf69YGVK0JiiqF-vvTSiqVjaWSgj8TtoCD1HrZbrZ-7Q-phD7VejymhpVuiO5O1oC6--_oIMdFkRRXA
Аппарат для маникюра и педикюра Фрезер-ручка для аппаратного маникюра,555 ₽,126 отзывов,"9 мая доставит Ozon, продавец Добрый медвежонок",https://www.ozon.ru/product/apparat-dlya-manikyura-i-pedikyura-frezer-ruchka-dlya-apparatnogo-manikyura-416464224/?asb2=wIBUEbpHKgww0n6spJJwMjeU7La6TwvRLHWyxbKgqsqPqtZmxmOKQf3lSF6IIEzA2zLQ0-kaOn220oDNe_hetw
Liara / Крафт пакеты SteriTimer для стерилизации инструментов / 100x200 мм / 100 шт.,304 ₽,195 отзывов,"Завтра доставит Ozon, продавец Liara",https://www.ozon.ru/product/liara-kraft-pakety-steritimer-dlya-sterilizatsii-instrumentov-100x200-mm-100-sht-389529792/?asb2=P7QYeeaZJnbKF6n_o47qVwmVh6GgqZntz6eXUTmkzLHT3x3Ro_dvrGYfClC2B0wJVWIMFgzrv1xO7JiAM-LMVg
Liara / Капрамин,300 ₽,71 отзыв,"Завтра доставит Ozon, продавец Liara",https://www.ozon.ru/product/liara-kapramin-402573119/?asb2=dSrP0jCyzRxdhcmmP1nk1JH5V3h3xUXTJGoVg1zvzt25AMpcpuUT3k2rKdBERefL7sGHbDKGVqujXOiX2f_wGw
Liara / Крафт пакет для стерилизации инструментов / 75х150 мм / 100 шт.,275 ₽,65 отзывов,"Завтра доставит Ozon, продавец Liara",https://www.ozon.ru/product/liara-kraft-paket-dlya-sterilizatsii-instrumentov-75h150-mm-100-sht-274266989/?asb2=KWz9d8pcbnAcw_3TT1QrwKr88vRHlPltGBwajM7BBjG7X1YMkVMPkn9v48qHPKHjTuQwt2jYT6E-ItldE5lhHA
Muhle Manikure Фреза 502 187 190 023 Средняя для выпиливания и затеков (Конус усеченный) d-2.3,395 ₽,49 отзывов,"Завтра доставит Ozon, продавец MYSLITSKY NAIL",https://www.ozon.ru/product/muhle-manikure-freza-502-187-190-023-srednyaya-konus-usechennyy-d-2-3-174878423/?asb2=IYQg9k5ZtqjAiihPxG-73uaqfMaAOkRw1YHI9Lknc7guK6py31Zs43_J37r0YATi
Steritimer Пакеты для стерилизации инструментов комбинированные крафт бумага/пленка 100х200 мм 100 шт. / Крафт пакет для стерилизации и хранения инструментов / Пакеты для стерилизации с QR-кодом / Пакет комбинированный плоский,300 ₽,94 отзыва,"Завтра доставит Ozon, продавец Steritimer",https://www.ozon.ru/product/steritimer-pakety-dlya-sterilizatsii-instrumentov-kombinirovannye-kraft-bumaga-plenka-100h200-mm-490377225/?asb2=oSGPrNzJE1v92ZqbulVU6Q5LtQzBV22mkYvSLl-oSQo-Jfki9vguSnblqVw4Rfoz
URM Аппарат для маникюра и педикюра Фрезер-ручка для аппаратного маникюра,555 ₽,106 отзывов,"9 мая доставит Ozon, продавец ГлавСнаб",https://www.ozon.ru/product/urm-apparat-dlya-manikyura-i-pedikyura-frezer-ruchka-dlya-apparatnogo-manikyura-298698869/?asb2=QWL0uAa7wA8E9OYx9yssC30ch_RSjJ3d5OphVvUWaL-YDpXkxMjoL-mJB2VEh9wgPxGBaxW9i9Q4dN7OupCb0A
Фреза пика керамическая для аппаратного маникюра и педикюра. Насадка бочонок. Цвет красный. FOCSA,145 ₽,106 отзывов,"Завтра доставит Ozon, продавец FOCSA",https://www.ozon.ru/product/freza-pika-keramicheskaya-dlya-apparatnogo-manikyura-i-pedikyura-nasadka-bochonok-tsvet-279231946/?asb2=IZwxrGkXGF0hmaZtcG-i9vB8d7c9RgTqF_eiP6JEuDHLOHlIn0Z9wUEByy2HlMZ4TcY-eZnPMKZuwFFZ1rjfPA
"Probioneat / Дезинфицирующее средство Bioneat Professional / Стерилизация и Дезинфекция инструментов/Анолит АНК Нейтральный / Антисептик, 3л",347 ₽,114 отзывов,"Завтра доставит Ozon, продавец ООО ""ТЕМА""",https://www.ozon.ru/product/probioneat-dezinfitsiruyushchee-sredstvo-bioneat-professional-sterilizatsiya-i-dezinfektsiya-386839814/?asb2=fcNSwadVx7XHGdp-0pH8C2AZqnewFsjIBzHBmxHcQQ66FU1HzyT9GqOkAgPcJDtCCOq6TC2-sx4CYC7iCL-rag
Scholl Аппарат для маникюра и педикюра для стоп с экстражестким роликом,659 ₽,7 отзывов,"11 мая доставит Ozon, продавец Household Goods",https://www.ozon.ru/product/scholl-apparat-dlya-manikyura-i-pedikyura-dlya-stop-s-ekstrazhestkim-rolikom-536004927/?asb2=G6RP7Q6-WVg-6AH4VTlUedbH5yWPuq_fxXWROMPK69_ClrZXOH9Sm6Fu_YSGAICf
Фреза пика керамическая для аппаратного маникюра и педикюра. Насадка бочонок. Цвет синий. FOCSA,145 ₽,106 отзывов,"Завтра доставит Ozon, продавец FOCSA",https://www.ozon.ru/product/freza-pika-keramicheskaya-dlya-apparatnogo-manikyura-i-pedikyura-nasadka-bochonok-tsvet-siniy-focsa-279204379/?asb2=pQBE5sjd18Oe-2IcMQTG_CoHM_OR5n2oOqNeChnxfN_4nk2ql04J08kCY-RZpxtwz9RUiXQI4LVaO7ZhUhHjIw
Лампа для сушки ногтей sun one UV/LED 48 W,749 ₽,125 отзывов,"9 мая доставит Ozon, продавец Diamond Shine",https://www.ozon.ru/product/lampa-dlya-sushki-nogtey-sun-one-uv-led-48-w-235491804/?asb2=mi3ax5DkKsdLOTIv8tBoO5csHqynkLTQZvS4jquK-zLXJ-0vRncrV8cDVtKsz18N
"Алмазные фрезы Пламя 023 (10), красная, диаметр 2.3 мм, длина 10 мм, 3 шт, производство Казань",309 ₽,3 отзыва,"Завтра доставит Ozon, продавец Grand Almaz",https://www.ozon.ru/product/almaznye-frezy-plamya-023-10-krasnaya-diametr-2-3-mm-dlina-10-mm-3-sht-proizvodstvo-kazan-521893252/?asb2=zrYpTxW_FdXvxpKhz4Kv6q2m5IrH-sK7rBVAXNiyq_4BbX3iDyfSdKdsl8jKGAjrIwiQU-0oFL7VI0tWfFcSqA
"БЛЮМЕНТАЛЬ Фреза алмазная 021 (упаковка 3 шт) (Пламя, красная насечка) d-2.1",190 ₽,4 отзыва,"9 мая доставит Ozon, продавец БЛЮМЕНТАЛЬ",https://www.ozon.ru/product/blyumental-freza-almaznaya-021-upakovka-3-sht-plamya-krasnaya-nasechka-d-2-1-542268126/?asb2=RloHGWnrx-dgYV5lWGp0mOx9Nv3Fx-l0atTRsi5EYJ43N57mdxb9eM8cllnthejYQQCMo5wX1ESKKFOPwh1uUw
Liara / Крафт пакеты SteriTimer для стерилизации инструментов / 75x150 мм / 100 шт.,275 ₽,195 отзывов,"Завтра доставит Ozon, продавец Liara",https://www.ozon.ru/product/liara-kraft-pakety-steritimer-dlya-sterilizatsii-instrumentov-75x150-mm-100-sht-399011846/?asb2=O9s1Vxd1CxHJPIFMp9AEGA-OJyNGTezlDXRnTg7l-GHlhPQsTYPw_oI_mzeVHgdlIx7JWI_RkmmeZ7NGNPHzaw
"HDFREZA Фреза твердосплавная фиолетовая для снятия гель-лака ёлочка 501 213 145 060 Тонкая (как красная), 6 мм",499 ₽,170 отзывов,"Завтра доставит Ozon, продавец MYSLITSKY NAIL",https://www.ozon.ru/product/hdfreza-freza-tverdosplavnaya-fioletovaya-dlya-snyatiya-gel-laka-elochka-501-213-145-060-tonkaya-540298824/?asb2=n-ki6wHdP0_BZAlFVQcSx28yfW8H6ra7McgSQqm3viXYaXSg3QeyEg_w2SHTKr-m
"Крафт-пакеты для стерилизации 100x200мм, 100шт, КЛИНИПАК",315 ₽,20 отзывов,"9 мая доставит Ozon, продавец Медицинские расходные товары",https://www.ozon.ru/product/kraft-pakety-dlya-sterilizatsii-100x200mm-100sht-klinipak-494725526/?asb2=wcNg12BS3ghJDK5zsGoF__yjpwgbfpA5ihy_v5Pr8Kp1EtbWkeYvy3Qe55Hxljwj
Colibri Design / Крафт пакеты SteriTimer для стерилизации инструментов / 60x100 мм / 100 шт.,214 ₽,110 отзывов,"Завтра доставит Ozon, продавец Colibri Design",https://www.ozon.ru/product/colibri-design-kraft-pakety-steritimer-dlya-sterilizatsii-instrumentov-60x100-mm-100-sht-389540706/?asb2=SyCXGOwNPnSi0T7_hNueOQ5NJYI_a1pBPhjYkhWdM1rUPX4wtf9IiykJDjtzX29IXLc_y6gifTM8GYpqJ5KUcg
"Лампа для маникюра CCFL/LED, 36 ВТ / Лампа для сушки ногтей / Гибридная лампа для маникюра LED",648 ₽,15 отзывов,"Завтра доставит Ozon, продавец Nail market",https://www.ozon.ru/product/lampa-dlya-manikyura-ccfl-led-36-vt-lampa-dlya-sushki-nogtey-gibridnaya-lampa-dlya-manikyura-led-552580657/?asb2=jYjBsYiAOppv2PCl7VUueDuAfuoxZYW0_9ATPu9zTPoRH79SyBdPoIFpbruG7Oo67PrNI3d8dzETfGEA-JHkYA
Scholl Аппарат для маникюра и педикюра для стоп с экстражестким роликом (розовая),679 ₽,7 отзывов,"11 мая доставит Ozon, продавец Household Goods",https://www.ozon.ru/product/scholl-apparat-dlya-manikyura-i-pedikyura-dlya-stop-s-ekstrazhestkim-rolikom-rozovaya-531871532/?asb2=S1gaLqEjje2wklb25b4QNaP-UyJC1J43xVztwww-0VBmmDIoiw6Mk-c74IJOIiUv
