"Декоративное покрытие, Эмаль Poli-R С МЕТАЛЛИЧЕСКОЙ СТРУЖКОЙ Быстросохнущая, Гладкая, до 150°, Эпоксидная, Шелковисто-матовое покрытие, Глубокоматовое покрытие, 0,84 кг, серый",979 ₽,2 отзыва,"8 мая доставит Ozon, продавец ООО ТД «Поли-Р»",https://www.ozon.ru/product/dekorativnoe-pokrytie-emal-poli-r-s-metallicheskoy-struzhkoy-bystrosohnushchaya-gladkaya-do-150-358696677/?advert=WJrvB32FPIZkh0t09CqwM7qWXBNdcKyo6Yv0qr5Uuqxp-cKMT6fqRfdxvhp0c3JcT0LvS8fcNSCn-Ilm7_8GJO3iGz94Xvk_nBvb7thWx1OUUJByyKMcvhox4H5eR0fXzMzXjHCIO9EKDHKUzQfN9F_ZazWEEhQs0Kfqa77kMyrprl9NXnRZGsb4MzPXoh7sX6Pj9xuzAo4nVdirtaAKAuK3Vw5MVHXeh6gsyhgkI0TttvDvw3cCayJ4vJgDBbcELnlfMAk5MlwMEDiIIkehyZJsIz5EIES6h9yyOdfd-ejB_TlW5fnVQHE5rmoCFg2QtLKpFm2cEs_ZLjyMU6Fw_YuGPClXDNtfEM742_dWp5bckchQxVEORY6kRGc-nIuDpFdYx56P86bVZJ4WSkZ23GhcAepCjmAQB85I8kXJStPADuFBGSuEQURO5PWAc_OILpgSdOakcQ7cMYIrDYHNh_WZP3amgVofHhT7OOADJzF9HqHVFZGVp0gQkGQ1NQgTQF9_S-beuxadPFJOhFGrMk2Dx8BR9CxbgwoTk7BJoEJGzPmfCn7Gr4Rvi4OveP_S
"Краска, Грунт-эмаль VGT (эмаль) акриловая ВД-АК-1180 фасадная для наружных и внутренних работ, для фасада 3 кг Гладкая, Структурная, Акриловая, Матовое покрытие, 3 кг, белый",599 ₽,23 отзыва,"Завтра доставит Ozon, продавец СтройKING",https://www.ozon.ru/product/kraska-grunt-emal-vgt-emal-akrilovaya-vd-ak-1180-fasadnaya-dlya-naruzhnyh-i-vnutrennih-rabot-297271681/?asb=ofMRWWeQaAjgvDFpllVrF0laN3k0HIf4R9%252FjC2jF%252B0iW9diOKHWZ2o5XAtcAbEZe&asb2=j_HSoaWkcmUJGoonc7I3cUyYbwCi3YdRs6Rcri9EgX2MPj7quuWsGW63cBdt_2oik34WOjlkVtwZ9FFUnHtGvi5Ic9kLF4BrNC0kp9iCGN2UdTSsIrlbjIjkhPXErLIbso5oilhhasAZadMES6wpqw
"Краска, Декоративное покрытие VGT 1180 Структурная, Фактурная, Матовое покрытие, 3 кг, белый",599 ₽,61 отзыв,"Завтра доставит Ozon, продавец СтройKING",https://www.ozon.ru/product/kraska-dekorativnoe-pokrytie-vgt-1180-strukturnaya-fakturnaya-matovoe-pokrytie-3-kg-belyy-247763944/?asb=ZS4ZJyM483RtFdtFK8lerOLiUJxnZW%252FJOKfNSdMgJjxqYDmYO8JBffzVY3wnf0dp&asb2=dKGJYSXLeD4FXm1c18wQB4XpvQDJIZ45E33dEwwodqZNjMwoUZgV0hMY2HOm853uQBdVrCs8VOTl8JJM-K64CyXuCON33iq-0MEf0K4btUBNwb4ZL_9W4tXQC434JicJUohOw4wgKRb937fRzSrHHA
"Декоративное покрытие VGT бесцветный, Матовое покрытие, прозрачный",595 ₽,1 отзыв,"Завтра доставит Ozon, продавец Мир Строительных Материалов",https://www.ozon.ru/product/dekorativnoe-pokrytie-vgt-bestsvetnyy-matovoe-pokrytie-prozrachnyy-441246116/?asb=2JVX2g9hTJ43aTYYwYs4FnNkAA4Q%252FFq%252BEjAVny98mb8%253D&asb2=g9chFgAe5kZejQ0j8dYvDYBGNd-QXQu9OXZEIyS5zOEe8dkALzXGKBxsF5rKQjGN
"Краска, Декоративное покрытие VGT (эмаль) акриловая ВД-АК-1180 фасадная для наружных и внутренних работ, для фасада 3 кг Гладкая, Матовое покрытие, 1.5 кг, белый",379 ₽,23 отзыва,"Завтра доставит Ozon, продавец СтройKING",https://www.ozon.ru/product/kraska-dekorativnoe-pokrytie-vgt-emal-akrilovaya-vd-ak-1180-fasadnaya-dlya-naruzhnyh-i-vnutrennih-297452212/?asb=yrEW5%252Bar%252BdYrAB6UvdMlRmEdFQQUoB6bKCX3D4SW%252BK0UjKOcQG2fFBbHoj8Ixsl0&asb2=zlpMKC7XwFpa9zU-4gFoQXqf1Rmv5EhvTVRstlspdHpyB3T7SLgYxebfb-ssRTlCZZmRfYAf1CnJpSmISs0PKPzeuaQ1kxinvkjFTqOwgPaDcwDRk40u5yVJB56bUdhOYeSEkSOkNQHJpwMfmgtTQw
"Декоративное покрытие Лоскутный Воск Венецианский, Глянцевое покрытие, Полуглянцевое покрытие",912 ₽,9 отзывов,"Завтра доставит Ozon, продавец Лоскутный Воск",https://www.ozon.ru/product/dekorativnoe-pokrytie-loskutnyy-vosk-venetsianskiy-glyantsevoe-pokrytie-poluglyantsevoe-pokrytie-366774572/?advert=iqCJ4iXQmhnWqfkd_n6uiKxvc56rA0tEt6J7GAgBOcE1s2HHFS80YK6Ar0rCsVSwWJ_oCZBd2pNdDQt-tqRG_d63D5nPNzjshKd-BTrhOn2eA594CLhKNRLHh5pOAjcfXDV6oVGmXvY453MVqK__f_v1NGgJwBfQjx1BBCy_Ub7ZqGVf3xxFJ0CMX9tGmW3aM5Z-d7BwupO921x3bQ_ir_XfwOgUqugOEtIodRVCFplKYy96cTea710EQUUlXjxJPKfO9p356su6wyFFjrVs38gq0kSD0OJCT3WpnMlCl5FpaeE0quzdKCqjlhdapp6c1DkfynE-uvmn4OHzrImw8Bx7qZ_kgXoqboCW7QqmPJnecoWqZeP9SbrWFrDt7_yym3tgpeTH3oerGpzE62fNJFItEZruP9wOnuHuaKBFAJplSxynsRXgrQ1vtzD8DdRSKDKkCqNYTVxZPKqn-WNFC2WDL1QbrRG3bglYqdsbNUjSR5nx0s_bld43qIOlxYjdtHe0qd1fyNrICra2IwnttwcI3uqzK8SYEYjFaUp_XWURbek6A3XSty3zpteT_Rsn
"Краска, Эмаль VGT (эмаль) акриловая интерьерная, для стен и потолков, белоснежная влагостойкая Структурная, Гладкая, Акриловая дисперсия, Матовое покрытие, 1,5 кг, белый",360 ₽,59 отзывов,"Завтра доставит Ozon, продавец СтройKING",https://www.ozon.ru/product/kraska-emal-vgt-emal-akrilovaya-interernaya-dlya-sten-i-potolkov-belosnezhnaya-vlagostoykaya-247466359/?asb=tMWkXj64A1r9CNGem632hiRh%252Fmn79s9VBVIdu0%252FWdv6M5AQyO3O6BkYRschUs%252F%252F6&asb2=ht2xWfwu6RcCRZGyF8PNrukP4q6BdCWynooaT3IM3DCeGwYeTC0oNhpv8PnneyK-VhWQ8XOn3c29bae5FV1TfN97_hKkpDl4o53fB2CbTbE8mTn88V2Y8cu-sehJCUcFz-XGOXhBlrECPclQa6jG6g
"Декоративное покрытие KUDO матовый прозрачный Быстросохнущая, Гладкая, до 80°, Акриловая, Матовое покрытие, прозрачный",341 ₽,74 отзыва,"Завтра доставит Ozon, продавец ООО ""Партнер""",https://www.ozon.ru/product/pokrytie-dlya-stekla-kudo-effekt-ineya-matovyy-prozrachnyy-aerozol-520-ml-151802720/?asb=iEHED%252F7y3pghmhzSdSmSK93DEaSJsmd0tqpW%252B4fZDJ8%253D&asb2=zufTx9yvdp27qGc1HvsiJHgfQWzbnbNt0LnaLjpizeR0JmwUBnmuSrTO4fvqbv5b
"Декоративное покрытие, Эмаль ПРЕСТИЖ Молотковая краска Молотковая, Алкидная, черный",630 ₽,19 отзывов,"Завтра доставит Ozon, продавец ЛК & Ваш Бригадир",https://www.ozon.ru/product/dekorativnoe-pokrytie-emal-prestizh-molotkovaya-kraska-molotkovaya-alkidnaya-chernyy-267021681/?asb=wBt7QwViLu28qfYIcB%252F39VKhRVzm%252Bk1JsiXXZR4rQLQ%253D&asb2=D_BKKpXUwBTvBdSxAhmvQi22V3XEJhSlF1CiKcU3xm8W0CkkDamtyzxlp8jFv6TB
"Краска, Эмаль VGT Акриловая ВД-АК-1179 радиаторная термостойкая для радиаторов, батарей и труб, глянцевая, супербелая 1 кг Термостойкая, до 160°, Акриловая дисперсия, Глянцевое покрытие, 0,5 кг, белый",474 ₽,40 отзывов,"Завтра доставит Ozon, продавец СтройKING",https://www.ozon.ru/product/kraska-emal-vgt-akrilovaya-vd-ak-1179-radiatornaya-termostoykaya-dlya-radiatorov-batarey-i-328628661/?asb=NYAb8nLELw%252BKcjFZLIsjWwlm94pxj4DhSX2CYHb1xRR9KeoTk4C2NTDUOxlu24D5&asb2=B7rPN3QYo-icljKbFLOgsK1B3OkUie4Hf6RxgY-T8vz-4zUQ4vk6vlMmbY4bgSR74gu1aYM5muYRGC_qsCijDYF3qdwyYsSdw7Lxsaae5k-tNurWy_6vezRMB0FH2lCNgkG1CtTbClC1DeE1pzHrxw
"Декоративное покрытие DALI DECOR Magic, Акриловая, серебристый, перламутровый",357 ₽,1 отзыв,"8 мая доставит Ozon, продавец Стройбаза ""SD MARKET""",https://www.ozon.ru/product/dekorativnoe-pokrytie-dali-decor-magic-akrilovaya-serebristyy-perlamutrovyy-450467557/?asb=8ZyrJ2GBIqg8CCMAF6EkIfmPFmtKWbxrL52F1PCrXPU%253D&asb2=G-ZAqiR5pQcKRUJiEiiquJfjN6wEIE1sO5kY6gQGm-fE6XdderN5O7U4K-Ozr3EM
"Краска, Декоративное покрытие Neomid BIO COLOR AQUA, Полуматовое покрытие, светло-коричневый",691 ₽,33 отзыва,"Завтра доставит Ozon, продавец ООО «ГудМастер»",https://www.ozon.ru/product/zashchitnaya-lazur-neomid-bio-color-aqua-svetlyy-dub-0-9l-149275929/?asb=Z69KJHpiWa94QbudWorxyuUvlKMQBUhMtSgcPUIY2BA%253D&asb2=3S84vAkLp85sZts1zmRiz-9-hKCDwwRtuNTaWUcbM_TI9cZ56uncnHTPwujF6hUF
"Декоративное покрытие, Краска ASTELIA COSMETICS Краска для стен 1 Быстросохнущая, до 5°, Акриловая, Водно-дисперсионная, Матовое покрытие, 0.5 кг, бежевый",648 ₽,5 отзывов,"Завтра доставит Ozon, продавец Мой маркет",https://www.ozon.ru/product/dekorativnoe-pokrytie-kraska-astelia-cosmetics-kraska-dlya-sten-1-bystrosohnushchaya-do-5-akrilovaya-550721101/?asb=5MXaWO7xBl3AXdj7OzANU94BhkhPE07dunnlObzDxSHIhKQ5xoP1ImgPwH65UcjC&asb2=XpmhdGtR5NGE62FaDBCI9mJ3KHNR2nZKtT3POTNupEv4-OJOR3isrMo-WM28vtbf8P_QhFD7poioXBGZdRAPrHKICNzjwHeArlUG5Xp6-2WLpuIjhxU_cgiRUPxN2Rxv4WGxfmvzAxbY6fya4gBZHA
"Декоративное покрытие ПРЕСТИЖ Лак БЫСТРОСОХНУЩИЙ Акрилатекс Быстросохнущая, до 35°, Акриловая, Полуглянцевое покрытие, 0.9 кг",484 ₽,2 отзыва,"8 мая доставит Ozon, продавец ПРЕСТИЖ ХОЛДИНГ",https://www.ozon.ru/product/dekorativnoe-pokrytie-prestizh-lak-bystrosohnushchiy-akrilateks-bystrosohnushchaya-do-35-518970117/?asb=oDlZ9pRgFAnAr0jonhGqo00%252B8UvmKF6M6RpWO%252FkJnnU%253D&asb2=rIuJD-y0ZFxlwaaIw4uPFgHbOq4R9rRm5dQAlS5bNsipwEFCOiab2uOK9dvo65qp
"Лак по камню Elcon Weston 0,9л",777 ₽,2 отзыва,"8 мая доставит Ozon, продавец 000 МастерСтрой СПБ",https://www.ozon.ru/product/lak-po-kamnyu-elcon-weston-0-9l-344934735/?asb=akMAMkXC1DLg%252BdnFddbIpC6tjYCvh9KAbn6aE2mT%252Fk0%253D&asb2=3XfgEcCc6NrWz7BTh8LhVBa8cV_gB-FBOYc6ZJzvFI2rrFybMgJ7meGJLhsWeZu2
"Аэрозольная краска, Краска Vivido белая, баллон 520 мл, 270 г Быстросохнущая, Термостойкая, Полуглянцевое покрытие, белый",499 ₽,11 отзывов,"Завтра доставит Ozon, продавец СтройKING",https://www.ozon.ru/product/aerozolnaya-kraska-kraska-vivido-belaya-ballon-520-ml-270-g-bystrosohnushchaya-271917803/?asb=Nsh51xIpTqBR0fCQ4zf2qOYNEC7grj7O%252B339XKI%252F8IEllK1XH%252BBMeO8XVOHmEEgK&asb2=xJ21zs9MZCtCF_VGa-OUhqkHopyohIc4e_Arf1LuTcAdx61jnPN4OLMEAinUd_YAj2rtPts7xlfyR34CsHnzbHDbvuCsqtR13u7JpO38GUJKJRyh6JiJxS7GGFxy2xHKVo1PmH0JXQ8_YeplTpORrA
"Краска, Декоративное покрытие Серебрянка, до 450°, Матовое покрытие, 0,05 кг, серебристый",236 ₽,30 отзывов,"Завтра доставит Ozon, продавец ГИВколорит",https://www.ozon.ru/product/kraska-dekorativnoe-pokrytie-serebryanka-do-450-matovoe-pokrytie-0-05-kg-serebristyy-482794309/?asb=9ULYwmVoaJrhDs9mU47ASrHbU8c0lsz%252FzmvC5FCl9EE%253D&asb2=TlxE2_cDPfNEmN3RMKD1eiHHtrG2jFSY5sttBOahLZvXxJfDSHz4Z7mL3-gNxixz
"Декоративное покрытие, Эмаль ВД-АК-1179 Быстросохнущая, Гладкая, до 40°, 0.23 кг",467 ₽,3 отзыва,"Завтра доставит Ozon, продавец Pro100 Design",https://www.ozon.ru/product/dekorativnoe-pokrytie-emal-vd-ak-1179-bystrosohnushchaya-gladkaya-do-40-0-23-kg-482009151/?asb=kFfNZFcNQqxjkZBoFCkcndLpLvw6n48IhPijlgbG3iM%253D&asb2=H2BydjEtPew2gP9WHdqMiSq2yrlUEX2m9WWrnKH99JyVgQ8bhBOHkwTdXIZBFwPk
"Декоративное покрытие KUDO Лак яхтный универсальный шелковисто-матовый, Акрил-уретановая",278 ₽,3 отзыва,"8 мая доставит Ozon, продавец РТК",https://www.ozon.ru/product/dekorativnoe-pokrytie-kudo-lak-yahtnyy-universalnyy-shelkovisto-matovyy-akril-uretanovaya-438019884/?asb=dkioWNOv%252FHiDbABi4rPw0mVq91FSkO46MAf6EfN8uK%252BBym19eV8BCo1TzW9dbzv1&asb2=QhvgrQH9y1m8vBY2hJEwyyma0JDrXhZnS2SSL58fPyviQ2u4t0t0sL0azn9hQPGHYn4k3G_DKBFWG_HmGEb8hkbkJ68f1TgWPPd5Qz45CEKj1I6lf8XDXmutg5pq9OQ3
"№114, Краска Декоратор Palizh акрил.(0.32 кг), ЯРКО-БИРЮЗ.",265 ₽,7 отзывов,"Завтра доставит Ozon, продавец ООО Новый дом",https://www.ozon.ru/product/114-kraska-dekorator-palizh-akril-0-32-kg-yarko-biryuz-294911401/?asb=8kZsIpxoXtYyl0OkgxhOGfn7xXiVXXZV0muI41YcOCA%253D&asb2=iMmcu9T1iM2bm7QynKazE0Vm2Ef9H1c6K0dqz-XSqumZTnVHTzQyxhpGva_vQgS6
"Краска, Декоративное покрытие Серебрянка, до 450°, Матовое покрытие, 0.75 кг, серебристый",730 ₽,30 отзывов,"Завтра доставит Ozon, продавец ГИВколорит",https://www.ozon.ru/product/kraska-dekorativnoe-pokrytie-serebryanka-do-450-matovoe-pokrytie-0-75-kg-serebristyy-482831709/?asb=h3mfNyIPyvuhpF2aqfSAmD9uV1Fnl1LsYjkK2%252BXQG%252Bc%253D&asb2=4YEVPzgNECRZut8GVruX-KI-wUxfe86Q7_eC-8iFp2-FDtkXx6YPqKOsWjxSJV_R
"Декоративное покрытие, Краска ASTELIA COSMETICS Краска для стен 1 Быстросохнущая, до 5°, Акриловая, Водно-дисперсионная, Матовое покрытие, 0,5 кг, белый",648 ₽,13 отзывов,"8 мая доставит Ozon, продавец Мой маркет",https://www.ozon.ru/product/dekorativnoe-pokrytie-kraska-astelia-cosmetics-kraska-dlya-sten-1-bystrosohnushchaya-do-5-akrilovaya-503976609/?asb=g2b49Bu7oASO89pac5QLpAuBRRT1K0ZHn3yWgxILlm6TskVXkAA6mPggEoiNx%252B7F&asb2=-I_QzGeeMs6ufvPrFlGKb7IyX6GFyWKWJZJ09eejUQdaVp71KPXLz9iTMM-lB2JrZ7HYYLPn4iOlwJuuI8HjQgUUOu--EJhkWfEQVXkP4B5QIQCCaJN9SK9SxrGdYxNxE6fLcZ9tlZkY9ncd5cW7-g
"Аэрозольная краска, Декоративное покрытие Bosny 18KT (эмаль, спрей, аэрозоль) акриловая универсальная, Металлик Золото, золотая, баллон, 520 мл, 227 г Быстросохнущая, Гладкая, Акриловая, *Декоративная, Матовое покрытие, Глубокоматовое покрытие, бронза",579 ₽,3 отзыва,"Завтра доставит Ozon, продавец СтройKING",https://www.ozon.ru/product/aerozolnaya-kraska-dekorativnoe-pokrytie-bosny-18kt-emal-sprey-aerozol-akrilovaya-297578781/?asb=D5bC%252B79rlc9R29kkY92QyoFZLjT8FnzNi7hykf8Od3%252BPzemfzwmma%252Bgf7cIuS586&asb2=61T33hklOc3QrXLM2ujyy67snPqz9zfHaCzHTkdePB_KaiN-tyiY28-dQOX4iSmUkAzleKff5gmuaPawMBIm1ndKNTcVBsVVGvHhJ-Su-GK5iPp0wHemB8aYgHNRIZ2xted0tjKXPaH9JWPzDaJ36w
"Краска, Декоративное покрытие Серебрянка, до 450°, Матовое покрытие, 0.5 кг, серебристый",669 ₽,30 отзывов,"Завтра доставит Ozon, продавец ГИВколорит",https://www.ozon.ru/product/kraska-dekorativnoe-pokrytie-serebryanka-do-450-matovoe-pokrytie-0-5-kg-serebristyy-482831819/?asb=mVxCkRduDzSv8vSONSPK7HNdeGwUAfItIU8%252Bkqu%252FOK0%253D&asb2=vSRGVgF9d_ZejLAKO0U4U1aTDT5jw2DQdUw3vSCRrdh7A7TOkOo8djv5NlrL7vyK
Декоративное покрытие Лоскутный Воск Набор пробников Венецианский Воск,449 ₽,4 отзыва,"10 мая доставит Ozon, продавец Лоскутный Воск",https://www.ozon.ru/product/dekorativnoe-pokrytie-loskutnyy-vosk-nabor-probnikov-venetsianskiy-vosk-387386777/?asb=upjs4G3BlzbZb%252BbiXCBHnnnL6jjdfaNto74osN%252FdujU%253D&asb2=DKPS6aUlQvum4dMb4pwLzG0tl1J8ebwR5BjPAhNYF_gXZB5ZzfnA0Ye8Ud_FfcWQ
Аэрозольная краска BOSNY Красная в баллончике / Балончик с краской BOSNY Красная,439 ₽,41 отзыв,"8 мая доставит Ozon, продавец Bro_shop",https://www.ozon.ru/product/aerozolnaya-kraska-bosny-krasnaya-v-ballonchike-balonchik-s-kraskoy-bosny-krasnaya-488376407/?asb=UuqD6d1%252FzI65zqrwuAm6gzO3%252FiIYjFANeZJw2NWyR8zeFQUTS74uh668HCMDnvbh&asb2=KZG9Rz_bg_JE5X5dyqg-GJFGnR2TUzChE25Jo8B0tcsvpEw1vnyYZV5CC3BMEcxm5eBwhLCackTEdjDc8GXZlS0FNjNIgo4jVHv1UL75b8tzGvh97j9MzHnsJce-Vq9y
"Паста пигментная Полимер U ""Palizh"" (50 мл), черная суперконцентрированная",215 ₽,1 отзыв,"Завтра доставит Ozon, продавец ООО Новый дом",https://www.ozon.ru/product/pasta-pigmentnaya-polimer-u-palizh-50-ml-chernaya-superkontsentrirovannaya-173913691/?asb=VIGo0P2SG8gMgy%252Ff%252FA%252BusYOXJlKm0HdNNkK4L3yrq84%253D&asb2=ZoNgwD0UoaFb36FdyaOhPdta2aIzRYVshLxmIXWYVhWlYScoNtTLKI1B6nner2cX
"Декоративное покрытие WizzArt 2528400, Водная, белый",213 ₽,2 отзыва,"Завтра доставит Ozon, продавец Фабрика счастья",https://www.ozon.ru/product/dekorativnoe-pokrytie-wizzart-2528400-vodnaya-belyy-218800890/?asb=Kbq%252F3mSBoPeyXNaDHu66DhFbBuoqTaVWxDpdRbadid8%253D&asb2=AUgNjQcmwVb2yNId_ehm-Vr3BaPGfrhPQ6vlI1eHMDaCxvCIOZx0fhXNPLLMiZfX
"Аэрозольная краска, Декоративное покрытие Bosny 18KT (эмаль, спрей, аэрозоль) акриловая универсальная, Металлик Медь, медная, баллон, 520 мл, 227 г, Акриловая, Глянцевое покрытие, 0.227 кг, медь",599 ₽,7 отзывов,"Завтра доставит Ozon, продавец СтройKING",https://www.ozon.ru/product/aerozolnaya-kraska-dekorativnoe-pokrytie-bosny-18kt-emal-sprey-aerozol-akrilovaya-485382870/?asb=zLh9TL6lAxmH8Yod4jJO7QFINsmx5RTCKAF3UE%252BpEw0n812yGNUU8DJbjODwm%252Bky&asb2=FGqtZM_dBn1_cDG10SrQByJimBhUUSwqxarB0675SoPT4O8GWIi248WaB5O26zl-g3npvFNSynG0jb3Biqz2W0zp9-ZTaxf7tuiU2Z3yyor1Yxm9cEUrhh3Ydt7oX4lYjU36C5ngtZpkKDRQH3UXzg
Аэрозольная краска BOSNY Розовая в баллончике / Балончик с краской BOSNY Розовая,429 ₽,41 отзыв,"8 мая доставит Ozon, продавец Bro_shop",https://www.ozon.ru/product/aerozolnaya-kraska-bosny-rozovaya-v-ballonchike-balonchik-s-kraskoy-bosny-rozovaya-488375675/?asb=mpo%252FOr2g%252FvrwFbARaqZRuA1J4zZYK2y%252FMOBPzSw9tRvW73PQdFYvnKKS3dbB4%252F9g&asb2=zh54RfFeQV8RV3dQImtK85NivITpfHhAE7WNwPSellTVBbIriCBlkdDsbp48uv21qagLfuqSslglnyFb53BmyXlg1a5bqV01VRm_h1j8UU2f-BzoUgUAC-Ooajn7F2SBpIOkEJr3PYUYWJSUCWo9Fw
"Аэрозольная краска, Декоративное покрытие Veslee Эмаль для металлочерепицы ШОКОЛАДНО-КОРИЧНЕВЫЙ RAL (РАЛ) 8017 Гладкая, Быстросохнущая, Акриловая, Глянцевое покрытие, синий",399 ₽,13 отзывов,"Завтра доставит Ozon, продавец СтройKING",https://www.ozon.ru/product/aerozolnaya-kraska-dekorativnoe-pokrytie-veslee-emal-dlya-metallocherepitsy-shokoladno-328649129/?asb=Eav9UwT0Mol2vO4nx4G1bpJsG8FirvyGUxXmAOIIlFv1cYTqOLIrOlO0lS23MXqf&asb2=xFwWkxY4OoMbmxgkHmieKB1Dxd1JA2wdrzL-a1q8FGGSbZAHcuHX8lGJBPyM11XvRfHbzHoppnhvi9aRMDcW7pzy3z5zil1JTAU8mao7vJb9h0BO5ut4naprVwS5s78nymLfhP4pqb1_0YnLaETpEw
"Декоративная краска DESSA DECOR Антика 1 кг, декоративная штукатурка с эффектом замши, ткани",649 ₽,8 отзывов,"10 мая доставит Ozon, продавец DESSA DECOR",https://www.ozon.ru/product/dekorativnaya-kraska-dessa-decor-antika-1-kg-dekorativnaya-shtukaturka-s-effektom-zamshi-tkani-551798248/?asb=dHX4TxqhJJem7ggmH13yCm%252FDnHDW%252BGx7%252FWQqAMP6ZQI%253D&asb2=ZLrJ2bN6t2NRwL6MCyuRDc7LLnb5j9YpGxErmQ-j1EDPDsmLWjqCy8cm1cw1ln7u
"Декоративное покрытие Palizh краска-колер Быстросохнущая, до 30°, Акриловая, Матовое покрытие, синий, темно-синий",464 ₽,86 отзывов,"8 мая доставит Ozon, продавец ООО Новый дом",https://www.ozon.ru/product/518-kolerovochnaya-kraska-vodno-dispersionnaya-palizh-0-75l-siniy-169382570/?asb=vSqnd5%252B21asvA1Atgk71SXq7V%252FjvhYyLCLiDFM0EMbg%253D&asb2=2YTq6WogeZnJIS6rZLoSMH1l5pMMnisWTPMT7EYKmn9bJtTbz0HSqMEkE6w_veuy
"Краска-колер Декоратор ""Palizh""акриловая (0.32 кг), ПИЖМА",265 ₽,6 отзывов,"Завтра доставит Ozon, продавец ООО Новый дом",https://www.ozon.ru/product/kraska-koler-dekorator-palizh-akrilovaya-0-32-kg-pizhma-294797999/?asb=TuctzmmQ2s0oi2iikfcPtJSlqp7yRRzyoUTXIK5WmaE%253D&asb2=Z-OvqNpu9cinjwquGqqBRlLRIZh83znmAy9vWS6jdk6XB7qVkU8Ez6aZ_sMtnXaP
"№120, Краска Декоратор Palizh акрил.(0.32 кг), КИРПИЧ.",265 ₽,21 отзыв,"Завтра доставит Ozon, продавец ООО Новый дом",https://www.ozon.ru/product/120-kraska-dekorator-palizh-akril-0-32-kg-kirpich-294908791/?asb=JMsydQqLh07eJ2ANHP0U5o8GCijfGbq%252BC1FOfB8x94g%253D&asb2=6GL47_36OnZ-HWCYVTstXclYIdROofIqZ2iUGIcTkYVD6VNFw6rkDaBYzEohJ4hq
"Декоративное покрытие ПРЕСТИЖ Лак БЫСТРОСОХНУЩИЙ Акрилатекс Быстросохнущая, до 35°, Акриловая, Полуглянцевое покрытие, 0.9 кг",496 ₽,2 отзыва,"8 мая доставит Ozon, продавец ПРЕСТИЖ ХОЛДИНГ",https://www.ozon.ru/product/dekorativnoe-pokrytie-prestizh-lak-bystrosohnushchiy-akrilateks-bystrosohnushchaya-do-35-518969151/?asb=raVCOhAoaSGiVH9i1fwLXM5gIMY7NrhX3ngtsJuXs3c%253D&asb2=fB8awE_bK1BjjgA9yf-nAqmK3539BGkNu2mJSP6WcJIVoOE-Uwnl4I0P5hj_BNZz
"Декоративное покрытие изумруд, Акриловая, 0.25 кг",392 ₽,1 отзыв,"12 мая доставит Ozon, продавец Мегаполис",https://www.ozon.ru/product/dekorativnoe-pokrytie-izumrud-akrilovaya-0-25-kg-362752885/?asb=G%252FTm7Dsqg774S1Dz3eI41je0qAgwjSzHCjpmKfCbKBNDUXPGia7RngIy%252BE4FhIvY&asb2=jXH-yO5PvWXRq4-vpPk5IbiEeKtdQ1Fp0UCBe1VKhTz6iBIGNUOeyTwSuGkImXNIM20NaAvmlhqW5DZeX70BR5MCRxs0XIbTd6uSeGKfelFQYHqpPL-Dp1ENc0EIUL8SkFb9DhvDsi0nTEd26ay7Cw
"Декоративное покрытие VGT акриловый Быстросохнущая, Акриловая, Водно-дисперсионная, Полуглянцевое покрытие, 2.2 кг, белый",1 046 ₽,0,"8 мая доставит Ozon, продавец Мир Строительных Материалов",https://www.ozon.ru/product/dekorativnoe-pokrytie-vgt-akrilovyy-bystrosohnushchaya-akrilovaya-vodno-dispersionnaya-441951689/?asb=NHaP85pL%252Fj2SJYjA3a%252FGLEFCwdmJQ9JiQSAJ7g%252FvcA0%253D&asb2=Nuy3Xoa8DZGRGnhu5m1_Z-2jzgvXlUtTkxAAzmrD3Ws8X1N1H8Bm6iXQ9cooULj-
"Декоративное покрытие VGT акриловая Быстросохнущая, Акриловая, Матовое покрытие, 0,9 кг",626 ₽,4 отзыва,"8 мая доставит Ozon, продавец Мир Строительных Материалов",https://www.ozon.ru/product/dekorativnoe-pokrytie-vgt-akrilovaya-bystrosohnushchaya-akrilovaya-matovoe-pokrytie-0-9-kg-441965401/?asb=KZ8aHH%252B%252FeoWOya3dHQa2GCk3mEfVWD0DOLW5QiAQjkw%253D&asb2=5fwqIhSHRCpMpae4BZAHeUIluKvymaS8zo1sSXORbePPo7KeVUAn2YGMOkjG4X8j
"Краска-колер Декоратор ""Palizh"" акриловая (0.32 кг), МОРЕ",256 ₽,21 отзыв,"Завтра доставит Ozon, продавец ООО Новый дом",https://www.ozon.ru/product/kraska-koler-dekorator-palizh-akrilovaya-0-32-kg-more-294798022/?asb=GpJzeu7pAowUFpbMeyeztWSSiZ%252Fyk5YGQ%252BWkKnd%252FobA%253D&asb2=lv20GKOyfv5AyPuGDcxGm0hR1PsM1iPw-Y_bmTln74OokVXPv0qSiCmOM-tiCb1g
Краска для мебели декора и творчества без запаха 250 грамм акриловая матовая быстросохнущая художественная для дерева бетона кирпича и других поверхностей Paint of Decor цвет Белый 0.25 кг,454 ₽,14 отзывов,"8 мая доставит Ozon, продавец ThermoColor",https://www.ozon.ru/product/kraska-dlya-mebeli-dekora-i-tvorchestva-bez-zapaha-250-gramm-akrilovaya-matovaya-bystrosohnushchaya-517035360/?asb=%252B1YyKpmEkdJ9yDtW7nKVsYWmmEIqrw30fNJXyRqz9Jv53fGbdowGiu6ZgJKPbdWm&asb2=XBMgahfU1w-Yz5ybfBsjFBcRSOQKVY66f1lNe-8dDiE34FRL-rpD49rkxB4j0mLijhj7sWQbXmh-ibKXBKNXGcmZtIfL__WJowMtZJA-Bz1J-gN_HeITHKrwGk1KXptveN8tNJ5hVuS4R4LUUisZjw
"Декоративное покрытие VGT Лак акриловый ""ПАЛИСАНДР"" ВГТ 2,2кг, Акриловая, Матовое покрытие, 2 кг",932 ₽,0,"8 мая доставит Ozon, продавец Мир Строительных Материалов",https://www.ozon.ru/product/dekorativnoe-pokrytie-vgt-lak-akrilovyy-palisandr-vgt-2-2kg-akrilovaya-matovoe-pokrytie-2-kg-445446514/?asb=makLEIkShh3IR8tp8J2A%252Fo4Txp5FMXObmOCptwdsefg%253D&asb2=e1u3m-_fU4z9xRpFLV-qkBj0rZjpbIxQCTZvFBMk5DlylbAgPwGg6wu4FGaIUlmB
"Краска-колер Декоратор ""Palizh"" акриловая (0.32 кг), ПИХТА",256 ₽,1 отзыв,"Завтра доставит Ozon, продавец ООО Новый дом",https://www.ozon.ru/product/kraska-koler-dekorator-palizh-akrilovaya-0-32-kg-pihta-294798167/?asb=bJkW0lrYOdQrXSbCVkfLLTLdrE4lXEHXLJNDCa%252F4qdc%253D&asb2=wToTdfZ2FMppu-RjXkrm6NgftKfmPmXPfr_ozdx8ECJ6JU51SLPKWUPvu7F3MOqD
