"Краска-колер Декоратор ""Palizh"" акриловая (0.32 кг), ЛЕН",279 ₽,7 отзывов,"8 мая доставит Ozon, продавец ООО Новый дом",https://www.ozon.ru/product/kraska-koler-dekorator-palizh-akrilovaya-0-32-kg-len-294798572/?asb=JTZtmXcC8Qd693nR5ZVPvD7z62enKMCrlXUuyDEVUTI%253D&asb2=6BCefszFlIEYY7roRYqZAGXxTFJlRBM-XNd5Kh6d73VbtA-yxw1LW3XaKsCsIQPy
"Декоративное покрытие D702, Акриловая, Полуглянцевое покрытие, 1 кг, прозрачный",735 ₽,2 отзыва,"12 мая доставит Ozon, продавец Мегаполис",https://www.ozon.ru/product/dekorativnoe-pokrytie-d702-akrilovaya-poluglyantsevoe-pokrytie-1-kg-prozrachnyy-367699321/?asb=MKtu1NmxAvugEbI3U7yRrlYZsSViC%252Fq38vePXuL05amaRmViIocIk6F0vximGlxX&asb2=GVE2gqobBkLwCNQpEdWUs6eGXfWlEWJgon2wu4IHPxXIw-6-j19dAdXcPskRPrlTLWtZParmPxYeU4TEhjn8GAIWMzssmA2JctZKaz8fP56IkKCJPwgBjy8VI71mzjCp8xOh7cJw9rZT0bp1mIPOAw
"№126, Краска Декоратор ""Palizh"" акрил.(0.32 кг), ПЕРСИК",256 ₽,2 отзыва,"Завтра доставит Ozon, продавец ООО Новый дом",https://www.ozon.ru/product/126-kraska-dekorator-palizh-akril-0-32-kg-persik-294909074/?asb=T58oF5FhQnq1LvH%252BY2YXtNO41G8rLUKjeuqxFUyo2po%253D&asb2=htN9DncaTiQHWyfpNjCX-ZJ1E0dUWNG7-9Sj3ZdMLtlHwuQLFwTuY9ZHmTTLy65U
Аэрозольная краска BOSNY Зеленая в баллончике / Балончик с краской BOSNY Зеленая,439 ₽,41 отзыв,"8 мая доставит Ozon, продавец Bro_shop",https://www.ozon.ru/product/aerozolnaya-kraska-bosny-zelenaya-v-ballonchike-balonchik-s-kraskoy-bosny-zelenaya-488384138/?asb=rb9eZhLgrTsJrceN9PfkaxPBilOOKz2JRHB6bkxr3%252BgggRARz81KhBIX37QcQEcc&asb2=aR_xOelJcnPz8Z03Cq9tHOvQ8D1Kj4OAFe9qucg4T2VBA5GHFKiu3SFdLxFDr9NkA3hwgyzcMjnv4RZyXvHheS1MIrZtOJcbmfgw4yUh52jZhtbfp33296O5zAHE0kEU
"Краска, Декоративное покрытие Palizh краска-колер Быстросохнущая, Гладкая, до 30°, Акриловая, Водная, Матовое покрытие, 1,065 кг, коричневый",441 ₽,86 отзывов,"Завтра доставит Ozon, продавец ООО Новый дом",https://www.ozon.ru/product/kraska-dekorativnoe-pokrytie-palizh-kraska-koler-bystrosohnushchaya-gladkaya-do-30-293722600/?asb=t16jBoTifz%252Br166vpIlEXY2PKA0QvF0PBPHMXvFf0S4%253D&asb2=kQqqnu-xeQpkoN050QTS-gi8vp1Z3-rDOczfanhptXMU9Xy7-vzY3bab087uvYaU
"Декоративное покрытие VGT Лак, Акриловая, Матовое покрытие",525 ₽,0,"8 мая доставит Ozon, продавец Мир Строительных Материалов",https://www.ozon.ru/product/dekorativnoe-pokrytie-vgt-lak-akrilovaya-matovoe-pokrytie-445440645/?asb=TjXvVEcEITLbmJn82OayEqWjSPq%252BGzIUbHDEURXXguw%253D&asb2=Roepln-Q0JTqAiiiLd4PSt5iCnbjIxVq2nKOrtgE8JDbikvAUID5o7Bz327PAfMk
Декоративная краска DESSA DECOR Сахара 1 кг - декоративная штукатурка для имитации песчаной поверхности со стеклянными шариками,983 ₽,20 отзывов,"10 мая доставит Ozon, продавец DESSA DECOR",https://www.ozon.ru/product/dekorativnaya-kraska-dessa-decor-sahara-1-kg-dekorativnaya-shtukaturka-dlya-imitatsii-peschanoy-551722500/?asb=7ZqLXLTIHGwJAdHtxxPWQVO%252BvqzvQ3oFRLiH%252Bg0hVI4%253D&asb2=Ze5RTrMWglKt2lYjy4KjsdTIchLV61ThiIdDVbE1Iq348qFwWUjuUoapDgp3UN2l
Краска для мебели декора и творчества без запаха 500 грамм акриловая матовая быстросохнущая художественная для дерева бетона кирпича и других поверхностей Paint of Decor цвет Фисташковый,584 ₽,14 отзывов,"8 мая доставит Ozon, продавец ThermoColor",https://www.ozon.ru/product/kraska-dlya-mebeli-dekora-i-tvorchestva-bez-zapaha-500-gramm-akrilovaya-matovaya-470689155/?asb=N%252BMxyOhcn22HTHHdwaFEvcUMmF1TMcNd3UEVJQw5lL%252FUWZwNyloO3mWK8ow3bOVK&asb2=yQ9KW1-zEaA-rGjhGJeCmLSaNogGPKjqgLWT1XSuZfSlugt3JGcWFn8QYiNBWAve2pxrlksgZ7HZPwYfJTs_o5ufShVI7bQgjx4ni5hiYG436f5tvLWMavMXi5Rm2IKl
"Декоративное покрытие, Краска Neomid BiO COLOR AQUA, Полуматовое покрытие, светло-коричневый",691 ₽,48 отзывов,"Завтра доставит Ozon, продавец ООО «ГудМастер»",https://www.ozon.ru/product/zashchitnaya-lazur-neomid-bio-color-aqua-kedr-0-9l-149275927/?asb=F1reiWtnstsBESeHEbtbuA4i7KZk7xkQWRsSf3jipx0%253D&asb2=WjNz5Zkn-806g6ngssZmx6vHvb7o9N2NlC6T-jX3ViA1XkXVlXbqtWURJwEVsMof
Краска для мебели декора и творчества без запаха 250 грамм акриловая матовая быстросохнущая художественная для дерева бетона кирпича и других поверхностей Paint of Decor цвет Бежевый 0.25 кг,454 ₽,14 отзывов,"8 мая доставит Ozon, продавец ThermoColor",https://www.ozon.ru/product/kraska-dlya-mebeli-dekora-i-tvorchestva-bez-zapaha-250-gramm-akrilovaya-matovaya-bystrosohnushchaya-517026963/?asb=DNEVQRgcbJQHTQ4FzUu1W3OBZbb0pR%252B2WFnS%252Bl%252BnQdow4H35BuQ8odnJe3sApZAl&asb2=N0AFRbvQNEZNSk6YH36VibOKzGU24sBU7-SJnBMnbDrtzApFIl3jZ1dXxv8tsiHt6PExbh7X6iloDEYmhslxW6w7Eg7PnZkCX-_1iiCG5H5MYd00S4I2sqpj5VukJnta4WEI24Wo_qTlanvuivhSAg
"Краска, Декоративное покрытие Artline Creativity PST-00-010-S02 Гладкая, Быстросохнущая, *Декоративная, Полимерная, Глянцевое покрытие, Полуглянцевое покрытие, 0.02 кг, разноцветный",972 ₽,4 отзыва,"8 мая доставит Ozon, продавец Artline Creativity Shop",https://www.ozon.ru/product/kraska-dekorativnoe-pokrytie-artline-creativity-pst-00-010-s02-gladkaya-bystrosohnushchaya-261355019/?asb=VC8i%252B7daSg%252FPNKzM3%252FHdYcof30k4Vy6lduzQBLcxrY4%253D&asb2=2bmcKp1Pw_d68o1TGp4bNQ4dDaR-9gn0-ZAEM6YWnOFj8ofFNzB_RHTZZHTsQ5FJ
Краска для мебели декора и творчества без запаха 250 грамм акриловая матовая быстросохнущая художественная для дерева бетона кирпича и других поверхностей Paint of Decor цвет Бирюзовый 0.25 кг,454 ₽,14 отзывов,"8 мая доставит Ozon, продавец ThermoColor",https://www.ozon.ru/product/kraska-dlya-mebeli-dekora-i-tvorchestva-bez-zapaha-250-gramm-akrilovaya-matovaya-bystrosohnushchaya-517036179/?asb=nz4d%252F4DY3%252B%252FwN0Rln0HsM4MVeRrnktmCKAw6vhhV2ZI%253D&asb2=DkK2fSSR80AXL9XDw1ufYvv4UTJfJ2GBuUH0CiAPX0fc-MIlksUVXEAzN-q1UyAL
"Декоративное покрытие VGT Лессирующий Быстросохнущая, Акриловая, Полуглянцевое покрытие, 0.9 кг, светло-серый",841 ₽,1 отзыв,"8 мая доставит Ozon, продавец Мир Строительных Материалов",https://www.ozon.ru/product/dekorativnoe-pokrytie-vgt-lessiruyushchiy-bystrosohnushchaya-akrilovaya-poluglyantsevoe-pokrytie-0-429512167/?asb=ujzjaETMckNCXz1OZZ9ogTKlvYZv9utEyWXMJtD8URI%253D&asb2=g8uYY0Bh6FS7vXK3Kf0e_M8tJzSrs59ZwflL9gaXckgP7HWY8K5lWK41fs3GjuAO
"Краска-колер Декоратор ""Palizh"" акриловая (0.25 кг), РОЗОВЫЙ металлик",535 ₽,4 отзыва,"Завтра доставит Ozon, продавец ООО Новый дом",https://www.ozon.ru/product/kraska-koler-dekorator-palizh-akrilovaya-0-25-kg-rozovyy-metallik-294971760/?asb=1ZsGSIMmb4QUmFwdXXScaUl946qJXIvicElm5zsQQsg%253D&asb2=17xeVkofCOgBgwgvA2A79aV6rmtGgJ4SQ96RlwEynq7kVt8ms4_0_3J0uB8t-KWv
"Декоративное покрытие, Эмаль Neomid BIO COLOR AQUA, Полуматовое покрытие, светло-коричневый",691 ₽,33 отзыва,"Завтра доставит Ozon, продавец ООО «ГудМастер»",https://www.ozon.ru/product/zashchitnaya-lazur-neomid-bio-color-aqua-sosna-0-9l-149275930/?asb=HEgMQRkIdTcWt8QNjAqh3iyiIIykPNFBx7nsClSgfRs%253D&asb2=HVojcp_lcFxB_fS1lL1neb6pBhjynv6Vs3O-qO_UoZ_aNxsz7-YObyzF9kRhVtA-
Аэрозольная краска BOSNY Темно-серая в баллончике / Балончик с краской BOSNY Темно-серая,439 ₽,41 отзыв,"8 мая доставит Ozon, продавец Bro_shop",https://www.ozon.ru/product/aerozolnaya-kraska-bosny-temno-seraya-v-ballonchike-balonchik-s-kraskoy-bosny-temno-seraya-488374064/?asb=k3hIC17NuYUfaGsEgCqoPBtuM8mWrBm01cKZ5ebbMf1mOwBesM0XwD1tDlECugIe&asb2=Lw8FiOGi2LHepcJXIn23O1bzWgkeu0Sf5Z7KwxyHeMvACGL8VUHEUrMUe6Rqd70ASrmRQff5XYBSHkbssZjhAtBL5ROZu54Q1-qX0o6iu1CEgfOnEeS6CJ5cVPxt-0hb
"Декоративное покрытие хамелеон, Акриловая, 0.23 кг",392 ₽,4 отзыва,"12 мая доставит Ozon, продавец Мегаполис",https://www.ozon.ru/product/dekorativnoe-pokrytie-hameleon-akrilovaya-0-23-kg-362753470/?asb=2zSBORcPX%252BLzY3RZqv%252FwZEdQ%252Fppwtak1UmG1S6V8OH8a2css%252F2ypkvl6U3SGXaub&asb2=CgAxPkqiIuUwLShm72RDVNyZKNti6O1tfELCLBPSOR6YBTyil6FNvkKPvW7jpCDZXNOP1061BVTtmQtjaCvPW8-SOwrszysvqTg_Xr_wO5cMC05ITiTyeWwX_TCEm52I-mT0RVH4H2QRk6iYMDagGg
"Краска-колер Декоратор ""Palizh"" акриловая (0.32 кг), АБРИКОС",256 ₽,1 отзыв,"Завтра доставит Ozon, продавец ООО Новый дом",https://www.ozon.ru/product/kraska-koler-dekorator-palizh-akrilovaya-0-32-kg-abrikos-292539018/?asb=LpZjIUMIYaBJUGjdRHQ3GAzS2BL%252F7wFZY92zlowX5kE%253D&asb2=3wlgXMPpA_KwebbkS-IwG806lT6w3zK74vHflO2XAZG_WAlP_seF-0NbKLVWHFLh
"Краска-колер Декоратор ""Palizh"" акриловая (0.32 кг), КЛЕВЕР",256 ₽,4 отзыва,"Завтра доставит Ozon, продавец ООО Новый дом",https://www.ozon.ru/product/kraska-koler-dekorator-palizh-akrilovaya-0-32-kg-klever-294798262/?asb=6SPucA8Vln%252BAzCQ3%252BjOpYY0bxsochn%252F7o4EentB%252BsgA%253D&asb2=SsG5cB5XBF7pgWoRuz3cYAgB7M3LVFpmCj0SKg-V19ZzRAJsnZbdhA5VatMahBCr
"№127, Краска-колер Декоратор Palizh акрил.(0.32 кг), ФИАЛКА",279 ₽,1 отзыв,"8 мая доставит Ozon, продавец ООО Новый дом",https://www.ozon.ru/product/127-kraska-koler-dekorator-palizh-akril-0-32-kg-fialka-294906790/?asb=F0h%252B0BJ4N6PXUM1PYNVqlXItboj9qmgKv3k3qidNBhY%253D&asb2=W3zoZH3cgDnux0n7jACG22hEFsHGwLWdhQMHaFAqhsGuQ7JhRfDVag4OiPXRGxOz
"Декоративное покрытие VGT Лак ""ВИШНЯ"" 0,9кг Быстросохнущая, Акриловая, Матовое покрытие, 0.9 кг, бордовый",518 ₽,0,"8 мая доставит Ozon, продавец Мир Строительных Материалов",https://www.ozon.ru/product/dekorativnoe-pokrytie-vgt-lak-vishnya-0-9kg-bystrosohnushchaya-akrilovaya-matovoe-pokrytie-0-9-456651142/?asb=0qhi1KbPxVoxITCYC7LWxXCh503fhA550ki6yYsG1Q0%253D&asb2=7OID1taicnvFukzOnsBpYJrNIUG5NPpMlgeUdX_gkCCgv-a5lNOoRI_zxPz7IrR-
Аэрозольный лак глянцевый Bosny / Акриловый лак Bosny глянцевый,439 ₽,41 отзыв,"8 мая доставит Ozon, продавец Bro_shop",https://www.ozon.ru/product/aerozolnyy-lak-glyantsevyy-bosny-akrilovyy-lak-bosny-glyantsevyy-488376118/?asb=RSiUTSUsJlE1piKxcKTtFqYY98Q6cYimqVmCETQE1hz5oy8vb7FpPO7bp34KxZEx&asb2=aIKYL2YDP8Zizwi-KHHKsjFRTxctDvdtXk0RCFgT2X6IKr_3o9e-uPFKdxDXqR-oe2thuCYsm__1oOHwyN0qFv4ZwrPTHlF5vX4dAWVv-9aEyHlfcwqes5lRE4VD8PQ1
Краска для мебели декора и творчества без запаха 500 грамм акриловая матовая быстросохнущая художественная для дерева бетона кирпича и других поверхностей Paint of Decor цвет Оранжевый 0.5 кг,584 ₽,14 отзывов,"8 мая доставит Ozon, продавец ThermoColor",https://www.ozon.ru/product/kraska-dlya-mebeli-dekora-i-tvorchestva-bez-zapaha-500-gramm-akrilovaya-matovaya-bystrosohnushchaya-472533145/?asb=C7pJvA6mw%252FZXlOEm1OQigmobR7Zlr5GYdifZZ5FcV1e7vXewyzKW8TFVQ0ZKu761&asb2=ceZkGBWRehzM6SxQdyE1zPGyJ8XFltfzFNFFwJg62UHK4qsyh2bbWqrptHmer29nGR7-vjV2FYYn0c_1MY_nARmzQkNNrvIIF0BrnRTIRjEqAXw4QcVhexG2zE7w_xfP
Краска для мебели декора и творчества без запаха 250 грамм акриловая матовая быстросохнущая художественная для дерева бетона кирпича и других поверхностей Paint of Decor цвет Сиреневый,454 ₽,14 отзывов,"8 мая доставит Ozon, продавец ThermoColor",https://www.ozon.ru/product/kraska-dlya-mebeli-dekora-i-tvorchestva-bez-zapaha-250-gramm-akrilovaya-matovaya-517027026/?asb=DRVXThcD%252FTUyBL2YZx3U%252B2r63vVqSo1QmFhW%252F%252FilqOVlEhK1cacos53RoGeE2ofq&asb2=eZMw25-NK_OxAHNIpvHj_KQbwtNdl-krbhLwM_i-t0GFOtcaBPtgySdT9XQiKUTjJMY81Rchzel1MfdrGpV-c4jwBJmkJXCl9w3KW6Y-KoOVMw1scE3jlD2nIGQq2ZRrg7ID1lJNoLXJfkEoIdv6FQ
Аэрозольная краска BOSNY Оранжевая в баллончике / Балончик с краской BOSNY Оранжевая,439 ₽,41 отзыв,"8 мая доставит Ozon, продавец Bro_shop",https://www.ozon.ru/product/aerozolnaya-kraska-bosny-oranzhevaya-v-ballonchike-balonchik-s-kraskoy-bosny-oranzhevaya-488375115/?asb=duwDvV8afghO6I9X%252FvS2jv2%252BJieMaVPQ27cGqqzwdS58UwT7xSBOyWkEzRtJ8P5u&asb2=h1J-Z1eJy1j48HEOZfYYvVGg1-pgnR4H4RLioO0siwjs-EoWaem834YfZmFliKAVDLC-cTI_WMbEsBygVi8TyspB0s08FWZWuLDKTjznIqguz6QHdfYROnCpNxMf9UyT
"Декоративная добавка слюда TICIANA DELUXE Lucente для штукатурки, жидких обоев, лака, воска, цвет серебристый, 0,1 кг",849 ₽,7 отзывов,"9 мая доставит Ozon, продавец М-КРАСКИ",https://www.ozon.ru/product/dekorativnaya-dobavka-slyuda-ticiana-deluxe-lucente-dlya-shtukaturki-zhidkih-oboev-laka-voska-tsvet-306406559/?asb=UQkVDrPanDrIAeLvHBSYK1Lc2CAnAa0q9Hqh4oSsypCNNuYi15iCjXqp0IhKTEos&asb2=RJQguAEwvYN_p8Jmk61OkhUifMIbQL5OsrmA11-V2lJcadgFfgIFbxOzv5dOCk57yhsZOjhr4gp7FHKeXTvUWyX7xQYFT98jhVrlrnqX_zhYJFKxFfIvo-AkNNq4NmYV1rIV5OLOCjtIIGILyNOU8Q
"Декоративная добавка слюда TICIANA DELUXE Lucente для штукатурки, жидких обоев, лака, воска, цвет золото, 0,1 кг",728 ₽,7 отзывов,"9 мая доставит Ozon, продавец М-КРАСКИ",https://www.ozon.ru/product/dekorativnaya-dobavka-slyuda-ticiana-deluxe-lucente-dlya-shtukaturki-zhidkih-oboev-laka-voska-tsvet-306348888/?asb=dkvY%252B8y70d1FGUUu%252FEspqacvIjcK4v4%252B7RJS31XGV%252FaRTEMgozHhWG%252Bzc9ubNljt&asb2=2xBggur9R-ofI0wh8CH3vt1OYuc7f5CI0s8eUu9SRqmgiDfD7OnLrLcg57IufrTtsLwk34mJkRYqk1hnm6u_2dM0FFHIW8xUtfMfAGe2NfcWxo5M7qijhUxMsAhDiizGQ8aLv1h4XfYp4HNC_ruBMA
Краска для мебели декора и творчества без запаха 500 грамм акриловая матовая быстросохнущая художественная для дерева бетона кирпича и других поверхностей Paint of Decor цвет Сиреневый 0.5 кг,584 ₽,14 отзывов,"8 мая доставит Ozon, продавец ThermoColor",https://www.ozon.ru/product/kraska-dlya-mebeli-dekora-i-tvorchestva-bez-zapaha-500-gramm-akrilovaya-matovaya-bystrosohnushchaya-471451471/?asb=IUWl%252F89%252F2iLO5jYiET6V7c95%252Fz9pdYkxCho90XCG2JRDLiwt3mvLlT5LbfFwhKPK&asb2=XAicC1VfuLWLfQugy-EZ8d9I3tIGMr8Dpos_Q1Ufsx_Rn9uPOVjkMzQD0Qn_xevaaNs7biDW7V7uMcuZfI2yWisBrYNayQ8sZbxoGM_1RKipbESlOw5_1afIdmhsu-su
"Декоративное покрытие DALI DECOR Magic, Акриловая, перламутровый",349 ₽,1 отзыв,"8 мая доставит Ozon, продавец Стройбаза ""SD MARKET""",https://www.ozon.ru/product/dekorativnoe-pokrytie-dali-decor-magic-akrilovaya-perlamutrovyy-450462324/?asb=YEeJC1EnwCqR3rxUkElpvz%252FydRSPlv9YYHSqL4Y1cv4%253D&asb2=_ZoCNDEBHgWglGxUvv8em7VZBwp5_kkVH7CKfhCfm8j_0BWHjOR0ASgyhcK0qlwR
Краска для мебели декора и творчества без запаха 250 грамм акриловая матовая быстросохнущая художественная для дерева бетона кирпича и других поверхностей Paint of Decor цвет Серый 0.25 кг,454 ₽,14 отзывов,"8 мая доставит Ozon, продавец ThermoColor",https://www.ozon.ru/product/kraska-dlya-mebeli-dekora-i-tvorchestva-bez-zapaha-250-gramm-akrilovaya-matovaya-bystrosohnushchaya-517036031/?asb=p9VOZIiCoQwOYKM%252FYVKqpvmQ4Sx8pZLEIhTvdKKaP7M%253D&asb2=ME3GKa4pji3EwGlSs9_l6fm3MqsDcoa8Umyn8pFu13yjvHs8BZXnXXZaIKhiR00P
"Декоративное покрытие DALI DECOR Magic, Акриловая, золотой, перламутровый",630 ₽,1 отзыв,"8 мая доставит Ozon, продавец Стройбаза ""SD MARKET""",https://www.ozon.ru/product/dekorativnoe-pokrytie-dali-decor-magic-akrilovaya-zolotoy-perlamutrovyy-455385078/?asb=ctOA4DtnGt%252BSebBMtp2zJ6LnTYvKsabjLohPCSodjWc%253D&asb2=p0mjhbEdWEz4dQgxF_HFghSbI0ZTCtlj5h2b-m4mYz7e-KUm7sX0-z3FWEj2iglk
"Декоративное покрытие, Эмаль Poli-R С МЕТАЛЛИЧЕСКОЙ СТРУЖКОЙ Быстросохнущая, Гладкая, до 150°, Эпоксидная, Шелковисто-матовое покрытие, Глубокоматовое покрытие, 0,84 кг, серый",979 ₽,2 отзыва,"8 мая доставит Ozon, продавец ООО ТД «Поли-Р»",https://www.ozon.ru/product/dekorativnoe-pokrytie-emal-poli-r-s-metallicheskoy-struzhkoy-bystrosohnushchaya-gladkaya-do-150-358696677/?asb=gB75rEcqBrI4NKDawmH%252FT03pU5zH0eMpb5Yy90FsDG4%253D&asb2=cyvIypqbPG5vgKSvt68BbMYG2hbiXLjjrnZeZ-r6CRROU1smw-yxhGEM7x9-qRlc
Краска для мебели декора и творчества без запаха 250 грамм акриловая матовая быстросохнущая художественная для дерева бетона кирпича и другихповерхностей Paint of Decor цвет Голубой 0.25 кг,454 ₽,14 отзывов,"8 мая доставит Ozon, продавец ThermoColor",https://www.ozon.ru/product/kraska-dlya-mebeli-dekora-i-tvorchestva-bez-zapaha-250-gramm-akrilovaya-matovaya-518169560/?asb=cmcaCjNmPKsMMyps9PZWggiuSYpa9gOMg7LZjUDC3uXmgVKxgGOivjNVZc8CZEhJ&asb2=i_24UAZP70DP2Q_Iy_AhpUsp470Ugz9sZV5-fCp9PeMXkkw0HMqMhDw2Q3RnvtuLF8divgsbsHG2TOiIT6rriBrDQd5l0CWEMg1VM77rJWU3LEpZULyko2mI79vioCoAxSE8L27IPcRRlojnl19vLg
"Декоративное покрытие VGT Лак ""ДУБ СВЕТЛО-СЕРЫЙ"" 0,9кг Быстросохнущая, Акриловая, Матовое покрытие",525 ₽,1 отзыв,"8 мая доставит Ozon, продавец Мир Строительных Материалов",https://www.ozon.ru/product/dekorativnoe-pokrytie-vgt-lak-dub-svetlo-seryy-0-9kg-bystrosohnushchaya-akrilovaya-matovoe-pokrytie-441981237/?asb=A4IHELagmWagqN%252BYVxXDzmWsB8LFZpY%252FaNMSKEqg8iM%253D&asb2=40WUvRVbZh08XbW1c6kT1LeUlKQJGk89M7azp7ukOhBJwN2Z9f0NRq7IV0shhtDG
Лак бесцветный Престиж Кракелюр 900г,899 ₽,1 отзыв,"8 мая доставит Ozon, продавец ЭКО-Балт",https://www.ozon.ru/product/lak-bestsvetnyy-prestizh-krakelyur-900g-536880389/?asb=RHZa4cANJ8xEHztib%252Bg9NrD9MU2jFXuG9TZ0u94t1ys%253D&asb2=iJ6gEwC8ICJMVNhEZN-v4qzsecazfDAV2dk128GT9WfnJsA-NdZdZh5pDvXxAsV0
"Декоративное покрытие, Краска AccentO 30436 Быстросохнущая, Акриловая, Шелковисто-матовое покрытие, белый, перламутровый",440 ₽,2 отзыва,"9 мая доставит Ozon, продавец Масштаб",https://www.ozon.ru/product/dekorativnoe-pokrytie-kraska-accento-30436-bystrosohnushchaya-akrilovaya-shelkovisto-405279812/?asb=iJKzGEy4zhO5IEMy2dPDhngQUTThip3vtcFfpdOJ8Fo%253D&asb2=B3YVDAwyJ0nmpwmvrwH7mqtUAGdvFEZ1BLGq6Rc-ofHWzF-qWG4ZXWN18XtZvxI6
Краска для мебели декора и творчества без запаха 500 грамм акриловая матовая быстросохнущая художественная для дерева бетона кирпича и других поверхностей Paint of Decor цвет Серый,584 ₽,14 отзывов,"8 мая доставит Ozon, продавец ThermoColor",https://www.ozon.ru/product/kraska-dlya-mebeli-dekora-i-tvorchestva-bez-zapaha-500-gramm-akrilovaya-matovaya-464536300/?asb=7NyVGytd%252FEp0oadpjEWft%252FPz4GPpsItP96CE51q%252BoECkz4TohHi7i7UrjjiL%252FBu2&asb2=w2n28vGmE1w6I5gERIVJgS7HvYk_5LxpYCALwVBXkvYOyeZWVttSsrFAbrIb30YLXlJwtF_ce0qr3SMphRWcP0Q2hVvI4DHXo6vrjmW5QtxGjB_mAXV35KT0M0tcyNA3
Краска для мебели декора и творчества без запаха 500 грамм акриловая матовая быстросохнущая художественная для дерева бетона кирпича и других поверхностей Paint of Decor цвет Бирюзовый 0.5 кг,584 ₽,14 отзывов,"8 мая доставит Ozon, продавец ThermoColor",https://www.ozon.ru/product/kraska-dlya-mebeli-dekora-i-tvorchestva-bez-zapaha-500-gramm-akrilovaya-matovaya-bystrosohnushchaya-472566625/?asb=R%252FsCQVaAWlxHeRq%252FcS8Uky2vBk6jlltqcWqrW76Zjc9kDIdf8GEVMaFeJzvg7O9v&asb2=UrgCgJbRfe62FlWiv_AiGn3nvjNhNo_ZlBXijqVpcmRsYp8w-4b6Fd0wYn7Qa968CtxPAMEo5uoEfM8SJY2e2E3kWJGWFOHPlmR5cQRN9rfkjA6PBECJxeBJz0kPZKl4
Краска для мебели декора и творчества без запаха 250 грамм акриловая матовая быстросохнущая художественная для дерева бетона кирпича и других поверхностей Paint of Decor цвет Фисташковый 0.25 кг,454 ₽,14 отзывов,"8 мая доставит Ozon, продавец ThermoColor",https://www.ozon.ru/product/kraska-dlya-mebeli-dekora-i-tvorchestva-bez-zapaha-250-gramm-akrilovaya-matovaya-bystrosohnushchaya-517026778/?asb=SDcLn0FkCWeJy2s4RfDg2o24KnKmLTLZN%252FFqy8UxYM0%253D&asb2=ojJOVvgsQPAu3eg6077HbPh1xNh2pDiDQdLoi0SUc74OiZipww8f11uYkSwswehb
"Краска Декоратор Palizh акрил.(0.32 кг), 113 МОРСКАЯ ЛАГУНА",279 ₽,21 отзыв,"8 мая доставит Ozon, продавец ООО Новый дом",https://www.ozon.ru/product/kraska-dekorator-palizh-akril-0-32-kg-113-morskaya-laguna-294910016/?asb=pBhIVrDA1xf63vs3n04qF8ycT50s6RoEmaQpiB4pKKo%253D&asb2=qU3qCwv4lDXhUGlWK9wPUBPn9_Llp-dVnAISFeRW1ComeNezABkTzcwisJu35eFY
"Декоративное покрытие DUFA Woodtex, Алкидная, Полуматовое покрытие",650 ₽,16 отзывов,null,https://www.ozon.ru/product/dekorativnoe-pokrytie-dufa-woodtex-alkidnaya-polumatovoe-pokrytie-221274014/?asb=rSAUJtx%252BqyVoz%252B0a%252BT%252BMksD6BHlWh1FcvM8XAwrfJE3F7ZihEipxVz1LE4yVA0LY&asb2=pThtk52hdt_txBEXWyLlVfiNJWmokRt8IcfyJR07NmFGLKir0MKmTibriZVoCwewUUYat5Dqpx0wNPePPi-cKXFlBrA6btXAVPmhf2MU_svucoI9Za-yxu9YaGIyst1yZu7qB4AEJpnxs20vZwbNbA
"Декоративное покрытие Wood Protect WoodProtect, Алкидно-акриловая, Полуматовое покрытие, белый",975 ₽,100 отзывов,null,https://www.ozon.ru/product/dekorativnoe-pokrytie-wood-protect-woodprotect-alkidno-akrilovaya-polumatovoe-pokrytie-belyy-221342491/?asb=Z87xLsVxXf71h3iqbXX4G193KaScteG%252FqvjYeqsipY8gQJ7MdgiumTisFs3%252FWUSe&asb2=jZcQzhjR5gyDF4uo4WkHLzfw483n3EIUsDH-J_3zq7jFa7FBtXFC84NH7FkRVAQxfCl82AFRGj3WC5P4QDEdvgx5QXk6-2we2T9IDL817J0hjHyeiem_O9WLSV9IJRaF4nQC8IjhFC50M2exPmq23g
"Пропитка декоративная для защиты древесины Pinotex Standard тиковое дерево 0,9 л.",905 ₽,36 отзывов,null,https://www.ozon.ru/product/propitka-dekorativnaya-dlya-zashchity-drevesiny-pinotex-standard-tikovoe-derevo-0-9-l-189328189/?asb=LNt2i7WVyxM6siOuSEbGFR914qY2QdIoHBN9WAQxb0%252BpFzyYydXIDWTVyqroiPB7&asb2=XjcDb41QFrPnbhYNn5cH_B_8XVAXobhueogQ8IkjdwN7sHVod8uO1K38G0H4lsmeDayaKL-5J59MLDdJTb7MUVDCSt7Uc1QjUM-2l-1tMeAbmS4XV5VeBCEFOgDLqqjHNDuJLi0ZoZH4_IDGWVD_MA
"Декоративное покрытие VGT Лак ""КРАСНОЕ ДЕРЕВО"" ВГТ 2,2кг Быстросохнущая, *Декоративная, Акриловая, Матовое покрытие, 2 кг, бордовый",983 ₽,0,"8 мая доставит Ozon, продавец Мир Строительных Материалов",https://www.ozon.ru/product/dekorativnoe-pokrytie-vgt-lak-krasnoe-derevo-vgt-2-2kg-bystrosohnushchaya-dekorativnaya-456644161/?asb=gzjiYAqkPFLPbSdKNEbaKNTM5I7lJ9oqO%252F7SJ8TOMgA%253D&asb2=rsSQiihZXDXyMyj446jOWl0BQ8gpf0vpgqPyEHJ9YG10pKpkzW4cO0sy9CrrDr-U
