"ICE PROFESSIONAL by NATURA SIBERICA Профессиональный разглаживающий крем для волос, увлажняющий TAME MY HAIR CREAM, 100 мл. Несмываемый уход для волос, для кудрявых волос, для вьющихся волос, для всех типов волос, для блеска волос, натура сиберика",406 ₽,191 отзыв,"Завтра доставит Ozon, продавец CityNature",https://www.ozon.ru/product/ice-professional-by-natura-siberica-professionalnyy-razglazhivayushchiy-krem-dlya-volos-245376114/?asb2=hEhAh5tQLUHvI4BeOMTfanWIG_tsWHRHxrqh2mMSM_mbrN2pTvtIva-rWwyzS7_S4ob42NafVOkZIaw7HO-gdA
"Mirrolla Ополаскиватель ""Малиновый уксус для волос"", блеск и гладкость волос, 300 мл",168 ₽,123 отзыва,"Завтра доставит Ozon, продавец Mirrolla",https://www.ozon.ru/product/mirrolla-opolaskivatel-malinovyy-uksus-dlya-volos-blesk-i-gladkost-volos-300-ml-380334570/?asb2=bg5bfKLu4BH_o9yImgW6n0N1IcbpSLfzfz4OGh2m7yBR97uCsNM_kYdq5jkcBubn
L'Adeleide Бальзам-кондиционер с экстрактом кокоса БЕЗ SLS 250 мл,230 ₽,28 отзывов,"Завтра доставит Ozon, продавец ADELEIDE",https://www.ozon.ru/product/l-adeleide-balzam-konditsioner-s-ekstraktom-kokosa-bez-sls-250-ml-447241922/?asb2=V1fqkglJbDUryEcfwVOTkTow0mSt7yzQrY6uPLRe-wAOWEibss1AQZMdDL_0n7Se
"Magio Professional Молекулярное масло против выпадения волос, масло для роста волос, масло для волос несмываемое, натуральное, 100 мл.",284 ₽,138 отзывов,"Завтра доставит Ozon, продавец Magio Professional",https://www.ozon.ru/product/magio-professional-molekulyarnoe-maslo-protiv-vypadeniya-volos-maslo-dlya-rosta-volos-maslo-254816115/?asb2=1K8-sDXna4DV32t1LypsZI5SkE0zF27s3ItE6gs2qv2V_sT0llCfBltzts6tSKkV
Compliment Маска-баттер Абсолютное восстановление для всех типов волос Keratin+Biotin 300 мл,209 ₽,196 отзывов,"9 мая доставит Ozon, продавец Аквакосметика",https://www.ozon.ru/product/compliment-maska-batter-absolyutnoe-vosstanovlenie-dlya-vseh-tipov-volos-keratin-biotin-300-ml-214426843/?asb2=LJY2_Csmd7wsx8gu9aZ3z-pdR01ZRBuPbXSqjyc6r1HrDZDMtG2yOl1dItfbM5Ld
"Крем для кудрявых волос LET'S TRAVEL. Крем для кудряшек ProКудри.Крем для кудрявых волос. Увлажняющий, без сульфатов, без силикона, без парабенов, синтетических отдушек и красителей",430 ₽,102 отзыва,"Завтра доставит Ozon, продавец Leonabureau",https://www.ozon.ru/product/krem-dlya-kudryavyh-volos-let-s-travel-krem-dlya-kudryashek-prokudri-krem-dlya-kudryavyh-356724349/?asb2=P5APV7iihBf0DUrNYK73e7QgQzOwkqzCn5sb1xO_flAYEwfSYC36-4kiZGs3afn6
"Leo Brickman / Восстанавливающее масло для волос 100мл , New York",249 ₽,72 отзыва,"Завтра доставит Ozon, продавец CosmoLab",https://www.ozon.ru/product/leo-brickman-vosstanavlivayushchee-maslo-dlya-volos-100ml-new-york-384713141/?asb2=pUeACEfuCu2XokpLw6zIMeCPvP2qQzIT4H6NwC-ziYsceiqnB5JoZ1F7-zJ-58cL
"Заполняющая маска - филлер для поврежденных волос, восстановление и блеск, CP-1 3 Seconds Hair Ringer , Южная Корея, набор 2 шт х 13 мл.",395 ₽,3 отзыва,"9 мая доставит Ozon, продавец BY",https://www.ozon.ru/product/zapolnyayushchaya-maska-filler-dlya-povrezhdennyh-volos-vosstanovlenie-i-blesk-cp-1-3-seconds-487843710/?asb2=TEu7jXtsfU4iDu37WxzpAx_ask7Jlvk5IpmVRIiMpsCjKM6GxU-S9ML2tfBFE8ui
Касторовое масло 30мл,140 ₽,2 отзыва,"9 мая доставит Ozon, продавец ИНФОФАРМ",https://www.ozon.ru/product/kastorovoe-maslo-30ml-552238559/?asb2=6Re7d1-hIlSEqG7MJU5PujjbFFqAYD1sjy_EtWLH6uQIcaxLgsvw3AdsIJQnqRSrO08sugDE20fD8y-9NO3ZiQ
Jean Paul Myne / Ocrys Deva кондиционер для защиты и блеска окрашенных волос 250 мл / профессиональная косметика для домашнего ухода / средство защищает кудри от повреждений и преждевременной потери цвета и яркости,199 ₽,14 отзывов,"15 мая доставит Ozon, продавец ООО ""Арт Дистрибьюшн""",https://www.ozon.ru/product/ocrys-deva-konditsioner-dlya-okrashennyh-volos-250-ml-199724053/?asb2=boK36t4LTRDC03WxYCPiNfaFRcFzK-9HVCeWhgmcxldP-rgW62ZecpSJMF4ZrJua6dO17y6g8sfoPuPAAemSrw
Jean Paul Myne / Keratin Plus Gold - органический кератин без формальдегида / салонная косметика для процедуры кератинового выпрямления волос / профессиональное средство для разглаживания и восстановления вьющихся кудрей 500 мл,660 ₽,58 отзывов,"15 мая доставит Ozon, продавец ООО ""Арт Дистрибьюшн""",https://www.ozon.ru/product/jean-paul-myne-keratin-plus-gold-organicheskiy-keratin-bez-formaldegida-salonnaya-kosmetika-dlya-282214630/?asb2=WaDZmDvVuRnw428JXN4PTnaCXNQXkCwXMeoUcwPEPTXhWYTpvDIC-aUCYHPvunA7
"MASIL Набор шампуней Масил, Восстанавливающий, Глубокоочищающий, с пробиотиками, от перхоти, Корейский уход",329 ₽,22 отзыва,"Завтра доставит Ozon, продавец Mimimishop",https://www.ozon.ru/product/masil-nabor-shampuney-masil-vosstanavlivayushchiy-glubokoochishchayushchiy-s-probiotikami-ot-perhoti-477801650/?asb2=QaWjWx_ONCwDdrSCw_I-_HhWpsuaMyFKhNEB1hWL5IWYsqSfO3nGTe8B5aqLXXWF
Золотой шелк Крем-спрей с маслом Усьмы,174 ₽,146 отзывов,"Завтра доставит Ozon, продавец Народные Промыслы",https://www.ozon.ru/product/zolotoy-shelk-krem-sprey-s-maslom-usmy-310004437/?asb2=WNWNXWjBXTLa0uo-6ym3m3LKg3Fx9Q01RoTiIT6h5sVVI66eygLgBBuJpxArn24E
ESTHETIC HOUSE Набор для волос: Протеиновый бессульфатный шампунь для волос + Кондиционер для волос CP-1 Intense Nourishing Version 2.0 / Увлажняющий набор для ежедневного ухода за волосами: корейский шампунь и кондиционер для волос - 2 шт. по 100 мл.,784 ₽,86 отзывов,"Завтра доставит Ozon, продавец НАДО.Маркет",https://www.ozon.ru/product/esthetic-house-nabor-dlya-volos-proteinovyy-bessulfatnyy-shampun-dlya-volos-konditsioner-dlya-522751389/?asb2=KBKpWs6HbTrt2jjZ14co_6_83d5ea-fgQZm4GkPOv_5El0zHnBCQZ3SE3OG8jle0pfwEWsyW_AYzdzaGpAUw9w
Compliment Маска восстанавливающая для волос поврежденных механическим и химическим путем Keraplex 3D 300 мл,197 ₽,127 отзывов,"9 мая доставит Ozon, продавец Аквакосметика",https://www.ozon.ru/product/compliment-maska-vosstanavlivayushchaya-dlya-volos-povrezhdennyh-mehanicheskim-i-himicheskim-putem-215282777/?asb2=_HlL9XnxV7y1Ztk7srgtT7ejj2IHHzRUzRmGFA4DicSY8oaiGD828x2JNMp1ctX1
"Dalan d'Olive Кондиционер для волос ""Восстановление и Питание"", бальзам для сухих и поврежденных волос с оливковым маслом, 200 мл.",307 ₽,29 отзывов,"Завтра доставит Ozon, продавец Turkish Cosmetics",https://www.ozon.ru/product/dalan-d-olive-konditsioner-dlya-volos-vosstanovlenie-i-pitanie-balzam-dlya-suhih-i-povrezhdennyh-346357879/?asb2=u61w4cMOjIkkOW4nHkrc0v0jBeQue3mz1-ZCOWqawvdeB5hn7L43UmWhskDJ1XlW
Сыворотка для волос AQUA BOTOX - ПОДАРИТ ВОЛОСАМ ПОТРЯСАЮЩИЙ БЛЕСК И НЕПРЕВЗОЙДЕННУЮ ГЛАДКОСТЬ,178 ₽,4 отзыва,"Завтра доставит Ozon, продавец KRASSEL",https://www.ozon.ru/product/krassel-aqua-botoks-aqua-aktivator-uvlazhneniya-volos-syvorotka-kontsentrat-dlya-volos-aqua-botox-219942844/?asb2=AR1WhzTmTWywCLD_vx5vj7bbVoHsuX1hyhHvqeSNEL2aEztKC6KoKEd-lsUQ3TmW
"Подарочный набор Pantene Аква Лайт: Шампунь, 250 мл + Бальзам, 200 мл",568 ₽,184 отзыва,"Завтра доставит Ozon, продавец Ozon",https://www.ozon.ru/product/podarochnyy-nabor-pantene-shampun-aqua-light-250-ml-balzam-opolaskivatel-200-ml-147424675/?asb2=KYEolxCi4OGfuhF_rOOXvT7pE8AojnuxWCicv0eyBIW8WY_2zYALICiZl_JDSKQ_
