"Атлас мира. Карты всех стран мира включая ДНР, ЛНР и все штаты США",321 ₽,82 отзыва,"9 мая доставит Ozon, продавец СЕВЕРО-ЗАПАДНОЕ КНИГОТОРГОВОЕ ЭКСПОРТНОЕ ОБЪЕ",https://www.ozon.ru/product/atlas-mira-karty-vseh-stran-mira-vklyuchaya-vatikan-i-vse-shtaty-ssha-171600841/?asb2=r04YI2GILv-vzSy9QBGyIleYNf29TNHLsXGD3lXM-n7qz1sX5je86dJ_83e8Q3s2
"Тысяча и одно мяу. Удивительные кошачьи истории о людях, любви, верности и потерях | Жеребилова Марина Евгеньевна",484 ₽,3 отзыва,"Завтра доставит Ozon, продавец Торговый Дом ""Эксмо""",https://www.ozon.ru/product/tysyacha-i-odno-myau-udivitelnye-koshachi-istorii-o-lyudyah-lyubvi-vernosti-i-poteryah-zherebilova-507359489/?asb2=BXHrx0t0Vv_G8pzbx8VU6GH4OFVIHBVCxT1md5Wyfpc9fjEsGG02jn4XrC4muHhh
Генетика на завтрак. Научные лайфхаки для повседневной жизни | Модер Мартин,466 ₽,37 отзывов,"Завтра доставит Ozon, продавец Торговый Дом ""Эксмо""",https://www.ozon.ru/product/genetika-na-zavtrak-nauchnye-layfhaki-dlya-povsednevnoy-zhizni-moder-martin-250964120/?asb2=s5DGGllgf7jXUDFt3EYE8OQovB5OOagp5EUrsjAQ7VtOxdd2u742oSn0sS3RSTor
"Почему одни страны богатые, а другие бедные | Аджемоглу Дарон, Робинсон Джеймс А.",938 ₽,191 отзыв,"Завтра доставит Ozon, продавец Издательство АСТ",https://www.ozon.ru/product/pochemu-odni-strany-bogatye-a-drugie-bednye-232959715/?asb2=k2Cn-tCjJru8c3xDNeWhdPAFE6yJ3HstT1RJMX5-GV3IQSf_N3hp8ND2iwpEXKjzbEwdXfS97b_GZOyFPAqwXQ
Навигатор по английскому языку | Вульф И.,96 ₽,13 отзывов,"Завтра доставит Ozon, продавец Ozon",https://www.ozon.ru/product/navigator-po-angliyskomu-yazyku-147565859/?asb2=HZNzsAhvbXpakVAfzIFpx6SMXgVLfv7UULQWgThuQRoaFY2YRzOhMBBRtz-6x3xz
Здоровый сон. 21 шаг на пути к хорошему самочувствию,946 ₽,49 отзывов,"Завтра доставит Ozon, продавец Торговый Дом ""Эксмо""",https://www.ozon.ru/product/zdorovyy-son-21-shag-na-puti-k-horoshemu-samochuvstviyu-stivenson-shon-267303954/?asb2=-Cut8KIUdxvTBCAfXp8eGGlEOeUKeIIz9qoVaQuOQ4JHQN1ARs1r_evsgI1lc92y
Камни и минералы | Хёхляйтнер Руперт,897 ₽,14 отзывов,"Завтра доставит Ozon, продавец Торговый Дом ""Эксмо""",https://www.ozon.ru/product/kamni-i-mineraly-hehlyaytner-rupert-438033489/?asb2=mJX1BqsgTy6N3_22QCPsE26Nbs_xlhd4_SHrQRewfxWET3OXzpbxU2KO1iCXAQrI
"Разум убийцы. Как работает мозг тех, кто совершает преступления | Тейлор Ричард",662 ₽,96 отзывов,"Завтра доставит Ozon, продавец Торговый Дом ""Эксмо""",https://www.ozon.ru/product/razum-ubiytsy-kak-rabotaet-mozg-teh-kto-sovershaet-prestupleniya-teylor-richard-289143138/?asb2=QfwnXv4jwQK5Looyw_ed82tb82s6xwa1NVCH2Lsw0P5NOnE11RViAd8LRJwWPZMI
"Москва и Область складная фальцованная карта города 67,5 х 97,5 см, издательство ""АГТ Геоцентр""",305 ₽,23 отзыва,"14 мая доставит Ozon, продавец Издательство ""АГТ Геоцентр""",https://www.ozon.ru/product/moskva-i-oblast-skladnaya-faltsovannaya-karta-goroda-67-5-h-97-5-sm-izdatelstvo-agt-geotsentr-501481206/?asb2=b4Kb42GFfWJ_0UDlHkGU5MS5VKLXurXzBmRf366i-TRJrdB44LZgbrfH1nNzhwBW
Удивительные динозавры. Детская энциклопедия,187 ₽,197 отзывов,"Послезавтра доставит Ozon, продавец Эврики",https://www.ozon.ru/product/udivitelnye-dinozavry-detskaya-entsiklopediya-189309857/?asb2=n0Q6oaKSqhd6EZ1bvsuTegTFe3MNbxfiDVvFOiYKYIiY2S5MyKJ3su-VZ-f6bf--
Правила дорожного движения 2022 с иллюстрациями | Алексеев А. П.,288 ₽,59 отзывов,"Завтра доставит Ozon, продавец Торговый Дом ""Эксмо""",https://www.ozon.ru/product/pravila-dorozhnogo-dvizheniya-2022-s-illyustratsiyami-alekseev-a-p-382288891/?asb2=vVIxx5zS-8LJj4MQk3BzIkxarPeGOF8YyhlOLQugFkL6_kyYievDVvI5GUZ8JE41
"В ожидании малыша (обновленное издание, бордовая) | Сирс Марта, Сирс Уильям",552 ₽,78 отзывов,"10 мая доставит Ozon, продавец СМАРТАП",https://www.ozon.ru/product/v-ozhidanii-malysha-obnovlennoe-izdanie-bordovaya-sirs-marta-sirs-uilyam-247102623/?asb2=K_fgMNfuF_C_hDjU_WTWKZhmi5tKaiXVclCKMJ3bhTuRnTDi1IknYKa5ntHp4VLl
Готовим из дикоросов. Травы.,689 ₽,8 отзывов,"9 мая доставит Ozon, продавец Ozon",https://www.ozon.ru/product/gotovim-iz-dikorosov-travy-428839984/?asb2=R-4ZsYow83R5tK2vNgKy6rKJoYC3vQE92ahCQ_BL14cDuWfoxIXqTWuPw7IrJFGQ
Неотложная помощь: справочник для родителей. Всегда под рукой | Комаровский Евгений Олегович,660 ₽,63 отзыва,"Завтра доставит Ozon, продавец Ozon",https://www.ozon.ru/product/neotlozhnaya-pomoshch-spravochnik-zdravomyslyashchih-roditeley-neotlozhnaya-pomoshch-6464237/?asb2=eiTlxv_GXGMdzz3Ap0mJGDfo_NtbatqHRgF79fIAxSfk146CgvIrt4Pq95tPvrNt
Красная книга. Детская энциклопедия РОСМЭН | Котятова Наталья Игоревна,259 ₽,57 отзывов,"9 мая доставит Ozon, продавец ООО РОСМЭН",https://www.ozon.ru/product/krasnaya-kniga-detskaya-entsiklopediya-148803880/?asb2=xSrmreSVsRbqpdBqAA3mIhPFK1YVo5bNTjSvHi5m8jq9hYag7ZQCc0N0hB4D91p9fLPi5ETeclZY06gTSzcRyA
Когда собаки не лают: путь криминалиста от смелых предположений до неопровержимых доказательств | Галлоп Анджела,590 ₽,59 отзывов,"Завтра доставит Ozon, продавец Торговый Дом ""Эксмо""",https://www.ozon.ru/product/kogda-sobaki-ne-layut-put-kriminalista-ot-smelyh-predpolozheniy-do-neoproverzhimyh-dokazatelstv-266869474/?asb2=KrsQr_ubEOtTxqecWefK7ZHHJezLYZU0LvlSN091WI6rYoaN1WfFxQON7XsFrGlD
"Экзаменационные билеты для сдачи экзаменов на права категорий А, В, М подкатегорий А1 В1 с комментариями на 2022 год.",236 ₽,55 отзывов,"Завтра доставит Ozon, продавец Торговый Дом ""Эксмо""",https://www.ozon.ru/product/ekzamenatsionnye-bilety-dlya-sdachi-ekzamenov-na-prava-kategoriy-a-v-m-podkategoriy-a1-v1-s-473467204/?asb2=c12EWHw34xNliWDVyP1VdpxodNTvnzMxL-NuUicuIYR3pm1cKv-SCyg9pqghXoB5
Арабский язык. Тренажер по письму и чтению | Азар Махмуд,252 ₽,5 отзывов,"Завтра доставит Ozon, продавец Издательство АСТ",https://www.ozon.ru/product/arabskiy-yazyk-trenazher-po-pismu-i-chteniyu-azar-mahmud-497610787/?asb2=aoOEHUKf35mlNV117F_bB1f64gbfZweCMLNLagR_glxnFJwhty1PNP-ZQC7gS8vtVEyW8YqE7df8Rg8nfRWJ1A
Деревья и кустарники России. Определитель | Пескова Ирина Михайловна,381 ₽,1 отзыв,"Завтра доставит Ozon, продавец Издательство АСТ",https://www.ozon.ru/product/derevya-i-kustarniki-rossii-opredelitel-peskova-irina-mihaylovna-562883433/?asb2=8ShA9spR0ulwr36jNQWstkRFuwzm4oHzGKCLbXP5fLkLSjYHbyHW0PCsqECt8vZrtSAMSilBQEsJx02-KUysSQ
"Заблокированные нейроны. Инновационная стратегия снижения веса, основанная на новейших достижениях в области биологии, психологии и неврологии | Томпсон Сьюзан",714 ₽,31 отзыв,"Завтра доставит Ozon, продавец Торговый Дом ""Эксмо""",https://www.ozon.ru/product/zablokirovannye-neyrony-innovatsionnaya-strategiya-snizheniya-vesa-osnovannaya-na-250966265/?asb2=GU7pxLNvK0p2sbtcGoF0sx5eRGA4y-EoPdnqwWaYct8pzhtkqnx3omECFGbTweTE
Очаровательный кишечник. Как самый могущественный орган управляет нами | Эндерс Джулия,759 ₽,101 отзыв,"Завтра доставит Ozon, продавец Ozon",https://www.ozon.ru/product/ocharovatelnyy-kishechnik-kak-samyy-mogushchestvennyy-organ-upravlyaet-nami-34436183/?asb2=Dnh8uqlS-6lVpHaKT2pCbFoC7HwK229I2M0kSUisKt7ohwCH_hhyqOw4HQtRPEHe
#Здоровоедим. Попробуй счастье на вкус | Давыдова Наташа,550 ₽,8 отзывов,"Завтра доставит Ozon, продавец Welps",https://www.ozon.ru/product/zdorovoedim-169478937/?asb2=DcZrjoViHz8BSSdv1dU1w8pihmh4i5luwU6QpjWiY4a0QeGbZ4sEce9VSjzwE0nA
"Парадокс растений. Скрытые опасности ""здоровой"" пищи: как продукты питания убивают нас, лишая здоровья, молодости и красоты (покет) | Гандри Стивен",401 ₽,135 отзывов,"Завтра доставит Ozon, продавец Торговый Дом ""Эксмо""",https://www.ozon.ru/product/paradoks-rasteniy-skrytye-opasnosti-zdorovoy-pishchi-kak-produkty-pitaniya-ubivayut-nas-250051797/?asb2=OPAOvIIDChmXwRh386YpaQ-3JVNq_HrNaz6D8NagSzZGCobVXriLrB-v2zFWnVP8
"Новая Книга-тренинг ""Исцеление рода. Путь к процветанию и благополучию"" | Синельников Валерий Владимирович, Синельникова Людмила Анатольевна",550 ₽,74 отзыва,"Завтра доставит Ozon, продавец Авторский дом ""Светоч""",https://www.ozon.ru/product/novaya-kniga-trening-istselenie-roda-put-k-protsvetaniyu-i-blagopoluchiyu-sinelnikov-valeriy-430612198/?asb2=FfVg9JwkzcqVVQ1YCTaiplO17UyCKNP9D7G9LLTpKuyYLPeaXaR5gEXw5eHhyUrwJJaYwBbTVjD2lnQDC_oIfg
Репортаж из морга. Как судмедэксперт заставляет говорить мертвых | Сапане Мишель,566 ₽,32 отзыва,"Завтра доставит Ozon, продавец Торговый Дом ""Эксмо""",https://www.ozon.ru/product/reportazh-iz-morga-kak-sudmedekspert-zastavlyaet-govorit-mertvyh-sapane-mishel-286133407/?asb2=YL2BzcdziVm6IP9m00X6pqBfxbXEVAhOBoazqIG2XMsdfGcypqF7P8oCKNoAib8d
"Это все психосоматика! Как симптомы попадают из головы в тело и что делать, чтобы вылечиться | Кугельштадт Александр",755 ₽,1 отзыв,"Завтра доставит Ozon, продавец Торговый Дом ""Эксмо""",https://www.ozon.ru/product/eto-vse-psihosomatika-kak-simptomy-popadayut-iz-golovy-v-telo-i-chto-delat-chtoby-vylechitsya-440947595/?asb2=5kEExIK9-VLLGVpgZJE2qj139m3X9jAyu_2Dfs_Zttu1JpYDq1Z0w0vvGUIDTiYo
"Клетка ""на диете"". Научное открытие о влиянии жиров на мышление, физическую активность и обмен веществ. 2-е издание | Меркола Джозеф",739 ₽,143 отзыва,"Завтра доставит Ozon, продавец Торговый Дом ""Эксмо""",https://www.ozon.ru/product/kletka-na-diete-nauchnoe-otkrytie-o-vliyanii-zhirov-na-myshlenie-fizicheskuyu-aktivnost-i-obmen-249173132/?asb2=SU9rDx4UIvBiYWi50KauHeSrfiSRQi-q5xNTZuVOGn0BsEo4K2P_eWenvq2HsrCF
Роды от природы | Носаль Евгения Евгеньевна,586 ₽,102 отзыва,"Завтра доставит Ozon, продавец Торговый Дом ""Эксмо""",https://www.ozon.ru/product/rody-ot-prirody-nosal-evgeniya-evgenevna-250970112/?asb2=2vlv3l8oDPRtQAvRLZMckxXccghvtMSmmMux9zAAOYzZtLtiozF_IrCISzzyK-Cf
Остеохондроз - не приговор! 2-е издание | Бубновский Сергей Михайлович,280 ₽,85 отзывов,"Завтра доставит Ozon, продавец Торговый Дом ""Эксмо""",https://www.ozon.ru/product/osteohondroz-ne-prigovor-2-e-izdanie-bubnovskiy-sergey-mihaylovich-357096835/?asb2=7zRv0SZloI4BxpXl7YBl8hpEV7dX3ZxwaNmuwTpG7xVxghHD52ppuphOf3ob8-ug
Питание в начале жизни. От беременности до 3-х лет,140 ₽,145 отзывов,"Завтра доставит Ozon, продавец Торговый Дом ""Эксмо""",https://www.ozon.ru/product/pitanie-v-nachale-zhizni-ot-beremennosti-do-3-h-let-249411439/?asb2=lS182c_KYlepCB_kvBWXg7o-7Z7_DSJuABjWYtLTfQN-MwuZe77tBu4RyT7YoLE3
Семь возрастов смерти. Путешествие судмедэксперта по жизни | Шеперд Ричард,620 ₽,25 отзывов,За час курьером Ozon Express,https://www.ozon.ru/product/sem-vozrastov-smerti-puteshestvie-sudmedeksperta-po-zhizni-sheperd-richard-332292995/?asb2=Ji7VzU2w_5LGISr_MIeGUQKwi29VZuhYC4g2v77uXptdAEGItR7AV9slXCf4F6Tc
"Интервальное голодание. Как восстановить свой организм, похудеть и активизировать работу мозга | Фанг Джейсон, Мур Джимми",739 ₽,89 отзывов,"Завтра доставит Ozon, продавец Торговый Дом ""Эксмо""",https://www.ozon.ru/product/intervalnoe-golodanie-kak-vosstanovit-svoy-organizm-pohudet-i-aktivizirovat-rabotu-mozga-250055944/?asb2=HOGbTWB16MTc5khzfNXFFLzh87fTPmf78lRlG5LkII1ntZVWA6m1wZ3yo6h0eg6P
"Viva la vagina. Хватит замалчивать скрытые возможности органа, который не принято называть | Стёкен Даль Эллен, Брокманн Нина",522 ₽,53 отзыва,Продавец Ozon,https://www.ozon.ru/product/viva-la-vagina-hvatit-zamalchivat-skrytye-vozmozhnosti-organa-kotoryy-ne-prinyato-nazyvat-144680072/?asb2=NiIGHGc6WWuhoDN-5N0kamMdn5fCrI0x6bj8orLJME0zcatT6Ta5-tHVB3e6DqEm
Правила дорожного движения РФ с расширенными комментариями и иллюстрациями с изм. и доп. на 2022 г. | Копусов-Долинин Алексей Иванович,140 ₽,68 отзывов,"Завтра доставит Ozon, продавец Торговый Дом ""Эксмо""",https://www.ozon.ru/product/pravila-dorozhnogo-dvizheniya-rf-s-rasshirennymi-kommentariyami-i-illyustratsiyami-s-izm-i-dop-na-367267055/?asb2=gzh0UUvVQiezVp4c-UE42lWzpuOkqNP1-PaukpVPdscutfZ57phvY2bdnCboopeg
"0,05. Доказательная медицина от магии до поисков бессмертия | Талантов Петр",896 ₽,177 отзывов,"Завтра доставит Ozon, продавец Издательство АСТ",https://www.ozon.ru/product/0-05-dokazatelnaya-meditsina-ot-magii-do-poiskov-bessmertiya-talantov-petr-valentinovich-250455432/?asb2=rR4ZBYbi_6wB9JeXYU2a_fVLBB24x0aL9lhBEqnc8xwLri3fD1ibCb80VximQkKiBZ28fvkhh0fDqPcTURU78A
"Семь с половиной уроков о мозге. Почему мозг устроен не так, как мы думали",844 ₽,1 отзыв,"Завтра доставит Ozon, продавец Торговый Дом ""Эксмо""",https://www.ozon.ru/product/sem-s-polovinoy-urokov-o-mozge-pochemu-mozg-ustroen-ne-tak-kak-my-dumali-547477355/?asb2=YajeK3pxbq92IBUyhJgCMOLOAOEtGYJ7tM17f_0iKlqWPsPZ5WYHJHqXWTVfc6CdzCMTavLooB6nipGBuqfTfw
