Комплект насадок и парфюмерных воронок для наполнения атомайзеров и разборных флаконов для духов,199 ₽,67 отзывов,"Завтра доставит Ozon, продавец Mea LifeStyle",https://www.ozon.ru/product/komplekt-nasadok-i-parfyumernyh-voronok-dlya-napolneniya-atomayzerov-i-razbornyh-flakonov-dlya-duhov-298351740/?asb=1bMPiHi7zurzUwH07fr5Ws3%252F8D4Gg4t4F6a93xbRMxiBduYRmUsPjOfYduqWCYwO&asb2=U2jK6QRldHVLvSAKvaR2d6ZYLFMovs9XGCbT_LzxEpXRMkiBpGibaIrUcDRqCh9j76DOD6rHiBPTgtEVhuXOF6GEjmA6iOy3XNSs_0l1U0EsE5LRaxKSjWHHe1qS_Wh0yL9giKeL5YuN0zrpFw9Eag
"Флакон для духов Tripla, 5 мл, синий / Флакон косметический / Флакон с распылителем / Дорожные флаконы / Атомайзер для духов / Флакон с дозатором / Флаконы дорожные / Атомайзер / Флакон / Для духов флакон / Флаконы / Атомайзер 5 мл / Флакон спрей",271 ₽,84 отзыва,"Завтра доставит Ozon, продавец 3STEPHEN",https://www.ozon.ru/product/flakon-dlya-duhov-tripla-5-ml-siniy-flakon-kosmeticheskiy-flakon-s-raspylitelem-dorozhnye-355286944/?asb=pW%252FTO9kNZuNrz%252Ff%252F8LzsEg2LoY8rwwNvsVyojs%252Buo0VbSuASyRJNkUk4bvH390Kb&asb2=s_iNxhGN_JwwaOpSi2ZRk2UJJ4VQvz9P5_bsz0WFzLl4yuMAjiNGyTh4th2gIY04uGFVOa-YKzqw1o9ETRQgVb24zn4gTAVuaIpWxoc3PviDh2VIzWmuZlZ7daCvmKqLPWfGJqdy4GI-E76UsvMvtw
Портативный мини-пульверизатор для духов,263 ₽,63 отзыва,"Завтра доставит Ozon, продавец Healthy Life",https://www.ozon.ru/product/portativnyy-mini-pulverizator-dlya-duhov-krasnyy-166699435/?asb=PIpdgcgrSYTkyvNi9s5uYw%252Fuslh95IacF7YMPcD2AkJpeTCgrPaNrSNannXIBDFP&asb2=vNyVNYvo5o7IXrnqRPQaBzEq9h8293eROue2txf_v9qBio7xZ2jg7zKQsH6Gbmeobyyr90pOxl4vcV9bkqWcMzSKxh3ROjvLTxPzv2phIQA3GSEFokVtesu1QKrMQzqNwJG0uDIgO_05aP1boXLyeA
"Спрей-насадка для перелива духов/создания отливантов, набор 5 штук",187 ₽,39 отзывов,"Завтра доставит Ozon, продавец KOC",https://www.ozon.ru/product/sprey-nasadka-dlya-pereliva-duhov-sozdaniya-otlivantov-nabor-5-shtuk-366934507/?asb=wsTK4YBYfJSTQotcqupjtzoKHKyCj6zpf3O2Dg9Ewv4%253D&asb2=ZqN0sRsocB51piwFyEZJ5aaFGP8Ua2MuiJ8XE_xvAUZs3WpOpSsxm-AMpHQiyOg1
"Флакон для парфюма с распылителем косметический, 10 мл/Емкость дорожная, для рефила",187 ₽,13 отзывов,"Завтра доставит Ozon, продавец ИП Шиманская Н.Н.",https://www.ozon.ru/product/flakon-dlya-parfyuma-s-raspylitelem-kosmeticheskiy-10-ml-emkost-dorozhnaya-dlya-refila-286677996/?asb=7RNGO0oW06a3V0F6hyAoIidWAh%252BJx%252BGHkDQTzdM1WZ0%253D&asb2=a61nuYhFPPEGpei7IqN-TcBHFUP00Ge0syrLDcn48_OraPY3Cv4N85IABTunlw4M
"Многоразовый дорожный атомайзер-флакон КАРТОФАН для духов и парфюма (компактная стеклянная ёмкость с распылителем 3 мл), серебряный",299 ₽,160 отзывов,"Завтра доставит Ozon, продавец Картофан",https://www.ozon.ru/product/mnogorazovyy-dorozhnyy-atomayzer-flakon-kartofan-dlya-duhov-i-parfyuma-kompaktnaya-steklyannaya-199717706/?asb=Q9PwaNv8YvlX555aXFgTqj4CXRKwaQ2nETyXHDFcv2LacIQE3aJ6MA0jWeSxIvgN&asb2=7RT4bKy_ZsHaOj5ojia2xdF05W5z5Fo0b3E6DVx_179PiCJqPTLxcK2vhyJGXyRhIP_n5B7CZWA-i4jHmge1eCgfTaGozWWbaMK4296nbseAIfR0cenrBLPBh1FBNV7Y9wUpxhZK1eT85zWsDXas7w
"Флакон-атомайзер выдвижной для духов с насадкой для перелива парфюмерии 10мл, цвет мраморный чёрный",380 ₽,164 отзыва,"Завтра доставит Ozon, продавец KOC",https://www.ozon.ru/product/flakon-atomayzer-vydvizhnoy-dlya-duhov-s-nasadkoy-dlya-pereliva-parfyumerii-10ml-tsvet-365421978/?asb=xkilwF9xu%252BGZdXWnSAq5ujTNS8SJVQ1IWNwl4bIyPM4%253D&asb2=k2HrTE04cS68TU_0EMOZQOrxG0Z7Tgm5iiFTLsHz09O1NwyeSFIp3te6fJsnpstq
Флакон атомайзер стеклянный 50 мл пустой,390 ₽,46 отзывов,"Завтра доставит Ozon, продавец JOYDI",https://www.ozon.ru/product/flakon-atomayzer-steklyannyy-50-ml-pustoy-402103502/?asb=fWKu27tcnirPzROLMJDKM%252FnC6%252FJseto2QZLMqnnCHa53RVnZUcWL8S4lsKoXTvoS&asb2=IcLr_qmIxGXoh9TaqrJpPXLsh_DUdN1zvuBaxw33s7NqJ1biJFCBw5t3rlWTyoAUGt3D8GRXbL7pSUq6VADcd6pCQfyRb6_F9taAS4ROGViVhBnvv286-GiyC36RxzhkUGJjniptqSiyM5RoTjSVKw
"Атомайзер флакон для духов, антисептика и других жидкостей 12мл",323 ₽,7 отзывов,"Завтра доставит Ozon, продавец Streaming forward",https://www.ozon.ru/product/atomayzer-flakon-dlya-duhov-antiseptika-i-drugih-zhidkostey-12ml-289658124/?asb=Rc4kqZg7gxKsPQYpvf3AbyFFsgtEi%252Bg5eMVj1MS11cFpNDcWhGNce12%252BhT%252B76Tkd&asb2=v6hVZDQCQbW1eREG2ElG4jssdlBZpC15dY7kxUjUxq6SpA9oqCDoK4aX99d768JUdrk77mNw8J0HxISsuT2sb-FDEBfGpXFVVOpdT-fhsoJUbJH3TJ6JitXulvPUn_3bf9oRvOoCuA8UWtEUsfjpJA
"Парфюмерный шприц 10 мл для перелива духов / создания отливантов, 3 штуки",300 ₽,39 отзывов,"Завтра доставит Ozon, продавец KOC",https://www.ozon.ru/product/parfyumernyy-shprits-10-ml-dlya-pereliva-duhov-sozdaniya-otlivantov-3-shtuki-535582514/?asb=9pVJMuLYvk%252BAPFlSOHQEAwx2DRO2ZqdnzHeB%252FYIA9tc%253D&asb2=xspf1VSM8CD1e0jBwkW00AQhMfNulcyZE2QBBhRYdk4jgNxS3d7MDIsyFB9WrOb2
"Атомайзер флакон для духов, антисептика и других жидкостей 10мл",299 ₽,5 отзывов,"Завтра доставит Ozon, продавец Streaming forward",https://www.ozon.ru/product/atomayzer-flakon-dlya-duhov-antiseptika-i-drugih-zhidkostey-10ml-290216208/?asb=XXld5WpDcz3ZW84pZ7VfVK8CtLGBqccP88ar3TIHhZE%253D&asb2=cNFb7GSELfhe35Ow8FlvHtIq0gGETqUtDj0e6JOIeKweJwN2uuKEbhduKIGzKs6N
Многоразовый флакон для духов/Атомайзер для духов в мешочке /атомайзер для антисептика/подарок,315 ₽,26 отзывов,"Завтра доставит Ozon, продавец GZ идеальные мелочи",https://www.ozon.ru/product/mnogorazovyy-flakon-dlya-duhov-atomayzer-dlya-duhov-v-meshochke-atomayzer-dlya-antiseptika-podarok-526743316/?asb=DmvCcRjoMJfh%252BUh3cwoUAwPmgZ2BhtiRENjLmWQ%252BeYU%253D&asb2=n_4PUSYaOipwu2TjiOf7vYtfDVcNloDKsVR2nRwDc--dMtNsQDMFXRdrmGUJjL-g
"Флакон-атомайзер выдвижной для духов с насадкой для перелива парфюмерии 10мл, цвет мраморный зелёный",380 ₽,164 отзыва,"Завтра доставит Ozon, продавец KOC",https://www.ozon.ru/product/flakon-atomayzer-vydvizhnoy-dlya-duhov-s-nasadkoy-dlya-pereliva-parfyumerii-10ml-tsvet-365435890/?asb=rCR3XGHgVDsLiSfnSh7aDMpPQovNKqtQ7jrql9ChegY%253D&asb2=KBocSHFOBVWvU3eKJ-JNp6OmN2MpNk7u9-8nC731p_4xZ4B7zEkmbZRL0vtsnqDE
"Флакон для масел 3 шт. EXCLUSIVE AROMAT 9 мл стеклянный с роликом, эфирные масла",322 ₽,51 отзыв,"Завтра доставит Ozon, продавец store kids",https://www.ozon.ru/product/flakon-dlya-masel-3-sht-exclusive-aromat-9-ml-steklyannyy-s-rolikom-efirnye-masla-286837779/?asb=9vjVfyWXnRzZV1NgiDUCbDeIJ%252Fhj5A1uRxXXGOWxXH%252B9KS4znfRouLXf3eMNpbPn&asb2=dw7R0TITBMvAVdYqmEpXV5h3agjwsf_kV1mkf3SQtMSlOKxdVUwGWGmC2so1LUAB5wsKm1qudrbWgsWXl7IEC4GCnWP0HZckd1XxJk2Z4WuVhPjaYsobsU_-oRuHed-qF7C8MMvMUtxn-9Bi2YISEw
Флакон атомайзер стеклянный 18 мл пустой,315 ₽,14 отзывов,"Завтра доставит Ozon, продавец JOYDI",https://www.ozon.ru/product/flakon-atomayzer-steklyannyy-18-ml-pustoy-402520582/?asb=Zb1FGvefIriT3LscD%252FA%252BtIDkctlhbRBPpqlNJHY2T%252FYI%252FXl%252FX3lLevzyh%252FTlX81h&asb2=wyDPVXBV1YQlMelJlnfFKo0jys8JZ4bmY3_VY2396YZ78AKeAvLe-VUFnFlPqqmvyKiP9acGomPd6Fq3ZTc05q7ABS9APT4v9II7pr6GCMWyke0aPjj71F2CHy4JiLn94H4YL8Boj4iipbgq2fC4LQ
"Флакон-атомайзер выдвижной для духов с насадкой для перелива парфюмерии 8мл, цвет пудровый",353 ₽,21 отзыв,"Завтра доставит Ozon, продавец KOC",https://www.ozon.ru/product/flakon-atomayzer-vydvizhnoy-dlya-duhov-s-nasadkoy-dlya-pereliva-parfyumerii-8ml-tsvet-pudrovyy-365468296/?asb=zz32ROOoHpBK8%252Bw2sNqFjp%252FpiRyiwUdth5GBw7xwC1I%253D&asb2=6nHqtLSdHUoGpf4JPd18oQ-Pt2UstESGHwl9pwVIowvSw8Roi31N98nytvsrhqrA
"Флакон-атомайзер выдвижной для духов с насадкой для перелива парфюмерии 10мл, цвет матовый чёрный с серебряной помпой",380 ₽,164 отзыва,"Завтра доставит Ozon, продавец KOC",https://www.ozon.ru/product/flakon-atomayzer-vydvizhnoy-dlya-duhov-s-nasadkoy-dlya-pereliva-parfyumerii-10ml-tsvet-matovyy-365426835/?asb=kpbXV8yz0rMJPcXKq2brbyO7k7oZw9gIyCy1d%252BMRa68%253D&asb2=4Wjc0pIW5EvPqc1KJw4newyHxd2smpVoGffxEk4yXffhx8k-hRKTXKqhJ0Bc7nH9
"Флакон для масел 3шт. EXCLUSIVE AROMAT 6мл стеклянный с роликом, эфирные масла",312 ₽,62 отзыва,"Завтра доставит Ozon, продавец store kids",https://www.ozon.ru/product/flakon-dlya-masel-3sht-exclusive-aromat-6ml-steklyannyy-s-rolikom-efirnye-masla-275492661/?asb=rwI4GAyLMNUeMEFyqWeALu8Rgc01p%252B8I2ViOPIz2d7tiGIwge17eaA%252F7u49%252BdLYh&asb2=EG-LlexxN9LnYKDYAvM91ozvIy3zDUX-2YMXlvF4zUPckSVwtJJ2RLfCKF-RCjv5U4x3cAN1eDKs7XHwyZRRjwkiNtTod_k1lplT40pttE3OYnKU813WB3jkS_YQo87NWpPodoMAMIYxUm9vHEbk_w
