"10шт! Флакон 10 мл ПЭТ с крышкой с пипеткой/набор для косметической упаковки/для эфирного масла/флакон для фармацевтической упаковки/бутылочка для хранения, с пипеткой/ набор 10 штук.",875 ₽,3 отзыва,"15 мая доставит Ozon, продавец 1000 ПОЛЕЗНЫХ МЕЛОЧЕЙ",https://www.ozon.ru/product/10sht-flakon-10-ml-pet-s-kryshkoy-s-pipetkoy-nabor-dlya-kosmeticheskoy-upakovki-dlya-efirnogo-masla-469555341/?advert=T9M8vfSn1utDmv0N0o82tl8hhpuUN1hjbrz-Cg6KvvTLq02RrZy-1jDlE5-DqiuBPGT955n8Vl17PhjwOPyS1KyBqveOT9aB5KMlZaoePNqOwd_b4pah4qm56h-Lh9g_kJ5y3UrEM6fzpJE2XoP5I4cM88dty0RZ20JJbVSXnMJoP8I0RSHVZETbccpvZy8bMM3139fEjpiT9ofeSnCrkin-j0ggo1zGR03Ip95q2oh1KlVRIVajhLacnOoWUEYLQmkfWfD_afxXlTk-TO_Ysmkq8ZyqJykQ28jk1Fz3kkg_Zv1K491oLecCQX-PIXocvDhdRyNwq5C8qTR-HgSc1U0XpFFPVS4oS57Y_FjRVjntRAIgR8RF0OWnr0CDMz7tVjIkqPf3bUvem-6c8jnB36ZI1fHPO7XUGvsTluzYxMBfYTg58d_EEj4KFLLtGYBdhgt7foUrYpSb-HSmi2FwxS0mUINTxVXGARuC_xu5Yt4yWJmhsZuN_NM2w0o1ivtd5_-gqi9sUeVBHiyXj3DZx-2eb-IQiFvQerl3iBRaeASyuWkeZJTlS_p3kGPc51aj
Бутылочки для путешествий / Дорожный набор пластиковых флаконов 9 предметов Stuffly,379 ₽,178 отзывов,"Завтра доставит Ozon, продавец Stuffly",https://www.ozon.ru/product/butylochki-dlya-puteshestviy-dorozhnyy-nabor-plastikovyh-flakonov-9-predmetov-stuffly-456694309/?asb=g4AHBIbrFMkGZOVWhf7lJRERoaENev3YgRzRMElaJBoCUIR%252Fsy7nywafA6jLQAs%252B&asb2=ZwMO7dM4js-xP6TANgx0DZMPTj5zqdceDV-5ANqV-nutZ_fXGc_uNp2voy-3fSoLPpwviSdSLxYAgDqfCyO2FFwuWwOrcRTEMsxnezrzSfjgYMDQR_Cl6NxIKj4Mh7qMqhOswNUEWY_71hV5YxLeyA
Бутылочки для путешествий / Дорожный набор пластиковых флаконов 9 предметов Stuffly,379 ₽,178 отзывов,"Завтра доставит Ozon, продавец Stuffly",https://www.ozon.ru/product/butylochki-dlya-puteshestviy-dorozhnyy-nabor-plastikovyh-flakonov-9-predmetov-stuffly-352788350/?asb=duIRAFcwSilWa46fhCdLZb%252BBF%252Bv3wMoEoDhlpLc8mTnkKEKpvtMm72JAuT%252Ff2P29&asb2=1JuEFdq2dTGCOpAVzruHq0bazTFHkuNV7opA8bxHigNT_g0wt5UsXqeL2cKYZsDerFkLSH5yNhPhQBPc7wM7B5RQxzVVSXXmyc1nTfX6G5RNVx5dkfED_KdnjdODWiYPAybasbmn4jYYnltOmSH3TA
Nail Perfet Пластиковый дозатор-помпа / диспенсер для жидкостей с нажимным механизмом 120 мл.,155 ₽,37 отзывов,"Завтра доставит Ozon, продавец Компания Виктори",https://www.ozon.ru/product/nail-perfet-plastikovyy-dozator-pompa-dispenser-dlya-zhidkostey-s-nazhimnym-mehanizmom-120-ml-313669895/?asb=Z4XDBtoI%252FI%252BCM9XhGpmFS2gFmwPh6AqykDckHXhi%252F8E%253D&asb2=YDMTpY1lKv09MjzJQroy7BUZ8CA6KyOKgezJ-py4939nx5jhcNdPYn2qkAs3nliM
Набор дорожных флаконов косметических 50 мл - 5 шт / Флакон косметический / Бутылочки в роддом,139 ₽,26 отзывов,"Завтра доставит Ozon, продавец Pixel light",https://www.ozon.ru/product/nabor-dorozhnyh-flakonov-kosmeticheskih-50-ml-5-sht-flakon-kosmeticheskiy-butylochki-v-roddom-518341751/?asb=0j9Dg4AirapEoqIaQzHN6Ky6lRqOjPoJKychkywZJGo%253D&asb2=-tzzUDJgjfn1qaGyyl-Qf4v7pmX7gdbVAx5UDmg5sMvcsyiTJtkWwYMv8vorKVQN
"Дорожный набор баночек флаконов для косметики, 3 предмета, голубой",248 ₽,2 отзыва,"Завтра доставит Ozon, продавец 4SeasonS",https://www.ozon.ru/product/dorozhnyy-nabor-banochek-flakonov-dlya-kosmetiki-3-predmeta-goluboy-484081962/?advert=ba2QUSaq9rFp6uOp0NJR4y1PJWQ-4Ef_znjkztWMsV5hIqQFwlJY1yM_jaDlN54eXWEaX7NTMtx8Ayi_DjCtN5Zyk8dr-SG1WugmBmdrq_3n9_vjnImbi8oV8jzJsgzqpSpETIwJQO4wcbdhW_kcVCec5beDFHbGTJPkG-Ein_sZwB-Pzvg3A0BxZtTLloT8KrgG9yXrqNFmdXE-SknPcrID-u9m9c2_dRccutebcgXtsvLP-KpmLWd4pcZ97y64acfrJ7AX7IIfuefuX1B6QZN47ERuvjfdTT7gyc34Uy3A7QzJ3P_B9lwVegxnOH9FNqVcymxwiH-vPnZImBxIFk40Fo-gI8gal4JMEmjtq-6wgiDQSTJIPfngtEPfdLFYYtSitmmMcNIsbD0WGx2-93G5_btdID7HXYSrMBO8OnCmyP5h3uM-ZYAhhE0K681tN6GW1KhLvnB3sZff398GgmxYwRIYXIFjdt9j34ByBjQqK6bz9rkraaTOw9abJxom6104jaf9-KLiG-XQw9CCcea22cVPZTd4XMKcgISA8lm_eZV13Rog6TPDEaeVZr5A
Набор дорожный флаконов 3 шт. 50 мл. и крышки флип-топ 3 шт.,119 ₽,23 отзыва,"Завтра доставит Ozon, продавец For U",https://www.ozon.ru/product/nabor-dorozhnyy-flakonov-3-sht-50-ml-i-kryshki-flip-top-3-sht-533466568/?asb=VDjpvKZ4nvsY%252FQoQhOhe91idosNTf3Yf2hbBy3q1aPMQzgl03pwA%252BUV7RkxEHzkQ&asb2=5ir-pUMgjlm7nOI3KcJ_8YVqVAKhpQkqh7CHV2ZWa-_7BVegegKwpEOROhjKmWhuUdgi96OlL32DyUsAR5lv02qGsMQ3fqZcbjxMo0GgZ_Bn0dmdJadKeYC-tqAHpxC1JzM175aUNSVD5rxj_d5b6w
"Набор контейнеров для косметики ЮниLook, 6 предметов, 2 цвета",263 ₽,84 отзыва,"Завтра доставит Ozon, продавец 4SeasonS",https://www.ozon.ru/product/nabor-konteynerov-dlya-kosmetiki-yunilook-6-predmetov-2-tsveta-389929316/?asb=no0cmSs6hD8Ukpamf37ffgTvd9ATO1JXVn9XP7UNFbiKh8qBzXRklg957FPiETos&asb2=LdvkLM5mr4kiGK-M-XIj13okSC8U6aHQkSW53Jm979T0cwgMmfw7QwwXebCIptu59uMtj2XJmEReUyjqQFlzJk3l6n8L9urwvf5N1J3mn73IIpMb_zwShoxjpmZb_2DGu_uQ5vqGBApsiFcqcC64Vg
Дорожный набор / Флаконы дорожные 4 шт по 100 мл / Дорожный набор баночек для путешествий,167 ₽,82 отзыва,"Завтра доставит Ozon, продавец ЭтоСмарт",https://www.ozon.ru/product/dorozhnyy-nabor-flakony-dorozhnye-4-sht-po-100-ml-dorozhnyy-nabor-banochek-dlya-puteshestviy-366842094/?asb=enxVhYFj0vztXyZKzG%252FXuA0mnAlJkNmjUASGNPgqoXbmDQm6Qp2PsiaNx8hKQ%252BCl&asb2=Ar_l6zc2hqOmt3KoYz3KqSC8hP8fKWWJJrVy2oKDzhIkF9YT9y4TU9T87ge5WOr1E4RzsuJ5uAQq8IahMb4SRTUus7abvji2_nolTJSsfm3FSeVQbJIo-qIQBAHmtcty4jBA7fuOhcUULLomHrW1ow
Комплект насадок и парфюмерных воронок для наполнения атомайзеров и разборных флаконов для духов,199 ₽,67 отзывов,"Завтра доставит Ozon, продавец Mea LifeStyle",https://www.ozon.ru/product/komplekt-nasadok-i-parfyumernyh-voronok-dlya-napolneniya-atomayzerov-i-razbornyh-flakonov-dlya-duhov-298351740/?asb=tWW7InMdVnqhOzFuHNqL1EwQK1KXoeXaXDzVJqq1wenDzROb%252FUkJsXNks%252BHuHb7R&asb2=1zCBj252GURrDBOul5B1aBtAKnya2KWzhH_nh2OuZh-ojrst-VBW5tqd978BObdgd7CNTVDJ1s1CA1JBlhPXFB0eRAE9eom77PWPwUYK4i9eiLYVmolZelvjr5hhutW1SAjZ_kS_EU227VffoDL1ow
"Дорожный набор флаконов с распылителем 2шт по 100 мл, флакон спрей прозрачный для косметических средств",126 ₽,20 отзывов,"Завтра доставит Ozon, продавец For U",https://www.ozon.ru/product/dorozhnyy-nabor-flakonov-s-raspylitelem-2sht-po-100-ml-flakon-sprey-prozrachnyy-dlya-533463729/?advert=T1vr4cwMwaY1g7rBV8NLbOz847ynZSnZdWaxYj3EADrGjkafH7GycuCzJan7w8ucHMxtlScU54xU_uXqUq5DdceM_dgIG-QwEvDb8mFW4IRqUHrEdwv3BnRSFJ2yQijYj6C4HDLAGdbMpeSJOYdLbrF6CFvotw8yAXhzJfFHkyjPJgaNoBCHZG2Nk7CctaFchctMbsUHRDHjsRgWB5wBcK2nRa_W-Z-Augh3aIuu9FjSSny1e3_IDsaIQlZu9-SImBqUt2mkd0p_wcsUHRnYZQKPoDRGDeqt7bBB6QEhxF3JWaHnMYIpM72pMxktt66BZ1E8Y18tNJQAXhi9Nnwn9oovv8iv8PoHYYpELJzL1rcKRyM9F04TeXn5-jnGdadwfgjRIsocOFgXx4q8T8gRfHq9jvWDU3xE_UjcRm3TCXGeu0OT4ChsZ8c0lFLp9ZPN7Rjy-DwRX8ahuQdRGkv_pLbVrASfUPLrLP0J3t-7fqMDWkNnk5CGDCmthTEs6gI2kbDkGezLIZWeEkak16NpQs2Q-F1OloOXf01CB8kJgd_hwTVKIwpaSHKIYjcbJl1I
"Дорожный набор контейнеров для косметики, набор для хранения в чехле, HESOYO, белый",249 ₽,17 отзывов,"Завтра доставит Ozon, продавец Miango",https://www.ozon.ru/product/dorozhnyy-nabor-konteynerov-dlya-kosmetiki-nabor-dlya-hraneniya-v-chehle-hesoyo-belyy-524407358/?asb=knIfAJlktDnuThGZ%252Bly7pY0I0MKKrKHUyrb91JJY00c%253D&asb2=7wEAtvKLx1O4W0-LWuXxmp_L2Y-fxHSLq8EoQmF4dq1zWo_qZ-G7jN2B1UowsfTy
Бутылочки для путешествий / Дорожный набор силиконовых флаконов 4 штуки - 60 и 90 мл Stuffly,743 ₽,59 отзывов,"Завтра доставит Ozon, продавец Stuffly",https://www.ozon.ru/product/butylochki-dlya-puteshestviy-dorozhnyy-nabor-silikonovyh-flakonov-4-shtuki-60-i-90-ml-stuffly-352561272/?asb=DFkBywTPEzWqVqVueHeCH1wJvUQOst4Uip9Gtb2J7xnBb%252BpzpnUAzmTwYjg%252FlcWl&asb2=8vaLtZk7XAPT5xVu0e6j6Aac-GpHSIuyL51YOe9vexfRPHS1HBnNu0Cu1ro0gXFB2RzWUZXNrT2_U_CYTAQ-rOT_L-ZmFabsgwZOGaeAyGiXOQ50cH4LQODKgl32FcAmNTUWlAbV4hn8fT-s7ghJUg
"Набор дорожных пустых флаконов для путешествий, косметики, антисептика и любых жидкостей по 2 шт. по 100 мл",95 ₽,46 отзывов,"Завтра доставит Ozon, продавец ООО ""Хендэль""",https://www.ozon.ru/product/nabor-dorozhnyh-pustyh-flakonov-dlya-puteshestviy-kosmetiki-antiseptika-i-lyubyh-zhidkostey-po-2-378807900/?asb=GzMlDcqGYUuD1v7w4%252BRrcwBTwCBRbGBZmclOAfrlhLPUtQMKOYtlWaF8UfrzsPV0&asb2=bk8C7WWBz53iarkVhLzXNOzccMIrM2BOKk5bGiTLytvKZijtpP1YC47_9QLzu0Jzsd4hmotLI8u3Nf6ANrYGKw1auZZtrs8xc6JhmkOYkYwu5dY9uUURuz6bNh31kR5F
"Дорожный набор для косметики BEATYCOLOR 9 предметов, баночки для косметики, розовый",235 ₽,156 отзывов,"Завтра доставит Ozon, продавец be Happy",https://www.ozon.ru/product/dorozhnyy-nabor-dlya-kosmetiki-beatycolor-9-predmetov-banochki-dlya-kosmetiki-rozovyy-295253960/?asb=xyV5eQ5L8jVU6M0L8HmSdBDmdnFaQkzNukyT1IsFVOZxxVaYbnpOm9fgQOlNVcCS&asb2=W0OUEdpimJQceBjPLJrajkSFTUpUBYWBndvITN5A6GiQsO0EnmzOtO6JVDSE5gll-gCB39hVBpx-Xk2FtSsG4E_ykKLLqqicQR5pFODb7zmPTtCKwVyIBIZxBTqjHBDn8auQAiplInxPIWGCLHe6_w
Тюбик для косметических средств,143 ₽,9 отзывов,"9 мая доставит Ozon, продавец EXIMG",https://www.ozon.ru/product/tyubik-dlya-kosmeticheskih-sredstv-217449412/?advert=TC2qfXNhrguTH8BzQ6y7bErtmuI5SdsFdA-cwUByD7E_C4fx2ns3CvuJW5vMKxRp0LDuTmHEfSuzDqpKM0u6U94KxVrMKYS5njjIfxGBpyje-Xw2iio-69fwFGTGykIgljkfDZyRwgrU3tsuxcRRP331RstrU9HdR0mv7Ehu6Qk4q2J_bJnhHpAapMvLypSB4jEhXc1jD0v5EmaLBXpBXARcIcD3U0jgFnpIUIiEZWKZ6qI7l171N4ZJph2nFN1KWg3LumQPMhA0uXGUEhX9QzuY8M0FHAfWK1Xi1Wxj-Bhb_tEP8k_wquIU3JCMfgqWeQc6rdvXi6XSA4vXpepDDdY1BIYMgpMgM1Tq35ZufqbYfflYGgR2wdbaansyaMLHNByJTfALOgC-MphBdaiSOu1fBJSLcVyvcZt5CfQyOx_i98-dO1BjYou7isAhJcZzUgsUzYn6cH3QidnWVRB9neCXVce65H822_HXagAGXrNVPz2J-WdWJpR90NVd3Jmq_suyIz3EMGc3Fepev-Uis8jB0Nir0rPJ0D4rf53_QEUry1lmfIBw8lZrMLGr5cS4
"Пенообразователь для косметики, бутылка-пенообразователь, флакон косметический с пенообразователем",181 ₽,27 отзывов,"Завтра доставит Ozon, продавец MELSON SHOP",https://www.ozon.ru/product/penoobrazovatel-dlya-kosmetiki-butylka-penoobrazovatel-flakon-kosmeticheskiy-s-penoobrazovatelem-486086530/?asb=1eYtiN3H%252FoNybEQbZCUow1AhOAbZyr6kt1UHV%252Fq%252BE6X7l6azzf5aKYVBeo%252FH7oqi&asb2=NACORM64OU-slTmKMBhlAvdZOWiikg4dJN7GLQJEYOqfy1-J5n7b0MX_QVO-Jej0xE9RHZR70mGlsnrtlCpjMjzsNCha0ZQja__yeN-k8Cqelt6J6THadYAxVVC7jhdwX8U0wSQSPmKtsXlXDcSh4Q
Дорожный набор флаконов для путешествий в косметичке для отпуска серый в футляре / командировка/ для роддома / косметические баночки для поездки в контейнере / 8 предметов для спортзала / пластиковые бутылочки /фитнес,365 ₽,30 отзывов,"Завтра доставит Ozon, продавец LALOSHOP",https://www.ozon.ru/product/dorozhnyy-nabor-flakonov-dlya-puteshestviy-v-kosmetichke-dlya-otpuska-seryy-v-futlyare-461263949/?asb=YXdjG5YlCHQVXrJFbLg8nANspokSt3AvrTXfXBbyi%252Ffh02Pixbb5lHhyfDJ%252FWcWn&asb2=VL_EG0taLXj2bcmOvY-Rhamh2DhqDWbMgsGhhdLMIfxcaj0TGgsgdnmLfkbM2IZTk0lzYJwFGn2YByVeRDf_kwihx2qdAWuVPf4nW9t_v9cqFgN4hmKu7TB-aHhw0L45WePO8JZbo7RgtAk4WIVReQ
"Selective Professional. Оригинальная помпа - дозатор для бутылок 1000мл, на средства для волос линии ARTISTIC FLAIR",148 ₽,134 отзыва,"Завтра доставит Ozon, продавец Eternita",https://www.ozon.ru/product/selective-professional-originalnaya-pompa-dozator-dlya-butylok-1000ml-linii-artistic-flair-179626622/?asb=4b5XvdrxJvnIXVkBWtab6E%252F%252FoEYGuYBKg8xkXyPgmSE%253D&asb2=im5RQZfeckn0SkMxbgoAXu4zxDtSOBAKcfrxFmvre-Sprm-r5FwUgK9X4vrPw_r-
"Дорожный набор для косметики BEATYCOLOR 9 предметов, баночки для косметики, белый",235 ₽,156 отзывов,"Завтра доставит Ozon, продавец be Happy",https://www.ozon.ru/product/dorozhnyy-nabor-dlya-kosmetiki-beatycolor-9-predmetov-banochki-dlya-kosmetiki-belyy-295127157/?asb=g2tm%252BHvM3IcyECYiMPynosHUiwxzZ4hJ94IykDAzrv79wdEoe58q5Gmc8Bqw9OR%252F&asb2=rnf78CDqGcEaB_OShmmshks-hkNprYkTnklq8j2ITmQJk2Fd48x85Ld3ZXjvjBMKgMWBCVxDjgOcBIJKB3Wj-BfAoWYHP0Av9Bw5ZedyTylWe5iY7f2v-Q3FIO8LtcC-RRLRPMXTGtyB-HWySEXqxA
Набор для крема 3 предмета,177 ₽,28 отзывов,"9 мая доставит Ozon, продавец EXIMG",https://www.ozon.ru/product/nabor-dlya-krema-3-predmeta-206571090/?advert=HzctHSUAiP_a2q3RU20cTgnJVC54s4znD6UPD1lg1UvBVbwo7XcdBqIHLdfT8Bw9gQf0Eso9qavOYmrDppRijmhY3z9DvzxEjEHWNDC5lL1wO21Os7F5IZ8qbLjBK-mWKXCs-ZlBzIIBKKXREY3A632Wv8t436v46xvM-VEeuC0jf6rrcmHC36KDyOsyfh8dZtko8hjhvSE7DZu_8WwqFNERvt_V8vIJ4vxynObad8AMhnO_EZKAAnTsjTUZoevr7L8yLdHIM6oOP5we4BHLU1PHaDdHqvlIyRQluVHM32tNCba7pE5V9dUdsnPypBg_5OhcTv7F4u955UWyH7BzgVqDqR3nJYZtv-YURONnNVR1fzpFfjq5ftbzBpB8CEJsp5AFwevsAxMLraSajnvN0muhQ5lXFbn-yD8zibDUoOl5jGGluer13sja_zUQTPXb6IH9XPBD-ce_MlQuIqDeg9VIqQQ-UFFR0ReyO1hkAWiVaxmBBLyMYFsvpXxAat8mxPrr2_2buDjOyc_bk2rONPzskxLbp9oO4yqqj_6qQODpii7cqZyDOBtzw9LyqNjP
"Набор контейнеров для косметики, 6 предметов, дорожный набор флаконов",263 ₽,84 отзыва,"Завтра доставит Ozon, продавец 4SeasonS",https://www.ozon.ru/product/nabor-konteynerov-dlya-kosmetiki-6-predmetov-dorozhnyy-nabor-flakonov-389940614/?asb=19HRoK%252FXmj9ThVAEoUWxwYKb4qhBRpxDZrEB0jAj%252FLt%252B%252BT%252FTiASMgsKFfH%252FO0xSo&asb2=3No7dwh1VjWySzXjiHMSTGIw1Ikxn7S832LdtOnNY_J8SjnxKgdCnFILZ8asi4nXpA1toB0dZ18sWlnhpGrrEf2PMyUh5ACB9bzmhy2ZULwhmDJHbupMYg0pG-9z4wkDpDEipY1yO94DedDMXh7GOg
"Флакон дорожный / флакон пустой / флакон с распылителем / флакон косметический / флакон для путешествий / флакон в самолет Yanmax, 50 мл",108 ₽,14 отзывов,"Завтра доставит Ozon, продавец YANMAX",https://www.ozon.ru/product/flakon-dorozhnyy-flakon-pustoy-flakon-s-raspylitelem-flakon-kosmeticheskiy-flakon-dlya-puteshestviy-385299864/?asb=F1NvSV%252FCFDicjEhmPMsS2XZ23DTIa%252BqKAQ5lYhRMFz0%253D&asb2=-90ms4aPU34Ehx96yi4O1kjA0Usdz9mqQdOQWgB4PQaUXDNiJ7j8cULD8Oac9am6
"Дозатор Итальянский винтовой для жидкого мыла, Насос-дозатор для жидкости механический для масла, шампуня, молочной ванны, антисептика, мыла, 1000 мл, 3 шт",190 ₽,24 отзыва,"Завтра доставит Ozon, продавец ИП Мещанов Глеб Олегович",https://www.ozon.ru/product/dozator-italyanskiy-vintovoy-dlya-zhidkogo-myla-nasos-dozator-dlya-zhidkosti-mehanicheskiy-dlya-448765979/?asb=tr%252BSiiVP7MtwneKLAX53d35654b35gdLwxrn4pg0C9Ty7CcZZdF9CINX5Wl%252BzKbG&asb2=Ii-tAergzjIIGJcV-ZVB9iNZaKXe6Vw5OPHGoyCOPPhkjmurSdRnvWfd1i99Y9d7Kg81VHIs0fVQzIS02jYbcdG1obHARX6-cLXBvuQO0dRxsXfGBVNzZ0YSHCG5YpmfQ9K3tp7aLYydcyGnR7fABg
"Флакон с распылителем, дозатором, пульверизатор 75 мл.",117 ₽,70 отзывов,"Завтра доставит Ozon, продавец ООО ""Фотон""",https://www.ozon.ru/product/flakon-s-raspylitelem-dozatorom-pulverizator-75-ml-278355763/?asb=uvLHl1KccFGcmzsQNsBjQ0XmM%252FUOgk2hjeGZ7BlegZI%253D&asb2=XwLwU4sIiq9rVkR6Y6L-3NrOe4jJMuGBx6XEd0Cu5-ARGT2-2KN2r1iRWwak1Dq3
Бутылочки для косметических средств,307 ₽,10 отзывов,"9 мая доставит Ozon, продавец EXIMG",https://www.ozon.ru/product/butylochki-dlya-kosmeticheskih-sredstv-217451492/?advert=UvSNTlS4De9xO5Ap67WFZDKBDrveyxA4c2xbmsgaEJgh2a7IhhIu3AGf7gSCYFbTFeGLCx9A8IhsSI6jRS8HGM49fLOq-CRsQUQPLJ206o2yl_ogkf2W_PCmZqHYXShTNakmMQ5Glt7lB3yVcznwWJKIaLaLrUO39jlxmpChfB1kni9AVre83fzJmIhmYIsbwjIxQLBE65BLqkUIm1qfemgRmf8Z-3mK38uXu1DK4IfUG4BCmblnx_KIKkn9fFXaSVo6l6GpnfEN7ggGGFm8faPR90B95KfV_HkEk2QPiQS50Uy-7bj27AzrtPIHnkL_7d-3kmqtGSp2MaRDTUWhWLVWitK4WB1LUhFOnUW-j0fGSpUhw8upFbbeu4QUqzWuKdaHDbJf7QBHgjqU1BG3LkXItyveLeQSzK3VKbPsVLILIZLrzZNJpbeJlDDiIQyynqJDsDp67ZesqJn-Pgxeqly-YpyZ8HtrtarIuv6u_99EqUlT0YlOCPOlFolnv0RNrN27dQM5-cUSGBd40COm0AKjgGoTmVfK--hGSA7bFsobraTBJVlQ4IrM4jjS_9aM
"Набор контейнеров для хранения и перевозки косметики с собой, дорожный набор флаконов для косметики в поездки и путешествия, 6 предметов емкостей с распылителем дозатором для антисептика, масла, 3шт 10мл, 1шт 30мл, 1шт 40мл, 1шт 50мл, туристический, ЮниLo",317 ₽,137 отзывов,"Завтра доставит Ozon, продавец МП ТРЕЙД",https://www.ozon.ru/product/nabor-konteynerov-dlya-hraneniya-i-perevozki-kosmetiki-s-soboy-dorozhnyy-nabor-flakonov-dlya-335212965/?asb=MiQTK9554lvctjAfEHniU1HvSpnDd1FsneDM0Zq6rVpHg%252FdH0eTqoEaNDI1NNZRe&asb2=nk54yp05SjIkksPtkKh74yGEXOLwGdsueK9KaV61Gqpy8DKhSxBBe12567kJ66Yna-XknVtQGJPsNU0Czwe_RKcXqY_RQI--IREXT_LPur2yqBf6_IOqmPr2dWB5usdRkpbYaVmzen1iU0PjEanLCw
"Дорожный набор контейнеров для косметики, набор для хранения в чехле, HESOYO, розовый",239 ₽,17 отзывов,"Завтра доставит Ozon, продавец Miango",https://www.ozon.ru/product/dorozhnyy-nabor-konteynerov-dlya-kosmetiki-nabor-dlya-hraneniya-v-chehle-hesoyo-rozovyy-524407501/?asb=Guj0dMD8JgdV1x62KKIQMYB22nMygQ4qvvrnpRWqgGw%253D&asb2=BWD-KdwcsetCFA-EzKdrMmichHOZo78a_bA8Tn4zXrkGm9gq8SKxpDpQ-BrKYwvE
"Набор контейнеров для хранения и перевозки косметики с собой, дорожный набор флаконов для косметики в поездки и путешествия, 6 предметов емкостей с распылителем дозатором для антисептика, масла, 3шт 10мл, 1шт 30мл, 1шт 40мл, 1шт 50мл, туристический, ЮниLo",317 ₽,137 отзывов,"Завтра доставит Ozon, продавец МП ТРЕЙД",https://www.ozon.ru/product/nabor-konteynerov-dlya-hraneniya-i-perevozki-kosmetiki-s-soboy-dorozhnyy-nabor-flakonov-dlya-335221068/?asb=y%252FL1bIQGrbxPW8EB871WR8Y7LiiYaX3kK5z0azH920sJkDVJrURNW7v1wvEQJwCW&asb2=wOmpNkZ8aCJCphAdizIVsLSMEkiaOlJT7zrag4TOW7f90OjDqC-_-btzmh2NYdSVzETACkarPiAKfOceqiSRqhuZ-HdAB7R13DtdHHERtSyhWDemgU3ahsrWivAgV_MuBaLaY-0q3V1LFDpKZ9vlJA
"Дорожный набор флаконов для путешествий в косметичке, набор баночек для косметики, 9 предметов",349 ₽,2 отзыва,"Завтра доставит Ozon, продавец Нужные товары",https://www.ozon.ru/product/dorozhnyy-nabor-flakonov-dlya-puteshestviy-v-kosmetichke-nabor-banochek-dlya-kosmetiki-9-predmetov-552465638/?asb=OweX0WenCURFMY5rG7mL1I6qP2YiB1ESe9UMD09nXG3OWNZtgW5PLcF8ChgBds0t&asb2=PO1cMtGMx4ahgUVcw9zYB4B1r2QmFDqJK6G-lJwKU6HAJTvYXebRM3YA5TeU0PaxfRRScRRjOrd30z_QDoJwVPJqDGP_hoYAnehHLjcd0Lsh-yPC1rEVaQOvoEbGMFcSKGuQ8Zo--wW3iDgNHbZC3A
Дорожный набор для косметики 3 предмета,273 ₽,1 отзыв,"9 мая доставит Ozon, продавец EXIMG",https://www.ozon.ru/product/dorozhnyy-nabor-dlya-kosmetiki-3-predmeta-205888301/?advert=qelBnoxbJNvApy8ghtAs4tpuOl0Ss5J3JsnkORSnMyfiBrkUS6dEshuhmeWe7hAcFpUP9VCKhe7cSM0Rb4-nmojZHozDIBqxqAxY1H94p4VWZlA8bsqkqWmjquODqviisj_aMWzCVzdzDVzl_eyn_g34qhc8mFSTNJGWvwsLl7jkNpnL-AwtpuOWGgTptjarNLVKIJad3UGbplLlk4WpUuqOclOgdAktoTL78v-vUr-ulfLMIL2icpeRq1AHv0Xm8fw5AHCjrw75CkD4wnnJ0clGQ72jhAQKYAljFDQN2W9pF82gibKOXyDoX0rXssTivDEbKsJMhadbapkIm4qWRUgwJ0ZmbW48pjMBhGOrw8Uaft3ZDldK1XV86Z__1cJHZVMEuGcGBC33SpvmCauXcHHqA1mwSH5_03ikKp0TuavdA4dpMDCvZVTTL6J9vkFw-ZS7IpoFL5zpngnGX24x2GICPV-v7dVHdV98FHFYpkEp1Ar31csgSymJjNEzZZb8SW3i6t8qu5LvQnxtt-Hc6R30BPLx_h5H6X53kGwRn_zAJbdPsG1RCefkj_DPbsMc
"Набор 2 баночки + шпатель 15 мл/Набор контейнеров для хранения и перевозки косметики с собой, дорожный набор флаконов для косметики в поездки и путешествия/ баночка для крема",174 ₽,3 отзыва,"Завтра доставит Ozon, продавец Чистовье",https://www.ozon.ru/product/nabor-2-banochki-shpatel-15-ml-nabor-konteynerov-dlya-hraneniya-i-perevozki-kosmetiki-s-soboy-496365087/?asb=70RvoOGTbx961OcA1iNuajffna5hkV%252BfMhRinMsEFoY%253D&asb2=5rkv3b1MufKW1copi69ufwleTsTVxuXIE3PJgZ8H2IVzoubOZAqV3XzM1IqT-ufI
DECO. Набор дорожных флаконов для кремов и косметики (glow dream) 3 шт,142 ₽,30 отзывов,"Завтра доставит Ozon, продавец сеть ""Подружка""",https://www.ozon.ru/product/deco-nabor-dorozhnyh-flakonov-dlya-kremov-i-kosmetiki-glow-dream-3-sht-370618728/?asb=34%252BOIimAQuDFT3dTJVkgGJUMxz76KUKu840LqgUnAIA%253D&asb2=SaGka7Q7bsUZLTY2yjfvydzRSX1AickuTTVIS-2WXPZ0xQaZltluXdHEsxfzWRj_
"Спрей-насадка для перелива духов/создания отливантов, набор 5 штук",187 ₽,39 отзывов,"Завтра доставит Ozon, продавец KOC",https://www.ozon.ru/product/sprey-nasadka-dlya-pereliva-duhov-sozdaniya-otlivantov-nabor-5-shtuk-366934507/?asb=iGf2qj2fQqxlAzUKYZJGBMswRlzJGZmRzQGjtq1BUsw%253D&asb2=HFMlbrEw5uq2OMR3HbuELjohi8cX7YofoHhewScrg-b0v9BbKkUivi826ZxStAzw
"Флакон стеклянный 30 мл., 3шт. Флакон с пипеткой дозатором, Пустой флакон коричневый, Флакон косметический, Флакон дорожный",351 ₽,33 отзыва,"Завтра доставит Ozon, продавец Badaboum Cosmetics",https://www.ozon.ru/product/flakon-steklyannyy-30-ml-3sht-flakon-s-pipetkoy-dozatorom-pustoy-flakon-korichnevyy-477161395/?asb=5kisG3EyRieQy%252B49Et%252BkrWK2fI%252FNcTaAPEAXNyA6G%252B7jfP8ooQXaRn9Dak7%252BGZU3&asb2=kF4G0SP8XgZi_rrDVQoc5VBsSPT3cdypozvHE76QpGz9NXwhs0Xodkcv6jMTUdNXVHx7M3N7b4nU9teIy3844NBa5Z-uXvxqy1Sa2_RjIunbq0jnMwyPqULlH4QAV320MK7Q3jPLCECBymZTmtem4g
Дорожный набор косметических флаконов для путешествий в косметичке для отпуска черный в футляре / командировка/ для роддома / косметические баночки для поездки в контейнере / 8 предметов для спортзала / пластиковые бутылочки /фитнес,330 ₽,30 отзывов,"Завтра доставит Ozon, продавец LALOSHOP",https://www.ozon.ru/product/dorozhnyy-nabor-kosmeticheskih-flakonov-dlya-puteshestviy-v-kosmetichke-dlya-otpuska-chernyy-461264032/?asb=37csYbyPjGxJX%252Fsro6kHmScwdCsQQaXkBILC2pVNGgB2MhAsWSJE48AnR7OiL3Gk&asb2=7BUxlwYhW-qaga4l3wL4ltfVZpNerNBLnDWon5Bl4zSwasVjpPLw7tgZuS0pBP8CIX4sUkNGUi73zqYvWrwOg95cSeyk8sxkxhF9PT_nde7thRzEoI7yP7a3e9xccTqRW0c2KfL_ciVa4GqO-FQw9A
