"Черный / Брелок метка / ""Умный"" брелок / Брелок ключей / Брелок локатор / Трекер антипотеряшка / Брелок для животных / Брелок Bluetooth-трекер / Брелок с защитой от потери / Брелок для собак, кошек / Для чемодана и сумки / Детский трекер искатель",336 ₽,16 отзывов,"Завтра доставит Ozon, продавец Хит и Хайп",https://www.ozon.ru/product/chernyy-brelok-metka-umnyy-brelok-brelok-klyuchey-brelok-lokator-treker-antipoteryashka-brelok-dlya-452718868/?asb=qnVOveH4qN5w%252FxZGk5UeNMPHxKK0l2uHdnT9PT26BEiD4m%252Fd3tmfSSfxAPbHvOG8&asb2=fRHyqI31qyS9a4V5PtWyfg3IvHMWqNCymjA-rNrAo6Q4ajYbhKqNkdwlamWu8sZkupvT_B9yIdryI-10AQICnUQyqLwzM9hNJADs7x1pZCdiqJMEjB2sBomaK3LrpL2A-JSe-ll9mZqo9HHnaUYy_Q
Брелок для ключей / Брелок локатор / Bluetooth брелок / Подарок / Брелок со звуком,365 ₽,23 отзыва,"Завтра доставит Ozon, продавец EcoPro",https://www.ozon.ru/product/brelok-dlya-klyuchey-brelok-lokator-bluetooth-brelok-podarok-brelok-so-zvukom-283884023/?asb=LrctrMLiLlc3fJezKN0R4ovuAKBgvxWT0hcXbcBnFhBZaOLDssolWj8T5AVh4l9l&asb2=P_xQqGd_JkUnsQyeE9lQv1tls7awdBMgDUylNNZDPe52gdFKJnYwK4tu9QMB5HmS_Jce1eVXlaK-isY2DNx0aLx6ikmGfc7XbuJmz_nMzg_cMMNRZEBpdEPBDnKkgePXruJg9w51q25GobOfuZvVqw
"GPS трекер / брелок метка / трекер для собак / трекер для кошек / искатель для детей, домашних животных / Bluetooth брелок для вещей / кнопка для селфи / пульт для селфи / запись голоса",599 ₽,52 отзыва,"Завтра доставит Ozon, продавец WorldZone",https://www.ozon.ru/product/gps-treker-brelok-metka-treker-dlya-sobak-treker-dlya-koshek-iskatel-dlya-detey-domashnih-zhivotnyh-360518079/?asb=NLkmhxHvPLE80OGAoDsGbeAOtUSLnkE6uKFEhrORO9ZmSt7AMMjaAKWjvH36fnHs&asb2=gJ2Z58I6viFqqADSNdFTsYGkyEHZPVwZ56ttc_6FrckjCzcsSOTjgydC5mA2DwUpgUEqW7Jz2imUtCxsEA7P8H3xCzCmzwkECrphmfjcKoCob3M7O3c6XEtlTMzae5jw7s9MtzaNa4oQmJeKSm-wxQ
Глушилка gps глонасс / Подавитель GPS / Глонасс / Платон сигнала (глушилка) антенны,659 ₽,75 отзывов,"Завтра доставит Ozon, продавец Well Market",https://www.ozon.ru/product/glushilka-gps-glonass-podavitel-gps-glonass-platon-signala-glushilka-antenny-309840781/?asb=3ey95Fw79%252BPt6t%252FeeXvJ%252FFHPUFjCWDSs6UkdXpcpq84%253D&asb2=fEaHbhZ-F3hyODqzUJ9tk639RR_Pud5EBZSiyJhtOOlfFsUixRCBkmnBQ0EE_qWj
"Gps трекер, Брелок для ключей зеленый, брелок локатор, Bluetooth брелок, брелок со звуком, с защитой от потери, для собак, кошек, ключей, кошельков, чемоданов, сумок, детские трекеры",476 ₽,19 отзывов,"Завтра доставит Ozon, продавец Пионер",https://www.ozon.ru/product/gps-treker-brelok-dlya-klyuchey-zelenyy-brelok-lokator-bluetooth-brelok-brelok-so-zvukom-s-523720173/?asb=wbwcbDK9OQ62Mn3B%252B3jjSOtRsYrY8ylIuwxyp6jPloBNMYA%252Fa2ad0IjYW27vEUcg&asb2=wo1OyxT2KPf-Kauzm1QveHL5qEe710Z11UyAXE3x6rrOCtslzocETIY6I_s9fNS5aLF9dXyzSC3fZd4d9bbm9HNxQelav_RwQWMdhHWq5GWhKNz9PrQ44B7Am5AHNIAS
"Gps трекер, Брелок для ключей черный, брелок локатор, Bluetooth брелок, брелок со звуком, с защитой от потери, для собак, кошек, ключей, кошельков, чемоданов, сумок, детские трекеры",497 ₽,19 отзывов,"6 мая доставит Ozon, продавец Пионер",https://www.ozon.ru/product/gps-treker-brelok-dlya-klyuchey-chernyy-brelok-lokator-bluetooth-brelok-brelok-so-zvukom-s-545568748/?asb=2amW%252Fl5Sn%252BFod6kLD%252FObyTr5TfYyJlc51LzKj9gakdpK%252Bh5t%252BsfRZLWxb4bPUwmM&asb2=Qs-CXWfHF7Pq7qUzYLTT77DQCXVOnv0N9czX3hwv60oATxfWVR46NQvOFr-qwPHBiX_BJzRLLrtzdpZTL_vQYw5QGEDMP4rLC6j-GIWCX9RRnb7qQ1Key0nQJK-QqbHommGHC3bjap0AjXJdciawlg
"Gps трекер, брелок. Двухсторонняя сигнализация . Джипс брелок для ключей",350 ₽,6 отзывов,"Завтра доставит Ozon, продавец Marvin",https://www.ozon.ru/product/gps-treker-brelok-dvuhstoronnyaya-signalizatsiya-dzhips-brelok-dlya-klyuchey-271981497/?asb=YvGqfIrZSBcXJEh8IxI20NjXYXfXIBuySfLZj5rkSI8%253D&asb2=2lAGsgLB0fXgObIfu6u-8kzfI0HAO6m334swvLdCecbkFJOowXj_fYEjSxQCLkJZ
Глушилка gps глонасс / Подавитель GPS / Платон сигнала антенны,690 ₽,10 отзывов,"6 мая доставит Ozon, продавец Мир Репитеров",https://www.ozon.ru/product/glushilka-gps-glonass-podavitel-gps-platon-signala-antenny-475227619/?asb=H6GuNYX0GpxknKoOVGDDc5Vnoxd1CFv2fnpMpcMS%252FcjT1I7qBe1oLJ0X0ifw3E%252FN&asb2=wPGiMVKs-syjA9PCVAK3O1lhCewDoAATSDfA2gmAv8QnnKJUaScV4_5dMa8VUWROEoNDVlSS7ZVGRVTh26B5bZQODL3Mn7P4DWc1vf3lGD3oGNdpQRv_xKJjGCt6WYjjv2wBMTA5HmusjFgnjSzrIQ
"GPS трекер, брелок. Двухсторонняя сигнализация анти-потеря ba",299 ₽,3 отзыва,"Завтра доставит Ozon, продавец Marvin",https://www.ozon.ru/product/gps-treker-brelok-dvuhstoronnyaya-signalizatsiya-anti-poterya-ba-268516383/?asb=7hNVBzJO6AkbcbaaYpqjMsLQdKj4dJiwEpb9ojf%252B5dY%253D&asb2=xkdCXcT8YzZY3U6545u-htJzWy0jORf-lwXF9dPf8vQvYhl8Ls6g6dsw8GX4SCO3
"Gps трекер, Брелок для ключей голубой, брелок локатор, Bluetooth брелок, брелок со звуком, с защитой от потери, для собак, кошек, ключей, кошельков, чемоданов, сумок, детские трекеры",475 ₽,19 отзывов,"6 мая доставит Ozon, продавец Пионер",https://www.ozon.ru/product/gps-treker-brelok-dlya-klyuchey-goluboy-brelok-lokator-bluetooth-brelok-brelok-so-zvukom-s-523548778/?asb=lymo3vwV4e7JAH9054DZMh%252BigbVHb06%252FHX6TY6vWqm5aAsBaMkR3miEdi3LV%252FPYa&asb2=kavoPJge7WXe685wVinXE9jbK7afytF93nUtOhVuwsJbePoiPhvWoMG96rM9IKN1kHgfn31Ycm1MTykixB2mSHpuNxNlAofKtvwahXGN4yUjAkehQt0ssS1qssp5geABuy3HFJ2JYMnc9ZKmkqek3A
Глушилка gps глонасс / Подавитель GPS / Глонасс,578 ₽,4 отзыва,"6 мая доставит Ozon, продавец Different Stuff Store",https://www.ozon.ru/product/glushilka-gps-glonass-podavitel-gps-glonass-479188501/?asb=Mw%252BpCl%252F9MyY0s0ajWP90QhfCshPJZ35TvLEiWwyksZs%253D&asb2=YfnxWaBt_RiANCBSgbWK2uBFiidEI5dn0kiV2nPKGVWiXRZvpMZglXKv06HovRi8
Подавитель GPS сигнала / Глонасс / Платон (глушилка) две антенны /,599 ₽,25 отзывов,"7 мая доставит Ozon, продавец Galaxy-Top",https://www.ozon.ru/product/podavitel-gps-signala-glonass-platon-glushilka-dve-antenny-286682936/?asb=8cNx9fU5hX604EpWq%252Fncqptc%252FFQ9c0vJN5jG5hkZ9IU%253D&asb2=xpmyELvpL3RUeAZb7poAFdhmwsxWEz47O30RdUFmQD2ZTQ5srp93dwg_GaYi6vJ3
"GPS трекер, брелок . Двухсторонняя сигнализация. Джпс брелок на ключи",350 ₽,2 отзыва,"Завтра доставит Ozon, продавец Marvin",https://www.ozon.ru/product/gps-treker-brelok-dvuhstoronnyaya-signalizatsiya-dzhps-brelok-na-klyuchi-271844697/?asb=YkeVekc6LtlPMggYm8GhIH4LyBAkKLJj1kjXT3Vp1w8%253D&asb2=rfv_LIuwqeiIXt0b_K1vLNoAOPX_bRSpCKQLoO-wyQZ9zNcLIGr4yxBUY5-MFuGm
"GPS трекер / брелок метка / трекер для собак / трекер для кошек / искатель для детей, домашних животных / Bluetooth брелок для вещей / кнопка для селфи / пульт для селфи / запись голоса",569 ₽,52 отзыва,"7 мая доставит Ozon, продавец WorldZone",https://www.ozon.ru/product/gps-treker-brelok-metka-treker-dlya-sobak-treker-dlya-koshek-iskatel-dlya-detey-domashnih-zhivotnyh-360465682/?asb=WLSfD0qVSxV4Er79HBHAJfgJOPb39exbEXTG1iuMwuA%253D&asb2=9FyHhW3ineBuMharULr9SjNHBU2Urt9dgixAgWFQl7lHGjDa54I0oS-rW1Z62mFL
"Синий / Брелок метка / ""Умный"" брелок / Брелок ключей / Брелок локатор / Трекер антипотеряшка / Брелок для животных / Брелок Bluetooth-трекер / Брелок с защитой от потери / Брелок для собак, кошек / Для чемодана и сумки / Детский трекер искатель",301 ₽,16 отзывов,"Завтра доставит Ozon, продавец Хит и Хайп",https://www.ozon.ru/product/siniy-brelok-metka-umnyy-brelok-brelok-klyuchey-brelok-lokator-treker-antipoteryashka-brelok-dlya-452719888/?asb=%252Ftb17%252FHPxtJU0vq6mqnkI3e1PQ2ynKpcN1Q77XT0yCn%252Fu54UNOwcrJYoL9u5Dc4k&asb2=0YOPs3ajL9THs44VqnAtRnMwzEPJtsMxBRe6jslenkwvVBI_lokZNOa8H5BDcyk3gIuk_YMv2u2WdTSw85yEp0B2wbWQKtHd8fMMancVjbrfWwf0xcrmt4QhJsiIHXx3DUPgzj6FdX5Qgx4bLMJ04A
"Gps трекер, Брелок для ключей / Брелок локатор / Bluetooth брелок / Брелок со звуком/с защитой от потери, для собак, кошек, ключи, кошелек, чемодан, сумка, детские трекеры.",475 ₽,19 отзывов,"6 мая доставит Ozon, продавец Пионер",https://www.ozon.ru/product/gps-treker-brelok-dlya-klyuchey-brelok-lokator-bluetooth-brelok-brelok-so-zvukom-s-zashchitoy-ot-523439518/?asb=T0JMgJTCRJH77SNUTditQzfZEwY%252Bs9hs26aHXz%252FY86y4wrLavOLcSvGOIomSRKOV&asb2=g9S9SYMZqPWBeXwGI3249XWnFDgTrdX-yz1G9R9rd-Ar6qHgLcAtH1FAdrgPh1xQZDgLqWODFEbjX9-a58ObcCGUI0-x3X9k8o8SePsJc_31IpT9an4a4rVr5kXzj55J
"Gps трекер, Брелок для ключей белый, брелок локатор, Bluetooth брелок, брелок со звуком, с защитой от потери, для собак, кошек, ключей, кошельков, чемоданов, сумок, детские трекеры",421 ₽,19 отзывов,"6 мая доставит Ozon, продавец Пионер",https://www.ozon.ru/product/gps-treker-brelok-dlya-klyuchey-belyy-brelok-lokator-bluetooth-brelok-brelok-so-zvukom-s-547504007/?asb=i8MAyR8X9kDWakwUvLyXzw3JM3S5%252BLtJ0uKVPjB5bGAsCA92kfljJGmUPyH4%252Bw1U&asb2=X-5z5En0gNVqOpOE5qNT-2IqH7bbklgg6Lrho52E850sCL_qQsQxHti6yttziUKFsd2TG84OFKvRgNi9DvvR0D601sQcn28x-5Go0EyuM9RAJ-jNehHBvxiswMCHIoUX
"Брелок для ключей / Брелок локатор / Bluetooth брелок / Брелок со звуком/с защитой от потери, для собак, кошек, ключи, кошелек, чемодан, сумка, детские трекеры.",375 ₽,18 отзывов,"6 мая доставит Ozon, продавец MyDiscounter",https://www.ozon.ru/product/brelok-dlya-klyuchey-brelok-lokator-bluetooth-brelok-brelok-so-zvukom-s-zashchitoy-ot-poteri-dlya-462615360/?asb=%252BBG%252BKRcBqUD7Qjfw1%252F0AqsIMgsw5Uf2YtBj592g0fAE%253D&asb2=kwLVT5DrZqLP3HeJJLTffzleYlSAPnJEvv4l7YCLX7f7sGL08M_c3X8Jib13eXYP
Подавитель GPS / Глонасс / Платон сигнала (глушилка) антенны / Глушилка камер видеофиксации ANTICAM A9712,749 ₽,15 отзывов,"6 мая доставит Ozon, продавец ItemShop",https://www.ozon.ru/product/podavitel-gps-glonass-platon-signala-glushilka-antenny-glushilka-kamer-videofiksatsii-anticam-a9712-457065249/?asb=%252FlJla%252B2lK8vYduyDEgvaJE5WvqvTVOtR%252BnK1kXCmoCRAaT5gOm2wkvgcTB8W6Gzk&asb2=pfwX7kXWm4cUl7FA-yRZxt5kkRgK2KpLcJ7vchmUEWla9zo4WFfsvrnvTp3srP0-tptEJEiwckuB9ufPQPBMnqEcMMSQc2XDH4_9LXMvge5ecLR1CzMYC4u3negLuuHvvt-akgwr08n-_BSfcjtI5w
GPS-антенна Fakra MFD2 RNS2 RNS 510 MFD3 RNS-E для Volkswagen Skoda Benz Audi,586 ₽,5 отзывов,Из-за рубежа доставит продавец Techshow,https://www.ozon.ru/product/gps-antenna-fakra-mfd2-rns2-rns-510-mfd3-rns-e-dlya-volkswagen-skoda-benz-audi-244407298/?asb=Xm4JJlTdAsXjj%252F4wuukK0BoeZsce35irU6rDdqX42EY%253D&asb2=EAlls1qOLQu3fkldGKw5Q11tTznp4opeFi3RR-croex8loNoeHpVMZVw9IqHtyMK
"GSM / GPS трекер-маяк GF-07 v1.2 для отслеживания собак, детей, автомобилей (android и ios)",900 ₽,1 отзыв,Из-за рубежа доставит продавец brucewu,https://www.ozon.ru/product/gsm-gps-treker-mayak-gf-07-v1-2-dlya-otslezhivaniya-sobak-detey-avtomobiley-android-i-ios-444568797/?asb=oF%252BakkYc6UwrvcXgB7KCAlibrIvUybB8q4QBU7hxfKY%253D&asb2=S8zeAN3XwdXG4luxb7OZMFLT5dNg4_shHg8oR2Y3bEoyFGmtWkyYpU36vUTSfDt5
Подавитель GPS сигнала / Глонасс / Платон (глушилка) две антенны /,599 ₽,4 отзыва,"7 мая доставит Ozon, продавец Home-mark.et",https://www.ozon.ru/product/podavitel-gps-signala-glonass-platon-glushilka-dve-antenny-459511742/?asb=OAst0jgupx6LNi1nXUuSGMlEZugBItDCxLOkgJ8HITY%253D&asb2=vEVd5_25RDwpBrhzdIikrQ6HzOUknXJikMI0G7NGW2WVOpm162ufCeCsBHi0pZUm
Установка дверей и окон позиционирование на воздушной подушке резиновые надувные стержни пресс-формы грузоподъемные инструменты аксессуары,539 ₽,2 отзыва,Из-за рубежа доставит продавец Techshow,https://www.ozon.ru/product/ustanovka-dverey-i-okon-pozitsionirovanie-na-vozdushnoy-podushke-rezinovye-naduvnye-sterzhni-press-244407291/?asb=dsKVzTtfs7iRQTvdxSuh1GW5jcslBz8dVKabXZjInyU%253D&asb2=u-ZxaIJuXKiEmeQGob1JJ7ai1msJV0rG3kXgz7_b8hvlfY4ZVOTVWkYqYpYBqBXv
Глушилка GPS,876 ₽,5 отзывов,"8 мая доставит Ozon, продавец ипдымов.рф",https://www.ozon.ru/product/glushilka-gps-240699074/?asb=8SSOGpu5CckObGSaMeCoNeDq5%252BR7BsoIgCOq14u9WtU%253D&asb2=ctAwveJG6YEfU-xHMejOs9DXta7xyh6XnIa2lXla9vt1Rl410f3EuAtpfshUXXsL7pJaKDMtndLcqIc8WK1boRDfMvkdM8_SAgYXMdHUgkFf6ubmJi8dYimsQtOqbE1_
Подавитель сигналов GPS,675 ₽,8 отзывов,"10 мая доставит Ozon, продавец Авто'Аксессуары",https://www.ozon.ru/product/podavitel-signalov-gps-249677050/?asb=a9t1JnagifJFsQpuw7RsfCvLoImslpsBFNbsd4Ihma84APdYbufjwwksG0EMWbJu&asb2=zXIgl2pS09G1RyOLbOtFNNPcDpUW5rw66ImPBtMjoA6E2pJS2Lq4wm5hX5dcE8Lf10rbQcnYAcZ1FbqgOcDGyLlRShOuE3gfr2K0vkC7MMGCAFoGeZQ_ThND36ZTeUlOELI8mpPX4oXheyfcODTLHw
"Брелок метка / ""Умный"" брелок / Брелок для ключей / Брелок локатор / Трекер антипотеряшка / Брелок для животных / Брелок Bluetooth-трекер / Брелок с защитой от потери / Брелок для собак, кошек / Для чемодана и сумки / Детский трекер искатель",499 ₽,2 отзыва,"6 мая доставит Ozon, продавец Jo inn",https://www.ozon.ru/product/brelok-metka-umnyy-brelok-brelok-dlya-klyuchey-brelok-lokator-treker-antipoteryashka-brelok-dlya-450286001/?asb=reKk5dncHd4dg5tMF8pSNfoHmSoTClh%252BHcGAv8sihfwuTpdtCCZJHtDWwW%252B76%252BE%252B&asb2=vVnBF7J80Q63GtXkEbPTwc7KLIGQKjZsHmLla71liXjKgMbA7dCpwz0ZHtnU6cmYOU2kQzJEnUzrkJB7zeRBn1y31_twU8EaKebp0PGXZo-77MTl1EJUKvL7rscE1MCx30-jI8HBZMzUQw7FdAUExg
GPS смарт-ключ для автомобиля,741 ₽,1 отзыв,Из-за рубежа доставит продавец CBTX GLOBAL,https://www.ozon.ru/product/gps-smart-klyuch-dlya-avtomobilya-278370203/?asb=hjcC7ANEQ3VyppuaaJuTPuPFVhEpiksAxpdNx3eFwkg%253D&asb2=fWQFo3jxjHw0sx9VaeJpfvwa6SRpn8O1QoIUGdJEVIwXIqDn_mSg6LsOWNkKnw2T
"GPS брелок для ключей, личных вещей. Двухсторонняя сигнализация на блютуз",369 ₽,8 отзывов,"Завтра доставит Ozon, продавец Marvin",https://www.ozon.ru/product/gps-brelok-dlya-klyuchey-lichnyh-veshchey-dvuhstoronnyaya-signalizatsiya-na-blyutuz-268650334/?asb=9uaCRD0GMUlAF0h%252FqpkmIHB2rnuzczZjHT0%252F1qG8oAI%253D&asb2=d9arsarzm_-XD-pkInIMdjh1MfwgRV9V6fwXAa9g_kl8VklWDEtHP3zyItnQ604c
