"Грунтовка Malare акриловая адгезионная глубокого проникновения Адгезионная, Глубокого проникновения",935 ₽,51 отзыв,"9 мая доставит Ozon, продавец ООО ТД Маляре",https://www.ozon.ru/product/gruntovka-malare-akrilovaya-adgezionnaya-glubokogo-proniknoveniya-adgezionnaya-215464351/?asb=mt5YM%252FkFNsNiwolW2dds9%252F7%252BZD6QP2x%252F88e8VRd96YU%253D&asb2=pUnpmuyj5mkF9kr7s6bZpeiKafkRI4hD4xpeNwpSCbVNEKnmzlAW8ilRWgs6_Gdg
"Грунтовка KERRY ""Грунт универсальный алкидный"", серый",299 ₽,12 отзывов,"Завтра доставит Ozon, продавец ООО «Торговый дом «КУДО»",https://www.ozon.ru/product/gruntovka-kerry-grunt-universalnyy-alkidnyy-seryy-276615317/?asb=LRp7pBRqbiZwmG7b5LQpZk0mg2J6fpVzLOULWz9s50R%252FG7gFLItFl1LXvF83cNq6&asb2=1czMo5SiKh8D6bxppWwgl_KmczYi4Y4OP4RTFPfRJ8SleY0uczLRvch6LMjVj2MJQZ6nqS9cgO7tdhBxKLbRoJKC2W19ctfZD0I42c70H9QeOQ4FpvK3_yJL_nMRu_He
Грунтовка КОНЦЕНТРАТ 5 л глубокого проникновения универсальная для стен перед покраской противогрибковая под обои штукатурку кирпич газосиликат стяжки наливные полы ГКЛ/ ГВЛ для фасадных работ,830 ₽,19 отзывов,"9 мая доставит Ozon, продавец АПРЕЛЬ-SHOP",https://www.ozon.ru/product/gruntovka-kontsentrat-5-l-glubokogo-proniknoveniya-universalnaya-dlya-sten-pered-pokraskoy-342312066/?asb=8gxG7GrkabYNnHkrZMJBJBgTYJEdbihFMQ83zO%252FnHtUsDSutyGhV0WoVlk73W%252BGw&asb2=VNxrsjLRFfBfWxJwFLGvQkcaL_amCLa9_NDkHW8NqCTTKO6yhwmnaT7Aib8NURZHPl5ZO1Fi2NRyOWJyI7NpMPSSPbyYz3n-Tirwm8Fq7NZykfs0aIEkBBGfWuSG7xkZLSxJYc9hNVeftfGHNCqmpA
Грунтовка baza BZ 5 кг,679 ₽,113 отзывов,"9 мая доставит Ozon, продавец АПРЕЛЬ-SHOP",https://www.ozon.ru/product/gruntovka-baza-bz-5-kg-343103265/?asb=Z9Uu1J1mZI7Wt0DjQ62Ex6hqqeLqKMeMg9ZhCaw2W0zZ1pIHbfErr2MtbVvP71Mq&asb2=DV4zkA3K_SL92c7jE76kIfrrRCElflvtG9fAFo0o33c7fyG3cmkOVbLXdE650Y6U-5fyDJ_7Z3VFkgPgQdyj3Xyvhc9hSHkyyyCj_uGLXSpI6BmIGEPcwu0pe48aA2og-nkeBfb0wEUWzKvcTEV3lg
"Грунтовка ThermoColor Универсальная Адгезионная, Глубокого проникновения, для стен, полов, потолков, обеспыливание поверхности 1 л 1.1 кг",286 ₽,54 отзыва,"8 мая доставит Ozon, продавец ThermoColor",https://www.ozon.ru/product/gruntovka-thermocolor-universalnaya-adgezionnaya-glubokogo-proniknoveniya-dlya-sten-polov-240412802/?asb=lSzxIJJ8D4UFQ%252B7zBS3Q131bYdqfWSBjcq4%252FMQRYcXM%253D&asb2=vuenTPlUE9nJhQNjbc5tG8KRKaZ8wOrelnNXyxSwTaHFD0CqsPXIefurEmdEsDje
Грунтовка PROFESSIONAL для стен глубокого проникновения универсальная акриловая с антисептиком для внутренних работ Глубокого проникновения,265 ₽,11 отзывов,"8 мая доставит Ozon, продавец КЛАССИК",https://www.ozon.ru/product/gruntovka-professional-dlya-sten-glubokogo-proniknoveniya-universalnaya-akrilovaya-s-259527629/?asb=WiLdUNOyoUzij0nzgwwNfeCcQc%252F%252BaJqXrICPRSHmVjc%253D&asb2=KkNrxErR6VLl7iVW1m5xY3xlnhQZu_osichVCv3I563BqW45kzdTzxMek9iBbWYs
"Грунтовка для стен и потолков универсальная ThermoColor, под обои, под покраску для любых поверхностей, акриловая, адгезионная, глубокого проникновения, для внутренних/наружных работ, для фасадов, влажных помещений, от плесени и грибка 1 л, 1,1 кг",265 ₽,12 отзывов,"Завтра доставит Ozon, продавец ООО ""Стройкомплект""",https://www.ozon.ru/product/gruntovka-dlya-sten-i-potolkov-universalnaya-thermocolor-pod-oboi-pod-pokrasku-dlya-lyubyh-464393879/?asb=ebn28D6N%252BTfq3slOXOty8AJVK47l3H19lIt2T4Wopsk%253D&asb2=Lv61Ef2TH6DOvYJ-w1oMQlIQvhRDTfLH12X2o5DiK4mukq-a3u724Kq34TMVLreIhvzKI7n-QhRsJZ_JrHg7hdUZcY-2xgYY2PYuwxqHS6_Th5Cli2uywqovHzZYEbUJ
"Грунтовка АКТЕРМ для стен , акриловая, 5л Глубокого проникновения, Укрепляющая 5 кг",676 ₽,61 отзыв,"12 мая доставит Ozon, продавец Концепт Групп",https://www.ozon.ru/product/gruntovka-akterm-dlya-sten-akrilovaya-5l-glubokogo-proniknoveniya-ukreplyayushchaya-5-kg-446894221/?asb=S5h3BT1GNdVREGYM3JXHOCSwliCdqi1rJmIVBFNoFB4%253D&asb2=gi-JJWqw3QgDtLwyb3dZQL6ffyK4b_7Cf7Y0YAuLx5ervVId4abQMj5cEmJxFLajVghpPaXsixBfR1M_FN9pWWOUzFOatTeudJd_oDVaMOfCKATIJwME608UScH5MorM
"Грунтовка укрывающая для внутренних работ VGT ВД-АК-0301, 3 кг",690 ₽,7 отзывов,"9 мая доставит Ozon, продавец ВЕРТИКАЛЬ",https://www.ozon.ru/product/gruntovka-ukryvayushchaya-dlya-vnutrennih-rabot-vgt-vd-ak-0301-3-kg-268912775/?asb=YxS5Pka6npMLq8QzNITB6ChluhKeyedfO6%252FpxNqUqXM%253D&asb2=ucciCpr6ldbfHgUlvl36LzX9rwZUxmJkeqNZfGAxyr-khsjxMcty-VMPyAOLyvk5
"Грунтовка Zerwood по дереву Глубокого проникновения, Противоплесневая",471 ₽,13 отзывов,"8 мая доставит Ozon, продавец Мой Дом",https://www.ozon.ru/product/gruntovka-zerwood-po-derevu-glubokogo-proniknoveniya-protivoplesnevaya-320223192/?asb=2XBTlZd0rCy7wq1LUD%252FheiyDHM59g8BpFCfk1cAuMDM%253D&asb2=Ojd6ECYkwknlu_AQIZWxt6pRxd_mMHYUyKZCRyUNq5Sw1cdoBPGdvPGsWu3E9GHy
"Грунт УНИВЕРСАЛЬНЫЙ Prosept пропиточный, готовый состав 3 л",271 ₽,4 отзыва,"8 мая доставит Ozon, продавец 000 МастерСтрой СПБ",https://www.ozon.ru/product/grunt-universalnyy-prosept-propitochnyy-gotovyy-sostav-3-l-531846867/?asb=3rT%252BdTN4zXf0sjY%252FdVmf617QOiopOmN9nkCKctTr3U0yU7bnPMwpqJpaXoxhvciu&asb2=SL2BCKqg4a_u7N22j-_4swwyuBQA3Ohm0jn4dr1uahgzeJsucBIsHP6-3d9zjM76A1R0RqjQaHLMgJ5ZAH5yNFvrNAc9KE8rSux-ksfAFBmeObfrtBpouC8ROqm3DXAdX8n03ZchMBLJrorsBEBX5A
"Грунтовка Mobihel ""41675501A"", активатор адгезии Адгезионная",511 ₽,9 отзывов,"Завтра доставит Ozon, продавец ООО ""Партнер""",https://www.ozon.ru/product/gruntovka-mobihel-41675501a-aktivator-adgezii-adgezionnaya-260224022/?asb=vga1mvkzEIsu85HEe8H5KhQp4yCRmiCLs4zshF7%252Bu7w%253D&asb2=UkaeRTvCaqoF6LxxudDlqedwD-8cfiSnbL_NONcDU3s2HEnefH4zo8Ve0vTdyRi2
"Грунтовка БОЛАРС Бетоноконтакт фр. 0,3 - 0,6 мм Адгезионная 2,5 кг",569 ₽,17 отзывов,"Завтра доставит Ozon, продавец БОЛАРС",https://www.ozon.ru/product/gruntovka-bolars-betonokontakt-fr-0-3-0-6-mm-adgezionnaya-2-5-kg-234155304/?asb=eS9rbJmgxdQyP49m2Z5f2Vh1G%252BwV3tWPxULr0wtLmAs%253D&asb2=GMmOBUd3EcK7zAeKz14-Or86fAg65HMNRToFHEcMBIgqWSAOIGkVEquImRFjdq2B
"Грунтовка Для внутренних работ DEKO для стен глубокого проникновения под обои, под покраску, адгезионная, акриловая, на 9 кв/м, 0,9л",246 ₽,13 отзывов,"11 мая доставит Ozon, продавец Завод красок DEKO",https://www.ozon.ru/product/gruntovka-dlya-vnutrennih-rabot-deko-dlya-sten-glubokogo-proniknoveniya-pod-oboi-pod-pokrasku-199307320/?asb=zXtWRDRLRwNhMhhWFUOQuXpZgahAeGprKwGRXwrX%252F%252BA%253D&asb2=kavH76RGBYcgvcPu7Ju2nhcUXBVufAMRo2OaPE49GL6NxfTDEd3tCs05L-oZ2s4R
"Грунтовка KUDO ""Грунт алкидный универсальный"" Универсальная",294 ₽,79 отзывов,"Завтра доставит Ozon, продавец ЭКО-Балт",https://www.ozon.ru/product/gruntovka-kudo-grunt-alkidnyy-universalnyy-universalnaya-196996870/?asb=EbYtfXtSiYetfUV90WUsSXX0%252B2jSzkHYs1F%252B3Jj6KbaxfP6TTFDc9zvPfPOOOtsJ&asb2=vX38_ZsVVCl9Vx_C-_hTjSuAzfaZRmRY8DgY9geNKhCy0W2GDH_H1wPB55qrGHy6CCPvZLOuGsBDeSVudZZZ4Wcm7ctRHxA5AoqB9cdHeNsPbZZ-JySy3oFteMT_0_C8xFbdH17T6qsMzCVEraCoew
"Грунтовка SILK PLASTER Сопутка Адгезионная, Влагозащитная 1 кг",517 ₽,5 отзывов,"Послезавтра доставит Ozon, продавец Жидкие обои SILK PLASTER",https://www.ozon.ru/product/gruntovka-silk-plaster-soputka-adgezionnaya-vlagozashchitnaya-1-kg-487099998/?asb=Ecvv4oWCQqFqq3Qx7%252BwGaN8bWOXP%252F1dYgRIzA0nLNPnpEPa7vAt9bQn5%252FGSRDPey&asb2=AjSRZRymt9aRHoJ77gHFT-k9RIAdGxvW9t18EatvBsT0y8MPICaolclLX4xEmLGOjWRZGzHSem32r7n7Mf4hYY838HE9YzDFzDPbid9umOIGl9d3xvpy5ttjZoRVp57vtBdZnY6ZfjfxOpqy1DUfxQ
"Грунтовка Finlux Святозар-95. для стен и полотков, антисептирующая. Готовая к применению. Универсальная, Адгезионная 2 кг",390 ₽,23 отзыва,"Послезавтра доставит Ozon, продавец МИРИК Мир инновационных красок",https://www.ozon.ru/product/gruntovka-finlux-svyatozar-95-dlya-sten-i-polotkov-antiseptiruyushchaya-gotovaya-k-primeneniyu-263510438/?asb=7a5dIUDB3nsyVKA0YNLWNzdiz%252BLmyojrr%252B2Fm%252FEKcQOoRDwMUmmHS1RredK1o11M&asb2=MkFfxm0Kh-z8asSu2BYqPbEEYe4PUcXH-VPMQTyV1G-_1UhUtjalaGODNNiewM8UtrhtArJaitAAbdVV64TzscSamUTJTEPiNuECoPXuQGz9cPkIP8Ozq7J5Ponryz3-
Грунтовка LM#81960747,832 ₽,1 отзыв,"10 мая доставит Ozon, продавец GREE",https://www.ozon.ru/product/gruntovka-lm-81960747-398027260/?asb=OXsQi81MUWuoF7LB%252BaFSeXzDZl%252BWlw7ZnMECxXt0m6U%253D&asb2=pALJ31Nh1d54pcf5zxE6UXfQnRD0hvLkY_nBadkuA75xsUUG1VOQioQKPSBkWJpg
"Грунтовка АКТЕРМ для стен глубокого проникновения под обои, под покраску, акриловая, 1л Универсальная, Глубокого проникновения 1 кг",279 ₽,61 отзыв,"12 мая доставит Ozon, продавец Концепт Групп",https://www.ozon.ru/product/gruntovka-akterm-dlya-sten-glubokogo-proniknoveniya-pod-oboi-pod-pokrasku-akrilovaya-240590876/?asb=Jlhq0HAstkJHGZVIDHFNrnXmfjsK%252FoNQhKJg0vrj5o%252BJrVc%252BqtP1XTbv5l%252FV%252FvwH&asb2=muuHAJ7KI-73GwMi2JTpT7atxN1XrDDvGdC98HLne6BNO3todpaWBK-rX-D7Ow78heXlQ4IumUY5bXg4TYUb61YqQA_kozGTr-o2ZjtEr64l4H6G1pb90yinFC8WafNKIDXbxiENYInmkri-D0Z-xw
Грунтовка KUDO гладкая матовая Универсальная,360 ₽,8 отзывов,"11 мая доставит Ozon, продавец Торговый Дом ""Сибирь""",https://www.ozon.ru/product/gruntovka-kudo-gladkaya-matovaya-universalnaya-315388337/?asb=5%252Fp5%252BsBtRtg3FCCTpnxBnCX5oFW4loBmD9AfFtAfH%252FI%253D&asb2=Bf0Sn9UotIPbc1b6hgLpVFJfeC-6I9i1rEJFBwLb07jcEV0kVM2XK5FB6mhTt63hV_oZbYa1zv1U0SteJ6OnW4WSEAJ3BSozu3xxw3iktNLDU73Dp8GpuwT3HmeoWPzg
"Грунтовка Siana Provense Адгезионная, Укрепляющая 0,27 кг",399 ₽,52 отзыва,"Завтра доставит Ozon, продавец Certa",https://www.ozon.ru/product/gruntovka-siana-provense-adgezionnaya-ukreplyayushchaya-0-27-kg-295869865/?asb=O4p%252BGRjlZ4SZQ3QSk5tx%252Blr9jeqJbpvJkU5w%252BmsjaIFyOu7y8lgqdKB1ZQfR%252FTSN&asb2=Lql_8oCUXYB60y5HSMhRtZHg08YJoJcRA5mpbXgtMl-tda9KbfJ4nj5oy-eHnovDc9XvDCQKNspGn5v7PuK8bzVjxh415Ccg8SjZ6YkP_yefHr26MZPeQborjrP8ULOUfdWKC-W8gJTujxDz3vUrzg
"Грунтовка акриловая DESSA DECOR Quartz 2 кг, универсальная, адгезионная, белая, густая, для штукатурок, жидких обоев, микроцемента",904 ₽,37 отзывов,"8 мая доставит Ozon, продавец DESSA DECOR",https://www.ozon.ru/product/gruntovka-akrilovaya-dessa-decor-quartz-2-kg-universalnaya-adgezionnaya-belaya-gustaya-dlya-400720140/?asb=Y9Y2tsVQDcTYmuscA0mFD6KE%252BOoyE%252B7o2zLZ8uQ1sEI%253D&asb2=BZOW37lT5bchhNUU0WLh7eBb1WIbWATiEcvtGuF8-eNCcG-U7OF1xbyJpmS_RMQo
Грунтовка Lakko Eg520 Противокоррозионная,295 ₽,26 отзывов,"8 мая доставит Ozon, продавец ИП Сафаров Р.Р.",https://www.ozon.ru/product/aerozolnaya-grunt-emal-po-rzhavchine-3-v-1-antikorrozionnaya-tsvet-seryy-520ml-165252024/?asb=tCi7hHAz749IWzIkt6u7qv2jp7FpjDNvODq7rArVRcI%253D&asb2=M7ORQ7tNSne6la0HwLMlqtoC7oW-VthClF6NDCou0BcRLI9y6CmEXlsIet5qwA9U
Грунтовка GOODHIM GU Универсальная,600 ₽,96 отзывов,"8 мая доставит Ozon, продавец ИП Новиков Д.В.",https://www.ozon.ru/product/gruntovka-goodhim-gu-universalnaya-174025703/?asb=GX8NEq90PbB9lEWd47LDoFdhoSCC3Ynu0pKvTk4ekkFugwrLp4%252Fwz1JHO3%252Fao74p&asb2=YMk70EpXZibKWQNYh0DvhXEF3t_xWfJQFZWSRqkQPe-2RiVwf27Z2FsMsNabUW8tiXPZDRyxQfDFCew1wvxYYqfZmJ4MUi5zrvgmhce1T1yv-K_0EwcxSpYu0BesMxc9jOt6brcv2qGRtazig3lsAA
"Грунтовка под обои акриловая пигментированная белая ВТеме 2,5кг для внутренних работ",421 ₽,16 отзывов,"8 мая доставит Ozon, продавец КЛАССИК",https://www.ozon.ru/product/gruntovka-pod-oboi-akrilovaya-pigmentirovannaya-belaya-vteme-2-5kg-dlya-vnutrennih-rabot-260559304/?asb=macSMc1T9%252FXwA%252BMlSooGd7PjstzX7875oVIMGESPX%252BI%253D&asb2=zITH8G8rSxsjTnjeKTPm8CNtimtUk3cRLkziLwhNY2mhjIHF5dQRvofpdno6Cv5m
"Грунт-наполнитель KUDO, 1К, цинконаполненный, аэрозоль, 520 мл",540 ₽,2 отзыва,Не доставляется в ваш регион,https://www.ozon.ru/product/grunt-napolnitel-kudo-1k-tsinkonapolnennyy-aerozol-520-ml-223687498/?asb=fOAt%252FZHxXUdGsPPlO1c%252BZB5fhU04SB18Kv63YwSlMAU%253D&asb2=Y8AgTiq8nJid6WWZvo0I987NgY7ZRkwxsc9TV6X-RyppSDu-nFI_rQiHkg-HzXHJ
"Грунтовка BAUPROFFE серая Противокоррозионная, Универсальная 6 кг",999 ₽,7 отзывов,"9 мая доставит Ozon, продавец Строй Сити Трейд",https://www.ozon.ru/product/gruntovka-bauproffe-seraya-protivokorrozionnaya-universalnaya-6-kg-231301079/?asb=97VSMFLCSiQtTpuPeYMy%252BUtuik%252F6%252FVn%252BxdMopTq6YLQ%253D&asb2=ojLYsmwZbfxIepngdP1pllafxaP593WZI3SbuPox0X-yP-iP4EUFSWCxVDrW2l1Z
"Грунтовка Deton UNIVERSAL, акриловый быстросохнущий 0,34 кг",320 ₽,1 отзыв,"Завтра доставит Ozon, продавец ТД ""Автон""",https://www.ozon.ru/product/gruntovka-deton-universal-akrilovyy-bystrosohnushchiy-0-34-kg-390867616/?asb=YuEb%252Fc1M9M0QBAR3CMvG%252FsqeOwVCsxhTJ0F5BcCI1U4p7pYAf4e7c9ZQyGwjk6Iz&asb2=2sCedcTu-OnAZIkAREYCesrMZ3ma1hqeVfiFn8SvqPxvWGoWp4SYrIhY_bRjp2YUNfy5_6sie7uKl4YRqndlS7hfBJDRX5v_sbQdFXTrjGvKrOiNb3bk4S6ZBfarJXsh9cqyOrYTl50rrBDhUyVrAg
"Грунтовка акриловая Адгезионная, Обеспыливающая 5.5 кг",496 ₽,6 отзывов,"8 мая доставит Ozon, продавец ThermoColor",https://www.ozon.ru/product/gruntovka-akrilovaya-adgezionnaya-obespylivayushchaya-5-5-kg-400356301/?asb=2L7PUCuWeUmticckiw9E0KVvS%252FIrY%252FJ0ofGgOv%252FsCqU%253D&asb2=hTkGrVWCDlYfBUf8Gu5Gq8Lwkd6QlAAmzna9IauP353mZ_mEEoos6_DY6EuQnZpNd1IID3w9qCgrUUaANsiZEHEeQG0xjQV0fmJtvgxFG0uHaBQtckXTTJAiBFCk_xpz
"Грунтовка EK G200 Универсальная для Внутренних и Наружный работ Адгезионная, Обеспыливающая",701 ₽,1 отзыв,"9 мая доставит Ozon, продавец POLYСАД",https://www.ozon.ru/product/gruntovka-ek-g200-universalnaya-dlya-vnutrennih-i-naruzhnyy-rabot-adgezionnaya-obespylivayushchaya-444089439/?asb=VDj18YTA8wDioF64u8hfRcKL326Y%252BGtVbpYrXfKP5rklXW56tuqw6OwlNHM3ai6W&asb2=r1d6RFnwL0PWRNB034P5PcTWKFDV6c7K2KR-Oc9t-vEWl9pWM6RlkTpY8nTYy1j8jZ33AsUKkR1FMlIVzq4-Q2UU6l6YiWALhAu0nTANulmVBr3d_xlmkoab5_lSqUgiSXvyxpxunjPNP-GNzhmBAA
Грунтовка Лакра ГФ-021 Универсальная 1 кг,398 ₽,3 отзыва,"Завтра доставит Ozon, продавец ТурZonа",https://www.ozon.ru/product/gruntovka-lakra-gf-021-universalnaya-1-kg-299057043/?asb=LuvpvcxAu5erEauGXbFIDcQakffzkASe0O5xv7kX08AYcTFpEcO1uuwE9cQESF40&asb2=svwGHTR1M44dZSQdyZDMnxXqr3rCBH09mga6XmHj-m7YEkWWtuwrAXQHf8fjUc9941WbSDyUSA3M4XJsrc4RJpqHpLmycf_C9WNU7Mbk2SESxD5LaTMv_x1GbNA0fb4gVyYgYNZzu1ELQXNgeFr5Og
Грунтовка SENBION S-Гр-14810/1 Адгезионная,340 ₽,71 отзыв,"Завтра доставит Ozon, продавец ООО ""Биодом""",https://www.ozon.ru/product/gruntovka-akrilovaya-senbion-s-mramornym-adgezionnym-napolnitelem-dlya-osb-1l-164772793/?asb=MIFpnELnOYQxwB86OlgmdB0MRjFt0fodo1qFbTVSunM%253D&asb2=PMMYjqTQ2QJg3sNtoPVbXsh5DkeeP0qHCBGaclqFBmYvKnvseGXmuEpHRr_XKb0e
"Грунтовка SAFORA грунт сцепляющий Бетонконтакт, Влагозащитная 1,2 кг",273 ₽,15 отзывов,"8 мая доставит Ozon, продавец ООО ""САФОРА""",https://www.ozon.ru/product/gruntovka-safora-grunt-stseplyayushchiy-betonkontakt-vlagozashchitnaya-1-2-kg-260529009/?asb=XO9ZowFglg5XY4YefJH34Eb21UGf2cjQTCW9u6HVGcI%253D&asb2=1Letv1DzqCLHXX25wvwF7KTxlb8hCOal5q4S4TpWw8oiy5fqfaflCIRYZN2_2aip
"Грунтовка Malare акриловая адгезионная глубокого проникновения Адгезионная, Глубокого проникновения",330 ₽,51 отзыв,"9 мая доставит Ozon, продавец ООО ТД Маляре",https://www.ozon.ru/product/gruntovka-malare-akrilovaya-adgezionnaya-glubokogo-proniknoveniya-adgezionnaya-215232567/?asb=AgNoJktyss9DK1UPlBFqRpapgqt4M9coOE2Bmh0JrAs%253D&asb2=PS57ZSOTHU0HL2q7uR9ABIi6vTdhXkzrxpZ2VvysgjuEx0teuuoeNIDzosuhwRVo
"Грунтовка MASTERFARBE глубокого проникновения Адгезионная, Влагозащитная 10 кг",890 ₽,3 отзыва,"8 мая доставит Ozon, продавец ВСЕКРАСКИ.РУ",https://www.ozon.ru/product/gruntovka-masterfarbe-glubokogo-proniknoveniya-adgezionnaya-vlagozashchitnaya-10-kg-491527275/?asb=Ly6lnOf4MDyNAQsN%252FnPBQKwStsDgNYiMN0O8njoxAzDEh%252Bjp%252FQ4zZLqcWYT0d3BI&asb2=wGr4r5ihs2xQJt8sdGR2f-VbmPFaN_4RziZT6lmgKTKISuEC8-paHjYWsJ1lDV85sAn2O7T84ms43P9w3_yTdtDjG60oiIbrj2VNOzlsCyDN09QqHvaq4AvrQ-CWcwGh
"Грунтовка KERRY ""Грунт универсальный алкидный"", чёрный",299 ₽,12 отзывов,"8 мая доставит Ozon, продавец ООО «Торговый дом «КУДО»",https://www.ozon.ru/product/gruntovka-kerry-grunt-universalnyy-alkidnyy-chernyy-276616029/?asb=uTZmAkq4O277LvDsDF61uR%252BmTsbZwUndX011mlWSrvlYNWF0TM7kpnF5Qp15dJrv&asb2=0O6NJk7jy9ECanQC7rdVXOJXYF0sxp75jOWxvXaWJrrL8mevVMg9tHXoM7IzE1r2q-t-S9BjfIQol4w8tmFJUHz9GUugv2DWyeWxs1q5WzVG601IivCli7XqUk511zhI
"Грунтовка Новохим Супер концентрат Адгезионная, Укрепляющая 1 кг",356 ₽,6 отзывов,"Завтра доставит Ozon, продавец ООО ""Новохим""",https://www.ozon.ru/product/gruntovka-novohim-super-kontsentrat-adgezionnaya-ukreplyayushchaya-1-kg-294950306/?asb=TJjjgldxnn1e5mh%252FdtwUSRC0dKSeOwLhppm%252FgOZIM5A%253D&asb2=L09TXGcCeNNPUUftrvM9h1bl3HrKa8e_cY3pHtr96wLQ-n5-SZCIRkcrEcDWVk20
Грунтовка Plex ПРАЙМЕР 1.1 кг,250 ₽,1 отзыв,"Завтра доставит Ozon, продавец PLEX",https://www.ozon.ru/product/gruntovka-plex-praymer-1-1-kg-362484715/?asb=VjMrBj25OtruUwFvRbVZNmOG%252FqjohOoAU8uGbgbJXWM%253D&asb2=OKBdO7Vziy5s-6dvg87uLZM6zOfXiFEBB7awVXAWvSWDLzx8qiGmOCvlFN3Q1dne
"Грунтовка Новохим Глубокого проникновения Глубокого проникновения, Обеспыливающая 1 кг",213 ₽,3 отзыва,"Завтра доставит Ozon, продавец ООО ""Новохим""",https://www.ozon.ru/product/gruntovka-novohim-glubokogo-proniknoveniya-glubokogo-proniknoveniya-obespylivayushchaya-1-kg-320262365/?asb=z5IFzhYbSoPiyrKQZy4ExH95hQ4T2%252BCjWXgkKHneHBI%253D&asb2=XBlQ4wJDm1QaZpwwrtlDbhBKoxFaIfvfzMfFiATQrmjBAcDDH40HFEZhR94TUPzH
Грунтовка БЕТОН-КОНТАКТ PaintGuard светло-желтая (ВД-АК-01-07) - 2л/3кг,543 ₽,67 отзывов,"12 мая доставит Ozon, продавец Оберег",https://www.ozon.ru/product/gruntovka-beton-kontakt-paintguard-svetlo-zheltaya-vd-ak-01-07-2l-3kg-219869927/?asb=EEi5RcJrnzEKPVIYD7QxHqyW3dXviGu%252FRzRGKujrrqGDH3lQQqLf7mrN%252FGXdSUba&asb2=4vKYg4dLY3YodDnXIPwqmjLGd_81-kpVZEjawncjTEtFotrWYTMnqzG-zFrjmypLvVkI6vDhd6YdShCVPobGwpHPcBY0h0FbHpEde4voRpjkyPl7itTO2Y9FrO_K8pVwb6it-TWnaoY0ORfcw_-OOA
"Грунтовка PROFESSIONAL сцепляющая, адгезионная Бетонконтакт ""ЛАЙТ"" для наружных и внутренних работ 1,3кг PG100",310 ₽,16 отзывов,"8 мая доставит Ozon, продавец КЛАССИК",https://www.ozon.ru/product/gruntovka-professional-stseplyayushchaya-adgezionnaya-betonkontakt-layt-dlya-naruzhnyh-i-vnutrennih-259443533/?asb=7rznX6BhmWjbYQdnYDdUpNs85E0PWxCN3Km9mDqovC4%253D&asb2=fVi00IkILUDj6ADX-m2OQubIci7sFzGyMKYqpmRDXW2m-2hJ7wa6GB3ESLjVRc7H
Грунтовка KUDO Алкидный Универсальная,278 ₽,39 отзывов,"Завтра доставит Ozon, продавец ООО ""Товарищ""",https://www.ozon.ru/product/gruntovka-kudo-alkidnyy-universalnaya-282801048/?asb=c%252FqRRAYFvSKMueV6jBqPR1QMja4Z1BXtpjP53cY2ULc%253D&asb2=QiMMqpjS1LtYG1bZ-zip4nO4WTAF1WqrHMonm2dX8tJz-MBjpVp_PLn7EWzRtLnl
Грунтовка Finlux Святозар-94. Супер универсальная глубокопроникающая для фасадных и интерьерных работ. Бесцветная. Готовая к применению. 2 кг,767 ₽,2 отзыва,"Послезавтра доставит Ozon, продавец МИРИК Мир инновационных красок",https://www.ozon.ru/product/gruntovka-finlux-svyatozar-94-super-universalnaya-glubokopronikayushchaya-dlya-fasadnyh-i-284718003/?asb=Lxmu%252FgNOfBe74JwB8m89JbekhfGUcDUvc%252BXFX1Exf6PR1tj1%252FjSLs50PEmGjezHI&asb2=EMW2RNxyFMQguLr3hJyZgO4gqIreAKjsuGthLeI6lbAasY2ZlLz5RGQODjE5582hHViBBxQwvOYrxZUF5gRcTYmC4NaolbS3C3KV10oClRFca1VoViJ-hm8rucA1q-zT
Грунтовка inRAL GROUND Противокоррозионная 0.53400000000000003 кг,447 ₽,21 отзыв,"8 мая доставит Ozon, продавец TEGRA VOSTOK",https://www.ozon.ru/product/gruntovka-inral-ground-protivokorrozionnaya-0-53400000000000003-kg-254758797/?asb=8GbUgRi5f42QoBTyiR%252Fna9IeN1Q0gNPmnTqakJXTQlQ%253D&asb2=6MDPkN2oylQhUCJG1qsc8vSl2hplDO3H1-RQ4RVRM1iDve9gb8Kf27Nor_8y76pz
Грунтовка Vixen VX-22002,329 ₽,1 отзыв,"9 мая доставит Ozon, продавец ТДЗ",https://www.ozon.ru/product/gruntovka-vixen-vx-22002-311815313/?asb=wMImH2Is3bBW%252Fjk%252FcfEf4f27vuT86o8A4PizjnhAa6U%253D&asb2=0PeHyWA1iH4YwAofHzK1sHm2kpqqjJcOeiFE9QxFIPthiqxZSP65KQnPAVm0uuH4
"Грунтовка PROFESSIONAL сцепляющая, адгезионная Бетонконтакт ""ОПТИУМ"" для внутренних работ Бетонконтакт, Адгезионная 1.3 кг",346 ₽,13 отзывов,"8 мая доставит Ozon, продавец КЛАССИК",https://www.ozon.ru/product/gruntovka-professional-stseplyayushchaya-adgezionnaya-betonkontakt-optium-dlya-vnutrennih-259447500/?asb=gpUDiXtDRQZ4sQXuCMuICz1Pf17BhAEs%252BnU3q6ma4QE%253D&asb2=IpI8irmryeMRPJDuPhypxRDL-YphMyyq85w8oQen4pzFdIiWq4vqPDY7YXKt7Rdy
"Грунт акриловый DESSA DECOR для жидких обоев, для мебели, декоративной штукатурки, адгезионный, супер белый, густой, 750 мл",467 ₽,7 отзывов,"10 мая доставит Ozon, продавец Производственная компания ""ДЕССА""",https://www.ozon.ru/product/grunt-akrilovyy-dessa-decor-dlya-zhidkih-oboev-dlya-mebeli-dekorativnoy-shtukaturki-504315530/?asb=B7515Uds5AmqL5QByB4fsPXzDIrJXsQ83vyKOLpbouw%253D&asb2=cecNmVDlEYgz5kROFloGLC4BO6oZHnX4J0d980LfXaVeYlK9AQS2tbbUlwOSkaih
Грунтовка Jeta Pro 5559,662 ₽,2 отзыва,"10 мая доставит Ozon, продавец AptX- Все для кузовного ремонта",https://www.ozon.ru/product/gruntovka-jeta-pro-5559-378612095/?asb=ZLylI4lD9r%252BNVQtmmqqOmTKgzGfoOArab0kyxCEZb4lc1aPKda83lwwKEzpIR4%252FP&asb2=__nAdCBT1z5WWmduwobHnyfr6tc6x3A7Ezpf7QFraClHi6odPEIzW1flT138IKvGxTSoVAhjr08nXkRbC_P9AqkfKGyCyjtPR6AF4MRV8CcF1r4GvzxOz7QEs-u9INE_A1q8VGPT7Iv20WRCkuCFUg
Грунтовка Мирабелла для мебели Адгезионная,666 ₽,4 отзыва,"10 мая доставит Ozon, продавец Neprostochasy",https://www.ozon.ru/product/gruntovka-mirabella-dlya-mebeli-adgezionnaya-487211055/?asb=jN6NHV7IwLMEfXoo28cD9SKuZMWwFuxC%252FQLdIqvnLMU%253D&asb2=rI-ZgKUQ5CdGqE-z4jVnWxMIYewEh64DzlWdx36D8kmSxlZzIug04ve3pUDttx1F
Универсальный грунт Этюд. цвет Красный. объем 520 мл 4630017000197,226 ₽,3 отзыва,"8 мая доставит Ozon, продавец Profkolor",https://www.ozon.ru/product/universalnyy-grunt-etyud-tsvet-krasnyy-obem-520-ml-4630017000197-184702637/?asb=H0xOSOLgu2pyje%252FgqvRR%252Ft6LvYL3tTUhYCQU02EIdLM%253D&asb2=jezmgomadezBEH359hTwuJLil7FZbnh6mdWI9CpDdcxO30xn5bldNe_Qt6ngJAgQ
