"Грунтовка White House АКРИЛОВАЯ ДЛЯ ВНУТРЕННИХ РАБОТ Адгезионная, Влагозащитная 1 кг",237 ₽,3 отзыва,"8 мая доставит Ozon, продавец ООО ТД «Поли-Р»",https://www.ozon.ru/product/gruntovka-white-house-akrilovaya-dlya-vnutrennih-rabot-adgezionnaya-vlagozashchitnaya-1-kg-534727640/?advert=iJb4ftgHuj9HbhRV0Fb0xhQJUZDO_NSh6A-uYoYSPqE5Ws2-bJgzbWhSfUecA8HzMMaNLCAIBKWNDVyhpxOru9B-NE4Iu7PTgsFjzY8Yh-ONUURneKOJkoZtcDgItXqNkciS3LH7bUbRl011D9H9GMAibKovbcSkW510gtL5_0-J8fEBcvNSJC84wkhfOhzEKLD4rwb-2AusiKD99J_AtcyoexcSSHGpbgWKnwc1JrLdiec-BID77mtauK0z1_t06Adn5INGXbOk3IXfJ_xIMUsGkHyLViRQSzR9Sb-S60aIypqfbmY-CrY5wwFb3te0PKn84bTxatmCQYVSywy6FGZHqI_-sXiIiibrV21cuUaLCuqEScXUK-BK8wMZBDCzDDmWa7yWgkhHwtc0c3d6VsMzDKvZFY89TeovwsN9zqlNd-GLWLqoSYwhPx0xYfreYOFP1Z3VpdlbC6TxpSUQENPPkN8ch4uTx3jFvs6WGpdIrKpz7xXVnShKBURpCCfe1bm9HOkF19aSg1oNXRaJ7nwuNtW9SKwenWQyrvGtixeoQCVA6rVKx3yU87PhFrGA
"Грунтовка антисептик акриловая FARBITEX ПРОФИ (Артикул: 4300002492; Фасовка 1 кг), защита от бактерий и грибков",229 ₽,37 отзывов,"Завтра доставит Ozon, продавец М-КРАСКИ",https://www.ozon.ru/product/gruntovka-antiseptik-akrilovaya-farbitex-profi-artikul-4300002492-fasovka-1-kg-zashchita-ot-bakteriy-170503303/?asb=LtJpNMoSAW9H%252Ft8tlqK%252BYHaEwgn8AuNdFnPvv1TrAcs%253D&asb2=y6fRqiydwNfeDlwWs11Yq2tsRTnmnMMP407CBQnUwyKNrdENwK0Af1rPdWqxdfVH
"Грунтовка ASTELIA COSMETICS Грунт премиум di Fondo Глубокого проникновения, Гидроизоляционная 300 кг",441 ₽,15 отзывов,"Завтра доставит Ozon, продавец Мой маркет",https://www.ozon.ru/product/gruntovka-astelia-cosmetics-grunt-premium-di-fondo-glubokogo-proniknoveniya-gidroizolyatsionnaya-503976792/?asb=r4NK5Z9uM5tIFxMrqEMGua5qkWTKEl%252F8bS6lAiwFB0PPqCFO48ioigU%252Bx8cMTUGn&asb2=hMIuco8EpIi6vDLDhh-tS010KVMmBYZQCu8x-uv6yEG8MLLKRX5PNjs8v1PSqogH4R6jWQL8NH0XKySU0cPRf6zGl-v_-dudxTtI_zJZN6uJkBu9YRViBIGKm1OpGOamejrQHULFFpxI-LJGVTLXzA
"Грунтовка по старой краске ОПТИЛЮКС 2,5кг",284 ₽,1 отзыв,"Завтра доставит Ozon, продавец 000 МастерСтрой СПБ",https://www.ozon.ru/product/gruntovka-po-staroy-kraske-optilyuks-2-5kg-522371507/?asb=4kXuVjNV06pJtnIqj5%252FJzxMy3L0mG7ZOYgrC2%252FcKD32JkCoLJO0Odo%252B7CA%252B3dN7%252F&asb2=KH3a2OxqCtaRaFbvz86JK7-yTVrXXziWNdYDfiEugyv0MZWev3ejAI_SmrmE5sqYGZlYkIRg9uJSRg7SnrTEBFk_031XnPjcvOxNaJVZfFiUKYxMYVkZpTQ7ZeakXpFu7mCEOXQg2CI_sDoocFWCEg
"Грунтовка CERTA песочно-желтая Адгезионная, Глубокого проникновения 0.8 кг",774 ₽,14 отзывов,"Завтра доставит Ozon, продавец Certa",https://www.ozon.ru/product/gruntovka-certa-pesochno-zheltaya-adgezionnaya-glubokogo-proniknoveniya-0-8-kg-311342488/?advert=fqxJi1JrPXk10bqYnlzzqZ6ecwnmp0blBRDMXbtfSeKX364E7agWOkZ2tbsba5xgndyceyavtyKI-z_3ZJHzaKuICmh081GzIFdX5Qr-mNVQnl9zJ40W2dcuPBxpQ5LOFwK_LcY2HNELkKnFszk2MW1uk-hj-zXzM6ik1TNvYH8yJRKANcCFQ8hUVvP1nkaCmceq25vMUkykR0G69Wuiu1Wm3CMyd1UYevQTJt0XCgJIOLfNLqztSKMMTzjOVf47AViE0Fl5dEFwoyg1aIec8o-72_VJ-r_yuAhNsCa_z2Hx3wogBRjwwPHqHTWsF08Lg4qszd8UOtocZ2lhJUK290fDk_TcL4dCkpJC_rOU88ls8fxebcKihBJ89Wh0utIQJZp_Wph0Azh8Mlp7YiZbracvF8rEarde75XLmBlIPXo8cDP3xzmqMY_Ft-zPEQRs3mSZt3j4JjqYGMbtXmxbwEKDuEmtQk6ygHWhX7zW4ROD_Ms54y89wpr4j_E65wMx0nNWlYxz9E9cDf3mKB0kdEd7c6e280iYsscM9yquERaJdM16dD8D5j51qTTzFDsp
Грунтовка акриловая глубокого проникновения FARBITEX ПРОФИ (Артикул: 4300008977; Фасовка 1 кг) универсальная для внутренних и наружных работ,269 ₽,132 отзыва,"Завтра доставит Ozon, продавец М-КРАСКИ",https://www.ozon.ru/product/gruntovka-akrilovaya-glubokogo-proniknoveniya-farbitex-profi-artikul-4300008977-fasovka-1-kg-309586345/?asb=sPWbrH%252FeLIeTM9RVBMBepgpymvyZNyWprCtiBlnKj8A%253D&asb2=nPJCsI1rT0uEa4xegaW4o5az8CbYga0yv-AboyFsKO3Dd_4t2vt-EzA_Ziaz4QNF
"Грунт универсальный DONEWELL акриловый, серый",232 ₽,24 отзыва,"Завтра доставит Ozon, продавец ООО «Торговый дом «КУДО»",https://www.ozon.ru/product/grunt-universalnyy-donewell-akrilovyy-seryy-538828715/?asb=C9D0lMYYgccbUUqCMf1iGAawrsfWic6T9CoZNo3iKEhjAazQOE8iwlvCoD9wDWD8&asb2=UsO-JuJqtiEGLQFzbr27O1mwG8_UcQH6PqnYvEh6KFrlAH1N06bejNCcH_SsP-7UTvcv80KLYd6CFIG6fwcVJRWJ-H-rnsDqWvvDOnHkhfc-tLTgq0LU0nhtFJV8fsMk8psW6vMQiz47Ml7mRHBGCw
"Грунтовка для мебели, дерева, стен, декора и творчества ACCENTOHOME акриловая белая без запаха 0,3кг",521 ₽,133 отзыва,"Завтра доставит Ozon, продавец КЛАССИК",https://www.ozon.ru/product/gruntovka-dlya-mebeli-dereva-sten-dekora-i-tvorchestva-accentohome-akrilovaya-belaya-bez-zapaha-306933040/?asb=DJckB4VLT21OvEbYcHLowPnBV28Du7yXB5clXy0JDYA%253D&asb2=FYUARZa9t8ClJfVNN1IxSufS70NBx_ispuSc_IT3dGMpkXIXzB2AEBsa1S94dgMb
Грунтовка Glims БетоContact Бетонконтакт 6000 кг,730 ₽,35 отзывов,"Завтра доставит Ozon, продавец GLIMS",https://www.ozon.ru/product/gruntovka-glims-betocontact-betonkontakt-6000-kg-416576034/?asb=uC90MKmHfmMsdMpOd6i8Mc%252F0p%252BRWRFDTan2PrVGYXVunEf4NdRtaxPT7V4BX4tFE&asb2=2O03vOgEZKMzYMt3aCMQFTutA7heJ8-h5Afum7FGW343JiQveV4OPf9W-3tp8gTTvFzp9IE0UVR2cltv7fba_Z9n0Z7M9GHAkdOQfKVa3Iwg-aGzXb0Mod5muuYQ6t60m5OOn0nv2PGV5s3WxSKB9A
"Грунтовка Siana Provense Адгезионная, Противокоррозионная 0,27 кг",399 ₽,52 отзыва,"Завтра доставит Ozon, продавец Certa",https://www.ozon.ru/product/gruntovka-siana-provense-adgezionnaya-protivokorrozionnaya-0-27-kg-295867856/?advert=QAJNfUtIuZ-DK6BiR3O90291QeK6A09DJogBQnKSFPhYwljgRu2w9RBem2kzsQ8XbLI8tWRwSj-_ll_iE6oS7NI_IyzJ3ULRLvfVLti2bbXU3aXjEpDVaQ-STDSUNwsNXuhwJE5Nm0jLY4rYO62XbJJUY1yqVUHBmSQknSBI-3t0Uuqqila_o98JjS2kBVlbbjGaywhZ6E3QiO_NdXQkgIpg7uEABY8SGh4OR7euwdiws46gUJ4rpTDG_fO1mr-4i0TqB_QrYvPxzxGV-8L81ipwMbpyEsHbHJVeFQWOaNW-RoaneTtOe68QugV9KkDRE-H5uWZocql9aGOXkBd0_jZ55AKG91TsDMfu3Vak3NnFX_5u_8JEKhpm__IfrJu6upzWVV-QDfU-8pbgrLXEiS8cQ7vtS5mdKoizuFSvQqIfdIxGcwbPcT-nz702zV3wjzZk-0hytdCv0PyI4JZAUHAJr9MPeXqffADlaXWHChDD_j_y4epoS-cRJysN7mpDpZKP697Au4-nfuCdCBMYxnTMoisJuTrH5JAm8aD2pEUdj0Lj7jvcAH-HM7Waft2y
"Грунтовка KERRY ""Преобразователь ржавчины в грунт"" По ржавчине, Противокоррозионная",527 ₽,35 отзывов,"Завтра доставит Ozon, продавец ООО «Торговый дом «КУДО»",https://www.ozon.ru/product/gruntovka-kerry-preobrazovatel-rzhavchiny-v-grunt-po-rzhavchine-protivokorrozionnaya-307641210/?asb=jNmXiyd%252BqKa1W67Vnfu%252Bb7pFm0VzDUwwAwDJzL1K0DhiQxRiUDYmUxT75iwr2tE7&asb2=jFQ62IxQXNgnDy1hNo-QBrHUtrS5e7i5BFW0s43d0uQR2oMeE5KPFY-YAWrZrsoUo84wBf0kRh7ht2hXSuVB75zYRt1IZP8PxaaAwvlWyW1KdaLfq8JBCnsmqDbwRCLrk7V0sTKl-O7AqNZod-OJUQ
"Грунтовка Cemmix CemGrunt Универсальная, Укрепляющая",274 ₽,70 отзывов,"Завтра доставит Ozon, продавец ЦЕММИКС",https://www.ozon.ru/product/gruntovka-cemmix-cemgrunt-universalnaya-ukreplyayushchaya-229889102/?asb=H7FT2uE5sN7VLcQ6f%252FP5nylsRVeiZLfyZoYCKG4ZAO8%253D&asb2=6fskgAH_4PsHFQM1J3sBxKUKdqkETqYpH3Oh1MAfHS0z6SVKVqD7Fu4tHPX5XXvH
"Грунтовка OLECOLOR акриловая по старой краске на старую краску под покраску для наружных и внутренних работ, для предварительной обработки ранее окрашенных поверхностей Адгезионная 1 кг",483 ₽,67 отзывов,"Завтра доставит Ozon, продавец М-КРАСКИ",https://www.ozon.ru/product/gruntovka-olecolor-akrilovaya-po-staroy-kraske-na-staruyu-krasku-pod-pokrasku-dlya-naruzhnyh-309207363/?asb=%252B%252FgE%252F3FPbtSXULElIflx4GBoEwbdcXwDSL2xmsEJ4yk%253D&asb2=1A05DbMcgPltxuJPQHP01YCiq4tECd5hZSM4YckigHjdJ4pMt0dwtqhXudNmb7MC
"Грунтовка Finlux Святозар-95. для стен и полотков, антисептирующая. Готовая к применению. Универсальная, Адгезионная 2 кг",390 ₽,23 отзыва,"Послезавтра доставит Ozon, продавец МИРИК Мир инновационных красок",https://www.ozon.ru/product/gruntovka-finlux-svyatozar-95-dlya-sten-i-polotkov-antiseptiruyushchaya-gotovaya-k-primeneniyu-263510438/?advert=5irMFFC_ybiPP0OC0y9SUWxvOr2sbG0S4Dzns3CbD9AjJvrZOipDh2KU8D0TcjF_1IEwNq2pzRbLPSk3Yz9HaP3-CiK4KwQV4xaNTducNA_us7yL5f_mIvXSUMDMIExeZQGK3OJsgasanXd1J8rJk5BmiDYXNWgB0me2Rfe4UEiacn-A5X0t2bpDSMZPADLZkOVEOSgsO74cBRBzqF5LgVJivPYNxq3xfhFpsyXe2yFFzfUcVqbOYfg3R0AnppLfTSU8WvJQ7-Rf_ya-LDgBZDb2SJJmnZ37NTltfbkDc6DFyMwuwdZxVtk91LbwYtwmuwipZplbvlzz60RlIKwSlk2CGAEwgjddxcpEsb09LawYmvV6wwOqi7K6_AakmGPaO_i_Oy8P5oXLr5lPiC2Hb4HnKzjJnXVHcFwX03mgaWLzgaaEtenUgJYbWrBSuvR93GA_1HyBTNh2cgvvxyfqpBiEs1oBz9CWjF_PULlnLxq9xOXUUF-K1NO81AgevX9EKRtIIwpvddis7euRwgMHcFQxGrCkSjFLCkygbzZrLw3pW1ZecYi0EHsAcIdZ9PRp
"Грунтовка Бетоноконтакт Akrimax 1,3 кг, адгезионная, для наружных и внутренних работ, бетонконтакт розовый",319 ₽,5 отзывов,"Завтра доставит Ozon, продавец Akrimax",https://www.ozon.ru/product/gruntovka-betonokontakt-akrimax-1-3-kg-adgezionnaya-dlya-naruzhnyh-i-vnutrennih-rabot-490423424/?asb=uAj9nblJDLHccoGVSpiQbbje7Qz6gc3%252BdeS3r3nJDwxfZKD%252B6kek2u02YrmIwKLU&asb2=qM2zeOaJwBvHltHUoLafxP3jEv9FoZ_xoIV1VpZ95pfQ2Bp04DG1tdyVHn8HyAJ6AasWNBwOWJhA2tFNAcRQxEQp8ZBoTs1HU7wnrhuXG-tJIzLoRKBxzb0GaGPxBfi0
"Состав для холодного цинкования Elcon Zintech серый, аэрозоль 520 мл",544 ₽,132 отзыва,"Завтра доставит Ozon, продавец Elcon",https://www.ozon.ru/product/sostav-dlya-holodnogo-tsinkovaniya-elcon-zintech-seryy-aerozol-168353275/?asb=%252BCgWQF%252FnAesMcHQrHhmq7Jm2Azo7iEvUYFUmCekpzJM%253D&asb2=VdlKfUySg6mDZQgS4RPByMB-TqjnTiSjNVucAgM4jIXqgAVKw_l-OTVn2DzQFsa9WuSFv1Cnq0SHbY1hPSUmYKvhz9TVn53Txjtt3AQPBldvtGowGn6r7-yDgFOkPOj4
"Грунтовка KUDO ""акриловый универсальный быстросохнущий"" Универсальная",294 ₽,146 отзывов,"Завтра доставит Ozon, продавец ЭКО-Балт",https://www.ozon.ru/product/gruntovka-kudo-akrilovyy-universalnyy-bystrosohnushchiy-universalnaya-196996866/?asb=Jiar5y0QVHdKKI2%252BL8MhSGfT90k%252Bv6fVogj5rB2YuTYI5PidptzLgKu1PU2pPb%252BG&asb2=60RoZeAl3KO5qRUgl4Z1zaeZQQgbhfuH4Klhq8rjHRFb_gnodLmONicJwn_g17qWqw_Pl6dn2S1ipUp8tQu-pAercc_HZd3-7UFmLTYAx9Pa-QUXMmRRLUEEshFqjYCrOpP7lPledXpJEfNt0B7Ajg
"Грунтовка OPTI LUX пигментированная Бетонконтакт, Влагозащитная",495 ₽,5 отзывов,"Завтра доставит Ozon, продавец Мир Строительных Материалов",https://www.ozon.ru/product/gruntovka-opti-lux-pigmentirovannaya-betonkontakt-vlagozashchitnaya-397525259/?asb=fZpTzFjTvvm4HejeArC8jFKmWY1o8ZuYJZ1Reyy481M%253D&asb2=z858sH154lX-FWZksHDfXC8-Yw8XSD9_jF4ZsZvgk_HauFpctB3qYzkMaS7FNS3G
"Грунтовка 10л Грунт Адгезионная, Глубокого проникновения",735 ₽,2 отзыва,"12 мая доставит Ozon, продавец Мегаполис",https://www.ozon.ru/product/gruntovka-10l-grunt-adgezionnaya-glubokogo-proniknoveniya-447173564/?advert=mxPXAYEgl7xetv6FG2FOeQbUaP6_NeqOQTeWU9DudYqhWO1D4XvwuY3iFr8tqV_H3MAugN099NsrU57oyvxmfgUqPQ3WwXlQLr5mbO3S_keoqCKDZQUGKSa_jBtGY1vl3PoR9c9A3v-33MgYOoKua0l1keijM_ywCOHiHVUjzFahCTIng6fUDS7RU4SzSY9jP7ZsP5KSekm2oPOpRthlKKF_XVl7UeQxSW0btg6aAl-65-gFJ5KAPt94pIDQ0Z1FtRBYROOrAAi9BDXfaJbT6gzZ6XNP8HpHeqJChi9weCtNO58ICOR2rCqFsXKjmLEl15xCGD6DNLJrkGnMYRQ9yKykW566Po9d6UE1-aWQzt2hllrQy5NVgwe75PYnE8V11dIubS0rEw4sZ4GT9hCD464aaQ8iaQsDDHWu_CVanSkA01JJrwQYFtZwwWKjNO1Dl_RDJQPoxmBir_2-LGrYo1a96EvUiOrNK0FN1X439ilJ617HFOocozW94GZ2h4xzfNJWb5ksT21W1YXSMpbf4WKZPCN7juE0TxiitGCdbaTYU-TzZYlfAB2A9F7eRvPA
"Грунтовка Бетоноконтакт Akrimax 3 кг, адгезионная, для наружных и внутренних работ, бетонконтакт розовый",509 ₽,5 отзывов,"Завтра доставит Ozon, продавец Akrimax",https://www.ozon.ru/product/gruntovka-betonokontakt-akrimax-3-kg-adgezionnaya-dlya-naruzhnyh-i-vnutrennih-rabot-490458453/?asb=Og9u553hVqvS8JIeJ0YVyhzE9DBbywki8ndAn79UdfPEn0XEtkDGXpP8qPEeswIt&asb2=2sbJRq-dxoI4oV-GnVA4S-K7uH3ysmizMPYY4zhNh5ZEw-1xR6kW7JNwF4DNnNn9bD9sTnKqX2cs5SOt3keCyxtIBqWAR0Q34eTDvzEwFvEugRznvdufJVt19SYyIKxb
"Грунтовка Bosny аэрозольная, Акриловая ,арт. 68, цвет Серый, объем, серый",440 ₽,11 отзывов,"8 мая доставит Ozon, продавец Ярче Маркет",https://www.ozon.ru/product/gruntovka-bosny-aerozolnaya-akrilovaya-art-68-tsvet-seryy-obem-seryy-288541334/?asb=ryAgsoLj33Ab08d2D9mFJoeoLxj1Po83sVwZ9iZPZ10%253D&asb2=vgbxH28jqfc2rYiEa53L9ar-LGpP0MfsjEvCZmPztipQ34bkLwArFCKjGXoZOP66
"Грунтовка Cemmix CemGrunt Универсальная, Укрепляющая",274 ₽,6 отзывов,"Завтра доставит Ozon, продавец ГРУППА ЦЕММИКС",https://www.ozon.ru/product/gruntovka-cemmix-cemgrunt-universalnaya-ukreplyayushchaya-508441312/?asb=yEp3xhsLa3DEjBH7rhRvrWZc8AHT9wsEcY0SyaW8anY%253D&asb2=LEJ6XfLgTybCQVr1bbrUjyS9RkcYuSwXYeD4nUX_kUa6fO0U3QEXZ_tecwF1rrHk
"Состав для холодного цинкования Elcon Zintech Alume, аэрозоль 520 мл.",551 ₽,66 отзывов,"Завтра доставит Ozon, продавец Elcon",https://www.ozon.ru/product/sostav-dlya-holodnogo-tsinkovaniya-elcon-zintech-alume-aerozol-520-ml-266300503/?asb=hoSPSkzR4G6BGP9kUta9S0qVOX5omJbZfZJBm%252FcnflM%253D&asb2=7OcLqKJiChuHqM3E6y0lnUfWWsq4xQ18WebiptVmP55na2m3TVAdFYfYDlCR8TubZuH1OC7tp2tNEFreDJvdOqbp5484XK2Hx1A4OxMMf8N69QHGIywZOVfWgar6VD_K
Грунтовка Castellamare Primer Глубокого проникновения 1 кг,725 ₽,4 отзыва,"9 мая доставит Ozon, продавец Castellamare",https://www.ozon.ru/product/gruntovka-castellamare-primer-glubokogo-proniknoveniya-1-kg-227564000/?advert=8HwgPPMNANKIuDumVeHVEx8we5ncdGmhXUf5ZYWI0jWN6oK898xdk7puiXTKECqtZ4jagdjjhgVR_tacK9ZuyAvDHRSnWgoQLI7-CxHKJMnoWMmxlI5cy8rs9Bck0GBO8NtRkQaC619A3ah3-mo76Z4PyyVfaS0YECGne6IgPQPalNNEPQ6o8qyM5iIthGpKxKhxqskLiIGR8nM5nK7Xg_IyW0gfttGKf5ePZTrg1RsiIKWpgRB2qHPJ1iIwAJ2YI_MXE4Cu6SLLF0LLhCKWvjpdshbi351qPYxB2DjVlEJp4Q64usRZbDCZRiGcsl2-LZwYuqUCPAxb5AoKpMn9omj6RvkRuDUUamSPvNVQY8ZGyB44iGj0XqtvU9jqesi-cp__BvVVR1x4AyUl-0bNcovGoBBYWdvuNXuorFZb8ujV5_RzYV9tNe_fGe58f8D96_mE3w-tcwuqVkwfN44zmIaCqdvhE_qeKE0ogJnswhxuFBZzvjwXvQLPle41NyUDxvDKqk2S_9Fi8D2KmIAkaII0GHuqFaDxmLAvX1eQRvKqROB9AhRaxUL4Q7fdpTiq
"Грунтовка Deton SPECIAL усилитель адгезии Адгезионная 0,34 кг",488 ₽,19 отзывов,"Завтра доставит Ozon, продавец ТД ""Автон""",https://www.ozon.ru/product/gruntovka-deton-special-usilitel-adgezii-adgezionnaya-0-34-kg-259685262/?asb=1C4vUcuhDfBYm1wcHeLfV8s3160wBokZvhLXQ5fIRRQgOSQLGd6h9PHF3cFSP6Ve&asb2=ZhzWzUpl70fY8CJXQhe0eqGZdJo0k9b4V8qwv_w0ivxQTgiBuKJ0_NvWiz5BRRp6kqOHsViE3zj6yPmlokpYMG-W1LDATm8ziFS2x4xx6dH2PeoUu7gAGzPWrSw32a7u41aquxQPFRtVdDHF7kzRpQ
"Грунтовка KUDO ""KU-200x"", универсальный, алкидный Универсальная",278 ₽,134 отзыва,"Завтра доставит Ozon, продавец ООО ""Партнер""",https://www.ozon.ru/product/grunt-universalnyy-kudo-belyy-alkidnyy-aerozol-520ml-148538556/?asb=KVEZT9qJeFtW2DGi6BfedpDS5nmkUQtPMUhDkwimeX8%253D&asb2=CN_m5J2k1mJrWEO0g9BRCJx_1TY70r6WH3IvGDujo9xZ-lDI_6EpBU90Dvq8dpkF
"Грунтовка AlfaBet 20042 Пропиточная, Адгезионная 1 кг",265 ₽,23 отзыва,"Завтра доставит Ozon, продавец AlfaBeton",https://www.ozon.ru/product/gruntovka-alfabet-20042-propitochnaya-glubokogo-proniknoveniya-1-kg-272774517/?asb=rev2T9iI7y3Jr2H82fQrZVr38WhAGXI8pTfeNr7dd9oVgyzwtGLpehbD%252B4zgALB5&asb2=UFxHHU2Aijg2ZKtXcrys5iCZ9hzGbqzKGCX-K9iBcPAbB4CHAGsQBKhm586TEUFxk8sra-b9RYTPIhx6hWAkjaE0Rw1dF1DvLkdY37EWdvz1ZK4j_OOLYFg6r4T_ddeUYtDsVS9kZigqd_gMVo5Ypg
"Грунтовка Царицыно ГФ-021 1,8 кг",409 ₽,28 отзывов,"Завтра доставит Ozon, продавец 000 МастерСтрой СПБ",https://www.ozon.ru/product/gruntovka-tsaritsyno-gf-021-1-8-kg-301908097/?asb=Bg4N8gRtjshrsINWgrNwKl1lxVREK4my5YKdPM5ZtKs%253D&asb2=bb2EWsnUScmzZXcu3a7emyY4H7Vsg3FGP6XiuEzgQD5jeH-ZqRLg3gzUJe7O4Z5K
"Грунтовка Prosept бетонконтакт Бетонконтакт 1,1 кг",267 ₽,25 отзывов,"Завтра доставит Ozon, продавец PROSEPT",https://www.ozon.ru/product/gruntovka-prosept-betonkontakt-betonkontakt-1-1-kg-435710007/?asb=CiEVQE76RR0lKs3is%252FlCPYVznOnJQx8hrvhtkD7pWvWSJ5O5QZy5GRlrFVB%252FgRph&asb2=uCAR1VWpSBGv0-kbJRZyZVMWpgOCbL6G671opXzpVetZVHoQDnlCXq5P3sp5Kqq9qAUPjltrteqCMyh2G5wz74VREGLGFTqTHReCjKM7PQWqrysQo6D3TIVMamwUpsrU
Грунтовка для стен глубокого проникновения Бергауф Tiefgrunt 5 л,594 ₽,20 отзывов,"Завтра доставит Ozon, продавец ООО ""Бергауф Строительные Технологии""",https://www.ozon.ru/product/gruntovka-dlya-sten-glubokogo-proniknoveniya-bergauf-tiefgrunt-5-l-383103134/?asb=Nd7t1R41U2tn71%252BGf0uGxFp%252Bg73%252B5bHGmYcIPJt8qiQ%253D&asb2=I8baFgZXR0X9ifah3xIZkJFtf3v4yq9Sc2es9azePqfQ1ucZYCJyFPzg0tvuGg1h
Грунтовка акриловая глубокого проникновения FARBITEX ПРОФИ (Артикул: 4300002308; Фасовка 3 кг),535 ₽,132 отзыва,"Завтра доставит Ozon, продавец М-КРАСКИ",https://www.ozon.ru/product/gruntovka-akrilovaya-glubokogo-proniknoveniya-farbitex-profi-artikul-4300002308-fasovka-3-kg-170393487/?asb=KShldTadq82RV%252BgCMwgwBQfGpthmdYcApTFPtcYSpXM%253D&asb2=bEiOOA9v_RraLWdBsJKxln255j6fRUBYAG4Z6-EuCZIeinAMLLYRoBTOy77QYza7
"Грунтовка акриловая бетоноконтакт FARBITEX ПРОФИ (РОЗОВЫЙ грунт адгезионный, грунтовка по бетону, грунт для стен 4300008927; Фасовка 1,4 кг)",493 ₽,38 отзывов,"Завтра доставит Ozon, продавец М-КРАСКИ",https://www.ozon.ru/product/gruntovka-akrilovaya-betonokontakt-farbitex-profi-rozovyy-grunt-adgezionnyy-gruntovka-po-betonu-309587549/?asb=2QvG9QvhjfOu1zfQFhSp%252Bg%252FQwKaURtA%252BIqJMtdTYTIQ%253D&asb2=VSi1I92KddVwQB_KSebzJZQIEHAsncrFXnAxfzhMhiDu4FDuBgaX2WztK6JIZ6lJ
Грунтовка Lakko Gb520 Противокоррозионная 0.27 кг,250 ₽,40 отзывов,"Завтра доставит Ozon, продавец ИП Сафаров Р.Р.",https://www.ozon.ru/product/grunt-seryy-bystrosohnushchiy-antikorrozionnyy-aerozol-520ml-165252014/?asb=m43bnEgPGi0Vr7mz%252FQ92GlvpTaISg%252BIopLmAhKHuAv4%253D&asb2=TuRI_W8measskxlquBFzd7my15AcOj8jomu3SdNf4psTc8e_hFLcCvBLeoLt1-sn
"Грунтовка для стен и потолков универсальная ThermoColor, под обои, под покраску для любых поверхностей, акриловая, адгезионная, глубокого проникновения, для внутренних/наружных работ, для фасадов, влажных помещений, от плесени и грибка 5 л, 5,2 кг",666 ₽,12 отзывов,"Завтра доставит Ozon, продавец ООО ""Стройкомплект""",https://www.ozon.ru/product/gruntovka-dlya-sten-i-potolkov-universalnaya-thermocolor-pod-oboi-pod-pokrasku-dlya-lyubyh-465055082/?asb=SiIZKi6i5kRCkLWGW2x6BkgKC1Ls2%252BM%252Bbhdlu%252B58vgw%253D&asb2=GWyfx1p_SMHuQYJppPCVZlQJFSYq9XsFZMQkHHmpYmeVbpbrA6ScBZ36yziEnGOktZka215J9qyac9EZuv74UCUaZ8QhvE0XviTEeIXee0_CMVQMKLyq0oVLZcGJXJ4A
"Грунтовка KUDO ""KU-210x"", универсальный, акриловый Универсальная 0.27 кг",294 ₽,146 отзывов,"8 мая доставит Ozon, продавец ЭКО-Балт",https://www.ozon.ru/product/gruntovka-kudo-ku-210x-universalnyy-akrilovyy-universalnaya-0-27-kg-196996860/?asb=LO9AlqJQngo7a8emVls97%252Fg8xEnALVmJ5OMWhuTvRUd1OW6CDcEZeKJ%252BJubwI8%252BR&asb2=Xe6e0xsrx2sDLHctYxuyw9WLAVCRZ3Q9O1Qsp8DuaYnuna0uq1XDRCTbFiijRGBlBfUQXwS30hM2Kj0FGP3A4ztgx1vWmJGAOeqSr5U81iJ4DhQZCDJHVIV_b3rToRQC1r5W9VyDSYq3t04jH_KqBQ
"Грунтовка Deton SPECIAL, Эпоксидная Универсальная 0,34 кг",511 ₽,65 отзывов,"Завтра доставит Ozon, продавец ТД ""Автон""",https://www.ozon.ru/product/gruntovka-deton-special-epoksidnaya-universalnaya-0-34-kg-259684161/?asb=VoVpVGti90FSr2QHSCRv%252FAkDDB3Img6nDs9d0zUB3wGMAHYUtr68H4asbLmSytzt&asb2=FMvrHocFTZD_XsNdOKTvXN-ipdyqgxliMwrh002Ovvzg56lmsYHtA4IMhECmib6-ytZycw-0yy4n-l6gFzIQ3REx3T3MiJYr_eDu87xNBKAGDXAT1N_0YK50w7zQapCMVcbucaCrGZOxZoFwTk6Dog
"Грунтовка KUDO ""Грунт алкидный универсальный"", аэрозоль, 520 мл, белый",278 ₽,199 отзывов,"8 мая доставит Ozon, продавец ООО «Торговый дом «КУДО»",https://www.ozon.ru/product/gruntovka-kudo-grunt-alkidnyy-universalnyy-aerozol-520-ml-belyy-279044819/?asb=pYEpcZBDMEFIugVYGvi7YxGcAFRzSBrqbo25OyGJk5YuDqPH86GI%252B3TjUIUmLTKC&asb2=UF4wk254UMQbPJ7-9MSRw4-BVNN8lYkKcw1ErJIthexKMKfA7RKJzPoLyNCYiFGgG2bcaRRK19-2qhpbQ0PmTz-JTaXyFX0Wz1GtqjJipWLbg3c9d5cQmzpsFSvQdIYoicGn_yoWYK5ZIugROg4hNw
"Грунтовка SILK PLASTER для жидких обоев Адгезионная, Влагозащитная 1 кг",517 ₽,87 отзывов,"8 мая доставит Ozon, продавец SILK PLASTER",https://www.ozon.ru/product/gruntovka-silk-plaster-dlya-zhidkih-oboev-adgezionnaya-vlagozashchitnaya-1-kg-295007751/?asb=kxsN1gWJWXqMWopQQb6NPGV4AHQIHUPXXUg4U0G49kXzd4qzNvqiPPSHONxHEqol&asb2=XQVvvyvtk5cfFXreT_H5c0iRhBokbn9SGyQYA3FjPVRH9D59Dk0noJY26SeHP4dvLXK1CFL43BD1sUi8W4BmEqqizcBT4EVBV_38S-9oYj9U7yG1-P3uxdZ81FxlOCLaJUZ8_X9id6ncShMDfZ8AYg
Грунтовка inRAL GROUND Противокоррозионная 0.53400000000000003 кг,239 ₽,21 отзыв,"Завтра доставит Ozon, продавец TEGRA VOSTOK",https://www.ozon.ru/product/gruntovka-inral-ground-protivokorrozionnaya-0-53400000000000003-kg-254758967/?asb=E3U8infZKQsBO1zuUwcy7cueWnPfxoniV3M4ZZpcmis%253D&asb2=Zz4Y170maUwztrW5XidLWThc--DYF1wlj3LbcKCx1miAYWb0pvF9-7ujyP_-WsbI
"Грунтовка Finlux / Святозар-9 Грунт высокоукрывистый акриловый подготовительный перед покраской и поклейкой обоев, убирает разнооттеночность и выравнивает для внутр. работ. Белый, матовый. Обеспыливающая, Пропиточная 7 кг",567 ₽,11 отзывов,"Послезавтра доставит Ozon, продавец МИРИК Мир инновационных красок",https://www.ozon.ru/product/gruntovka-finlux-svyatozar-9-grunt-vysokoukryvistyy-akrilovyy-podgotovitelnyy-pered-pokraskoy-333698987/?asb=MtqPZv51gNrKlfvm7XP7BDtpy37Pp%252FkC5DPNLs5gce0JY5yoJ2T6fYwgDcZmNSKX&asb2=45zBpA36u71qYhODT45BDR_Ay_JA5zqXytWgLRBJZzOyIDdbB0teRmOLbFqfSvGy5QKUpu7N1XSReaJvdpCKF5sRStEzWW5ZY4Sl0M45D7iOlZWyAcN9MzzFhIAGsBvW
"Грунтовка Deton UNIVERSAL, алкидный атмосферостойкий Универсальная 0,34 кг",340 ₽,27 отзывов,"Завтра доставит Ozon, продавец ТД ""Автон""",https://www.ozon.ru/product/gruntovka-deton-universal-alkidnyy-atmosferostoykiy-universalnaya-0-34-kg-326523469/?asb=SsT7cqhdUAGq40EIlYuGh2no2G5tfmnVKfyULx8zFeJm2B7phhAhp19MHbtxCOud&asb2=nc-vxbGyvQVlS7bEJ91iX5qYEfWUNs3Ze2cj5lfRdSG4U0bCQwxywEO2TmdXXK1Wmvhp4gFKyhZM-aM15uVI2OZwils_JH61cgBYJxDvp2mXIxk2aK2AIxGpN4E10PWwbuVgXBagtXQZvVHPAh4U4A
Грунтовка Лакра Глубокое проникновение Глубокого проникновения 4 кг,598 ₽,13 отзывов,"Завтра доставит Ozon, продавец ТурZonа",https://www.ozon.ru/product/gruntovka-lakra-glubokoe-proniknovenie-glubokogo-proniknoveniya-4-kg-299097043/?asb=QWPVekwtyJ5WbtSfrOJORvwUt1AyJSSqXKfn18IMd0T8XmAdB8wmQcT2HpkDZPGx&asb2=D-C4QIyP4ksHOFHFM0KJamxsYbM2YaPg00S_7N9dVN62WKlXXci1Ff68b6g4rFnU9by_-pTt3MhgJHm08JOzXrrh8jzURKkjJGJg9pvPPEeajmpQyy7Mj0i0B3ehUTPEBXzPNJNl3yrcpWGUH4bjHw
"Грунт БЕТОНКОНТАКТ Prosept, готовый состав 1,3 кг",271 ₽,3 отзыва,"Завтра доставит Ozon, продавец 000 МастерСтрой СПБ",https://www.ozon.ru/product/grunt-betonkontakt-prosept-gotovyy-sostav-1-3-kg-533161983/?asb=BbKkY1XtMSvvRxpN3Myln8qHjeNi%252FOMVPp6a9TkUCWIzWrFxsnHNNs1OQQyu9OZq&asb2=zyP1PouZ98Si9fjL4U2T4brfI6A7-h0lq_d64XFMnf-FRF1NzHFBIUCrBQe3Z-bdz32Qmjtj3j_qUjLrGmTs_vXTzzxl_qzIUZA8RD-YGNthGMO6oCiSqcGmaXqF0UyeK0F3LH4kc1E9aNfrEuz8QA
