Грунтовка БЕТОН-КОНТАКТ PaintGuard светло-желтая (ВД-АК-01-07) - 1л/1кг,388 ₽,67 отзывов,"12 мая доставит Ozon, продавец Оберег",https://www.ozon.ru/product/gruntovka-beton-kontakt-paintguard-svetlo-zheltaya-vd-ak-01-07-1l-1kg-219869922/?asb=P2sgP8LfQu7Z%252FRa1jpWDmfCtiiPB%252BDLYPL23bZj6Wv2Kk0UhWr43mr%252FlS%252FrRyQR3&asb2=xlcSxKqDwOk31wwv6ktYxseTalWyYe7dl-_N970HWd64t-3x9d6TW0Fcoeo8SeFYw0fgfypvKVCO1-nGcxlUcdVa-6iwPKwgK67fBrR1Tlhbdcy3aX6X1EbLjTlAJlmOrzebPpi5nwDuP5GDHKAZgg
"Грунтовка Мистер Чо Побелка по бетону, кирпичу, дереву, ДСП Универсальная 2 кг",284 ₽,1 отзыв,"Завтра доставит Ozon, продавец Кузнецова Мария Владимировна ИП",https://www.ozon.ru/product/gruntovka-mister-cho-pobelka-po-betonu-kirpichu-derevu-dsp-universalnaya-2-kg-285646900/?asb=3CK0Ctsh5NM83dKE2RxhTammhEl%252BScVzhB7Ww6LDGqc%253D&asb2=eYtK9HTMzGZmXmyH0hyXIkl8rFcG1r6jkpvDNZJK61sf0hEJ91NR0QEe5eNqowpG
Грунтовка Монолит Г-2 Укрепляющая с антисептиком Укрепляющая 5 кг,805 ₽,7 отзывов,"8 мая доставит Ozon, продавец Мэйджик Сервис",https://www.ozon.ru/product/gruntovka-monolit-g-2-ukreplyayushchaya-s-antiseptikom-ukreplyayushchaya-5-kg-227163990/?asb=LnCfznlNwfJZfCYfOuSOyDeJD2qsGbbckpN%252BY8%252FoTcD%252BoVugyfLdNv5in84JK5nw&asb2=SvAXx8ypvyC3VAlKAJ226gVCeooeIe9pwJkukq-sZ39mT5NjkKWKIxtRGIKXoxjWH2JOVot_Of5x_tDD1MokVUrTUQbaLYymnRoU27G1FmwC3Le_vOM3sxt7XdLL9wZispbN-42QaB8n1R0of_xCDA
"Грунтовка PROFESSIONAL для стен проникающая адгезионная универсальная акриловая с антисептиком для внутренних работ PG101 Противоплесневая, Пропиточная",589 ₽,18 отзывов,"9 мая доставит Ozon, продавец КЛАССИК",https://www.ozon.ru/product/gruntovka-professional-dlya-sten-pronikayushchaya-adgezionnaya-universalnaya-akrilovaya-489290192/?asb=aIaCP9gRVXa6s0jJ2kNRdqmt7YTjeIS4kvXVrM%252Foqpk%253D&asb2=ulgh8zNkVX-rVma9xXw29CpVA1UJWwH6F6Q9ApeJyGt0-ppD-I8byj2rnfyD97jR
Грунтовка Neomid по старой краске 2.5 кг,946 ₽,2 отзыва,"8 мая доставит Ozon, продавец ООО ""Титан""",https://www.ozon.ru/product/gruntovka-neomid-po-staroy-kraske-2-5-kg-335426885/?asb=kB%252B%252ByZAxrJizvHfMri1pvWMoZDp00%252BAi675QoxgGszw%253D&asb2=Wo7OGdWItJedmbfO77TcAhd5Z1aeK9I9sYK8pIvF9fazcmI2fPytRcZz4t_XcydS
"Грунт АКВАИЗОЛ Prosept влагоизолирующий, концентрат 1:9 1 л",426 ₽,1 отзыв,"Завтра доставит Ozon, продавец 000 МастерСтрой СПБ",https://www.ozon.ru/product/grunt-akvaizol-prosept-vlagoizoliruyushchiy-kontsentrat-1-9-1-l-533021166/?asb=BXnhbPpkcQCZMQ74xKXVZ1mTwX2D061uOKHiTxlYKGcWnv5%252BQV4VLPan5dlXWR%252Bw&asb2=MwgtKaJhunEb7x1uHhk8TWGG7kPQjKr2WuywaYjA9dzQSh2kzFs3qFkpbDU_BN_TKgf7hLBRux3-XlZ23ri66_NlHJ5aWzO-xN1HK-YH9p4cnLHo4Xvytc3F7MQM-tK9CqZqeCLVkJRNTb2WbXqRVA
"Грунтовка zinsser Bulls Eye 1-2-3 Primer Гидроизоляционная, Противоплесневая 0.34 кг",950 ₽,2 отзыва,"8 мая доставит Ozon, продавец Строй-Ярмарка",https://www.ozon.ru/product/gruntovka-zinsser-bulls-eye-1-2-3-primer-gidroizolyatsionnaya-protivoplesnevaya-0-34-kg-258041493/?asb=uESQgnwbLx8YNfpqtT2Av5pC8JO7OiJw15CHNrGE9P0%253D&asb2=k1F99Jf-pGQg2xi5fjyt-y4zA7sVrIIa5CFjWtnEIP6x5MZqFBWchGC_MS9bAONh
Грунтовка Decorix А22 По ржавчине 0.31 кг,436 ₽,3 отзыва,"8 мая доставит Ozon, продавец краски-эмали.рф",https://www.ozon.ru/product/gruntovka-decorix-a22-po-rzhavchine-0-31-kg-247715594/?asb=wnHsh1WdN%252BNyQlabXCH4xjKkTWYfn9hVnd6WG6wwZA3N8D9m3CxIYLi6DyoYgYcG&asb2=wPXOart-AyMSGL5bPUJVl6a2MCBnQSlgsdX9YfCJ-giYf3uW-k3NRgVcBYZ9hIS0dbm6I26xQ-K58EVrw_9b1G8gr7e2oNM5OBuwsfcCjRTDSCcLBVqv6PBHKJeQzkmY4ghoMCu09yii8aBmEQDW3A
"Грунт аэрозольный алкидный светло-серый ""Deton Universal"" атмосферостойкий 520мл",383 ₽,2 отзыва,"Завтра доставит Ozon, продавец 000 МастерСтрой СПБ",https://www.ozon.ru/product/grunt-aerozolnyy-alkidnyy-svetlo-seryy-deton-universal-atmosferostoykiy-520ml-298319504/?asb=Py1NY8N%252FOiN16gQH6XcoTpSWowCXrGZCWsbuxKUwL1NmBm5f3cXNMSPS1m7tbNJ6&asb2=tObo9tule9mOXSra_5TMIOVC8j19LGxHfI72z167zgYaNKc7bsDYdcwkgJ2FTaiGmI5Ot-zyInbWgRIgsYxoJrAn_i36qNkepvJo4S6dZ5KjaXWwhkG7QGHramEelAdU
"Грунтовка Симбирские краски строительная Бетонконтакт 1,3 кг",321 ₽,4 отзыва,"8 мая доставит Ozon, продавец Мир Строительных Материалов",https://www.ozon.ru/product/gruntovka-simbirskie-kraski-stroitelnaya-betonkontakt-1-3-kg-436525833/?asb=P9FAwDEmGo0ruP5woVx1v5o2dEOgv%252BnffWN7J40aDhI%253D&asb2=Wm_vEsC7y2NZH09VseEBauczNT4bjobraHJfATbuBCz3OqxPcyIptKG5pQq9C3z7
Грунтовка KUDO Алкидный Универсальная,285 ₽,39 отзывов,"8 мая доставит Ozon, продавец ООО ""Товарищ""",https://www.ozon.ru/product/gruntovka-kudo-alkidnyy-universalnaya-227766844/?asb=i2GXDlhLM1MgHH2Rt31r1GclQyBFImuukGith1UbWko%253D&asb2=mtzpSzQvPdKAgzOH5ZZ8jphwRJaYuCPwVKGPxdlFl-13j8L0e25hv5VYyjgPeV1W
Грунтовка Бетоноконтакт 7 КГ РОЗОВЫЙ грунт адгезионный акриловая грунтовка по бетону грунт для стен грунт для краски грунтовка перед покраской противогрибковая грунтовка для стен грунт для покраски,888 ₽,11 отзывов,"9 мая доставит Ozon, продавец АПРЕЛЬ-SHOP",https://www.ozon.ru/product/gruntovka-betonokontakt-7-kg-rozovyy-grunt-adgezionnyy-akrilovaya-gruntovka-po-betonu-grunt-dlya-395305973/?asb=AeBjLawLQr9W7DsA1Okgv4V4unF3N7y4PxB39F6fk7unZmqPNOtg1k3OZVp%252BEMn7&asb2=cApwnSMrl7Y6noSbrws3NIu8xo87jNubEOmE7LPRI72UNNOwLqMskFlz3G86r9SKb4Ldl0aIRiMpPe0MUD8awCR_oBYClP6omTejTpiyOBTQ8c-nya-Hik-eZE3cjcGbJr3IayjGe6xYNhAvrYAbDA
Грунтовка GOODHIM GU Универсальная,960 ₽,96 отзывов,"8 мая доставит Ozon, продавец ИП Новиков Д.В.",https://www.ozon.ru/product/gruntovka-goodhim-gu-universalnaya-173787813/?asb=LItHFVJrReOPxsjHhOpJhgB%252F8S8cOX%252B9jvLyTr%252Fh31U%253D&asb2=sQnhvgRJXZZftyzpLvnyotUeSwG5eoPnnaLSli-c96prv2-vRuK8_5fl-uTgi7vR
"Грунтовка SUNKE Light Grey Primer Адгезионная 0,360 кг",249 ₽,1 отзыв,"12 мая доставит Ozon, продавец Накито",https://www.ozon.ru/product/gruntovka-sunke-light-grey-primer-adgezionnaya-0-360-kg-526479729/?asb=RWy7r3k6KHtGbBhR85VWzCWyr%252FEcjNPfdVmeWCUBqXU%253D&asb2=HQ_QkYhu13d3B2xis3-MfWGz1gYF7GiDlO4rxH4pTDhfgnUoTv_v-QGumYRvP8Lt
"Грунтовка акриловая бетоноконтакт FARBITEX ПРОФИ (РОЗОВЫЙ грунт адгезионный, грунтовка по бетону, грунт для стен 4300002317; Фасовка 3,5 кг)",957 ₽,38 отзывов,"9 мая доставит Ozon, продавец М-КРАСКИ",https://www.ozon.ru/product/gruntovka-akrilovaya-betonokontakt-farbitex-profi-rozovyy-grunt-adgezionnyy-gruntovka-po-betonu-284255857/?asb=BqT0rk0gn%252FP2%252Fzv%252BAB1y5r1thj0LKI0Pt8uDxoUkVLUUCIMGRUP74khlXbHHZ9%252FV&asb2=yy3qI70Dc01dEyqgumiP8GiDC-EWTrEnHIWhWW_jCx_PmaIndgiNlXP0uZN-CLRK0Vq9dbvzB_6EgRAH08qvPbhrj4S3bd1-NpmU-zo2q9Qu0DPCYI2fY85R7dBgQXkX
Грунтовка inRAL GROUND Противокоррозионная 0.53400000000000003 кг,447 ₽,21 отзыв,"Завтра доставит Ozon, продавец TEGRA VOSTOK",https://www.ozon.ru/product/gruntovka-inral-ground-protivokorrozionnaya-0-53400000000000003-kg-254758682/?asb=yymDxSDmxd9j4PFL9S4hYYnaB1aWGdtEfnpBvhd4w4c%253D&asb2=-rKv2u8P0WkuLE2pKt_kSpmxdSEV6wIgjT2dwF5FDAgxKZ154fGR1WCFjP4at2LM
Грунтовка KUDO KU-6000 Адгезионная 0.52 кг,571 ₽,5 отзывов,"9 мая доставит Ozon, продавец ВЕРТИКАЛЬ",https://www.ozon.ru/product/gruntovka-kudo-ku-6000-adgezionnaya-0-52-kg-215921524/?asb=F1XsuMW2ddzZSdP1ER9hr0ys7%252B41oZtZOLpsi10%252FUlI%253D&asb2=O93VQtR7lronHw7OWwDSO2OCSuzOfFj9QDKqtJyOM4eIvhrcH7O3v_CjEu3-KLrQ
Грунтовка Proremontt ГФ-021 Противокоррозионная 0.9 кг,390 ₽,16 отзывов,"9 мая доставит Ozon, продавец ООО""ЛидерГрупп Строй""",https://www.ozon.ru/product/gruntovka-proremontt-gf-021-protivokorrozionnaya-0-9-kg-184110803/?asb=M0Ta4JRGACL9gsZxQc1ftDQ8Fwe%252FlQ4F6ggzF9ivZrM%253D&asb2=wmmrNEyH87mxXeuPmfMork3wR3yg66YWkjCTtrwMmA0D_E4FHPWkPjrHEPU6Uwxe
"Грунтовка Neomid PRIMER Влагозащитная, Пропиточная",640 ₽,2 отзыва,"9 мая доставит Ozon, продавец ""СтройМаркет""",https://www.ozon.ru/product/gruntovka-neomid-primer-vlagozashchitnaya-propitochnaya-334004748/?asb=jz%252FQ8h1m3Cg0sweY0PUm3U%252FL8j4ry3zl4FMWOXWfaYSX8vn%252BA397Qt9vcjAmhUIi&asb2=M5-ER7VjwiBg29CETnV02absiLBWh9BNj6UpjoSwynHBIFWia2sGomPmDpXl8vRFZTEYxAXrJAncGtlkPdTqeW2Gpy8Qy5u23dkzxqgXYMLrWurCsRnTscMyWf6VoLLAzoMWY-3T4IXhkMqRVXcxiQ
Грунтовка К507 6 6 кг,686 ₽,1 отзыв,"12 мая доставит Ozon, продавец Мегаполис",https://www.ozon.ru/product/gruntovka-k507-6-6-kg-388042624/?asb=3my%252F3v6WEnjB3U0vLkWq9SEMMWLJW8ND4wrtu3FkdFopNBjD9Mdun3OBk7Cp9f%252Fh&asb2=jyANhJr9gGssjAE24UX4V6T6Qz9ON8JDpBlecvBATfph9hJJwo0JscwQkrCAV7Poa8oJxOUPrvyL5Dgrg7vPDpr68YT2zIDxZSZYK9GaAu8hFUHbhySSy40cN4zBqZ0J-Q15AeTvXc0cgJRGkrR9qQ
Грунтовка ThermoColor Адгезионная Адгезионная 4.2 кг,593 ₽,4 отзыва,"8 мая доставит Ozon, продавец ThermoColor",https://www.ozon.ru/product/gruntovka-thermocolor-adgezionnaya-adgezionnaya-4-2-kg-400357684/?asb=%252BtDhFUsMeGjm30SY6WgC5%252BzgmhEED6WSPSfmbSfFXvDd%252BHLlNffdOBbi%252FJFGn6GC&asb2=508kEWNmvNrHBdfqrqyUYbN_X3gXumQmaOq7P0RH4w_eteiJaygH4Gig9Xv2xFpFGG6kQR-myD5z3nZ9PtUQ9kAlaE2DSCh9CK4rrF663ZXOFmDB9_COYDsgns9ujqVL
"Грунтовка Царицыно быстросохнущая 2,6 кг",570 ₽,3 отзыва,"Завтра доставит Ozon, продавец 000 МастерСтрой СПБ",https://www.ozon.ru/product/gruntovka-tsaritsyno-bystrosohnushchaya-2-6-kg-326064526/?asb=ha1P9yTYs2B86JIivsrBy2ssGEAsHj2b6hu%252B4XrChm12h6XWiKNwp9fGIpw1GnWg&asb2=CcR9E7qw6Allocj4_AfX74l-uRQCs081_O4cFfb5cfbWj1vnZBWujgWtsRaXEO5Wz-DbLH5YcSJw8kbyEuWB2dphKVSysf8uUm8AcnKIR3BxCCQQAr7-GituA8OGpz3et9J9N6Ul0GVKjddL2UbaUQ
"ГРУНТОВКА DROP глубокого проникновения, акриловая для внутренних и наружных работ 1л",215 ₽,11 отзывов,"12 мая доставит Ozon, продавец Absolute",https://www.ozon.ru/product/gruntovka-drop-glubokogo-proniknoveniya-akrilovaya-dlya-vnutrennih-i-naruzhnyh-rabot-1l-512352156/?asb=occe9vJSUA%252F0qS2Ia1wp9NflZuYZaJm%252BBVx13EzIenA%253D&asb2=gc68qOOlavuJjCJp4aYqCusDjN2gikvkUcIKB4XoERZ-Yv2e4pxuKIq3g5hIR1AG
Грунтовка OLECOLOR акриловая глубокого проникновения OLECOLOR.ро 1 кг,291 ₽,4 отзыва,"9 мая доставит Ozon, продавец М-КРАСКИ",https://www.ozon.ru/product/gruntovka-olecolor-akrilovaya-glubokogo-proniknoveniya-olecolor-ro-1-kg-309452761/?asb=%252FxBtTrwTsZwidrxnVvZtYbQA7FMk2Woeq1RyH72ljJKr5XaITStwjwXlrQOwW%252BsS&asb2=aGCCuZvJuLvLYkFzgY1V2hECaJM-ZhOcRMa0CkecmDs3rM0RwCy4EsWU-w7AgBPtgYouNvkOR5luZ7SKt5N_ygRRCpeuDQvd_JZvtdEGKhxMaQvrc48Xz5Pl6d6vqVJYmBMKoHVC3N9KYK3YEB3EJQ
Грунтовка Magic Line 910,530 ₽,2 отзыва,"13 мая доставит Ozon, продавец БАСКО",https://www.ozon.ru/product/grunt-magicline-belyy-450-ml-aerozol-ral-9016-167339666/?asb=KwuzkB6LvLoC4tdlpZ0m05U1o1uU3zz8gzdjC5mBrD4%253D&asb2=_ZyuWcjLCbs8Ju2Tsl0MKy8Iw_emFslywuEHQ6i_sDEyUsunMwOX2anJq-aNQBH5
"Грунтовка влагостойкий Бетонконтакт, Адгезионная 1.3 кг",488 ₽,1 отзыв,"8 мая доставит Ozon, продавец Мир Строительных Материалов",https://www.ozon.ru/product/gruntovka-vlagostoykiy-betonkontakt-adgezionnaya-1-3-kg-476464907/?asb=0K2uXsNrh290om7G%252BPxRrPlTiaWca95PeCQ17pSrpcc%253D&asb2=_CcXnzKJgI6B5Fz8SRJ3GD38qZmxq9vgwzWC0Zh9Xvv7m2R2p-sr0sT2C1oYlzJ3
Грунтовка Лакра Синтез Проникающий Противоплесневая 1 кг,272 ₽,1 отзыв,"8 мая доставит Ozon, продавец Стройбаза ""SD MARKET""",https://www.ozon.ru/product/gruntovka-lakra-sintez-pronikayushchiy-protivoplesnevaya-1-kg-466949782/?asb=id8ajotZ%252BsXlS0Qsiu8yKn4AlPFKecddcSnzLGYTd8A%253D&asb2=_aO0oV_cJYBNZBjJJaABt58ePvpuK63xO3BwI9Za4KgTledMnj8X5AfTao7jqobI
"Грунтовка Гибкий камень акриловая для гибкого камня, гибкого кирпича, гибкой плитки, гибкого мрамора. Универсальная 1 кг",359 ₽,22 отзыва,"9 мая доставит Ozon, продавец ООО ""СЕНАТ-ТЕХНОГРУПП-УРАЛ""",https://www.ozon.ru/product/gruntovka-gibkiy-kamen-akrilovaya-dlya-gibkogo-kamnya-gibkogo-kirpicha-gibkoy-plitki-gibkogo-215264939/?asb=By4aC1Gf0%252F8j4qJtaIZQTbOnBcZdxw%252FDZxwPDUnKtnE%253D&asb2=-KfSdGyTL-HQvPWIdDIAMFCqxCFa13pqQFeAgxfLM3PRYTxFnJlJDUnGmmtYgJxE
Грунтовка Лакра ГФ-21 Противокоррозионная 2.5 кг,837 ₽,9 отзывов,"9 мая доставит Ozon, продавец ООО""ЛидерГрупп Строй""",https://www.ozon.ru/product/gruntovka-lakra-gf-21-protivokorrozionnaya-2-5-kg-216840483/?asb=zcj1xZYsZd5N%252FDGTKOSXOHUGUEGyr7ZZYrIpXqukUQU%253D&asb2=EslPj5p5EOWLBA7vBRbAhiIsItopcfTdodgZ0-NXpbEJ1oHGJuKzBQp1RVGW1mz5
Грунтовка Акватекс грунт Противоплесневая,360 ₽,2 отзыва,"8 мая доставит Ozon, продавец ВСЕКРАСКИ.РУ",https://www.ozon.ru/product/gruntovka-akvateks-grunt-protivoplesnevaya-541893148/?asb=c%252FnYYNKi%252B7Uhp2eaAHEPbW7DSsKjH8VeIZrXDHAAc5jmmWfaINDU73ORsH8Ynp8R&asb2=SZLR9HnrgDgfX3PsQfEjjWlLiFmY3KaUiF4ti2rELNfhNCUbSw5sEa8DXywFkojc5Tsxnkwd2xGiQYELwEbjyorkifxcg8AclY1vicwdIfYqjZ8LUtcQR3BUclGQFFpuo2A5RF4bK1R8xv70MliL6g
Грунтовка OLIMP osb primer Пропиточная,864 ₽,5 отзывов,"8 мая доставит Ozon, продавец ИП Бриндарова Дарья",https://www.ozon.ru/product/gruntovka-olimp-osb-primer-propitochnaya-468717846/?asb=Jjz8pCL566J1cyAxLbzrxRAiLJwameh7d%252B4KOlxEvWg%253D&asb2=NiuggBI_i9H_nubfj_UEx_v5ReMH186f_wbWe1UJ4JD2XlLU_ss2hVKkxUD7aUUe
"Грунтовка ГФ-021 FARBITEX (Артикул: 4300005989; Цвет: Серый; Фасовка 0,8 кг)",366 ₽,1 отзыв,"9 мая доставит Ozon, продавец М-КРАСКИ",https://www.ozon.ru/product/gruntovka-gf-021-farbitex-artikul-4300005989-tsvet-seryy-fasovka-0-8-kg-311435877/?asb=XOvaxYRB%252F223YYNGyyiSniPeUpbDlVKE3HKa6gEUZxw%253D&asb2=Kwm2cR-v5f_xzI1FPNV8GIVzTlhqUVJvcGpZb2HFnUveh_FCLAbsWV9UzFc_9KAG
Грунтовка акриловая БИОЗАЩИТНАЯ PaintGuard (ВД-АК-01-08) -5л,799 ₽,17 отзывов,"12 мая доставит Ozon, продавец Оберег",https://www.ozon.ru/product/gruntovka-akrilovaya-biozashchitnaya-paintguard-vd-ak-01-08-5l-227950486/?asb=o1cZ6aHiwG4QJN1vVoPciefQJq%252FIEDq6%252BMu6V8%252BYVVEBFitw%252FeCsmQZfhdGXf%252FWR&asb2=RuEcmK6-kM6WM4I_GeSKsqEPbTPwwhM2BRodG661bPohzyPWtkX8XEwCgNlwS2gkeiXY9m01jMF6erG6FUR4RdubFZ7caJ0mVVTZOal8iMIYcekjYt3ijvLP-2DLFUiPAAjct2izlN-5wIY90hzL7g
Грунтовка акриловая глубокого проникновения FARBITEX (Артикул: 4300001559; Фасовка 5 кг),783 ₽,29 отзывов,"9 мая доставит Ozon, продавец М-КРАСКИ",https://www.ozon.ru/product/gruntovka-akrilovaya-glubokogo-proniknoveniya-farbitex-artikul-4300001559-fasovka-5-kg-230782113/?asb=ZOAhOmi60OcMEYLpijxyX9HXD9k6wMQhpbYzLKdwuxQ%253D&asb2=o1SBOI6CrumejpW6ifDWvt-m7wc7fVYDLhvrhYcxTNQN5oBg-KhVVD_WLNHcB2MZ
"Грунтовка Г-1 Адгезионная, Влагозащитная 1 кг",228 ₽,4 отзыва,"9 мая доставит Ozon, продавец ЭСТР",https://www.ozon.ru/product/gruntovka-g-1-adgezionnaya-vlagozashchitnaya-1-kg-369360694/?asb=n7XgZeSFAbNpZIXDTz9BjadsNoYYRnKiaYzCpXLjvCk9DqiiTfMBzVyfjADA7d1d&asb2=oc-_JdWhu0_Ud0VXZ4vVv3DiswNKlpc6KCr1t2GDHFe2dz6NNV8Fk2usI3_V7dqB4RpuU9lTNV_tHMgRQzjXpEFJyTY8bEGwo5Qt3OQSme9SOQgfPbpuTBz6L2zOIOhJz5L_EbcjMMXDyMidPTnuNg
Грунтовка Лакра PROF IT Универсальная 4 кг,774 ₽,24 отзыва,"9 мая доставит Ozon, продавец ООО""ЛидерГрупп Строй""",https://www.ozon.ru/product/gruntovka-lakra-prof-it-universalnaya-4-kg-216806377/?asb=6xM3L2ZZ2%252BNkpCdO8r%252BBBIk0FyFajnb6ayXQEC55pO4%253D&asb2=cenAldu-5SzHs827b6fKRVs5dphILx_Aj9yyC4gL9llyVOsG-rGqrsSXlAhUJmlM
Грунтовка АНТИКОРРОЗИЙНАЯ быстросохнущая ГФ-021 Серая PaintGuard - 1л/1кг,496 ₽,34 отзыва,"12 мая доставит Ozon, продавец Оберег",https://www.ozon.ru/product/gruntovka-antikorroziynaya-bystrosohnushchaya-gf-021-seraya-paintguard-1l-1kg-219869998/?asb=5qjw11svZ1j2e2CFp5754b3EeFL7la87%252FxDqY7uJrey5fvVB65RFQ0nCpgUuE7XT&asb2=9UAdNUKjsZQ4JVqUy5XmezyNcKC22n7ocRUw1XVOjlIbAv9TcAOWtUUJ001vwoJYPwilp2dw5tNAD4CTmTZUcSNFwZ0yHUoJeJHav6VGEPJ97V6C3qJifMd0-ubLZnEFTgyUfmq7ewtQJMIcYNWrMw
Грунтовка DALI укрепляющая Укрепляющая,936 ₽,1 отзыв,"9 мая доставит Ozon, продавец ООО""ЛидерГрупп Строй""",https://www.ozon.ru/product/gruntovka-dali-ukreplyayushchaya-ukreplyayushchaya-287522202/?asb=XbODko6CXN0L9lNGBBB6Vpb1GqNU7FxhdcsPLvjmAjs%253D&asb2=o347WpD964i4yVE0_Ovsoc1gxtaEzugRq_sbWLaYnHeki9m54SzUmUTUcEmJbMt7
Грунтовка Гибкий камень для гибкого камня Универсальная 3 кг,615 ₽,22 отзыва,"9 мая доставит Ozon, продавец ООО ""СЕНАТ-ТЕХНОГРУПП-УРАЛ""",https://www.ozon.ru/product/gruntovka-gibkiy-kamen-dlya-gibkogo-kamnya-universalnaya-3-kg-208582113/?asb=XzrOarnwaDDqezV9u%252FnEHv0zMYEn9nZm%252FhgHHGaJI9M%253D&asb2=Dt94zePQ12RmgjyMq8KjuKWr0Jz72QEvJMr0k8l4vKXiCxOxk9Y96qN4cm4A9qAg
"Грунт аэрозольный алкидный черный ""Deton Universal"" атмосферостойкий 520мл",383 ₽,2 отзыва,"Завтра доставит Ozon, продавец 000 МастерСтрой СПБ",https://www.ozon.ru/product/grunt-aerozolnyy-alkidnyy-chernyy-deton-universal-atmosferostoykiy-520ml-300182511/?asb=26xg9k3%252FPzRHqRyKfeCiMmX90YjdFASCIyzMY971zRT4BmVINjojfxwVobUY0Dtn&asb2=5zRPxGFs4efZ5A8MllAEcgsHBc14tKxMWDxc95lPwnTKJsrw9MLBlKB4fuh3InDEBn78ZUxGgrWOlhFdyiCeurJK3evtGIDCms-s3elRijk83le0qmT1WxerlUoTpG-z
"Грунтовка ThermoColor Универсальная Адгезионная, Глубокого проникновения, для стен, полов, потолков, обеспыливание поверхности 5 литров",749 ₽,54 отзыва,"8 мая доставит Ozon, продавец ThermoColor",https://www.ozon.ru/product/gruntovka-thermocolor-universalnaya-adgezionnaya-glubokogo-proniknoveniya-dlya-sten-polov-potolkov-251246157/?asb=VS9FW5O2bsha8p8%252B1Wr01mXxw%252F1iOlnTt%252F5O7rhAkDY%253D&asb2=6ZTEkCXxs2iaWCgO3VeKTYSWhalg0f3x5kJ8N5hBNrBra88M_SobaeeDZXVfnsoJ
Грунтовка Neomid ВлагоStop Bio Адгезионная,779 ₽,8 отзывов,"Завтра доставит Ozon, продавец ООО «ГудМастер»",https://www.ozon.ru/product/neomid-grunt-vlagostop-bio-kontsentrat-1-9-1l-sht-149315034/?asb=hAVgthqEWYA%252BWyZts%252FkL%252Bch6%252BBBVqTx0AATLfwKxY3I%253D&asb2=H9J-wljKYZg6CNQyReThidquxzLAKwEfVpuBmHK70jas_RIuOoHQAdCB5L2VfbEh
"Грунтовка Царицыно быстросохнущая 1,8 кг",419 ₽,3 отзыва,"Завтра доставит Ozon, продавец 000 МастерСтрой СПБ",https://www.ozon.ru/product/gruntovka-tsaritsyno-bystrosohnushchaya-1-8-kg-325838600/?asb=%252Fli8hAuXroG8XlJsoIBW%252BesGt4DQGhCQBUwqCXQLgwezCwVAo44umujXTsHPH%252Ffd&asb2=8weEBB49cJTINKlcmtgEarjWJTV58ZV9wKPNW0aww-vIzdODuppW2DY9QcAJs0CxfnmHz-9ejAQUPXtYSXGO7ae3LChCQ1dp7fdM2OjMTxPk9Mk_q2Nio2ChLhbYmoamaObLLNZIlcZdIOwwQ_LZBA
Грунтовка Лакра Синтез Глубокова проникновения Глубокого проникновения 1 кг,294 ₽,2 отзыва,"8 мая доставит Ozon, продавец Стройбаза ""SD MARKET""",https://www.ozon.ru/product/gruntovka-lakra-sintez-glubokova-proniknoveniya-glubokogo-proniknoveniya-1-kg-467135152/?asb=K%252FtSZQhYPr00sLqTvmIBq7PfXJdRDpOSSGvZ%252F5bygWU%253D&asb2=CKLCtCH6a8LsBH5lgqjK5x_SunJtIM7PJsA5ZUf2-e85L9YKBg5kUCfcqts_-XIM
"Грунтовка Ceresit СТ 17 Pro Глубокого проникновения, Адгезионная",985 ₽,3 отзыва,null,https://www.ozon.ru/product/gruntovka-ceresit-st-17-pro-glubokogo-proniknoveniya-adgezionnaya-233052985/?asb=YWP9yEbT7mf%252FQ789QQ4q0SZxgVnzS5Oj9eZbi5K0ezYRbvZ7lPvqmOLIDYRkPxgj&asb2=K6Lf0Y6Nf6y6Kr_xm-YTq8zPRQkE00bpBehMR_b6-yZf9xx5RvB_vVODy5_DBvPZpc35nCPw1nyrtUuNCyctf7JrwXGoHJN3VZfwBrL3sOYkNOXwE0h6ztlcyFFf0xgiLK0If6EvjmuFgI_N-FelKw
"Грунт аэрозольный алкидный белый ""Deton Universal"" атмосферостойкий 520мл",340 ₽,2 отзыва,"Завтра доставит Ozon, продавец 000 МастерСтрой СПБ",https://www.ozon.ru/product/grunt-aerozolnyy-alkidnyy-belyy-deton-universal-atmosferostoykiy-520ml-298320257/?asb=1ah89hRallay1mdeokLju4yGGZGIs41d%252BkgXEyWCIhJd2zoHKvg2Bx%252BlMMD92f4u&asb2=EPG-RR-nZGS-V3G4j7qE9hVicl3-XHhPsVChb1ayb-UkWkZrv8zqngj6VIedvmKGtr96otV3oBqtmQBgGiY5kyn6cdw2C116w8deT2BLm1hj2KDUbOazkTlCm6QgqE2-
Грунтовка Alpina Expert Grund-Konzentrat Глубокого проникновения,881 ₽,3 отзыва,"Послезавтра доставит Ozon, продавец Термокит",https://www.ozon.ru/product/gruntovka-alpina-expert-grund-konzentrat-glubokogo-proniknoveniya-250765025/?asb=%252F0MOb8%252FOZ%252B4aJzNX3fNw6EgGuDG%252FnxzIwR2aYlnf704%253D&asb2=Nrcy_Im14xjc2wNG1ZT6tS7cJLUA83hAIYBUdHrW5yJ1-hVTjcMVWg4mLSx8LgVD
Грунтовка KUDO KU-2003 Универсальная,294 ₽,11 отзывов,"Завтра доставит Ozon, продавец ЭКО-Балт",https://www.ozon.ru/product/gruntovka-kudo-ku-2003-universalnaya-198428113/?asb=zNzhXCdMD0axf0ZyE2Ew%252Bq3KlLtU%252FayVR%252BXj%252FtkUqj4iLRlK7g6FT6VRVIFiTuK2&asb2=6cV01RjlMZRePs-3lzTpBvpDG1--XLuk3nuabO_noRphbnNz72htSagtdSOYKkyn2S7vZhaB_qiINU98z16MXluhD2vTXYeOrA518Jow8EwGERdXtSi_H8eOV9hKestGmxPLrrGp0PVmHSgkRsZZeA
Грунтовка Proremontt ГФ-021 Противокоррозионная 1.8 кг,579 ₽,16 отзывов,"9 мая доставит Ozon, продавец ООО""ЛидерГрупп Строй""",https://www.ozon.ru/product/gruntovka-proremontt-gf-021-protivokorrozionnaya-1-8-kg-184110791/?asb=8CKlpfnwXHkA9gQkcAupvZSXA29Mdm9gWaZFZtmZo1E%253D&asb2=rfyPBl6634Sq-IJNLQ1EI3sj1h4pGXtbVNlCktBz6Dw_YDbDG8KMcE44ZKqG5fhC
"Грунтовка Момент для обработки стен перед наклеиванием обоев, 150г Адгезионная, Противоплесневая",501 ₽,2 отзыва,"9 мая доставит Ozon, продавец Your Store",https://www.ozon.ru/product/gruntovka-moment-dlya-obrabotki-sten-pered-nakleivaniem-oboev-150g-adgezionnaya-protivoplesnevaya-388382974/?asb=5AXbwP%252F3Kh6OnsjHDrGtL9OMU%252BPKzHyl86DNxHho9%252F0%253D&asb2=oXvW6Df-0ObMVw-WNFP49aS2q-yUrpGUil9RmoNkcvGptksGTfBvkyf9QKt61u0f
Грунтовка Основит 86853,895 ₽,1 отзыв,"13 мая доставит Ozon, продавец Седрус",https://www.ozon.ru/product/gruntovka-osnovit-86853-317619260/?asb=8TYg7RdxeB3nfuEl%252FAlsOW9qMxOVC%252BKHYyD7t4P7Ibs%253D&asb2=TF-V0eRWgnCXfXcIsYj0wqfe5lqPUFxt1-ZE5ZrCvJTA9eeQIwQ-uGXa9F34MIOH
Грунтовка L'IMPRESSION SOUS-COUCHE Адгезионная 1.58 кг,699 ₽,3 отзыва,"8 мая доставит Ozon, продавец LACOS",https://www.ozon.ru/product/gruntovka-l-impression-sous-couche-adgezionnaya-1-58-kg-214577135/?asb=%252FydJ%252FQg9PYNfDnjoHt9qB2m1ldJRRK4fB%252B1Nc2TCu7M%253D&asb2=AJTppSmPP3jqSik4-3kgObfhbQCx-A2LHmBpGi0RuxRbKnfbq9m9AIBs0JrayEL5
