"Хлопушка (пневмохлопушка) с конфетти новогодняя / на свадьбу / день рождения праздничная с сюрпризом Золотая Сказка 5000 рублей 40см, наполнитель купюры",289 ₽,128 отзывов,"Завтра доставит Ozon, продавец Самсон",https://www.ozon.ru/product/hlopushka-pnevmohlopushka-s-konfetti-novogodnyaya-na-svadbu-den-rozhdeniya-prazdnichnaya-s-258385448/?asb=dYTAGaf3XVnvZAL94yYrWFBOg04WhqV0BtxJRkQuBBs%253D&asb2=cF-bMXtgB3MhbxXLGEAYj-RYo0IaQaFqLCQ-_HhNeq_gkdrzQjbxIpJacRPQYPAA
"Хлопушка (пневмохлопушка) с конфетти новогодняя / на свадьбу / день рождения праздничная с сюрпризом Золотая Сказка 30 см, фольга, конфетти, ассорти",215 ₽,18 отзывов,"Завтра доставит Ozon, продавец Самсон",https://www.ozon.ru/product/hlopushka-pnevmohlopushka-s-konfetti-novogodnyaya-na-svadbu-den-rozhdeniya-prazdnichnaya-s-363405366/?asb=n1X1QBMNUQQgxNdJVIy0FRay1UQ0vIk7GDXadSarg6WcwnlrssjHS%252Fy%252FMer6rVN5&asb2=e_zXkWtL-h16VDIvY3lruif_zSI-Cu6COa8YKt-4SXZFgLNMyp_b7XQy_I25lOxbdJLyQUdvzCjxbNmZayeEHw3SVtZ0KSo4z-TN56WbKuIGjUOG6U-lIBSBSk4jvEQcfrZPpOT0intacuDyx0Mytg
"Праздничная хлопушка, Конфетти Лепестки Ткань, красный Мегапир 30 см, 1 шт",246 ₽,16 отзывов,"Завтра доставит Ozon, продавец Мегапир",https://www.ozon.ru/product/prazdnichnaya-hlopushka-konfetti-lepestki-tkan-krasnyy-megapir-30-sm-1-sht-479448193/?asb=LghRzdvJBEolcxoLDmk94wfsdRRXoK4Z8xbh2IXXUHHN9%252BuQ1mXmVMI2In1bMx5o&asb2=UkgjC0zvCF8doos9kKGk0Xg8YyZ0SgReuPoS7an10IimHitEw6hPwALmvfncMRkfBdWfg847TPd4yC8S4l9k9B3-73BRdAG2FSytmq0nnMkENkjqXxDHwo6DqnblyowmADT--Uvsmly8O1F0WRT4hg
"Хлопушка ""ТРИ КОТА"" металлизированные круги, ассорти, пружинная 1 шт. (4''/10 см). Дальность выстрела 2-3 метра.",149 ₽,33 отзыва,"Завтра доставит Ozon, продавец Волшебный мир воздушных сувениров",https://www.ozon.ru/product/hlopushka-tri-kota-metallizirovannye-krugi-assorti-pruzhinnaya-1-sht-4-10-sm-dalnost-vystrela-2-262911432/?asb=AS2%252BVG6fwHkg9YBPF3deQqBqWk4HA93669YxGrytpqAwxKzE3WWqHKI%252FK5pA59NR&asb2=t-Iqw0p1OgBnRnqJuTmaF9J9QcgoVQRBfMFG4XuilAn4mSy9MsBDjMcDI4YbeRxoc_PE7U54CBwD2SV1LCLbJa2IS8j70v58pCybv1QaRNjYGhiGBWVU8UxwMLtMnGYu-DZCNq7N4H4Qfl5W9Mpnzg
Хлопушка для гендер пати Мальчик или Девочка Gender Reveal Party / гендерный шар,486 ₽,31 отзыв,"Завтра доставит Ozon, продавец KANRY GROUP",https://www.ozon.ru/product/hlopushka-dlya-gender-pati-malchik-ili-devochka-gender-reveal-party-gendernyy-shar-446410795/?asb=Egaz8FZ0XXRlazR3dWciPO0vslZUeCWuXmO1MrU%252FBxo%253D&asb2=BjGkRJtsrJEt2T3QYkgjt8vXofP8X4kzGsbiMEkOZ6orv_jiA8wet54-eJrJ16Nx
"Хлопушка (пневмохлопушка) с конфетти новогодняя / на свадьбу / день рождения праздничная с сюрпризом Золотая Сказка 20 см, фольга, серпантин/конфетти, ассорти",189 ₽,17 отзывов,"Завтра доставит Ozon, продавец Самсон",https://www.ozon.ru/product/hlopushka-pnevmohlopushka-s-konfetti-novogodnyaya-na-svadbu-den-rozhdeniya-prazdnichnaya-363405364/?asb=Li63AMX7AWZ1iIHq%252FgdJc3EL7Ljn8FAkJIqQjey7VOwz85kG08X2I7GKV%252F4U%252FmPP&asb2=MqpDRzWE6xoOv4adCnR7r2Y0dva9sIMVbKg3TXD5_yrxexHK9L0v5UcAuAhNNBDC-DDODsd_yAYVvZOKOfD_-5lSQpU5ULM1PWR6q1ynGXpfCxfqNNeY-cZmEzJdVCfv8XlU4abz5JpOyzZiuIZLfw
"Хлопушка пружинная (4/10 см), Три Кота (3 кота), Металлизированные круги, Ассорти, 1 шт. (хлоппруж)",145 ₽,73 отзыва,"Завтра доставит Ozon, продавец ДавайДарить!",https://www.ozon.ru/product/hlopushka-pruzhinnaya-4-10-sm-tri-kota-3-kota-metallizirovannye-krugi-assorti-1-sht-hloppruzh-175235829/?asb=lTCVOi%252F%252FyssuQy%252BjLkmB0mB3q4MLehJ4mTCK9t0nwu0%253D&asb2=Hu560nf02_c_lhqfCo5viodciD1XaZjUfh8ZaqI08dmQSvKniFgLGFINNFUMZn5z
"Конфетти Бумага, Фольга,",145 ₽,19 отзывов,"Завтра доставит Ozon, продавец Эврики",https://www.ozon.ru/product/konfetti-bumaga-folga-236868479/?asb=Fg1j1ZuZcQYRhZNOSFDmEtwZMeuOTZ9tNuNaxDgrJVA%253D&asb2=4D5dpHuFGS4A8qUOSagb7wWpToU26YqifbUKf7Q6vg_sMS0kKjvtjHTp_sZRaKbR
"Конфетти слюда, Блестки, Белый, Голография, 20 гр (Консл)",139 ₽,102 отзыва,"Завтра доставит Ozon, продавец ДавайДарить!",https://www.ozon.ru/product/konfetti-slyuda-blestki-belyy-golografiya-20-gr-konsl-176588307/?asb=7tCLWqmaZFad56UGw%252FaHf9qaqFNb9ulwZBsZqqwTz1s%253D&asb2=dkT_f3tiC024XOZXHYmzc6MkKdOi24Iv4MWqCz8Uwz4GnC6C0jTYMzxhGlF4QS7Q
Праздничная хлопушка Пати Бум,242 ₽,6 отзывов,"Завтра доставит Ozon, продавец ООО ""РЕЛЬЕФ-ЦЕНТР""",https://www.ozon.ru/product/prazdnichnaya-hlopushka-pati-bum-288586400/?asb=ty%252Bu1h6LLiMTgT2xvVss1qUQIJbXIpw75VjaZqjCQ3w%253D&asb2=FJufrVC8mmnbyIb6_s8GoSrrQ-F77es2-3mtsA-TZe06EbMofWlhMMPN1g4WoQrM
"Праздничная хлопушка, Конфетти Картон, Бумага, Денежный взрыв Свадебная Мечта 40 см, 1 шт",367 ₽,152 отзыва,"Завтра доставит Ozon, продавец Свадебная Мечта",https://www.ozon.ru/product/prazdnichnaya-hlopushka-konfetti-karton-bumaga-denezhnyy-vzryv-svadebnaya-mechta-40-sm-1-sht-203535014/?asb=xuXIJgeL2e4Jt79XWs3wRidivAw2TUk5IK%252BVXLK7HCs%253D&asb2=0ychSYy-PX8zAIgU5ftFnANHaV0mYH6hguWyykUXCy1c-D0N81U7yoR1XZYXwb-m
"Праздничная хлопушка Круглые Бумага, розовый BOY OR GIRL 30 см, 1 шт",486 ₽,31 отзыв,"Завтра доставит Ozon, продавец KANRY GROUP",https://www.ozon.ru/product/prazdnichnaya-hlopushka-kruglye-bumaga-rozovyy-boy-or-girl-30-sm-1-sht-446410793/?asb=g8vwYbBTY7%252BFqka3i%252BtoxKjq6Yo171XnfwS%252BhdS1F14%253D&asb2=kg1dJLMLlFn8L8mTkzMJ2bvfjaSijtqLElByTAWZRoSGnwkBmrA2acmN9Lr5zd-A
"Праздничная хлопушка, Конфетти Картон, Бумага, Денежный дождь Свадебная Мечта 40 см",367 ₽,43 отзыва,"Завтра доставит Ozon, продавец Свадебная Мечта",https://www.ozon.ru/product/prazdnichnaya-hlopushka-konfetti-karton-bumaga-denezhnyy-dozhd-svadebnaya-mechta-40-sm-204278882/?asb=%252Bq5ecjeFQnnRgUThSh2p0WW1dHI%252BdDuoLytyo6Rchm4%253D&asb2=zyJa_AqANCT1GszRPpy1HrKAzH1tlXpPQQBF9fozD1m2kv_u2p6KLJH6bUGzwWAp
"Конфетти фольга, Блестки, Серебро, Голография, 20 гр (Консл)",149 ₽,102 отзыва,"Завтра доставит Ozon, продавец ДавайДарить!",https://www.ozon.ru/product/konfetti-folga-blestki-serebro-golografiya-20-gr-konsl-176590694/?asb=o43qPVN22NeYELT8Gr3uXaQDUP2SuF35M2ENAjDVn%252F8%253D&asb2=71fqmvy3p-lJeMezDz_q1RIKSsS_XRyT9dMpjdm9K8Isx7IxPtlNaPCLDnGK5DlD
Праздничная хлопушка,269 ₽,1 отзыв,"Завтра доставит Ozon, продавец Праздник будет!",https://www.ozon.ru/product/prazdnichnaya-hlopushka-332264440/?asb=DCwtKUb4vt2nJEsWPdd4B62ObELJdT8YnkRY%252BmHgRPBLtasICsZ4dUYb3S60ASu5&asb2=7AgR-ArncNsQNjYPFW2Y4LEExO8WJZVVTFLGxz5EMxuVvV_vFMct_C9NiJlCozydMld8AA9y7EmLl9nhny-EvLgQWtX8kmy1PUzcCwBO5poQotYXuIq4ZE0ANTb1sfR3TgoRdRxPFEBzo0YGcwXnjA
"Праздничная хлопушка, Конфетти Сноу Бум",119 ₽,20 отзывов,"7 мая доставит Ozon, продавец МПР",https://www.ozon.ru/product/prazdnichnaya-hlopushka-konfetti-snou-bum-441425387/?asb=V3Iwbk%252FwdFs%252BxZIiVcx2sz59B0A2pQeeYv0oTz6g6wCnwUC1lD3mq7WbHfDxq7SJ&asb2=0KuKnt35o_4N3Y5giHNXteZSc8mR6i8CfsQUC8v34jN7u5e54XCw8C9UPZH0I-gJIjhn9qBBk1Ff-kcmW4_PhSTVGIRYvE710QT45r5ULAqTuPN_GR07s7Zx6FHaJZgSUde0FGCOsTosyzTWfw10FA
"Праздничная хлопушка, Конфетти Картон, Фольга, Конфетти пружинное Свадебная Мечта 16 см, 1 шт",224 ₽,126 отзывов,"Завтра доставит Ozon, продавец Свадебная Мечта",https://www.ozon.ru/product/prazdnichnaya-hlopushka-konfetti-karton-folga-konfetti-pruzhinnoe-svadebnaya-mechta-16-sm-1-sht-203885332/?asb=iaPSkXlaT196wBRlouPwD6bFXnYS5ZbLnuQ19pGiEzQ%253D&asb2=sUfV9CSy37t-2yyUneeY2qj70zQBVW-UQ-ESn9HJStIJ4rLtYueqHopokiJFRZXt
Набор для гендер пати Хлопушки 2 шт. с краской холи и конфетти / Мальчик или Девочка / гендерная вечеринка Gender Reveal Party праздник для будущих мам / для беременнных,882 ₽,21 отзыв,"Завтра доставит Ozon, продавец KANRY GROUP",https://www.ozon.ru/product/nabor-dlya-gender-pati-hlopushki-2-sht-s-kraskoy-holi-i-konfetti-malchik-ili-devochka-gendernaya-469071609/?asb=Ng0z3YGTkE4jybdlWvOFkJ4L91%252F0eylNhZTiJOlp2%252Fo%253D&asb2=utGGbpnORJz3AfA-wQhwiwt7-6wWBJ64Z-NFIw-GJ0duV3jQZX4mqsC1RmlQ4_dP
"Праздничная хлопушка, Конфетти Звёзды Фольга, золотой Мегапир 30 см, 1 шт",268 ₽,16 отзывов,"7 мая доставит Ozon, продавец Мегапир",https://www.ozon.ru/product/prazdnichnaya-hlopushka-konfetti-zvezdy-folga-zolotoy-megapir-30-sm-1-sht-478209898/?asb=0%252BCJ%252F48iYtgHJg8E6pk56i1Oe30JzAOr6XTxzWr7dwyBZMQex1AidB%252FY9UUyW8Q3&asb2=NW9DWcqO17mFraqll3jl2U-iI9bP1A5gwBZPLKW2dBfqAq2kZ9aI7nbcldmjSktKRxIGp5otznLJ0LVxzF0D9XUWenZHXUbudrhjE-oD_lwJtzAVMCIAoWFrtLetIYZ6Bw7tEEkx_4B3A_9_YD7dBQ
Праздничная хлопушка Деньги Дон Баллон,259 ₽,6 отзывов,"8 мая доставит Ozon, продавец IHI",https://www.ozon.ru/product/prazdnichnaya-hlopushka-dengi-don-ballon-426224926/?asb=rMEVjU7457ztwF4vCXaI8Ac%252BvUcqlMKgBuaVN24IDXM%253D&asb2=9iiRpE3Qh5XQVESMH9-wGlg9fqY9Bo1-of3eDEkX2LolLo8YdS7l8Ucpl-ygUEWQ
"Праздничная хлопушка, Конфетти Картон, Бумага, Зеленое конфетти Свадебная Мечта 20 см, 1 шт",187 ₽,126 отзывов,"Завтра доставит Ozon, продавец Свадебная Мечта",https://www.ozon.ru/product/prazdnichnaya-hlopushka-konfetti-karton-bumaga-zelenoe-konfetti-svadebnaya-mechta-20-sm-1-sht-203507669/?asb=kGbYfsBKO2N5FW1qlhcWzkJfJ97vCzus%252B46qIRBCiJM%253D&asb2=8p9N096K2c9f4MhAIqe6tB1KrNxWVIp6S21oOEhM0l0nazEaiFJdvBvwQxHHCzBu
"Конфетти Круглые Фольга, Золото, Металлик Волна Веселья 1 см, 1 шт",269 ₽,56 отзывов,"Завтра доставит Ozon, продавец Просто праздник",https://www.ozon.ru/product/konfetti-kruglye-folga-zoloto-metallik-volna-veselya-1-sm-1-sht-355775043/?asb=S51l4lSrAVMOUViiQlzub1LZ2FDRS9rjWp4GkGoT2Is%253D&asb2=yPlBUXcdDn-kGG8G9dQhW3usAEM3KjZrjMTCXBwwvkPItTlmjy3ytls-JqUbG-WQ
Праздничная хлопушка фуксия Дон Баллон,321 ₽,6 отзывов,"7 мая доставит Ozon, продавец ДавайДарить!",https://www.ozon.ru/product/prazdnichnaya-hlopushka-fuksiya-don-ballon-254229960/?asb=gFODhrU1HMeOGnfY8qpKjU8x7uxEQD7zF6YoT3RWyZE%253D&asb2=3oCoefZt6mWakbmYT988VzxE5Is-UxO81H_PxQjbMa3HaMAe-0dgDfOvWi67fjaF
"Конфетти, наполнитель для подарков Звезда, Контур, Золото, 17 г. (Конпл)",127 ₽,18 отзывов,"7 мая доставит Ozon, продавец ДавайДарить!",https://www.ozon.ru/product/konfetti-napolnitel-dlya-podarkov-zvezda-kontur-zoloto-17-g-konpl-363526526/?asb=gvYbsOdL1Oa%252FMExE8AOXgwhE9lV8ZZDsjWqzwaC76%252Bw%253D&asb2=G71gGO1FJ-gLpMsgwpjXEswlEAhILaSoNIWlvz-uLxEouqS2rn5piua8X-qtnIQx
Праздничная хлопушка Шампанское серпантин 20 см,199 ₽,27 отзывов,"Завтра доставит Ozon, продавец МФ Поиск",https://www.ozon.ru/product/prazdnichnaya-hlopushka-shampanskoe-serpantin-20-sm-251842712/?asb=wm69%252Fl0BmkuLBuHqA03PcNndGjEsxWhRc7W%252BEjWoN2k%253D&asb2=2zvyYk34ZXHDdnWT2dWGJC0ETGGebijXf8OmsR5rrTYR-lWmdBgaMPMuWbDlCOK_
Хлопушка серпантин и конфетти фольгированная на день рождения и свадьбу 20см,246 ₽,1 отзыв,"Завтра доставит Ozon, продавец Улица Праздничная",https://www.ozon.ru/product/hlopushka-serpantin-i-konfetti-folgirovannaya-na-den-rozhdeniya-i-svadbu-20sm-528149505/?asb=ezvgILldJ%252FKjfN9EtAQd4umOc3DjeaotSm0u8vHXX5YdxfnyDLWlOV9AGxnlnios&asb2=CjlKxgdYCrdC81lESy8iAzW3yarJ-x_k5-ORCIE6lBtt80a9aTgQGZphVXOiY-ZOH-Rx3iqDsLwfvGkWDDQ1SSGE5_1mgYdC7rlvXF-NQcSpGc-tdW9MzNyQ22i-fBhy7dyAp1cGRVRRMQbvvGfruQ
"Конфетти Круглые Фольга, Круг, Розовое Золото, Металлик Волна Веселья 2 см, 1 шт",269 ₽,56 отзывов,"Завтра доставит Ozon, продавец Просто праздник",https://www.ozon.ru/product/konfetti-kruglye-folga-krug-rozovoe-zoloto-metallik-volna-veselya-2-sm-1-sht-386889836/?asb=QsK5ygEmz01u7YrGjLZixd6UAqF4rA45Gfq3kwO2Y24%253D&asb2=M7g8YRjClIbpdVgCWorF-gOo2Y4aXSvHYYbKvX1cQ22m-Gi5iaYGoqdJK104QUbG
"Конфетти Блёстки Фольга, Золото, Голография, 20 гр. Дон Баллон, 1 шт",119 ₽,9 отзывов,"Завтра доставит Ozon, продавец Airwave",https://www.ozon.ru/product/konfetti-blestki-folga-zoloto-golografiya-20-gr-don-ballon-1-sht-291851187/?asb=Oz5xx%252F4q6C1KAJhXSb1ZR7crd%252BYhMDOSa5eWfCi3j3s%253D&asb2=SsslYHVUJ2MGCslHoo6oCY29jyQC1BIrF71q7PqshN_XiahcsvQ5laLM2QcWdEtD
Маска для пиньяты,194 ₽,24 отзыва,"Завтра доставит Ozon, продавец Airwave",https://www.ozon.ru/product/maska-dlya-pinyaty-392708101/?asb=W6KpS1%252B20pKvG89EC%252Bzi8UQpmmt09YAm246S5aHgfi8%253D&asb2=W-5eaGUadTVIhz9GIMvpRkPWrW8Ey0SqDaKc3-_eLayhf4XLB4fqQ_95vvotRWF8
"Праздничная хлопушка, Конфетти Картон, Бумага, Рублевый бум Свадебная Мечта 40 см, 1 шт",367 ₽,152 отзыва,"Завтра доставит Ozon, продавец Свадебная Мечта",https://www.ozon.ru/product/prazdnichnaya-hlopushka-konfetti-karton-bumaga-rublevyy-bum-svadebnaya-mechta-40-sm-1-sht-203507724/?asb=Uj2ScZj9lqXPXv1yBaACF5nHx4Tl9y9iu94XXJbrquY%253D&asb2=C7u0wJlwlwvQcDXMPV3sc3wDXlMONNRRSjMIxuN_DSCG2cs5LMct1N1vjV3gg5lz
"Серпантин Бумага, разноцветный, 2 шт",226 ₽,16 отзывов,"Завтра доставит Ozon, продавец Эврики",https://www.ozon.ru/product/serpantin-bumaga-raznotsvetnyy-2-sht-243769872/?asb=tBuThvUrVxJT3yyHw2SLBrrTxUl4iT3LCX%252Ftf%252BtJNUA%253D&asb2=nENDW-IMZgnUqqyagFylJwiorZBxsRqYsHZ8H7Jts0zKv7DORalKiakjpdZkwzmy
"Праздничная хлопушка Фольга, Бумага, Дон Баллон 11 см, 3 шт",309 ₽,73 отзыва,"7 мая доставит Ozon, продавец ДавайДарить!",https://www.ozon.ru/product/prazdnichnaya-hlopushka-folga-bumaga-don-ballon-11-sm-3-sht-199768058/?asb=Q%252FPtdJfaXV42tznCvSqgIjMG%252FBfQlTxZ2HefsdGd724%253D&asb2=3cZsb2DfvnCpFCw25_tR9_JtnZuKuoeaWzeoSRWiTos9WdRciztQ1_DbQRahnA2R
"Праздничная хлопушка Пластик, Фольга, Страна Карнавалия, 1 шт",266 ₽,6 отзывов,"Завтра доставит Ozon, продавец Эврики",https://www.ozon.ru/product/prazdnichnaya-hlopushka-plastik-folga-strana-karnavaliya-1-sht-193885550/?asb=88qgfADO9K5z8HL%252FcQ3vN4ByFplCEzdIqDYZBSyQX%252BA%253D&asb2=gUwTgzclzzm5YggMdxE39GElwRR5W17_FIHIvVaPSO_d8JgR7JuAl4Dk2bRkJRSp
"Конфетти фольга, наполнитель для подарков Сердце, Красный, Металлик, 1,5 см, 50 г. (Конфоль)",223 ₽,72 отзыва,"7 мая доставит Ozon, продавец ДавайДарить!",https://www.ozon.ru/product/konfetti-folga-napolnitel-dlya-podarkov-serdtse-krasnyy-metallik-1-5-sm-50-g-konfol-363435649/?asb=5HfemjlQKLnIeCeC5IMRQwFTmqR1sSLQsSzHmNkzUZs%253D&asb2=3eD_-Sx3PnLaMJJkiysh9s4a4IJ8WR49c4vGTmrDntFCWRuKjrZXqbH-ro3YOqJP
"Конфетти Круглые ПВХ (поливинилхлорид), разноцветный ПСВ 1 см",179 ₽,20 отзывов,"Завтра доставит Ozon, продавец ПСВ",https://www.ozon.ru/product/konfetti-kruglye-pvh-polivinilhlorid-raznotsvetnyy-psv-1-sm-251595017/?asb=JcAoIFFvcBTRg%252FL1uMpk1XcLfaU15AizxrMvQo6IHZ9aAc4fgCQALXorJ77ivA0D&asb2=e63NX6vtrwWmtgOQZ5vQgbrPkDDOoeekUnbsIPsRO5bxPXatC--PdstwCWALrOb3QuiKpGl_6MtNbp40WYFhE-0DIkPx5t04WOA1KyflFsuYfUnNKkZC84OpQLZVo6jszFJpNiBz1VWYKOn1db1jPg
"Бумага для бумажного шоу Полоски Бумага, белый EasyPuh",863 ₽,38 отзывов,"7 мая доставит Ozon, продавец ИП Рахманный",https://www.ozon.ru/product/bumaga-dlya-bumazhnogo-shou-poloski-bumaga-belyy-easypuh-304279517/?asb=9utsiI%252Fv%252FjA3HshQa9oBlIVWfvIbpPl0IS3ELjMfWULPVvy0J%252BntkMk7a9ojwCBp&asb2=cgrfr2vQYusGj4JpQFZDFaAwbicC4e7rzjP87E-sJYYHuOM9xucEfhrTWsJSV0qNDL_rtZfP1FLBAi0BI5W7QOoYLOTemnnjtpBaOpCLZUP_lXH-VzMVIoJ2t3pS5Kw8vwLqE49IgKkYsZYNEdbGRg
"Праздничная хлопушка Пластик, Фольга, разноцветный Страна Карнавалия 16 см, 1 шт",252 ₽,9 отзывов,"Завтра доставит Ozon, продавец Эврики",https://www.ozon.ru/product/prazdnichnaya-hlopushka-plastik-folga-raznotsvetnyy-strana-karnavaliya-16-sm-1-sht-352197226/?asb=palHs77QHZ5pr5Ef1KNs%252FrOVR7CNKPA%252B8zxOjtntq3k%253D&asb2=7nFWi4quh-jXL7NSJ-sxeBuSbx69s_AwTyGEiH9jBQOuUDmO39PuzH9pOIikTtb4
"Праздничная хлопушка Полоски серебристый Пати Бум, 1 шт",297 ₽,7 отзывов,"Завтра доставит Ozon, продавец WASK",https://www.ozon.ru/product/prazdnichnaya-hlopushka-poloski-serebristyy-pati-bum-1-sht-301073225/?asb=KX5dccREx%252BtL8vXKAPL%252BwGrVbKql7y5F1BcYFfyC28Y%253D&asb2=ObSrZxeXewC-01jLewYUQFcitl6zI-X6jIHpBJj4GSHE6ma-I7Nq9O-29ELCWcNM
"Праздничная хлопушка Бумага, красный, зеленый Дон Баллон 30 см",287 ₽,8 отзывов,"Завтра доставит Ozon, продавец Праздник будет!",https://www.ozon.ru/product/prazdnichnaya-hlopushka-bumaga-krasnyy-zelenyy-don-ballon-30-sm-463901912/?asb=FyLGWLccrcj4j8UWhwDr0BMsSCGKLl6jtz9vtYf4U%252BFqphpsq8jHq7az5NhwTlCq&asb2=KCW_SHPp6ILw4dbv3wjTkD128Ln0vleZipP0fbm33r3D8CQe24nR-iuL9IsAMrrljqgWBbVFMyYLYxyFE8ibYaZtQuFcO5zg_F4d7omaNlIzBnlq9OIxnaY9upHMrFjfESrO7_y23gdeNNMav8HYtA
Праздничная хлопушка MAXSEM,735 ₽,1 отзыв,"8 мая доставит Ozon, продавец Дом праздника",https://www.ozon.ru/product/prazdnichnaya-hlopushka-maxsem-525568401/?asb=Xjo7oTwRPA2rxsOEpgyxA%252BoH4U7Y9PpdE%252BzRh95kaPATy6nQk6VAyyzrV6yCkm1E&asb2=NSJD37FsVRd5aKGKpAghYrSEzG83JrCxVB1uEn6f6pueWVf2oji9F5Nbc5P9gUURgekUN2E2Lli7k93o-UuH67byWzvGsg4RUR5s6GOjTT1osouUCFQApOsr8_UDhzj_KF26k4jfr8fHi6lZfV7Ppg
"Глиттер Розовое Золото, 80 гр. (глир)",259 ₽,21 отзыв,"7 мая доставит Ozon, продавец ДавайДарить!",https://www.ozon.ru/product/glitter-rozovoe-zoloto-80-gr-glir-203457208/?asb=2dvFHHbfidyfujrziCjScWPEbOjSYNdS3pIm9Y%252Fx7HM%253D&asb2=xLmvURMpf1Ljx0VoZBleVaZWlg9USeHc7HxoiY128qLOsjrU5KFdUw39kIABBvpJ
"Конфетти слюда, Блестки, Розовый, Голография, 20 гр (Консл)",151 ₽,102 отзыва,"7 мая доставит Ozon, продавец ДавайДарить!",https://www.ozon.ru/product/konfetti-slyuda-blestki-rozovyy-golografiya-20-gr-konsl-176611171/?asb=mjfhx6cxuM%252FV12W2D8hBbJ8D%252FNbx6h44FAB%252B3LOjMqc%253D&asb2=JuJE_tWbH7BpSWGTwAH-cPuobouQ42_uEp1wVfdtoUQPk-lRCE0I27zorE8MPM26
"Праздничная хлопушка золотой Grand Cadeau 20 см, 1 шт",280 ₽,2 отзыва,"Завтра доставит Ozon, продавец grand cadeau",https://www.ozon.ru/product/prazdnichnaya-hlopushka-zolotoy-grand-cadeau-20-sm-1-sht-301340171/?asb=OS9HPabvkOXlJYuyLlqmE5%252FEts9%252BmGElFq4U5MwOMy8%253D&asb2=88AxQQo5kXeyPcIwQQsqBWJDvWCjl-mHD50WxE8-OQwqFEmP3v6Q4Ks9cmSlYK8x
"Праздничная хлопушка разноцветный Grand Cadeau 20 см, 1 шт",280 ₽,2 отзыва,"Завтра доставит Ozon, продавец grand cadeau",https://www.ozon.ru/product/prazdnichnaya-hlopushka-raznotsvetnyy-grand-cadeau-20-sm-1-sht-298941326/?asb=N%252F0%252Bp2p6LJib7YYb4CCXHOrAwEjeH3UZ%252FjmsKgh1yzU%253D&asb2=1zgAp6544ZXh3dkGVoCxThT-rJ-zAj5l8jN0lo6Fg0NtUS1JjM1IwjTcEpUdvHwR
"Праздничная хлопушка 40 см, 15 шт",499 ₽,3 отзыва,"7 мая доставит Ozon, продавец Алёна",https://www.ozon.ru/product/prazdnichnaya-hlopushka-40-sm-15-sht-349806511/?asb=gmR7jLHLsxxpcNOaFjCnCqjl3diyAzn98s2hlJUzmAA%253D&asb2=HsGXWQ5ndqaDzwxPiakUgzWKjXu8-_aBG1PYEaRP26h7L-LmT8mTMehcuzZuHuSp
"Праздничная хлопушка Деньги, доллары и евро, 30см Arts&Crafts, 1 шт",333 ₽,113 отзывов,"7 мая доставит Ozon, продавец ДавайДарить!",https://www.ozon.ru/product/prazdnichnaya-hlopushka-dengi-dollary-i-evro-30sm-don-ballon-1-sht-282379416/?asb=ejSmAaZRjGdxRPvjzacHHxfF%252FDIjhih6aipfJS9KMbM%253D&asb2=w0vE4LG_ONmmxz-1fRrDIZUaNaQgLAwBhl6HYpns4LvwMyx_Zy-iMmKBowWacnrl
"Праздничная хлопушка, Конфетти Полоски Картон, Фольга, разноцветный Свадебная Мечта 16 см",224 ₽,126 отзывов,"Завтра доставит Ozon, продавец Свадебная Мечта",https://www.ozon.ru/product/prazdnichnaya-hlopushka-konfetti-poloski-karton-folga-raznotsvetnyy-svadebnaya-mechta-16-sm-401647153/?asb=IqJ175U74E12Q4FExJFb9PiLCbe5SbQdj3Wb63S4%252BTU%253D&asb2=c_53A2rjGj0vzvrQ-BDfLJ2bNKpUCJ2HBH0pyH2MZjkv-tGL0dCw6B73HbpWIoOg
"Хлопушка ""ЩЕНЯЧИЙ ПАТРУЛЬ"" конфетти звёзды, ассорти пружинная 1 шт. (4''/10 см). Дальность выстрела 2-3 метра.",149 ₽,141 отзыв,"7 мая доставит Ozon, продавец Волшебный мир воздушных сувениров",https://www.ozon.ru/product/hlopushka-shchenyachiy-patrul-konfetti-zvezdy-assorti-pruzhinnaya-1-sht-4-10-sm-dalnost-vystrela-2-262893023/?asb=XipjeXoJcCvM6kimvsrHlU7W74GPJWGFKmsr8mAUA23974TLDEUeQXYsVtOKa8i9&asb2=ugmd5WD12NS96Kbpv4F8HpRaWr5MOCd1e19LvaP7ffPqo6l8i2tIgVg9HDGYSqTUcSmRPxu8hFSR5QsZhRzHhGOZ6ag4TK1h6L2zg-E1irS9DjCatHuePUpzuXFXOO-yhNi6hyCF6vDyfnsEAqOzyg
"Конфетти Круглые Фольга, разноцветный Tukzar",171 ₽,1 отзыв,"Завтра доставит Ozon, продавец ИП Машкова Е.Н.",https://www.ozon.ru/product/konfetti-kruglye-folga-raznotsvetnyy-tukzar-217768571/?asb=YbHB%252BVruzvAEaUKSVOb1msIATgWKW9rdS%252FeIjoPjtLiIJwsbLQfOqo1LGc2Iiagl&asb2=HQZbJYUbcl0o7svwr8EfTjDJ96i7yUAENZyeZ9Q6meRvsoGKqro51_BXv6pLGHqOwA3DU3X7G4Lk6SVYvUhmoYL0kj9h9lxhY1hk32YEEm1h5QqQn8oKgBLZiEL7rEuwephLKrDLDtusMewBLGuGRg
"Праздничная хлопушка Бумага, Картон, Хлопушка Это девочка! 1 шт. Волшебный мир воздушных сувениров 30 см, 1 шт",239 ₽,141 отзыв,"7 мая доставит Ozon, продавец Волшебный мир воздушных сувениров",https://www.ozon.ru/product/prazdnichnaya-hlopushka-bumaga-karton-hlopushka-eto-devochka-1-sht-volshebnyy-mir-510833156/?asb=ziEfk5AytlgE12ZRBY%252BE81KJlfOjrovqRUVgqTut3B0%253D&asb2=VEiQuChiQivGzvMlncz2LE5owOL9rNhQE4aSAuMFcVYyn7j-lyPGkmtRQ32xixfi
"Конфетти фольга, наполнитель для подарков Прямоугольники, Золото, Металлик, 3,5 см, 50 г. (Конфоль)",223 ₽,72 отзыва,"7 мая доставит Ozon, продавец ДавайДарить!",https://www.ozon.ru/product/konfetti-folga-napolnitel-dlya-podarkov-pryamougolniki-zoloto-metallik-3-5-sm-50-g-konfol-363435619/?asb=AmHbsi%252FePUkDiJxlPGQaXdbUpchh1iqZD7cnr66JHiA%253D&asb2=HO6cl1DDlx1Z9O_tS88Xnt12hu_B9h8i92kyHsNgTNiJb0g_zK4stURyekv_OVfT
"Серпантин Фольга, золотой Весёлая затея 400 см, 36 шт",330 ₽,19 отзывов,"Завтра доставит Ozon, продавец ИП Машкова Е.Н.",https://www.ozon.ru/product/serpantin-folga-zolotoy-veselaya-zateya-400-sm-36-sht-214012057/?asb=tMSglzfTSnVdocKaW8cIACnA6%252BNbLEkiR%252F5egC2Iu0iq23uH1NnW0VopijXiJJn6&asb2=2XdOYpuf93BqaRL0N2KLAZvyxaaIQxXVCrFCSjZYkcsQa5-LGksQNaDnBjSyDVTwhVHhWfkexEIF9KeYqvS3jt9basz_QMxKGU7zjaVR5dSM5gIcz4P_3RJwpPeQoqjSPDLzM550PyCydtAppKFNzg
