"Конфетти Полоски Фольга, серебристый",329 ₽,4 отзыва,"7 мая доставит Ozon, продавец ИП Попов Н.С.",https://www.ozon.ru/product/konfetti-poloski-folga-serebristyy-407099031/?asb=Yby4WId4badBxIckumvAqykgop03aMVSVKYjDhgSFO3HXJAXbxS%252B4C5k6MxFsODb&asb2=ycyMfVCbIXHbYPQMR490YiYyQT0dt1EgAJnjDeArabM_fZrGSTMoxG_BTHCue-0BjZ7oGrhQpxmKNKyHgRXsqHwFMpC7TjmzLq5kpKtEh_pwaLnkYFyQ2e8ZHNIAOqdrCyFhEym7nlU66isVCswyNw
"Хлопушка ""СЕРПАНТИН и КОНФЕТТИ"" ассорти пружинная 1 шт. (6''/15 см). Дальность выстрела 2-3 м!",168 ₽,141 отзыв,"7 мая доставит Ozon, продавец Волшебный мир воздушных сувениров",https://www.ozon.ru/product/hlopushka-serpantin-i-konfetti-assorti-pruzhinnaya-1-sht-6-15-sm-dalnost-vystrela-2-3-m-241130049/?asb=v44R%252FEjNoFspasLbc3vN%252FEuk1%252FLYtrETJszUvuorzSyIvEKuNlFyD7g4C2bqBwzp&asb2=acmbjG-o1nmCp4gu_qdjCYtWxXC438ii06NtnIXDaEJKtHe4IqD2mMNhUTa7PQe14SVk2ga_PuhLQC9Bo0eaDXogL0edrxG6y369mAmPkPFGNGuHNeNKP1Km2MyHshVHxneXgCj5U07BaGdPJQLbQA
"Праздничная хлопушка Картон, Фольга, 30 см, 1 шт",298 ₽,7 отзывов,"Завтра доставит Ozon, продавец grand cadeau",https://www.ozon.ru/product/prazdnichnaya-hlopushka-karton-folga-30-sm-1-sht-178559980/?asb=7jLILhuEKO5bwy225ciBgIm7ibPY0cQxYL3DUNFlO5xub1pXRS56fk2Lv7X2UHHa&asb2=IYznpT6BHLTUPWCTl76AhYRVKeK1--yxxDgy2oNcEGqyLqM_p-WocLaknV_jc2bH9_tnKwh8Ww0aP8kIEdvB5wtDaK1IPQr0yVWB36yB2rS2sm3nCPQAfqsEiBz3MPPy1EJkARIxSFVVrQ_xkEO8Ag
"Конфетти фольга Шестиугольники, Розовое Золото, 90 гр. (конш)",259 ₽,7 отзывов,"7 мая доставит Ozon, продавец ДавайДарить!",https://www.ozon.ru/product/konfetti-folga-shestiugolniki-rozovoe-zoloto-90-gr-konsh-203756281/?asb=a3fl5PtsmJZiPDegaGVfgKLNWLj%252F3LLEoXr1zog05hM%253D&asb2=VeufdCPTzEi5cDymwPeLT87fYAjuhnDls8eFpN9j1ahT9wGeqjtj6Fy1NgMrVerQ
Праздничная хлопушка СуперСалют,560 ₽,2 отзыва,"8 мая доставит Ozon, продавец Дом праздника",https://www.ozon.ru/product/prazdnichnaya-hlopushka-supersalyut-532117019/?asb=wMGdJSvozLNwPGc7gnE7BOv2ZJ%252F1CMw6lJ%252BDRD1pdaw%253D&asb2=2EgYFHMDvwhqao7sBOc4MLaT2J-UX7MXkQDbh9Ltfzfoimxwd9_VDzhxnOez01Fp
"Праздничная хлопушка ПВХ (поливинилхлорид), Страна Карнавалия, 1 шт",176 ₽,8 отзывов,"Завтра доставит Ozon, продавец Эврики",https://www.ozon.ru/product/prazdnichnaya-hlopushka-pvh-polivinilhlorid-strana-karnavaliya-1-sht-193865878/?asb=i%252F6nB6dNwI5asF5G%252F69pffcYuHVFiZi8hfR2WQ3WLk8%253D&asb2=ucHshx2GOEJLXm9cAPDCEAPQcV7T9XIvYCCXhqvlTpYptn5fyDNmT2O3am02COP0
"Праздничная хлопушка разноцветный Grand Cadeau 30 см, 1 шт",276 ₽,2 отзыва,"Завтра доставит Ozon, продавец grand cadeau",https://www.ozon.ru/product/prazdnichnaya-hlopushka-raznotsvetnyy-grand-cadeau-30-sm-1-sht-298943588/?asb=tfQx52nDdl2Zu7u%252BwyWxcPj%252B8mynNcKR49nSu2I3YHc%253D&asb2=cDjzljrkJXHPCDGxfIgZDMQKqfN0P6ReXQX_7T-yvmzRSgcKKyTYfLziz7VW7CGV
Спрей серпантин голубой,441 ₽,1 отзыв,"10 мая доставит Ozon, продавец MariLu",https://www.ozon.ru/product/sprey-serpantin-goluboy-410667747/?asb=vxLYKHm8eGu1Qs5PCKk28EWnwxybU%252BkH2eKWiRqaRkM%253D&asb2=FWKoVrcXihQ4K5yDnOKW5UHiYfVnA2N903YYhUW2QSOdbkTPlSpwO2rKT1kLHNXQ
"Конфетти, наполнитель для подарков Сердце, Микс, Золото, 17 г. (Конпл)",127 ₽,18 отзывов,"7 мая доставит Ozon, продавец ДавайДарить!",https://www.ozon.ru/product/konfetti-napolnitel-dlya-podarkov-serdtse-miks-zoloto-17-g-konpl-363526199/?asb=1NpYoXjLhvwXCUDsUzYijKKpRbVRCbJXHxrPbPRd5GU%253D&asb2=xgIjaqbfcq8yKkInMXh8FR2suQkmCG2HPSM-_On2HcGiBHr5d8wj_v0tLwEcC9Kt
"Праздничная хлопушка разноцветный Grand Cadeau 60 см, 1 шт",276 ₽,2 отзыва,"Завтра доставит Ozon, продавец grand cadeau",https://www.ozon.ru/product/prazdnichnaya-hlopushka-raznotsvetnyy-grand-cadeau-60-sm-1-sht-298940369/?asb=6dRNK8TLsbhkh9V6scde%252BJ2ATNGrd%252B73XFCk5a2bll8%253D&asb2=WyDaUB4mirAsfNBiuQfBWQnpooCGCFlTiFG_xovlBAa9pM8vgxfwvD8aQMAGK-h_
"Праздничная хлопушка Фольга, 30 см, 1 шт",348 ₽,9 отзывов,"Завтра доставит Ozon, продавец grand cadeau",https://www.ozon.ru/product/prazdnichnaya-hlopushka-folga-30-sm-1-sht-173015087/?asb=x1HrE139giLg%252F2dtB4HEz5sLHGMMTyZrj8gwyem2E7A%253D&asb2=YpSLgfRctmlXGxIy4GNaSnf2YW3u6xcJ4u4Q62C70Wnae65EfgicJNUrepla2hr4
"Конфетти Фольга, лазурный Дон Баллон",208 ₽,1 отзыв,"Завтра доставит Ozon, продавец Товары для детей и взрослых",https://www.ozon.ru/product/konfetti-folga-lazurnyy-don-ballon-191271532/?asb=OIGCdXjNw9StIjFL7%252FOKuN62GMeliWxODVWNJyd8glEfn%252FEwqFw3pu%252FOd4OZWLo%252B&asb2=HzaleDOHoV0qZ9bDn1cu3q_-cYnE4B_MIWinSnqMb3yRuizRwldUrBXE4UvcS3K-Cgk7wPLYaRJ-Iix2KotRIpQIVB860hcmBtcI-BJwIDokl9WhrNivK-UOBLE8r8sKGzN0-CeOgN6er4H7e00RoQ
Хлопушка серпантин и конфетти фольгированная 20см,253 ₽,64 отзыва,"Завтра доставит Ozon, продавец МФ Поиск",https://www.ozon.ru/product/hlopushka-serpantin-i-konfetti-folgirovannaya-20sm-250408308/?asb=J1EeoEXZxuBunuiYjjeYIKxBcTq57ZetkJ57M7plt48%253D&asb2=F3wstnnJLB3VmJrmXRD-aSwe18fgvGz_1KspEEpuNqMPuDLzSsbEyvx-SRdtxTfv
"Конфетти фольга, наполнитель для подарков Круг, Зеленый, Металлик, 1 см, 50 г. (Конфоль)",285 ₽,72 отзыва,"7 мая доставит Ozon, продавец ДавайДарить!",https://www.ozon.ru/product/konfetti-folga-napolnitel-dlya-podarkov-krug-zelenyy-metallik-1-sm-50-g-konfol-363436334/?asb=ALfgD%252FyAI0uE6f2IFhb%252F95SdIeYGzLJI4hNCfr6DyL0%253D&asb2=siJ9qbYR4-ibiW4ssMSpjvAiFZ9TwyiouSY8dHNzaEuGRUfBg5x4vg3etipCCTyB
"Праздничная хлопушка Бумага, Фольга, разноцветный Страна Карнавалия 30 см, 1 шт",207 ₽,2 отзыва,"Завтра доставит Ozon, продавец Эврики",https://www.ozon.ru/product/prazdnichnaya-hlopushka-bumaga-folga-raznotsvetnyy-strana-karnavaliya-30-sm-1-sht-205687009/?asb=xGdi4Ya55RB8mJSSRztJGETknvQuBq07ii6t81edxVc%253D&asb2=ZkNCEG5qWkzLpm__yvmvfeR3fdPiLdAEoU6QGZAC8QhZk6E9Bce17XO1nE5GcxGx
Праздничная хлопушка зеленый MAXSEM 30 см,296 ₽,10 отзывов,"7 мая доставит Ozon, продавец Правильный выбор",https://www.ozon.ru/product/prazdnichnaya-hlopushka-zelenyy-maxsem-30-sm-319259216/?asb=4VZe5Niwxg%252BgDpIHUQAgkN%252FKr9KU%252Fw8I1jnTvPcJYvqKSjVpNxSt3%252Bvr7rjw7JDR&asb2=_71kCF74ZsWvswJhOe4rJG7MkH7oOnj0FBcttQN2NZEscWpD1GN0wPDMfpF9EVxxw-a82LSxvzBCBOAZ1IuMEaQCr3sQTjKM5cHHsvuojfi55IMCbyueAudwPrSgC5l-QqM1YrGgsOWOp8hti4Fv1A
"Праздничная хлопушка Сердца Фольга, Картон, Хлопушка сердца золото 30 см. Волшебный мир воздушных сувениров 30 см, 1 шт",279 ₽,141 отзыв,"7 мая доставит Ozon, продавец Волшебный мир воздушных сувениров",https://www.ozon.ru/product/prazdnichnaya-hlopushka-serdtsa-folga-karton-hlopushka-serdtsa-zoloto-30-sm-volshebnyy-mir-335042698/?asb=qS0kHHwj9Izk0Wp8f1EteIuTTmfSRASmAkbtZCPPxh%252BCdkev0PrIhwzlyeKaOkvd&asb2=7VtL2eI-XlVZf_XEtrYSiGn01DENmMuxGjsQC0UL-6te5clpTeIRqrAB4K5foKVgyxgBL9VDgN7eN3R6Op7aFxOALuxLEduHwnDDsv0VV88EpmLMvpqPSAlCjDjqQpzGROGfp8hC5F8mnC7InUYuHQ
"Праздничная хлопушка, Конфетти Картон, Бумага, Разноцветный серпантин Свадебная Мечта 60 см, 1 шт",333 ₽,84 отзыва,"7 мая доставит Ozon, продавец Свадебная Мечта",https://www.ozon.ru/product/prazdnichnaya-hlopushka-konfetti-karton-bumaga-raznotsvetnyy-serpantin-svadebnaya-mechta-60-sm-1-sht-204000653/?asb=BmumRp9LgYQTSUavUQi352SyzmkYgHBdyLtxtj6m3iQ%253D&asb2=000vNyLb47GBbFC7lPYgDs3OOw_agj0hUgRTkRusK3s2Yh0n8rK13xGvffeHnF71
"Праздничная хлопушка разноцветный Grand Cadeau 20 см, 1 шт",280 ₽,2 отзыва,"Завтра доставит Ozon, продавец grand cadeau",https://www.ozon.ru/product/prazdnichnaya-hlopushka-raznotsvetnyy-grand-cadeau-20-sm-1-sht-298940645/?asb=q75%252BguzcPZGJ2UVdivBoJhiQ%252By2%252FjHsjyP3FkAv%252FglQ%253D&asb2=IFz88GDdJltOLJg-x8dLRFOZZ_H-VX5eIt7i6crvAmhuYEwXshdY1AbeXpjrqYPE
"Глиттер Золото, 80 гр. (глир)",259 ₽,21 отзыв,"7 мая доставит Ozon, продавец ДавайДарить!",https://www.ozon.ru/product/glitter-zoloto-80-gr-glir-203457198/?asb=LC26ha%252FcorJIae4BCZFsVljeb4EttdsZBumSo6w592c%253D&asb2=q7ynEWJSo0RtEIylVMd3oH3SGCtU5tWoICpArmBD5F77PLHbogwpEi0A8goejjfu
Праздничная хлопушка Страна Карнавалия,176 ₽,2 отзыва,"Завтра доставит Ozon, продавец Эврики",https://www.ozon.ru/product/prazdnichnaya-hlopushka-strana-karnavaliya-233670533/?asb=0fJBiC3RfAUWfp6v%252FhhYDJJXEboZIPB5EEOcP3PkXpo%253D&asb2=X3Bt4VkoDUrtwxfr2h9M5I1t8kS06GIZsm8C8u7XAE8sdJ54u0YdA7PYeo7HXSti
"Праздничная хлопушка 58 см, 1 шт",299 ₽,6 отзывов,"Завтра доставит Ozon, продавец ИП Нургалеев И.Р.",https://www.ozon.ru/product/prazdnichnaya-hlopushka-58-sm-1-sht-363486652/?asb=R%252BokO3wWcG4QAFkUefDi9jvy7jFHU5vGsALGRpP%252FDas%253D&asb2=zG6RncUIMe5bhYx_sQ25qQL1WRIsJ1v16tnNdzpIAz2pia7r04xPRsgaPy53eAbG
Праздничная хлопушка Страна Карнавалия,449 ₽,7 отзывов,"Завтра доставит Ozon, продавец Эврики",https://www.ozon.ru/product/prazdnichnaya-hlopushka-strana-karnavaliya-238342443/?asb=C47DJ4SPITDlVe3RGLTsRdrH%252B2lJBJ3owJhG5KSK6U0%253D&asb2=-7suI_u-PlXKvNR19CY8Bxhxam2myEz8Dr8WYjcgeujb2bOxd6AmBmH6Ffsf_cJj
"Конфетти тишью, наполнитель для подарков Сердце, Розовый микс, 2,5 см, 50 г. (Ктиш)",297 ₽,14 отзывов,"7 мая доставит Ozon, продавец ДавайДарить!",https://www.ozon.ru/product/konfetti-tishyu-napolnitel-dlya-podarkov-serdtse-rozovyy-miks-2-5-sm-50-g-ktish-363378005/?asb=5z%252BKY8mNWXr1xTruNiNo6R4fxIOM7WqwlV4kxjI8TJ8%253D&asb2=3fXlpJnY6JEqRqKPcFLTNyH-5gLLpjhyGMRazes6YBPHYW3FL6Jb-3sZ9xdD5C7I
"Конфетти фольга, наполнитель для подарков Сердце, Золото, Металлик, 3 см, 50 г. (Конфоль)",223 ₽,72 отзыва,"7 мая доставит Ozon, продавец ДавайДарить!",https://www.ozon.ru/product/konfetti-folga-napolnitel-dlya-podarkov-serdtse-zoloto-metallik-3-sm-50-g-konfol-363436375/?asb=ull4%252BUgllKVtBCOFEwsXsnVvcvDh3yGhJhNMRyoZhKQ%253D&asb2=PVyjmUxIELKChcc257_x-UvEw82Uw-aPfN194ZrpnPUj4jVeGkqpkIWAq0Xghke2
"Бита для пиньяты, размер: 4х43 см, 1 шт.",323 ₽,24 отзыва,"Завтра доставит Ozon, продавец Airwave",https://www.ozon.ru/product/bita-dlya-pinyaty-razmer-4h43-sm-1-sht-349799309/?asb=hRCSrHgzk3zcjkNtpJGrSZ2XWzvG%252FS2UCWZHRr8dbh8%253D&asb2=a0RuLS_NYh1lLEYb7HnEwPtwztMSZSErFwwcMVQtZuVqZF7F6K46CnFSjy9sxxNu
"Конфетти тишью Круг, Голубой микс, 1 см, 50 г. (Ктиш)",297 ₽,14 отзывов,"7 мая доставит Ozon, продавец ДавайДарить!",https://www.ozon.ru/product/konfetti-tishyu-krug-goluboy-miks-1-sm-50-g-ktish-363376692/?asb=GjYF%252Fkosov6PRuVDV%252B%252FoFSK4avURaYaLJ8GRl2tagCc%253D&asb2=P7ZgE9CgizTu3uNqeIKGfv5luVsNFdiml_IpQrluiehmWBA3VKkI_eXl0jc44ei9
"Конфетти Металл, золотой Sima-land",199 ₽,9 отзывов,"Завтра доставит Ozon, продавец Да Винчи",https://www.ozon.ru/product/konfetti-metall-zolotoy-sima-land-324013069/?asb=6ZAohcNxnzKG%252Bdceg9q7AHmJfob8z0SzwGnhUfygR7TfnLedMINWGTfomUxiL6wJ&asb2=xmW3OVn2ANwpRyuYLy07PwKKYOEJ3mS9mYVZPTp6tTMgG6zUXFAaz1Ep3UbCcK3ngvXzLLakw1-m7JuVqW0UziBOOKYkqSICS69GP9a6Dr8C7dimmlo-em_UMyE25IDOsSoHOE60vTBHEko1uPHQ6w
"Конфетти фольга, наполнитель для подарков Звезда, Черный, 1,5 см, 50 г. (Конфоль)",273 ₽,72 отзыва,"7 мая доставит Ozon, продавец ДавайДарить!",https://www.ozon.ru/product/konfetti-folga-napolnitel-dlya-podarkov-zvezda-chernyy-1-5-sm-50-g-konfol-363437394/?asb=XnLxmhKVv%252FH6lFld17sQrvxEYuZiUpJmMZ6prtgiNe8%253D&asb2=xQn62pqtKujFB1HmA2sDtGjPW4Eg6pYSJsHxOl6YKXS9BCPRLy_4b8ICK2OcVxVv
"Пневмохлопушка (12/30 см), Металлизированная лента, Ассорти, 1 шт.",338 ₽,1 отзыв,"Завтра доставит Ozon, продавец ШарикClub",https://www.ozon.ru/product/pnevmohlopushka-12-30-sm-metallizirovannaya-lenta-assorti-1-sht-293564802/?asb=NsV4rTK%252FOJVBsUxoSfNT65IPztT85BpLATzoD8Hy9eI%253D&asb2=l4o50FdSxtT0XdVqEs_NqMeVyWCE9vO73LpzE06iBRTi9eT_X6-DNuaag1wTxW7X
Праздничная хлопушка темно-зеленый Дон Баллон,287 ₽,8 отзывов,"Завтра доставит Ozon, продавец Праздник будет!",https://www.ozon.ru/product/prazdnichnaya-hlopushka-temno-zelenyy-don-ballon-463938378/?asb=GU%252F8v55n52z0hl02F%252BDoAYkBfjajB%252FMAsTDPxkmBIEH965TcrpDbp2SeEOFlyaRp&asb2=i69BpO_xCtQ5InJmrI4XmL_Sx4EH05B-9N1MykKhqx4epZivYIUK5dkRkVqQPh75rXqj_8jaEDCeuW9PmAJf7mBWCk03LyDeo9H6da1USz3IJpQr9-Q4puTaO9OmFwHWoQAj3u_VVTD8S1-zrQAx2w
"Хлопушка пружинная (4/10 см), Три Кота (3 кота), Металлизированные круги, Ассорти, 1 шт. (хлоппруж)",145 ₽,73 отзыва,"Завтра доставит Ozon, продавец ДавайДарить!",https://www.ozon.ru/product/hlopushka-pruzhinnaya-4-10-sm-tri-kota-3-kota-metallizirovannye-krugi-assorti-1-sht-hloppruzh-254223094/?asb=3WLBCXAM3uz76O4s2QYgGZa4NNRWSQN7I1lIFjvSX14%253D&asb2=_M5835HP7xw5hQsLVLDA9ojGXUnDNbzAv5oytNo9KxhpyEUPhHR5X8raU2UChYE0
"Праздничная хлопушка зеленый Легенда 30 см, 1 шт",213 ₽,8 отзывов,"Завтра доставит Ozon, продавец ИП Акимцев А.Д.",https://www.ozon.ru/product/prazdnichnaya-hlopushka-zelenyy-legenda-30-sm-1-sht-405950015/?asb=uTEnL836Lyz6rHfCEAv7pAh26O0M9dOlnK3rlacw%252BnuM4DqaYr175Y8m6u3Rg1J9&asb2=pq-_l2SWF6hLG88hS-Nl8KSDG7h8eUdN5d0XXD2SundjKjhe5keIJt9V1Sl3OWW-oye7lPSmhSnbUuU0NwM2AKM5HyyyD8BpOQVV77Ti9mGTDOYrkPPwVYQxkdKO1vrCAH_SZIUfIimsh-nvYzSdOA
"Праздничная хлопушка Картон, Фольга, 30 см, 1 шт",348 ₽,8 отзывов,"Завтра доставит Ozon, продавец grand cadeau",https://www.ozon.ru/product/prazdnichnaya-hlopushka-karton-folga-30-sm-1-sht-172933291/?asb=I8h1NYTmTDP3Ku3958YCez%252B6N1QIN51GwHH6351csuC8oKltaOsjHpga3T0zHmFH&asb2=OL7i5r0sri8jIsRIN4MdeGTVuxxgcshQE_a8fEL6gJSIGyD2j_QiS1OEmypV5FQBninDrwXTUTEhcNzEsIwLFdyGrNlis4tQpsvIZOo52IFZ_5J8lrp4BkKIqIlIKarkRLvLyaNBwgxBhG95_6cmFg
"Праздничная хлопушка, Конфетти Картон, Бумага, Разноцветное конфетти Свадебная Мечта 60 см, 1 шт",389 ₽,84 отзыва,"7 мая доставит Ozon, продавец Свадебная Мечта",https://www.ozon.ru/product/prazdnichnaya-hlopushka-konfetti-karton-bumaga-raznotsvetnoe-konfetti-svadebnaya-mechta-60-sm-1-sht-204012322/?asb=BzZ%252FXpgNjSLIUCHdKSgs80vbCZ6Rwv6v%252BgKT3kvpgUE%253D&asb2=y-4B4ktvL1sRrcyh6kB0tBC26Zp2ouoRLYnG1reZ_WyztN-iTs1yMnRK35jld7RZ
"Серпантин Текстиль,",260 ₽,1 отзыв,"Завтра доставит Ozon, продавец Эврики",https://www.ozon.ru/product/serpantin-tekstil-236872980/?asb=U7kYQYVNb%252FlrKmd%252Ft6xmQjWsJNmy1G78zvbobfIX1Gk%253D&asb2=M6UPi4OAD18-G0pPbWuwSLuQCWIkBJD35WWIZRootLzyBCN9Z7auwgvhlM__r0Gh
Праздничная хлопушка коралловый Дон Баллон,259 ₽,8 отзывов,"Завтра доставит Ozon, продавец Праздник будет!",https://www.ozon.ru/product/prazdnichnaya-hlopushka-korallovyy-don-ballon-332261760/?asb=eg%252FFC7xPoM%252BgewqUuYbMoQhlB%252BX8Jx9K9L6CFnTRen2FIXCfpZ2EZWX7vbTdUKIf&asb2=7S9kZI8it2qIbMgMLuauwLI7LibchI3ua7F1pQedvBl0yxhl93XX78nPXp3uephsScAE3U0O3hAnowxv0rIGNeOklXamLT-VUvjYBuENvD0rV5YliGEuBfENFUbBZt4iA-gUgTvXuQFxYJZU-EZmjA
"Конфетти, наполнитель для подарков Звезда, Контур, Красный, 17 г. (Конпл)",127 ₽,18 отзывов,"7 мая доставит Ozon, продавец ДавайДарить!",https://www.ozon.ru/product/konfetti-napolnitel-dlya-podarkov-zvezda-kontur-krasnyy-17-g-konpl-363526123/?asb=3eYdsBpaPx%252FKwa6ay9ERMjSPP3Sn7h8j9TbzF%252FC17Co%253D&asb2=TiDlUGAFj9wZAqP7UmZ9L2WAxuoa-s9_c-Cx0a4eUnNkXz_Gdz2xKCcJHCXYbxDL
"Конфетти Слова Фольга, голубой Ukid GIFT",108 ₽,2 отзыва,"Завтра доставит Ozon, продавец Товары для детей и взрослых",https://www.ozon.ru/product/konfetti-slova-folga-goluboy-ukid-gift-181855313/?asb=v5%252BOxe1IZhRzwQ3v06MA2tf3aYdydDIEsINB5gfJkeI%253D&asb2=ECw5Q3JcU4YyPrSIB5WfKzp4SaABv0bRC6FD6CQoDiaXPiycpqW5Gs6NYT4g9TfR
"Конфетти Сердца Фольга, Сердце, Розовое Золото, Металлик, 2,5 см, Волна Веселья 2,5 см, 1 шт",269 ₽,56 отзывов,"Завтра доставит Ozon, продавец Просто праздник",https://www.ozon.ru/product/konfetti-serdtsa-folga-serdtse-rozovoe-zoloto-metallik-2-5-sm-volna-veselya-2-5-sm-1-sht-474387605/?asb=4nbXt72zVCxV2Wttk0mbXJlyLHnrIF4o0ExvqC832wI%253D&asb2=M6JjI9p3MBdUg53VIJNYWwOFPpwKdJD0Kwg8lc8JgxSRv2k1eO62ppjry4KxqiP-
"Серпантин Фольга, красный Весёлая затея 400 см, 36 шт",330 ₽,30 отзывов,"Завтра доставит Ozon, продавец ИП Машкова Е.Н.",https://www.ozon.ru/product/serpantin-folga-krasnyy-veselaya-zateya-400-sm-36-sht-214004710/?asb=VHxCLs4JiPki%252Br1LsktXRaEGSBjo8nYffVDbRUzIS1SlRZ0BcyNHpeaCsjhWR4JJ&asb2=4YF0khPdeVlHIM3uQM3guQKJ_qucTJyx8-aSwH2O4tMqe7-Z6qM7A_kVdCQBcLmA1dbv39PYZTgKgX7vSZrq3hFFXWMeXfLxxY7insALcAAaNGVByfuLvRd4xvyNDVSyWDshTW76xSsibThx5l8vPA
"Серпантин Бумага, красный Страна Карнавалия, 18 шт",173 ₽,9 отзывов,"Завтра доставит Ozon, продавец Эврики",https://www.ozon.ru/product/serpantin-bumaga-krasnyy-strana-karnavaliya-18-sht-283051105/?asb=umwDXaqekQl%252BRJhe6hdQ0%252BRIzQE5j7%252F%252FRz2eddPxifM%253D&asb2=SB_rPycEjHDrKyk8w4jEivuhZ14AORCVyGJn63kSn_8_YMtimT-E3pZfCoMkBBeC
"Праздничная хлопушка Бумага, Металл, разноцветный Страна Карнавалия 30 см",315 ₽,1 отзыв,"Завтра доставит Ozon, продавец Эврики",https://www.ozon.ru/product/prazdnichnaya-hlopushka-bumaga-metall-raznotsvetnyy-strana-karnavaliya-30-sm-261595433/?asb=MIo76G%252BFi%252F0nN6wEzVt%252BXGW0j8jFxIXpuowDifu%252F1V8%253D&asb2=e-s6ZG7aUm87d5o143yREGeOwVEtm_mRTybQjUKnfDoGQ-PBp740wiXO8La0GPO1
"Праздничная хлопушка, Конфетти Картон, Фольга, зеленый;желтый;красный Свадебная Мечта",230 ₽,11 отзывов,"Завтра доставит Ozon, продавец Свадебная Мечта",https://www.ozon.ru/product/prazdnichnaya-hlopushka-konfetti-karton-folga-zelenyy-zheltyy-krasnyy-svadebnaya-mechta-334552111/?asb=En2yNnkg6Y0%252FVZSF2Z7cQ2zpX18qAOa0i2fSryBZZD4%253D&asb2=-6KdzlvT0j6VMXn2z6paNGaG6cAwEi8ECK3hCoCDqEW4T3QgWfccC4U47LeF7POv
"Конфетти тишью, наполнитель для подарков Круг, Шоколадный, 2,5 см, 50 г.(Ктиш)",201 ₽,14 отзывов,"7 мая доставит Ozon, продавец ДавайДарить!",https://www.ozon.ru/product/konfetti-tishyu-napolnitel-dlya-podarkov-krug-shokoladnyy-2-5-sm-50-g-ktish-363376596/?asb=6iMpVql203cdx5AZKZINymzkJSfJZxCHcrnl%252BRoajM0%253D&asb2=sWzyzCga7Ib8W2vPVLAu4P5VzrksnN2e9AWFWtHRCgGyJ2YyVlAioOYBWAsIsjSq
"Пневмохлопушка (12/30 см), Комикс, Праздничный взрыв, Конфетти тишью, Звезды, Ассорти, 1 шт.",341 ₽,2 отзыва,"Завтра доставит Ozon, продавец ШарикClub",https://www.ozon.ru/product/pnevmohlopushka-12-30-sm-komiks-prazdnichnyy-vzryv-konfetti-tishyu-zvezdy-assorti-1-sht-293564151/?asb=NeMb3in%252Fc%252BGDklJT2xi5yTWStnMrgYR8q%252BXHqDivWHo%253D&asb2=29PS0thqze_0OodteBLHHdvpMOCDEv28H_n1b22FRZQBOQo5d1eW_QtZSP_0Brvq
"Бита для пиньяты, Ассорти, 2,5*50 см, 1 шт.",323 ₽,14 отзывов,"Завтра доставит Ozon, продавец Просто праздник",https://www.ozon.ru/product/bita-dlya-pinyaty-assorti-2-5-50-sm-1-sht-468123823/?asb=TE9vWC4Ygpv3qGvOKhXgvj0%252FIw1wrP7Kz%252Ff%252BdFyYElg%253D&asb2=ed2oWx2Qz1wQ9XRtWB2jKwdRvnvasJQPWcKLAoheXTrfcc4h6AkIumAEa8hHnN_8
Хлопушка Три кота хлопушка с днем рождения хлопушка с конфетти хлопушка с серпантином хлопушка на день рождения хлопушка детская три кота 30см,440 ₽,6 отзывов,"Завтра доставит Ozon, продавец FUNNY ШАР",https://www.ozon.ru/product/hlopushka-tri-kota-hlopushka-s-dnem-rozhdeniya-hlopushka-s-konfetti-hlopushka-s-309952618/?asb=%252FZHiPdk6uc1kgXLlGYS9yRo85gGPoyUOpzs6Omxb7IX5soOcvRkheMRycj0PzaL0&asb2=8-1G7DAgOIS4Z3UO7Hy7h3kThfpjdKTCsNWINkloZD1tcIjO27_P4oEfQjT7iW8tZZnH_ef3iG3bQ1Baa2JiWW926J_59KUMSOdmjkuBxtOcMpmyXp2K7Im0uzEez_-1
Праздничная хлопушка зеленый Joker Fireworks,420 ₽,9 отзывов,"8 мая доставит Ozon, продавец Дом праздника",https://www.ozon.ru/product/prazdnichnaya-hlopushka-zelenyy-joker-fireworks-524348795/?asb=IJ46%252B7IapC8dboNSggYbsJXx%252FVQoZEYnyjwWQ8JtZ4DRqG41Zf5Sj4b%252BP1SUjWd8&asb2=_EKH0rMHMWY1tXZ5k--Oon43_jgMyb7834vJLkCnV-JzqIOmHNOlzHJUQsAhR8NyygNjp80emt_z_x7rYv58MVmpQ4y2fQFx2E4i37Aj8-ZBVm-zijo0zwUdQE_cczd0iz9nOscsg0DaDSxdjBW7AQ
"Бенгальские огни ""FUROR"" свечи 40 см. 15 шт.",399 ₽,14 отзывов,"7 мая доставит Ozon, продавец Market SM",https://www.ozon.ru/product/bengalskie-ogni-furor-svechi-40-sm-15-sht-205743807/?asb=NPrUPoMJ%252F8FRQO4wfAoUt9on%252BvpSwEZhuB%252FtGFI43eQ%253D&asb2=JWPxyh8vSJQpLm4tCckR0MyThbXF-DSZ2NcZHmTGI0WuTMh_s0pkKp0TbC8CVH7W
"Праздничная хлопушка разноцветный Grand Cadeau 30 см, 1 шт",220 ₽,1 отзыв,"Завтра доставит Ozon, продавец grand cadeau",https://www.ozon.ru/product/prazdnichnaya-hlopushka-raznotsvetnyy-grand-cadeau-30-sm-1-sht-298943653/?asb=umf3juYod0ABq4oyDKaTANCuMgfub37vTo2FD2SILCw%253D&asb2=Fw8CVAOLJSkWf01ftnoTeRVUK175tRhTNG_haHPTpKFL5xc2XYMUsIVb-55IPRVE
"Конфетти фольга Сердце, Розовый, Металлик, 1,5 см, 50 г.",260 ₽,6 отзывов,"8 мая доставит Ozon, продавец ШарикClub",https://www.ozon.ru/product/konfetti-folga-serdtse-rozovyy-metallik-1-5-sm-50-g-293559799/?asb=lnOcmpDm0Zt4LDOcWqUp%252B9fiQpmWx2eb6CKveC0B8jc%253D&asb2=MuE5iftQQq3djMZgDPuYcsG70Uy_XxzeQExpMgl_30FgxyktCCxMhTkR_m8ZX_1P
"Пневмохлопушка (12/30 см), Гендер Пати, Конфетти тишью, Круги, Розовый, 1 шт.",354 ₽,6 отзывов,"8 мая доставит Ozon, продавец ШарикClub",https://www.ozon.ru/product/pnevmohlopushka-12-30-sm-gender-pati-konfetti-tishyu-krugi-rozovyy-1-sht-293564163/?asb=X1UeGY1qrtHfYf7tn%252FbVh82oxlL8ryzjTyiDuo0E6ps%253D&asb2=bI7-3R3K1Evo2af9JSrx5b42gLvdx3lrB5NRNeuRvwsb7xPJkmcLKx4achwd14Kn
"Праздничная хлопушка Полоски Бумага, Металл, разноцветный Страна Карнавалия 50 см, 1 шт",427 ₽,7 отзывов,"Завтра доставит Ozon, продавец Эврики",https://www.ozon.ru/product/prazdnichnaya-hlopushka-poloski-bumaga-metall-raznotsvetnyy-strana-karnavaliya-50-sm-1-sht-193863020/?asb=ikdVLb7JXIsSdF47J6%252FsjeVyouaOpwhlOqCRLpajn2q4FGuIGvPmayijh84NqRxW&asb2=Jy_7u5vgMgxaoIgBU0lwfQXYHrijmICdYM5JjaiBOrXjHy-mzBxu4vefmGGLoO9PYQhrld2cwHX8-tqKQF_mp74yiwFx7soIw-aBpeGt-PlsurRHh92Uc6UtxWKMxdzJn2E8AnTWTND9_LulAyeXwg
"Праздничная хлопушка, Конфетти Картон, Бумага, Денежный взрыв – евро Свадебная Мечта 40 см, 1 шт",426 ₽,14 отзывов,"8 мая доставит Ozon, продавец PartyFlexx",https://www.ozon.ru/product/prazdnichnaya-hlopushka-konfetti-karton-bumaga-denezhnyy-vzryv-evro-svadebnaya-mechta-40-sm-1-sht-293065613/?asb=28hPvnCgvLmUIUwTjwyj%252BfAZb9irJMSFeoGIocmK9qSLvLxltvPP15zCK3b6TRC0&asb2=1ohiXFLH-P9FNYNDTSYdyiZ1iMjvLdNOuCimgrKUer6wZvusGtsoXpmAB2kEJYHcEFOXIIb_V-XQKvhUtq5cW9vIL_kaqM7JIVvHYLrqCJ7vfDjNGZb4HihEqY2p_CtcfeeedtWCWfXd3q88pNTw2w
