Авангард. Клинок пери. Книга 1 / фэнтези для детей и подростков 12+ | Гаглоев Евгений,409 ₽,8 отзывов,"Завтра доставит Ozon, продавец ООО РОСМЭН",https://www.ozon.ru/product/avangard-klinok-peri-kniga-1-fentezi-dlya-detey-i-podrostkov-12-gagloev-evgeniy-547588988/?asb2=oGQnMIclB_nmOfmsjjNZyTHHl78Zhv4YGE13NQoyJMntKq2hUkwNQiy_zT2-xuog
"Мама меня любит / Сказки для детей, малышей, эмоции, воспитание детей, книги для детей | Ульева Елена Александровна",212 ₽,27 отзывов,"Завтра доставит Ozon, продавец Clever",https://www.ozon.ru/product/mama-menya-lyubit-skazki-dlya-detey-malyshey-emotsii-vospitanie-detey-knigi-dlya-detey-uleva-405713350/?asb2=lL_2SfETdw77pnuXJyoOAcgK1vevsH824eswuQ43JOsR3_Nu52DLL-zMPQNit3Qo
"Правила безопасности в сказках. Осторожно, микробы! | Ульева Елена Александровна",160 ₽,154 отзыва,"Завтра доставит Ozon, продавец Clever",https://www.ozon.ru/product/pravila-bezopasnosti-v-skazkah-ostorozhno-mikroby-uleva-elena-aleksandrovna-205732430/?asb2=FzmTKDu7y8PMEUVrjay3JUQHGorWOtrn5nHotq0XasVHyjZ1IXGzprZZ9VjDl-Yb
InvestFuture IF Kids. Аня и Макс: первая зарплата,475 ₽,15 отзывов,"9 мая доставит Ozon, продавец IF Kids",https://www.ozon.ru/product/investfuture-if-kids-anya-i-maks-pervaya-zarplata-546445381/?asb2=-b0NbUjxQlruz8OEN4bY2-EKpVsz2h_FO4mt9ic4jZx5-S7xh6lX5kgXclEnXmnQ
"Чик и Брики. День рождения / Сказка, приключения, книжки-картинки | Шеффлер Аксель",255 ₽,4 отзыва,"Завтра доставит Ozon, продавец Clever",https://www.ozon.ru/product/chik-i-briki-den-rozhdeniya-skazka-priklyucheniya-knizhki-kartinki-sheffler-aksel-512238425/?asb2=0LqQXoxvJ8iz473kgC3uUzu3tldU-ewK1USGlnjtqtmhcd9r0aiUjpnwC1XQw-xg
Мы с дедушкой друзья | Коваль Татьяна Леонидовна,108 ₽,102 отзыва,"Завтра доставит Ozon, продавец Ozon",https://www.ozon.ru/product/my-s-dedushkoy-druzya-koval-tatyana-leonidovna-257020301/?asb2=fW_ucmQ1U_kVufyyLt0C7f9dnaib-3L0fapOPgXjetF9J29s4c0yq8XBUY9UhgI1
Бабушкино сокровище | Коваль Татьяна Леонидовна,103 ₽,193 отзыва,"Завтра доставит Ozon, продавец Ozon",https://www.ozon.ru/product/babushkino-sokrovishche-koval-tatyana-leonidovna-235411207/?asb2=xhlvQ5uFIzQwCv76nOC4cNROelJSUXc80PISr9m01wJ7OeMFIStx6AAC6YGEyQl5
Бабки-ёжкины сказки,150 ₽,18 отзывов,"Завтра доставит Ozon, продавец Издательский Дом Мещерякова",https://www.ozon.ru/product/babki-ezhkiny-skazki-319467238/?asb2=KUnMclMd349YFaK1kHCYO6dXFbiJ67n0vwl-NTB95B7Ef45MH6perZMMXfRqa79T2Vy3oZkeTF8QOAryyG0oZA
Сказки для высокочувствительных детей. Сказкотерапия. Эмоциональный интеллект,419 ₽,9 отзывов,"9 мая доставит Ozon, продавец Феникс-Премьер",https://www.ozon.ru/product/skazki-dlya-vysokochuvstvitelnyh-detey-skazkoterapiya-emotsionalnyy-intellekt-501566675/?asb2=vJgVY0b0QVf-Pj1uN3IlUrjxz_ojBQT7CHYFbjkXt3dN6qr-ALkxgqvb-QFPPkJI
"Древний африканский город | Макдональд Фиона, Вуд Джеральд",120 ₽,11 отзывов,"9 мая доставит Ozon, продавец Издательский Дом Мещерякова",https://www.ozon.ru/product/drevniy-afrikanskiy-gorod-173320767/?asb2=ddgrO022jqidEGa30qMD8JirPHKfoF8jKEpuy86nj4FWad6HPOYXA_3TVha1OT2g
Разгром: роман | Фадеев Александр Александрович,309 ₽,2 отзыва,"Завтра доставит Ozon, продавец Ozon",https://www.ozon.ru/product/razgrom-roman-fadeev-aleksandr-aleksandrovich-429073853/?asb2=dyCTTKIgXFxrZsww67izwQnTUmuG0o5qdXSbjr-uJjz-lExzHmLr9fLSA5SC9Jun
Дочурка Груффало. Стихи | Дональдсон Джулия,396 ₽,16 отзывов,За час курьером Ozon Express,https://www.ozon.ru/product/dochurka-gruffalo-stihi-donaldson-dzhuliya-464408288/?asb2=8cYMW05Z08jMSbNQhaoa_lXiA155h3xzmgw580b7puCI3Zo-pOGTTXrNl2xXyQ36
Замурчательные стихи | Валаханович Ксения Леонидовна,130 ₽,43 отзыва,"Завтра доставит Ozon, продавец Издательский Дом Мещерякова",https://www.ozon.ru/product/zamurchatelnye-stihi-valahanovich-kseniya-leonidovna-310228838/?asb2=E_foN6oBcqYx55eir6inj2aJjC0DqSZPMuohiu2mLNQSyqwSnkyW2BeWIb3XsHNBjixfpbbcVEdxoUP0Mtt_DQ
"Котенок Шмяк - заботливый брат / Сказки для детей, книжки-картинки, подарок | Скоттон Роб",164 ₽,141 отзыв,"Завтра доставит Ozon, продавец Clever",https://www.ozon.ru/product/kotenok-shmyak-zabotlivyy-brat-skazki-dlya-detey-knizhki-kartinki-podarok-skotton-rob-309737945/?asb2=b02-RYxf5zQ-cnkFsWH2lFKV205DLDtJ8TFSDzUvkCFDcglWrZnM3xjpIl8ljVxg
"Котенок Шмяк и лунный кот / Сказки для детей, книжки-картинки, подарок | Скоттон Роб",164 ₽,162 отзыва,"Завтра доставит Ozon, продавец Clever",https://www.ozon.ru/product/kotenok-shmyak-i-lunnyy-kot-skazki-dlya-detey-knizhki-kartinki-podarok-skotton-rob-309737914/?asb2=KEyrxVEM9Sy7c7cygvUmH3eEewNJEQbM-MeR95C_XLpz632h9e7DmuFTHBHuxVEW
Я побеждаю страхи: Энциклопедия для малышей в сказках (мягкая обложка). Развитие эмоционального интеллекта | Ульева Елена Александровна,247 ₽,157 отзывов,"Завтра доставит Ozon, продавец Феникс-Премьер",https://www.ozon.ru/product/ya-pobezhdayu-strahi-entsiklopediya-dlya-malyshey-v-skazkah-myagkaya-oblozhka-240279964/?asb2=KwYksWPn5fWpidSAvRr6MrHerEdihkBjxxsG3HyKcgfQPkvdCeEqf6eR2605L-ZiFg4yWrWnCkR_19butZ_2zQ
Сказки о троллях Высокой горы и Большого леса,190 ₽,18 отзывов,"Завтра доставит Ozon, продавец Издательский Дом Мещерякова",https://www.ozon.ru/product/skazki-o-trollyah-vysokoy-gory-i-bolshogo-lesa-294637587/?asb2=P16hcSdZOpeW7cxZzsZy2ayYvhVO8hWo80Geqw9cTXtkE11h93JXn4-VlE6xigvmymKJdzKJkYZ5plXDmJcXgQ
М. М. Зощенко. Рассказы для детей,169 ₽,90 отзывов,"Завтра доставит Ozon, продавец ООО РОСМЭН",https://www.ozon.ru/product/m-m-zoshchenko-rasskazy-dlya-detey-149639117/?asb2=j5rwuwYoWuop1EjFYm8bnxuxhvbwKW8NTc3dhjXzRC9gCOiKaylRoRgOsFCQvE4v
На ферме | Шеффлер Аксель,517 ₽,65 отзывов,"Завтра доставит Ozon, продавец Ozon",https://www.ozon.ru/product/na-ferme-sheffler-aksel-208020222/?asb2=VGUHtv_L0f7IC9TJZmN8MT56hOx2pW1yOQj_Zf4JGTnpcdIm10LFwoqnv0_JH4lP
Маленький принц | Сент-Экзюпери Антуан де,146 ₽,107 отзывов,"Завтра доставит Ozon, продавец Ozon",https://www.ozon.ru/product/malenkiy-prints-sent-ekzyuperi-antuan-de-206360761/?asb2=iXkBlhdAhVfxLjNpiH-n8-cJlFgfaA21s2500-z6biSVMcNyQKY_d9Q6i8xOXsAg
Мэри Поппинс | Трэверс Памела Линдон,169 ₽,139 отзывов,"Завтра доставит Ozon, продавец ООО РОСМЭН",https://www.ozon.ru/product/meri-poppins-148804118/?asb2=JRKywrkThVHVQO4ntr2XTeUHJ8cry4h9nJYPDgUnqYKy0t0sS0wZAMmyBPXhSNSU
Приключения олененка | Гурина Ирина Валерьевна,99 ₽,193 отзыва,"Завтра доставит Ozon, продавец Ozon",https://www.ozon.ru/product/priklyucheniya-olenenka-169452315/?asb2=-9cxhziVEB_QnZVn7ZSO7jQaWItggkQWyNv_NvbMysrutHHC6dkYLCCtkhU3FVLd
Сказки дядюшки Римуса. Внеклассное чтение. | Харрис Джоэль Чандлер,169 ₽,42 отзыва,"Завтра доставит Ozon, продавец ООО РОСМЭН",https://www.ozon.ru/product/skazki-dyadyushki-rimusa-vneklassnoe-chtenie-149639268/?asb2=JbaepD1Vn5U3vQKKbOqz3VNaXxuECGbWHqtvZaTjmRVGMfT7qRkVB9NT7dsN-jjE
"Правила безопасности в сказках. Внимание, дорога! | Ульева Елена Александровна",207 ₽,166 отзывов,"Завтра доставит Ozon, продавец Clever",https://www.ozon.ru/product/vnimanie-doroga-167588591/?asb2=sf7VVCBlBQaPq_gL30F1c-9NAeKMAHo-aYTMkoPaTcgRI1KM4p0SRbIkQD2ZNUao
