Наедине с собой. Максимы | Аврелий Марк,140 ₽,65 отзывов,"Завтра доставит Ozon, продавец Торговый Дом ""Эксмо""",https://www.ozon.ru/product/naedine-s-soboy-maksimy-avreliy-mark-249408218/?asb2=itkxAfenZMT2kIWmerTHUqlK82Oe3Pj_mkufAN5XIL-rUv1rDneKY4VIXtRV0the
1913. Лето целого века | Иллиес Флориан,574 ₽,126 отзывов,"Завтра доставит Ozon, продавец Ад Маргинем",https://www.ozon.ru/product/1913-leto-tselogo-veka-illies-florian-223527162/?asb2=ZNGKB9zET0mUrtXPMrytGTAFgAa196_kn04yRldaFtjAWxZaHEMCPn2ZN4gkTNI8
Полный курс нумерологии. Как найти себя и раскрыть свой потенциал | Филлипс Дэвид А.,319 ₽,164 отзыва,"Завтра доставит Ozon, продавец Ozon",https://www.ozon.ru/product/polnyy-kurs-numerologii-kak-nayti-sebya-i-raskryt-svoy-potentsial-147104230/?asb2=y129XyZREEq8H4ZI9HEiYqYu-PrVlhAjXPQ8QuB-TdAReXeXxYN3tPTYrZewoN-h
"История искусств. Просто о важном. Стили, направления и течения | Аксенова Алина Сергеевна",555 ₽,15 отзывов,"Завтра доставит Ozon, продавец Ozon",https://www.ozon.ru/product/2020-istoriya-iskusstv-prosto-o-vazhnom-stili-napravleniya-i-techeniya-148105776/?asb2=n9JPT1RkvJ1Ne0o54em3B3-1-14viCJn3HX5OnTWTvc-FOc1AU-iATnm-NCg1MPw
"Легкие пьесы для фортепиано, звучащие сложно. Сборник нот | Шарова Мария",198 ₽,37 отзывов,"9 мая доставит Ozon, продавец Феникс ТД",https://www.ozon.ru/product/legkie-pesy-dlya-fortepiano-zvuchashchie-slozhno-sbornik-not-sharova-mariya-239938995/?asb2=BhYr0VqA769LsYfBNuP_-IIziVYBt1hmXHYGI7cBsC4mYKnCV1tK_P4MgabF5n0_
Учение о цвете | Гёте Иоганн Вольфганг,161 ₽,102 отзыва,"Завтра доставит Ozon, продавец Ozon",https://www.ozon.ru/product/uchenie-o-tsvete-149051559/?asb2=Vs9OORlIF-e990W5jGGJLTW0YxNYDmXj1ExSNlMvawSTYe8gTAMWnJJzlOkTZS43
Homo ludens. Человек играющий | Хёйзинга Йохан,202 ₽,97 отзывов,"9 мая доставит Ozon, продавец Ozon",https://www.ozon.ru/product/homo-ludens-chelovek-igrayushchiy-148829582/?asb2=ufBPsJGvpmpIN_IjZ2Ll5d7smF3GoiSZ0EkTSFgW-v1X9H3vJFtfsi92aVPxjrI0
Нумерология | Кристи Энн,202 ₽,68 отзывов,"Завтра доставит Ozon, продавец Ozon",https://www.ozon.ru/product/numerologiya-169181928/?asb2=YkdzGQ1C84BWEGLAy0myBxcmikOSphMZkQ43D_0UysoJyTBuNTFyyLv26TsTBz6F
Суждения о науке и искусстве | да Винчи Леонардо,142 ₽,113 отзывов,"Завтра доставит Ozon, продавец Ozon",https://www.ozon.ru/product/suzhdeniya-o-nauke-i-iskusstve-32359551/?asb2=KkyEFG8c_LiDpSpNpukpYeJYaBG506h86H7Jo1FPYfrvppkz2y6gWP4vTTuEJJsg
Письма к брату Тео | Ван Гог Винсент,236 ₽,168 отзывов,"Завтра доставит Ozon, продавец Издательство АСТ",https://www.ozon.ru/product/pisma-k-bratu-teo-van-gog-vinsent-313583992/?asb2=B6yHpjZHtVgjx4Qtq9k_MIXJgfageL-nlui4dx9us4dw-JfMbrVc81k1vEsLVaDb4W2FLeLUo6WDszgeWOn9ww
Этикет: Полный свод правил светского и делового общения | Белоусова Татьяна Вадимовна,261 ₽,164 отзыва,"Завтра доставит Ozon, продавец Издательство АСТ",https://www.ozon.ru/product/etiket-polnyy-svod-pravil-svetskogo-i-delovogo-obshcheniya-belousova-tatyana-vadimovna-322264443/?asb2=bO-61PzFVMzCHfv8nE1JxXMDWfJdF7xERyGZxTAs9zFV4NNOkTgiPHn2pdfwfu6uL6slzmEkyCDEM_GMIoarxA
О духовном в искусстве | Кандинский Василий,160 ₽,33 отзыва,"Завтра доставит Ozon, продавец Ozon",https://www.ozon.ru/product/o-duhovnom-v-iskusstve-kandinskiy-vasiliy-181275935/?asb2=OavjWUB88GjDBGb15fyU2n5rLncotyuVWxW1jewrpO9bxQ_j5wBWTVYRnBERhb1E
Найти идею: Введение в ТРИЗ - теорию решения изобретательских задач | Альтшуллер Генрих Саулович,595 ₽,3 отзыва,"Завтра доставит Ozon, продавец Альпина. Книги",https://www.ozon.ru/product/nayti-ideyu-vvedenie-v-triz-teoriyu-resheniya-izobretatelskih-zadach-altshuller-genrih-saulovich-482214488/?asb2=ascQEPlu0QoG-wVHVNrQ5CG9eyNJQnros2s99x0veRtN5RqSKE6Q8t3g8PtwKgzF
Я и Оно | Фрейд Зигмунд,143 ₽,97 отзывов,"Завтра доставит Ozon, продавец Торговый Дом ""Эксмо""",https://www.ozon.ru/product/ya-i-ono-freyd-zigmund-249025883/?asb2=E2rbQzyaquw7ihy2HRnVpKao1poWq1xfnC_t8bis0PlKQdmzqub_hxUq_nVQKErm
Скрытый смысл. Создание подтекста в кино (покет),249 ₽,117 отзывов,За час курьером Ozon Express,https://www.ozon.ru/product/skrytyy-smysl-sozdanie-podteksta-v-kino-poket-seger-linda-226982161/?asb2=CmNyvozJpAP3d_2C2OguO7t9ucpDGu6wWu3mdZgQTqc2HTgKMaOTTaKdtAwIxW2K5ux8kZQqNpvl08A-Ev9nBQ
Легенды и мифы Древней Греции. Кун Николай Альбертович | Кун Николай Альбертович,188 ₽,89 отзывов,"Завтра доставит Ozon, продавец Издательство АСТ",https://www.ozon.ru/product/legendy-i-mify-drevney-gretsii-kun-nikolay-albertovich-227780751/?asb2=0J3DKNIgByP8U4k9lT6wRocc4Op6a9G4bLTK_sKZnyd3fd17GNZNIGtE6Mde1fhKd6f-fwIKXa9JrUgd-cUEbA
"Любовь в эпоху ненависти. Хроника одного чувства, 1929-1939 | Иллиес Флориан",797 ₽,1 отзыв,"Завтра доставит Ozon, продавец Ад Маргинем",https://www.ozon.ru/product/lyubov-v-epohu-nenavisti-hronika-odnogo-chuvstva-1929-1939-illies-florian-538593734/?asb2=F4vJJF2c0WQl0DP4LnRLty8jTEEgrMKsi79BfRKP-eAjuuIKfIe3PvE0cNpDex8O
Империализм как высшая стадия капитализма | Ленин Владимир Ильич,143 ₽,33 отзыва,"Завтра доставит Ozon, продавец Ozon",https://www.ozon.ru/product/imperializm-kak-vysshaya-stadiya-kapitalizma-165190710/?asb2=1jWtvcTMcNVjBT1BjyQ_tiDRL2_osi_LgF43eFZLRCPz4vw8ofOPlojVTrP-VJFG
Английский дом. Интимная история | Уорсли Люси,513 ₽,79 отзывов,"Завтра доставит Ozon, продавец Издательство СИНДБАД",https://www.ozon.ru/product/angliyskiy-dom-intimnaya-istoriya-uorsli-lyusi-208923802/?asb2=DaWBcvh1wxHovpejUog_qKc-nuvLE5vHnQsVXnBvBE_LBu5ki3N6TFxWeFUI6tSF
Критика чистого разума | Кант Иммануил,143 ₽,104 отзыва,"Завтра доставит Ozon, продавец Торговый Дом ""Эксмо""",https://www.ozon.ru/product/kritika-chistogo-razuma-kant-immanuil-249172513/?asb2=_OZ3vyVwm71z3Oh-QykuixS5qiQw2MN__U2PhRlCOuKGr5p5QCs-ycCzFG4vL3dh
Автобиография. Пройти сквозь стены | Абрамович Марина,772 ₽,97 отзывов,"Завтра доставит Ozon, продавец Издательство АСТ",https://www.ozon.ru/product/avtobiografiya-proyti-skvoz-steny-abramovich-marina-227779669/?asb2=PA4JTXbNlf5vPRirzYbskReGdEYxg_2yRrZyxVLqLQ-xf75cCWcROOYytH4qCtm-6NQsoSUFzgngFH9Og4hoow
Любовь. Стиль. Жизнь,635 ₽,115 отзывов,"Завтра доставит Ozon, продавец Издательство СИНДБАД",https://www.ozon.ru/product/lyubov-stil-zhizn-208923758/?asb2=iMwBGBQXr4DiETHVXGeFKW8Kc1-QtIAwvcGky4gZojmlkVKxUsge-_cwUT5LbzVQ
Любовь к ботанике,500 ₽,3 отзыва,"Завтра доставит Ozon, продавец Юпитер-Импэкс",https://www.ozon.ru/product/lyubov-k-botanike-413164158/?asb2=kagUqXUM3TDw4fOprt13wCHDJgWrYs7SB8Vv4K-ydliJ8UJDsC5NqxdEmiXSvcav
Хагакурэ. Бусидо | Цунэтомо Ямамото,143 ₽,103 отзыва,"Завтра доставит Ozon, продавец Торговый Дом ""Эксмо""",https://www.ozon.ru/product/hagakure-busido-tsunetomo-yamamoto-249173409/?asb2=Btq5H7RA9ixX4OfwQ6k_BFVENu9G0T4tFlcq4Ntl7xKB0vtxsyW3nnqYLlOam7Cb
Работа актера над собой в творческом процессе воплощения | Станиславский Константин,167 ₽,110 отзывов,"Завтра доставит Ozon, продавец Ozon",https://www.ozon.ru/product/rabota-aktera-nad-soboy-v-tvorcheskom-protsesse-voploshcheniya-dnevnik-uchenika-31104194/?asb2=uos2vhU6TqQq9eQLpn2WhWEplIRu4oEXyj9f2ol7dMbsk1wk0xGN8VyfBLy1yNlh
"Скандинавские мифы: от Тора и Локи до Толкина и ""Игры престолов""",859 ₽,124 отзыва,"Завтра доставит Ozon, продавец Торговый Дом ""Эксмо""",https://www.ozon.ru/product/skandinavskie-mify-ot-tora-i-loki-do-tolkina-i-igry-prestolov-250053126/?asb2=lojmZ8lQM48JJfNFlvmbuiCf20LKVYyQkXUMTi2sPlg3Lv6-uTDwubvxHOYrCCO0
Акварельные цветы от Ай Накамуры. 5 простых шагов,951 ₽,3 отзыва,"Завтра доставит Ozon, продавец Торговый Дом ""Эксмо""",https://www.ozon.ru/product/akvarelnye-tsvety-ot-ay-nakamury-5-prostyh-shagov-520650981/?asb2=1N_CTwd4l0qgV-c0jw6J-MfVJjB2BxfFqI0VkgqtzPKJeq3T8OybGBQiTatJn2oWlOBhtwzOw9XTTI20cGznbA
Основные понятия истории искусств | Вёльфлин Генрих,202 ₽,71 отзыв,"Завтра доставит Ozon, продавец Ozon",https://www.ozon.ru/product/osnovnye-ponyatiya-istorii-iskusstv-160623451/?asb2=1FhXyPI_RrSsMnKYIZP0cHfUWZS1PHHolURWp6RyUN0SEMC3CmwfSUJmv7t1CAwv
Тетрадь для нот: для младших классов ДМШ и ДШИ,82 ₽,65 отзывов,"9 мая доставит Ozon, продавец Феникс ТД",https://www.ozon.ru/product/tetrad-dlya-not-dlya-mladshih-klassov-dmsh-i-dshi-332477213/?asb2=3xAL--Twmt_n59wqOtd2WZGdfl7Ze5RAd9NuORoGgxaqfF_jeQBb4t_CmUHquQlI
Психология для сценаристов: Построение конфликта в сюжете (покет) | Индик Уильям,348 ₽,100 отзывов,За час курьером Ozon Express,https://www.ozon.ru/product/psihologiya-dlya-stsenaristov-postroenie-konflikta-v-syuzhete-poket-indik-uilyam-254375302/?asb2=lLIujQRzd40smeAjplUsX-2Szli8CLQqdGshQLRK3YuuMmcDMW_oU5b2m5qROfP3GHELDPUitiXRxzRn3O8YLA
Все животные равны | Оруэлл Джордж,140 ₽,16 отзывов,"Завтра доставит Ozon, продавец Торговый Дом ""Эксмо""",https://www.ozon.ru/product/vse-zhivotnye-ravny-oruell-dzhordzh-280388335/?asb2=ggoyVJMej4xi9o9zPEjCGufDRNDE0px7lBdZS0d--3tl-ggnRdGdrpk16dHkVPeC
"Египетские мифы. От пирамид и фараонов до Анубиса и ""Книги мертвых"" | Шоу Гэрри",809 ₽,13 отзывов,Продавец URSS,https://www.ozon.ru/product/egipetskie-mify-ot-piramid-i-faraonov-do-anubisa-i-knigi-mertvyh-shou-gerri-267723872/?asb2=Bhh0mxsUkT2ByVc1pVp5G3AiJH_XBdDj3snAsFlN5nOjENIrwj7NuJm3cx3ECJal
Психология искусства | Выготский Лев,202 ₽,79 отзывов,"Завтра доставит Ozon, продавец Ozon",https://www.ozon.ru/product/psihologiya-iskusstva-135331406/?asb2=ZwfSSgaivXZlSkcXBVojpues0Ni78nShKSriwTm3tpqmAgA8gUOtaYexR7ckKX9J
Беседы о русской культуре: Быт и традиции русского дворянства (XVIII — начало XIX века) | Лотман Юрий,618 ₽,139 отзывов,"Завтра доставит Ozon, продавец Ozon",https://www.ozon.ru/product/besedy-o-russkoy-kulture-byt-i-traditsii-russkogo-dvoryanstva-xviii-nachalo-xix-veka-142579659/?asb2=5qrzNPwQYZwt1IGybVc8Hf9x5HfalL1Dt0bgDiYHTXkLCqQ_BXqBYjYPJblKSCL1
Беседы о русской культуре: Быт и традиции русского дворянства (XVIII — начало XIX века) | Лотман Юрий,240 ₽,139 отзывов,"Завтра доставит Ozon, продавец Ozon",https://www.ozon.ru/product/besedy-o-russkoy-kulture-byt-i-traditsii-russkogo-dvoryanstva-xviii-nachalo-xix-veka-34386042/?asb2=dg-LuMVBLDkS8Gpepma8xw0axUXajijn49aiDS0C-pe35Qn0CaWTls1vypOb54Ne
Лекции об искусстве | Рёскин Джон,202 ₽,39 отзывов,"Завтра доставит Ozon, продавец Ozon",https://www.ozon.ru/product/lektsii-ob-iskusstve-34092072/?asb2=8VNLQy90nlfAsd_ORpIj6aTmRf_W6tzZR5vhiOVgALJvoJf6YBfQvGISNAYK8Xf4
