"Мака перуанская в таблетках Spirulinafood, 250 гр.",400 ₽,26 отзывов,"Завтра доставит Ozon, продавец Spirulinafood",https://www.ozon.ru/product/maka-peruanskaya-v-tabletkah-spirulinafood-250-gr-231088482/?asb=YQ%252BRNNnGsG5%252F1%252ByIbOzYXVJXYMONuKDaXwchJeF1e2g%253D&asb2=LrgVqdD8yRVOYgeMfj9l_MH8GEBHrWQwGaxuK91dZHqMIr3_4B4_1VwHHfMdn3pC
"Арт Лайф Коктейль ""Провитель После шести"", витаминный протеиновый коктейль для второй половины дня, 300 г Артлайф Art Life",888 ₽,57 отзывов,"8 мая доставит Ozon, продавец Арт Лайф Россия",https://www.ozon.ru/product/art-layf-kokteyl-provitel-posle-shesti-vitaminnyy-proteinovyy-kokteyl-dlya-vtoroy-poloviny-dnya-300-233552763/?asb=JgDMJPZliFgmwiiMkGZVbITOkxQcZ1SuMaO7vtcOb97qIEwCbugxv6SGfe2UnGxH&asb2=TaXYiv7JkU7wOgRexmGrscBvfyGinUbeq6x9MlFMF2ZmXjEJcL1V9W5QCVsfAb4LkyMbo6jwXi_ieKZULWuqkklHaTIizBF6RPTEJTIZdlKVUHSo5QOO7jBsRQYZmkrlflT72DCFuNpth-fNlVuUtQ
"Пища богов Коктейль соево-белковый со вкусом клубники, 300 г",566 ₽,181 отзыв,"Завтра доставит Ozon, продавец ВИТАПРОМ",https://www.ozon.ru/product/pishcha-bogov-kokteyl-soevo-belkovyy-so-vkusom-klubniki-300-g-172951399/?asb=YzwGGK64po2uEFVbkKf7iOGeb9n8dhmROeUXvAC%252BRgQ%253D&asb2=RRyKXzF-KrZgjKLYH9ZccQLpooJhvA1glWS87ym5rW9eBZWApHW39rWh144lrnjj
"Коктейль соево-белковый сухой ""Пища богов"" 200 гр АССОРТИ № 1 (вкусы ваниль, клубника, ананас, бабл гам - по 2 пакетика по 25г)",437 ₽,74 отзыва,"Завтра доставит Ozon, продавец ВИТАПРОМ",https://www.ozon.ru/product/kokteyl-soevo-belkovyy-suhoy-pishcha-bogov-200-gr-assorti-1-vkusy-vanil-klubnika-ananas-babl-gam-po-193275367/?asb=QKDfvwMBIYt6AL7Ifadq3Hok5gwPVE298QbeO%252BqpANE%253D&asb2=0NO56iEdjj9S4QgWqoRfrVM182G_BJMFkvB2bjCWciqTu60mFv5qtGjO2UGhTM3X
"Арт лайф Коктейль Провитель После шест, 300 г - Витаминный протеиновый коктейль для второй половины дня Арт лайф , Artlife",888 ₽,1 отзыв,"8 мая доставит Ozon, продавец ДокторБад - Здоровье и Долголетие",https://www.ozon.ru/product/art-layf-kokteyl-provitel-posle-shest-300-g-vitaminnyy-proteinovyy-kokteyl-dlya-vtoroy-poloviny-379167284/?asb=yMQx4KEHspy74G7YN4IFhyY9aFq291yQFSdNq6W99C8%253D&asb2=hmyGZ9S06YxE2WGniS0TPqqTIl58fMwJKvm12Rk-GqngYVSM3GodDCANdXGbQp9J
"Коктейль соево-белковый сухой ""Пища богов"" 200 гр КЛУБНИКА (коробочка 8 пакетиков)",437 ₽,79 отзывов,"Послезавтра доставит Ozon, продавец ВИТАПРОМ",https://www.ozon.ru/product/kokteyl-soevo-belkovyy-suhoy-pishcha-bogov-200-gr-klubnika-korobochka-8-paketikov-193275382/?asb=IqoZeYodcMCq0CO2e57M%252FpwCzGwfgKdLxP05FwGmtU8%253D&asb2=SR-u0Edq9HmaIKUJMJNwKL76Tffne1RT63waBZBUZ-o1miis8tDwiUa5AKy-SehA
"Коктейль соево-белковый сухой ""Пища богов"" 200 гр АНАНАС (коробочка 8 пакетиков)",437 ₽,5 отзывов,"Послезавтра доставит Ozon, продавец ВИТАПРОМ",https://www.ozon.ru/product/kokteyl-soevo-belkovyy-suhoy-pishcha-bogov-200-gr-ananas-korobochka-8-paketikov-193275369/?asb=v0V9DBZBPj1eQXQTo93bkLfz85%252BDL9JcIw8afqgiHbY%253D&asb2=vfgFhNmexApG5hFzesoqcEayk-NtXoqHeKrvqHQBPcuErQr_7CqsymFsZMthgNI8
"Арт лайф Коктейль Провитель Zаряд, 300 г - Витаминный протеиновый коктейль для первой половины дня Арт лайф , Artlife",888 ₽,1 отзыв,"8 мая доставит Ozon, продавец ДокторБад - Здоровье и Долголетие",https://www.ozon.ru/product/art-layf-kokteyl-provitel-zaryad-300-g-vitaminnyy-proteinovyy-kokteyl-dlya-pervoy-poloviny-dnya-art-379160952/?asb=grjRNxL64CU38%252FB7UsJWDjglrwUIBH04cX6%252FZ8d%252BkZ0%253D&asb2=V22Qyelc7dIQkoqcEvswoZm5SZbd5LwtlDjVog12JdsJ53dbF2FEOSbCOl-iFKJi
