Пульт для сплит системы DAEWOO,949 ₽,4 отзыва,"12 мая доставит Ozon, продавец QSystem",https://www.ozon.ru/product/pult-dlya-split-sistemy-daewoo-266162857/?asb=2DKFxzD2HYp%252Fq5bNV4yE8i13qYv75nQS8ny%252BqmqtRlg%253D&asb2=4eC8hbWMHe6rHw5OfqTvUFowBu8dZHCkmEiOv0m2CrGjOdEAcqgP8a1wPuUS2j6h
Пульт для сплит системы VESTEL,949 ₽,8 отзывов,"12 мая доставит Ozon, продавец QSystem",https://www.ozon.ru/product/pult-dlya-split-sistemy-vestel-280945702/?asb=1WT0gVtVYlfhKjN48vt4OFaDzygEVwalsy5MYTB3eiU%253D&asb2=kEdJ2Zj723f4wnHv8OI7CKfLcxroa6O3gcVkKTRtE9kEviIefTo_1VuwZn6i_JKZ
Пульт для сплит системы ROYAL CLIMA,949 ₽,4 отзыва,"12 мая доставит Ozon, продавец QSystem",https://www.ozon.ru/product/pult-dlya-split-sistemy-royal-clima-277647177/?asb=KIEc9qE29mu%252F0ZJ%252FGNQlJyMWs0sETOYwBoGPAhEhuPM%253D&asb2=n4mMvYTFgk2-xZKkFnrpiPonvCOjgiFgT_UA3GgAwlaNx9iiH3l4Uy6iTdWhPxJp
"Конденсатор двойной пусковой, рабочий для кондиционера СВВ65 40 +1,5 мкф на 450в",980 ₽,1 отзыв,"7 мая доставит Ozon, продавец Комларк",https://www.ozon.ru/product/kondensator-dvoynoy-puskovoy-rabochiy-dlya-konditsionera-svv65-40-1-5-mkf-na-450v-295843154/?asb=ZhUPhn6lFTUZ3P728Ph5W5tNEdZfkWV4Br5iWmf7Yqg%253D&asb2=W3cRAgPGsZ8tdnm3l7QBBrlDetBHGEC1XLe59TXXKKionGw1_EmvPPZ4_K67pqvL
Пульт для сплит системы TOSOT,949 ₽,3 отзыва,"12 мая доставит Ozon, продавец QSystem",https://www.ozon.ru/product/pult-dlya-split-sistemy-tosot-279294664/?asb=TPnIYywpjnAL03qHni5ByyxLrmLHZeah1InnbhE9rfE%253D&asb2=msH9GhJmjs68Q3_lIFacPcsoYTz_78wiMM4Qp6jAsOLqGGWyDO0Bx0WDFPCp2G0E
Пульт для сплит системы BALLU,949 ₽,8 отзывов,"12 мая доставит Ozon, продавец QSystem",https://www.ozon.ru/product/pult-dlya-split-sistemy-ballu-178604297/?asb=yjx8Ph9oYGa9%252BF94Jq2g3hJqtxCcWoGssY%252FqM3X%252F8I0%253D&asb2=UfNqzxQfzI_viaWMfCEATIOkY5W_k-wzBxiphyGMoe-YhSCKMUg7jYwssPCcZ7yG
Пульт для сплит системы ROVEX,949 ₽,1 отзыв,"12 мая доставит Ozon, продавец QSystem",https://www.ozon.ru/product/pult-dlya-split-sistemy-rovex-279289751/?asb=8zVAlTnpdGmIWGoTNMYAUfHcsIZOefrFeCDIE05piH8%253D&asb2=DsEwBn1xXz0iANbxOw87fUqtcQDribii63UtuM6kx7LBuZpCIhfV93rciO3jnO-g
"Пульт универсальный Huayu Q-1000, 1000 в 1 для кондиционеров Akira, Boshi, Haier, Samsung и многих других + батарейки",597 ₽,1 отзыв,"8 мая доставит Ozon, продавец E-RED",https://www.ozon.ru/product/pult-universalnyy-huayu-q-1000-1000-v-1-dlya-konditsionerov-akira-boshi-haier-samsung-i-mnogih-295422375/?asb=ezgQiQq7PQov%252Bk%252Blmi00E9CYWqhzuQAN5HM8DOpJXBg%253D&asb2=ukw49OAgIRH8JAPjgPqq53GC3SFAlcATMWAeOymdQlAxywvHXqUvqIxaPFi67maY
"Труба медная мягкая 6,35 мм (1/4 дюйма), 1 метр, трубка медь для отопления, монтажа кондиционера, водопровода, холодильника, водоснабжения, топливные системы, змеевик, газопровод, охладитель (чиллер) для сусла",715 ₽,5 отзывов,"10 мая доставит Ozon, продавец Запчасти и аксессуары",https://www.ozon.ru/product/truba-mednaya-myagkaya-6-35-mm-1-4-dyuyma-1-metr-trubka-med-dlya-otopleniya-montazha-490158209/?asb=gHuSSv%252Fgc2xNrIZcL0wmQPWaNK4A2PKoODOqw7F3%252B%252BphaRUPPKPpEwa0k%252BZ2WzAs&asb2=ZhDxVVn3CyuClLd4A0aX7v8ohYSLSBwFQS5pzhpndmH02M2953gGuNi1lHYc0krMsFYKA8_qsG9MiEkS51Os0CDdZw3GYRoQlZ0IydyFS7Xpld7hieBhytQ4lEqT0zvSRLfCjFLBa5YjmGKIpy1OUg
Пульт для сплит системы HANSA,949 ₽,1 отзыв,"12 мая доставит Ozon, продавец QSystem",https://www.ozon.ru/product/pult-dlya-split-sistemy-hansa-266164052/?asb=XHCSsCQzglmtPr1HrXAESZOB73xv51rstuBwMRi%252BQnc%253D&asb2=_9LH_db4fpXcjI6zecfr2txcS-V5W6XSC01v3yELCvJNOOmVIl-2PuZLUJiheXaX
Пульт для сплит системы NEOCLIMA,949 ₽,2 отзыва,"12 мая доставит Ozon, продавец QSystem",https://www.ozon.ru/product/pult-dlya-split-sistemy-neoclima-279275342/?asb=cSFfRgRZ0tDKpMl9vQ1tRL3PjNl06k%252BUVB6cb5baRVI%253D&asb2=7wwyzKcxc52neeh3ayt5ono0Wrbe6Ghgsyo8HyMp5x0pNmfJOCzzp25CBfsGRqeS
Пульт для сплит системы CELCIA,949 ₽,2 отзыва,"12 мая доставит Ozon, продавец QSystem",https://www.ozon.ru/product/pult-dlya-split-sistemy-celcia-282892620/?asb=gDSZ%252BoLwU75eYOHdin1P%252FzGyGmPlrfkorxtJOFsvN8E%253D&asb2=pvT3sBhoGpJlMT7pZ9f7n9U2wNsts6Cn0M_7Z8vEFc27gPQhk-nDEX085OajGW4p
Пульт для сплит системы ROVEX,949 ₽,3 отзыва,"12 мая доставит Ozon, продавец QSystem",https://www.ozon.ru/product/pult-dlya-split-sistemy-rovex-277648215/?asb=XlIJCDDAMT2e04QFHDOwULt%252FNJMZsjkc70jHe4FQNoU%253D&asb2=cTZ_XRnB8yCTqdsHT1_qadnzebckJAjbkap77qRe1ijH1LWMQwFzws57jL-SG6lm
"Шланг дренажный для кондиционера 5метров, дренаж для кондиционера 16мм",999 ₽,1 отзыв,"9 мая доставит Ozon, продавец Im",https://www.ozon.ru/product/shlang-drenazhnyy-dlya-konditsionera-5metrov-drenazh-dlya-konditsionera-16mm-303141911/?asb=xMI629WbJAzYvXNzMLwdyJoYBXUh6LjZxs0grYdfebE%253D&asb2=ZFoA0BlqLgy-uuCywVz6hTon36vgjIJ_UYv-wGjP2YSTc7AVpYRS6co48Yjf6OEr
Обогреватель дренажа HD50 (50 см),690 ₽,2 отзыва,"8 мая доставит Ozon, продавец SNABLIGA.RU",https://www.ozon.ru/product/obogrevatel-drenazha-hd50-50-sm-231107034/?asb=Inv3baeuGbnd3hdtKZvS9rWvaQITbJHtAEKUpM78%252B14JeWZtb7%252BiVxWdcbMEOOK6&asb2=hVrmcq8WO4qgUjMUe6RGK9o_CTQhtEWR4tgb0Aa9NSy14vQyRM6923LqlH11RNA8makw1KpazKYL7BE-ENmI0E3gcYJMCQ__55YbS1NosjjXYRtyvnkg95VWctObbL0qxYDGGiC22OdOop2LsJoTzA
Универсальный пульт KT-E08 для кондиционера,580 ₽,2 отзыва,"9 мая доставит Ozon, продавец Pantogroff",https://www.ozon.ru/product/universalnyy-pult-kt-e08-dlya-konditsionera-256640993/?asb=FucOviSWJJI8SywscThA%252ByKCZiyfdo633Hf1Lda%252FH0IeUVpOrJM7RQ5Dl1DJO0o0&asb2=iPOJzl8LyTjHlo-RSOen-OiodsIFWiZLd0ct7_TePF5mNvizL7QzR0PjcCM3xVBV1w5RGevg3H4gs3dY8-7mf0rILCTDHHXyP5prfVrreYzAivJjmR3Ek7XjTjrAnAAAOgvZuDEfwhWf4S9J2l_UvA
Пульт для сплит системы NIAGARA,949 ₽,2 отзыва,"12 мая доставит Ozon, продавец QSystem",https://www.ozon.ru/product/pult-dlya-split-sistemy-niagara-279000486/?asb=UiisXOXh27thGOYeWrBySEuB73C4DX%252FOCHjYvrgubXc%253D&asb2=jpVh1EDmHzXjzWGr642Bj3WAWP4RrCMQO0SWfDyMI6SPkVMs544LOE6yqcjYt22D
"Заглушка медная для кондиционирования 1/2"" (2 шт)",270 ₽,1 отзыв,"9 мая доставит Ozon, продавец РаСходка",https://www.ozon.ru/product/zaglushka-mednaya-dlya-konditsionirovaniya-1-2-2-sht-485753775/?asb=EHpwQFCQrWYXTqiE5oeVAVEqMwwLJT3wPMA%252Forc1zSg%253D&asb2=urRPIAUXt_NP8bxQDKNKvPSzQ06rqkt4qP8b8RNyIJYh9_naGndCw1gj7VY96fav
Универсальный пульт Huayu K-DK680 для кондиционеров Daikin,600 ₽,7 отзывов,"8 мая доставит Ozon, продавец ИП Котова М.В.",https://www.ozon.ru/product/universalnyy-pult-huayu-k-dk680-dlya-konditsionerov-daikin-247720168/?asb=fIcACsx%252BQ55rKimliLeg1VO3b9FkWPMvcW0orzLPabsaoNe7jMagkOOgkON%252BAD%252Bx&asb2=fL9P7SAlE-H3nUNnzGtdM0JzwNsQBOYPqYocBWGalB8KEYVNDf8NAY3-T1ZiWnzDnZSQ9CFc90V_7GXuZFlE6DaiP7KCRMQD8N4x6NB_iT7QDCq3jEzttJy1qcSSS3WHLbP75V6ynU9xvBGEZt6Y8g
"Соединители шланга для дренажа кондиционеров и сплит систем, 15 мм (3/5 дюйма), 2 штуки",999 ₽,1 отзыв,"12 мая доставит Ozon, продавец Андромеда",https://www.ozon.ru/product/soediniteli-shlanga-dlya-drenazha-konditsionerov-i-split-sistem-15-mm-3-5-dyuyma-2-shtuki-309823153/?asb=E5%252BRr4fTXj71eZijRWGJDEMfjy0%252BwSCV24ejZbrRlC2kVgNZ8yjAGdV9EpjpvZdT&asb2=64yXLpUb5nQnP-9veiK12tOImXnJiQDEHySwWc8ObNsfs3iL865dtOSTRi0CgKE47mTHXisVca7Y6nlr7wjEDuMO9UZHnrfwRg5jNBW6ihJSJCCP8hOac6gkthDc6tFEAb0G2xd-wjj7SuAf7hCedw
Чехол для кондиционера шириной 82-84см/чехол на кондиционер/чехол для сплит систем,441 ₽,1 отзыв,"13 мая доставит Ozon, продавец SaveHome",https://www.ozon.ru/product/chehol-dlya-konditsionera-shirinoy-82-84sm-chehol-na-konditsioner-chehol-dlya-split-sistem-506115314/?asb=LjxIUI1kHI%252FVusr0wSEscsiCT2hf2O3CWzGApsEbBJiNqbPsdprjf%252BP0YMP1KpZG&asb2=uVi0XPpNMBMtqBmCJvBk8LyqkHieHxT_7Ohqfl7eIKgBKng-FQsLlDqIcSy---tQR4EkRov9jllH5szDRZrs2VRw4aQefYQcH88-AKY2n47H3kbqtISxq2PxJc14ODN2VTBJbZwASwDUZPn5Lg5FHA
Пульт для сплит системы StarWind,949 ₽,5 отзывов,"12 мая доставит Ozon, продавец QSystem",https://www.ozon.ru/product/pult-dlya-split-sistemy-starwind-277643503/?asb=UkF2WkFdNDyF5BalMFlTa1WVBntJ8VCJqjXf%252BqCQZh0%253D&asb2=ETk42vqLbOEFgTGVHA9aEqSM6pJGLX9ZrzQ8IArc8wDVvS1CONTYw0IZZ1VO7cqF
Пульт для сплит системы BALLU,949 ₽,6 отзывов,"12 мая доставит Ozon, продавец QSystem",https://www.ozon.ru/product/pult-dlya-split-sistemy-ballu-178604298/?asb=i65YCTaeP73qnWo7WQISIyLQcJTfF5O%252BylnzWef5G14%253D&asb2=JrxoEDsRn6Lwlc_DduIR-qm1N4N2iaTHgFgrWg0CpK4qbyNf1zrpkwmR7mlxwIzs
Пульт для сплит системы KOMATSU,949 ₽,3 отзыва,"12 мая доставит Ozon, продавец QSystem",https://www.ozon.ru/product/pult-dlya-split-sistemy-komatsu-282758871/?asb=6Lm3Yt69zOn%252FM6%252B%252Fv66k0osd4h2juX0IcT4%252FI0JGkOQ%253D&asb2=5TRzS5MptHGF5IwOM2N98VscRsK28NJ-WUm92I0sV8CAe8Z2FQ4RvMtmdfs9Yry1
Пульт для сплит системы QUATTROCLIMA,949 ₽,3 отзыва,"12 мая доставит Ozon, продавец QSystem",https://www.ozon.ru/product/pult-dlya-split-sistemy-quattroclima-271203731/?asb=wpwUAySwK904sfBJz3VJiYaKL08XEzDRUO9OxPSqM6o%253D&asb2=8CzRDnc0s6lCUdegCtBMmzihy1kKElAEDM_IXhCLDXGQOlzEP3cZf3ATawuLiDiU
Пульт для сплит системы AUX,949 ₽,1 отзыв,"12 мая доставит Ozon, продавец QSystem",https://www.ozon.ru/product/pult-dlya-split-sistemy-aux-277649996/?asb=gmBqBCmIwzOGj8Sd%252BpBjuvgW108YURpEg02GlCht%252Bcc%253D&asb2=XcqTqOYwIhnSYohKFEIV8iTlysIeRFuoEkN_w56aWTY_Fawbcwr5uEY9gVTAgM7m
Чехол для кондиционера шириной 76-78см/чехол на кондиционер/чехол для сплит систем,441 ₽,2 отзыва,"13 мая доставит Ozon, продавец SaveHome",https://www.ozon.ru/product/chehol-dlya-konditsionera-shirinoy-76-78sm-chehol-na-konditsioner-chehol-dlya-split-sistem-506078542/?asb=uYeiQw82lHAVUWtZEk6mm8q%252BJrDS5DIYKGP2e8rfROtP7GNOjIvZhchrTBYV%252FO%252FR&asb2=QUEquZ3KoC_gXMMTjC-1QeYrCJE0_RlO12CJLwraLVuYZNcdtbmpSHey_Uxc4_J_EKtapQaKavIy0u27HgKGDqGvKqzy9UL8bpwXk29gYCqzzZ_d0gN1kyV_UWnjyGXqM1cyCNbpI-_akpUas9mNiw
Пульт для сплит системы JAX,949 ₽,2 отзыва,"12 мая доставит Ozon, продавец QSystem",https://www.ozon.ru/product/pult-dlya-split-sistemy-jax-279271918/?asb=TLmiRYbaIfJsuAuR32V3Uhswe1A8iwSCOu%252BhPccRibI%253D&asb2=XUAsUBvvMeqCVY0R_UxyKKTcD4tUYaUxVKCjUbWZMF1DiBegpaHC99PjeItPrh7Y
Пульт для сплит системы WHIRLPOOL,949 ₽,2 отзыва,"12 мая доставит Ozon, продавец QSystem",https://www.ozon.ru/product/pult-dlya-split-sistemy-whirlpool-271205217/?asb=P79AtTKhaq6JFkW3c2aZ%252Bgi5XpZkm15saxX7a5nE4z8%253D&asb2=kZVg91FwidcnfE6_HD4FHsYuRl0bcXyvbAOIwaibR_NQl8dl1Au7L4F5R8GyYrFs
Пульт для сплит системы MITSUBISHI,949 ₽,3 отзыва,"12 мая доставит Ozon, продавец QSystem",https://www.ozon.ru/product/pult-dlya-split-sistemy-mitsubishi-178604293/?asb=qoAXt5sE2AGQx%252FyRKL93CCLuEYthVdBaC17jW%252B6%252F8Qs%253D&asb2=oam_c0HYDg1FOjPQv9O-dbNArWJC-stWcghiV4XnnEsJIIeF9EYWZj7p1OQLdoUT
Чехол для кондиционера шириной 76-78см/чехол на кондиционер/чехол для сплит систем,405 ₽,1 отзыв,"13 мая доставит Ozon, продавец SaveHome",https://www.ozon.ru/product/chehol-dlya-konditsionera-shirinoy-76-78sm-chehol-na-konditsioner-chehol-dlya-split-sistem-506106668/?asb=9Evq%252FpfAVqJ8snZe8dzhnA8A9BsapB7An9Lx2hsopbE4c2Aw4mT3VIvIzw8LrNnt&asb2=QvyBuNAKQyqVgGZkBzN-MHerfOu246FpcdLRmky-DufWcy5IQIwFhigdWGE5k11zC7O5GAaqwYgI7kOR9p9xUgthS4NWTg-0RABSG3sAT-HJBSQjtctYxvTxJnQYg0sDZqZ6QBuyIQ3zFadMaHAssw
Пульт для кондиционера Sharp Huayu K-SH1336,615 ₽,1 отзыв,"10 мая доставит Ozon, продавец ЭЛЕКТРОНИКА SMART",https://www.ozon.ru/product/pult-dlya-konditsionera-sharp-huayu-k-sh1336-320583804/?asb=SJF5tl7RpGvAFqstXHkMik9LRYjaWBMONowL0zNJigg%253D&asb2=OcX6w1SgF8m8SFtwX7SfKS1oTUgJBvEMhIHfPjiiu2sgwPhid4dQsKe8t0egEbEX
Пульт для сплит системы GENERAL CLIMATE,949 ₽,7 отзывов,"12 мая доставит Ozon, продавец QSystem",https://www.ozon.ru/product/pult-dlya-split-sistemy-general-climate-271106143/?asb=M9ni1ZyF30tWNlM8vLq%252FIabUiicok2UEU2ZQqmC%252FC6E%253D&asb2=Ya8tCQCsmJ8oHXnaY1_0obezMHhQWYmGuY02-5j_zqMRFxRQNMwkKcUFO3q7lh9u
Пульт для сплит системы CENTEK,949 ₽,1 отзыв,"12 мая доставит Ozon, продавец QSystem",https://www.ozon.ru/product/pult-dlya-split-sistemy-centek-271097522/?asb=xA9MCBDCsXjQHENm%252BCArDcl4RL17rSc6mTUg3hXoOlA%253D&asb2=4nApXBi3L6RAFGPKwyKyL1a72dOByzB7shFVdw-ffJe1NoZ5DFagtLWjjLGYr96G
"Антивибрационные подставки (проставки) под крепления кондиционера, 4 шт.",684 ₽,3 отзыва,"8 мая доставит Ozon, продавец Хоз Маркет. Товары для дома",https://www.ozon.ru/product/antivibratsionnye-podstavki-prostavki-pod-krepleniya-konditsionera-4-sht-300552941/?asb=SLbsPvQ0U22e9FkqiCaEqNcxg5fJQ4uyzAICdN7s%252FpX6EBRhQk243doYVUuZqmhD&asb2=uKk6wmUucFUpVLRAbh9dqwc34XljuF3M9LDRaMh4jDoeISo5iPd4fx3ctjzpo__BggzwyDYhMeS_tjWedYT_id6L9l3kYFrDfJxbqEI694lh70EYpNbTY4KPukggiR_wj7afb5g8dADLiP2_23-kuQ
Пульт для сплит системы ZANUSSI,949 ₽,2 отзыва,"12 мая доставит Ozon, продавец QSystem",https://www.ozon.ru/product/pult-dlya-split-sistemy-zanussi-266168613/?asb=UzPNrL%252FryHniZK%252FX7feT2S2MaX91dKNFfCOrLhG7OSQ%253D&asb2=7x-mu9CMRWNLuzRZ_mwHR2D3gcO2YDQi-jkSILEgMmGEO3ezdpE8zQDY5NE-ko5j
"Монтажное устройство (кронштейн) 400х450мм (1,5мм)",931 ₽,1 отзыв,"11 мая доставит Ozon, продавец Tehno-Discont",https://www.ozon.ru/product/montazhnoe-ustroystvo-kronshteyn-400h450mm-1-5mm-384701373/?asb=DJFjIvHPNgZENOyuTzOpKZ1ItYTulhd5ZCJ%252B8lUtgEs%253D&asb2=6GHWaS1PRct-pvdCKHQQOGL9A8ejE3J3Ql4qZzmJSyUP_Sem-YsFkYD-RGnDP7S4
Пульт для кондиционеров универсальный КТ-1000,660 ₽,1 отзыв,"9 мая доставит Ozon, продавец Sportano",https://www.ozon.ru/product/pult-dlya-konditsionerov-universalnyy-kt-1000-267880791/?asb=nfHZRWS0cLN5V5Ulb2wrsvl7nPNpsTw86Z2yeT3o74I%253D&asb2=VpONBGzDL0vKMqSkojButrAz_nfMYTlLihV-iRDW8RRKk9jX19bB63bLj95wjL35
Пульт для сплит системы TOILER,949 ₽,1 отзыв,"12 мая доставит Ozon, продавец QSystem",https://www.ozon.ru/product/pult-dlya-split-sistemy-toiler-279294048/?asb=JbsUOz%252B25jeWMXnwoeC13BlPCIId1NCSKebhXYDOyKU%253D&asb2=pw5B3Y4iyPGTPzeH0LM1S7NrDXFmQDAkNuLVTmdoywGz-X_-jh7uOh43yj6bwbyX
"Медная труба М2 мягкая диаметр 5 мм стенка 1мм в бухте 1 метр, трубка медь для отопления, кондиционера, водопровода, холодильника, водоснабжения, топливные системы, змеевик, газопровод, Охладитель (чиллер) для сусла",799 ₽,1 отзыв,"9 мая доставит Ozon, продавец СТАН Нихром Фехраль Нержа",https://www.ozon.ru/product/mednaya-truba-m2-myagkaya-diametr-5-mm-stenka-1mm-v-buhte-1-metr-trubka-med-dlya-otopleniya-270591327/?asb=8Mi37lpa67PvVxr%252F2ZiKR%252FSSW0wwiarRaoretL86nj8%253D&asb2=yb_FuiRgnW_wWfNASGWmN0NgWUbsuobxGgkD3IYOmtDCeCuYrBFEIfRLCnmC1oi0
Пульт для сплит системы DeLonghi,949 ₽,1 отзыв,"12 мая доставит Ozon, продавец QSystem",https://www.ozon.ru/product/pult-dlya-split-sistemy-delonghi-283009903/?asb=0V49FUfTNCo4F%252Fxon89n0aIfXmKlmupcAFEwdTRkybk%253D&asb2=lj3TvLHD5lTzrSVPcKPcRoG3ZzM8i5__3izDFBkEaHF977kZ8KYRtgIjtr39edAK
Универсальный пульт KT-E08 для кондиционера,630 ₽,3 отзыва,"9 мая доставит Ozon, продавец Mobicent - аксессуары для мобильных телефонов",https://www.ozon.ru/product/universalnyy-pult-kt-e08-dlya-konditsionera-257063379/?asb=qKulTUEcU2%252BcJsIPKPjkFKZtATkZKec0cMh9Rq%252Fk0c0%253D&asb2=C0QxE2KRGgftPVHzU1pSf22AEW7kzTUtPWn50KabryHcyrYHdxXSbq_H0W3UHme3
"Медная труба 1/4"" (6,35х0,6мм) в бухте 2 метра. По ГОСТ 617-2006, мягкая, трубка медь для отопления, кондиционера, водопровода, холодильника, водоснабжения, топливные системы, магистраль, змеевик, газопровод, Охладитель (чиллер) для сусла",932 ₽,1 отзыв,"9 мая доставит Ozon, продавец Нихром Фехраль Нержавейка",https://www.ozon.ru/product/mednaya-truba-1-4-6-35h0-6mm-v-buhte-2-metra-po-gost-617-2006-myagkaya-trubka-med-dlya-327073977/?asb=d3p1UDbOAasHrtccVuNe562N%252Bf8kvXS74aIZEJlE2XE%253D&asb2=YW6OTpVPAT6n2o-SWeUoZMOM6sZpx8P_5d_KAxd5FxzSvu6QJm-7DngFczAfTkvC
Пульт для сплит системы MYSTERY,949 ₽,3 отзыва,"12 мая доставит Ozon, продавец QSystem",https://www.ozon.ru/product/pult-dlya-split-sistemy-mystery-178604292/?asb=xP02pcx%252BYIWU2NKPHo3pIrteg1P%252FgqWl9gbLujUzbig%253D&asb2=3kchIMxji3tzF0JatiuvCeL5Ufytih3rBqH11fOGQYtqPkmk4VutR64_ad_8GGmR
Пульт для кондиционера (сплит-системы) Samsung DB93-14643 / DB93-15169 / DB93-15882,1 000 ₽,1 отзыв,"11 мая доставит Ozon, продавец GSM Маркет 23",https://www.ozon.ru/product/pult-dlya-konditsionera-split-sistemy-samsung-db93-14643-db93-15169-db93-15882-553064152/?asb=n%252B9g4AMNSL2MBebPwmSPd1CmRBmzm4KqF3Ud%252Be04PdM%253D&asb2=6jOkgMePisMiw6zJvkGMLoodh3loqjS-6lr1_N6PUBvD_Nov5dZ2JViERcAkQkU4
Пульт для сплит системы HITACHI,949 ₽,5 отзывов,"12 мая доставит Ozon, продавец QSystem",https://www.ozon.ru/product/pult-dlya-split-sistemy-hitachi-178604295/?asb=nkLkNvxhKtrlYeTRB3Qo0hA3GiHnQjajezKilPaBjxU%253D&asb2=AyZRg4yvy37PB0kdmwTa719W_810AOva1e820skpWvelPYsV-nPlHUqNp8h6aN3j
Пульт для сплит системы DAHATSU,949 ₽,2 отзыва,"12 мая доставит Ozon, продавец QSystem",https://www.ozon.ru/product/pult-dlya-split-sistemy-dahatsu-271098267/?asb=X4EbIdfTZnX4hlfhX4te4RaQRqXumtZxUFJ4DGuE03E%253D&asb2=7M0vAE0AlfzfA_TmHoIWqlqlb5Q6ApLaoHaTy2MMuLvhlBb-3GuelvQitlARUxGz
Пульт для сплит системы BEKO,949 ₽,2 отзыва,"12 мая доставит Ozon, продавец QSystem",https://www.ozon.ru/product/pult-dlya-split-sistemy-beko-266162139/?asb=eYQuhuFR0wZI8z90ZcgX40JFA8bI%252BYb%252BLNbT64jruCM%253D&asb2=T3ZBaiEFsOjYHfm9uZIf7y_8tg_xZ3FpwmpTCuoLJ8KJqiA9QeZFPkxlzFkFbm21
Пульт для сплит системы BEKO,949 ₽,2 отзыва,"12 мая доставит Ozon, продавец QSystem",https://www.ozon.ru/product/pult-dlya-split-sistemy-beko-266161938/?asb=8y%252BOipQAYF7AWpM%252BO1wV%252BwAqezC7UcN4wKPl26YuQX8%253D&asb2=Ab2o4YEQ4rX2SHDqMr0muB02-BPec0jda39GmuSPVVVvy4bBZmuYY6s84R03Uvdo
Пульт универсальный Huayu К-TB650 для кондиционеров Toshiba,848 ₽,1 отзыв,"7 мая доставит Ozon, продавец Element",https://www.ozon.ru/product/pult-universalnyy-huayu-k-tb650-dlya-konditsionerov-toshiba-287326521/?asb=iF96ikqTLtnvDuGnFsRpOCylmg4guL6cuZo11LsbHFs%253D&asb2=TyfNKoYHPupbHglJML7PnCcRO_PLT6Sjuuc_h_imE_zh4iLbpZzDsGK_7sN7-Y8B
"0,5 мкф 630В(35х09х25) 5% гибкие выводы CBB-61",414 ₽,1 отзыв,"7 мая доставит Ozon, продавец Комларк",https://www.ozon.ru/product/0-5-mkf-630v-35h09h25-5-gibkie-vyvody-cbb-61-308041905/?asb=n%252Btxrzke%252B2%252FiZPZorxpxnfLUmheBfxnaCNHUHZIWptM%253D&asb2=s8mUhJcz3rmAiBwDx-ljRIIlzMZBWqic0RqAQ4taOsriLDOe1n9njWpJ7yj5Fboq
Пульт для сплит системы ZERTEN,949 ₽,1 отзыв,"12 мая доставит Ozon, продавец QSystem",https://www.ozon.ru/product/pult-dlya-split-sistemy-zerten-283007939/?asb=dX2A7dp0u4ENgzHV1URD2Y8QpOS7tLYZEF2rlSGslZA%253D&asb2=cL-mFuWSmWjN6pW65hAR0YxVJSQQdEo4vzinVsr25ogwcYxi46zJoXQirCpj3qU0
Пульт для сплит системы DAHATSU,949 ₽,2 отзыва,"12 мая доставит Ozon, продавец QSystem",https://www.ozon.ru/product/pult-dlya-split-sistemy-dahatsu-271098885/?asb=XyEXNtMYBvh5m2xsajpDy5aFkQVwQ%252B69GmN%252Fc2rJHAs%253D&asb2=WZzclbiNuYKDPeTsegjAgHsW7z-3klzpFm_lLgHuJGOUbZ1vn4q-D0grxuPFEar-
Пульт для сплит системы SAMSUNG ARH-1362/ARH-1331/ARH-1334/ARH-1366/ARH-1351/ARC-1351/ARC-1358/ARH-1388/KIE20090406/ESC-RC-141,949 ₽,2 отзыва,"12 мая доставит Ozon, продавец QSystem",https://www.ozon.ru/product/pult-dlya-split-sistemy-samsung-arh-1362-arh-1331-arh-1334-arh-1366-arh-1351-arc-1351-arc-1358-178160764/?asb=enlQTiLOICwPhbzeIpMPwYcMI4Zi6wQ50fA1L3AmoT4%253D&asb2=OPwKet9IV83QDaqKUmS-xLV_6rRA8I1oBNzPUtPoEDcZWt1FjF-R_08fwZiC_xoP
Пульт для сплит системы HAIER,949 ₽,4 отзыва,"12 мая доставит Ozon, продавец QSystem",https://www.ozon.ru/product/pult-dlya-split-sistemy-haier-279270528/?asb=gft2gkc7zeJ%252BfGlxW%252BD1eP%252BkNPXxsAg0kQ%252BiaeDfLC4%253D&asb2=qG20SIrT0HCa0ba5bsBVERt3MOnqIrhMwKjiTgaCJ9-f5DCcrS15USLDEndqiLs-
Пульт для сплит системы HAIER,949 ₽,3 отзыва,"12 мая доставит Ozon, продавец QSystem",https://www.ozon.ru/product/pult-dlya-split-sistemy-haier-279270763/?asb=kYUQIUQ2R50emohJuzu2r0pVQe70tIXIItbN9nSe%252F2Q%253D&asb2=C_xMr76db0iFFHDRPGhcI1x-WKYWfsXiJn8CAMeIuNbr8dYEBWcmdB24g4glZ4C2
Пульт для сплит системы DAX,949 ₽,3 отзыва,"12 мая доставит Ozon, продавец QSystem",https://www.ozon.ru/product/pult-dlya-split-sistemy-dax-279301738/?asb=3jYB2B0QkV3Nwa19Bi478Wku9leeThwx4hYCtue3BVk%253D&asb2=9ULyVxns42G-Suz6Sv848eJdlO5U2QgTGXBD5E1K7aqv16GUQ_SnRb7eCUk1u7pz
Пульт для сплит системы AERONIK,949 ₽,2 отзыва,"12 мая доставит Ozon, продавец QSystem",https://www.ozon.ru/product/pult-dlya-split-sistemy-aeronik-266160551/?asb=QFRh9r%252Fs8bm2JnYkCYbNRz5%252BBBVoyWkAHPf9eZx%252FUDI%253D&asb2=m7x-YNGycNYYoHmacMtyvqveWYLCLxmeLO9z01EPJYWpmeGSaV-dG0FR7GdygjJv
"3,5 мкф 450В(25x57) 5% с клеммами CBB-60H",430 ₽,1 отзыв,"7 мая доставит Ozon, продавец Комларк",https://www.ozon.ru/product/3-5-mkf-450v-25x57-5-s-klemmami-cbb-60h-308040439/?asb=pbEaXD%252Faj2oybDAViXbC5z3zGUBVqu534vu5KRbJTaM%253D&asb2=JslJldUIVC3fDYJZeP7UgK6LxSHKlcxLND7n8DcAmRncEq6zU07sLS-TRZIYC-np
Пульт для сплит системы RIX,949 ₽,4 отзыва,"12 мая доставит Ozon, продавец QSystem",https://www.ozon.ru/product/pult-dlya-split-sistemy-rix-277648093/?asb=hvNY1Kcm4dk66D6EmJcH4Mu4ChrAxkKn%252FIm85qTRUmE%253D&asb2=ZAE5vha_lNKVH7_7xX8yzatSQdwd2-CCtKLvPX5IrMqNEg7BQyYap_Larsugum4U
Пульт для сплит системы MIDEA RG52A2/KIC-72H,949 ₽,2 отзыва,"12 мая доставит Ozon, продавец QSystem",https://www.ozon.ru/product/pult-dlya-split-sistemy-midea-rg52a2-kic-72h-275529282/?asb=DNIH5zQHIMu2vCQHwxevTmNO%252B6QkvKTVBssQYQj4WGU%253D&asb2=kOVF0H16ZingvWBnqotUamZsbFgKXoREuEsfRumPvFxfhMqNt2zJxE3MrZGtpIGM
Чехол для кондиционера шириной 92-94см/чехол на кондиционер/чехол для сплит систем,441 ₽,1 отзыв,"13 мая доставит Ozon, продавец SaveHome",https://www.ozon.ru/product/chehol-dlya-konditsionera-shirinoy-92-94sm-chehol-na-konditsioner-chehol-dlya-split-sistem-506156192/?asb=t7jC%252FRPRyxWOpiLhtOzj2HEgM8xLTFiMtTbYn60wrvgxRnQUw4pC1whxQxssJKyq&asb2=oPLnIrv0bFfgIDJzv-XBWqnNqFM8HUWN0FRJjjV0pAHI6XQDm8Ce1wF3in--VRCpXLD-KRq78fkrF7eqCeQvSX9ktLO2rvNf1R0v7PTPuH0cGxnnMavvizx0JGUR4-IN2OpyHd0R3mVWCtnwu1jXrQ
Пульт для сплит системы SHIVAKI,949 ₽,1 отзыв,"12 мая доставит Ozon, продавец QSystem",https://www.ozon.ru/product/pult-dlya-split-sistemy-shivaki-278815021/?asb=hTMM1DOO%252BY%252BNFHEA7oT3PS3YN0aUrPu6%252By591XkO3yY%253D&asb2=s6AmBeB4l6Z1xQONYUvNihEgmFpFApKCcpaGSbPfXkkFF9-OJ6EPvxWAu1NVxF2I
