Пульт для сплит системы CENTEK,949 ₽,1 отзыв,"12 мая доставит Ozon, продавец QSystem",https://www.ozon.ru/product/pult-dlya-split-sistemy-centek-271097898/?asb=DlCk5mh%252BpfkettSg9kpkvyt6D94VLsWfEBcTRiLpS6M%253D&asb2=It60cK6U1pyx49n6iTAl0alzMtuEhIQpFJKJUriL1qDOu0YRo1fXBnHEGqhFoe2S
Пульт для сплит системы AUX,949 ₽,1 отзыв,"12 мая доставит Ozon, продавец QSystem",https://www.ozon.ru/product/pult-dlya-split-sistemy-aux-266160966/?asb=m2ECLM6S526wuCeWlUOMHRMtoJjLK3LVZVAM8WoE4To%253D&asb2=CQyqXVpj4yudS_7x-WYoY3tGM_JHZBWqZSrSbQ7dNxP5uF634roXXIQtGzOrvnlR
Пульт для сплит системы HEC,949 ₽,3 отзыва,"12 мая доставит Ozon, продавец QSystem",https://www.ozon.ru/product/pult-dlya-split-sistemy-hec-276245250/?asb=y8Z0u4dsbCy8%252Bj7mcx4%252B2iuT7PFOVYzxjdp8g%252FBAMBM%253D&asb2=zg2NxU4oDqQ0ufZ6R8dLD4C5JaV3t5ZG00WFOVsSarqSrzXzljBy7AXAl_Hrafl1
Пульт для сплит системы MIDEA RG36F/BGEF,949 ₽,3 отзыва,"12 мая доставит Ozon, продавец QSystem",https://www.ozon.ru/product/pult-dlya-split-sistemy-midea-rg36f-bgef-275526887/?asb=vkM3CmqUomE%252FTLbgTly0lAQw6iIwNPDpboZ6xKOrJKc%253D&asb2=w5TugAlyXLmMXWJ3J0Yl6OmO8n3QfG2O0YeuXPgWAKJ0hce3EuOJBENrP_TMPq3y
Пульт для сплит системы BAZZIO,949 ₽,1 отзыв,"12 мая доставит Ozon, продавец QSystem",https://www.ozon.ru/product/pult-dlya-split-sistemy-bazzio-283009382/?asb=KSYuOmIjH3ygMy67%252FglDlHN%252Fo%252B5k50neVlqqY%252BEQ4H0%253D&asb2=sbuMBLxH0v7S5bLasUuziMdCNcz5Ly4HCVZ3-bR_YTI9hzSXGlurAr2lxqXYx2Zt
Пульт для сплит системы CARRIER,949 ₽,1 отзыв,"12 мая доставит Ozon, продавец QSystem",https://www.ozon.ru/product/pult-dlya-split-sistemy-carrier-276078080/?asb=4D9hOQd54VABllP5feerkAttNyZ5PU3SLYWJWrTU2ac%253D&asb2=bCZk5DUsqlHd5oX8Acinva_X1ePV2cVFQ0-210j05gRO8F25U3rRIJXsZVibS6p2
Пульт для сплит системы HISENSE,949 ₽,6 отзывов,"12 мая доставит Ozon, продавец QSystem",https://www.ozon.ru/product/pult-dlya-split-sistemy-hisense-266166034/?asb=fbhVb13HukAi%252Be9qglpb5ncXcDbyvFo8V0RFmLcaGwQ%253D&asb2=q62Rhf2g8bc5Ql2p_e62PnF4o2F-UARIO0m21dnwV6GrPLSW8j_aUsXj-ASO5rx5
Пульт для сплит системы MITSUBISHI,949 ₽,1 отзыв,"12 мая доставит Ozon, продавец QSystem",https://www.ozon.ru/product/pult-dlya-split-sistemy-mitsubishi-266166751/?asb=%252F1ispM84JdOipjjhiT%252B6KLJqVx4BaUrFWQY2NDLDCt8%253D&asb2=cun25mvBZ7ncGS9BPHcA7XD5GEiR6FvYEu3cTVo-DJZd41W3JAnJxuoclYjhaX4N
Пульт для сплит системы DAHATSU,949 ₽,1 отзыв,"12 мая доставит Ozon, продавец QSystem",https://www.ozon.ru/product/pult-dlya-split-sistemy-dahatsu-277650611/?asb=M4Ix4aQ7y7HFPO5U%252FbDuia9j9fI20RPNmt11xAabuvs%253D&asb2=a59rFjC1pGmQXoIIZqeVksnL6nmMJfB9uHpWZNpHSJcnbT5a6Ad2iK96_u5BNrNC
"Заглушка медная для кондиционирования 7/8""",270 ₽,1 отзыв,"9 мая доставит Ozon, продавец РаСходка",https://www.ozon.ru/product/zaglushka-mednaya-dlya-konditsionirovaniya-7-8-485734722/?asb=u7vWpe1KY6oHXt5IdCoh8Ixd%252FGbd7cjNDDUqPPXilpM%253D&asb2=47dzq6fZuxKzFoHWuWs-WJrV7qbAOaVVrpaOQLJfKF6aQ_wgSZDgBrgMwonp8puU
"Заглушка медная для кондиционирования 3/4""",270 ₽,1 отзыв,"9 мая доставит Ozon, продавец РаСходка",https://www.ozon.ru/product/zaglushka-mednaya-dlya-konditsionirovaniya-3-4-485755654/?asb=MDzlT%252BRRuqEm8xG78ZDYAOL6qAM8hwCgGI%252FLJhXoEUw%253D&asb2=lJAUchNxKs1LbwF69aARMX1OXkC8IuOCy2SqpDVTdSqvvqxvCLvb21oKZIHOeCO_
Пульт для сплит системы NEOCLIMA,949 ₽,1 отзыв,"12 мая доставит Ozon, продавец QSystem",https://www.ozon.ru/product/pult-dlya-split-sistemy-neoclima-277650500/?asb=RQmRDKE9YiTo3mU%252BTgvOP9vyfVD%252Fa0l7ZCK1%252BHe4rtQ%253D&asb2=768ldtEewFoIXEV1UYg0IQuWGw49cInD2RA2zXkFYhJc0T6Y--b42zMZEfLMrGDn
Пульт для сплит системы DANTEX,949 ₽,1 отзыв,"12 мая доставит Ozon, продавец QSystem",https://www.ozon.ru/product/pult-dlya-split-sistemy-dantex-276079788/?asb=qvIxZq13dRbldCSFBaCucfhtnMuCrC6UXQjdHkLBPn0%253D&asb2=b_fFVds5HbbDoteeSthU2Q-v-vixRIou2P2kRLHicFrG4Psb9MROdVBcmOWLQYHm
"Заглушка медная для кондиционирования 1"" 1/8",405 ₽,1 отзыв,"9 мая доставит Ozon, продавец РаСходка",https://www.ozon.ru/product/zaglushka-mednaya-dlya-konditsionirovaniya-1-1-8-485748325/?asb=46MS5lIeljabXXO329MskWPDWmLPTS7WPjxgqw82G%252B0%253D&asb2=BPGLsBFG22TIZuD1X7w6OS8uTZZbZX-Jyt1cehLzaLLIp7NLt4zUi-_Hs8dPwsFN
Пульт для сплит системы BEKO,949 ₽,2 отзыва,"12 мая доставит Ozon, продавец QSystem",https://www.ozon.ru/product/pult-dlya-split-sistemy-beko-266162235/?asb=BSWltzO%252FakbHRwF7dPvijtE5OJN0FqWH5a02GTi8H20%253D&asb2=C-UdACYgFZlMsWsKtXL0p47d4GDNgI2Bb2Gn03qsw6JvBx_VpsRVzQs6FJt1RFQL
"Конденсатор САР 520 UN 12 мкф 450в, пластик",360 ₽,1 отзыв,"9 мая доставит Ozon, продавец РаСходка",https://www.ozon.ru/product/kondensator-sar-520-un-12-mkf-450v-plastik-454751564/?asb=s4OQh3UBu75LLS3nfsA8uYXhv46XsL1rHt9EsHapTno%253D&asb2=KUbn2MAJCiE4hBXGVRq0lkRGPonuDq3I5_GMzyeDMf7MaON-i0As-BoLT_pRfFK_
Пульт для сплит системы Aeronik,949 ₽,2 отзыва,"12 мая доставит Ozon, продавец QSystem",https://www.ozon.ru/product/pult-dlya-split-sistemy-aeronik-278922717/?asb=s3lqatEOhBRXaw9K6OqHgwxJfZ6MAiNrcAktIXA%252Bqw8%253D&asb2=hc_2SlX3Y1EyUINJDg_WIXHXJMPBjKxEXLELOoDywvLL_OqY_F736WwSGXBQIUW8
Пульт для сплит системы HISENSE,949 ₽,6 отзывов,"12 мая доставит Ozon, продавец QSystem",https://www.ozon.ru/product/pult-dlya-split-sistemy-hisense-266164222/?asb=F011mL0SSVTMbGp9GWKmNcAp0pOihlUNfUuRis7ilUY%253D&asb2=sqDX_XhzyuOU9PdRVI0TJdp7sBoBwDDzGKnSpknxveeMhiVO3gTxGDFxglJxWyKE
