Увлажнитель воздуха кондиционер для охлаждения воздуха с вентилятором,999 ₽,34 отзыва,"8 мая доставит Ozon, продавец ВЕЛИКИЙ",https://www.ozon.ru/product/uvlazhnitel-vozduha-konditsioner-dlya-ohlazhdeniya-vozduha-s-ventilyatorom-271684618/?asb=8UYYdbiV9xYAWsUcDJoL66x2PobutAXowXHVKvGMBUI%253D&asb2=vVzcMeLAPom2Iy7B1k1PO1TR7V0yRc2hU14ElF31Rx1nsVICP4nK7l5drC9LBdIR
Пульт для кондиционеров Aux / Timberk / SmartWay / Pioneer,899 ₽,3 отзыва,"12 мая доставит Ozon, продавец Radio Budka",https://www.ozon.ru/product/pult-dlya-konditsionerov-aux-timberk-smartway-pioneer-279263725/?asb=r9VvbsvsfVWCX9eN66L5IyoCfGeit9GvNqNM0KE9pwDoMuheCDVWUoucBUrtkObe&asb2=RpxTUGa3NdoU4twPtFgLUcNfIm-y_AHpRUMRbTKmQqSMo5BlTEaEcWztp2Su_hyzN82QM9PwhsakRznV6JVxcay09upoSHk-Hp24-7JxAJgPvAS2Zqgnibeb_1Iz7ouja4P961Yzbv6HFwiDpzv4hA
Универсальный пульт Huayu K-GR1355 для кондиционеров Gree,600 ₽,15 отзывов,"8 мая доставит Ozon, продавец ИП Котова М.В.",https://www.ozon.ru/product/universalnyy-pult-huayu-k-gr1355-dlya-konditsionerov-gree-247750720/?asb=osmRjKIg3qcRWAQ7BcEjQGmeOqlBgvqfNqwmMxvM8DKO6MRobedr6JQkvOgmbZRh&asb2=ctI8ZsPB0bm-ae56pRJ5adeQWyKaj_JE3lF5zldFDTpo6XZxORFUNPbEazjYlX9Zo2B3lOEejyOUmFGQ-5QNPisBEZbut6oD_ofx2W7gXZQBwp4uPER3eSmslOgRRInsqspa4OlPIL_qgNrIQYS-3A
Шланг дренажный для кондиционера 16мм / 5м,669 ₽,40 отзывов,"10 мая доставит Ozon, продавец Очумелые ручки",https://www.ozon.ru/product/shlang-drenazhnyy-dlya-konditsionera-16mm-5m-271375266/?asb=lsT2b8X149CD8OJBUFgXFkE3MpYHRsUm0%252B0BwHAfQ4cEfZ8vQEqqrdSLlu5AIr9K&asb2=Vui3Bb3sKVccfsC6skW5g3hGjb6BrmUqoAWt0KXWvp4MEJKXEFMr8VRMBcVFNrYdp9GwELBsOKNAgkMje7k5xPXrMGmdyI44NEyVAy-N_6iocxWdhGEU5TgfE8jdH_btekv1NT2hneOU3c3H6esZLg
Пульт для сплит системы PANASONIC A75C3173 (CS-A7HKD/CS-A9HKD/CS-A12HKD/S-A7JKD/U-A7JKD),949 ₽,7 отзывов,"12 мая доставит Ozon, продавец QSystem",https://www.ozon.ru/product/pult-dlya-split-sistemy-panasonic-a75c3173-cs-a7hkd-cs-a9hkd-cs-a12hkd-s-a7jkd-u-a7jkd-177919721/?asb=7Zd8sz63K1xtUx6hjf2I9ePbkko1c1PBVHVNkb3zl3A%253D&asb2=IdizZJPi6N4jNWXzlYK6e-XiPBcXLIbSTUQvZ6C5pEWe2u9mztIiOaYivyKp6pfj
"Пусковой, рабочий конденсатор для кондиционера 25 мкф, 450В, СВВ65-металл",495 ₽,3 отзыва,"9 мая доставит Ozon, продавец РаСходка",https://www.ozon.ru/product/puskovoy-rabochiy-kondensator-dlya-konditsionera-25-mkf-450v-svv65-metall-453869651/?asb=5Q0E6GhdI2GQ97rC1y%252BMCQT0QEM%252FwE0KEs1AdKqOPpQ%253D&asb2=Qt0uVfTJuHOgIQNNcmE79gYSAdoFIeCZOGe9Y1q8C5dRk6w1lZDtJe_dGE1g3qri
Универсальный пульт Huayu K-MB1550 для кондиционеров Mitsubishi,600 ₽,8 отзывов,"8 мая доставит Ozon, продавец ИП Котова М.В.",https://www.ozon.ru/product/universalnyy-pult-huayu-k-mb1550-dlya-konditsionerov-mitsubishi-247783891/?asb=MM7EAkIISYkvJ2ZDuXrD8fl0cvXB9Pwh0RBKaFIiRvCax%252BQhEEJBpUjv4lgjpt5Z&asb2=2fksr9wf6DY-S4-agtC7fR5jIL1_kIglEUHQrK9koTKzJKCQvMjun3mA_ZrwEVJ_49nFoKVVX7riGWJNWpmDcR3Ioyq6miiCTmnMf2rrH5s4yIIJ7J4Rda8uWI35RV2OKhJy1_RiHrcecr_7z8QyjQ
Универсальный пульт для кондиционеров K-1028E (1000 в 1),800 ₽,9 отзывов,"7 мая доставит Ozon, продавец Комларк",https://www.ozon.ru/product/universalnyy-pult-distantsionnogo-upravleniya-dlya-konditsionerov-k-1028e-bolee-1000-modeley-272394872/?asb=TecLPJKCuefcbZxFgtng6Y5YDlwljwEFgNMplm5lum8%253D&asb2=GSqJ6G9Lu_nK7V486SrsdclcFq-pRw7xp9utyfd1EbN3ttaGLfmn9QzcGkw62uiN
Пульт для сплит системы Aeronik,949 ₽,1 отзыв,"12 мая доставит Ozon, продавец QSystem",https://www.ozon.ru/product/pult-dlya-split-sistemy-aeronik-278928346/?asb=90gPLH3G6VyPFt0nsWLgft%252B7dxTLKsSqtSHFMWyQ%252BNo%253D&asb2=V3uHP7o982lWntrd7RxhnVRHX_zQ4ibAfbHnkshF9yFfXmLp7JIXy2bDod2YJ6N8
Шланг дренажный для кондиционера 16мм / 10м,865 ₽,40 отзывов,"10 мая доставит Ozon, продавец Очумелые ручки",https://www.ozon.ru/product/shlang-drenazhnyy-dlya-konditsionera-16mm-10m-271373576/?asb=VxLhHZONRUv2OaQeqlgJIxtVqR8D%252BNA02jKOfdf5IoI3KdGlb5tRmqiSaB8IdNWw&asb2=79eB_rXGEBlACGdwyfSARpG0pGoRLqjLKoDaWjegNXC2sLzTBJEokTUBnz6Jt8Zwee9tQC9Ky_OgOKmv6EuoOhoUzoAocZZW0K33FqxTwiTGpcB-wVcbKpM_zSFl5qpf2WlRgDLcHJbEIwl1d4mHAg
"Конденсатор пусковой CBB65 35 mF 440V для кондиционера, сплит системы LG, Samsung, JAX, Haier, Lgen, Pioneer, Chigo, Neoclima, TCL, Ballu, Green, Rovex",495 ₽,1 отзыв,"11 мая доставит Ozon, продавец ""Модуль""",https://www.ozon.ru/product/kondensator-puskovoy-cbb65-35-mf-440v-dlya-konditsionera-split-sistemy-lg-samsung-jax-haier-500454578/?asb=%252FXlEBbtOLAlozUdQLJMXgFXrz4yyEdeSecXNBSgyWMxy01ZJVpzsX%252BeHGwAlEN7n&asb2=5SXvmHj1OKnyrw2Oq2fE95Q16wO_ARBIZic6inaqE7kX2iYZYAxVR0KrCtxU7l2aM5whPVnf5PY1OfJz308R__684rOaBJCQQi-Ft8b4wb8fu5I9uoP_uKn1BWQycTfoUoLvvq1Qi7FIxmUMUSMvLg
Пульт для сплит системы HISENSE,949 ₽,6 отзывов,"12 мая доставит Ozon, продавец QSystem",https://www.ozon.ru/product/pult-dlya-split-sistemy-hisense-266164088/?asb=ylUzMe%252F7WxV4oyrH4jHDcqEcZQyqKY01bHtZW9UtmLo%253D&asb2=gbECE_vwyi5C4IUSA5PHZfUIHQtUg3fF8LUqSVKZ6NJc_JbsZmyTIfKkEZXgluO0
Пульт для сплит-системы Haier YR-W03,940 ₽,9 отзывов,"8 мая доставит Ozon, продавец Radio Budka",https://www.ozon.ru/product/pult-dlya-split-sistemy-haier-yr-w03-261572293/?asb=UH3oqHvGn0tUPjd6geh%252B0g%252BmkrGKGFj8Yip7HWazAxE%253D&asb2=tqPFVGGX7Wyzr-QelntYa_JG8wr1zTOqxnwB5f6myV7rkq0MiCpbRtNxArv7jkep
Универсальный пульт Huayu K-MS636 для кондиционеров MITSUBISHI Electric,600 ₽,10 отзывов,"8 мая доставит Ozon, продавец ИП Котова М.В.",https://www.ozon.ru/product/universalnyy-pult-huayu-k-ms636-dlya-konditsionerov-mitsubishi-electric-247726179/?asb=HDQiWXoaU0AVTiE0xZU8wJwRZJavraeQGbLOCj4dpWDh1MAhkvq679PEKCTBaENC&asb2=vfIdgunOBHmqqevGi6qTzYK-gasGc79UrYbioOGefVo0-hHWXqFvPKyqrMxFB9z6tKQ3Fravx1RqYa8FX2cquneuHA94cIvi4lmu3_cDoyKH_sQpsoRbdAUYlmvDxpQ1YpUW0dMa4oMsSb9WD1B5lA
Конденсатор пусковой-рабочий 8 мкф - пластик,340 ₽,3 отзыва,"9 мая доставит Ozon, продавец РаСходка",https://www.ozon.ru/product/kondensator-puskovoy-rabochiy-8-mkf-plastik-453869558/?asb=hHjp78cNWnorSvLuBYE27nqG42kY5lAfuJI53qUT9OU%253D&asb2=BxlZzJUAL6z4iBS6FUY5fL9jOjrl5LwAnof41ykWWelmNEWWF0BbwNpIt8B4GWQS
HEPA фильтры на сплит системы любого бренда (2 комплекта),999 ₽,3 отзыва,"12 мая доставит Ozon, продавец Андромеда",https://www.ozon.ru/product/hepa-filtry-na-split-sistemy-lyubogo-brenda-2-komplekta-300858817/?asb=1lziISn94uGPLC60du1JFG5lWoS2vLKI18Pi3iodw0XQOjbY1VM1AI%252BBHDwnOFAU&asb2=jJ20cBgx97FnNwxKOuh4uWVKb4VpPviPsJlU1uOQs9y4wnrZhgyx-4IkNRiNj-3uhQ5R_tFo8GNynhnK4B7Xrn5dFe_klmv0DbAUXHzBp1UuzPEAjo3mTJ5aGwAJYccj1R-WllCYyXw-rV_d_UnVEA
"Пульт ДУ для кондиционера Qunda KT-E08, белый",629 ₽,1 отзыв,"Послезавтра доставит Ozon, продавец Расходники",https://www.ozon.ru/product/pult-du-dlya-konditsionera-qunda-kt-e08-belyy-361680148/?asb=I9%252FYBEs%252B3srPcxQTfmP1FNijBBGXdflQoaz9%252BL602kzEYPvM2K0CtcCYALEiRQgO&asb2=BPZkEycJGctxkgsf6mqPqJwNnrF-eAzEKApX3Y_jVeLP5aWoHRVoTRy7r2HOjVgnHlqbEw3eLzWPV9RPrG1NbUVU2ooGSNRWybFPlgyYEi2MiYnwDHsRxK2Ltzr_tR1rTaWXDURdanG-tkbahzydLA
Пульт для кондиционера PANASONIC CWA75C2710,849 ₽,1 отзыв,"12 мая доставит Ozon, продавец Radio Budka",https://www.ozon.ru/product/pult-dlya-konditsionera-panasonic-cwa75c2710-259975174/?asb=%252FJPG7lWzskW%252Fp%252B0jeRiSwQ%252FNe27jK%252B6sS11zihAqABEKINVRqfKxoYbLrN80BsUk&asb2=J4ukZGjxB5w5hJyDvzocyhLZis2CpXwzyaDkAzM7stWYsxTcY2Wk25I82DNHPU_W2yQOtNf-4V9SVORm5-f_um_KYJGPAIr97ZG4X8jmnL2JDz2tU0kbJ2y0XfKhELm6p-VZ2NhPApZLFAO5TqkaVA
Универсальный пульт Huayu K-HT676 для кондиционера Hitachi,600 ₽,1 отзыв,"8 мая доставит Ozon, продавец ИП Котова М.В.",https://www.ozon.ru/product/universalnyy-pult-huayu-k-ht676-dlya-konditsionera-hitachi-247524224/?asb=ZkPPVoCBEv05JqVuvLdEWwdx0EMTLGCiFOUwOLNdj%252FCjgrb6FOogc87fr1IOtFch&asb2=txrnHl1Hbj3Ze99iFI1Uu3nnS0VPen15lKAqqd1g1BOwp_GLovHjn4DoQyV-ycU6XYGfj1fmXlo6qAv6b6euRZtwH_rxWLNaUPF4vq1xIFYkh2fTTy_zxSsBlCDhxL8WTwpOhWdj6ef8Uv_LhNN3Bw
"Конденсатор двойной пусковой, рабочий для кондиционера СВВ65 30 + 1,5 мкф на 450в",980 ₽,2 отзыва,"7 мая доставит Ozon, продавец Комларк",https://www.ozon.ru/product/kondensator-dvoynoy-puskovoy-rabochiy-dlya-konditsionera-svv65-30-1-5-mkf-na-450v-295832908/?asb=zk8A%252B6T%252FS8dM%252BxGNRTzcdllVvx%252BkOJS%252Fz92%252BbD%252F44ag%253D&asb2=tAR-S29ATiGt7GvzITnM_plkuuNe70NAGNSsBQgNAyFc1SB0TEkTrjk_J65DXeTY
Пульт для сплит системы McQuay,949 ₽,5 отзывов,"12 мая доставит Ozon, продавец QSystem",https://www.ozon.ru/product/pult-dlya-split-sistemy-mcquay-276581465/?asb=sZdg7JU588HjgONYLyRLySPGIRu%252Fmvzq0nOdAuCGiy4%253D&asb2=ZUD6O3Mm9s-kNSC3Yf_cO4ZPyapCy2XHb-CuyE3kIMjFhKIcbkDm-b55bbk-CF8h
Универсальный пульт для кондиционеров KT-9018E,707 ₽,3 отзыва,"12 мая доставит Ozon, продавец ФУЛСТОР",https://www.ozon.ru/product/universalnyy-pult-dlya-konditsionerov-kt-9018e-258443382/?asb=9g4ramxd2KKOjigWMNuMoKsURPsOypR6IBLoNvYAe10%253D&asb2=GHckS4KniNXBuFU1rxibbplzz0EOQ-DCVi4-gsYfyd5KjucFBWiHqYVZVzbU0n5-
Пульт кондиционера KT-9018Е (4000 кодов),650 ₽,4 отзыва,"12 мая доставит Ozon, продавец Zip108",https://www.ozon.ru/product/pult-konditsionera-kt-9018e-4000-kodov-237172278/?asb=8wa7bD9w0i%252FCDkWtl7sIVWDtypEKpqk2hhatLDsVdtQ%253D&asb2=Ph9zm42fN3yf1lrsOeotXdegwuLjUEezZL3k7qr6DX1z86z0LHySo_XQ1EC2SNuJ
Пульт для сплит системы MDV,949 ₽,2 отзыва,"12 мая доставит Ozon, продавец QSystem",https://www.ozon.ru/product/pult-dlya-split-sistemy-mdv-276412643/?asb=%252Frg1U3hKs5n7ft6JYQ2KV1s0XnBS4LUK%252BmVWeNKwf4w%253D&asb2=oYabxM4RXspNY2keBSm04e8cs-StRT3AqvEfiJ82srfGdBSmGSSGSQ5VpP0mtej4
Пульт для сплит-системы (кондиционера) BALLU GYKQ-03 / GYKQ-63,849 ₽,5 отзывов,"8 мая доставит Ozon, продавец Radio Budka",https://www.ozon.ru/product/pult-dlya-split-sistemy-konditsionera-ballu-gykq-03-gykq-63-259964708/?asb=qptQ72cMm0AtLlL6dZYMcLHGUXZahzVVPLOu6Z%252BjOjI%253D&asb2=TX3Med1NIoO7EPcgS8VTZ3zLvM9wbR9PA9LpTm1hAl4-Jjx9JIcswkfP3F3CMNI1
"Шланг дренажный для кондиционера 16мм / 10м, дренаж гофрированный для кондиционера",855 ₽,4 отзыва,"9 мая доставит Ozon, продавец РаСходка",https://www.ozon.ru/product/shlang-drenazhnyy-dlya-konditsionera-16mm-10m-drenazh-gofrirovannyy-dlya-konditsionera-494909739/?asb=Jfc62IoclTtcn6wy%252F7wkLnGk0cCgiZu6HOWL9Am8pSg%253D&asb2=rPN6ArBD-rpm8U0EsrjxB5hu0IhqTYc17OeNzO5Nqk5XnYJHng5p7EvcEwC6nPCA
"Пусковой конденсатор 16uF(мкф), 450V, CBB-60, 40x70, клеммы",520 ₽,1 отзыв,"Завтра доставит Ozon, продавец Нужные Вещи",https://www.ozon.ru/product/puskovoy-kondensator-16uf-mkf-450v-cbb-60-40x70-klemmy-462736364/?asb=Z7fWCBhJGGy%252BRegqufWBEvMrgbKbo6wCApETDYQHq9w%253D&asb2=DJDe-tNh6pDdXHHIp7qTHJ9v_-nWsEmYjtZQf-XNqk9708ix4z9iRCZfa29L2764
Пульт для сплит системы SUPRA,949 ₽,7 отзывов,"12 мая доставит Ozon, продавец QSystem",https://www.ozon.ru/product/pult-dlya-split-sistemy-supra-279292279/?asb=DFSLKPB1xSKbEgCmVj%252FZY5tmPrA5IfkhX9nbwKi4%252FEM%253D&asb2=cNK7xiFeFbIuFzsuv7cLBoBLuA1DjvBiTE2ktftEv7FwtSQIqbCH57doCeXwuPFO
Пусковой конденсатор в прямоугольном корпусе СВВ61 4 мкф 450В,340 ₽,5 отзывов,"9 мая доставит Ozon, продавец РаСходка",https://www.ozon.ru/product/puskovoy-kondensator-v-pryamougolnom-korpuse-svv61-4-mkf-450v-453711134/?asb=oL%252F3W5P%252FWuQw5S02P%252BSmv8QrG0pANChp30q5QFZi0xk%253D&asb2=JXkJF_QRWZOtfWS2Uzn2xBT4-7CoEItsriEX8s58lxmLqTkvClHteLhl4VsAyfMD
Пульт для сплит системы PANASONIC A75C2581 (ESC-RC-082) A75C2665/A75C2663/A75C2664/A75C2953/A75C2713,949 ₽,21 отзыв,"12 мая доставит Ozon, продавец QSystem",https://www.ozon.ru/product/pult-dlya-split-sistemy-panasonic-a75c2581-esc-rc-082-a75c2665-a75c2663-a75c2664-a75c2953-a75c2713-177919789/?asb=mc%252BI2EzEOEkN2E3Wf%252FavQBQQEg44jN6pm9t88b8tkKI%253D&asb2=yB0ekBgtjNPoOWII5fkvjwzrndQJD12jMoP6Jp1zjgusewlYfsq8j04rhgxAN_wD
"Труба медная мягкая 9,52 мм (3/8 дюйма), 1 метр, трубка медь для отопления, монтажа кондиционера, водопровода, холодильника, водоснабжения, топливные системы, змеевик, газопровод, охладитель(чиллер) для сусла",941 ₽,5 отзывов,"10 мая доставит Ozon, продавец Запчасти и аксессуары",https://www.ozon.ru/product/truba-mednaya-myagkaya-9-52-mm-3-8-dyuyma-1-metr-trubka-med-dlya-otopleniya-montazha-492163782/?asb=b3kH01IpjacMa0i3HpkJC76WkJUtQeqjU4Blisjzxx1%252Bjl2F4QjxYMyJZi4COJ%252Fm&asb2=ex9aJfa0IKyt--f9fmZDg6RQ8OQ4I9_4pijY7i62psqdSj97ek5NidY2cDyxtNQffMnT7Rw2s35h-iA963xB180aeIY2tCL2-cgpj58bSd3QvkVUuNBhMzYxd1v8TLJr72C7nyvZ2NC5SOnzLPuNcg
Шланг дренажный для кондиционера 16мм / 5м,669 ₽,33 отзыва,"8 мая доставит Ozon, продавец SafClimate",https://www.ozon.ru/product/shlang-drenazhnyy-dlya-konditsionera-16mm-5m-440078597/?asb=yMha4CEsZgFkitSFvC1wLJZQFs97fcaAcKxeKwlTAmo%253D&asb2=zAZ4UAnUhzP2h-nWzC7SgNTkXRsEsjdqTHtjMLPzJtuYvnzSyj8Uda-S_6pg208a
"Антивибрационные подставки (проставки) под крепления кондиционера, 4 шт. / крепления кондиционера",684 ₽,4 отзыва,"8 мая доставит Ozon, продавец Магазин ""Товары для дома и семьи""",https://www.ozon.ru/product/antivibratsionnye-podstavki-prostavki-pod-krepleniya-konditsionera-4-sht-krepleniya-konditsionera-395708631/?asb=lO9i5pDcfNcrP7NHIB3eQV2qgz0YEREfbPH5l3jDMGAl1vJ1YNyugGiYwR3c2UYV&asb2=KMGtCMK8NLrU2cOk_Pyy8h7DOvsVv16ACeO5ZwCk4jn8OtRADrWF6mabGPtKzRr9aNkfIM27D7aIwZW3FrGhoDIAca5PVt46jeV_6-renC3m8NRkdgwo5fFIiOGM6OEaViP-pVHDzLaQdAy-TvJ-PA
Пульт для сплит системы VENTERRA,949 ₽,3 отзыва,"12 мая доставит Ozon, продавец QSystem",https://www.ozon.ru/product/pult-dlya-split-sistemy-venterra-276422148/?asb=bLET04tPcDrpk2BMf%252FdxcpuTd2uuVK9oqSx2zagFsSI%253D&asb2=DLsj5MGEfFIYI-LIsPzR9Hyqlh2tIJ3Qk9O4MT8bNIVr-CzO0h1foUYszjQDer86
Пульт для сплит системы DANTEX,949 ₽,4 отзыва,"12 мая доставит Ozon, продавец QSystem",https://www.ozon.ru/product/pult-dlya-split-sistemy-dantex-271100596/?asb=5ocWpn1E%252Bgk8PqcXGudeeadFTT9nmSBllkXsYMD1GrQ%253D&asb2=ADo65ao3Q2L5PnVlamgnieNGfpkw7ETHLKP2PecBro996l8RoQ8kiV_Tl_trDeyS
Пульт для сплит системы LG 6711A90023C (6711A20111F),949 ₽,12 отзывов,"12 мая доставит Ozon, продавец QSystem",https://www.ozon.ru/product/pult-dlya-split-sistemy-lg-6711a90023c-6711a20111f-177930445/?asb=Lz4wVS8LHlcXwktJY03D5l53HVmtdWfa9vWckDBb2ug%253D&asb2=Fz8WFV5rTb11og8WFdXQwO8BliEbfQDCV2cO7fhLfVzBR5DvmgiGZ2Tvo_fs3gk7
Универсальный пульт для кондиционеров QUNDA KT-e08 (6000 в 1),704 ₽,1 отзыв,"7 мая доставит Ozon, продавец PDUSPB",https://www.ozon.ru/product/universalnyy-pult-dlya-konditsionerov-qunda-kt-e08-6000-v-1-227175723/?asb=E9yHckpYK3DUT%252FiDc5M7HR7lI9YXbiJNbpsGagtKcyQ%253D&asb2=2F8BkdxhOiKT2z1bBiYORqvVAX1SHYynX4M0IVQ01kLFNbeZU_at9706HbOoTodW
Пульт для сплит системы MAGNIT,949 ₽,2 отзыва,"12 мая доставит Ozon, продавец QSystem",https://www.ozon.ru/product/pult-dlya-split-sistemy-magnit-280924184/?asb=FH%252Bw5LJ%252FsTAXDZPbq1fDoI51ronWGF%252Brs8B5ctSaV5E%253D&asb2=3Um4RSxrvml-1TYIt3QS4qzJm_5ygLozz-6FFZQKQ2gzmmRzYVV87IbbaLc-2y9w
Пульт для сплит системы MYSTERY,949 ₽,7 отзывов,"12 мая доставит Ozon, продавец QSystem",https://www.ozon.ru/product/pult-dlya-split-sistemy-mystery-266159614/?asb=ZJkQplzaoKp79oDVX4e9rWHHwoOsGCmYyUfqDzrVibQ%253D&asb2=J9Zk9LJxj8e5RzEYq-eQ7v0li4UMEFNM85g4W1FMud51B31TR015njlUcc6Sb5vS
Рукав ПВХ для кондиционеров AIR 16/20 (25м),899 ₽,1 отзыв,"9 мая доставит Ozon, продавец КАЗАНСКАЯ РЕЗИНА",https://www.ozon.ru/product/rukav-pvh-dlya-konditsionerov-air-16-20-25m-462563208/?asb=A9TdZOXHkeYCTS8jKjia2%252BgQfd4xozpqB1ElKCVNyBA1bXzSapAmP0ZDscBkAEgs&asb2=1WyBVP_6tRDbMUiy83NwEa81piadgG2Tr60Drffa50x6RCOHF0PVMKlUJ5RX65pyH87gUWs8BCQuVqp6hzeRs1v5hzqy5ttSMz2DlOWsftoruQL7s0hCsd0gGFGq0ER12oFfDcvA3Gj_W1K2E1i7SA
Универсальный пульт Huayu K-HS1512 для кондиционеров HISENSE,600 ₽,5 отзывов,"8 мая доставит Ozon, продавец ИП Котова М.В.",https://www.ozon.ru/product/universalnyy-pult-huayu-k-hs1512-dlya-konditsionerov-hisense-247767417/?asb=uCLuknMsg8n5c0%252FC7RhfiCRqjgZ0bt2SHFntTu1RGyIT3lrZ%252FFLWlywBa9KarjmE&asb2=qutw1DRNG_fbxIqknnnS_s_V0d2RJxgunH_fJvyirJxrkQRwTHXb2doI5YLpoFwbC9qcEkMfWZmz_e9uFk4CXr-yWD9DpzNNEx2h3kE2pukX4JkPQRI2RffizZnhQ6RUnj_mvysk6kJyMRzKXMOy5A
Пульт для кондиционеров HANSA YKR-F/006,849 ₽,4 отзыва,"12 мая доставит Ozon, продавец Radio Budka",https://www.ozon.ru/product/pult-dlya-konditsionerov-hansa-ykr-f-006-260594357/?asb=%252BqXO7O93pUDAJF1KM%252BYJ%252FMmKDBwDUlMgaS6zqHsNeKtqn9K904nfTgcUV1Yti2bg&asb2=1wC0i9vRi3_ugujxQIhRA4-YnzN33EZCzHmDkQWHstjL08Lq1N1mZQqgpukkZf2XZffAZ4XPu0ZKjmN6MEj_ivZ5WSFjyVbK6XagHkxn6VbyoZyt13kOrNV4arqvM9CWem3Zg6GLueUOeDE5A-nQPw
Универсальный пульт Huayu K-DK1339 для кондиционеров Daikin,600 ₽,5 отзывов,"8 мая доставит Ozon, продавец ИП Котова М.В.",https://www.ozon.ru/product/universalnyy-pult-huayu-k-dk1339-dlya-konditsionerov-daikin-247731213/?asb=lo8tMdPpjKV9nL0w4t21UvV98ccqegkCzXjkoXZiCklSM3zO6lLF27MiPTfpuz%252BV&asb2=kIOSJDyuQ7Wk2KV6MZ7u4oWrN7C3eeZbjEktoXCMKDbcDB1TOmYBxa2IBkfr4dQt8858REAACmEZCyJMH5ao-Xd87H0EFmbehc0w6t_zjcrFHzjpmA8G5APTv9_wi66sRbqF4UUAKnXC9MJnPROjjg
Пульт для сплит системы POLARIS,949 ₽,4 отзыва,"12 мая доставит Ozon, продавец QSystem",https://www.ozon.ru/product/pult-dlya-split-sistemy-polaris-279281975/?asb=RBcK%252BWprxz0CxZ477zKtQEcyIzsHLUNHpZ20m21Prgw%253D&asb2=VEZlEm5jJZUKYm_zBjdwDdM2pvi5yX77MuROiCyZmpDP5zAo8w4lHiegpllrjW1i
Обогреватель картера компрессора HC 60,790 ₽,3 отзыва,"8 мая доставит Ozon, продавец SNABLIGA.RU",https://www.ozon.ru/product/obogrevatel-kartera-kompressora-hc-60-231118547/?asb=sMJnx8WqPsfrkmgjcYHT5SVHM1n5O3bksvIpEyOq1MRjA1yqSl3RT1vXrBd9%252F2UD&asb2=54UwHZVrDvvDj8mN2W0ENEEOkZW3piUxswbzYgqC9HGRMAGn0ps8cUx6gCOmV4CQUy6W3I__ES2KkSMtzWoLEsYzJtN1cdneT0pr1thNLnZb_LPWC-6Vl5_-btz7stTGTIUjowD1SfeJ9qtI5zWdZQ
Универсальный пульт для кондиционеров PANASONIC K-PN1122,615 ₽,6 отзывов,"10 мая доставит Ozon, продавец МИР ПУЛЬТОВ И МИКРОСХЕМ",https://www.ozon.ru/product/universalnyy-pult-dlya-konditsionerov-panasonic-k-pn1122-271361839/?asb=8piC%252B6E4w5zenqRPOvnU3chuVCoKnL1a5qjShhKJnKM%253D&asb2=68CuIkZlaHtXTKwoJ14WNYTTdhg9qs2jbIxoAuMBJQlAAUDqwtAgD40PNbhaAoSI
Пульт для сплит-системы (кондиционера) Beko / Galanz GZ-056B,949 ₽,4 отзыва,"12 мая доставит Ozon, продавец Radio Budka",https://www.ozon.ru/product/pult-dlya-split-sistemy-konditsionera-beko-galanz-gz-056b-282748044/?asb=gcmnxUZu9bqTo4M2b73KDV0JcChHmefQAxDxKuHXxlLRpJMfqUJruzYdLAPr6Ejp&asb2=kvHROz8W8nII1A9ORd7yGvAh1QhzuQZeOJM_0R0qrhthRG7uOH3tw79thXMUSbcEcFA4eZnE7HK8IvpfkZaaPwDCOSpbftYWKUeBCJ46r6LB4mMcvzqlxdB6zFdBPP72BbyJy4IOXnhFWjB3ko1COg
Пульт для сплит системы POLARIS,949 ₽,2 отзыва,"12 мая доставит Ozon, продавец QSystem",https://www.ozon.ru/product/pult-dlya-split-sistemy-polaris-282757504/?asb=jx2hMIaYZ5A5kj%252FwvkV48Qdgc94rDSSNocJ44a5uUSQ%253D&asb2=R6d4Bsz-UaAAFohpyg58HkECJJ-PGe4LyZiGd4W0ncqCHT86ILbkdwUK8tB203kl
Пульт для сплит системы SAMSUNG,949 ₽,5 отзывов,"12 мая доставит Ozon, продавец QSystem",https://www.ozon.ru/product/pult-dlya-split-sistemy-samsung-279187335/?asb=8IAs28CIBC%252BxvFGedto%252B4JoYiCnsTfQkGc4sk7HSjxQ%253D&asb2=f9Yzci57DowkaUYzy3ULnGrtOD2TSYV6n6JC52lof0pIBMJ5G7RBKTZRyInTfj1Q
12 мкф 450В 5% 58*28*40 с клеммами CBB-61,458 ₽,4 отзыва,"7 мая доставит Ozon, продавец Комларк",https://www.ozon.ru/product/12-mkf-450v-5-58-28-40-s-klemmami-cbb-61-308067472/?asb=AQV8FHJEDAMY7eOaCiHt9SaWC%252BpB6LGh3U4upoD8LQY%253D&asb2=St7u-n1UTAUxuf2avuUqpo74aZ0dfyLPa-iqW2_BRECvInXH3cwtidZIRvRjmaxp
"Пусковой, рабочий конденсатор СВВ65 35+2,5 мкф на 450в, металл",540 ₽,1 отзыв,"9 мая доставит Ozon, продавец РаСходка",https://www.ozon.ru/product/puskovoy-rabochiy-kondensator-svv65-35-2-5-mkf-na-450v-metall-453870902/?asb=esSkfPxzGIIPgtsHrtaAqHS%252BkRGM9lGE4mgoI0kVN%252Fc%253D&asb2=B9e0Cma62AxMrtpCcFCpgmKE9uWqYbJ6MlRX3bXw1g6xQjhWW_bobggUSvgRP0HA
Шланг дренажный для кондиционера 16мм / 10м,900 ₽,7 отзывов,"8 мая доставит Ozon, продавец Центр Климат",https://www.ozon.ru/product/shlang-drenazhnyy-dlya-konditsionera-16mm-10m-234562526/?asb=cb47CzpM0%252BfQqJJ8nK3cwdlXzRFakjX3EKPewTGqtYI%253D&asb2=ozoKTDLVPaBuPYPND8CouAIxTz_AX-_9gpg_7HvO7ItmsrLhmD0zjL0XlEmEjpaS
Пульт для сплит-системы (кондиционера) Roda / Erisson / Saturn / Neoclima YKR/I-010E,940 ₽,1 отзыв,"12 мая доставит Ozon, продавец Radio Budka",https://www.ozon.ru/product/pult-dlya-split-sistemy-konditsionera-roda-erisson-saturn-neoclima-ykr-i-010e-282294216/?asb=vzLfDLs2k39F%252BYR3Qxt45VfbcnqS%252B21fDz7uqWPxTfnXytqF2ZyiKNGhuZ8XHBo1&asb2=pjyErzVIjiLJuoXUVlLdRb0EwMjO1LWOT_MmG9vn6SOdXROO5cdwN8p3Pa85PJwll5YZJbYGO8jXa84hKF2iys19sE4kTAX3zPJJk9pzekLlz-m41mwKylhWZvn6yjNCQ2v02xL7xIkS_N-SX7bMag
Пульт для сплит системы LGEN,949 ₽,3 отзыва,"12 мая доставит Ozon, продавец QSystem",https://www.ozon.ru/product/pult-dlya-split-sistemy-lgen-266166308/?asb=uSywE8CKov7zZA%252F1tZzVivr9B6LfD9A45BpsX7m6f4E%253D&asb2=NXFoLRMCIt2Jbj7rKqVGdKZ6CN8sovoV2Y_Xgy-Qkb9n56N8urODDhksWhnd8G6W
Универсальный пульт HUAYU K-1038E+L для кондиционера,540 ₽,7 отзывов,"8 мая доставит Ozon, продавец ИП Котова М.В.",https://www.ozon.ru/product/universalnyy-pult-huayu-k-1038e-l-dlya-konditsionera-245094068/?asb=o1o051VFcXfbNip4n2mV8QwzAaF4S852YdVY1YuU9zJ3ZiF1uzvERXVvYcxqu9jC&asb2=A9m7xcmulFcvskDtJetU7uQKYPoMxB-N7OjAWn_tSDlsF_NSriVkVbUhv5lN7xKCBgyNM12p-U6RU9O-L3iAk8LtCeQK0WpWqDRhSElBfn1Rw6hTpVo2zHwCMbWKO9rQDCRG5A7kdmfAHzJx7LGnRg
Пульт для сплит системы SAMSUNG TP14068/DB93-08808A/DB93-08808B/DB93-07073A,949 ₽,10 отзывов,"12 мая доставит Ozon, продавец QSystem",https://www.ozon.ru/product/pult-dlya-split-sistemy-samsung-tp14068-db93-08808a-db93-08808b-db93-07073a-178160741/?asb=YlyrH9f6qvzoOhrrtA6Wve56jApj1pYv6eKDVrBeYJM%253D&asb2=CLmkQWG9FEkPUDuHUUZhHdvYCb713N-XRg1wXaZvQm3LNUtqeuIgdoNcD-7GKIfq
6 мкф 450В 5% 47*22*32 Конденсатор с клеммами CBB-61,441 ₽,1 отзыв,"7 мая доставит Ozon, продавец Комларк",https://www.ozon.ru/product/6-mkf-450v-5-47-22-32-kondensator-s-klemmami-cbb-61-308122077/?asb=7V9yrtqQ%252FWc6rXQJ723fBHExrnSl2bKJgGBKGiokhA4%253D&asb2=mzH0-em6eImrA6FQcxdrODYsGsusvfXmIT1loEJIieUg3HCM9QE0dUbxRW9WcX-f
Пульт универсальный ДУ для СПЛИТ-СИСТЕМ РАЗНОЙ МОДЕЛИ КТ-9018Е 4000in 1,750 ₽,1 отзыв,"17 мая доставит продавец КРОНШТЕЙНЫ,ПОДСТАВКИ,ТЕЛЕВИДЕНИЕ,ИНТЕРНЕТ",https://www.ozon.ru/product/pult-universalnyy-du-dlya-split-sistem-raznoy-modeli-kt-9018e-4000in-1-252848125/?asb=7xXSrb2JgR4BJHn4p5FIxh%252BFJTnmEcd%252B4bETCHmC5sA%253D&asb2=8e03ggIqXx37d9DqIZLSi6oPTtxzzkstqGYj_56HwlEPkx9TWfq-oSojeXF2uViz
