Уплотнитель для врезной мойки (рулон 2.4м),260 ₽,68 отзывов,"Завтра доставит Ozon, продавец Хозтоварчик",https://www.ozon.ru/product/uplotnitel-dlya-vreznoy-moyki-rulon-2-4m-323971554/?asb=5RNB9rxw4r5dii3WZ1VCa6MFrIBWR6uDeuLSJ4MidsA%253D&asb2=ic0PhIcDY4Sxtq61BRXQnuaOGJA5FEInZi4kedQNOmKXGVVlKQEQi01-UXveagP3
Мойка пластиковая для дачных умывальников (с выпуском),573 ₽,74 отзыва,"Завтра доставит Ozon, продавец MasterProf / MPF",https://www.ozon.ru/product/moyka-plastikovaya-dlya-dachnyh-umyvalnikov-s-vypuskom-227723225/?asb=23Fp7kPjdnHNCEgsccOLQBr%252FCJuCRx6%252FAgSEvxoEQes%253D&asb2=PCi2yaydsdT1eyYoo8yM3iVLGl73tVTZMtyo05WU-Gj2VXsy6eUVwXBXYmdPYrQW
"Кухонный органайзер со сливом для губки, угловой держатель для раковины, для мытья овощей и фруктов, сбора кухонных отходов на присоске,Vetta.",282 ₽,2 отзыва,"Завтра доставит Ozon, продавец Сияй",https://www.ozon.ru/product/kuhonnyy-organayzer-so-slivom-dlya-gubki-uglovoy-derzhatel-dlya-rakoviny-dlya-mytya-ovoshchey-508425399/?asb=I0Wf2LNq%252B3wT3Ijc9CqiCjoWwIKhCVSyRDE4nopg02z4vTPhyI3p92vN%252FY6DE8gJ&asb2=FjWe2kNkEiq3zvqbCiLmpl2De_MXNjoivuOwjrzqu5BAgutGRhYC4zmtmalvnfT6el7PA7OyqQ6aSCixkD2JmLYGP-VqIA-xluwxLOy4R6vRNBszzF4tJYMgcr9JhySdxt0a_f2nIy2fqMuzGph01Q
"Сетка для раковины, Коврик для раковины Able Goods, 14 см х 14 см, 1 шт",232 ₽,42 отзыва,"Завтра доставит Ozon, продавец aGoods",https://www.ozon.ru/product/setka-dlya-rakoviny-kovrik-dlya-rakoviny-able-goods-14-sm-h-14-sm-1-sht-262515205/?asb=Yrdrebygf3rCg%252BzfJTbK2f0o6VfGvUfwbR6IiSRjRWrMK1pmm5wXLXAsv7OR9n3A&asb2=Pg3Fk85AJf5cUBOg098Gn-7h0uqdR1pAhIr4V6iBDIjGd-8Ey-9xxHwDTnSFcxSS_dwPpe59lFiePtqahkhk3P4wm1OCBeHEIKCAH09bR6S6_8CSHgXP8n8SZHZFcE6mgJjuRESFXimIr4v7-fwCaA
"Коландер для мойки Frank Profi, 32 см х 22.5 см, 1 шт",894 ₽,1 отзыв,"12 мая доставит Ozon, продавец Бимарт",https://www.ozon.ru/product/kolander-dlya-moyki-frank-profi-32-sm-h-22-5-sm-1-sht-283635309/?asb=xJnhmSLI6VWlh2pWBiigWcIUH8H3bN0gIfmV%252Bm2589mLc2xRhFH1DR4oa9zr4Ymq&asb2=GRs4xP_HAYQt5rCA7XG0CsXIJRBdCdRs97RrIJjHbHjNJ1TbjmS5MMyFOtduAQFw0PyJeDZkUHgk5uWFumjI0TdJ5xNHyGY2h5ORNP-io5Fqueo3UsxooKJg-YCZxByMDMzVPiDumChUfzVOuhU1DA
"Кухонный органайзер со сливом для губки, угловой держатель для раковины, для мытья овощей, фруктов и сбора кухонных отходов на присоске Vetta.",290 ₽,3 отзыва,"Завтра доставит Ozon, продавец Сияй",https://www.ozon.ru/product/kuhonnyy-organayzer-so-slivom-dlya-gubki-uglovoy-derzhatel-dlya-rakoviny-dlya-mytya-ovoshchey-507659189/?asb=9J%252BJG03L43L%252BOiI89UnqdovomPdqWWG6thMhwgR9T25Dg0O5FkHssecyFiMhthrN&asb2=oLaungTH9c5yXle08dg-u5hlpbJRXP1PtvXnczDM-XKOm3gHcVNgF08y03zut5wTPWCZoFWQ41gCcTTa3datvWYc6Dn3gnW4yMnX-2d3O4iOo-T8W0E_CydH4Ur0niCi4kHDQLph8HD9R6LJwVbcZQ
Свеча/ свеча религиозная/ свеча церковная/ свеча ароматическая/ свеча восковая/ свеча для крещения/ свеча из пчелиного воска/ натуральная свеча/ свеча декоративная,210 ₽,66 отзывов,"Завтра доставит Ozon, продавец Медовые Свечи Сибири",https://www.ozon.ru/product/svecha-svecha-religioznaya-svecha-tserkovnaya-svecha-aromaticheskaya-svecha-voskovaya-svecha-238765118/?asb=HBmj00%252BDBzZQEFO%252FBb9NX2HJeJCHiO%252FScgpUPgtjJhlwKsB6gb4rs98hQHLC869f&asb2=kOdLkgg7WsX3ERNx7NAA6VBuxemJdvAqIfsWpln_EqQCpzItL5X4XxW3XxIKNfeZ5EtptOcLNH7YLw8JQJtzP9zFWzfF-P9-AlbvHAED6pzfbMiFYRXahUE12r8p57LwWQIfT_SnhLdKMvcSZur3Fg
Свеча религиозная для крещения из пчелиного воска,210 ₽,66 отзывов,"Завтра доставит Ozon, продавец Медовые Свечи Сибири",https://www.ozon.ru/product/svecha-religioznaya-dlya-kreshcheniya-iz-pchelinogo-voska-238765224/?asb=nm%252BAS2XT8S8JZK5jEYFD4Kn6IP%252B0D5xIce%252FJvBGMcYm6BpQqeAyBorZyRgVMQNMu&asb2=rAYQFh_E1W6tM19VcFx5IJK8caWZQKhRUtI2tpVMwQfeTptE0Kvz-DJuPCddd4pMoBm0VLAlp_nCnbTnODRt-4fZLneFbmMxmviCZ65KeqRBpRvc7tuTWAiPRByLc801mhMjPiuFo6iG4QA9sCSjMA
Набор для монтажа врезных моек CP-10-S (крепёж 10 шт. с уплотнительной лентой),640 ₽,3 отзыва,"9 мая доставит Ozon, продавец The Time Line",https://www.ozon.ru/product/nabor-dlya-montazha-vreznyh-moek-cp-10-s-krepezh-10-sht-s-uplotnitelnoy-lentoy-461826651/?asb=Ca3x8ouyge53ha8d6Ple9%252Fa2VSMNuVqmi4QMjxLdpj8%253D&asb2=8gbMv8WLrY_KaQLDBO9vbI3ghCB0Kem5KU6i2W6hrE5mFRQb-PXxbuAy9ga4VZ9h
"Умывальник-рукомойник Альтернатива Дачник, зеленый, 3 л",319 ₽,29 отзывов,"Завтра доставит Ozon, продавец Monblick",https://www.ozon.ru/product/umyvalnik-rukomoynik-alternativa-dachnik-zelenyy-3-l-180569578/?asb=x12TM4SKwowJyhce%252FKXLRD%252BpxRKCcgd1DjMvNGaCu7tm91q1J8GATOdUZlMF6AxI&asb2=CvLT-x2GU6CHuo8f2cPsrvMPysDfHTBhz-3eKW44CxhXlvFgekMo-GUqXcKaRjSvHo5n8P8Oxnsd-VeV2FqaF8pzxiT9UM80NNNkOivdjMfUcNpKEZCIp3gDYD1r_uz1uuMcxVzofILkI2QJSF5H7w
"Коврик для раковины, Коландер для мойки ProMarket, 30 см х 30 см, 1 шт",238 ₽,1 отзыв,"9 мая доставит Ozon, продавец PROmarket",https://www.ozon.ru/product/kovrik-dlya-rakoviny-kolander-dlya-moyki-promarket-30-sm-h-30-sm-1-sht-468428104/?asb=diiHHk1tj9SSxGlPP2hRcNWnc2Dw1X9bmH5wTs2IxHyre7JZpqkOXXe8bCublgiW&asb2=SHiWu2qc-rU94PuAN2Hc2WnqqBvn6E_0xS3ixAIxmPgrmOU6EENFtAW_FS0JwbRCqpWrJNU6ztbi3QCcgqOTpl9O2Nmg3DCEg5uSl_9K6eceJJcDkPmGjhc0j-jbfrqOOu-POZRsoD5v-Os1fiEWbg
"Органайзер для раковины на кухню / Телескопическая полка для раковины / Держатель, сушилка для губки, щёток и моющих средств на мойку Цв.Розовый",400 ₽,5 отзывов,"8 мая доставит Ozon, продавец Ve-day",https://www.ozon.ru/product/organayzer-dlya-rakoviny-na-kuhnyu-teleskopicheskaya-polka-dlya-rakoviny-derzhatel-sushilka-496844740/?asb=p1Z9AW0rQCHyjMSeP6e8hhqb%252BMJVnqA90hpLylY3Xuu4Fhe8Y4JUAp6Jq5T9Me4%252B&asb2=-2Iw2fphU8zz2gcJSbpUvxC3ZG7BBG4sQgw6YHVEc2Q6TjPqB0Y3rtVWcczMcrpx4TtQL3QyWU5sfUtN1Ljt-GqbknxOQoHuFQ0vbpXeHNrnfX6_6VTtIPYHnsp-WZ49Hf9zxP5lODrZwMSUgrrpiQ
"Коландер для мойки, Сетка для раковины, 2 шт",970 ₽,1 отзыв,"12 мая доставит Ozon, продавец Андромеда",https://www.ozon.ru/product/kolander-dlya-moyki-setka-dlya-rakoviny-2-sht-300872575/?asb=s3cavz2Rem6UJG7lNRcn8OULXLtwe3htLwv1JLG2KMOjAKRlOeAyOc6rJrt3CHjz&asb2=lOsoJTydm9CTBm7m0Lbr2ZMJcFeGI90KsDugrh05Xp5luua-173XPOR78AC-BoSGDIz6qoxXvqDGjxrjxH7ZsL88r5tUEuKTuPhjYnYauw0aYLjPxmy0oT9MZk4Hjr0GYTasG0Tcj8QkGXqsss6kOg
"Умывальник универсальный, 9 л",716 ₽,2 отзыва,"10 мая доставит Ozon, продавец Robo Sale",https://www.ozon.ru/product/umyvalnik-universalnyy-9-l-271348822/?asb=YgFa34lMEBd2%252BjZobbZKtH8R7nGhohiSRi%252FQnt3p%252FXBot40u5B%252BfOB2qMA%252BSmfYv&asb2=j4nxjXtX0VtC8EDHeW1eXiUNEn6_g1_8VNyI68RftaNGZ4nQMTGFF1Kb1-KzSXp5CKmNy4g4xsL7meiGBtGMyHo_UcQQcbGidA5HDDEBdpfRmPESRNofXTNfMp2FMcmtmhbdMIFZqtzuSCnEQM2dgQ
"Коландер для мойки Franke, 41 см х 18.2 см, 1 шт",712 ₽,1 отзыв,"9 мая доставит Ozon, продавец Arsenal-BT",https://www.ozon.ru/product/kolander-dlya-moyki-franke-41-sm-h-18-2-sm-1-sht-409998205/?asb=vLoyhiyI755vmTPmQfzXfxBsIlhu7t%252B%252BimJ0YFnazaewazgQVSZfrPFdHlQFh5xM&asb2=6TUYT7J5DNniy0nrODfWnCZcEZPPMFR-Wxn18muZm2ZpLlrHEWKMJ6oQGomWzCoeRd8gLUfRNi1tLXhSwhM9advWMoushLd7khmgUnRpd_3cBNCFT2No8LolAtHOk0Ek7wecF4B-v7Tg0-WqbFavOA
"Коландер для мойки ONE STORE, 4 см х 4 см, 2 шт",303 ₽,3 отзыва,"10 мая доставит Ozon, продавец Wave",https://www.ozon.ru/product/kolander-dlya-moyki-one-store-4-sm-h-4-sm-2-sht-230868469/?asb=sn0JQCPuGNpaTCqhWbDjny0eWpEQggPHHroGnvtkE55gRJDgX724ABDQnkN5eMGY&asb2=rXwIIwpxchIVZ5Ztw-tRs6g0BkN33PaN3Nn7GSXY_oPyEbdJ1cuSyKpT-BevyXs5SwpUCWqEvYQU9aQibiHW5clikd2UhP1LRrPGWdWLoP5j00BY38CIh-NcWDMDNrHI0iixfglqbrecMjtA5ilw0w
"Сетка для раковины, Коландер для мойки HM STARх 8 см, 4 шт",415 ₽,2 отзыва,"9 мая доставит Ozon, продавец Магазин ""Товары для дома и семьи""",https://www.ozon.ru/product/setka-dlya-rakoviny-kolander-dlya-moyki-hm-starh-8-sm-4-sht-395708886/?asb=H9w1nqXEvnaU3TBVIQ06n7zCpdPYsPD7%252BovxXgq8adLpEW6AkuZwL7t1bL8QOhyt&asb2=vY1kcM1nuaeaOdsRv3WA5XC6t3Av5ALxTN6erAwDdiuDQnUamTQC-lnY3GqgfRIk1oXkBhkUbElgt9_Aa7jVSmMGF835BPBdd9bBOzTfjWCi_jBvzzXQE_oHs1zGlcrScj8ZSRS4w01-r7DSEQHJQA
"Коврик для раковины, Коландер для мойки, 28 см х 28 см, 1 шт",289 ₽,2 отзыва,"8 мая доставит Ozon, продавец Точка товара",https://www.ozon.ru/product/kovrik-dlya-rakoviny-kolander-dlya-moyki-28-sm-h-28-sm-1-sht-370087752/?asb=JMOsSMp%252BRRkcyaPrY51OiyJfteA89pwNkeer0mGa9X4%253D&asb2=AEhJj2D4VuD6O-n0ur5hU-roQeeG3cfh8APnnkJExVl7oIX0cDkzCUgs2bkSzc21
"Коландер для мойки Franke, 41 см х 18 см, 1 шт",966 ₽,1 отзыв,"9 мая доставит Ozon, продавец Arsenal-BT",https://www.ozon.ru/product/kolander-dlya-moyki-franke-41-sm-h-18-sm-1-sht-409998131/?asb=hPwgEWRPIV%252Bm9j%252FPuDs3CGUm5OnbVHWMryLSo3HX8q4%253D&asb2=k5v2XE56CixRtHffHzv6GPmLjsu6j-2n1bfUuT8lfgci14rybv__wU9kLJCmu3GGArajEbYZ6hKH5UL7S0IIMw
"Органайзер для раковины на кухню / Телескопическая полка для раковины / Держатель подвесной, сушилка для губки, щёток и моющих средств на мойку / Цв.Серый",390 ₽,5 отзывов,null,https://www.ozon.ru/product/organayzer-dlya-rakoviny-na-kuhnyu-teleskopicheskaya-polka-dlya-rakoviny-derzhatel-479628979/?asb=Wz7X0RdLRAhAmOv0CDIKdesmJpZaetxcLK5STxNOGi1rspuqBZuQDi9T8hfnQnJH&asb2=9cHETUuos1M3cNuZjxTI6kLHbCjtlFKCb5--a7rm_ay0aexakdoSgbtLK6dbvKvgHTKUf8b1MjPgCl_IYrIPFwEWRcieLoDsr_Gp4EFh5xET2FHolpipGHNdb68ZryDxymfhmpPA9jw8zV1bd4h8lg
"Органайзер для раковины на кухню / Телескопическая полка для раковины / Держатель подвесной, сушилка для губки, щёток и моющих средств на мойку / Цв.Синий",390 ₽,5 отзывов,null,https://www.ozon.ru/product/organayzer-dlya-rakoviny-na-kuhnyu-teleskopicheskaya-polka-dlya-rakoviny-derzhatel-502623307/?asb=zqU7udbOg1KQqtBctlkuQhCrxn0oqn%252FM8BNkY%252FICtxo%253D&asb2=-KNB9hw2gWfCv25kGGUFjuEEKltuyyxcLOzZuc8g9fkC_J7sda6iSfxQO9hI_BjtHrywsUSUsvJVbqwLHzdb8Q
