Наполнитель для кошачьего туалета 15 кг (45л) For Your Pet Впитывающий Премиум Белый,779 ₽,9 отзывов,"Завтра доставит Ozon, продавец Aleynikov&co",https://www.ozon.ru/product/napolnitel-dlya-koshachego-tualeta-15-kg-45l-for-your-pet-vpityvayushchiy-premium-belyy-561832054/?advert=OkuZzV6lgjs_18EvmhNjlTkEY1HD8ztP3siklpeGKmiQDwCbYSVGZW0WpulPcPcW6gYPFI29i--Fa2zCw23dpn53FeZMfDGY4BtTv01pO5hEHkCohv_jnkOj1on_7vxfFR5NuUAey_Ummid_vU16G8d39A3rIa7E1lkL2yhuqi47moGf1hWoClB6ViSntI23bHAZkEo9ep5hofDD5RG7_dLLVHX4CrLmv7b8h036ild_nBSWMZqNCMdINky4AuFxvtRNiucJC5WGLmO3bPL1nRhwC3olAEsxLZ-QeBpi7CwKH8uf9SyW-qUQSIjQSO_dUQAuhFfZKQ9D4lF21o8Yw3jCP9zQ3feCXGxGYaGId9i1VIIKjf8z3qYqZT80V19ROSfiMI9gYIqElfBq20cHh_nSRAjcrVzskMqv-W81tkQUKLm3wcs4ANXQw2TDo-92-gOh66lSIRiDhh7CSZRJiAp4d91DDswn4bB9I1k_yQARnaVt1hoYcEYoHfQ_Xo-sxAmtCKhpCJNimLsnDQhX15zZDgZhlBMBXFhcYOXCK-tJFY04TtB3fPN6XlY7eaQP
"Наполнитель растительный комкующийся TOFU Зеленый Чай, смываемый в унитаз, растворимый, 4,54 л",678 ₽,87 отзывов,"Завтра доставит Ozon, продавец Jutegood",https://www.ozon.ru/product/napolnitel-rastitelnyy-komkuyushchiysya-tofu-zelenyy-chay-smyvaemyy-v-unitaz-eko-rastvorimyy-480264947/?asb=O%252BCxVO4i48EWHXiowffOgFIco5641Y7S3QyfYmvw%252B7E%253D&asb2=gTkFxfv2O7q_fdKJE3c4oCtcwjMpUjU_2cY1zRosy1lUlapLIHBrtGXmwnXS_pp4
"Ванночка для попугаев и других птиц ""Листочек"" (18х9х4 см)",250 ₽,87 отзывов,"Завтра доставит Ozon, продавец esMonde",https://www.ozon.ru/product/vannochka-dlya-popugaev-i-drugih-ptits-listochek-18h9h4-sm-178362818/?asb=rIED47HTy4y%252FIwI87MHzwLC2f9c7hwpjB6YgTT%252F9EX0%253D&asb2=HXu799EBNJNVTxA3lDfsgTzOB_F7xAv5MLD4ke_ZczBU-d0MzLFSAug8CZOj85nI
"Бумажный наполнитель для клетки, подстилка для грызунов, хомяков, кроликов, крыс, мышей, ежей, птиц, мелких животных, натуральный, белый",350 ₽,70 отзывов,"Завтра доставит Ozon, продавец PAKADO",https://www.ozon.ru/product/bumazhnyy-napolnitel-dlya-kletki-podstilka-dlya-gryzunov-homyakov-krolikov-krys-myshey-ezhey-ptits-519073743/?asb=Ti9VMGSktlwk6u333apggegQLmV6d8Nx9rVRXwPpMk0%253D&asb2=tCqqMUdoW-u5Hu9utwghe-NpZm-dR8zdm5bH1axjnh5ropMkTy6ZJW1jg07S9l3O
"Наполнитель для кошачьих туалетов комкующийся Барсик TOFU Кукуруза, смываемый в унитаз, с нежным кукурузным ароматом, для кошек, собак и грызунов, 4,54 л",650 ₽,87 отзывов,"Завтра доставит Ozon, продавец Jutegood",https://www.ozon.ru/product/napolnitel-dlya-koshachih-tualetov-komkuyushchiysya-barsik-tofu-kukuruza-smyvaemyy-v-unitaz-560306958/?asb=JTcZmMnCpFU%252BQkUo1h%252BE%252BKaGr5MNibl4RE7jT9J32EDUcLFogSXS4gGZRPup1mg%252F&asb2=V0Mgko46tuwg2BPQSE4CyFJMiLakFShYySFNAvsFYp4pvIRBP3Ep35XYtVvNsv52ZPUhaqngUZFUy8vsxY7qPIlnecT4mMXrWT0G-PVpjWqeiN6xAnR4_Ncbk93dzK0444xp_XlzUXcMHfzw-Bwzww
"Наполнитель для кошачьего туалета ""ЭКОНАП"" древесный 15 кг. (Наполнитель для кошачьего туалета древесный, Кошачий наполнитель, Древесный наполнитель для кошачьего туалета, Древесный наполнитель, Наполнитель древесный, Наполнитель древесный для кошек)",790 ₽,2 отзыва,"Завтра доставит Ozon, продавец ЭкоНап",https://www.ozon.ru/product/napolnitel-dlya-koshachego-tualeta-ekonap-drevesnyy-15-kg-napolnitel-dlya-koshachego-tualeta-555517368/?asb=Wzyx%252F8fM9%252FtXoDnccl2iMOhcgxtKbFdb4%252FpPCWS%252BUQQcQL%252BGlypnRY2HYrXzx0%252B7&asb2=6TBlrk0tT14sim4k9oBL-SS0eLY12U3-ZeramcBhMcqysxRsAvwUquHiA-MvpJKOhtXkQYVN_QRmY4pmUurkuiVIbpKxWKp1uFSKXx2MJ4uBt8UlTxvdX21TgX8j3sKnu1xreLbDzjalV8YB8V61gQ
"Купалка для птиц, 145*136*140, светло-зелёный перламутр",280 ₽,6 отзывов,"14 мая доставит Ozon, продавец Сима-Урал",https://www.ozon.ru/product/kupalka-dlya-ptits-145-136-140-svetlo-zelenyy-perlamutr-491293017/?asb=EmL8220f4y79LFmqKvKWf7g8yyqiYcB5BRXh5sCvj74%253D&asb2=jpQ3jtejFQuNUxAHdm4S5ExwqSLeRlnhlVOeAcqdY4RuGENkolxllelrXx8SL-8Y
"Опилки, 1.5 кг",399 ₽,54 отзыва,"Завтра доставит Ozon, продавец VEHI",https://www.ozon.ru/product/opilki-1-5-kg-224945775/?asb=Maeuv6fOdqvk6YEB2jaaq%252BhT9P06qqrdgXQGoTEXHb4%253D&asb2=or4uWbSVO5GpCj_CQRbN5TGYAAJ_AZp0-GqZGM9w7dy8VLx4NyRWyMi9wv8e2f8f
"Стружка Сибирского Кедра крупной фракции для грызунов, птиц. Наполнитель на основе древесной стружки Сибирского Кедра, 500г.",305 ₽,1 отзыв,"Завтра доставит Ozon, продавец ХЭМиКо",https://www.ozon.ru/product/struzhka-sibirskogo-kedra-krupnoy-fraktsii-dlya-gryzunov-ptits-napolnitel-na-osnove-drevesnoy-498293577/?asb=iW%252F0dNCYJGlr23f6dca%252BkbycbI1FHzQ%252BbYLx94gL9Cg%253D&asb2=_JwSheyPD1NBrvO-OO3mexj2LvTu9MgJcycGxasfsoa2LE1xl-4laFSnUSvNLLZW
"Кукурузный наполнитель ""Золотой кот"" для туалета домашних животных, грызунов, кроликов, кошек 2 х 4 л",769 ₽,60 отзывов,"13 мая доставит Ozon, продавец BeHome",https://www.ozon.ru/product/kukuruznyy-napolnitel-zolotoy-kot-dlya-tualeta-domashnih-zhivotnyh-gryzunov-krolikov-koshek-2-h-4-l-198269711/?asb=AYGynuKk3c8j0%252BGcsLuE3vFZhnVVsLS476hCpFPrV9j27uO8s%252FOgf6IjcsqUdp2h&asb2=tb-k3q9LKZlEemHxmTBjIT03P5JlMQCJcLINY7q3CoAJo3zdBUD0vapO8hYHopKIjVeOSdE4jWqzevDRFRStJfG6EWhU4pjejlMiRV_yc52jd54KyUCohlJ9Fota3Axc5ZkqIL254X43DMauGRbpXQ
"Наполнитель для кошачьего туалета,древесный,впитывающий 10кг",568 ₽,5 отзывов,"11 мая доставит Ozon, продавец EvaDa",https://www.ozon.ru/product/napolnitel-dlya-koshachego-tualeta-drevesnyy-vpityvayushchiy-10kg-521416724/?asb=aoFwVMi61pHg3zRyn4FLPOBwf%252BJveeUmiMDG2Zw%252F1rI%253D&asb2=_ABSwrfPTtA4DvnVwSvwSIalNmoZW68j8qtTsU05s29O0SExN9Mr-ioMv7t_wQlLoOv-0uM9Li9FzG1rw4wuozyoU9ueC_SJDGzX3eS3W-ibuAHnijr3613Zc6_km84T
опилки древесные,248 ₽,26 отзывов,"9 мая доставит Ozon, продавец лапи лапи",https://www.ozon.ru/product/opilki-drevesnye-302073107/?asb=RIuq%252FKZPARICS27O%252Bfa%252BQCvfAGwdVAxXaIWQI8o1HAIKbKlmk95Vy%252BfDeHlF%252F96r&asb2=JtdGMHelzSCX2yaqRBvpFMFoBGCZ9J49Mb8UdgRx7OV_A5G13OucVKpAVBWCtH_KcdVj3KhrpWx_W68HrImq5Z_hxmDJj6flmLL7QM1tVHixBc6uAR_9ceUR7V4sXMjhxpWGGclVWz_v3m8UKRQbWw
"Опилки отборные для грызунов, птиц и земноводных",155 ₽,93 отзыва,"8 мая доставит Ozon, продавец ООО ""КиттиКэт""",https://www.ozon.ru/product/opilki-otbornye-dlya-gryzunov-ptits-i-zemnovodnyh-285547131/?asb=dzkFhR8fbozSuqFobi%252FMx1myrmUU0lj55AYbJU%252Fua3E%253D&asb2=lwQq6D5BaHmQ_acSnZ0z1myp5Zjcnvr6MMQc3YldVjnOgmChrc6on75_OnMsi6DR
"Песок кварцевый НАТУРАЛЬНЫЙ, фракционный 0,3-1,0мм 1,5кг",236 ₽,1 отзыв,"14 мая доставит Ozon, продавец OVERMARKET",https://www.ozon.ru/product/pesok-kvartsevyy-naturalnyy-fraktsionnyy-0-3-1-0mm-1-5kg-323721586/?asb=ega0pR3qj44t8xOtP4mpSO1HRNm8%252FdtuybRtruyqbjE%253D&asb2=6wO0Gbc44rwhBl-HG2fcUAQWFwgcoA-sGwmw8VuS9_SucXPFYqEuFRfLku0RGyNp
"AromatiPet древесный наполнитель для грызунов и птиц2,5л./1,5кг",260 ₽,3 отзыва,"14 мая доставит Ozon, продавец Новый исток",https://www.ozon.ru/product/aromatipet-drevesnyy-napolnitel-dlya-gryzunov-i-ptits2-5l-1-5kg-307671514/?asb=vZF3qMv68n3Iv6fnSYBny14v0bXLw8ZCNkjSk2iMEZ8%253D&asb2=ggsue9DLTrFy3XEwvn39AXFcEoAV8IsdqKJpMb1Q96ekcm5JAXAaDZuHUjxh3p-s
Стружка осиновая для домашних питомцев 1 шт. 550гр,219 ₽,2 отзыва,"Завтра доставит Ozon, продавец Aspen World",https://www.ozon.ru/product/struzhka-osinovaya-dlya-domashnih-pitomtsev-1-sht-550gr-492259638/?asb=Y4zeXqN9MQZrEhYrsSROOWsTLkoWwxYUMp1r5Koacs0%253D&asb2=OfbmAswMOtZssr3qQKbnt0LJSkf_j23fU3EutQJCQLWWdqI1E5JN5kCSSg1HdxVM
