Кушон - тональный крем с экстрактом авокадо ZOZU,348 ₽,185 отзывов,"Завтра доставит Ozon, продавец HomeKnife",https://www.ozon.ru/product/kushon-tonalnyy-krem-s-ekstraktom-avokado-zozu-544573694/?asb2=CWwdqQJH6gemjiIRJPoS63DpmLP8JUEwGM5k44418lt3M8HnLXmslPyJFy_qtjhj0l7-abPsviHbr6y-e-IDBw
Тональный крем для лица кушон Zozu с экстрактом авокадо BB крем,300 ₽,61 отзыв,"Завтра доставит Ozon, продавец Лимбо",https://www.ozon.ru/product/tonalnyy-krem-dlya-litsa-kushon-zozu-s-ekstraktom-avokado-bb-krem-554996283/?asb2=mcuKgYrJjtsdo1UTPvD2j373j35p8LGEEmzDVyN7wUCs_NQas1Zmqxt4bdglVlZ5
Lapuella/Корректор / Консилер для лица и глаз / Консилер для глаз / Корректор для глаз,224 ₽,57 отзывов,"Завтра доставит Ozon, продавец Lapuella",https://www.ozon.ru/product/lapuella-korrektor-konsiler-dlya-litsa-i-glaz-konsiler-dlya-glaz-korrektor-dlya-glaz-531847204/?asb2=nSXne8LJmU7PIUxF_JqPUgVe_5g7Zu0eOwRlZc5G_-kKQzidPeb1-P01UapmaysDhiS7X4xZpJ4KFJmOdARnvQ
/ Консилер для лица и глаз / Консилер для глаз / Корректор для глаз,198 ₽,1 отзыв,"Послезавтра доставит Ozon, продавец MISS LIRENN",https://www.ozon.ru/product/konsiler-dlya-litsa-i-glaz-konsiler-dlya-glaz-korrektor-dlya-glaz-547474886/?asb2=XtrQStGWAPTmx1QzaKMCj64f5vLYWjBeTwuHpk1qGDS26krY8BzttgNPFv0lFxCy
TLM Тональный крем TLM Foundation Color Changing,355 ₽,34 отзыва,"9 мая доставит Ozon, продавец bio kos",https://www.ozon.ru/product/tlm-tonalnyy-krem-tlm-foundation-color-changing-519310758/?asb2=NA-qi0EcrZ9JV5QjVOM6yj24EuASoFEY0BkE_wOEPcQrGZgkPa_-0SGQG_xH__Kh
Стик для контуринга BELL MY EVERYDAY CONTOUR STICK тон 01,322 ₽,132 отзыва,"Завтра доставит Ozon, продавец сеть ""Подружка""",https://www.ozon.ru/product/stik-dlya-konturinga-bell-my-everyday-contour-stick-ton-01-294129387/?asb2=H_lktPFG70FfjxvfYi74MGPFJ0b1EM8MkU4Vk-9xXrXBTtE1nWdUY1aMfukVqSPd
Compliment Гиалуроновый спрей для лица фиксатор макияжа увлажняющий 110 мл,192 ₽,170 отзывов,"Завтра доставит Ozon, продавец Аквакосметика",https://www.ozon.ru/product/compliment-gialuronovyy-sprey-dlya-litsa-fiksator-makiyazha-uvlazhnyayushchiy-110-ml-249170007/?asb2=UQiL5bGpujLl9wPi-vmyPhwpBwhLz3KABbWTs0lYPlswbxRERJM-7tEI5qG2wU5l
Enough Увлажняющий тональный крем с коллагеном Collagen Moisture Foundation SPF 15 tone 13,359 ₽,10 отзывов,"Послезавтра доставит Ozon, продавец SUDAIS",https://www.ozon.ru/product/enough-uvlazhnyayushchiy-tonalnyy-krem-s-kollagenom-collagen-moisture-foundation-spf-15-tone-13-473478678/?asb2=lbfCZZCiKSmMn5SBodMj3AtYkuuL-IMWkiEEZ-IQ7HonCc3CTALoxStjJQkeQxnN
"MATSESTA Натуральный минеральный BB-крем с зеленым чаем, тонирующий корректор, увлажняющий и выравнивающий тон лица, с антивозрастным и солнцезащитным эффектом, защита от солнца и УФ лучей, против морщин, SPF 30+, 50 мл",460 ₽,149 отзывов,"Завтра доставит Ozon, продавец Натуральная косметика из Сочи",https://www.ozon.ru/product/matsesta-naturalnyy-mnogofunktsionalnyy-bb-krem-s-zelenym-chaem-toniruyushchiy-korrektor-188923300/?asb2=EpF8p5GZLEYuc1oHAAQXeg6117z0oVFe5S2416-fJl6HtYGDDWg-xDpv4EIaSMVjehQCJlajyzid5tWhdOvs2Q
Белита BB-крем для лица photoshop эффект универсальный тон BELITA YOUNG 30 мл,246 ₽,5 отзывов,"9 мая доставит Ozon, продавец Milabela",https://www.ozon.ru/product/belita-bb-krem-dlya-litsa-photoshop-effekt-universalnyy-ton-belita-young-30-ml-550923599/?asb2=OmdXoinKHGbZGMKK83Ou3IzwwTzAO-Akt7mTvaK0ZyLozB8s8YgPR8Z5tiCocXkz
Стик для контуринга BELL MY EVERYDAY CONTOUR STICK тон 02,322 ₽,132 отзыва,"Завтра доставит Ozon, продавец сеть ""Подружка""",https://www.ozon.ru/product/stik-dlya-konturinga-bell-my-everyday-contour-stick-ton-02-294103992/?asb2=f-RY6lz5Oo13VGMmCo8RlvCoH2SO8xKygMMnIfP1CG2Pi8XcOBXXg34Yz--nBjla
Стойкий тональный BB-крем,118 ₽,21 отзыв,"10 мая доставит Ozon, продавец LovelinessStore",https://www.ozon.ru/product/stoykiy-tonalnyy-bb-krem-348102732/?asb2=k_z4psbeqL3x9I35s2ZgkNrfvzElsaGD58N2aAEr_1FyHlpHGbcPd0m8kU93qCpN
Estrade Палетка для стробинга PICASSO тон 502 (холодная),522 ₽,29 отзывов,"Завтра доставит Ozon, продавец ООО ""«ХЕДЕРА»""",https://www.ozon.ru/product/estrade-paletka-dlya-strobinga-picasso-ton-502-holodnaya-513267622/?asb2=FUH5RelGtZWij-0n0Lj2EIZ-RnenhZguAL9rYokG2pA-bjrduNGupN-eTCC13gFU
ZOZU Кушон - тональный крем с экстрактом авокадо / ВВ крем со спонжем,329 ₽,3 отзыва,"Завтра доставит Ozon, продавец ИП РЫЖОВ",https://www.ozon.ru/product/zozu-kushon-tonalnyy-krem-s-ekstraktom-avokado-vv-krem-so-sponzhem-552574769/?asb2=JdP3dHKbBMyMapk3heoUGO4_nA3MLcrWHfmoQUDyGM6QgQWgJzU8F0Y4H7KmuiA1
Основа под макияж / База под макияж трёхцветная / Косметика женская для макияжа / Выравнивающая основа под макияж,269 ₽,6 отзывов,"Завтра доставит Ozon, продавец Seller",https://www.ozon.ru/product/osnova-pod-makiyazh-baza-pod-makiyazh-trehtsvetnaya-kosmetika-zhenskaya-dlya-makiyazha-537624837/?asb2=51RKNdXW5lihrWnnDQLSe0-CSy5o0oE0tTQlQkvyLm-2nosFnxl6cO0DMZS7Sdw0
Консилер для лица и глаз/Корректор/Кушон,238 ₽,41 отзыв,"10 мая доставит Ozon, продавец Cosmosbeauty",https://www.ozon.ru/product/konsiler-dlya-litsa-i-glaz-korrektor-kushon-515460779/?asb2=Wy3w1HXvQ0rffkrdvS5n1k8nx6Xe726jETJz2c6o2B1cP8S4fJR6B5lFvk5QkYgUE_-lqGNDDSiOTX8VSkbs2Q
LIBREDERM Гиалуроновый ВВ крем ALL in ONE 50 мл,518 ₽,173 отзыва,"Завтра доставит Ozon, продавец ООО «БИОФАРМРУС»",https://www.ozon.ru/product/librederm-gialuronovyy-vv-krem-all-in-one-50-ml-306604752/?asb2=98c-SqScYjWQ-2WNw5tTy73LaKnbAIe7F_K7EdhJh8vGA-aIyYVANaLgKh9KdBrH
Relouis Румяна для лица PRO Blush компактные тон 73 Juicy Peach,334 ₽,163 отзыва,"Завтра доставит Ozon, продавец ИП Лукьянов А.С.",https://www.ozon.ru/product/relouis-rumyana-kompaktnye-relouis-pro-blush-ton-73-juicy-peach-179059513/?asb2=ATr8T7CqEdfN2cw7o-EeAMfn9BlXo4PyeAp-ZdPPb7zX0xltF7_NwME5boqwK6uK
LN PRO Жидкие румяна для лица Liquid Blush Cheek & Lip Color тон 101,266 ₽,24 отзыва,"Завтра доставит Ozon, продавец Lamel Professional",https://www.ozon.ru/product/ln-pro-zhidkie-rumyana-dlya-litsa-liquid-blush-cheek-lip-color-ton-101-300614261/?asb2=27YTirLXV3f4-WAeB4Kd4Yn43vCKmIi7AUU2SZjVApYWo3Noq2Z_Lmp9TcL7sbG6
"Eveline Base Full Hd База под макияж выравнивающее-матирующая 3 в 1, 30 мл",222 ₽,105 отзывов,"Завтра доставит Ozon, продавец ЭВА COSMETICS",https://www.ozon.ru/product/eveline-base-full-hd-baza-pod-makiyazh-vyravnivayushchee-matiruyushchaya-3-v-1-30-ml-293793787/?asb2=C8J_HBLjIbzdUUBU0gdzY2c1D3_DDLwbyTFtgE5dvFL9BLTEiROa9Y7ByXP1ctwD
Кушон Авакадо / Кушон для лица/ кушон крем / тональный крем для лица/кушон тональный,299 ₽,18 отзывов,"9 мая доставит Ozon, продавец bio kos",https://www.ozon.ru/product/kushon-avakado-kushon-dlya-litsa-kushon-krem-tonalnyy-krem-dlya-litsa-kushon-tonalnyy-499112897/?asb2=AEOHk2b-FsogeJ1LnBMogt7TskORbFGIJE-6mGVp8vJ470jquT7fAMTsywe6CmNz
"Jomtam isolation three color grooming Выравнивающая база под макияж 3в1, 40 г",269 ₽,56 отзывов,"9 мая доставит Ozon, продавец R&COS shop",https://www.ozon.ru/product/jomtam-isolation-three-color-grooming-vyravnivayushchaya-baza-pod-makiyazh-3v1-40-g-335774389/?asb2=lNsMUrzK8YIatArG4uuah_7Ydp220BL5xjO9GG7m5UkDz8OS7bqOoo14_U-ACDCY
Минеральная пудра для лица ROREC NO-SEBUM Mineral Powder / Пудра для фиксации макияжа / Прозрачная бесцветная пудра порошок / Матирующая пудра для макияжа / Рассыпчатая пудра / Пудра от жирного блеска / Декоративная косметика / Освежающая пудра / Пудра,318 ₽,98 отзывов,"Послезавтра доставит Ozon, продавец FFStore",https://www.ozon.ru/product/mineralnaya-pudra-dlya-litsa-rorec-no-sebum-mineral-powder-pudra-dlya-fiksatsii-353594234/?asb2=8NhADXmejjK0FzShYaY2T_A2-OvXF1I_BeWC1aorSlFmYjwwWyHzsDXGId1baaSVbidxmN_1aeIgv9Bifi_Xlw
"EVELINE Инновационная жидкая тональная основа LIQUID CONTROL №005 - IVORY, 32мл",450 ₽,73 отзыва,"Завтра доставит Ozon, продавец ЭВА COSMETICS",https://www.ozon.ru/product/eveline-innovatsionnaya-zhidkaya-tonalnaya-osnova-liquid-control-005-ivory-32ml-293870403/?asb2=K_YdJs-tBLzhyDEFeShBE6cI_5Zt7HKP6saZOm1QJmfkyZnhjXQb76aCJ5Jq35O9
"Eveline Cosmetics Тональный крем ART make-up professional 3в1, Светло-бежевый, 30 мл",211 ₽,100 отзывов,"Завтра доставит Ozon, продавец ООО ""К.М. КОСМЕТИК""",https://www.ozon.ru/product/eveline-cosmetics-tonalnyy-krem-art-make-up-professional-3v1-svetlo-bezhevyy-30-ml-310007834/?asb2=f98qc8wbTm7gb5qUCY0KxausdW_d17lbD9jlYX7ghnK53H1zWwdsI5B0XQx36xmr9qude30pNlHQtqevdN8RKw
"Eveline Cosmetics CASHEMIRE EFFECT Тональный крем, Слоновая кость 40 мл",152 ₽,6 отзывов,"Завтра доставит Ozon, продавец ЭВА COSMETICS",https://www.ozon.ru/product/eveline-cashemire-effect-tonalnyy-krem-slonovaya-kost-40-ml-218918423/?asb2=OEhkZvzmOgNQ0x0a9rnorNZwe4xd1rnzRUIawiNcUQaBHD9oblgE4H1XLwEhvj0e
JOMTAM Основа под макияж / Кушон для лица / Тональный крем / Праймер для лица 3в1 / Корейская косметика,278 ₽,134 отзыва,"Завтра доставит Ozon, продавец Green Cosmetics",https://www.ozon.ru/product/jomtam-osnova-pod-makiyazh-kushon-dlya-litsa-tonalnyy-krem-praymer-dlya-litsa-3v1-488414697/?asb2=T0wJ-pGyIFlU5cUs6lz-Mi9WRpXXqeF2SPPhItrewpk4rNM5rMuGOPtvr0_zt6zqGy2EMou-r9oxWy4uShNblw
"EVELINE Тональный крем 3в1 BOTANIC EXPERT матирующий антибактериальный №01 - PORCELAIN, 30 мл",189 ₽,1 отзыв,"Завтра доставит Ozon, продавец ЭВА COSMETICS",https://www.ozon.ru/product/eveline-tonalnyy-krem-3v1-botanic-expert-matiruyushchiy-antibakterialnyy-01-porcelain-30-ml-564434257/?asb2=UeeEikHEo2kmye0XxtIZBMmIL61m8vZufaYX4yYRKyAF67GjY6soJsCEgod9M9SQ
"Eveline Cosmetics WONDER MATCH Консилер кремовый с гиалуроновой кислотой и амазонской глиной №05 LIGHT PORCELAIN, 7мл",240 ₽,27 отзывов,"Послезавтра доставит Ozon, продавец ЭВА COSMETICS",https://www.ozon.ru/product/eveline-cosmetics-wonder-match-konsiler-kremovyy-s-gialuronovoy-kislotoy-i-amazonskoy-glinoy-469104571/?asb2=rjlQk5hJAcQp_XqcykqHqFGHJR6B9L-tu-uGgzYHe82MwNp9jPSqqVC4fTNCz84R
"Bibity Bobity / Набор Глиттеров/блесток для глаз и лица ""Rocky+RiRi"" / 5мл*2",350 ₽,42 отзыва,"Завтра доставит Ozon, продавец Bibity Bobity",https://www.ozon.ru/product/bibity-bobity-nabor-glitterov-blestok-dlya-glaz-i-litsa-rocky-riri-5ml-2-492592306/?asb2=7roQTjhzHo3oZrNB7ztMh3G3BBSaW0ZakUqAu1UwywJFi1TzrpcfeEwluWNpymgNQ2JxKMQXcb7cG8TUlMKP7g
"Jomtam isolation three color grooming Выравнивающая база под макияж 3в1, 40 г",380 ₽,3 отзыва,"9 мая доставит Ozon, продавец Commons",https://www.ozon.ru/product/jomtam-isolation-three-color-grooming-vyravnivayushchaya-baza-pod-makiyazh-3v1-40-g-495253887/?asb2=4NaFGJkqV3hSu1u9c1EFEKm_AdjgCL4hNaAHhFaR_Z3_0aQVMsKDSA-I386ObnIP
"ZOZU Тональный крем Кушон с экстрактом Авокадо 3 в 1 для лица / Увлажняющий BB крем пудра со спонжем для лица водостойкий / Корейская косметика / Тональная основа / Красота и здоровье / Подарочный набор косметики для девушки, Средства для макияжа",308 ₽,30 отзывов,"Завтра доставит Ozon, продавец Delivery Sale",https://www.ozon.ru/product/kushon-zozu-s-ekstraktom-avokado-3-v-1-dlya-litsa-original-uvlazhnyayushchiy-bb-krem-pudra-so-488431590/?asb2=1RDgtrQkSgDUgDb6ZrhB5lGAlGF88pTWRSqdoLPOLDOVwDUt2k33DbR4QKSIQVBS
"HOLIKA HOLIKA ББ крем для лица Petit BB Aqua SPF25 PA++, 30 мл",499 ₽,49 отзывов,"10 мая доставит Ozon, продавец РИВ ГОШ",https://www.ozon.ru/product/holika-holika-bb-krem-dlya-litsa-petit-bb-aqua-spf25-pa-30-ml-253691684/?asb2=dhqz8VYdLfFdBdty5Ip-WSl7do9mplheq4w1foodVlue4YZiDacFy7ag1Om85ACC
Bibity Bobity / Набор Глиттеров/блесток для глаз и лица ALOHOMORA / 5мл*3,450 ₽,42 отзыва,"Завтра доставит Ozon, продавец Bibity Bobity",https://www.ozon.ru/product/bibity-bobity-nabor-glitterov-blestok-dlya-glaz-i-litsa-alohomora-5ml-3-545233029/?asb2=3JcpNwS_6ipW2XJ0EGi2ATSTn9DMCYeHXEW7H7HvoS5LXWCOIobsR8U26wugzfzZKdsyCHUEXbxH12HBM0KqPw
"YANGMEI Жидкий консилер для лица и глаз тон 01 (2,7 ml) / корректор под глаза / хайлайтер для лица / тональный консилер / тоналка",239 ₽,78 отзывов,"Завтра доставит Ozon, продавец CRABB",https://www.ozon.ru/product/yangmei-zhidkiy-konsiler-dlya-litsa-i-glaz-ton-01-2-7-ml-korrektor-pod-glaza-haylayter-dlya-391178416/?asb2=tWtFF2ZqGoQOaY9d8xRMQHs6Z0jyoIU3SWdF-goKFEG6FfuDJvs_R_c4PJSHDGT6
Ruby Rose / хайлайтер / Палетка хайлайтеров / Руби роуз / пудровый хайлайтер и бронзатор / Beach Bunny Бежево-золотой / косметика / хайлайтер для лица / скульптор для лица / корректор для лица / палетка / скульптор / контуринга для лица / бронзатор,321 ₽,62 отзыва,"Завтра доставит Ozon, продавец CityNature",https://www.ozon.ru/product/ruby-rose-haylayter-paletka-haylayterov-rubi-rouz-pudrovyy-haylayter-i-bronzator-beach-bunny-362629829/?asb2=-nbkEPnMrSPn0PvvNo5L140njApPbWlUfci4N72iXOLhJNBaQYwW-eeS2pF3v53VU-hyaY3ZQFOpI-AJAuw2OQ
