"Макароны из полбы цельнозерновые Перья, 3 х 400 г",361 ₽,32 отзыва,"8 мая доставит Ozon, продавец ВАСТЭКО Партнерс",https://www.ozon.ru/product/makarony-iz-polby-tselnozernovye-perya-3-h-400-g-198805295/?asb=%252FVmgfFdJEBr46Rzw%252Fhg4ZQJGLV0ardhceHs13ku9RfM%253D&asb2=eLXzOC_JTbenodSBSzb9Pc0_c5DbiugxOejp4ChBldgogcU-LoVNFnNlVk_zs6Ef
"Макароны Felicia из Нута: Ризони, Без глютена",589 ₽,3 отзыва,"Завтра доставит Ozon, продавец ИП Прокошенков А.Н.",https://www.ozon.ru/product/makarony-felicia-iz-nuta-rizoni-bez-glyutena-256260145/?asb=bxZDVebqkmHiVbKTRhG77hlbC5QjbTADmldo806xLv0%253D&asb2=qPHfRP7SzGniO5bpnvKVgkq2P1YALgeOZNeQKMbEoSbAoCj-AegcMhwyqU5eFO1-
Eaglobe / Вермишель из сладкого картофеля 500г,499 ₽,1 отзыв,"Завтра доставит Ozon, продавец ООО ""Филмер""",https://www.ozon.ru/product/eaglobe-vermishel-iz-sladkogo-kartofelya-500g-259246795/?asb=7q0GhWCwAD%252FZav9mgsws1Klw8eiA806YGsgTjz3pD4s%253D&asb2=vrxKHyQcC6LH-nB9OXjOH11zDLAvvV26PG6eLLSEHAEX7-allKlCCDyE2fT1tRs2
"Piacelli Макаронные изделия Biavetta №77, 3 шт по 500г",458 ₽,3 отзыва,"Завтра доставит Ozon, продавец TGroup",https://www.ozon.ru/product/piacelli-makaronnye-izdeliya-biavetta-77-3-sht-po-500g-424960185/?asb=MQtbrOTo0yB7w2jS3L5F7HC%252FHlqOx2hCSRtsi1cgdPc%253D&asb2=TzA5ad3vcLO1DwRqrbpriw4sBgIlcEUC1bD_ABce1gb3y7v-TM6fFzzgYZ9Bpjir
"Ecochief Макаронные изделия Пёрышки №2, 900 г",256 ₽,7 отзывов,"Завтра доставит Ozon, продавец Лакшми",https://www.ozon.ru/product/ecochief-makaronnye-izdeliya-peryshki-2-900-g-429065610/?asb=vFG04KrYKPe2rk610sjAcQnhmSxRC0Q22HCluknrdhA%253D&asb2=enyJNGziIaTFQXishlsHxrasZmj9-nJEgWN8Y3CqWdMx9Ck-5Y7KuJaM2iag-xt6
Макаронные изделия Jamie Oliver Ракушки мини 500 г Великобритания,336 ₽,5 отзывов,"Послезавтра доставит Ozon, продавец Азбука Вкуса",https://www.ozon.ru/product/makaronnye-izdeliya-jamie-oliver-rakushki-mini-500-g-velikobritaniya-162863592/?asb=pBJ3lRm9BmiT%252Fsdze6KjqFOSzGI0sjMgukNnwJfQl7lq6Wg1sSsYqPyoK40K7O9q&asb2=36qYiaMtmYMNGtpYlw0sUtCreQFjsttkFRJUc5sQ4Rg3_MCH_DMC--zTC7hHimJmnn1MJW14RNn7sO4nVzCQYpGoWHtFvDzil-l68tpp55kQyn7DpetBsExe0cGFfcEnTfzFLTdQqREYnxY3G_T1MA
Лапша Hanami Фунчоза 100 гр.,123 ₽,19 отзывов,"Завтра доставит Ozon, продавец ООО ""РЕАЛ ФИШ""",https://www.ozon.ru/product/lapsha-hanami-funchoza-100-gr-173140466/?asb=d5O6nIIFGdoyshtHWc3P%252FzYjo0T5ptBjlm0SPoyhYoc%253D&asb2=yNIHmGRMBvwD7CkjAxAbC0lGF_g5VmUNEcH23jcq0KvutTTo7VUPBbUFeJIio1aq
"Добродея Макароны Латиница, 0,9 кг",244 ₽,24 отзыва,"8 мая доставит Ozon, продавец Лакшми",https://www.ozon.ru/product/dobrodeya-makarony-latinitsa-0-9-kg-276955622/?asb=PsjFfWjxKMyJm%252FkhMY1bcF92H6I0AtMWURlaYFkiYlE%253D&asb2=amVQBguQAAbts7UYU6M91mJLnO8-l3gU_PCsfdEqLe3Z1VqIUQagpqWR5f_Elu4h
"Макароны из полбы Умная мама. Спагетти, 350г",176 ₽,7 отзывов,"Послезавтра доставит Ozon, продавец Миродар",https://www.ozon.ru/product/makarony-iz-polby-umnaya-mama-spagetti-350g-150596197/?asb=gNbBpDewF7naiRDISglLpE5RJYYAW9w%252BuR%252FpGRYJs8g%253D&asb2=XMwI2K3YQ5qx38mW57z2gp00zqJlJTR-bdOi7QjHRFmo_kr90Ti00T-_sgy9gJdh
"Ecochief Макаронные изделия Ракушка №1, 900 г",256 ₽,5 отзывов,"8 мая доставит Ozon, продавец Лакшми",https://www.ozon.ru/product/ecochief-makaronnye-izdeliya-rakushka-1-900-g-429066957/?asb=gbsIN4fwyMVZ9ciPQ43qhvz96GMRZVyLqwSK1SIijsU%253D&asb2=kGMGIo98_Kj-78uQoE-vJvfD0DzbLy1wI3a7cyFTVN6t4LK8cfC2AdLxWRIVywuV
"MIDORI / Лапша Ширатаки Феттуччине с побегами ячменя, без глютена, 200 г",377 ₽,5 отзывов,"9 мая доставит Ozon, продавец Gegl",https://www.ozon.ru/product/midori-lapsha-shirataki-fettuchchine-s-pobegami-yachmenya-bez-glyutena-200-g-383570887/?asb=P4vp6Y8oqiDhAphub0CzlHeDDWtInqkcNFzxiubA4N4%253D&asb2=sOa34QRkWxaXvEE_E0sSQXIKkOaae1Nd7goM2oLVzbqTAorbWg4mxvARG2iUO5Xg
"Макаронные изделия De Cecco лазанья №112, с добавлением яйца, 500 г",329 ₽,6 отзывов,null,https://www.ozon.ru/product/de-cecco-pasta-lazanya-s-dobavleniem-yaytsa-112-500-g-140095895/?asb=48Tm3PLHIdd7n5XMUI0uZI8ixVGekkb8mTAGK7jrqko%253D&asb2=KPK1-IttyTDdp3PXcNz29jU8wLMAQEUuuQU3OesQoGvWUi4Ghx0BWQHXPlRiOcqO&ectx=1&miniapp=supermarket
"Макароны ""Алейка"" (Алтай), перья , 3кг",420 ₽,63 отзыва,"Завтра доставит Ozon, продавец eco-product",https://www.ozon.ru/product/makarony-aleyka-altay-perya-3kg-214510953/?asb=csCOU2%252BHcviwYvV1WeM3h72yo8%252ByF9wo%252BBA71xwVv1s%253D&asb2=XLqwgYj5TA47se4SxhVM94UxY8L9s4NmOGVoyYLdTyJ0pZx5_ICTm4iZmUHvTwMa
Макаронные изделия La Pasta Naturale Фузилли с томатами и базиликом,273 ₽,6 отзывов,"Завтра доставит Ozon, продавец La Pasta Naturale",https://www.ozon.ru/product/makaronnye-izdeliya-la-pasta-naturale-fuzilli-s-tomatami-i-bazilikom-269112582/?asb=p7XA9uSwMqJrCbPxPR4%252FzB6CgeB%252FAulLah7C6zADjBBhuCyfKQHIiNpFWinXeG1P&asb2=VMSJHb6xd3YedelDSR_E0Duc59folpgWsu7kZT70XV7vZR0qw7rwQJAudVZCxIoLl5o9FSaoC6F2r3LWxb9XAsL_VcDqHok9Q7Q4dI_JEKQX-D_Cga3DUIVOOk-gxx_GiGPQw1XGTvjZuswWBnYWFQ
"Макаронные изделия De Cecco спагетти №11, 500 г",278 ₽,89 отзывов,null,https://www.ozon.ru/product/de-cecco-pasta-spagettini-11-500-g-140095894/?asb=vhTy4Zhmhm3Qyi4tSgafpKqtzNT3uYtMx0HbNfw80eg%253D&asb2=HWiImDMZIZTle5jhRa7B0opauYkAsnZHMB83rKaHz4vdi0_4oZbN1jGXG9CULtTS&ectx=1&miniapp=supermarket
"Макароны ""Алейка"" (Алтай), лапша короткая , 5кг",650 ₽,30 отзывов,"Завтра доставит Ozon, продавец eco-product",https://www.ozon.ru/product/makarony-aleyka-altay-lapsha-korotkaya-5kg-214518999/?asb=RrkE8rv3JVxP6XBMR4SGRKDFk8pbcj8VseA05cNK5Vk%253D&asb2=ct-vUTKmgNKaeKAh3j-3qzOvNugQeHch6HPdtw-R174MuZKFQatGBfPXaDI_mO9e
"Макароны из полбы Умная мама. Рожки, 350г",155 ₽,8 отзывов,"Послезавтра доставит Ozon, продавец Миродар",https://www.ozon.ru/product/makarony-iz-polby-umnaya-mama-rozhki-350g-150597770/?asb=qvq4bc9ghoJ2N08UauqIgm9x51RIGM3XZzs8SAydy8w%253D&asb2=4-Bb_uc4ff6jqlIO1UyjwiDl1JpshgRmm9wyjEbqVThU3sL6MsQUT49ib07Mmd7x
"Imperial Cuisine Макароны длинные, Лапша гречневая соба без пучков 400 г х 3 шт + соба в пучках 400 г х 3 шт + Лапша домашняя ""Удон"" без пучков 400 г х 3 шт, Набор",603 ₽,9 отзывов,"Завтра доставит Ozon, продавец ЯLove Trade",https://www.ozon.ru/product/imperial-cuisine-makarony-dlinnye-lapsha-grechnevaya-soba-bez-puchkov-400-g-h-3-sht-soba-v-puchkah-201302629/?asb=0l0vZzGMCqcQwk1mPocbb7Vy%252BLx02n9nc83RHT7e2tI%253D&asb2=ghxfMnoWJoZpC49mVppSHoElHJGVU3byaV_Uo9EKkoZk2syT_v_eG73oxhLUKC7t
"Foody Mac&Cheese Пармезан макароны с сырным соусом, 143г х 6шт",530 ₽,84 отзыва,"Послезавтра доставит Ozon, продавец Оптовая Региональная Торговля",https://www.ozon.ru/product/foody-mac-cheese-parmezan-makarony-s-syrnym-sousom-143g-h-6sht-173057620/?asb=Hng4dnv2fiEXQz0KNWVg0k9Am%252FYBFj5uO%252Fp9GGOFNJc%253D&asb2=2Nbl8q2EzcO04ha-6l10Ync3dMAsLslfEWx6POdlK8szmO_C5FzJL95ORIVL0BRT
"Casa Rinaldi Паста Меззе Манике, 4 шт по 500 г",689 ₽,4 отзыва,"Послезавтра доставит Ozon, продавец ИТАЛ СИТИ ФУД",https://www.ozon.ru/product/casa-rinaldi-pasta-mezze-manike-4-sht-po-500-g-199638082/?asb=ZInlZPpcCDz0FHL1ZEO7oyuxQq2zFkFp5Pcx6z6buz0%253D&asb2=hVSgTEn0uNwWP6vZzr3A6zeMmyOyZT98rE2-ZeRd_r5GgDuGQ2ks3TEH4avsJSAI
"Casa Rinaldi Паста Premium Орекетте, 500 г",360 ₽,28 отзывов,"Послезавтра доставит Ozon, продавец ИТАЛ СИТИ ФУД",https://www.ozon.ru/product/casa-rinaldi-pasta-premium-orekette-500-g-178307279/?asb=u3REKOKpkzCCelIxxopK5s8OF1Kxbdu3nAw0sz8Q15M%253D&asb2=g7mKdwQ4aE30-J9rKGirF7vfQEwqw59siUZzgRKcY-6RW7_ao07sxOldTN8SFWBV
Лапша Pho рисовая SanBonsai 200гр.,214 ₽,12 отзывов,"Послезавтра доставит Ozon, продавец АСК",https://www.ozon.ru/product/lapsha-pho-risovaya-sanbonsai-200gr-203123938/?asb=nNRvLLkSSjkYUql%252BTplhEoUCQDNkh3q8ZGb5Atk1LSdm0HQxwgEvChNTjqgvah4j&asb2=R_mdB4iyhutGbYX7Y2C8NzL1mL6xKSCExEayaeFDxY1CKjq2rabg5QlmDMdOkln1oFOpnpiIngXGlGhhPlhdp6g7a0TPr_dy_-L6XOgbhVUpOyY4OD-4EcsJb_PNlZoS2gLGCA1PkFbWODDM2obUVw
"Лапша гречневая соба, Dr. Naturi, 10 упаковок по 400 г",738 ₽,4 отзыва,"9 мая доставит Ozon, продавец Zevs",https://www.ozon.ru/product/lapsha-grechnevaya-soba-dr-naturi-10-upakovok-po-400-g-536836963/?asb=eEqx2m9HKVIYuanZElDAXSv%252FRJEmJ%252Fk%252BnoSMT6EBPTTtxPnRufj7ZWBGKIEer5Sf&asb2=Hhc_dzWdbrjhUTwdPS79Fl9MdJtPiRkqrV2dlvW_Fmoa9MSZNXkELGsiJk77j0hM7vjvtVhv26QwxNyuzXPI8XGAl65q4RjMud6QUWSAlH0AtHGSIA1Xq9WVs0ArfcvC-AzxHqDa8oHuZinrfNeRNw
"SanBonsai вермишель бобовая фунчоза короткая, 200 г",240 ₽,55 отзывов,"Послезавтра доставит Ozon, продавец АСК",https://www.ozon.ru/product/sanbonsai-vermishel-bobovaya-funchoza-korotkaya-200-g-161828166/?asb=0jtnIVjkl%252B26GNIWlKbKvR%252F2Qs%252Bbs%252B6KN4y4epJp0cP7dV1RAF8BwZVyw68Am6Wa&asb2=A_vnHuUiXXNf2UC6MIqJN_CvPWDv2LTXemsK0rOOMA4qeDBoufpvvmDpIdOB-Q-ghGCL2qNwgDxmtQKDm7xdKw4Pe8nK8qqlhPIxsA2WOopLgxcRuIus8NnKdkhDLHlrX_tAkLPa5TMjc_zZ8udITQ
Лапша богатырская яичная,132 ₽,4 отзыва,"Завтра доставит Ozon, продавец Гео-Простор",https://www.ozon.ru/product/lapsha-bogatyrskaya-yaichnaya-528796130/?asb=rH%252F26fJ0Hs5XXoAt6%252BbEZIenWJdxV1RFGl%252BQgxjMRU0nHVCX8JvuKUvO6Av0duxY&asb2=IIGmNgsTBqDjTWC2efgj2ZaXzkJ0JmrhUS9m4m5-VmgJ4oL8_koCdHgNfC5FSTvhaZP9YN7cdewM_JpkguWyIbrjtHWC6YgBaitWn56BcAiU4rtcF_Su809IujU50KrbQIK2ECb8-htyY54XVBIQ7w
"Casa Rinaldi Паста Пенне с чернилами каракатицы, 500 г",449 ₽,7 отзывов,"Послезавтра доставит Ozon, продавец ИТАЛ СИТИ ФУД",https://www.ozon.ru/product/casa-rinaldi-pasta-penne-s-chernilami-karakatitsy-500-g-177489165/?asb=evo0IY%252FV%252B%252Fa4LdC9B7Cs66kGsj%252FHrpMyvxVdwf4fOFc%253D&asb2=Jut-Bo22MmksAvVoLBFmsY-vK5R4SiMdMeZi0n57feCJ40_syLbfTBsCOrsh_bGq
"Casa Rinaldi Паста Premium Букатини, 500 г",325 ₽,2 отзыва,"Завтра доставит Ozon, продавец ИТАЛ СИТИ ФУД",https://www.ozon.ru/product/casa-rinaldi-pasta-premium-bukatini-500-g-178306846/?asb=P6it0IEnm8QxHJlXxrzBdWogVhcEeui8uuH6H836Rio%253D&asb2=MoeVkIq9Aux5otHdK2rLrXAiTghfZG1xEuWNykI1AUNsPapcG49L3AUueTu6NebP
Лапша крахмальная Фунчоза (2 шт. по 500 г),461 ₽,28 отзывов,"9 мая доставит Ozon, продавец Красный дракон",https://www.ozon.ru/product/lapsha-krahmalnaya-funchoza-2-sht-po-500-g-230571957/?asb=gL6DibKPwiVSgtOwmVoZFjXKDYuHTCY4%252Bcb8MMkzwGk%253D&asb2=EE-bjgL3kzVjcBO1Zjo_N_PrwG-oRRkPJaJP_WaxSqAyhMtmGLOey-WB4N_GhBgm
"Casa Rinaldi Паста Пенне Ригате, 4 шт по 500 гр",689 ₽,21 отзыв,"Послезавтра доставит Ozon, продавец ИТАЛ СИТИ ФУД",https://www.ozon.ru/product/casa-rinaldi-pasta-penne-rigate-4-sht-po-500-gr-199710402/?asb=uZhxiWxTT%252BLVEobyduvOaJXQko0d04GLIK%252FQ3Bk7G2c%253D&asb2=jwV0RFVpv_LPWdJqjawn73BQSXtyriHzgshUPy-WjXa-r2t_bwgz9thSgc2estR3
"Макаронные изделия ""Мартин"" цветные ассорти из твёрдых сортов пшеницы, 400 г",199 ₽,1 отзыв,"10 мая доставит Ozon, продавец Ликаан",https://www.ozon.ru/product/makaronnye-izdeliya-martin-tsvetnye-assorti-iz-tverdyh-sortov-pshenitsy-400-g-557368096/?asb=fZ2aGB10rGA3HLqCmK9irBrA2BtcOaXzjdWPx0jCyL4%253D&asb2=RxGazqcu2kkOmTNF4QKg9nq5_BR6Ngj05mgg7Xn3wpkCN0dwPlFTAgq291JWtVQ1
Макаронные изделия AIDA Fusilli/Спирали 400г ( 10 штук в упаковке ),698 ₽,22 отзыва,"8 мая доставит Ozon, продавец Агро-Альянс",https://www.ozon.ru/product/makaronnye-izdeliya-aida-fusilli-spirali-400g-10-shtuk-v-upakovke-242825600/?asb=%252FyYVqCTmu1yBs0dSUst2MDEBgMIQY3E4qcSS62O75Gw%253D&asb2=dirORRGqbV1hmPAQx3XDHenF3WotrNg-8JRxqgOZ-nG_-JcxMu7AC24BhHcbx3b5
"Паста LINGUE DI PASSERO BARONIA, Италия, из 100% Итальянской Пшеницы Твёрдых Сортов, выращенной в ИТАЛИИ, 500 гр.",236 ₽,4 отзыва,"Завтра доставит Ozon, продавец Альт гросер",https://www.ozon.ru/product/pasta-lingue-di-passero-baronia-italiya-iz-100-italyanskoy-pshenitsy-tverdyh-sortov-vyrashchennoy-330896528/?asb=lyNOAf03xF%252BvkeYGmispVrKpcYcPBrw3OgqOQg3hH3zBkMm4D8lfPkwZylJTr%252BtY&asb2=0MXPUzXgd-cT2ppqEEVQn7UklP7CCXyA3XrHVWEy4BkX5eq8TJv9_CikTkFOBeM8moDqcqQg6Roz5oI4MiUIHKJow8kNqN-3chU_lAoyz3JdIq-0AnJF0Mx8a7h9yDYAjLqkw33_7PTDypVCo1FMGA
"Макароны ""Америя"" Перья 4кг Высший Сорт ГОСТ",599 ₽,39 отзывов,"Завтра доставит Ozon, продавец Carnival",https://www.ozon.ru/product/makarony-ameriya-perya-4kg-vysshiy-sort-gost-483936320/?asb=ZxYNHrS%252FKBnYruFwFns%252FRFHVoMJfQFI65ZVg8JAuQ36UFc%252B1GeK4XwWA4nQi8Qpp&asb2=CfnLpEuFJgHLU4BM5WFkHWs1cd6hXrjJH9kDwoxpLhMosMreUzZGhq-m0eZdhE_kw4J5eLHtGXcQ0FI6kW1tWFmc9aL9DxrYGr3rkav2G32j8YD39TmFxifirEpw9udiLD5VqzKaPgG55WlkdUa11Q
"Макаронные изделия Мелькомбинат Перо гладкое, 1,8кг (2шт)",256 ₽,2 отзыва,"Послезавтра доставит Ozon, продавец ДИМАРТ",https://www.ozon.ru/product/makaronnye-izdeliya-melkombinat-pero-gladkoe-1-8kg-2sht-545932983/?asb=%252Bx4f1kG9nDzL8VwFqd0KeFv4Act%252F%252FFqgZkkpRsJbVhY%253D&asb2=scgUh0GK4G3ocWTOpxnGaR5txswdTqXTE-szE4gnc7jFYLuasD2-_1sRAfaL0mMH
"Cavatelli - Кавателли. Итальянская паста торговой марки""NONNA TOTA"",500г",550 ₽,12 отзывов,"Завтра доставит Ozon, продавец IPS Group",https://www.ozon.ru/product/cavatelli-kavatelli-italyanskaya-pasta-torgovoy-marki-nonna-tota-500g-162860509/?asb=utUdIcrT%252BgjWGyviC3kWBEhiMxeiFFAPafxzDPc0kRKnLUQExQK%252BtsOVkDo0Mq2J&asb2=Q8LX-SdQUQ3eKw2qKiHv6q8tik6w8BKEflra6HnNz34mWSym_5kFsWUrBjp3G8MK3fJEJ9Px3joPEeP1Jis7e2B5s9SwQLFLoz5FGCOJm4UXJItRWWcLqmHsLTXUB-fQU_icmZHmgsbALGk7BXZtJQ
"Casa Rinaldi Паста 3-х цветная Спагетти Fantasia, 500 г",329 ₽,17 отзывов,"Послезавтра доставит Ozon, продавец ИТАЛ СИТИ ФУД",https://www.ozon.ru/product/casa-rinaldi-pasta-3-h-tsvetnaya-spagetti-fantasia-500-g-236891956/?asb=W9weaLe94eGZiAUtIgbrMtUXnA0yv%252BKWtIC9YNfYHw0%253D&asb2=cXALdYOrGbNR19ZfwapSOgudW8Hk0UvZCTQ_jJCdr6TTSapvNv8iudUoHXj81kW3
"Макароны ""Америя"" Рожки 4кг Высший Сорт ГОСТ",599 ₽,39 отзывов,"Завтра доставит Ozon, продавец Carnival",https://www.ozon.ru/product/makarony-ameriya-rozhki-4kg-vysshiy-sort-gost-484619788/?asb=xC50PqrvfscyhlCs8zrlXMMC8nL%252BH%252Fl9FQ%252B1mrgBVrBdL8ZX1cwNJWG6xZ%252BQZUhh&asb2=WK8ofXKBJZHh1BSI8KHVCwn9ZqfunnkmnIN-Xmi9lFggS5X9k7xQH74JpDLqXKw_p20vR_Ysyy3nRrPpoUVEtaE_HlCKwNkrhyXhPNUeYe3xnCy_ofoUCwoldCE9mk97pk_RHCgGdMHbZ2065BiFPQ
"Макаронные изделия Пенне Ригате IGP Gragnano 500 г, Ferdinando II, Артиджанале, Италия",590 ₽,2 отзыва,"Завтра доставит Ozon, продавец Bello e Buono",https://www.ozon.ru/product/makaronnye-izdeliya-penne-rigate-igp-gragnano-500-g-ferdinando-ii-artidzhanale-italiya-216089669/?asb=Ij8fN2PGvg0Bqnebior67QpJh%252FUoaPNLoI5KUzKWUh8%253D&asb2=v-ajAZBZAOig-PRsr3mIQU_6j513MroTe4W8RLY-qEJ9BpJZhkQlVoDqioqy8WSl
"Паста Спагетти BIO 500 г из цельнозерновой пшеницы высокого качества с добавлением Омега-3, макаронные изделия из твёрдых сортов пшеницы, Pasta Toscana, Тоскана, Италия",385 ₽,13 отзывов,"Завтра доставит Ozon, продавец Bello e Buono",https://www.ozon.ru/product/pasta-spagetti-bio-500-g-iz-tselnozernovoy-pshenitsy-vysokogo-kachestva-s-dobavleniem-omega-3-216011021/?asb=YSfQCQEbvZhnZPq9xt7vPx45p8VdNFZYB24XDeZY1y8%253D&asb2=2ZU0UrmCROFZoR5ZjZCuU9ayni5ncLX9dA15xGrx6jINwHcC32qXxKNREbvvSP9L
Хинкал яичный,132 ₽,4 отзыва,"Завтра доставит Ozon, продавец Гео-Простор",https://www.ozon.ru/product/hinkal-yaichnyy-528802666/?asb=J%252FeDzRuxa3gUlV4SqGKMI6zTaTK4RvsDS109AENo%252Fx8YVED3IjsbLu5uLWnCAF9a&asb2=85mCGpcusS-EMogzKXGfZum2YhGFwZ8zPGhQyVMHDgF-fXqXkIHMYTcG5AxGpPP6dMw-XiywMm_i29JXZs4SIvPD-3QN9ZW-4FGCc0X7Ga5tsZoP7mIUyceNMiLXqy839exp_KvgKCTjHcI9HF0TLA
"Лапша Гнездовая. Ми Тон. Лия Алматы, 500 г",286 ₽,3 отзыва,"Завтра доставит Ozon, продавец ADJEDAN-2021",https://www.ozon.ru/product/lapsha-gnezdovaya-mi-ton-liya-almaty-500-g-312077683/?asb=ynP0prPl6Z3%252FgGHbIFz6Ums8pXt2E8qgxZKzunBCyayzzhA0WtFLeTOytUVN7vot&asb2=XyHdafXNzhaU5HoQ1BgQ8r92ASgO32r03kmfzgcL7hfPYQlaXilOvtcC2ZjwPzJPj8d0WrF_NWxUwMRngg1hFGD0EHwqsk-52em1fyE-DtYgIh4qozVhjGBUVH39BtWZ6He2mYV5f8qUEcamEkkRyA
"Barilla Листы для лазаньи Lasagne, 500 г",599 ₽,16 отзывов,"Завтра доставит Ozon, продавец Kinstar",https://www.ozon.ru/product/barilla-listy-dlya-lazani-lasagne-500-g-309753413/?asb=ix5O08wINWQGN8gbqj9UAOpH8FVvEDR%252BL7NK2jVaF%252Bw%253D&asb2=aiv3TZUl14MIk1oyWINMIE5SWuoNSVBfnVLhmeXsoCaBRq3RU-sLPPlXzIEOyjq_
"MIDORI / Лапша Ширатаки Феттуччине с побегами ячменя, без глютена, 200 г х 3 пачка",648 ₽,5 отзывов,"9 мая доставит Ozon, продавец Gegl",https://www.ozon.ru/product/midori-lapsha-shirataki-fettuchchine-s-pobegami-yachmenya-bez-glyutena-200-g-h-3-pachka-531820055/?asb=zAZWcfjhgC5qoTvL%252B5%252FOVy5tzGPyBiPUIN7hmtQyq%252BQ%253D&asb2=0vB_PmETHrA6e6NyYHdLky3Uctm4jPKtkY_A93YF5CbHx_aeyNEygIxfyPmSin-P
Макаронные изделия AIDA цельнозерновые Linguine integrale/Лапша 500г (20шт в упаковке),1 050 ₽,66 отзывов,"8 мая доставит Ozon, продавец Агро-Альянс",https://www.ozon.ru/product/makaronnye-izdeliya-aida-tselnozernovye-linguine-integrale-lapsha-500g-20sht-v-upakovke-241573608/?asb=A9DKZ00i4U1%252FhbktiIKyT%252BwmJTlpnlaqIjcRNdPwUeA%253D&asb2=48CvSUKZieKzhuXcQCBejhAoFZZNK8cpmI7h3V1i91Xz_-Ydk_6iFqSzzCSYyCep
"Макароны из красной чечевицы (без глютена) 250г, МукаДаВода",318 ₽,45 отзывов,"8 мая доставит Ozon, продавец МагЗОЖ Оргтиум",https://www.ozon.ru/product/makarony-iz-krasnoy-chechevitsy-bez-glyutena-250g-mukadavoda-489300677/?asb=se%252F0cKvjcBz770lp8veVXuwpBXYvuzF%252BVUBC6rcR5SGjkNn%252FcA%252FZomIKvoTxQJ%252BU&asb2=sjgRDBscb-wm5ATGC_Xw4Ce9b025lpK5OU8aB7cntoJCmvLBbdQ7U7f0K0CA7Z_QZPSD3o5oFa_7RkxdN-Ik4GzpzQvxo8uXOby-X2Gq743E40nnexc5QOoBx7wB5ZLFxNpOpaLAa_faWD_C6se5vQ
"Макароны с сырным соусом Foody Mac&Cheese с пряными травами острые, 143г х 2шт",213 ₽,20 отзывов,"Завтра доставит Ozon, продавец Оптовая Региональная Торговля",https://www.ozon.ru/product/makarony-s-syrnym-sousom-foody-mac-cheese-s-pryanymi-travami-ostrye-143g-h-2sht-283121254/?asb=DMY73yxLKXxgXgn12IO0IvWAUUx0mAnn1u3Wf0iwHa0%253D&asb2=xqG_2ERLW_Roluwa3pjLYWNXLaqWmtS9LMKMDsfypGgDRlE946i8wtNMOrzLdjrD
Лапша Лагманная CARRONI MIO,250 ₽,1 отзыв,"Завтра доставит Ozon, продавец ФУЛЬМИНАТ",https://www.ozon.ru/product/lapsha-lagmannaya-carroni-mio-544190203/?asb=YkjQW%252FJI8Nf%252FvXY1XyVGbiXUAYjtX2nnrwkRHyaFQhk%253D&asb2=-sRTZ_-zLzA_xQteJ-K_KjvcupqoUj8UONld9QO9_S2U9tjVGj9vKzRMuVbaj0e1
"Макароны паста Rummo гнезда Паппарделле n.101 ниди аль уово, 250 гр.",361 ₽,1 отзыв,"Завтра доставит Ozon, продавец Funtasy",https://www.ozon.ru/product/makarony-pasta-rummo-gnezda-pappardelle-n-101-nidi-al-uovo-250-gr-525881525/?asb=X5OPHbgDOoXCPxUVNZU9%252FtiMNYDp9WvaNqw1i%252FXZ6kc%253D&asb2=NLABhAjWiyczOj5K9NlGkHV62ldKorrNznp0UBTPWCnvoeclI7N-4H0dtoHfwlAP
"Макаронные изделия из твердых сортов пшеницы GranOro Dedicato № 198 ""FARFALLE"" 500 г * 2 шт",498 ₽,6 отзывов,"Завтра доставит Ozon, продавец Меридиан",https://www.ozon.ru/product/makaronnye-izdeliya-iz-tverdyh-sortov-pshenitsy-granoro-dedicato-198-farfalle-500-g-2-sht-173491064/?asb=WCklOqUHlH4hgQBM1cD6zL1nCO5Y%252BPldkJFDB7XlndY%253D&asb2=yJmj-SyCvmL1b_VLljqBakQfQ-XJyDn51NXZ4YFOZmv455UyYbSnSAI_kDmJ_upH
Сенсой Лапша рисовая RICE VERMICELLI Sen Soy Premium 2 штуки по 300 грамм,389 ₽,5 отзывов,"9 мая доставит Ozon, продавец ИП Кисенков Юрий Игоревич",https://www.ozon.ru/product/sensoy-lapsha-risovaya-rice-vermicelli-sen-soy-premium-2-shtuki-po-300-gramm-335466496/?asb=Q3M5irXYEvYSkIhZM6ju2TV9mtgBLyd3MOaQywHG4aiNW76rDRwaK9D24lqIVdYG&asb2=hyeb44z2-tyQMibgrIPT5xXyXniySV6IMPJ337_vSwhZ9hvqntJDj9xMoAMruijVzyt63Hk_VLFGMXy-GAeDKAyuoCUwcRRhtVae9NeAelN7B3RdWghju6-wasGzzc5yRWfklaenYxexG-izfg2W6w
"Макаронные изделия Гальяни Рожки с гребешком, 900г (2шт)",266 ₽,1 отзыв,"Послезавтра доставит Ozon, продавец ДИМАРТ",https://www.ozon.ru/product/makaronnye-izdeliya-galyani-rozhki-s-grebeshkom-900g-2sht-545935705/?asb=zpBXKYZ8EpFobIsJpr9pAZUGfyxMI04Vgr0feZPVi8s%253D&asb2=i9uPDNVDN5IgakDv2RKTR0ErpZ2M1M_wTPcPYkoZhlgJ81NJpC5be2yF3tyDgz5v
"Макароны гречневые (без глютена) 250г, МукаДаВода",318 ₽,45 отзывов,"8 мая доставит Ozon, продавец МагЗОЖ Оргтиум",https://www.ozon.ru/product/makarony-grechnevye-bez-glyutena-250g-mukadavoda-489292174/?asb=z%252BSa36ymN6s6IetpKVW6gfVpHhzVZ%252Fv30wwaxac6wzuPmz6U4gOw2t3GX4j1gOEV&asb2=rlcen8UuxdfCHlhxnMM5AW9pP37HvPjq2Q58Oa5WMBnRQJu9CCaJRsPFNRG3NatNyG9BJtXjEpfdi_yA_cwe66dmKPhbDr90acTDnYUe6E0zoKYG67gEXbdY9e8vVw7mKhP3Z-1lyY4HEoyoZhO15w
"Добродея Макароны Атласный Бантик, 0,9 кг",256 ₽,29 отзывов,"8 мая доставит Ozon, продавец Лакшми",https://www.ozon.ru/product/dobrodeya-makarony-atlasnyy-bantik-0-9-kg-276414848/?asb=K84JBgzSEi7A%252BmBuI7IgG2u47%252BvPmfHne8VNL3yxUvo%253D&asb2=RIEMBl-AivDAgIq9e8ANMEACnSqXafcr4kQ32Epcbga_r_x0r1rzkSthaDN5Wm3e
"Макароны ORZI BARONIA, ИТАЛИЯ, из 100% Итальянской Пшеницы Твёрдых Сортов, 500 гр.",246 ₽,9 отзывов,"Завтра доставит Ozon, продавец Альт гросер",https://www.ozon.ru/product/makarony-orzi-baronia-italiya-iz-100-italyanskoy-pshenitsy-tverdyh-sortov-500-gr-307962141/?asb=JzURcAgu0kJRDHEd2mHUqhb%252Fg%252BYuhR4v%252Fn4py1MCe4vAr8PXyHwAM%252F1gFXLRvuiU&asb2=j2JXrBb9LjzRobj8BKVtgv4u25tXTKDmmQ9130VndwcXBXVrmhn_Np-u_UkLZPo3GOsBq2fPt2vq32J1_ObGFJnZNhw-Z2BJBHkLVvxyVBnACW7HBKBRhUD1LnoxebeCWuU2HtNVqjyDxofoGACjtA
"Макаронные изделия Шиателли IGP Gragnano 500 г, Ferdinando II, Артиджанале, Италия",590 ₽,1 отзыв,"Завтра доставит Ozon, продавец Bello e Buono",https://www.ozon.ru/product/makaronnye-izdeliya-shiatelli-igp-gragnano-500-g-ferdinando-ii-artidzhanale-italiya-216152437/?asb=j%252BH8LvEfaun0I8zxlYH7i3P7oCnv8WZtR1WXOI2cHho%253D&asb2=azQdGzpq0O4Su8WvNTu1sFIYZn4rEux6H4QYQBXYZpsEA0pprmorloDRNbEVATYI
"Макаронные изделия Valfleuri Бантики, 250 г",139 ₽,55 отзывов,"Послезавтра доставит Ozon, продавец Ozon",https://www.ozon.ru/product/makaronnye-izdeliya-valfleuri-bantiki-250-g-217646241/?asb=0yXJJBZpBepxDtQv4Y51G779%252BfX0xChTWuBSSGzzsH8%253D&asb2=jtn3ecvW20pDlCRT31Zg6CE3W7cjnKe0VwTWbWe-9DK6eVHEm9NaKwjbyUMl_Mwy
Макаронные изделия AIDA Spaghetti/Спагетти 500г ( 10 шт в упаковке ),699 ₽,49 отзывов,"9 мая доставит Ozon, продавец Агро-Альянс",https://www.ozon.ru/product/makaronnye-izdeliya-aida-spaghetti-spagetti-500g-10-sht-v-upakovke-242824952/?asb=aGsl46ElN%252Bks5BqP%252BIwT50PKCvI12t4IgKroktIbeJw%253D&asb2=_s5GX3zaKUvHnO_3qdEFogD5uSEadQ3wUDyWKM71hqnvsK4Gh5CGKr1Dj3HI5dYd
