Лапша богатырская яичная,132 ₽,4 отзыва,"Завтра доставит Ozon, продавец Гео-Простор",https://www.ozon.ru/product/lapsha-bogatyrskaya-yaichnaya-528796130/?advert=jpy2PL6weQ99U2k5GkHzZY2gkj5Q3K_7vG03XtYQV2Blp-482hwIQYVJwUd40FKR6rHCbnCRubtYOYkF0sexP9bdg20kYZWmkGGMPBwq4ju40Xy7U1VRlgctPmDlVC4sT79BtEr81QbnRCXzxXNBLm44tAB-h45OfZxNef4Aqu606U3F10qE1eP2eHrV3_0soyZatJsSFq2RCtrju5npxkemYD9G9BYR5fkkm7rrSMJkYNOgdpmynCOyRXjgkovYHG8tovEmRiPYM4pooP4Aqaf1kBv_jfPDN5BRaRLGvbRUQCh6rsZuZSQDfP9NH9HG6FBKNcX4zQxdpXaHdSxQxdcSyiLe7bBjxq_iCJd2kRdbKO9x9LwxzZ7m77qjsBY4cQcEh83RF_tOpdEaHjxinMZ35QCbuyNiWiH_0CxdB9zUjcCWgVUgeUNcyuXakTly7qWI9EdYlII5_Sem6wr483dTc6NOt10p7dOyP9Vr6MJnWiNtKkNU9t8GuqG5cFxaVF9sEyC8W1W1fz9pher6GeF86kHj9BRgQP8tuSYnbZjI5AvIFiQJn1X0ZkBLmvZa
"Макаронные изделия Pasta Zara Лазанья, 500 г",164 ₽,142 отзыва,null,https://www.ozon.ru/product/makaronnye-izdeliya-pasta-zara-lazanya-500-g-179569532/?asb=fJb5FHZglao6pR2kV3v7otxOLyNjGs5dygwztVAbdCc%253D&asb2=JUY8Vk9Xw9k0zfOzE45mNjkDWyaiuS0KWyTIX17vzmmsqqRszHLHtx651im6NQJ2&ectx=1&miniapp=supermarket
"Макароны с сырным соусом Foody Mac&Cheese Чеддер классический, 143г",129 ₽,112 отзывов,"Завтра доставит Ozon, продавец Оптовая Региональная Торговля",https://www.ozon.ru/product/foody-mac-cheese-chedder-klassicheskiy-makarony-s-syrnym-sousom-143-g-167705630/?asb=fVaUAZQMskQV7l6Q%252FeWtG3dkjeaw5BHMkQ%252FnAVWs31o%253D&asb2=cda3LQPlqNSQYDMPCnofQVC7S_tE-3kkiULiJlWiuHTOe3PIjy90kvGwuqSNSxcM
"Паста Птитим 1 кг, макароны 1000 грамм,паста жемчужная Птитим,Кускус",460 ₽,23 отзыва,"Завтра доставит Ozon, продавец ОРЕХБЕРИ",https://www.ozon.ru/product/pasta-ptitim-1-kg-makarony-1000-gramm-pasta-zhemchuzhnaya-ptitim-kuskus-523870492/?asb=i5DRcEngGu1qMPOjxoMViNFMQkCShc5meJ5NxnGO66g%253D&asb2=VQOTz0i0KzFfKTg-i61x1Db9_7Ofmhd0xepTJg3Z4Q_bseCMR8gBXZvosWS_9ONE
"Птитим 1000гр, паста жемчужная, макароны из твердых сортов пшеницы Narmak",510 ₽,55 отзывов,"Завтра доставит Ozon, продавец Narmak",https://www.ozon.ru/product/ptitim-1000gr-pasta-zhemchuzhnaya-makarony-iz-tverdyh-sortov-pshenitsy-narmak-489945650/?asb=njt23o3lnYKv5sNDUBFN5ASkW1vzTbCIx2lV0KH6tv9RYKh8AjGK4h9oawMzOvFu&asb2=KoGmwM-olcnmB0HO0kx5ZKASYmzLDY6iTeEyb2wPUTBE_FVoBr9efGEoaYfF7Qcn-Pq19nV76Xjz6zw7tuyXJozb5-XPQUCSa8nizZDIFFRvB_IKURdlpSHk7xPj2yqdlmb8Y8QPBVyn_LAggzfZ_A
"MAKFA Макаронные изделия СПИРАЛЬ, 400г, 6 упаковок",739 ₽,2 отзыва,"9 мая доставит Ozon, продавец Торговый Дом",https://www.ozon.ru/product/makfa-makaronnye-izdeliya-spiral-400g-6-upakovok-422467361/?advert=Dvi5ATvduk1TcnHZNNbLpS1o04Ejauci8NJXfKNyDRk4oaDnqqzKd1dqXk44mJ9OatQg_MD7di8orfJN8S1H4KBkxDTtIzqpMAii9jeujecmDfJ_ooKpSxmYW4ZDxFBboHs46N2O360BnNJY_8h0de0oS_mDAaZYLu3bljsEszYYD2octMgpoz3fsq_dcVVSINXYo2IUHZcwB5r0cnFurxMbMFycsQsdOl5HnH7Bj8D8rVGXtJ5xAXyXiDbth9BhlvPOmINgYBsYa_9FURlzZxK9TCCB2XCO2qlyximlDQliQVQN-7u4KtdFdHDZh2O-bbLzVdodWdr4oQ4mGcVzqNj5hT66uRWXPGDU2LqGNemNGJhJAOK3nf66YP0MaPpiySBms5xc8v-YWjOkLm9eJL9rgOf39oiEYGkR3a08JO4YP-EnTUJNWkhQkxZS8LI3zrpVHYBHbqVM8sFFEb8bEXefIOc2V26MuIoFrszdYr1DPvJEIDfpfmfbe92s9y-mD6P5eKkqGrPRInDhEl-YLcDqK1NVg5c5UIIA8qskYogODXo0SpCJivjn8QW7V4Rf
"Макаронные изделия FOODCODE спирали Фузилли №7, гречневая, без глютена, 250 г",152 ₽,71 отзыв,null,https://www.ozon.ru/product/makaronnye-izdeliya-foodcode-spirali-fuzilli-7-grechnevaya-bez-glyutena-250-g-342792201/?asb=LiEfWATG7s1UEPUVc5MH9rMdMJ65B8cZ7z6A%252FP6iBrM%253D&asb2=czIF6abpRxrmgJRa76L_4ZVpOhn_XGOn2DB5fVAbdk2oclapw9i6pr8XLc6ytIph&ectx=1&miniapp=supermarket
"Макаронные изделия Bravolli Орзо, 350г",138 ₽,168 отзывов,"Завтра доставит Ozon, продавец Ozon",https://www.ozon.ru/product/bravolli-pasta-orzo-350-g-143629443/?asb=UkiCniGHH2JqhBbwOySzPyrQW%252F%252B9LoOp7%252Brd7%252F3QFsg%253D&asb2=RAO5OWhDFVnWcu9KvZKadLBDEAA1lDZ7-YW9UvhBLOe2bYDUHJoxChDCqSIuSmiw
Макаронные изделия AIDA цельнозерновые Fusilli integrale/Спирали 400г,84 ₽,44 отзыва,"Завтра доставит Ozon, продавец Агро-Альянс",https://www.ozon.ru/product/makaronnye-izdeliya-aida-tselnozernovye-fusilli-spiral-400g-166788391/?asb=sfSZzvG2UPFQTWm%252Fm4%252BxhrUJKCS3P5Z8ye%252BZh13y7Zw%253D&asb2=DLFDeL_pLP7DjJKqF8KFsG5oMOdDtW9QgoDSTuFfwiqdn4eMK2LKGVDN4U4C3cwy
"Макароны детские паста из твердых сортов пшеницы Rummo Классические Семи Ди Орзо n.27, 500 гр",331 ₽,94 отзыва,"Завтра доставит Ozon, продавец Funtasy",https://www.ozon.ru/product/makarony-detskie-pasta-iz-tverdyh-sortov-pshenitsy-rummo-klassicheskie-steline-n-22-500-gr-256803747/?asb=8hbInKnK27xAdA%252B9kUzwTkkuyAb4bLBaxb4wJaG0MPTYPnd6deyI7TwyvrR2YN0Y&asb2=-KTF32Upb2blUIAoFndS2x9rIRIFB_BEWk_8LKZO50HpAm7_I24w2r72wYUVuQ6EhTJEX8HQx_IHVjJ_agWOFFaG91qfMkVQxP5p6kT6n4J6Tt-irpzJfrlBrnTr7CH-BThkEypvqyfa4RxPbC5-wQ
"Макароны с сырным соусом Foody Mac&Cheese с грибами, 143г",119 ₽,24 отзыва,"Завтра доставит Ozon, продавец Оптовая Региональная Торговля",https://www.ozon.ru/product/makarony-s-syrnym-sousom-foody-mac-cheese-s-gribami-143g-282942358/?asb=RB4u040Zi4BxfNjrIZenvb3KxsHwi91ITP1A68N%252BJYY%253D&asb2=x0RbY8jNsDyevTFyEGwNDqlOD7sIrWLeMcN8vkzMxzXFdt_ERN-8isPj5azcNJIw
"Лапша удон MAI XIANG CUN, 300 г",99 ₽,54 отзыва,"Завтра доставит Ozon, продавец Ozon",https://www.ozon.ru/product/lapsha-udon-mai-xiang-cun-300-g-414461793/?asb=u%252FrasZZTWjGa0JYOeU8qXpphfaT2zoW6Bm6EbT9F7eg%253D&asb2=eoohs-5Xdl4lYinNR5BzcH_JNsjpJqywo_zrYwM8Wbtq7fxmNopOI3IGGqsvmioN
"Макароны лапша пшеничная Удон Kekeshi Премиум, 2,4 кг",590 ₽,122 отзыва,"Завтра доставит Ozon, продавец Resfood",https://www.ozon.ru/product/makarony-lapsha-pshenichnaya-udon-kekeshi-premium-2-4-kg-174306627/?asb=nXy75vopK%252BddDQbJV5n3zEIBDjku8DdFktbpdHezF0IK2feqdxuvaorDbrKGccOj&asb2=Fx_K1UE2_yK72e1wTKh9b02hT4RyxgBt43XJsmt4b4Dur5J3IO0FDZrqORwyAed-iYo0gIkc_MAG0gOH7MYsEJcY1i-87Iomb71a4snGUmC7KrKfimWRiHGrXhdllcylBP99WpooP3wlixd5mAOisQ
"Макароны для супа L' STELLINE ARMANDO, ИТАЛИЯ, СЕРТИФИКАТ НОЛЬ ПЕСТИЦИДОВ, 400 гр.",236 ₽,19 отзывов,"Завтра доставит Ozon, продавец Альт гросер",https://www.ozon.ru/product/makarony-dlya-supa-l-stelline-armando-italiya-sertifikat-nol-pestitsidov-400-gr-325141001/?asb=2h4ht%252F7nFw%252BEk8Vz0uGaILL%252Fdq0zkz%252F4cU7PtlrWdW%252FGTpwCVhgIRhwHswqmeQWq&asb2=qcnXAXf0SPLVeEyZVcmbu5nRWOuDHOcN7Swg6XrxE4JacNRYtQT9dLtDd5g17ua6NJvfOS2uTjiBJoqo0VS5pdkebotxaVdPQHcJdslLBzmy8Up3KH6qlScxFTAzGpZc0OxHz71PKeB9syiDHSlKvA
"Макароны с сырным соусом Foody Mac&Cheese Карбонара с беконом, 143г",133 ₽,67 отзывов,"Завтра доставит Ozon, продавец Оптовая Региональная Торговля",https://www.ozon.ru/product/foody-mac-cheese-karbonara-s-bekonom-makarony-s-syrnym-sousom-143-g-167704611/?asb=Z1S1T2Xm6gWKSwZq7SwV760TgdDM1qTw9BWmvhWKJU0%253D&asb2=eVQUNGKpx4kywX2KBsBisxksMdEiLeRc3hcFyYrtSgKqYhlyh2rMSzfb_5Cu3r7_
"Макаронные изделия Corticella Спирали Fusilli №64, 500 г",122 ₽,81 отзыв,null,https://www.ozon.ru/product/makaronnye-izdeliya-corticella-spirali-fusilli-64-500-g-266453736/?asb=TYHCCXFlZrsGgg196A8sXF96hFCBvhHdZL%252Bp4CH1cTE%253D&asb2=gKKDw3efRF7aqECcJkTssBlVbVhLe0NIvzjdjbbk2SWz-cOC9Gc0z37hOEpI3X2u&ectx=1&miniapp=supermarket
"Макароны Вермишель Фунчоза Kekeshi (в брикетах), 500 г",265 ₽,179 отзывов,"Завтра доставит Ozon, продавец Resfood",https://www.ozon.ru/product/makarony-vermishel-funchoza-kekeshi-v-briketah-500-g-173866985/?asb=BqaZE6lujaS4Tslm2UgD9g6tDNgVKIzN2AZgDPcwmYKLOcZiTe0ixNcs%252FItmMWoQ&asb2=Pmq4OlrBpNaDtS-ESYAaAkCw6j7in7ge33cWfdcVc8xIkUIz4LFDHRii2sZM8W-NQChlKWj6ob2FpIMyyRrAvPSYzBmPS7UWPyeeghPwziN8PrJjyC3JH-PvU3YY2xHay-IxKUSJFN7I_V10HUPF1g
"Макароны без глютена ""ЕШЬ ЗДОРОВО"" Ракушки, 250г",160 ₽,10 отзывов,"Завтра доставит Ozon, продавец Корпорация Ди энд Ди",https://www.ozon.ru/product/makarony-bez-glyutena-esh-zdorovo-rakushki-250g-335299159/?asb=8DC6Gk8CDahbp%252BF1SlHbNa7n%252FeCHn4KCw6fb2uUlqec%253D&asb2=XxFzQ9T_jvrcBEqFXlnDrS5-FuG3sqgfA2qRc-wREq3mo4KFjuZZRA8aUq9jipU0
"Макароны Спагетти OZON fresh, группа А, 500 г",89 ₽,196 отзывов,"Завтра доставит Ozon, продавец Ozon",https://www.ozon.ru/product/makarony-spagetti-ozon-fresh-gruppa-a-500-g-400324858/?asb=EJmQYvlw2%252BXyWaKmsAt89nwXEGY5UPioAeey2nXIKi0%253D&asb2=RvbHlrZPBcQ0x2jG5Ck84qCNTDOMVjzs7DKVpo2d3sLL3YGLsUM7G7LGV2UB6RG3
"MIDORI / Лапша Ширатаки Спагетти, без глютена, 200 г х 3 пачки",668 ₽,24 отзыва,"9 мая доставит Ozon, продавец Gegl",https://www.ozon.ru/product/midori-lapsha-shirataki-spagetti-bez-glyutena-200-g-h-3-pachki-531820048/?asb=Kdzo1CSW%252BG48J5MEiK0t9w39pMwTCCgLdjUNVsF3evI%253D&asb2=AmTMLSFekIWMootNKKV0ep0CC2bOO2wxe3JvvSA_3FkgwjFYEzulUqP1EGKznhZ2
"Макароны/ Пастины для супа I DITALI GRANO ARMANDO, ИТАЛИЯ, СЕРТИФИКАТ НОЛЬ ПЕСТИЦИДОВ, 400 гр.",246 ₽,19 отзывов,"Завтра доставит Ozon, продавец Альт гросер",https://www.ozon.ru/product/makarony-pastiny-dlya-supa-i-ditali-grano-armando-italiya-sertifikat-nol-pestitsidov-400-gr-325212500/?asb=9%252FwxKINsGhVA9d1hwdE3SAtukT9Q9uX2vUJs%252FpQjUSKRwOJYF3LyXxmDSlXsCnYc&asb2=la5V7R4DcSIkMlw8o6wj0nwZzTSlxa_RMmYtXGd9NVgEEJCyvoKHRbZJ8ccyhHOPUhplj1NuQzz82N296bsXKnzuJDAetGTEM5udkd23O7tZvOZp3I1nq1slhHnAkummByakKJqvwiohLbL6terJQQ
"Макароны для супа Алфавит L'ALFABETO ARMANDO, ИТАЛИЯ, СЕРТИФИКАТ НОЛЬ ПЕСТИЦИДОВ, 400 гр.",246 ₽,19 отзывов,"Завтра доставит Ozon, продавец Альт гросер",https://www.ozon.ru/product/makarony-pastiny-dlya-supa-i-ditali-grano-armando-italiya-sertifikat-nol-pestitsidov-400-gr-307931492/?asb=NpQFgmjQWeQiX86GPiEqvNSk1qU6eTBF%252FybHOwwo1yxb5r3XDJwyJGEeUuMZLFP5&asb2=CmJVMMV9byCwxEJkeQ9rZnBuebZzORaih9Id-4HQ_K5lHOVLrtquh0iC9RIJ25aQrliH83kg2Vh4UkJFIyW__VA2oFZF0pA8t8_4WOzp_OkJYVRAUU6IQ7vUVCeCnNyEmuCYWdP5hF95ZhvrBLImXg
Лапша Бесбармачная (Бешбармак) 250г Упаковка 6 шт,440 ₽,26 отзывов,"Завтра доставит Ozon, продавец МакСтори",https://www.ozon.ru/product/lapsha-besbarmachnaya-beshbarmak-250g-upakovka-6-sht-470158816/?asb=DO0nBqeZxCqkrV7VwiTkLmLxaV5G4wesnWYTV%252BYL1YaUP5shuPYNrHaVfYzrW0M8&asb2=oK3SmZl6kLMOZK6FV5zC0O-DePlUifc5u7LXnXBAH4l2Vfc8of3gdxB24nXP2epRtBHTnUAYHZoLmtyATehXoarUZRyxD4HatpVDM9agwgW1NABWnjnP_owlYqEneYhfml9FRxhrnhgdTr952TPrbw
"De Cecco паста Феттучине-233, 500 г",363 ₽,34 отзыва,"Завтра доставит Ozon, продавец De Cecco",https://www.ozon.ru/product/de-cecco-pasta-fettuchine-233-500-g-213166938/?asb=WZbieZKl63qOc1xzESwHxNYHoIWCc1kA0D8MIr%252BUZ9w%253D&asb2=a3lrCQhMS6o6RjHMoGUM32tXCP3K-EskqUZMo_3-J3WRINX5aL5XWmR620Qy4BXF
"Макаронные изделия Bravolli Птитим, 400 г",173 ₽,168 отзывов,"9 мая доставит Ozon, продавец Ozon",https://www.ozon.ru/product/makaronnye-izdeliya-bravolli-ptitim-400-g-387942904/?asb=tjF8Na5Xohu8AU7xX%252BLvn%252Fi4Ng4cLS7C0HhbTU7ZCsQ%253D&asb2=jxaF1jZoZ5WKMoAIiVtuUsG8QJllv5KZxt-9XGmx0ZjiDnLj2ziDEw_W--umBQC2
"Макаронные изделия Bravolli Орзо, 400 г",168 ₽,168 отзывов,"Завтра доставит Ozon, продавец Ozon",https://www.ozon.ru/product/makaronnye-izdeliya-bravolli-orzo-400-g-387942926/?asb=oJ2tBGtxlTSeLRqUnfW%252BDmxxVC%252FhC5Ih2IPkWuzn4oY%253D&asb2=EKYLSnQQyWJRovPxq06j4raOwjgLlpM5Kq-0B10nhLanMw8rI_Z81kMVJy_KZbi7
"Макароны с сырным соусом Foody Mac&Cheese Четыре сыра, 143г",138 ₽,165 отзывов,"Завтра доставит Ozon, продавец Оптовая Региональная Торговля",https://www.ozon.ru/product/makarony-s-syrnym-sousom-foody-mac-cheese-chetyre-syra-143g-326360815/?asb=FUjiZ2YxW2LSEznwWv4ufVwIRGx1HAjlf8gHdd42214%253D&asb2=sdHzoxqcPW9rswEd_IFZKLJaHPTcgxqXcOUeDNS63ko6DOUqiUopqwalnj-Pemdk
"Макароны без глютена ""Ешь здорово"", Спиральки, 250г",160 ₽,22 отзыва,"Завтра доставит Ozon, продавец Корпорация Ди энд Ди",https://www.ozon.ru/product/makarony-bez-glyutena-esh-zdorovo-spiralki-250g-335355608/?asb=FLaYtJl8sULAI3YNurqo2Ad9DZ5qIC6JZiSDcB8mZnY%253D&asb2=qPm5Yh4YszqZvw3hPS1qfnBbj9NMvuiPIVdejHTeclmE6ApPl9Qb_xVkggdHg4YS
"Паста гречневая Иван Да безглютеновая, 250г х 3шт",473 ₽,27 отзывов,"Завтра доставит Ozon, продавец Оптовая Региональная Торговля",https://www.ozon.ru/product/pasta-grechnevaya-ivan-da-bezglyutenovaya-250g-h-3sht-248858981/?asb=CKW5I8hNScjfdU8t5RAfDxUrMxYitNN1lkJNAtxKUYw%253D&asb2=R3NKRyksZkj6FwuzisyNKxXUVUQypNM5O07zSqSeT9uGV0Uso5FM25IMvd640Yqk
"Макароны ARMANDO IL FUSILLO ФУЗИЛЛО Италия, 500 гр., СЕРТИФИКАТ 0/НОЛЬ ПЕСТИЦИДОВ",285 ₽,58 отзывов,"Завтра доставит Ozon, продавец Альт гросер",https://www.ozon.ru/product/makarony-armando-il-fusillo-fuzillo-italiya-500-gr-sertifikat-0-nol-pestitsidov-351889107/?asb=%252Baft1tqw3dqs4ZjwMinvT%252FqI0myfydY1ZMmuBWyJLJ1PBVVqDcJvhVHe2lMd0usb&asb2=5s0dE9pc4ER5wNlgDgEzs1LvDjWbLaz98pYepVL0xmQb1o2ZXzsuAYj_tRXVHDnWPLSRfxQLVQltvGb220tZMI4h9t-QSHnqqV_0X-iMGaZ2StRz415wWBpqGn3XLGRk6TzvJx-x4MuxCrVEzO7yIg
"Макаронные изделия 3 Glocken гнезда Fadennestchen, 500 г",259 ₽,72 отзыва,null,https://www.ozon.ru/product/3-glocken-fadennestchen-gnezda-500-g-34859489/?asb=PI2M%252FrE%252FZEtRgDeknqcWG74mEg7z0pwMzbkHRS1Z96U%253D&asb2=zX6p6txhdohJSIntW8JA2D7uh5d_32l9DzZTW2oHiH57vs7E2Um0VtTMHwltjHs5&ectx=1&miniapp=supermarket
"Макароны паста из твердых сортов пшеницы Rummo Классические Пенне Ригате n.66, 500 гр.",331 ₽,20 отзывов,"Завтра доставит Ozon, продавец Funtasy",https://www.ozon.ru/product/makarony-pasta-iz-tverdyh-sortov-pshenitsy-rummo-klassicheskie-penne-rigate-n-66-500-gr-485636959/?asb=PSO3C0S%252BaRw3okJUZD6YodUSRJLPjkOlJF8H834A5CHQM%252BH0H54AfgSth8wToloK&asb2=CMh2bA-uYpLXGjsh2QqwgiOD1Dxc4qw_V4_6JSQuZK2b5ore58BAodexbBCOaPGLc_Rdo2JbCkBsn6n9aZr1C8THJX0kd-LO4JV96xPIr8ddZH-FNCa3xSkPbgH6x4989rQoLeZNoP9yD3OlNqmphw
"Лазанья GRANO ARMANDO LA LASAGNA Италия, 500 гр.",293 ₽,58 отзывов,"Завтра доставит Ozon, продавец Альт гросер",https://www.ozon.ru/product/lazanya-grano-armando-la-lasagna-italiya-500-gr-351892595/?asb=eg22fFQAiGQLrfjXIa9HabBvaktdtVdyDn26HVnx5mn6eZxDwL%252B56p007qM8Ip6R&asb2=5tyty6RmRtzTcI1k1uCW2RqvGxF4ZfJXEb0VToOayCYworMnGgUamcMFBtgleXeuBK8tcZz7eSIl3ueqIo9uiYmjnxz0uYCGBgbV-1oCU3E3syo5pjr6FgSQUkOq2SCb40shgHDPhlLx7xAIEeAc8A
"De Cecco паста Фузилли №34, 500 г",273 ₽,31 отзыв,"Завтра доставит Ozon, продавец De Cecco",https://www.ozon.ru/product/de-cecco-pasta-fuzilli-34-500-g-212024748/?asb=EUhe5usHyORUJgkKo0pVbFel8qBn%252F2JFOu2uHotPe3c%253D&asb2=H3rCHqeAkTh7eaVyZOm6SC_dmNQbP8AsQYeMSMmqYSJ1Sz5swpnvxpwR8XsnqxoW
"De Cecco паста Фузилли лунги букати №5, 500 г",273 ₽,67 отзывов,"Завтра доставит Ozon, продавец De Cecco",https://www.ozon.ru/product/de-cecco-pasta-fuzilli-lungi-bukati-5-500-g-213166806/?asb=o7oYr%252Fr2VhY6ffG9HnaEt%252Bp644DI%252BePCrKiWqvpdZU0%253D&asb2=_nKMz9BS7ZC6HnUKSchOB3zUxVoR8y_JbDpTMntTWRYOQIgy9LOlENFnkLV1uhCi
"Макаронные изделия Corticella спагетти Spaghetti №4, 500 г",171 ₽,56 отзывов,"8 мая доставит Ozon, продавец Ozon",https://www.ozon.ru/product/makaronnye-izdeliya-corticella-spagetti-spaghetti-4-500-g-266453746/?asb=XKcivz9AvoTljgSnAy2EG9ksgSz59VtgPdkttVwg7ts%253D&asb2=2s1P8SXXQ2jOx24uWwrg4EGOsPeZpTmo0jJv8ZQZqTx4yPgs-Hp6fy1tjrQvcd5f
"Макаронные изделия La Pasta Naturale Фузилли ассорти (шпинат, свекла, тыква)",291 ₽,29 отзывов,"Завтра доставит Ozon, продавец La Pasta Naturale",https://www.ozon.ru/product/makaronnye-izdeliya-la-pasta-naturale-fuzilli-assorti-shpinat-svekla-tykva-269030981/?asb=3Lz0gxwaGYwD3TxRR1vj8Pax7XbcAh8OtOmCSl9aqjHl4ZZVFttH0cQ87OiM3OR0&asb2=MRJbOXO3htLtyh2ysIyPGE7meUz3OOMPD1nYJGDIZzzdAdMaMrQYYKaQ5Oy-amUhXvLy65ErjY7tc_dUei5PCwT5ro2t62VB4wODyeW2H9EAjEVPV8z_Z6k7WSMsddY0UVmmVrSg4pWsAl6BhNXiEg
"Макаронные изделия Bravolli Птитим, 400 г",218 ₽,3 отзыва,"Завтра доставит Ozon, продавец Торговый Дом Ярмарка",https://www.ozon.ru/product/makaronnye-izdeliya-bravolli-ptitim-400-g-540190009/?asb=DgFLs9NXtm140DzaxYcVixskPaumCfBNgwBxBwx1FQ8%253D&asb2=njgH_AZFE1jNrf0OGnWhuuTfNpMEVZdPiXOEbK4hHO24jhKPiZlezwq-lqwnrmvi
Макаронные изделия De Cecco КОНКИЛЬОНИ РИГАТИ №126 500 г.,363 ₽,7 отзывов,"Завтра доставит Ozon, продавец De Cecco",https://www.ozon.ru/product/makaronnye-izdeliya-de-cecco-konkiloni-rigati-126-500-g-306942269/?asb=NpGFWrsA3OsaolF9%252FEnleoL%252BRekNU9iDxsCS%252Bih4mDM%253D&asb2=TAOzq7X68_BnTD7SBDJgRen1T-0m6jVMTiEHIaO61XqVMxrORvkzW5NJlZojM67Q
"Макароны BARONIA, SPAGHETTI NERO SEPPIA с чернилами каракатицы, Италия, 500 гр.",369 ₽,161 отзыв,"Завтра доставит Ozon, продавец Альт гросер",https://www.ozon.ru/product/makarony-baronia-spaghetti-nero-seppia-s-chernilami-karakatitsy-italiya-500-gr-307959617/?asb=GJK2%252BwB7A7jOkpHgH1FK4NxxE9dh7mhclMvfL3itdChOZWbP9NC9F0rHAXyQpWwt&asb2=SQv9NAh8D60LiyKEoILeompebJ5TSDnh1ZY15Mj1e2WzQUWEcZycKg6CsYZr27n5_cf3FWXgBiXnxUXTFXDsG-Nqw4efh5_d671nAtiNRaDASFBE1lq2qUkgZz9o7Wp7tH-HX6qGkmPUj8ydBmVZHQ
"Макароны ""Алейка"" (Алтай), гребешок , 5кг",585 ₽,36 отзывов,"Завтра доставит Ozon, продавец eco-product",https://www.ozon.ru/product/makarony-aleyka-altay-grebeshok-5kg-214504924/?asb=IXZxw5%252F1NEvs0c0xlrodx4tou5r3ZyKf5%252FS9BP4ouv8%253D&asb2=9QZZ41d5FYRlF_K8emrCvBoQcUSB5RI85uZvGatJUIzzLGobBgLEMcpoYxxwl2Wp
"Макаронные изделия Delverde гнезда № 089 Феттучине, 250 г",212 ₽,190 отзывов,"Завтра доставит Ozon, продавец Ozon",https://www.ozon.ru/product/delverde-089-pasta-fettuchine-250-g-141020182/?asb=Kh4LCO8fVR8Ao2%252Fy4Jf4e8T%252BipRIh1%252F7zm12MRM6uzI%253D&asb2=lYsVLmEDQbV3aiu8zNvNTVZ1GG324Xh8c2ryekCtvVssqsQPcabeDMMlTVsWzq7w
"Макаронные изделия из твёрдых сортов пшеницы, макароны для детей, цветные, органические, 300г",230 ₽,14 отзывов,"Завтра доставит Ozon, продавец Little Art",https://www.ozon.ru/product/makaronnye-izdeliya-iz-tverdyh-sortov-pshenitsy-makarony-dlya-detey-tsvetnye-organicheskie-300g-482206891/?asb=dNJWIqn1s6pet8iY%252FcJKsR%252FmT3S83Q697wqecvaPwkQLSQP%252FvlMkvsUufkS2RbZC&asb2=ivcdHcsOlLYsBNs43SMGRn9DwPV1ihWddyRd0Af1up7X28CUdwymam8beELTVwD-LGM9IkkeZ__97AFYqkbiVA0mI2-m87qOpyD0fDgA1eP7hAu4OKPGLQg21U9gEjbTa7sF31ymLb2NcwggWyGCjA
"Макароны паста спагетти Rummo Классические Спагеттини n.2, 1000 гр.",541 ₽,6 отзывов,"12 мая доставит Ozon, продавец Funtasy",https://www.ozon.ru/product/makarony-pasta-spagetti-rummo-klassicheskie-spagettini-n-2-1000-gr-526244873/?asb=2x%252BJeDt3PnFyXe1zFi3dcoi7GgBzjR8UPHie9KzQr2AMQrzduFQMABgwxEiacVsM&asb2=xXVA449UwrwNAbUV5GKd4GXaD8-_hkA1K7fwtbER7ZjCbm1LM7zuFPFNT2Gj8yZDVA0DKOcR4o8VZj-3xiRp-NUXZfk-J2ziSkDyJt6w9L6YkvWJG1GxPaNgxfgDZQ0uWCq6tgRKfRtaylWV4de3Gg
"Здороведа Макароны цельнозерновые из полбы ""Спираль"", 3 шт по 350 г",366 ₽,2 отзыва,"Завтра доставит Ozon, продавец ЯLoveBeauty",https://www.ozon.ru/product/zdoroveda-makarony-tselnozernovye-iz-polby-spiral-3-sht-po-350-g-526754527/?asb=Xc98nLNf0JLK%252FncQAYIkq3DI1Lllldzqp3Ynin2LoJDwz7l%252Fw6yOtuc8HJgdw1sg&asb2=vnAEG7yohHccvLB-PYYUGOrXWC4MDX7sYAtGSAitWWE1KrVYDy0baTAdBBlVNiLyo4IlnzsJ2r8DfiMvF3Xruk41-HeU2DLzFbSJvgZQyy4xRn9-rJ-q_z4ZQAd6nsLNZHkLYvU-fO-ZWMUGbwDRDg
"Макаронные изделия Divella ракушки Конкильони, крупный формат, из твердых сортов пшеницы, 500 г",259 ₽,19 отзывов,null,https://www.ozon.ru/product/makaronnye-izdeliya-divella-rakushki-konkiloni-krupnyy-format-iz-tverdyh-sortov-pshenitsy-500-g-193915355/?asb=UbIg9gjGJt9ZR%252BvihFDinF%252BkwReMR%252FiQnJfxWnFhglg%253D&asb2=PZku7qhhb87xtVpVQKA7WLHpmIf5H8OKSrO5OCLLNJzkVYU9GVVMZ6H9X7Wpinh8&ectx=1&miniapp=supermarket
3 Glocken Makaroni макароны 500 грамм,235 ₽,1 отзыв,"Завтра доставит Ozon, продавец Концепция Вкуса",https://www.ozon.ru/product/3-glocken-makaroni-makarony-500-gramm-530368442/?asb=AK7PPE%252B%252Bh5nzSGGwC7VUZSvP9mKOEXIzNC26D0gIPrw%253D&asb2=WAQ2QAhlQ08G8c-91M9xnWRDihHvrr7hGqP0YuIppsfW_lUkac3iDYTuACXhoSEK
Лапша Midori Ширатаки Феттуччине с побегами ячменя 200 г 3 шт,730 ₽,10 отзывов,"Завтра доставит Ozon, продавец Три-С Фуд",https://www.ozon.ru/product/lapsha-midori-shirataki-fettuchchine-s-pobegami-yachmenya-200-g-3-sht-307880488/?asb=ZdwRgFsLPvpXPu9Jo4Q9qvdD5ImdgMq%252FXs9sHzm7vlY%253D&asb2=23VrM3P_OA-ExUIt07vVovgjnh9l_mVhcCWDwaj-rMTvTc54NBnQ5hPfW4lc5MLQ
"Макаронные изделия Ешь ЗдорОво, из амарантовой муки, Перья, без глютена (5шт * 250 гр)",635 ₽,27 отзывов,"Завтра доставит Ozon, продавец ХэппиДом",https://www.ozon.ru/product/makaronnye-izdeliya-esh-zdorovo-iz-amarantovoy-muki-perya-bez-glyutena-5sht-250-gr-256831284/?asb=qyn0Gw7RvDEUVJUqXZizQ0%252BPxGtb4%252FMSMD1atW3ILW7F8hXm8bllHlG7nY9aLdpw&asb2=wc4aTCt0gziwjvQzq14EISZe-CsXmv66tZi9C45qwaO6BLo52R__oc3o_YD_e9nQGSYZ2SpFiAU_HejsF4fWNvOWaiaB6i2PaM35QaqYcW1ohU4iX-qv5xkK2diev8YE8dLpGYz8gHJuQ48uWRUW1Q
Макаронные изделия De Cecco ПАККЕРИ №125 500 г.,363 ₽,2 отзыва,"Завтра доставит Ozon, продавец De Cecco",https://www.ozon.ru/product/makaronnye-izdeliya-de-cecco-pakkeri-125-500-g-306944506/?asb=L5PlT5y2huhNsyP0VYqpFKZNNLKHJGqoSafDv5SbAYA%253D&asb2=9ZOauJ9371rrSKt2h2NY4iuI9WkamU-B8w6vCuQIP733ILSXoOUtMN0nZ8rQsxxZ
"Макаронные изделия De Cecco спирали фузилли №34, 500 г",254 ₽,51 отзыв,null,https://www.ozon.ru/product/de-cecco-pasta-fuzilli-34-500-g-166190542/?asb=GkHLItMR4VBtlrh3zElgBelD4bAN793ttbIHIiA775Q%253D&asb2=qUcmkw2mNFnugo7A5ETXhj6OGNkvu3RWszxx0rdWk7QqCdqdKEpD-SNBVRVlL3sK
"Лапша яичная для супа домашняя фермерская Настоящая Сибирь, 250 г",139 ₽,5 отзывов,"Завтра доставит Ozon, продавец Лапша фермерская яичная",https://www.ozon.ru/product/lapsha-yaichnaya-dlya-supa-domashnyaya-fermerskaya-nastoyashchaya-sibir-250-g-524549369/?asb=Q%252BRej5ShvKc%252FZ15VRyrxSH2QaNIRyVbgtVEFVpwjFbkRN0oB3eThqt%252F3fJYwHRKW&asb2=ttUFhiW_FK3eb24Opo1Aq9cOc-qiveIODnCT-BW8JqOgOeVSZdwn-O8qCwbA7sU5jklwLIN9GO657xZTED7Ww-uQMd5s7sgfFkETERL0Mm44rBplF6br70zdZlH8JY4iFzXYlJhfXTkcRpOfzIS1sA
"Макароны BARONIA, FUSILLI TRICOLOR (Спиральки с добавлением томатов и шпината), Италия, из 100% Итальянской Пшеницы Твёрдых Сортов, 500 гр.",274 ₽,161 отзыв,"Завтра доставит Ozon, продавец Альт гросер",https://www.ozon.ru/product/makarony-baronia-fusilli-tricolor-spiralki-s-dobavleniem-tomatov-i-shpinata-italiya-iz-100-307959412/?asb=yJ9X%252FdAiqhRCjFdY9SSRGwjb66Tcem32ja2xtG%252BBFb2lmeg8A4gmYztDvvKCxMqj&asb2=B6WhgN9_muxyTLwOeTmLeW_brBQJsGJpfLPsz8T0gB027zl_FjK3czfmNcYcS5PihfiXRZ0hgR9gCOSepY7mjbfPVexB5-KZgKGrxVmeX8Y7jnIee3HEyO1DIgrLK10egYMr50OxlOITXdAysHIM3w
"Макароны ""Алейка"" (Алтай), рожок витой, 5 кг",585 ₽,95 отзывов,"8 мая доставит Ozon, продавец eco-product",https://www.ozon.ru/product/makarony-aleyka-altay-rozhok-vitoy-5-kg-213665195/?asb=lkt0UGa6OlyS3EvIOYiC9BUh3GKZIaF0E46MLFuYNpk%253D&asb2=xePjVp5QgflBUin6xNc8XPwsvZ0DBLyDIy-APw4IKT90Z80i7uXB3nKunvVlEvn2
