"Макаронные изделия из твердых сортов пшеницы GranOro Biologica Integrale №100 ""Фузилли"" 500 г",292 ₽,1 отзыв,"Послезавтра доставит Ozon, продавец Меридиан",https://www.ozon.ru/product/makaronnye-izdeliya-iz-tverdyh-sortov-pshenitsy-granoro-biologica-integrale-100-fuzilli-500-g-277949451/?asb=cQrbbBYaartyVxxWZC3bIRcVQXw4ZLty87mLfIJLR%252Bo%253D&asb2=UuxeqMRfL0Fi_3rwVg7Bcj7IrWxXWSzCw2yaD7CwCoiJvHLV5ipK6kAvjz7ZGDj-
"SanBonsai Udon лапша пшеничная, 300 г",200 ₽,4 отзыва,"Послезавтра доставит Ozon, продавец АСК",https://www.ozon.ru/product/sanbonsai-udon-lapsha-pshenichnaya-300-g-161828515/?asb=vujID5HKn8XxqFfKd6NnVrjP%252B%252B87jIWhJMmuWrP5kpSiTUM44xvWIQKfy9eQ6HcE&asb2=sutz_IJDfl3akuFx3mk_so8CbpgRL0RZT63Aqq1w7uKB_NA79gzkd47c8XSZzRSzxiqSQrcCQGF9N1hwf7WrBH_6u2UoOvX6h-AKDgZpHOKEt_nf0T3vRSGIdiD9QUyjHkStDQvIVfvVyjDxtoSF_A
"Макароны без глютена УМНАЯ СЕМЬЯ Vita, из пророщенной зеленой гречки, с биофлавоноидами. Спирали 250 г",244 ₽,2 отзыва,"Послезавтра доставит Ozon, продавец Миродар",https://www.ozon.ru/product/makarony-bez-glyutena-umnaya-semya-vita-iz-proroshchennoy-zelenoy-grechki-s-bioflavonoidami-rakushki-367537856/?asb=TqALWYDrNvwK4SBUU7dMZcdGMT3mPbKdQFP%252FOl84ar8%253D&asb2=LFmI6vKBUCgLdBi2--Z4u9a2XacRyyJkxpNgEgO6ME_QL1EXbcYwTtculrJoxblN
Макаронные изделия Тальятелле ручной работы Классическая,230 ₽,12 отзывов,"14 мая доставит Ozon, продавец NeroMulino",https://www.ozon.ru/product/makaronnye-izdeliya-talyatelle-ruchnoy-raboty-klassicheskaya-210076050/?asb=%252BkqaJa3kInOl2aFxUqk%252F2rWy7pe30NNayyjPEIoYuHP3wf9fHw8Qnt3VLypSxHus&asb2=mUccHksXtC4OBkZf6nwIi5Nxfoh2wPPfcFWCZdDFXIx00yMyHbEdZ9zl4OtjcNZjKCowZDkLm5l0NFU0rkllPRMijaYceyD4LBLeBODXe0mVOmty9M-XHjKu_j7My9T5-hv13N2nrkzwHznKgJ6txQ
"Макароны Felicia 4 злака (кукуруза, рис, гречиха, киноа): спагетти, Без глютена",589 ₽,23 отзыва,"Послезавтра доставит Ozon, продавец ИП Прокошенков А.Н.",https://www.ozon.ru/product/makarony-felicia-4-zlaka-kukuruza-ris-grechiha-kinoa-spagetti-bez-glyutena-184794855/?asb=GTgkT0KzijBCTzzomoBI%252B6ZLwsoT9%252FsiPioYwthrRZs%253D&asb2=sygh9D5WFlfJzFUno99skkCzI_Bp2BJjyc1Tv66y0R2ZX9sQtbt17lueIRs2SfdO
"Макароны Fabianelli Баветтини, на свежих яйцах и муке твердых сортов пшеницы 250 гр",369 ₽,2 отзыва,"Завтра доставит Ozon, продавец ИталиАмо",https://www.ozon.ru/product/makarony-fabianelli-bavettini-na-svezhih-yaytsah-i-muke-tverdyh-sortov-pshenitsy-250-gr-396557619/?asb=1sxlzK71T%252Byo6J2zKWiiTEAC5IdJE5Jf%252FlEl2cY%252B7OI%253D&asb2=9bVbS00TdmR9GlHPILWH2-2FajV1iZAVgQ7MWRtfLQOIYNuNB0Xl7c4gqgHd2MU-
"Макаронные изделия из твердых сортов пшеницы GranOro Biologica №198 ""Фарфалле"" 500 г",301 ₽,3 отзыва,"Послезавтра доставит Ozon, продавец Меридиан",https://www.ozon.ru/product/makaronnye-izdeliya-iz-tverdyh-sortov-pshenitsy-granoro-biologica-198-farfalle-500-g-276893940/?asb=NqUcK9B1NuBTckBPqfGyrlicejM3Lg9sY24aTL6f6uk%253D&asb2=YzQKGDreHQIoMMAWyI_RA7C417_0RlARTKcV9_izIG78kgyICTqc4RQJbRgw0r57
"Паста без яиц Dalla Costa ""Любовь"" со шпинатом и томатами, 250 г",522 ₽,6 отзывов,"8 мая доставит Ozon, продавец Вам Вода",https://www.ozon.ru/product/pasta-bez-yaits-dalla-costa-lyubov-so-shpinatom-i-tomatami-250-g-228448581/?asb=om5s8%252BGbHh4yNAzRP2sN1bmoSV%252Ft9xKsIxDp%252FpQGkRhDwkbsnymQuxcj57NGvjKG&asb2=nN2wZ1nTHRkvHFPc4pocIiIVNu7flq8BOb-8HMr5_gDgOm2OG24o99u079CjJ9tgn5SYBePm1y1HpfO5z5jXxjGJ4MJxyrJh25fio6jvl5hEueHtQYKIxWtHREb8y956d1ya9gSesPpOYOjjmi7y1g
"Макаронные изделия Anfosso лапша Тренетте, без яиц, 500 г",409 ₽,3 отзыва,"Послезавтра доставит Ozon, продавец Ozon",https://www.ozon.ru/product/makaronnye-izdeliya-anfosso-lapsha-trenette-bez-yaits-500-g-247066662/?asb=vlbseRFEpRVlcBW%252FPItwbG8JfYNkJGRFfDKVIjQOa6w%253D&asb2=s8nEhcgO6lDbp5dAHH1dyFuSG-cI05RfWcdLqbI6QnuCADYQSJcq9tINdjZKuoiS
"Макароны Midori вермишель из сладкого картофеля, 500 г",568 ₽,8 отзывов,"8 мая доставит Ozon, продавец Здоровая Страна",https://www.ozon.ru/product/makarony-midori-vermishel-iz-sladkogo-kartofelya-500-g-196379191/?asb=LHEObbklVbuTCBOEIhT7kxVQ%252BoSs5QWRVRFPZ87fahg%253D&asb2=yPVGT-OyLNHRTlqcA5Eb7o9xTkKgT9U-Pm7rJbvsSBf5YTWsshsCU41WeQE5gxsA
Макароны Казахстан Лапша СОЧНИ для бесбармака яичная (Казахстан) из твердых сортов пшеницы. 400 гр,561 ₽,21 отзыв,"Завтра доставит Ozon, продавец ООО ""ПАГОДА""",https://www.ozon.ru/product/makarony-kazahstan-lapsha-sochni-dlya-besbarmaka-yaichnaya-kazahstan-iz-tverdyh-sortov-pshenitsy-284172412/?asb=pcZJ9J6PQzhKCWg96neZOFvPpjqa%252B%252FrIufx%252BBKcr8UE%253D&asb2=cO7fIcVDjoThLgiGUZS5-zll5ym8CJF88IdsDvo4caHFfoDStlwdp7B39vQ7pnxu
"Макароны Felicia из гречихи: Ризони, без глютена",589 ₽,7 отзывов,"Завтра доставит Ozon, продавец ИП Прокошенков А.Н.",https://www.ozon.ru/product/makarony-felicia-iz-grechihi-rizoni-bez-glyutena-256144848/?asb=RoS45xh7fLL75g1fmmOdJiEOl7MmKuMcQdLJdrm4Yy0%253D&asb2=_IV3PHlABVWrWAsAeq-_LvyQdz1tgxxBwbJYRvXJTw0dr3qpi4km6dPMDw6hNR8i
"Antico Pastificio Макароны Rigatoni, 500 г",306 ₽,1 отзыв,"Послезавтра доставит Ozon, продавец FoodFactory",https://www.ozon.ru/product/antico-pastificio-makarony-rigatoni-500-g-538542528/?asb=%252BTo%252BO32pO13lUR12h%252Fcs27H6GFUWLjhxlIsLAdZFHGEa88u9n3zwYzoxuDNICYRN&asb2=n0loM2DdRlPJ9V2F4MHhH8MJSLXMxle8lGbmCkoee1cTa4_WkfEoPszAhoqkIdyzLzdnSuOinu-rIiMTmGpqL0hVjknZnX6XT9YvHiqmxY-SPjRRz1xkULJdq3O6YCh16mqkDznXoYzddVI7Hs164Q
"Добродея макароны Вермишель, гр А, 400г - 6шт",658 ₽,4 отзыва,"9 мая доставит Ozon, продавец Гастроном",https://www.ozon.ru/product/dobrodeya-makarony-vermishel-gr-a-400g-6sht-508725944/?asb=Ho4lCOzamYqTy%252BmvcJfRLPu2PU%252B7KhPTpEHW3kLAY1o%253D&asb2=JsU5HQrMJGd8Dbfxrz1XFIISirqSWnsH6ehJTsAnXZQ_7lmF-vZ7PHLYe4AQlyHQ
"Макаронные изделия PALERMO, СКС, рожки, 450 гр, 3 упаковки",265 ₽,11 отзывов,"9 мая доставит Ozon, продавец Куликова",https://www.ozon.ru/product/makaronnye-izdeliya-palermo-sks-rozhki-450-gr-3-upakovki-394368059/?asb=wZ0HarBS46yrEmsccghNFGGe1DIsH6iXI7Wpq2yyEws%253D&asb2=U0Xz-TzBebQ-EW8MAqdDd6hSxoiWn0hi_7jpCdfB_KPF-sO260e8s-Xgcrtedj8Z
Pasta Natura макаронные изделия БИО без глютена из цельнозернового риса со спирулинойв форме ньокко сардо.,550 ₽,7 отзывов,"Послезавтра доставит Ozon, продавец Olivierfood Biostore",https://www.ozon.ru/product/pasta-natura-makaronnye-izdeliya-bio-bez-glyutena-iz-tselnozernovogo-risa-so-spirulinoyv-forme-169458116/?asb=7RgHgtDPFC2FscKughN9wRddHLK9s3ka4PgPWuSFxz8%253D&asb2=bQ-Uxv3AstXHJ-ZFpObzMwG3Zh5grwCuKga8tMgmo0x-DGqp6NU04hmp1kbMcrSC
TIBERINO Паста Пеннетте с цуккини и шафраном 200 гр.,583 ₽,1 отзыв,"8 мая доставит Ozon, продавец ITALMARKET",https://www.ozon.ru/product/tiberino-pasta-pennette-s-tsukkini-i-shafranom-200-gr-212834576/?asb=W7MP9UdXCoSdrBBsb3KRK68bekEcF8C5hmXB5FFwKes%253D&asb2=3w42aJKsgw70ISZMQXv7H846g7fPQFfIAQpX_Xh-hzqua9VowP_UIscRGVZukaOy
"Паста Тортильони BIO 500 г из цельнозерновой пшеницы высокого качества с добавлением Омега-3, макаронные изделия из твёрдых сортов пшеницы, Pasta Toscana, Тоскана, Италия",385 ₽,1 отзыв,"Завтра доставит Ozon, продавец Bello e Buono",https://www.ozon.ru/product/pasta-tortiloni-bio-500-g-iz-tselnozernovoy-pshenitsy-vysokogo-kachestva-s-dobavleniem-omega-3-238805200/?asb=ZgCKYdm6oFqbJlDg%252F%252FgCsty6wBXX26nNPgsOdI4XMzg%253D&asb2=KVMg6rag1kIKGa1wn6YV34zeInBFMzs4y14cDBdUGvAJM4VfLz3EOqmGZe-H8f-r
Макароны Dialsi Маккерони из кукурузы и риса 400гр. Без глютена,415 ₽,1 отзыв,"Завтра доставит Ozon, продавец ИталиАмо",https://www.ozon.ru/product/makarony-dialsi-makkeroni-iz-kukuruzy-i-risa-400gr-bez-glyutena-401069170/?asb=F35naVXekB1NG8JkWpSBMRBklDno6pBRCl%252Fnoff8Vmg%253D&asb2=Y93ZOEImvmMA5F_ozT9RNnDDz2nVs_7JNyeBYNSadfUxILGqAKqwqfh8eps6WdVF
"Роллтон Макароны рожки №13, 6 пачек по 400 гр.",600 ₽,24 отзыва,Не доставляется в ваш регион,https://www.ozon.ru/product/rollton-makarony-rozhki-13-6-pachek-po-400-gr-276362945/?asb=yK8dOB3s0y1%252BDBq%252BCC4lFRI0hqgdXXWjko5Q1mmFmZc%253D&asb2=ZSb_1Qqh9eIFihWpB8CrMManBTXmQDtpgfkeRkLl7wvmn0s0t_vUvn6siw7H_X1z
"Dr. Schar Penne макаронные изделия перья, 250 г",355 ₽,5 отзывов,"8 мая доставит Ozon, продавец ЛАКОМКА",https://www.ozon.ru/product/dr-schar-penne-makaronnye-izdeliya-perya-250-g-170917918/?asb=SAfvToRJPd8aMQj1npcGdt%252FyHXUVDlkJGnFKrXXPRH8%253D&asb2=Qv9op6JDR9zdIcKip5CMLkxLIVAVQcWCdgK-9e2Mf06HOHvS7cH8vFF9nUhZIJHB
"Макароны гороховые (без глютена) 250 г, МукаДаВода",318 ₽,45 отзывов,"8 мая доставит Ozon, продавец МагЗОЖ Оргтиум",https://www.ozon.ru/product/makarony-gorohovye-bez-glyutena-250-g-mukadavoda-489301553/?asb=kZYh6WW2h6Lh5QNZDt%252BaLyu1Mlsyu7XiHvB5smoVkFwtduNUpYl8fn1oWTPTGddS&asb2=KQKy_MpQR44yxNWk_Amj241k51dUo6H2zk5WUvI6-iByozg9-_X8DdS3ucHTDIfOZsfrBoYRPkWi6YApjzqcZsXIg8DCUEvOLeptR59L_s06KqRObi10mxbP2RK8XMkoaV7JUYzyqowVMw0X2_jHWw
"Лапша овощная ""Самадхи"", 250 г.",199 ₽,4 отзыва,"8 мая доставит Ozon, продавец ООО ""Компания Телми""",https://www.ozon.ru/product/lapsha-ovoshchnaya-samadhi-250-g-320398949/?asb=fLwslYidXndQE%252BCxoT1ceU%252FPKw8RIB0wb2KA7MNwqig%253D&asb2=F900CYXSUYGmMFWbMa3RCQmoyTrgOcBH4C4VkVSh6wSVUzIQ-FKyj5GdbOKuLQLu
Макароны рожки-дружки Добродея 2 кг,442 ₽,10 отзывов,"10 мая доставит Ozon, продавец SarkarFood",https://www.ozon.ru/product/makarony-rozhki-druzhki-dobrodeya-2-kg-336295354/?asb=CB2Bi1zal8m1faZg%252F0uZ8XF0D%252FkqGmlDSLu8ptWbvT6rgl%252Bbe9o9pY4227qwzIOq&asb2=KNAzCfw4snareDSX94iCm6LjkmXgjUzfaFXSqYWrivbJsvc-g3u4R9JanqrgSbbbbgqbqdmxoEN0S93SG5f0lM05r9osa30i-eUq-oVSUFt2j6zUJEv_NYxTiHqneY8tRCYmvJOtpPSr_6gRFhqUWg
"Лапша пшеничная Гупо Кукси Saehan Food, 900 г",450 ₽,5 отзывов,"8 мая доставит Ozon, продавец Korfood",https://www.ozon.ru/product/lapsha-pshenichnaya-gupo-kuksi-saehan-food-900-g-322829127/?asb=rZ8pzwZvWxA5soQWpYBtF%252FArhL9hcsgAcnPNSlTAwPbQ4hciHiyePqvQwED5%252BIlW&asb2=8ojZFN4W9Vumaun_SMgBg35qh8necdChIdGZyGT_jtY7jRgT4Acc3EqHNZwT8TdYfSs1rL-dlo4GeljVDPCjUT1PUewTYfWPTKRDx7Hy_2H8vOvP4sFlB2R3OrCDZcD4wdtHJIwXdH0uHeKgh1MAGA
"Лапша в ассортименте,3 шт.в упаковке",600 ₽,1 отзыв,"Завтра доставит Ozon, продавец ФУЛЬМИНАТ",https://www.ozon.ru/product/lapsha-v-assortimente-3-sht-v-upakovke-567801335/?asb=86zIUzJ%252FDXqxPwa5i7GnNv6VncpwUYJUZ3jtWwOAlTY%253D&asb2=OCWoUsujcJ4bv7jFIn-yYFiWnoJNxk9UfhvXEW7USCYp1ZuPR0HoX0NglCYaNrHC
Паста GranOro макароны Ореккъетте Казаречче №410 500г*2 шт,653 ₽,6 отзывов,"8 мая доставит Ozon, продавец Меридиан",https://www.ozon.ru/product/pasta-granoro-makarony-orekkette-kazarechche-410-500g-2-sht-173491055/?asb=5FSyN%252Bioj0DsYQURrLCbVR%252FPSKQHGPFVC9Nh4P9Rnag%253D&asb2=bEm-ITARQ9tW67Z2xwsLxIvOoO1UZ4ohb67bL0wUNAYB8A2JNh6Rthr2zM_eTIAx
"Макароны цельнозерновые пшеничные Умная мама Спагетти, 350г х 3шт",409 ₽,3 отзыва,"Послезавтра доставит Ozon, продавец Оптовая Региональная Торговля",https://www.ozon.ru/product/makarony-tselnozernovye-pshenichnye-umnaya-mama-spagetti-350g-h-3sht-272788678/?asb=hp9x0GJeYdUgRJA7a4TaKzhR7tRpok7GOlqhL0crVqw%253D&asb2=o9swxusHiIoEA-G-dolXp6St5eXqTE-YTsK00e_Xv9I8OrOS0bSKIvaDcncV9rJ0
Макаронные изделия ручной работы Тальятелле с томатами и базиликом 250 грамм,263 ₽,15 отзывов,"14 мая доставит Ozon, продавец NeroMulino",https://www.ozon.ru/product/makaronnye-izdeliya-ruchnoy-raboty-talyatelle-s-tomatami-i-bazilikom-250-gramm-210867463/?asb=%252Bl6fxPXSdJDtViCFv2BBkE9WxymyNp4DkZmn%252F0blsFnaMbv2AP7XC58guhz%252ByIiD&asb2=5SOs1UEEWMvRBwws0dp4rnb_oZxldZpOESYlsfrulUR2hmgny0VxArBDiFx9yCwZ8pUEVBKVr1yEFI0oQ3Ak5cX1Avb57U24sS3TqHFsfikdfgnJhX6B2BGjaI7FM0jwoNjlknFigy3UWQUZ4_C4Yw
"Макароны цельнозерновые из полбы Умная мама Вермишель, 350г х 2шт",373 ₽,1 отзыв,"Послезавтра доставит Ozon, продавец Оптовая Региональная Торговля",https://www.ozon.ru/product/makarony-tselnozernovye-iz-polby-umnaya-mama-vermishel-350g-h-2sht-272791616/?asb=yjvpGRG4BWVyZ17rbPgVgN%252BvKZPBsDZHpqr%252F7Xx7tKU%253D&asb2=YB_v3n4yDWDtebxNi5u8c1lxqrgpE_Os1RpxPkTjZMH6Y5BWfVLHIdD7rrmKx9Q3
"Паста (макаронные изделия) Безглютеновая гречневая, 250г",315 ₽,1 отзыв,"14 мая доставит Ozon, продавец Фермерские угодья",https://www.ozon.ru/product/pasta-makaronnye-izdeliya-bezglyutenovaya-grechnevaya-250g-544914241/?asb=eVjIDaXtEd3pofWXUxro%252Fiooq21HEna7EXnqciTfboZRz6Orgm3GSDNELDX1EZau&asb2=W-Xq8GvFOdEMsAxByS8AuAxqzVLYu_slpuCogIRJEff5rOAcAnH61rJw7-Cs5s0iohQuIcmk1MCZsDSzN8E71AE_7gCOF_ML5xHFUUjY3l1Eshyuye5C1iQ7ZxN0AvfdPMGUs_Fru4GFNt0DSHOoGA
"Лапша Mai Lao da, стеклянная, 0,8 мм, 500 г",498 ₽,1 отзыв,"15 мая доставит Ozon, продавец Экомаркет ""Основа Здоровья""",https://www.ozon.ru/product/lapsha-mai-lao-da-steklyannaya-0-8-mm-500-g-492499530/?asb=q0GDg2IUDVEZoK18R7Roh3jCWT2QQ%252BShzmgp6wBbp88%253D&asb2=KXN-aIyK2xdGOXZMBqKbG3SGQzWR-PiM4mVbTjmZSQmN8FUb1kuZ6y8G1uIHa1z4
"Casa Rinaldi Паста цветная Тальятелле Fantasia (лапша), 500 г",569 ₽,10 отзывов,"Послезавтра доставит Ozon, продавец ИТАЛ СИТИ ФУД",https://www.ozon.ru/product/casa-rinaldi-pasta-tsvetnaya-talyatelle-fantasia-lapsha-500-g-174599254/?asb=dlxErIRS%252FTgllfe7qrmwIfpecpFT3dKtsJnVreAdiF8%253D&asb2=fEx-VXmQiGzbWTyrQEH7mqtBJIdJcz4IeE9SqT42XL_Ox2RYyGyBYJc4dGZCr9-7
"Вермишель Фунчоза Asian Fusion ""Premium"" пакет 150 гр. - набор 2 шт.",288 ₽,1 отзыв,"Послезавтра доставит Ozon, продавец АО ""Си-Проджект""",https://www.ozon.ru/product/vermishel-funchoza-asian-fusion-premium-paket-150-gr-nabor-2-sht-442017189/?asb=JbZ7cvKaBmaQEWtvHZELRf%252B4juwo0IrGvclxKyA28U0%253D&asb2=ETHoi-uHhDEegxDgxf2NePJqxkAMnXknyI7ImY4MfLBXSrIRlA7i9AzE7yR0bjHR
Макаронные изделия Makfa Рожки-экспресс 400г (комплект из 6 шт),674 ₽,28 отзывов,"9 мая доставит Ozon, продавец Мишка ест",https://www.ozon.ru/product/makaronnye-izdeliya-makfa-rozhki-ekspress-400g-komplekt-iz-6-sht-197890111/?asb=SlakHw%252BEq7Uxz08SePCbo%252FGi5aywwwQrsbRQetVAT1A%253D&asb2=EY0yZlhCgYWoThe0h2-SiXLVdmGtO8gveNiex-sFYEsOGNG7Nax6MwG3tDWX3RMe
"Макароны из полбы Умная мама. Спирали, 350г",155 ₽,4 отзыва,"Послезавтра доставит Ozon, продавец Здравое дело",https://www.ozon.ru/product/makarony-iz-polby-umnaya-mama-spirali-350g-154673559/?asb=75n5KQI7W4umayBZhR9Qk%252FdruTJlvyc8WlWELBTBklg%253D&asb2=UaCDa-FMjKb7wsrAl8TZ7GWt7wxuz-wZjVzyw9JIHtb9DImdfa1QfKt9TXitMilF
"Добродея Макароны Пружинки, 2 кг",495 ₽,19 отзывов,"8 мая доставит Ozon, продавец Лакшми",https://www.ozon.ru/product/dobrodeya-makarony-pruzhinki-2-kg-276421983/?asb=sD%252FXvk4amCA%252BC2bhaEUwHfk0j0g7Cr3p9s1%252Fzr%252BwXaM%253D&asb2=U2hyRuwwKc5rq-i7muiGrAO4aQ2rL4snyjm6-s8Zbbcoy_f3YqEetP_40cJz17f4
Макароны спагетти Добродея 2 кг,505 ₽,6 отзывов,"10 мая доставит Ozon, продавец SarkarFood",https://www.ozon.ru/product/makarony-spagetti-dobrodeya-2-kg-431045209/?asb=7kjhsq7qvZfI0RFap0u%252BIqPyNkvRnwNa7P4fVj1DDDg%253D&asb2=KWsJSqqnTeoMuxItYwX__Fh1bqVGhm4fjyKVzpPxKYHgiMlFtVEXkLvnC17gSYkf
"Вермишель фунчоза Sen Soy Premium стеклянная, 200 г",229 ₽,3 отзыва,"Завтра доставит Ozon, продавец SenSoy",https://www.ozon.ru/product/vermishel-funchoza-sen-soy-premium-steklyannaya-200-g-532182373/?asb=8on52UrQcWTzZv2vVJJWu%252FI%252BciECU5lGx0mdcMaZZR1qyNtdcJMegsLEBSyjm09w&asb2=qU_J0zP0qnJDkhkSA8STLt2WsWOVMD1s01Q3zsYf_19U0TWKJuxh0DhvUs88jBq30WEeN3yGAdvaiVCRb5bxoeS-h8LAHp24rKgM6Oe8FXdL1c_A0lN-NYqNK8yBKyhSCcU5xEk5eJp4g8om1yeC2w
Лапша Hanami Cоба 300 гр.,219 ₽,10 отзывов,"Завтра доставит Ozon, продавец ООО ""РЕАЛ ФИШ""",https://www.ozon.ru/product/lapsha-hanami-coba-300-gr-174745115/?asb=nGrwsSMV6o6YJK1Jhy%252FNo1Va2n8HqotKdXNcSt3CwKI%253D&asb2=ZLQ6Zm-7SMUybewTXfK6yMdTKo4PnHGyGvdNJXk3XL6VE6ySE9wAWQq_nXPZa9KT
"ЗДОРОВЕЙ Макаронные изделия из красной чечевицы РОЖКИ, без глютена, 4 шт. по 250 гр.",810 ₽,17 отзывов,"8 мая доставит Ozon, продавец ООО ""Первый Комбинат Детского и Диетического Питания""",https://www.ozon.ru/product/zdorovey-makaronnye-izdeliya-iz-krasnoy-chechevitsy-rozhki-bez-glyutena-4-sht-po-250-gr-396667851/?asb=vWS%252FnPvYkSGf3PSAPTRWixAZy%252F0hddtHnQK68jpu6lE%253D&asb2=L_Y6JBG7r0vBxrFg8uavqKMiLFsNxb9M7TbSidM21HN_4Imhr4KIQWA_nwGKuaYJ
Filotea паста яичная Matassine Linguine / Лингвине 250 гр.,635 ₽,1 отзыв,"8 мая доставит Ozon, продавец ITALMARKET",https://www.ozon.ru/product/filotea-pasta-yaichnaya-matassine-linguine-lingvine-250-gr-226072315/?asb=DfrJ7HoUy6DFw4ILCGCllvnOH5c4fZm3ceRIQhrqqqc%253D&asb2=Cw4pXoUb2i_QeOOqe4Fe3k4iw8PZRw42XYZx5UiLZOcXkR3VzVXpDw5hRkABygrF
"Макаронные изделия Anfosso гнезда Тальятелле, без яиц, 500 г",409 ₽,3 отзыва,"Послезавтра доставит Ozon, продавец Ozon",https://www.ozon.ru/product/makaronnye-izdeliya-anfosso-gnezda-talyatelle-bez-yaits-500-g-247066654/?asb=0r64rKk0Xy9AYkl0UXDveVO1%252BDiH92L5VvfGdqkMF5g%253D&asb2=y7SFREUKBpBHS2PTBeP2pTDkzQ_agyb1dAKYZCCj_otKpttNvQbPyJEItJ6VdrQ_
"Лапша ""от Мартина"" Волна 350гр., 8 шт.",789 ₽,3 отзыва,"9 мая доставит Ozon, продавец KataroGrad",https://www.ozon.ru/product/lapsha-ot-martina-volna-350gr-8-sht-482282889/?asb=s6KPA6tUKfxWnd9Pv6fTML2hztcsmoBR7pYa0yRBH6I%253D&asb2=N6dancavDOyy-QRtvhYh6Ed9ntYVsM-Zc6JyELSyk-sbHczYc9Omq2Uq2pENvE_6
Макаронные изделия Тальятелле ручной работы с белыми грибами,349 ₽,13 отзывов,"14 мая доставит Ozon, продавец NeroMulino",https://www.ozon.ru/product/makaronnye-izdeliya-talyatelle-ruchnoy-raboty-s-belymi-gribami-222911391/?asb=hsCA2eTZpTj3XcAvaTju%252B%252FfYAFEEfGlv9%252Ftn1%252Fr7RUDaLCUzX8V13u4pgzOfPatv&asb2=3e6nNBV5k_nSUhGH-3SwXDBqeeIh2UTk1hHPdkB39lFZedFVTYh_ywNB1FBVZXMzuv8a3gDekBInNvmptwEd1qzXFfj82n7x2qoNf9MSt__DsyNr8txYT3V6j-9QGyFbF2GtrArMdrN8psehHBVUmA
"Макаронные изделия Granmulino Спагетти, 7 уп по 400 гр",707 ₽,2 отзыва,"10 мая доставит Ozon, продавец Milky Way",https://www.ozon.ru/product/makaronnye-izdeliya-granmulino-spagetti-7-up-po-400-gr-358963874/?asb=lJXO9uLpWSra7V4QukuD39vx0HY3MjFVP8baz50Lxuk%253D&asb2=pro2o5hUs1fWsvvaHDbVMTF9pRQXHfImqwUR600EUiav3bweCZgw-0m0Rwun_8eV
Суп детский с макаронами СМЕШАРИКИ,650 ₽,5 отзывов,"8 мая доставит Ozon, продавец Эко-Лавка",https://www.ozon.ru/product/sup-detskiy-s-makaronami-smeshariki-449331231/?asb=SN7IwYeWC4rz1M1jc%252FcbcAxpdfUujhba4D9w1mFLO24%253D&asb2=eNAw-6VjjJgOibs6PduEB68xGTQaNzkrWVCdNCVYwb9_Er_OXTgzAV8Z8TVjjRxr
"Макаронные изделия Лимак Рожки, 450г х 10шт",594 ₽,8 отзывов,"Послезавтра доставит Ozon, продавец Оптовая Региональная Торговля",https://www.ozon.ru/product/makaronnye-izdeliya-limak-rozhki-450g-h-10sht-219157597/?asb=Uw19bICb7hjIvqYPU1qYlDZlYGXLkoRBDzQOvDvmd4Y%253D&asb2=3E26dFnKmoMhaQ6L7VKxFkPxM-ZGlEnNMhyF9y25d91Lh6BIb_fM__VDlvTqM4Gq
Макароны Ракушки из амарантовой муки ODRI (6 шт.),699 ₽,13 отзывов,"Послезавтра доставит Ozon, продавец ООО ""Натур Импорт+""",https://www.ozon.ru/product/makarony-rakushki-iz-amarantovoy-muki-odri-6-sht-174428847/?asb=rZ8FqWEXckprfbSoFRVn4XrGhkKTh%252FBwQTQXP1W1RPI%253D&asb2=K0OI7jlgd79BANy4IxnreCZAoUg7aXNUGIsDavJvPKrko-tJ-pqtxQoCfXB1xOjJ
"Pasta Natura макаронные изделия без глютена с амарантом,теф и киноа в форме фузилли.",490 ₽,17 отзывов,"Послезавтра доставит Ozon, продавец Olivierfood Biostore",https://www.ozon.ru/product/pasta-natura-makaronnye-izdeliya-bez-glyutena-s-amarantom-tef-i-kinoa-v-forme-fuzilli-165401279/?asb=gFdffhiylF3t5ieu6h4DIDuyJDLRSXq60prPTnzt2GU%253D&asb2=-T3CAruSAt7GvlUTVOVNaAnIjZgK_FtjPb4NF6rpY39ogSrxatFevJmAn5M79BGM
Макароны без глютена Спиральки Eliche Le Veneziane 2 шт по 250 г,975 ₽,3 отзыва,"9 мая доставит Ozon, продавец Диетмаркет ""АМБАР""",https://www.ozon.ru/product/makarony-bez-glyutena-spiralki-eliche-le-veneziane-2-sht-po-250-g-193593786/?asb=qLZ%252FZ%252Bqdnl8dCKJsIIn3cdbnSRpHSin20UGV92Exm25cN%252F2FZhrm6yBbsugKQjQg&asb2=Kpeo4NJM7wAV-KwZUmHmLyhks7Qm-9lqfDQY4CQkbLn3eKm8fsQAh49xudmaU2wVBMNQxT0sJOG3zPbB2clnw5H8UNo6zapt20IKp-lVENrXhuyD2aPOEbJRyBiVxjAnINV7sqbYWcvp2dQk7vX4aw
"Casa Rinaldi Паста Букатини из Лацио ручной работы, 500 г",499 ₽,8 отзывов,"Послезавтра доставит Ozon, продавец ИТАЛ СИТИ ФУД",https://www.ozon.ru/product/casa-rinaldi-pasta-bukatini-iz-latsio-ruchnoy-raboty-500-g-175316125/?asb=NfdxBJJ40%252BnMRbKiKLh49JMeO%252FZW7cyPwi0%252BdAjLFnw%253D&asb2=rxT6d2L5z4k8oBYx2NmtlqR1KeiuZK3B3tEFnAe072KtJcJOaNQ5GBicpju2kdJ1
Макаронные изделия Makfa Макароны длинные Соломка 400г (комплект из 2 шт),284 ₽,28 отзывов,"9 мая доставит Ozon, продавец Мишка ест",https://www.ozon.ru/product/makaronnye-izdeliya-makfa-makarony-dlinnye-solomka-400g-komplekt-iz-2-sht-207135861/?asb=1cPZSvNIny3bl3xLxjsBLTLMan6ff3rbaUG9IDwJY9U%252BCbR3fy6WWVZDHX7lHBYI&asb2=0jUIH5439csqE2scMR8hLor8in0XiWjB7-lILFH0oIxJl1L8X0Cq1nyqEy-YVYlQJsqA06s7gqPq9makCwCZM5dIBAurqUavKNshSwIbbCluvuzaxplELpFLcUrtaSvd4q5dFVGqqOPPHrH8tk-6Jg
"Безглютеновые макароны овсяные, макароны из муки овсяной цельнозерновой 250 г, МукаДаВода (без глютена)",318 ₽,45 отзывов,"8 мая доставит Ozon, продавец МагЗОЖ Оргтиум",https://www.ozon.ru/product/bezglyutenovye-makarony-ovsyanye-makarony-iz-muki-ovsyanoy-tselnozernovoy-250-g-mukadavoda-533594317/?asb=frAyuT00wsE1u3wBRIScRyfJaRzEy4l1w4XVLUw1w2A%253D&asb2=dYuNdj7nyuF_Ly7fzUfersnDIP3HtaOeURBY5w4_xYAHyB633JinObPFdl5UdNhY
Лапша. Рителли. МАКОС. 380г. 3 шт. в упаковке.,446 ₽,2 отзыва,"9 мая доставит Ozon, продавец Склад ПГТ",https://www.ozon.ru/product/lapsha-ritelli-makos-380g-3-sht-v-upakovke-483455663/?asb=V25l8hpKGqQQNrPsczf6%252BVV7Vgeyd0vPQNGIzyB5BqA%253D&asb2=pjFQmGJ_KMFz_T-75hphSKGvuz9ci7PKPj7YObtkqCDeKeql3kVG_B5dzd1FEHs_
"Макаронные изделия из твердых сортов пшеницы (трубочки) ""Penne Rigate"" 500 гр. х 3 шт. (Италия)",583 ₽,1 отзыв,"Послезавтра доставит Ozon, продавец ИП Гозеян Г.Н",https://www.ozon.ru/product/makaronnye-izdeliya-iz-tverdyh-sortov-pshenitsy-trubochki-penne-rigate-500-gr-h-3-sht-italiya-445660765/?asb=Z4MeoVR5Dj0B6Xb9kNIpf8pPSGQ4GW%252FwLNDfHowteWc%253D&asb2=2gX-6RoUmEp-W3r2rpQJEs3NLLXTIf1isQsfWZ8_S1YyCosFCB3qUXXuGau9DUCk
