Зеркало с подсветкой для макияжа/белое zKissfashion/Настольное зеркало/Зеркальце для макияжа/Сенсорное зеркало с подсветкой/ Косметическое зеркало,487 ₽,27 отзывов,"Завтра доставит Ozon, продавец zKissfashion",https://www.ozon.ru/product/zerkalo-s-podsvetkoy-dlya-makiyazha-beloe-zkissfashion-nastolnoe-zerkalo-zerkaltse-dlya-makiyazha-527880113/?asb=UZpReJi5apvOBRt%252FKoJf9yHNgXj1Bssb6Hz454N7kvk%253D&asb2=w6l8CWqH155xhRgOoPkf7A6CBpbmzH1rxwIG0nvLD0ExJ3JadrnD6Lj2LVfxPcCR
Воротник для парикмахерской мойки,590 ₽,106 отзывов,"Завтра доставит Ozon, продавец ИП Соболев Л.А.",https://www.ozon.ru/product/vorotnik-dlya-parikmaherskoy-moyki-218956635/?asb=LY0AcRpe2MkcuTVxVbQk9Y3HlMdMgmVGsLqM9DnO46U%253D&asb2=EPUM30QdKKPvKMEFnTT_oGySFyCn6DdHRuWYl3haX1iZm7Tn6Vvb-u9t9Ba8fXy6
"Термошапка сушуар для укладки и сушки волос волос для взрослых, шапочка насадка на фен",357 ₽,17 отзывов,"Завтра доставит Ozon, продавец ООО ""Прогресс""",https://www.ozon.ru/product/termoshapka-sushuar-dlya-ukladki-i-sushki-volos-volos-dlya-vzroslyh-shapochka-nasadka-na-fen-349036072/?asb=gQaBkQSoWKbIG%252BL4B8YC1%252FamvWaPzS%252BgN0I0PN8Kq%252B0%253D&asb2=z3j-eqMxN-gdjG-6oi3cc06UE0cyBT6RfZ8jiWi5rMw2K_EHBS_lXbAiL1qiq8i4
"Зеркало косметическое с подсветкой LED для макияжа, гримерное зеркало, зеркало с подсветкой в ванную, зеркало для ванной, подарок, макияжное зеркало, зеркало настольное",749 ₽,39 отзывов,"Завтра доставит Ozon, продавец ИП Уфаркина Ю.О.",https://www.ozon.ru/product/zerkalo-kosmeticheskoe-s-podsvetkoy-led-dlya-makiyazha-grimernoe-zerkalo-zerkalo-s-podsvetkoy-522418334/?asb=X5UH7n%252BswQWoRotQN3P%252FRyrN3iJBnC%252BqS3SeIixPBi0%253D&asb2=Zt-TenrXnQI7Nc7JFrFyENcy3rFLYkSEwS3mWr-jKEqNntYkRntujW1JEzv4FBL2
Help Salon Силиконовый воротник для парикмахерской мойки на присосках,890 ₽,163 отзыва,"Завтра доставит Ozon, продавец ИП Соболев Л.А.",https://www.ozon.ru/product/help-salon-silikonovyy-vorotnik-dlya-parikmaherskoy-moyki-na-prisoskah-298307510/?asb=uxxUFGrRt0VijAVH%252FOjzqd9CUvgjTcKJJmc2eIzeIWk%253D&asb2=R9DtgYik09sMIHgzsTFgMx80pyXgVqexKSemSxLOo_ZS9H9sE4SCbhlMWM5rSk0u
"Термошапка/Сушуар/Климазон/Салонный уход дома/Насадка на фен для быстрой сушки/укладки/ламинирования волос/лечения волос, цвет серебристый",329 ₽,6 отзывов,"Завтра доставит Ozon, продавец Torus.tech",https://www.ozon.ru/product/termoshapka-sushuar-klimazon-salonnyy-uhod-doma-nasadka-na-fen-dlya-bystroy-sushki-ukladki-450317502/?asb=mbueHFVnj3zdOPVoCQ26ZtBKfpCAcf4JrzNx952hILQ%253D&asb2=8HVmkEpKyYmCM8nUNmOrYPqf3WIGjQD-RU7e0qiiB0j1s-RD3m4FhxR8zxrMmygT
"Полотенца/Салфетки одноразовые White Line гигиенические профессиональные, парикмахерские, белые, спанлейс, 35*70 в пачке 50 шт. плотность 45 г/м2",497 ₽,3 отзыва,"Завтра доставит Ozon, продавец White-line",https://www.ozon.ru/product/polotentsa-salfetki-odnorazovye-white-line-gigienicheskie-professionalnye-parikmaherskie-493543978/?asb=XOdWv4giimt4O%252FA0gG7XMu9J1egE%252F%252B8cVEhvO4eBWqw%253D&asb2=e7ZPQVIiBQ17Dc6YYWRqIz78XIR-1jYYwZYFk4eTFcCbVFdXQ9iH7DALbEm4Kgbh
"DEWAL Воротник-лоток для окрашивания, пластик с резиновой прокладкой,прозрачный",572 ₽,35 отзывов,"9 мая доставит Ozon, продавец Малина Мания",https://www.ozon.ru/product/dewal-vorotnik-lotok-dlya-okrashivaniya-plastik-s-rezinovoy-prokladkoy-prozrachnyy-191449041/?asb=eOCQTKAs%252F8PfAl7i4yXslU34QqvDvApkg1KHmnvn%252BQ2MGyhkx78CzCu%252BJWQWScad&asb2=RkpDq7FY_AAg84uiWfsVGGqcfe3ItxH3MJo6Wg8RBoglCIBEKHhyoaOkZYlohQj-v0-Q-CjxWSYddfcmwXm7ytpcmnHqBUUkOWjTpHyZZJeem5rLHcqzbQEmAilgRs24LOOp57D4tw0DPfzpB-FvkA
Лейка для парикмахерской мойки BACH на 2 режима. Цвет серебристый. Арт. 1019020 Код 15106,430 ₽,14 отзывов,"17 мая доставит Ozon, продавец Меркурий Импорт",https://www.ozon.ru/product/leyka-dlya-parikmaherskoy-moyki-bach-na-2-rezhima-tsvet-serebristyy-art-1019020-kod-15106-340693242/?asb=3nERA%252B3ktkyQCcbiQHhnhbMp4ASKrI%252F1eGJ9QKpzT8k%253D&asb2=nCdiKab421WchGcE_u-p-BXNDzBOvwrHwXdZQnLP7tqtdJeW0rL4x4T315IdkT30
"Comair Кисточка для окрашивания прозрачная с расческой, Черная 21,5*7 см.",179 ₽,5 отзывов,"Завтра доставит Ozon, продавец ИГРО",https://www.ozon.ru/product/comair-kistochka-dlya-okrashivaniya-prozrachnaya-s-rascheskoy-chernaya-21-5-7-sm-356437040/?asb=BrFTikBbeq%252FCGXvoXV979ZEJS%252FqfQAvrwTPTfdG4qFw%253D&asb2=C2_4QZcqwImdGWn27kmNVOEbhN5_qt5Z3WQF1yLLBVhG1wI6QNGKYByCrc6zWaKV
Зеркало настольное со светодиодной подсветкой х2-х10 увеличение белое / Зеркало / Зеркало с подсветкой / Косметическое зеркало / Косметическое зеркало с подсветкой / Косметическое зеркало настенное / Косметическое зеркало с увеличением,853 ₽,11 отзывов,"Завтра доставит Ozon, продавец VA-GROUP",https://www.ozon.ru/product/zerkalo-nastolnoe-so-svetodiodnoy-podsvetkoy-h2-h10-uvelichenie-beloe-zerkalo-zerkalo-s-400674045/?asb=8pMzDn25qSGhae08z89fGDrogCxCb4SCZDITFUXCYyc2FazEE7ITKL%252B7WuSJirlw&asb2=epPG-ZW1fHyq0fL170DlpIOMK6DFIsv2snUDFs5Cmhz0kilNCTlwtMckbqBP8Na4C7f-WpObmrZDQBVPHsuwoZxJkR5un_LSjxz5uJppw2832k4HX4v3H2fx63dvubvGcYfzGeblti422_qAGfDR1A
Полка для гель-лаков,850 ₽,2 отзыва,"12 мая доставит Ozon, продавец Sweet Modern",https://www.ozon.ru/product/polka-dlya-gel-lakov-487291237/?asb=94SIqaAqun5rXf4ypDk8YaxjUiLUSQTQWltZqT6fOGw%253D&asb2=xqKcHdY_D1LneLCBuowqugJzvMPrYqsK1_B5ZMeqv1WSiGpo1lry_eOrx1x9nBrn
"UGOL / Гофра - резинка на узел наклона (механизм наклона) раковины, для парикмахерской мойки.",680 ₽,2 отзыва,"13 мая доставит Ozon, продавец Barberchair",https://www.ozon.ru/product/ugol-gofra-rezinka-na-uzel-naklona-mehanizm-naklona-rakoviny-dlya-parikmaherskoy-moyki-462845011/?asb=Tli2zSQq%252FUMRCeaefk0l0JKkvJwP5WdRM3PDOKRry6U%253D&asb2=ZY8bwX5wB_GWs4u9yCXo-yxKSiGNwciPIWHoGLFdhsx6I7NGthb5dV7bR1cNN9UJ
Косметическое зеркало с LED подсветкой / Зеркало с подсветкой для макияжа / зеркало настольное / зеркало с подсветкой в ванную /,690 ₽,7 отзывов,"Завтра доставит Ozon, продавец Solo Home",https://www.ozon.ru/product/kosmeticheskoe-zerkalo-s-led-podsvetkoy-zerkalo-s-podsvetkoy-dlya-makiyazha-zerkalo-521088745/?asb=sSlJIYJk9PBvKuavfEBlIWVtsepnXERahAGOLlGkBBQjg0X28bgPGZNf2XdGR656&asb2=JMNR5dIuDQFb_cpostlwbaUONxKMHrwqdgGycpSAUQmyFXeVRKuu29bhfA32j6HHcGQCTRVRWo-qeny8uUWq35Mq6adrVYfHDVPcuEq1a3hKDQiKuJcIwm3gwn00YkUX53lJH7Ac_rPAuhN2vU7jVA
Косметическое зеркало с LED подсветкой / Зеркало с подсветкой для макияжа / зеркало настольное / зеркало с подсветкой в ванную,690 ₽,7 отзывов,"Завтра доставит Ozon, продавец Solo Home",https://www.ozon.ru/product/kosmeticheskoe-zerkalo-s-led-podsvetkoy-zerkalo-s-podsvetkoy-dlya-makiyazha-zerkalo-521094190/?asb=ZcOET8kp2NcQFYkMxuPpjPihHsPRREQOdGyFH30KHsD5VsTBxizHq0jH%252FBIKretn&asb2=WoMXP6HrV_uBCatbakUrBwrjerHbHZyzJlembK5xji5ddfX_SeacTnYZIWRznCepSME9adqk0nwkVprRkmz-FEdaEOBUKr-U6NGBEJ95BCFg9D5hnJ_kMRHfVj2yjdu0gpvAX-HiJVUObS6tLX8zmg
"CHARITES / Подголовник для парикмахерской мойки, резиновый воротник для раковины в салоне красоты",679 ₽,27 отзывов,"9 мая доставит Ozon, продавец FarmaVita",https://www.ozon.ru/product/charites-podgolovnik-dlya-parikmaherskoy-moyki-rezinovyy-vorotnik-dlya-rakoviny-v-salone-krasoty-251248895/?asb=w2gkGBla7xP1YFbZKT3yLMjPk4DX0Q1XmredmFbnlbE%253D&asb2=SHzkHzmCnI99BcD4YklUKEfAhXPNBG4L7_junVHcgbNqJv7lKAVlz5ycv3HebFaE
"Natural Beauty Зеркало с ручкой круглое косметическое, парикмахерское",885 ₽,6 отзывов,"10 мая доставит Ozon, продавец Natural Beauty",https://www.ozon.ru/product/natural-beauty-zerkalo-s-ruchkoy-krugloe-kosmeticheskoe-parikmaherskoe-306853001/?asb=YQyfnq%252FhNFw8XZDRlnDnvGDVANc3gnzh0spDieg%252BLjI%253D&asb2=bMxhIGJtzLBeRwfVlXhDiHXkoWH9vGLdkodvr1NLpjtkTH4sIgX3OjcE4Z_Cj28H
Шапочка-насадка на фен (сушуар) для ламинирования и сушки волос,603 ₽,12 отзывов,"Завтра доставит Ozon, продавец Healthy Life",https://www.ozon.ru/product/shapochka-nasadka-na-fen-sushuar-dlya-laminirovaniya-i-sushki-volos-231540058/?asb=m0etXu6SWX0Qr5fNgLvseIkYXg1jyulaALPIeklKlY8r7jlzuzBwnGhkYN501jtS&asb2=tXmdePYgi1S_ldn4_rQPJl1v6d80DF1tGAwEpsqotulwZvG_1Q0SQzzu5lDmdymSxS3KzyQvkI11S5YuIIZVZrqmRwjWyWW0WB8PGN99lEsdvNRERFUQtWMSFXDK3wCL8iR0RXtBkuPc5ygiBEHPFg
DEWAL Воротник для мойки,690 ₽,86 отзывов,"Завтра доставит Ozon, продавец Малина Мания",https://www.ozon.ru/product/vorotnik-dlya-moyki-dewal-na-moyku-151891596/?asb=9%252BBtj3kRFqQsr8kIANJNxwfGuzPfYkA3pit53eXaH%252FNiUTPd%252FMt8LsfV%252FmItX3rk&asb2=ePGUT-1dXBzsUkwaINSEzs0khWAPYm7KKzffB-uJxXvo8kIBExf_sL6IvEY--Wp5ORSu6FV13k6bY1Aw2p5nGQJaIuov0hk02OLxpPHugY2BWeRdcaudpGAAe6vHytkdStw3s8EnL5nnIoc2nSN7cw
"Sibel Чаша защитная 0900831, черная",426 ₽,10 отзывов,"10 мая доставит Ozon, продавец ИП Колотов М.В.",https://www.ozon.ru/product/chasha-zashchitnaya-sibel-0900831-chernaya-163825534/?asb=%252FfL5ib8bgkRzezS%252FxZJPEDK6I%252BU349%252BT%252BILy6Ch6R6k%253D&asb2=WdM8fKkdmhzf0TGT272QwVVcSOOufaZA37i-gF1VzS8l6jkpfyOuglDNGZtjmofN
"Полотенца/Салфетки одноразовые White Line гигиенические профессиональные, парикмахерские, голубые, спанлейс, 35*70 см, 50 шт., плотность 45 г/м2",709 ₽,2 отзыва,"9 мая доставит Ozon, продавец White-line",https://www.ozon.ru/product/polotentsa-salfetki-odnorazovye-white-line-gigienicheskie-professionalnye-parikmaherskie-golubye-496986363/?asb=LE4s%252FHVYCZ8h%252FNib8Fbyy6hQGI0uNdUj8SbhzhY9spU%253D&asb2=SVlFA6wg07ExvUq6PoFSeCuo6YZmhqZV_3ihjPDR7iM88BVMpMu0C5yv9iWcazZP
Шапочка-насадка для фена (сушуар),799 ₽,20 отзывов,"9 мая доставит Ozon, продавец Sheldi",https://www.ozon.ru/product/shapochka-nasadka-dlya-fena-sushuar-204229409/?asb=%252BDnT4jLvDXpQtQrhVmh7u9%252BSUn9JPRsnzZ%252FAsXjfmSxEnSxT8cFhLjGqutEVJMo1&asb2=3uhEoWqlGYLMlPkQ36FM2uPDhYCnkcRdF1atoznzhwRNpM5iGj9WeuAJc2MMzoyDDLIDE-uXAhj5qthAQvw6lIxAdAViiCzOU2B83hIEuyQWYc0liMJd15rwKhW5Oif3gdnxMcii7nPDz2ijFINfwA
Слив для парикмахерской мойки с гофрошлангом JXMP,590 ₽,9 отзывов,"9 мая доставит Ozon, продавец PROcolors",https://www.ozon.ru/product/sliv-dlya-parikmaherskoy-moyki-s-gofroshlangom-jxmp-294819066/?asb=B4Sdxx8L1PWeX3lGZtGNrC8D7awtPj4z8yjzL6KNde8%253D&asb2=-3UpwYT-XrIZmROyUiMmcDHKR1ScctAkLxCEIww1L5YbXp1AUQhlbFKQzQuHcygi
"Зеркало косметическое для макияжа с 10-кратным увеличением на присосках, зеркало для бритья, зеркало для косметолога",604 ₽,6 отзывов,"13 мая доставит Ozon, продавец ИП Свирин Андрей Андреевич",https://www.ozon.ru/product/zerkalo-kosmeticheskoe-dlya-makiyazha-s-10-kratnym-uvelicheniem-na-prisoskah-zerkalo-dlya-466386535/?asb=uajbyKEWLU9yKasyOKQ%252BH%252Bf47DoNBMqLrU4iCz0q8uLEhPqM66esDnnCSbfPQMpE&asb2=BzPAaS45zqoAmmmlbOGJgARC-rIeHa0DIH8Kln27ZuIcEQQ6AjtWrX3ss9oJCams25rk3A7fyVhhzHv6PulALiEgjgLp05rfItZzygRMsYt-_P_Q0JDbCyCN89sFcpcFVqrzMe_uRDH6wz8N1p1rsw
Зеркало карманное складное двустороннее с двухкратным увеличением,650 ₽,3 отзыва,"Завтра доставит Ozon, продавец Kalay Matur",https://www.ozon.ru/product/zerkalo-karmannoe-skladnoe-dvustoronnee-s-dvuhkratnym-uvelicheniem-357580035/?asb=LFBIOoqOqrRAAlOGXq2Nqh62pD3wkz2hISLzMIfjdH4QmqsKkDw5DisGS7rzOuon&asb2=iMksqMrdKbFxWYK6DKjCJ7tYe3hQwGn2kVgadNnHz7_kGPgxmkXpKHrve_c2YF44QBO2FbRcLlxV0RzEbCtDYQW5MRtmLzt3XkyD5-VMwtf7nMo6_TnCzYUKh9xxiAQZC22gMto51Vfzue_fFd5jYQ
"Косметическое зеркало настольное с подсветкой для макияжа круглое на ножке сенсорное с тремя режимами подсветки и регулировкой яркости, поворот на 90 градусов / зеркало в ванную / зеркало в спальню / гримерное зеркало / зеркало белое / зеркало розовое",844 ₽,12 отзывов,"12 мая доставит Ozon, продавец Joke-Land",https://www.ozon.ru/product/kosmeticheskoe-zerkalo-nastolnoe-s-podsvetkoy-dlya-makiyazha-krugloe-na-nozhke-sensornoe-s-479270147/?asb=NuxfulqnmsC3sRgcIaOv1Ja%252FJ4wKZ1YfXCNuGWoahRORMYat%252B6CctENFw7gD7wNA&asb2=Z3glkJC6PxOR0uZTbTzexbPlEWP8Dy7bITyLqZjWdIPeaWH7-UBZK2SMSJBuehCCSBPIzHlYX3uYUuaBvPOzP9dLpNqqMHO3zPTdZ1gmh2brUGzKacG4-qkfnIhEDsxMXD1KIuj7M3CvwpXbMSOyAA
Воротник для парикмахерской мойки,627 ₽,3 отзыва,"9 мая доставит Ozon, продавец PROFESSIONAL COSMETICS",https://www.ozon.ru/product/vorotnik-dlya-parikmaherskoy-moyki-250161689/?asb=kDxl%252Bot6mpBlpQeLGzxhy%252BOAl6IE5zYHbJ6Y9mTA3i8%253D&asb2=VYZLSVVjERvl5lnQueRPXlOst3zPhIUosNWjP0S-jnv5w9mErPufS5CXAwBV1pF2
Зеркало для макияжа/ светодиодное зеркало / зеркало стоматологическое / гримерное зеркало с лампочками / зеркало напольное с подсветкой / зеркало с подсветкой для ванной / зеркало настольное с подсветкой / зеркало косметическое с увеличением,765 ₽,46 отзывов,"13 мая доставит Ozon, продавец TopSale",https://www.ozon.ru/product/zerkalo-dlya-makiyazha-svetodiodnoe-zerkalo-zerkalo-stomatologicheskoe-grimernoe-zerkalo-s-303655625/?asb=C76QsAvy8I9JSaR2WOuLy3igpN5R%252FxIHb449rUPkCo%252FQQeZ5VqJdDFExoZ5NxNZW&asb2=UMxHaji2xcC94WXYJHJTs7x1J9NRFu4oOEYQd1YwXaBc73RDA92nHDV0icXab8_KYycJhHo1rGUbv7Y1tOa_CR1ukVNRXJCd9iC36UtmfTgZHxvfOJgkgX7_pqQu81OWDSnZ1XHh06oNXE_lsEZ-cQ
Зеркало карманное складное двустороннее с двухкратным увеличением,500 ₽,3 отзыва,"Завтра доставит Ozon, продавец Kalay Matur",https://www.ozon.ru/product/zerkalo-karmannoe-skladnoe-dvustoronnee-s-dvuhkratnym-uvelicheniem-357513257/?asb=GutyvUHcyzMnvhgSDW5bXSmFQglFlg1NFJ6ovEUC8Y8arBFg%252Btld5KkzvQPa8Slg&asb2=AWS74ffHgK5sa9vA0o3g4AQSkmsaeGKt4oe44Hwzafghwv-WzFGHHC02S3KEhYFzDGVBjfWGAkAdQEX4a2-aL4g4Hv7mRsVatiUzCHB0EAo0zDvNbtN_OkDJncxn--lhf29lzGzMPtHzQLWOep6Cig
Зеркало для макияжа с подсветкой / Зеркало настольное / Гримерное зеркало/ Косметическое зеркало (белое),899 ₽,13 отзывов,"9 мая доставит Ozon, продавец family_D",https://www.ozon.ru/product/zerkalo-dlya-makiyazha-s-podsvetkoy-zerkalo-nastolnoe-grimernoe-zerkalo-kosmeticheskoe-zerkalo-beloe-418999824/?asb=YEQRDP2gGYhL78pkmdeSczD3qpFPOYN9XJNmUhXXijuSppnPdF2UQFgd26WFA4gu&asb2=NFk1mnwV-IAZ0JiEudvvskeAfG_YuV4XBfBmeFa2JfKQNNJHp2FQuYGznUWiKStIcw3ZFtMaaLxoy1v8cFWD1_p6S6JuL951DLIhroWKyQ2JlK7reYFuRD3wv38RcP9OXoWKZFv0HmWqIqabv7yY-w
Зеркало косметическое с увеличением Belberg BZ-10 Orb,490 ₽,6 отзывов,"9 мая доставит Ozon, продавец Belberg",https://www.ozon.ru/product/zerkalo-kosmeticheskoe-s-uvelicheniem-belberg-bz-10-orb-351863785/?asb=PFFVHMF5%252FpCnQAeOA07rz7CffGjwR%252BN85niiOrzhGH4RsdSWFjlN210Mxxnh8LB1&asb2=zQ-Z5D7EcK6384L12ZJrHmm2GqfiuTBjyLd4kEBAUGKatcnj3GLcr_JRZ5FKe8ck6LlRL9WVfhf30CM6epYkOAZgsgQEPXr7-CWnGufin3thIfioKQCVpMB1CPK8DObVAmUH9u8wdg_aY9VhbBSfeQ
"Зеркало косметическое с подсветкой, лампа настольная, косметика, для ванной, макияжа, со штативом белое",664 ₽,9 отзывов,"9 мая доставит Ozon, продавец Lee-Bags",https://www.ozon.ru/product/zerkalo-kosmeticheskoe-s-podsvetkoy-lampa-nastolnaya-kosmetika-dlya-vannoy-makiyazha-so-359969019/?asb=vcZLgXTzjwuFo%252F3yq1YNnjdnMLzM%252Bp%252Fh%252FZ3DSKtDARj31fJ7ynSZwQtMQtooLPY5&asb2=4eJJ-3Zg4jK2LV1gAsoOI-VhCCbQyR-YL1F49pfez4oPJMym7Z_6xrgJ8W61SeIPZjEfquyftM59qGMK-7JrPzkgthMld9FUu2xWgmILjIXtPnMWCgQrRf0g1T1cbmXqQApOpf9qZtxn334dvhf_oA
Зеркало косметическое с увеличением Belberg BZ-10 Orb,490 ₽,6 отзывов,"9 мая доставит Ozon, продавец Перминова Юлия Сергеевна",https://www.ozon.ru/product/zerkalo-kosmeticheskoe-s-uvelicheniem-belberg-bz-10-orb-403613394/?asb=Flal9MoI7ZHcqCZh34LBXfRTL4M1jHJ%252BXEf9XpRDdxYmdl2qI5tCUVhWqb7Mvfhn&asb2=5HFAkqnkTdD-n0YQIhZCZopk0SX2rlp4XDgch51sVry8yHwjPYrQvvlLY_zjFNvUQMcBC-1Vc29daUHogyAwirY4032Y7g5loi8maAYoE95Jp7UaiUcpPek3KJcTuMp_s6DrGzwxzZ5i8nZfbctLBQ
Защитный лицевой экран,368 ₽,5 отзывов,"9 мая доставит Ozon, продавец Бизнес Медиа",https://www.ozon.ru/product/zashchitnyy-litsevoy-ekran-176668399/?asb=ooTJdHGC1YA3RMDV8GNAsNZirNhB%252BjnWuoAe3kWhqk4%253D&asb2=PVlbIIcyBqu9RAUi1xfsAnfv-0_KN8U_6YVZO77pLfG9ahHpriJWZWopgfepnATH
Зеркало настольное/ Зеркало косметическое для макияжа с LED подсветкой,807 ₽,2 отзыва,"Завтра доставит Ozon, продавец ImTun",https://www.ozon.ru/product/zerkalo-nastolnoe-zerkalo-kosmeticheskoe-dlya-makiyazha-s-led-podsvetkoy-527653977/?asb=PM9w21%252FKIh3sN%252BxOeZiidkUPpxreDoIdB5forhUFLhQ%253D&asb2=hQM8vJ8bAcZ1H6rIP3omQO-jnWnl9uPiL0AQh2rR25sb6de8jOiNCi25vkP5dHE0
Зеркало настольное двухстороннее с двукратным увеличением 20см,413 ₽,1 отзыв,"14 мая доставит Ozon, продавец Absolute",https://www.ozon.ru/product/zerkalo-nastolnoe-dvuhstoronnee-s-dvukratnym-uvelicheniem-20sm-489476357/?asb=Ev1aIBunXkTYVYwlOaO3HCARBLF4at0eVZvPE6%252FlB2s%253D&asb2=bsCp-uVLx0x06I0P8UcKTXN_nVfy01kewZ14inGSg0ndzDBjFpT0-DQADQXdOiSV
