"НАНОПЯТКИ / Крем ЗАЖИВИТ для сухой и очень сухой кожи лица, рук, ног и тела (от трещин, мозолей, грубой кожи) 50 мл х 3 шт",637 ₽,18 отзывов,"Завтра доставит Ozon, продавец ИП Кремлева М.А.",https://www.ozon.ru/product/nanopyatki-krem-zazhivit-dlya-suhoy-i-ochen-suhoy-kozhi-litsa-ruk-nog-i-tela-ot-treshchin-487687074/?advert=VLx1zRQYlmDTgSFJlyqM4dUFvH4JSrWsDunNuWyvGM2ye-qlQXjD4smRKATNXD8ucFZ8QDWcV86ueQchX13Zq6L8FGNCuTz9gTAWt6qJvEm5hybBn_zNjhmf8bsllqkNABdIEJrvU7zW7ToO2MttKfqpN73_NMZNVr2UZD3eN1SbId_VvscDV-bbkY1APUJ1wnUX6fMWeBhfiHIVVuypgWm_gG9EoQyGNnKwfpcHIA-nfjTiYrhDLRdso9TdlTiBXTDgQk5bQKx_zjeehQYDBNHDhI4aUorEGYwpOoai87b2JaJ-k-gxfPV25qao47sinysNeK8bYlzua6S2-AhAtDor4sl9tsfdQMjgOD5WJ7WdJ-7fHDLNEJ5mHDD7rFGwmyGkQvpueSte48UB2oYlkAyfd8IsnsZfO2QcJOy1HxhW_p4zaHoPmkyU04Gb8sCV9vifsP92_Fcl_LvwlLCx0dQVFIQowl2yQkGmehGpt9aDmh1Hwf-gJDfsWJFBDyGlGgLxkEaJkER9mKOfmY6KYbky3WIX-CzSwrJB5aNjYIslCMZBdagCkCMs6Bo-sG7n
"Принцесса подарочный набор Тайна Принцессы (Детский шампунь 2в1 Калинка-малинка, 300 мл + Крем с миндальным маслом 75мл)",217 ₽,56 отзывов,"Завтра доставит Ozon, продавец БИГ",https://www.ozon.ru/product/printsessa-podarochnyy-nabor-tayna-printsessy-detskiy-shampun-2v1-kalinka-malinka-300-ml-krem-305102766/?asb=BAtSxXGBmv0mveVlamZgekV%252B2M4YVqNlfa%252BdXRpuxaI%253D&asb2=CSNKoMoq_UOdG8KT1HPo3hypN-cvBJ80Vx1Epkz_LM1kP1QL69MAsNo2Qklb600-
"Botavikos Комплекс 5 экстрактов ""Сладкие сны"" для купания младенцев на основе цветочной воды гамамелиса, 200 мл",280 ₽,151 отзыв,"Завтра доставит Ozon, продавец АКС СТИЛЬ",https://www.ozon.ru/product/botavikos-kompleks-5-ekstraktov-sladkie-sny-dlya-kupaniya-mladentsev-na-osnove-tsvetochnoy-164558900/?asb=0Sh0390HTH4s4qf4T4W4Yzp%252Bs3gkcaK1jNEgT5Ww6bI%253D&asb2=NtMLmbIoSmVNf0Qc7zR66hbiiRUdgZcyomAByKOJWRlKxIPY0APzwBIZt9k0ZkFy
Кря-Кря Набор детский шампунь для девочек и гель для подмывания ромашка,349 ₽,10 отзывов,"Завтра доставит Ozon, продавец Доминанта Сервис",https://www.ozon.ru/product/krya-krya-nabor-detskiy-shampun-dlya-devochek-i-gel-dlya-podmyvaniya-romashka-427970249/?asb=8s68EEQ5fdLR23i5Gtdtsl9BQwpvHMgVABYo5e9XCCWqbEfnQf9w04Mhe2CbosLR&asb2=9KNRnPFbrbIXF38ILf4ewiPyDmw3oKbd4gRwnVAf8qGCxRRXNQAdzNacGXsKwIgxhEFPMtmTQI7ZNM8ROKfS84xW81CpaNAeqtgzne8Q2pmcZ--2i4vlzqSAE66iozUw
Кря-Кря Набор шампунь для мальчиков и пена для купания,360 ₽,5 отзывов,"Завтра доставит Ozon, продавец Доминанта Сервис",https://www.ozon.ru/product/krya-krya-nabor-shampun-dlya-malchikov-i-pena-dlya-kupaniya-428764050/?asb=wSeLuE0CFY01g78MHmm0SiUKMjzzMrVVxAGqnrWIoHOaeO3hGtUUZ9PypwlXBgBB&asb2=X_ARhwvbwYxiw8PU8wZrIcbngwdXebDhCZtQSZnqgKOIfZfs9r0nDTbaDGSFmE0nIoqJOwmleGFYrxXKQR4I24ITmiLRmhb9HtvYK1fJ9PBtdzJA_TQ2EUqPcFtziuIJ
Ecolatier Подарочный набор Pure BABY 3+,364 ₽,27 отзывов,"Завтра доставит Ozon, продавец Аквакосметика",https://www.ozon.ru/product/ecolatier-podarochnyy-nabor-pure-baby-3-233368766/?asb=fdBnbqvNsUYV6oxJ9p80DIdZoA1QkCFt00D%252B%252FByx1kc%253D&asb2=8fXelIqVNvd_Lk7U_C_-4_17_bR5_6PbmD2zyR3b6GgJqsv3KQe4eWLgyK_tJOh1
Кря-Кря Набор шампунь лёгкое расчёсывание абрикос и детский спрей для волос,360 ₽,1 отзыв,"Завтра доставит Ozon, продавец Доминанта Сервис",https://www.ozon.ru/product/krya-krya-nabor-shampun-legkoe-raschesyvanie-abrikos-i-detskiy-sprey-dlya-volos-428743061/?asb=8gxnJFbYj3gE8ghoKRrbHFKgO5ov6kuiO%252BwBSwjYk9nkzpfyIc93mMqxdGV3KXxw&asb2=dG34w0yeNp0Xv8AR6pI2hXh1Prtrbm7ZRvZ0hr0BgqskhAkuqZUSOWP0ax1EcLr7dukMu1cYP6BH4xiGX14S_lFhO2b2ooUc97uMChubVphr0g6upKdBfE6k4baOU5JL
Набор Johnson's Kids Детский гель для душа 300 мл + LISTERINE Smart Rinse Детский ополаскиватель для полости рта Ягодная Свежесть 250 мл,390 ₽,24 отзыва,"Завтра доставит Ozon, продавец Официальный партнер Johnson & Johnson Consumer Health",https://www.ozon.ru/product/nabor-johnson-s-kids-detskiy-gel-dlya-dusha-300-ml-listerine-smart-rinse-detskiy-opolaskivatel-dlya-326960777/?asb=Nfq2eY4NGj8C3BMCyXRata5f6kWKDcISUZnvE1PbR%252Bg%253D&asb2=wVfEDXoF26xAVPrEi9KhomMDdYsWdKSetab5jXt4knLymEmPx3R30lmOzJ5h0rjM
"Iris cosmetic Набор детской косметики для девочек: Крем детский ""Нежная забота"", 100 мл + Детское жидкое мыло для рук нежное ""Малиновое чудо"", 500 мл, 5+",236 ₽,1 отзыв,"Завтра доставит Ozon, продавец ООО МИР",https://www.ozon.ru/product/iris-cosmetic-nabor-detskoy-kosmetiki-dlya-devochek-krem-detskiy-nezhnaya-zabota-100-ml-detskoe-301394217/?asb=UK9aaaCBDmtg1tCo5ZeyDL%252F%252Fw%252FRPdkoIaWh233MJJ9c%253D&asb2=zDOIxNepA7etsQo3eB2ykRy6iihcWwxNfYNc16ZCKYBLVBQIQmXQKOa-ACsMZsZL
"VILENTA / Гель-шампунь 2-в-1 ANIMAL LINE LITTLE RABBIT с Малиной и Ежевикой, 2 шт., 200 мл*2",231 ₽,63 отзыва,"Завтра доставит Ozon, продавец 7DAYS",https://www.ozon.ru/product/vilenta-gel-shampun-2-v-1-animal-line-little-rabbit-s-malinoy-i-ezhevikoy-2-sht-200-ml-2-166323817/?asb=gf%252BoUzwAfwMNsFza%252FZ08jvXguXeT%252FiGz%252BC5TJ8n6E28%253D&asb2=new4k48yMJc-hlgeaGMs1GFiRLB-mkTnYtBVynURZW_fYZvUbkitM8jQYJV829Yp
Детский набор для ухода NOMI ( 2 шт x 50 мл),241 ₽,14 отзывов,"Завтра доставит Ozon, продавец ООО «Компания Новая Идея»",https://www.ozon.ru/product/detskiy-nabor-dlya-uhoda-nomi-2-sht-x-50-ml-149394652/?asb=uNBscZaSBqMXB6f1gaeZInjY4B%252BJ9lMH09BnDY3fEY0%253D&asb2=h4Yx6Y9GZeZTmz1iagJdVGV0-HDk9Y-ujvilYldPSdUiAvyk05uM5QYK756yB8uH
Liv Delano Подарочный набор WONDER GIRL шампунь 300 мл и спрей для волос 200 мл,803 ₽,38 отзывов,"Завтра доставит Ozon, продавец ИП Лукьянов А.С.",https://www.ozon.ru/product/liv-delano-podarochnyy-nabor-wonder-girl-shampun-300-ml-i-sprey-dlya-volos-200-ml-428064196/?asb=1qSKUOzhTO77eEYarvHKi5Bf4hfqxSjYsmsNK7PGXXY%253D&asb2=lVXmSp9KcJxND0M4txPhGxFvLPmKXFAcd8Ob7DZ3cNrH8XIJGgtl7dRp_S6GEAwg
"AQA, Набор (Гель для подмывания малыша AQA, 250 мл + Крем-присыпка под подгузник AQA, 75 мл)",459 ₽,122 отзыва,"Завтра доставит Ozon, продавец Детские Продукты",https://www.ozon.ru/product/aqa-nabor-gel-dlya-podmyvaniya-malysha-aqa-250-ml-krem-prisypka-pod-podguznik-aqa-75-ml-184502761/?asb=%252BndcG2nUKXq8ngFlRe6wCrTey0%252FpB6jDOnXbnbmYNJ4%253D&asb2=zvaTVWExHcB1e53vrWJFStHL23iGhbVKqQF-ReuhVVg7i0kw8kszbTq8Qm66GfWL
"LUKKY Набор лаков для ногтей peel-off ""Конфетти""",849 ₽,2 отзыва,"13 мая доставит Ozon, продавец МТК «Алиса»",https://www.ozon.ru/product/lukky-nabor-lakov-dlya-nogtey-peel-off-konfetti-336157984/?asb=OsgjwzKpVex8AWTVL7tXuMSMgXQAC%252Bkw4a10vw5aZ5w%253D&asb2=C1kKc2hCexroBRjF4laymCLRzFWVfYlOUVt2kA_yh4XWUSNcZ4KZDBgAm7WRb21S
LURE KIDS Подарочный набор для мальчиков NIGHT BATTLE 3+ Шампунь детский 200 мл + детское средство для купания 200мл,289 ₽,164 отзыва,"Завтра доставит Ozon, продавец КОТТОН КЛАБ",https://www.ozon.ru/product/lure-kids-podarochnyy-nabor-dlya-malchikov-night-battle-3-shampun-detskiy-200-ml-detskoe-317616142/?asb=1UxIkY66s75aLMcYJysR0D2mQ%252F7v%252BPYVhimLScles8qlCextqDzUdceM9qbBY7EM&asb2=UhLqgim0nsJwm8wNscTX8YoPnZ9dmC2hotVAP-ukYJEIQNSCmjabqa47GDkRYgcErOd1HIhncBDihWZkLBSORAvEvKzmrWm-XQm3UYsmeFFb6B57EnGBUl3cIV33h5CBdupt_j5AA9_UVivfMkSY0A
Майкиддо Набор детский подарочный средство для подмывания шампунь детский средство для купания 2 в 1 жидкое мыло крем под подгузник салфетки детские MyKiddo,936 ₽,19 отзывов,"10 мая доставит Ozon, продавец Vertex",https://www.ozon.ru/product/maykiddo-nabor-detskiy-podarochnyy-sredstvo-dlya-podmyvaniya-shampun-detskiy-sredstvo-dlya-436800942/?asb=7eLcciNqr7b0X7jkTRlXWMg76DtRHkop8Y%252FjOrDwmv0%253D&asb2=8d7c7s7D4BcpaM85bKULxpIjP83O3e7sLb1_pCJVYP7aZAlwz7jDfDLlK72cSVWH
FESTIVA Подарочный набор МОЙ ПРИНЦ Сказочный Герой (Шампунь 250 мл. + Гель для душа 250 мл.),268 ₽,15 отзывов,"Завтра доставит Ozon, продавец Фестива",https://www.ozon.ru/product/festiva-podarochnyy-nabor-moy-prints-skazochnyy-geroy-shampun-250-ml-gel-dlya-dusha-250-ml-155778732/?asb=m4nxu1sNLUDwNQK6O%252BgWB6RHcKRDPnOEAgO8JW3yXrs%253D&asb2=iocsT1ahaQvkKyqKjuMb4UXXYErEj4sBGmpTDGWXp1op4QoGfQqjC6x9KhSFUw96
Liv Delano Подарочный набор WONDER GIRL гель для душа 300 мл и спрей мист для тела 100 мл,731 ₽,38 отзывов,"Завтра доставит Ozon, продавец ИП Лукьянов А.С.",https://www.ozon.ru/product/liv-delano-podarochnyy-nabor-wonder-girl-gel-dlya-dusha-300-ml-i-sprey-mist-dlya-tela-100-ml-428071796/?asb=YsEKstcg5SEHp%252FWbdN6fqNvRa0h99Z%252F2ANCwHOHxLmQ%253D&asb2=V0zmWGjLc4tNcTYPdHk9IErR32PwmC3cUmu0p3Prgb9Y1l_Ouh5EICDE1aUwzYOk
Little Sammy Детский набор косметики для девочек бьютибокс для ухода за кожей: молочко для тела и гель для душа,726 ₽,1 отзыв,"Завтра доставит Ozon, продавец ООО «Бьюти Инновации»",https://www.ozon.ru/product/little-sammy-detskiy-nabor-kosmetiki-dlya-devochek-byutiboks-dlya-uhoda-za-kozhey-molochko-dlya-tela-474806388/?asb=NmhL222wMZY9BYjgQrFEZs0gpYD9Ys0uUWHDNT249Ow%253D&asb2=yPEmHhY5nBXWgJE_0vptB02ukc58Fja0jkS4ckf09sTP0qPeUfIs1tPrvNDIyaV2
FESTIVA Подарочный набор АЛИСА В СТРАНЕ ЧУДЕС Сказочный Переполох (Шампунь 250мл. + Гель/пена для ванны 250мл.),350 ₽,6 отзывов,"Завтра доставит Ozon, продавец Фестива",https://www.ozon.ru/product/podarochnyy-nabor-festiva-alisa-v-strane-chudes-skazochnyy-perepoloh-shampun-250ml-gel-pena-dlya-155778987/?asb=wmhP6Xtaa6K29FV4K%252FI8UZI8bfijae4QgVjKyy8Jvw4%253D&asb2=azY0TdgXmobbY91MRs5198Tk8U15_3BmGzB5HMYpoJXKSe5Ks75mQvyUTqRHKWiI
FESTIVA Подарочный набор ТРИ ВЕСЕЛЫХ ПОРОСЕНКА (Три цвета мыльная краска для ванны 75мл.),320 ₽,1 отзыв,"Завтра доставит Ozon, продавец Фестива",https://www.ozon.ru/product/festiva-podarochnyy-nabor-tri-veselyh-porosenka-tri-tsveta-mylnaya-kraska-dlya-vanny-75ml-155778736/?asb=cDc5T8MFjAiy5ojIkZ2oE1xNwL8jyPkL0RCEOtADkxg%253D&asb2=ZGShqfrVVYpESM1zkM8aeZEsxOBUeOpItkvoLSRSRdLRNGuf7v0x0-scCUmOWpIP
Biolane Набор детской косметики (Мой первый уход),940 ₽,44 отзыва,"Завтра доставит Ozon, продавец Мир лечебной косметики",https://www.ozon.ru/product/biolane-nabor-detskoy-kosmetiki-moy-pervyy-uhod-254621941/?asb=FKXZ8%252BTDq6xC5YvGwdM%252BYANOaNKJy2A3jHGShWqA9t0%253D&asb2=c8xPkaJ2ybUzhFE9KBB0RaZqlCXSickJ0kBH1A1kErDUOscpg7CT-fuYL2HpxXY0
Bonny Набор уходовой косметики для новорожденных: Жидкое мыло детское 250 мл + Шампунь для волос 250 мл (набор для детской гигиены / для ежедневного использования / косметика детская / гипоаллергенно / защита / успокаивающее),571 ₽,5 отзывов,"Завтра доставит Ozon, продавец CityNature",https://www.ozon.ru/product/bonny-bn06-00160-nabor-krem-mylo-shampun-dlya-volos-krem-dlya-nezhnoy-kozhi-600-ml-154972695/?asb=335q7evnDRI8eeOeR4VxnyAkLRaLp2wlHFA79RDLqrs%253D&asb2=_Y5Ik-gb7szO9WJ1kXkSgTRZCQCNwfDOZyJc9j8_cMvwBbi_U-BK0RSONjiatwQ9
"ПРИНЦЕССА Набор для девочек для волос и тела ""Тайна Принцессы"" 300+75 мл",279 ₽,4 отзыва,"Послезавтра доставит Ozon, продавец E-COSMETIC",https://www.ozon.ru/product/printsessa-nabor-dlya-devochek-dlya-volos-i-tela-tayna-printsessy-300-75-ml-327232941/?asb=w93yOV%252Fto1zGknOX%252Fkq4iBftJPAYC3%252B0k13LtMbBEiQ%253D&asb2=r7Onr49C76QIZP28dl92JVu2okoo6QGsQh0o-EUBmMeemWTOOxeApnZEzx4JlHcC
Little Sammy Детский подарочный набор косметики для ухода за телом: Молочко хайлайтер и мягкий скраб с витаминами,765 ₽,1 отзыв,"Завтра доставит Ozon, продавец ООО «Бьюти Инновации»",https://www.ozon.ru/product/little-sammy-detskiy-podarochnyy-nabor-kosmetiki-dlya-uhoda-za-telom-molochko-haylayter-i-474818865/?asb=omdGfwooCiXE6QAwipPeRo%252B58CX4Nlri8fxw9pIbYdA%253D&asb2=-8OkVkww4_iduJSX8J1e3k1SD6FoesARzD9niAkUrwC8nldda7VjvsUddg_hAD5c
Гонки Подарочный набор Крутые виражи (Шампунь с кондиционером 300 + Пена для ванн 300),329 ₽,47 отзывов,"Послезавтра доставит Ozon, продавец БИГ",https://www.ozon.ru/product/gonki-podarochnyy-nabor-krutye-virazhi-shampun-s-konditsionerom-300-pena-dlya-vann-300-317293922/?asb=j1yD7gAOtOKDYb6eLcafqSC6rv9G05M%252FPTp2G9wNa44%253D&asb2=mPyaGRKr5PtPD_jRIII9GcGVD4Z4RMog5zIq5aol05a6S5oSarmAnMAIegO50H9X
"Iris cosmetic Набор детский: Шампунь и гель для душа с календулой и чистотелом, 400 мл + Крем детский Универсальный с чередой, шалфеем и D-пантенолом, 100 мл, 3+, Kids Care",249 ₽,2 отзыва,"Завтра доставит Ozon, продавец ООО МИР",https://www.ozon.ru/product/iris-cosmetic-nabor-detskiy-shampun-i-gel-dlya-dusha-s-kalenduloy-i-chistotelom-400-ml-krem-detskiy-300783015/?asb=DZO%252BWDeZxN%252FC5CR0PEeD%252BY183LYjZMa%252Bwd1OEpIuBQY%253D&asb2=7U-25T6OVbULKND3tcoBvs_Xx2rtSnjSPTNuFNeUq8UU7eTfHoHmPKGwnKFkn9EM
EO Laboratorie Набор Детский для ванны (шампунь Без слез 250 мл + крем-мыло 300 мл),565 ₽,46 отзывов,"Завтра доставит Ozon, продавец Аквакосметика",https://www.ozon.ru/product/eo-laboratorie-nabor-detskiy-dlya-vanny-shampun-bez-slez-250-ml-krem-mylo-300-ml-257254009/?asb=ZZQIA34baM2OY2A85qkzA49LhjU7kvbBqcz%252Bmfewd3E%253D&asb2=GmGzsi8bbzSIYaanrrrO30y5qwx0o4VzNTnsqZC3YT0cBkDpYzM4YlAI8A1mCfpA
"Liv Delano Подарочный набор HAPPY BABY Шампунь, Гель пенка для купания, Крем универсальный 675 г",803 ₽,57 отзывов,"Завтра доставит Ozon, продавец ИП Лукьянов А.С.",https://www.ozon.ru/product/liv-delano-podarochnyy-nabor-happy-baby-shampun-gel-penka-dlya-kupaniya-krem-181341733/?asb=ADsyJ%252Bx0bjupjkTZe7gWMdpu0r5gW7i6DRcpPAiPjZE%253D&asb2=ivRepmq4WDc8uE4-B1B4SuFzjx8oCwV7B4aVbX8QuiATptJZanV9j4d2kOiygfto
Детский набор для ухода СОЛНЦЕ И ЛУНА для девочек гель для душа мармеладный 200 мл / шампунь блестящие локоны 200 мл,432 ₽,19 отзывов,"Завтра доставит Ozon, продавец УСПЕШНОЕ ДЕЛО",https://www.ozon.ru/product/detskiy-nabor-dlya-uhoda-solntse-i-luna-dlya-devochek-gel-dlya-dusha-marmeladnyy-200-ml-shampun-196836319/?asb=4j6JklFpqsfxh8XuvXAmIAsllDITngl%252FYdR7riOosgM%253D&asb2=e2esS8cYT0sRdfQWxQT-4Tl50Cy3MtgEwl1b9sD9EjTSLU2X5zOtOexpbz0x46Ah
"EDEN Little Lady косметический набор для девочек с 3-х лет: Спрей для волос Волшебное сияние 150 мл, Шампунь-кондиционер Легкое расчесывание 245 мл, Гель для душа Нежные объятия 245 мл + пакет крафт",704 ₽,37 отзывов,"12 мая доставит Ozon, продавец ОРБИТА",https://www.ozon.ru/product/eden-little-lady-kosmeticheskiy-nabor-dlya-devochek-s-3-h-let-sprey-dlya-volos-volshebnoe-397671575/?asb=4e6VFmSgYC7jZeguVP54X9cKltEyv5YCVD6SdYfm6Co%253D&asb2=rv4V8_i9yiizOVV3cRSqrniIX37pqWFUG5Gis4ZDJiBpnTjXNjx15xo8EKeqbtrV
Детский набор для ухода СОЛНЦЕ И ЛУНА для мальчиков Шампунь SUPERCAR 200 мл / средство для купания 2в1 SUPERHERO 200 мл,350 ₽,31 отзыв,"Завтра доставит Ozon, продавец УСПЕШНОЕ ДЕЛО",https://www.ozon.ru/product/detskiy-nabor-dlya-uhoda-solntse-i-luna-dlya-malchikov-shampun-supercar-200-ml-sredstvo-196836321/?asb=6qzNqBh9nLpXClBNRekXAWqzMJ5iNP8N%252FEJjJPLLMCI%253D&asb2=lTo2-166eSXYXaAyogDe-PHCok8xfeHPdVvz7L-2X_MKO_-6UCCD46vziMGjcdvF
VILSEN / Детский подарочный набор: Шампунь для легкого расчесывания 500мл+гель мусс с клубничкой 75гр,378 ₽,2 отзыва,"Завтра доставит Ozon, продавец АЛЬТЕРГО",https://www.ozon.ru/product/vilsen-detskiy-podarochnyy-nabor-shampun-dlya-legkogo-raschesyvaniya-500ml-gel-muss-s-430852093/?asb=47xi4vwPL9yV%252FRU%252F2TZjBd8DNJdy9gd7KsFWUw6gscE%253D&asb2=PZvMLqnQF1fhtqgGa6Ilg2SIEZycpgM4bV1Kq1JfaUSTmJGkrCOx_2m73pjOISza
Papa Care Косметический набор для ухода: Крем-мыло для мам 250 мл + детское мыло жидкое 250 мл + детский крем для чувствительной кожи 100 мл (для рук лица волос тела кожи косметика детская женская,580 ₽,7 отзывов,"Завтра доставит Ozon, продавец CityNature",https://www.ozon.ru/product/papa-care-kosmeticheskiy-nabor-dlya-uhoda-krem-mylo-dlya-mam-250-ml-detskoe-mylo-zhidkoe-250-ml-231123849/?asb=KfZIC4F646P6ACLnzGm9saS3BYw1hMY4pyY1bsWaRL0%253D&asb2=TOaOs6q8XyKN8iqLVWEm4Tt03sUkZfwWFClie-2LFvTcMatTzp4Cr90shiQqZB0e
"ESTEL Детский набор ""Отличное настроение LITTLE ME ( шампунь 2 в 1 + гель для душа + зубная паста апельсин)",1 000 ₽,34 отзыва,"Завтра доставит Ozon, продавец Малина Мания",https://www.ozon.ru/product/estel-detskiy-nabor-otlichnoe-nastroenie-little-me-shampun-2-v-1-gel-dlya-dusha-zubnaya-434187448/?asb=Zfl9bRIomLH%252FdyuIRoy3nopoXI0mG5U1uhsJu08dylY%253D&asb2=FuT6DDkzCjGdKql42e35t-1uxGn74LgRyu5U4rhQ2-6Xkhd9XdtGJ6_VQqx4Pnni
Кря-Кря Набор шампунь для самых маленьких и гель для купания,494 ₽,16 отзывов,"Завтра доставит Ozon, продавец Доминанта Сервис",https://www.ozon.ru/product/krya-krya-nabor-shampun-dlya-samyh-malenkih-i-gel-dlya-kupaniya-428942126/?asb=SCvZYtc%252FUw621nubcQf%252FKa%252FsvI6ZiS5BPrN%252BAd4TxM2NcbYqiz1x1Yi9d2zGazLp&asb2=0vDLJRXK-luDzuuqInKCFgBy_reI0vHjinRJ1mp9sPm89PJvwiQAGgXLZFCEj3q1Qpe6ySPXKFXs3f692S6eu0oS-6VuHoqNXJL8VNco29VFDsLUfGndvfba-YpyqMbN
