Берсерк Настольная игра Герои Стартовый набор цвет красный,290 ₽,86 отзывов,"Завтра доставит Ozon, продавец Ozon",https://www.ozon.ru/product/berserk-nastolnaya-igra-geroi-startovyy-nabor-tsvet-krasnyy-138455419/?advert=Y0AxxErwRkugHp1blFb7OWbuxH1YzamO-OnaoVmRkXNaZVNNImCPy-bsGE1PSLYyFli-kLqz9o5VN637kCsQyc0U3xHbOAlG6wXtyDNcLmlgd3PxKyl17Tvj4TOBH8xEyNx5dgsSkaaUCaQLqj_rMqfyNoaRuixtMINvPqvtwN0cuZinUlU_7W_Lz20fX6fTa2SqWy_V8qIKBxj8sqPSol90zFANiuVeExpkhyBeDqHQK4nvmhIEl5E0sb71TpNdS6o9qv7LE73ld2v6esd1lZQQh11EvLMOOdY3jD14uepuW_9wkozQJPyDLb4FMlkdnCcw0mA3rKRIpqJldUy1WDVNpu3xBd-DtUAebVnNlmBfYiNsFn7Wew5H67mWMpV3KDH1x10jrrubyJYIihQ15FRqKlboDZ32cgT5mgxdxTMNwA9yfeQEcK_GFb6cilg82_uau5MVToSRO2w0va0VuudAEtvRkQwVqfI_gZNwFNZERk0_BefvrUqDfQveg2qrswRWA3Jlmki3oNmAZmYsvRruT_OIjlghNzbZVk16wU8
Настольная игра Балансирующие стулья 36 шт стульчиков,283 ₽,29 отзывов,"Завтра доставит Ozon, продавец 1aSale",https://www.ozon.ru/product/nastolnaya-igra-balansiruyushchie-stulya-36-sht-stulchikov-266866864/?asb=akHNqk2v9WiCo7gkhMDCG5LEYjDCnGnjnM1Yic4fXXc%253D&asb2=iEFd_krHLgodjVzx9YG3CP1wbZhlA51A0jRKCaRg-heEAOqtR0etBuf4d4twJiDt
"Настольная игра для детей ""Где мой кот?"" серия Игры в табакерке (детские настольные игры)",337 ₽,191 отзыв,"Завтра доставит Ozon, продавец Тридевятое царство",https://www.ozon.ru/product/nastolnaya-igra-dlya-detey-gde-moy-kot-seriya-igry-v-tabakerke-detskie-nastolnye-igry-262735473/?asb=qBdodk5qlv0IWJmXlgWAmhsb9S1uDDUpdRR0M%252Fq7rxE%253D&asb2=Ny2_AWbGy-I-uzEtGiJjlfxleheQX-lrEL6oI1JnuRr10O7SyzApuAHHgLYk_Bsc
"Настольная игра для детей Вокруг Света, Post Moroz, игровое поле формата А2, в комплекте кубик и четыре фишки, игра ходилка путешествие, обучающая, образовательная, бродилка, приключения, русская, экологичная, компактная упаковка, игра для всей семьи",292 ₽,138 отзывов,"Завтра доставит Ozon, продавец HqProduct",https://www.ozon.ru/product/nastolnaya-igra-dlya-detey-vokrug-sveta-post-moroz-igrovoe-pole-formata-a2-v-komplekte-kubik-435724170/?asb=9CkzEAvZh70jye97c1eiXQxtYYCZOwgip%252BeHFU83jT6WNvEDhBCYnB%252FzHJaf7rzD&asb2=6fUoCvTVdZG3OqFXhefsx9LhSXgoKntwtslt_wbjlC7P-S9GD2ENWCNshUuaQVjv_xmKF_cGWPsaR4UnaAF7GL81IrS1o4_TNENI_cJVdqa6J1mdNPyc4m_HK2qP3ATN
"Настольная карточная игра уно (УНО) , карты игральные Уно (Uno/UNO)",332 ₽,16 отзывов,"Завтра доставит Ozon, продавец Bang Chill",https://www.ozon.ru/product/nastolnaya-kartochnaya-igra-uno-uno-karty-igralnye-uno-uno-uno-471363710/?asb=1Yr94PjBaxwXwjzqS%252BGhOQke8drU6PAcmJ4kxf2dzMuGZr6%252BVBikVHtX27CUnZot&asb2=-z7OuIygzu7QQfAF7VH-WZgm_aKJfBC1Hqhi3GKBo6Lce6w-lwEYe_7nxU-Dr2WSxgTrq4eeNsDWMfGEoMx7DE2F9Zh1yrUkOkB4yFhHzugg2wONCSmHp8ojf2hPETFy9pQKkh26Q8ON_ykrNI9Vrg
Hobby World Настольная игра Мачи Коро Шарп,590 ₽,44 отзыва,"Завтра доставит Ozon, продавец Ozon",https://www.ozon.ru/product/hobby-world-nastolnaya-igra-machi-koro-sharp-31701059/?advert=h9uWDWWJDo2vnt7j_DSzTcF56HATVEaGvHvboEOyeWiyBvs2iPFdjiS_4WKuOOGahqondx-uUcvi0wOK5lFk2Ssz5G454N2I1wpc3n7677UiouR9bwCj2Fr06NbKK_nTGX55mZ_6OEeobcGOiKT4a0kT8_SomipyGeU9Y9Xw44FTxCN4szJQP-C3j7ebeyQ8y3JWiUjwVRRhqDihcJ2dI8SUSIz_E7BWxUgfIsPWMnZckSbtV48PvM_flD17ZmCINIhqSlYUWdY996AZdDxflwFGhd10DKfXCzm97V5qu88JPCN9HGYWUxRMKqrU-02l85x9JYf7dNZ1tJ9OtuEEK3x6Sr2g9Sd0t0AO6mevdyuwLg-ais_WRgU8kS8Z1l1jvy1niW7C83VYtEwa1AprInfI3Hfv-PSxtFrhoDXSeP130WTv2BHAnWovA86SwLGgO3vzr-dVfTXEdFNEPjZVZSb_2SObuN_8O3knSfKlwm_uX9SoqeVSsqU5h9PJXy7XzVAX3ieuvyMpf__xjDklYA
Дженга с заданиями / Настольная игра башня,655 ₽,51 отзыв,"Завтра доставит Ozon, продавец ООО ""Екомрус""",https://www.ozon.ru/product/dzhenga-s-zadaniyami-nastolnaya-igra-bashnya-472607914/?asb=B2jpEiqs68ffEZHBcRiVrzHN0OG2IGzuE7vCy81rdXGq04sSozeZK5WepH%252FlQNQS&asb2=En8C4quwr3001aEhhKCnDqW3kDnWdzJAejNePPhytZQ7co4J06VlvuQHjBmFjvcNLJXAHRdGFepto4ggsiPHJCuNwgnhAnioQiTJMY5FL5aAS2--dO6JKhsWWFBLBhYeJPKPYyEiL5DCVT485AEgTw
"Развивающая игра в дорогу пиши стирай ""Веселые лабиринты""",305 ₽,150 отзывов,"Завтра доставит Ozon, продавец Тридевятое царство",https://www.ozon.ru/product/razvivayushchaya-igra-v-dorogu-pishi-stiray-veselye-labirinty-311976328/?asb=Dh6JKg%252FHgY54CFUQB2JLSO5rlHeEiu8P86X%252BX2l2SHY%253D&asb2=p0_FdZKxFBjfj4edF4VBwbiQ97_1uAvMqEMnx9D-NGWJaW1JtZ7H_oabZnmIUe6Y
"Логопедическая игра-тренажер для развития речевого дыхания у детей, настольный футбол ""Пенальти""",127 ₽,119 отзывов,"Завтра доставит Ozon, продавец LogoMax.shop",https://www.ozon.ru/product/logopedicheskaya-igra-trenazher-dlya-razvitiya-rechevogo-dyhaniya-u-detey-nastolnyy-futbol-penalti-406898645/?asb=C6ZWzj2dK5pvIFcZxw53KlVT0oDSouJGEwKsRdzwh1A%253D&asb2=xkEDALKRqvz3WSkv2hN2ZVLeGxwMz46bHLvYVcAsdRMRdgbBHqJoYtRmderdSjUq
"Обучающая игра Bondibon ИДУ Играй Думай Учись Логомозаика Звуки Р, Р' и Л, Л'",548 ₽,115 отзывов,"Завтра доставит Ozon, продавец Радуга",https://www.ozon.ru/product/obuchayushchaya-igra-bondibon-idu-igray-dumay-uchis-logomozaika-zvuki-r-r-i-l-l-399010692/?asb=61eO6drQom%252F5OyMyL7vkUrhYE%252BfodEyR3osO6RmFM177cqZYScS0EDkQNGg6MuiJ&asb2=nKhkxfJqObuyQ5Z0K3seUNSazR2kNUpypoNkdnVZa0PNdt1OQy0UR-YM8JvnRx4PKa_QLqwzuDZuOGWy8LhTTDN3kLr-3nIH4II1LN6Tv1a92aEixqvs3MLyEIk7VI-TAsGmupW71QHW3w6VHX2f-w
Hobby World Настольная игра Fluxx Ктулху,790 ₽,114 отзывов,"Завтра доставит Ozon, продавец Ozon",https://www.ozon.ru/product/hobby-world-nastolnaya-igra-fluxx-ktulhu-140700215/?advert=AzaXrJddCKkAsNTUKqYRw25W5s7wM940Fu4uOk3moxqYAbXebBmWENNk-ZnFggoxcZ24SfofC_Hle_O6h2KyFJVQ8fXud8FaVayDBxBtWVvzJ47AsNMSUBLDH2AfTMivlfAnvGqqqGgxv3TVxXxysgMCrOB01du6ZE6ezVJE5Ij6njT-aKUXmAhVaU7ffOIusXfyI4BTunfdT0ET9gi8tn1X1M2ioVjnqo0TLiWv8oeFa-9DKJlYk_ukNKhfoX-AjM-frDdZsdtrKhjS4piqzB6UyWQP2AYkVvMWgqz0f4DOZFpA5wfEWuNUB0EYqkWXdlPnxfdxqsepvCZ8yi07ucyD7T0mncscBua2ykQQJN1tokBxyuyR-0s123JZ98k5TvTB7N0Wbv1DLADIjmi5SLrMnNAftf_K-EmaNeUA5grymLkuyj7u52qodUk7ymkeRGOGdnlz4jhD8zFQk-Uu_PNxE36iPRWKJ3Xm4ArGkNr93_Nx4pWjWNJ0MiCkq0LNIi0EuNdULOyTfo7O2DhPM8XsSvK6a9Dal5hf8KV87_g
"Домино ""Время игры""",141 ₽,17 отзывов,"Завтра доставит Ozon, продавец Фабрика счастья",https://www.ozon.ru/product/domino-vremya-igry-335919256/?asb=3u%252FuQXuhxlXG8QrLyF%252BZUcNYTGV4xKaJ2Kz4kRsKDG4%253D&asb2=i19OkZE2_kSMfRfiQDVL0SVMpEg82IMzb-bOQPrhdCy89nPjfP5UDo91n9VxcRfm
Развлекательная игра на реакцию Крокодил Дантист,517 ₽,128 отзывов,"Завтра доставит Ozon, продавец Buzmarket",https://www.ozon.ru/product/razvlekatelnaya-igra-na-reaktsiyu-krokodil-dantist-234840420/?asb=4BfJXw5o45zCizbh3LL0whmz%252BKSR8r%252BVzhRyYgccZZ0%253D&asb2=JB5Jjaanr2HbPFnqs9AwtwOW9vuutrrlhqiKaU5l1pT57bD-8d_ASAPXh3xWlUd8
"НИКУСИКИ / Боулинг детский, боулинг, детский боулинг, боулинг для детей, детская деревянная игра, мини боулинг, игра боулинг, игрушка боулинг, настольная игра боулинг, 30x10 см",360 ₽,77 отзывов,"Завтра доставит Ozon, продавец Купить.ру",https://www.ozon.ru/product/nikusiki-bouling-detskaya-derevyannaya-nastolnaya-igra-30x10-sm-214527303/?asb=GSxJTBj5aeF3vky3C2kOw0LC32zY285ZbHuCwXu2jVg%253D&asb2=20-rCUeRwToXpWUy-jLm7wpMXXc1wY0mXkUOOScLFI__vKSzKaeKeJLwW4VlmeBG
"Настольные классические игры ""Шахматы"" пластиковые в деревянной коробке",690 ₽,154 отзыва,"Завтра доставит Ozon, продавец Тридевятое царство",https://www.ozon.ru/product/igra-nastolnaya-shahmaty-plastikovye-v-derevyannoy-korobke-desyatoe-korolevstvo-161855204/?asb=Mu2XGKeP0ywwnELofqrKq92aqdrIDm2%252B5hJKQI%252BU%252Fbo%253D&asb2=dThd-ovzmx58D3PMFDl--jubnOa5rfY92iqlbFr8IHAaspZiZmlJNqyZIDZsF_Cp
Hobby World Настольная игра Манчкин Хипстеры,390 ₽,150 отзывов,"Завтра доставит Ozon, продавец Ozon",https://www.ozon.ru/product/hobby-world-nastolnaya-igra-manchkin-hipstery-140700235/?advert=xVuPe93ieu2MkWe3_Bnf2oPSZom5k6b2V4AtceL6l7CbLFlXDhDBV5q5D_B32F0Ji_NSfNrxeVd02F5v6i8YPU9JMy3U9mFhzo8iqTEYzS_OGBNEpwQykbO7SIghg1R4GOEL_bIhnmFnya4jN48jW_igPy8sng8W4uEcF_QVIbhKTMftgkSYHO4QfMMiTwHFEU3I9sgi9HiGKnlf617Mx-GGw3nGXXRtJS9lFmGrZTwIUwjllPNKPochm8mex9Ut1LFu5jwMrCMwiaX5ioqSCd4ORNpq7cIKOhG8o5w5GdDLd6I60AaMu2_EFTUaiQMAopv3G78fC0SmOpqKQ8ef47-1JnIbw2WYNuzxz2SC2oYMHlMd7LJb0kNZ9PKvRJdbJf28-SbOyHhEuR6oZ6DAJDIbhPXtmOER95ksMt9eyY5br_uKmF1kZQf7yl3yMHvEqb_Jsq8Bw0S_sDlOF9nDMr1NKGS9t9ci_d7q1PQPf3wtyzWSL-1CC84BobLzdmBRfbEZWYo7sUQ6KS4eGOL0lD1Z_qSitO3sgm0Pi5dSDcE
"Игрушечная касса для детей ""Монеты и купюры для игр"" (деньги игрушечные, купюры денежные, фейк рубли) детские настольные игры",305 ₽,102 отзыва,"Завтра доставит Ozon, продавец Тридевятое царство",https://www.ozon.ru/product/igrushechnaya-kassa-dlya-detey-monety-i-kupyury-dlya-igr-dengi-igrushechnye-kupyury-denezhnye-feyk-302882074/?asb=q2vWRdfCHBdEyGG4bfZWGVCGS7OlI945V8vOuPxpO9xerI6loML6YbAUh3W9WF3A&asb2=GCMTNMF95MiA-sAnsDrfyoRrT4YEZlv_Xm1aLWwAorFp8ehpAS0HS9Fo0686pPWazHRcwbWZRnIQY_sOjU05VejcAskNH0tIdtFKsgukm5qhE-BO7jB2DJDSxAWvtzH81dxANYSi0LQ7oCmvpBCKkA
"Настольная игра для детей ""Морской бой"" (вариант игры Танковый бой, Космобой)",386 ₽,167 отзывов,"Завтра доставит Ozon, продавец Тридевятое царство",https://www.ozon.ru/product/igra-nastolnaya-morskoy-boy-167277105/?asb=ZlyQ6ZJZl7FJrftuObKwVP58OournOXTov7iyOLN05A%253D&asb2=HcUxdwB7Lx1UtXCD7NAbRuav3jW6ZsJkY4ZNvaR7OBR-mbIYCBZVzQ3X90F1WJto
"Настольные классические игры ""Шашки-Шахматы"" в пластиковой коробке 2 в 1 (серые)",322 ₽,201 отзыв,"Завтра доставит Ozon, продавец Тридевятое царство",https://www.ozon.ru/product/nastolnaya-igra-desyatoe-korolevstvo-shashki-shahmaty-v-plastikovoy-korobke-173623538/?asb=1onLvh3uZBvyaIng1LYj4KQSZNp6C%252BU5%252BSdR1tyWkxs%253D&asb2=lV4uPb-IqEJ2CvzUbSewcfQXPHGzCabcTakUeiMStSRWwiNrA2fUE2zLUlz71hh1
Настольная игра Мафия с масками (10 штук) и картами / Психологическая игра для веселой компании в подарочной коробке / Игры для взрослых и детей / Мафия вся семья в сборе,979 ₽,67 отзывов,"Завтра доставит Ozon, продавец ГлавСнаб",https://www.ozon.ru/product/nastolnaya-igra-mafiya-s-maskami-10-shtuk-i-kartami-psihologicheskaya-igra-dlya-veseloy-kompanii-v-298808707/?asb=BiMklosBK%252BbrDuZWpm5tY6XatTAZje3E8ripIkEfdEQWgXsaVMBJUnMRw2PuWisc&asb2=Htqf1-YWgdYb5hg76Zepw6F56DY5yjnUto8YDHh0_hJwmJwrTSwve5NKs_YkV6uqjfpTksveX7LZLfYdzpaBxWTDQ34TZIuocA8-z0vGIb7VGtfO-Jn-BoIgNpSnFo8N6sA2B-PrKjmacsgc9nDshQ
Hobby World Настольная игра Берсерк Герои Сила и Честь,150 ₽,40 отзывов,"9 мая доставит Ozon, продавец Ozon",https://www.ozon.ru/product/hobby-world-nastolnaya-igra-berserk-geroi-sila-i-chest-136224258/?advert=B6JpweSF8oRbOrpP8V6k80QI6u-sEGvWbOlEo4lU5fuxG5HmkLyYbh_gwHtk-FXNSneeTJiY-gIGYjHgSPtBvcYYgMGF0dtCYawjs4L1RS-XtaLZspPyuTxjlQ2zttvIE8tPb4fw5gGqCAh5-PMctsyHcJsZt4KtkX7RzyWuNl46QUcQo1rcwG-kjLLIXhiNrUq-oNJ87KzfzB5r__bItdvH7HqsNcnCNYNSqy14B03LCz63vWvenj2UtqiO1jJld6x2HdiSRY05aa4hnmfy-PrqfnX3uM7rAX2m7GUbgZMia9rddqiwglgJcfAgQvkCI2HGHntRG-HyxcLyjX29ARGrD5bx7pmSBXxBUUUjImOu3J11l-RVFz0s19H4cXd0e_5b8XCm8w9uhwnLy8fyvRdCqlsddYusgrcfnHMHfZ6hstN77hpqjVlHZyax9lJ7tMbB5Mu0NA6CWQKe72zczngCE8br4ddVgG-Jc0rLk_QMQTyMW1o8yYbwpRVKWj_hhGLYsrbPVD6Jmju7IA8Vhi3N_8CQTWyM7K3tTJjkvNQ
"Детское лото ""Зоопарк"" малое (обучающее лото для малышей)",102 ₽,158 отзывов,"Завтра доставит Ozon, продавец Тридевятое царство",https://www.ozon.ru/product/loto-detskoe-zoopark-maloe-205724566/?asb=lo4vUpcuUyLtF4zW2Qd9iOMKoCxy0E3y2rOhWzy4rgI%253D&asb2=4DR5627bwCXXY59V22UcJ6C1hzoLwN71Dq6raocFIBTNZqEnlbDrGIAno687PMnU
"Настольная игра-ходилка Умные игры ""Фиксики. Весёлые приключения""",160 ₽,31 отзыв,"Завтра доставит Ozon, продавец СИМБАТ",https://www.ozon.ru/product/nastolnaya-igra-hodilka-umnye-igry-fiksiki-veselye-priklyucheniya-268990609/?asb=z9JSI6elOgIbXWMtrDD94TiMpMfabT%252F4xN0pUwt4zak%253D&asb2=D6iXRy-yc3p_AAOuL5C27HGKBMiHU5OVhtydks_Wnl3D7XyBBxdVAi7TflbzwjDP
"Настольные классические игры ""Шахматы, шашки"" 2 в1 пластиковые в деревянной коробке",726 ₽,66 отзывов,"Завтра доставит Ozon, продавец Тридевятое царство",https://www.ozon.ru/product/igra-nastolnaya-shahmaty-shashki-plastikovye-v-derevyannoy-korobke-desyatoe-korolevstvo-161855043/?asb=XKIsxG9j%252BvTBoShACAgkUOWNpjmqkEa2JzRlXfKYh0A%253D&asb2=FzDPxReOd25ulGd8k8f01_VogeEHK-Yp0coQy3hJmlLIMDmAptj3rKupyUQ9AGpe
"Веселая игра для детей и взрослых ""Break Dance"" ( аналог Твистер, Skrutter, Твист, Скруттер, Tvister )",308 ₽,17 отзывов,"Завтра доставит Ozon, продавец Тридевятое царство",https://www.ozon.ru/product/veselaya-igra-dlya-detey-i-vzroslyh-break-dance-analog-tvister-skrutter-tvist-skrutter-tvister-264793375/?asb=KrB7OQ7hitNWW8o8QAkM3%252BhWktaQTZGnUnDKM5APCOo%253D&asb2=EEGL6eOcTrlNCjt7axUgOmUB9DwJxgfL07t7Ms4HK8_TaYa-u1CoqPE95fuwONcF
Hobby World Настольная игра Манчкин Принцессы,390 ₽,80 отзывов,"Завтра доставит Ozon, продавец Ozon",https://www.ozon.ru/product/hobby-world-nastolnaya-igra-manchkin-printsessy-140700233/?advert=dgSfA8T15-fpzAN4u1WtCxQUh_VvELYCIJqdgoNdw7sftBOj3Y4IZct7zsuBzgEoHOoyxjqbkWMf1E4Rm3UCUXviw97J4hC4WjVf3jZPNw1RyIlWhFw7MWbTzEp8Ulz1daGvIFGg5VC84S_jyWf6378thUD7ztzeicMMGHNccIvDpr34wFFv8_2eh2MBlDD8vHJEW6YBesAm8zdE6hsjuXYL9gSpzXFY0qvgFoC0SaqAbdBUXZfbK8dy-8s7d9ayJ0mgbX7gg7ckWjGhyYEhi5YKa_f9CTfeqmPuqW0y8hnCIjgd_Daa5oifKoOGwUu6v9LV83KCXTpF8EeHbAdF-pAgZVE3kKm7pLXi-Fxv6s0taQWYW2E4Jl7Kwe5X2QlA8OW3uzWuFylfOdJNKNS-_zaOAMNt4h-jD2EKLHQV88RdLXOv4yDVwhVGLshGOJcI61Xf4_mpNYEHWKW7deFgKJEX7snFA-uwV9g7KN3f7xn2jiA2k9ne0haTEwgy9_g_O_DF4uiR9WF3_DOjd3M1qTh1IdSM3xUiUvZqo2wKshk
"Настольная игра ""Осторожно! Злая собака"" / игра для взрослых и детей / для большой и маленькой компании",977 ₽,3 отзыва,"Завтра доставит Ozon, продавец Golden island",https://www.ozon.ru/product/nastolnaya-igra-ostorozhno-zlaya-sobaka-igra-dlya-vzroslyh-i-detey-dlya-bolshoy-i-malenkoy-kompanii-343327427/?asb=mj0RgdRfOVPiYZQ3r7NRPQsHTfrM6AC1NHyy6EUPgoX9JzTwHaO9pv0V2jqTt%252FkC&asb2=O8F6rDRyQMBJnBbTQhNWE-4xLdzjxPG6Y8kSa69L_rn8jUNj3gfKIWxg3WqByaiFQIuHNL1e8wPRiz3yCdg4duCq1ycBRPPaLeKwFvMcCK4j3AgxAMOxvoEoK_foA0xa1TxBYEElT5xfzIh8wvtpsw
"Фанты, ЛАС ИГРАС, ""Дрыгалки"", танцевальные для детей",138 ₽,30 отзывов,"Завтра доставит Ozon, продавец Эврики",https://www.ozon.ru/product/fanty-las-igras-drygalki-tantsevalnye-dlya-detey-262579071/?asb=AIxuzw495Gl%252BgfKKEsMU74ZMa6WeLT8o1C9%252F6PWbJ5l1Tx2W65A9ttjvp8qsggoy&asb2=Ic5yWAacQ2ZzlLeqbACsN9jU3P2QWxNhhbVBQnn2nOdFpbWpa3TkO-PFMmFRGa2xCWmO4OyAaDfjxgotKPHT9q7IztWSAVUYKcLgSu3sICf5D2C72IoGPNFWXnJ5XWM0RqEZVslECYtORaZyV7GukA
"Купоны, Родительской щедрости (книжечка из 24 купонов), 7*15 см, 1 шт.",149 ₽,67 отзывов,"Завтра доставит Ozon, продавец ДавайДарить!",https://www.ozon.ru/product/kupony-roditelskoy-shchedrosti-knizhechka-iz-24-kuponov-7-15-sm-1-sht-272237304/?asb=RmHG26%252FlVYlzw6Eu4anfLVSSPyf31eF9HIDjnWoiEgE%253D&asb2=W2_CGEcoYSnXrQRWFc8LMXD8scd3ZGXMkHbv2kRFABZIajWz0uqEJIGLbbgmpYEY
"Настольная экономическая игра для детей ""Денежка. Играем в магазин, покупаем продукты"" с карточками товаров (игры по финансовой грамотности, азбука финансовой грамотности, финансовая грамотность для детей, деньги игрушечные, купюры денежные, фейк рубли)",284 ₽,85 отзывов,"Завтра доставит Ozon, продавец Тридевятое царство",https://www.ozon.ru/product/nastolnaya-ekonomicheskaya-igra-dlya-detey-denezhka-igraem-v-magazin-pokupaem-produkty-s-kartochkami-264345744/?asb=ra%252FZuM4FG65Tz7SkDKfDxTkZylNWT4W1XZKoaPs8WsA%253D&asb2=9pMEvVuWTMy-QXXS4j_a72xdQnHjxfwLUXRL301a7GBzSBWGZ_OrjIPGmElawlCR
"Настольная игра Hobby World Картографы: Герои, 915397",990 ₽,3 отзыва,"Завтра доставит Ozon, продавец Ozon",https://www.ozon.ru/product/nastolnaya-igra-hobby-world-kartografy-geroi-915397-401596243/?advert=crz1vP_avhqso7AFm_wUiqy-3MLumDfJysWnCKdRjmeh-ylJ62yU7tA6LiXguzNavoDT7YqvSbWy1xz1L6dX9jBICzMm1ScScAk-2PWO6hVj-k6uQJpvp4jUQqlbpGH2LhufYwKtFYHFZZAT71Gs5M1qUwFu9SzLUcSlCBElyCkVMqQDV_MuKY0PWFPkRGdn90DnBdkZV8VAqT1Wu2WmpoofbGk3-mxX97aoLXixQXSSO0Osb1a6q29GKgVx3PzZgwboFpy7gKzfeiN3NFBysj65EWDMTqgCOXCqb_5d-qa22D7-OJ_RKNlX6j3SMiO6MPKk6IwXbMiMAds5fylQzkHZdV-m4cHI04OdAbKvFADbam617vtWKj-0mjBZtZVKzJEPgfuZn8VVkuLo_-5MFz6_Qm_nYq_efV3HkEJv3Y44opBHHTBYNf73nGYMKB9dBAT_VJfpcXHG74ehKcpvnkVAcJqKjAqe4c9-zuW8yTfLTJ4ZvEt0JI2iTbDO1uEl_CFVimnhgpglDIhXJk9JHahwBcv8kl2k2zQvVbd3tVU
"Настольная игра для детей ""Крестики-нолики. "" (деревянные фишки) европодвес (детские настольные игры)",110 ₽,58 отзывов,"Завтра доставит Ozon, продавец Тридевятое царство",https://www.ozon.ru/product/nastolnaya-igra-dlya-detey-krestiki-noliki-derevyannye-fishki-evropodves-detskie-nastolnye-igry-272313581/?asb=7kcb4jsMr7L34tE54RPNEuBrqGWsNW8tY75%252Fwq043cU%253D&asb2=OA6kCeD_As1sHIBEBDjCtyxsVMBlnakH8idE3nVSuVSDYSszrCXScKzxsmvvqYjY
Напольная игра Твистер (Twister) / Настольная игра Твистер / Активная игра / Настольная игра для всей семьи / Напольная игра для компании,598 ₽,175 отзывов,"Завтра доставит Ozon, продавец BrandOnShop",https://www.ozon.ru/product/napolnaya-igra-tvister-twister-nastolnaya-igra-tvister-aktivnaya-igra-nastolnaya-igra-dlya-vsey-semi-246286367/?asb=07SaZex%252FwhTBymS96CQkV%252B1j12%252BrlwoUrJ5whVlmNKY%253D&asb2=yTFi-p77O0bqO0xOgb24cNa85UCl7xe2SlXJecCb44V2TWqgSMqS5v3hZG4w6tvj
"Мармеладские игры, подарочный набор 2 серия, 120 г",428 ₽,146 отзывов,"Завтра доставит Ozon, продавец МТК «Алиса»",https://www.ozon.ru/product/marmeladskie-igry-podarochnyy-nabor-2-seriya-120-g-307061536/?asb=ytI6dHr2U1hf7trJRtTyWMUSfs2OFEFrSllNWl5L9Eg%253D&asb2=mMy2OQpoksJQU9lqyebjo6Zl9nG4eUH2g21rRN3wryRqSmQ8e0AvqfQu0QbKSmsU
Настольная игра Простые правила Пакля-рвакля,560 ₽,39 отзывов,"Завтра доставит Ozon, продавец ПРОСТЫЕ ПРАВИЛА",https://www.ozon.ru/product/nastolnaya-igra-prostye-pravila-paklya-rvaklya-178193306/?asb=tDykRRb3hiew51W9BSqG4vfig6B7f0VbZP7ZgxYVVNY%253D&asb2=VXKzja4aUC3TCPLIAg1wsRfYLP8zA-sbWFcsV80DKR_6IrJQXZEr95JRqs_NJyHU
Игра настольная / Шашки пластмассовые в деревянной упаковке с полем 29см*29см,649 ₽,39 отзывов,"Завтра доставит Ozon, продавец Leomik",https://www.ozon.ru/product/igra-nastolnaya-shashki-plastmassovye-v-derevyannoy-upakovke-s-polem-29sm-29sm-264467286/?asb=kds2ArHjUAFQ6JQguGd8AOxUw1h4qt3UO1tAn4y%252B7c2HlyozHGOsK1w72TXE%252FR5A&asb2=qzsuHADvRtCAYjo2Xga6dlTe_FWbz5Ue6srPkaaysV09NIpDQO6sjLABO72dXX0f4xHb5Tsh8DMYk9O5HYtxEp1VCNB1wdb85de1yxCaDmK0O3ck6pUguER8YKzDiTgxWx0VGn2PNiP0X_pzMKJpkA
