"Ультразвуковой отпугиватель насекомых, грызунов и тараканов ""Electronic pest repeller""",439 ₽,44 отзыва,"7 мая доставит Ozon, продавец goodstore24",https://www.ozon.ru/product/ultrazvukovoy-otpugivatel-nasekomyh-gryzunov-i-tarakanov-electronic-pest-repeller-323010761/?asb=FxPdmQCCZqexnn68Vnaxr%252BpvY7rOhkE1h2tRfhv%252BtNI%253D&asb2=RYqQBNc_zNXRe55qmu_p0UdmmtFP_BMdz7_dQpqFbbTagSmb3AUhXnc7DbHp6Ku5
"Solozar Отпугиватель грызунов и насекомых ультразвуковой Pest Repeller Aid, белый",338 ₽,1 отзыв,"8 мая доставит Ozon, продавец Solozar",https://www.ozon.ru/product/solozar-otpugivatel-gryzunov-i-nasekomyh-ultrazvukovoy-pest-repeller-aid-belyy-253260107/?asb=Q8bvl3WCD6lEu%252FwwTi8Qb6OjH8kIqyCGwP5xJrtFZTI%253D&asb2=d_E045HgrsEWwRP8npASwthS68F3ANR5BjT6gvwgImGCH2Cf48p3afpf3hTePrqD
"Спрей для защиты растений Ваше хозяйство ""Зеленое мыло"" от вредителей 700 мл",319 ₽,20 отзывов,"10 мая доставит Ozon, продавец Бумеранг",https://www.ozon.ru/product/sprey-dlya-zashchity-rasteniy-vashe-hozyaystvo-zelenoe-mylo-ot-vrediteley-700-ml-262216099/?asb=mK7kwRuxzTopzlUUH5fYPYox5K9IC7P0ensEwlWMnBY%253D&asb2=nYFbYDrbYLZeGFbGXvsFHv9HZezggbchZ7RsPxqX6Di--rPh5RZyoygy0kWYXClx
Виниловый 3D-шар с глазами хищника,840 ₽,1 отзыв,"8 мая доставит Ozon, продавец магазин Энергоблок",https://www.ozon.ru/product/vinilovyy-3d-shar-s-glazami-hishchnika-283392664/?asb=y5MhfazsJEQxQMUVo4qV7k1la6TiKYkwOpLTT2sNeC4%253D&asb2=RWL60cfDY2BSb504Cs3qQy5N4ee1AHACL-0NYgwO9Z1UOnksSKI2XN9J4m02nUAT
Отпугиватель мышей Pest Reject,270 ₽,2 отзыва,"7 мая доставит Ozon, продавец Force-W",https://www.ozon.ru/product/otpugivatel-myshey-pest-reject-260161175/?asb=W6PI5aoNIbSUgKjE%252FWu66j34JJOjROkfMuY2SqrpBTs%253D&asb2=soYF11pDaKaeJF83D9KRRrTMy8ipmmmABb24JAsQA09teCLPaZ1GSmnwT7Iq5N1i
Пусковое устройство однозарядное ПУ-1 для Сигнала охотника / Гром,299 ₽,1 отзыв,"7 мая доставит Ozon, продавец TrueGun",https://www.ozon.ru/product/puskovoe-ustroystvo-odnozaryadnoe-pu-1-dlya-signala-ohotnika-grom-356728497/?asb=ego%252BJRg3bIGoY3SrXfg5TjdgBaO5ZRWW5tgxU%252F1mZc8%253D&asb2=BpMtY7lYy5dj7VHo_VPVbEDBNkfwFLCCx9nVtSreHhZOzESGNJ5KY8v2m1h9hXyO
Кротоотпугиватель Rep-3P 333404,512 ₽,4 отзыва,"8 мая доставит Ozon, продавец ИП Тимарбаев Илья Владимирович",https://www.ozon.ru/product/krotootpugivatel-rep-3p-333404-168338095/?asb=Nyz1yC0VA4o6rlFz62DzGf7Ee3sDVHC4WMFBH3yaf88%253D&asb2=t45XsKabORi-BlhwXLYMwV9WVgFI6VrUIVXBxSEsRBNaNENDIzzGGUy0Krm7OfxK
Кротоотпугиватель REP-2S (на солнечной батарее),836 ₽,3 отзыва,"8 мая доставит Ozon, продавец РДС Маркет",https://www.ozon.ru/product/krotootpugivatel-rep-2s-na-solnechnoy-bataree-268595326/?asb=47O20AnYhjsJpp%252BHBvy1upbOfp7PmCINebfLhtD%252FwMM%253D&asb2=6AN6RmiVaZwrmM2sX9ZmLeN_bhG5PF0us_Ze_KuZ97K4kszFeBN3g3VjNP7DhFXN
"Детский ультразвуковой брелок, отпугиватель комаров, Migliores5",221 ₽,10 отзывов,"8 мая доставит Ozon, продавец ООО ""Юпитер""",https://www.ozon.ru/product/detskiy-ultrazvukovoy-brelok-otpugivatel-komarov-migliores5-242302070/?asb=3vRngEkNWN9En1aPkr21JOzaxbVnnUI2ZvifG8nmYFA%253D&asb2=picEY7eNbW1udSriSqCXl6syoW0rD4IfWTjMpnVMdUhCDoiBH6jli4yzD3U6Ekqa
"Гранулы от тараканов и мокриц Avgust ""Кукарача"", 100 г",261 ₽,6 отзывов,"7 мая доставит Ozon, продавец Семь Семян",https://www.ozon.ru/product/granuly-ot-tarakanov-i-mokrits-avgust-kukaracha-100-g-262868324/?asb=QHTvAeuyhvfWSIfWSwxooXh23qhI6OU7Cj16zuIR7hQ%253D&asb2=DECOpZCqG-JaIp50yeyU-Um8MNvfXVJHoSUT7tSKXZh3jGPjNP5jS1v9t1uC36Rg
"Браслет от комаров с натуральным репеллентом для детей и взрослых , Mosquitech. от комаров и других кровососущих. зеленый",252 ₽,1 отзыв,"Завтра доставит Ozon, продавец Vary-Shop",https://www.ozon.ru/product/braslet-ot-komarov-s-naturalnym-repellentom-dlya-detey-i-vzroslyh-mosquitech-ot-komarov-i-drugih-562279294/?asb=Slzh2vnT2KROMSp%252FxQgRLApe2x9ZW0OUH80E90Y4si4%253D&asb2=e1wBszloNcR-NPRI8XIPKSLfyaYbaW1JlkE0Qmj-3ZePRYYsPJEjg9frTb4WuxdlFFXvF2-sMm6gpFiaC1-i1z7e2kN2642OGxcyYYhcSW-ZvAdWg-MXypMLrEgILLw4
Средство от тараканов Гектор,550 ₽,1 отзыв,"8 мая доставит Ozon, продавец Идея в сад",https://www.ozon.ru/product/sredstvo-ot-tarakanov-gektor-297699419/?asb=JZdlzU17l0zdPW8%252FQwTKefely5QVEL6jBwzRRcCZvMk%253D&asb2=jCw11RhSBcMkGVWw3H2bkVJc3VwPIM7cHPJRyHgZmnpS2R-LXU0ZV9JQsEgD5m-i
Отпугиватель комаров персональный ЭкоСнайпер DX-600,350 ₽,1 отзыв,"9 мая доставит Ozon, продавец PushkinMarket",https://www.ozon.ru/product/otpugivatel-komarov-personalnyy-ekosnayper-dx-600-510612007/?asb=y3LHPTOujEQ%252FsMWhQfv5M5a8OLbSb4IllxMfgeLdLK%252BvkZwFdoTFuQax5x4XUGcE&asb2=Dd_cYV47RKB9dnpJCDhl5myYtcbOehPqOWeGBHhXrQEl1HhPvmyz8WGepyX_1P6SiBt9iWB8KBGGupUwnjeEo4sbPCQHKjvHADxF_zdyGCG8NdkYvBrBv7vH4uVEvBjraR2X-rKHYIR_Q_7hDytIQA
Набор запасной Thermacell (1 газовый картридж + 3 пластины),740 ₽,29 отзывов,"8 мая доставит Ozon, продавец Comfortime",https://www.ozon.ru/product/nabor-zapasnoy-thermacell-1-gazovyy-kartridzh-3-plastiny-260573535/?asb=B83v1D3yKAxZZpO91G%252BJL%252BFgeCpadQhO3R6RfNadF7RMcGbLCU4VuHcyKKRXyrye&asb2=1ec6XJxyKt8rJGmhGMx8qc7RQu5zYpb76A1FP6QquFLYa-Ei3USLNlte-F5HKktE3chOFxu_JGiXl0M3PuONycprrc9POT1-OxRd_W5z5-pF6pFw929LJVGCC_l-YW97lKqy1LBwari1bctoD9PQlA
"Отпугиватель крыс и мышей ультразвуковой, Чистый дом",890 ₽,3 отзыва,"9 мая доставит Ozon, продавец IN MARKET",https://www.ozon.ru/product/otpugivatel-krys-i-myshey-ultrazvukovoy-chistyy-dom-310291572/?asb=PsFHUuDyxo1xWCNz1GLfTrlNKQ0k%252Bx7rSV36wt9AL54%253D&asb2=lmfeuJ1ha_r9BpWF9DuMToD1gk6vRkKZh60rVpsPGQIgLkyUBQ6IzOngDmCo4UAy
Отпугиватель кротов АнтиКрот - Макси БИОС,719 ₽,6 отзывов,"7 мая доставит Ozon, продавец RShop",https://www.ozon.ru/product/otpugivatel-krotov-antikrot-maksi-bios-244472348/?asb=mIPQyPBEvw8m5FLgxayvMx1fPg34eEwZtnZXI0TtDZ3pl7kFlFAYASd6xoA9S6f5&asb2=48Q_xV81DjY36WnSZV-D5__ffpupDBj4va2va-ekFcmeaFTptAM-X6YQmhMQDbUTb0widQfZbV7I7fZiDNkbFtz8URMx3uodmMd1cl5fFOfwUcpPbLGcmZ9gf0AKk-XBEK1DBLfm0AHQEg2YR8rBkg
Штора от комаров на магнитах 100х210см,637 ₽,2 отзыва,"10 мая доставит Ozon, продавец YOZHShop",https://www.ozon.ru/product/shtora-ot-komarov-na-magnitah-100h210sm-558889296/?asb=9T6%252FHIwmwpBwbhCpznYd7Zz0WIYpFtwW1y%252Brcs7zcGTLa0FTYs%252FqQWY2T4AczN9j&asb2=YWziJcCH2JqVs1QdDNhkRn5eoe3EZUUiwl_MMu4tHJj4vFILFIifjhDy-Xkn-yuzDb2FZJfRibiBPFRWnzMCz8Bpy3Ws6j1hHNTg3MvlRrMdgm-n3mmzKaevN4OV5T4q5iF1HyxhEmqkw-YYEktLDw
Ультразвуковой отпугиватель насекомых и грызунов Pest Reject (Pest Repeller),407 ₽,40 отзывов,"8 мая доставит Ozon, продавец Optbay",https://www.ozon.ru/product/ultrazvukovoy-otpugivatel-nasekomyh-i-gryzunov-pest-reject-pest-repeller-282660914/?asb=M%252FG%252FLNgKwapWTJ%252Fan8Yz5hhtnouUdw3JZtWd4%252Bb2Mok%253D&asb2=20bdy1_jjKJoD3l1GzzVar4Ub7Y6In1UpZXpjhRW3cgPEbW0Uv0QLHgC9MQ0bcty
Ультразвуковой отпугиватель мышей Облик 703,750 ₽,4 отзыва,"7 мая доставит Ozon, продавец ИП Богданова",https://www.ozon.ru/product/ultrazvukovoy-otpugivatel-myshey-oblik-703-400475237/?asb=c%252BDxgt69OT7mwdt7Cu3oiW63e3LHeEqDxTbCvpSkr%252Fo%253D&asb2=asoisUY6_VsWUcwalXfMSYOd4QS46pKG5wBJK1pVnqd1i2H3-1g-yZO3nOI5Kf4O
Ультразвуковой отпугиватель насекомых и грызунов Pest Reject / Средство от грызунов и насекомых / От грызунов / От мышей / От тараканов / От крыс / Отпугиватель грызунов,378 ₽,2 отзыва,"7 мая доставит Ozon, продавец storeash",https://www.ozon.ru/product/ultrazvukovoy-otpugivatel-nasekomyh-i-gryzunov-pest-reject-sredstvo-ot-gryzunov-i-nasekomyh-519599277/?asb=ywRDUsmyViM79MuRRYXvagAT9tEi5R2KBspRLQwiAlcOStR4hFzQmjGhv0ue8V25&asb2=6tAUz8jmjxWClMOQF6G6QbJXwhKxLZ_uPpXEOcRb1AOGMmUhF0pKKCSaD6cuAOYHy7RRm3rG5bdR8sDPvrtOe4FOoOd6ATwHoCf9WUiqgEcw91_k9XFPjPRJLYrAkMQIEsnFUAVGTUYlkd1QtiY-Yw
Отпугиватель крыс и мышей ультразвуковой,590 ₽,49 отзывов,"7 мая доставит Ozon, продавец NITITA",https://www.ozon.ru/product/otpugivatel-krys-i-myshey-ultrazvukovoy-262688040/?asb=6GVh4u9a4mSWv0LkPThTj%252Ff5r%252BRc1VoJSauAF9%252F%252F3Z8%253D&asb2=7SKBpbFNoYTsENiPU8g1w6zgFwXPRRqqXNjObBL-T76DCoZMD3sNPlnYfzgdHHWx
"Ловчий пояс ""БашИнком"" 3м",292 ₽,5 отзывов,"7 мая доставит Ozon, продавец Семь Семян",https://www.ozon.ru/product/lovchiy-poyas-bashinkom-3m-218676663/?asb=1lRLKOZsgflN0fC1WUndoUp%252F3RjhGk4Zzw84MUpPLhs%253D&asb2=VHYw81a4DyvFVBVcLWnKJaIXRmn2z5rbZtHupf-B9BTMm8Pk0_vXBegR5CRFVxhU
"Solozar Отпугиватель грызунов и насекомых ультразвуковой Pest Repeller Aid, белый",338 ₽,25 отзывов,"8 мая доставит Ozon, продавец Е-КОММЕРС",https://www.ozon.ru/product/solozar-otpugivatel-gryzunov-i-nasekomyh-ultrazvukovoy-pest-repeller-aid-belyy-562410722/?asb=eyNAG16Sv9KPraz2rcgzmWAdRRJT7IGCAcVDQ9ciFgY%253D&asb2=chT9KCNJ3FfMZ0bsm3hwKzBUeJxSdXCpXoIfbzyKK8XbSXr-hKx7ePVyugWUjgl1
"Средство от вредителей Avgust Змеед ЭКО, 50 шариков",561 ₽,3 отзыва,"7 мая доставит Ozon, продавец Семь Семян",https://www.ozon.ru/product/sredstvo-ot-vrediteley-avgust-zmeed-eko-50-sharikov-262785008/?asb=4KhwSdLXU9JKp9N6%252Fje8BATwktZs%252FzIysQTB%252BzcU1jI%253D&asb2=JoIt2i8K_uJzGyRiOfw_pvTDTDdF2eYOBflRZv8TbWwfbFoaag-BEsIt0MWvRksq
"Средство от колорадского жука и вредителей Препарат 30 Плюс, 1 л",962 ₽,1 отзыв,"10 мая доставит Ozon, продавец Galore",https://www.ozon.ru/product/sredstvo-ot-koloradskogo-zhuka-i-vrediteley-preparat-30-plyus-1-l-474873574/?asb=zX4fLJwnzhWU2OhNp7yHRrL1F6sWlIQmvCtzx40JO9U%253D&asb2=Cjtt6qLN5kYAXG2pOvwFr-kpxi3Qc7W6lRd896Fyi_zvqh0YwjTYfBou2VMRh1zN
Спирали от комаров Чистый Дом 10 шт.,269 ₽,8 отзывов,"11 мая доставит Ozon, продавец Home sweet Home",https://www.ozon.ru/product/spirali-ot-komarov-chistyy-dom-10-sht-243550108/?asb=ohJ%252BjkjFtbgPP%252Be7PVUjRLnjwhHOHgmT4drzr01Olfk%253D&asb2=iFx5gVv592WYE87NjMcNrC3SPM3allX7Nn7aL2SXKvog4zzKPsBzJm3lszhFLFi1
Отпугиватель комаров персональный ЭкоСнайпер LS-216,590 ₽,1 отзыв,"8 мая доставит Ozon, продавец АЛЬЯНС-М",https://www.ozon.ru/product/otpugivatel-komarov-personalnyy-ekosnayper-ls-216-184895844/?asb=3oQatah06nUcLgySRWNkpOSRUGn7Oti%252B1NWlPFtu3JM%253D&asb2=aSi3Bhx4mrUmpv8fDMeAyqPoaos1M06Yu4eZeLp-0Y5IQGSaBTVXRVD8_tTQTSup
"Отрава от крыс и мышей Тестокс 1кг, от грызунов , уничтожение крыс и мышей, отрава, яд!",836 ₽,22 отзыва,"12 мая доставит Ozon, продавец ИП Черных Владимир Викторович",https://www.ozon.ru/product/otrava-ot-krys-i-myshey-testoks-1kg-ot-gryzunov-unichtozhenie-krys-i-myshey-otrava-yad-278426320/?asb=CqOSKEi%252FhdZ62HzcA5L0GDmEbZTspeCuvuWTkEjoFlA%253D&asb2=T4zB5dZoLySWmO1GJjgHz0iGk9iquMN2OKHlLvTOXEziugKp012uxTWMznXopb9H
"Отпугиватель тараканов, грызунов и насекомых RIDDEX Pest Repelling Aid",800 ₽,1 отзыв,"8 мая доставит Ozon, продавец Kugu",https://www.ozon.ru/product/otpugivatel-tarakanov-gryzunov-i-nasekomyh-riddex-pest-repelling-aid-213379775/?asb=DupUg7F0P1BTlbAXUgAStLVRFkOgomk6or2smwS3AD0%253D&asb2=q5eqmosTC8NWsGmf0vDiBN7-oYRsXVQti5YNcr4wRueRORWrY6cchQR5EDRdAUdF
"Средство для обработки тканей от летающих и ползающих насекомых ""Тайга Барьер"", 250 мл",614 ₽,1 отзыв,"10 мая доставит Ozon, продавец Goods-Club",https://www.ozon.ru/product/sredstvo-dlya-obrabotki-tkaney-ot-letayushchih-i-polzayushchih-nasekomyh-tayga-barer-250-ml-257735334/?asb=xt2cn%252FA25qacsnwYNii7r57UFoYCNN7XfHr5yg8WiDI%253D&asb2=FrblRfohJjKMBtsyCj8D_RB4XwuoqjvSnQ_Gk0rOQJ7yONeDKlEkqTJphBMclOD5
Липкая лента от мух Рефтамид 4 шт,250 ₽,1 отзыв,"8 мая доставит Ozon, продавец Симплекс",https://www.ozon.ru/product/lipkaya-lenta-ot-muh-reftamid-4-sht-275810685/?asb=7lTYEmQ%252FpFJb3%252BJ%252FG9%252BL%252BFffdH3sf%252FRinmICJSzBjTZ3lakxu28YpdCUclG%252FN0m6&asb2=IrDAThJQDH0rnLyr29LIAI6GUioCK9ACsyep6kG1xiXeFvDFwZIKp5Hzu7g-NohFchH5LIiQ_dxZTeU2q7w5bgUjX7gGoowVp7nnI0jQ5MKE1S8RrVVUogOmpkPK84E5imXxkdZ5GP1Q98p8nXIbNw
"Отпугиватель кротов ""АнтиКрот"" БИОС",822 ₽,1 отзыв,"7 мая доставит Ozon, продавец Розовый слон",https://www.ozon.ru/product/otpugivatel-krotov-antikrot-bios-243212504/?asb=0mK1AioZkbA66AtpiOWa%252B5XMbB4vh9EOKtoEA7ZsiN163vPGh44mC8n4tNI8eAPk&asb2=0mz_Aob9j3nsvgdPTA1BORw8smw9iaINovicjnZDRgx1oJwd9jlAJiFznKtFnb-NKxETYcC-POlUrYqx8vT8d1GNn3QOJxr5J3HzHfR7rQ0coF33y8QIIoBVTzYNy8sdMXBB0PSXvhXSCnyeoWwbdQ
Отпугиватель комаров персональный ЭкоСнайпер LS-216,900 ₽,1 отзыв,"7 мая доставит Ozon, продавец Зинбест",https://www.ozon.ru/product/otpugivatel-komarov-personalnyy-ls-216-180216906/?asb=5gmhSPrMo9pd6EIU%252F%252BGCJDMongjwVPPc6DMTHuDV%252F3g%253D&asb2=Rr_t4xA3C-_V8Ug5r7wgE9FeM3Qo4Q0OZ9XFRf9CUwvwE65JnbsNLz67RwrDpvjn
"Отпугиватель грызунов и насекомых, ночник Inbloom",861 ₽,1 отзыв,"8 мая доставит Ozon, продавец EXIMG",https://www.ozon.ru/product/otpugivatel-gryzunov-i-nasekomyh-nochnik-inbloom-234103594/?asb=GRXryK%252B8lh66LUMvuTC87cM%252FpDi8cxH%252B8yyNT6eh%252FLM%253D&asb2=-jWPddwgBaynWmOaxiMjZJ6iwGpDIfPL4ADh66Z51EXexaAqVQYuKRHkWro9boX7
"GREEN BELT Серная дымовая шашка КЛИМАТ для защиты погреба от плесени и грибка, 300 г.",283 ₽,4 отзыва,"9 мая доставит Ozon, продавец МДС-НН",https://www.ozon.ru/product/green-belt-sernaya-dymovaya-shashka-klimat-dlya-zashchity-pogreba-ot-pleseni-i-gribka-300-g-264352935/?asb=iZuHleJyWt7a%252FVdKCnF55y91fMf1OR7MWOt3RhaPPVM%253D&asb2=_K3iQbiVNGyGJB94lwIR-74pRjB4QQilV6ZPrgTUJoqoq3mYxgSETCBlrNQ9xAd5
Отпугиватель комаров двойного действия Стрекоза с фонариком,400 ₽,1 отзыв,"7 мая доставит Ozon, продавец Магазин подарков BVU",https://www.ozon.ru/product/otpugivatel-komarov-dvoynogo-deystviya-strekoza-s-fonarikom-203334179/?asb=wCCK1MGLV8Dh31%252B%252FEHCOu9fOM%252F7AJcdjzx8QN2%252BGitY%253D&asb2=BRgGY1bwzdjUZnaCQS6IENc-nb-qEkaqb2EU98E41pfh7fkmXoo3hSFfU1svuw6l
"Отпугиватель птиц Глаз хищника, Виниловый 3D-шар с глазами хищника",750 ₽,3 отзыва,"9 мая доставит Ozon, продавец ТД Товары Народного Потребления",https://www.ozon.ru/product/otpugivatel-ptits-glaz-hishchnika-vinilovyy-3d-shar-s-glazami-hishchnika-232773287/?asb=VvUq6%252BgItM3CZZmGcY10TTQhNe5v9wPl%252BOiSuKrGArPbxM8oPd5ezyH9uZQLU7KV&asb2=LPykIVi34lQ1xww9hZ4N1Fk-2EqlPET7OJhMEBY4TbuskpxKJLzST5AsuzScyCBM7LchiTAaEE1sItFe_RZ4n6odcyU_34Tsal_cnpza0Pv0C1EYgMk_ht-qQf004JP1
Отпугиватель насекомых и грызунов,347 ₽,11 отзывов,"8 мая доставит Ozon, продавец ИП Кочетыгов",https://www.ozon.ru/product/otpugivatel-nasekomyh-i-gryzunov-231942426/?asb=LEh3IzcZC8kLdK%252BvNHCWaVHQ%252BZ7Cj12RS3OxHMOtmDU%253D&asb2=wscagxtPfUBYgbm5ZKc0E1c1lQbxBNJnKXH8EQ4tQpOGgSTdK8GLJf1Zm1B8jbNO
"Отпугиватель-брелок комаров ультразвуковой, с фонариком, до 6кв.м",544 ₽,1 отзыв,"10 мая доставит Ozon, продавец Мельница",https://www.ozon.ru/product/otpugivatel-brelok-komarov-ultrazvukovoy-s-fonarikom-do-6kv-m-282697779/?asb=rEr44FBDUYes%252Fvcq1aNkCbLbJ%252BxyXfJeJcVc7Alfqtg%253D&asb2=CIcLuPSGb-SNLg7BLRnJFAmS709AGeb1-32g_fTfI_R3FKze4TDzh4p7xQcvC1YH
"Отпугиватель грызунов биологический ""SITITEK БИО-1""",674 ₽,1 отзыв,"8 мая доставит Ozon, продавец ИП Куркин А.В.",https://www.ozon.ru/product/otpugivatel-gryzunov-biologicheskiy-sititek-bio-1-260622588/?asb=sYfwBNfYa4K5PVZaTPp0QUl7xIsIqmi0I7jE7QdFnYk%253D&asb2=uaHvYxc_gp3xpcxtlxTVjVEUWLULKhZHITTG-P_F6nbzl63QAxBOPSd07OPm0uEO
Ультразвуковой отпугиватель от вредителей крыс и мышей Чистый Дом,735 ₽,1 отзыв,"10 мая доставит Ozon, продавец Всё Для Дома",https://www.ozon.ru/product/ultrazvukovoy-otpugivatel-ot-vrediteley-krys-i-myshey-chistyy-dom-356417826/?asb=yKAo2Tbn7IdCQP3INsVf5P5B%252Br1av9Pt6H1cUrxHYbM%253D&asb2=Nhv2k9TAnLZTvJj5T3ggXOk2fQEajsy7oS8B0dGRYrrng6VNfMbIYH7GBEfdUYwZ
"Клеевая ловушка для летающих и ползающих насекомых в горшки комнатных цветов, 12 шт. Nadzor PEST18 комплект 2 штуки",667 ₽,1 отзыв,"16 мая доставит Ozon, продавец На дачу",https://www.ozon.ru/product/kleevaya-lovushka-dlya-letayushchih-i-polzayushchih-nasekomyh-v-gorshki-komnatnyh-tsvetov-12-455564064/?asb=gZZoA22BNAqbf%252Fw4dafMnZwhwpiZub9yueBS%252BpSJ3do%253D&asb2=cBfrpfgcF3Jw8wtXBBqm3EtmGjkTjWFaTCo8y4pRzPNbsEfERCjcyKajMy4aIcri
"Уничтожитель насекомых LuazON LRI-24, от батареек, серый",681 ₽,1 отзыв,"10 мая доставит Ozon, продавец Фабрика Успеха",https://www.ozon.ru/product/unichtozhitel-nasekomyh-luazon-lri-24-ot-batareek-seryy-283349415/?asb=nsLONY6krNgdQMOJydvMBv5lscyrjLTM8SoaifVpzUs%253D&asb2=XXz5tr3hI7A4135PKJPWgeo_0tEybvxV4D81zbvzrgyADf7hoN8WWLy_DVn3fIb9
"Ультразвуковой отпугиватель мышей, грызунов Pest Reject в блистере / Защита от грызунов, крыс для дома",900 ₽,2 отзыва,"8 мая доставит Ozon, продавец Maxmoll",https://www.ozon.ru/product/ultrazvukovoy-otpugivatel-myshey-gryzunov-pest-reject-v-blistere-zashchita-ot-gryzunov-krys-223438196/?asb=4mrbrPpxLUtmo%252FJHlE%252Bjr03797aZBR9wI5esCML0Nxo%253D&asb2=omXCc8a9PDliewG0_oLvmwgV02Za0VSvlaIbYI9FNmvKoEJ2lT3ARFkmoB-wgqtT
"Двухсторонняя Светоотражающая лента сад фруктовых деревьев вредителей отпугивающее средство, Репеллент для голубь с дятлами рост гусей отклонить",741 ₽,1 отзыв,Из-за рубежа доставит продавец YourStore,https://www.ozon.ru/product/dvuhstoronnyaya-svetootrazhayushchaya-lenta-sad-fruktovyh-derevev-vrediteley-257259744/?asb=YlQknRmcWnMzorrV5FI6Znxm0xTR%252BE8VKt%252BFkdZpfao0gIAQV4AvhUgic9tAWRF%252F&asb2=6XL-5W_fFkqY0hTX-NSMq1CB_yoKMgvpJ7PvCUXtW0i8Twv7RtKCXBut66jsmLv9s2wrFVJZ7v9JiCi0rvQ9WfZhumXXctw9UOAr0_lDGdx88oSES1FaMFstmoX8oXd_
"Ультразвуковой отпугиватель собак с двойной головкой, портативный светодиодный фонарик",803 ₽,1 отзыв,"Из-за рубежа доставит продавец Yongzhou Lixuan Trade Co., Ltd.",https://www.ozon.ru/product/ultrazvukovoy-otpugivatel-sobak-s-dvoynoy-golovkoy-portativnyy-svetodiodnyy-fonarik-426011695/?asb=KKIysw2gUjEqqznLlRqmJE6SRCHlktk20JlVAWhXuoI%253D&asb2=IyOad5Ow-LzKbUhz7xNy4djh25GzRc6LAT65Hd8mFEjBLw1QqgAXGt40Uhzh2zE0
"GREEN BELT Серная дымовая шашка КЛИМАТ для защиты погреба от плесени и грибка, 300 г. Набор 2 штуки",521 ₽,1 отзыв,"9 мая доставит Ozon, продавец МДС-НН",https://www.ozon.ru/product/green-belt-sernaya-dymovaya-shashka-klimat-dlya-zashchity-pogreba-ot-pleseni-i-gribka-300-g-nabor-264199168/?asb=a7icSCOvq%252F5vGbrriuEhVqb97oPubvdJBtwSvj3oFIE%253D&asb2=KehQCvNiCsVwUrLZGSUcQijCA-yQ3AnR2mKJpBuZIcZO7P58oCXgqyrpXnKIrtXz
"Уничтожитель насекомых LRI-35, портативный, от USB, белый",875 ₽,1 отзыв,"10 мая доставит Ozon, продавец Сад и огород",https://www.ozon.ru/product/unichtozhitel-nasekomyh-lri-35-portativnyy-ot-usb-belyy-505132502/?asb=h%252FctM1SzyxuF55qx0FaWDhfcH68VC8AIZzZGVoreCd4%253D&asb2=cPE5pYuFTN0o_9B5aZXUDxv9fpExOZoCTqb24BE99sRz7x1kpfmEpwgxgjFiREqh
Отпугиватель крыс и мышей ультразвуковой,690 ₽,10 отзывов,"7 мая доставит Ozon, продавец MAFFIN",https://www.ozon.ru/product/otpugivatel-krys-i-myshey-ultrazvukovoy-277442917/?asb=N9nRUylD7cBSRuIXMzI5%252FXHpd9Ju6GBMCqV6qsHJO6Y%253D&asb2=Saeu17vM6kXfac8jYbXhSGs-3frJkPsLeOSPmtSb-hgOADMc0DRA_RzpRmHAaHUO
"Уничтожитель насекомых LuazON LRI-24, от батареек, серый",922 ₽,1 отзыв,"10 мая доставит Ozon, продавец Сад и огород",https://www.ozon.ru/product/unichtozhitel-nasekomyh-luazon-lri-24-ot-batareek-seryy-505132127/?asb=bimVJL6honMmfM7g1DKJpF4QFOtr9KI7221zghp%252F0uw%253D&asb2=j0bjehiQK1FDtOzFNOvc7nEtoNSgrmcAh700QvOz2k1ANInnh95LHXIZqOCJ_V89
Отпугиватель насекомых и грызунов.,404 ₽,3 отзыва,"8 мая доставит Ozon, продавец ИП Кочетыгов",https://www.ozon.ru/product/otpugivatel-nasekomyh-i-gryzunov-441251067/?asb=lgj5YkmR592QOLKzVzORBxWHlkkb2c585JoIyn1QnCc%253D&asb2=YnxbxTgFOQFdbn4Lz8rH7ivPKNL_8cCxKZR_vugXhlxdMgNqTGEmA07RyK4yEYHx
Ультразвуковой отпугиватель грызунов,449 ₽,1 отзыв,"8 мая доставит Ozon, продавец Home-mark.et",https://www.ozon.ru/product/ultrazvukovoy-otpugivatel-gryzunov-459849301/?asb=KpnNaPPyBnuf6y%252BYeFoVaYe%252BU%252FmWfSxGvpQ7BHzkIMM%253D&asb2=tNfclGW-CPczePCdDGjLCOiJ_3ze-NU6FpvedzVZVjhOPTxGla4tzgDAle1MMp3l
"Средство от улиток и слизняков Хищник Green Belt, 50 г - 2 шт",358 ₽,2 отзыва,"8 мая доставит Ozon, продавец Y-Shop",https://www.ozon.ru/product/sredstvo-ot-ulitok-i-sliznyakov-hishchnik-green-belt-50-g-2-sht-479450928/?asb=jKANK1CMfuhwkDueireAzPuBvdXx68g6vzn%252FNILud70%253D&asb2=6RfAIReBSbLSLuk6GcydAYgYzPxMHe5Ale8tZofGXzK60Mum1FUjdeBCCgJD72Mv
"Средство от болезней растений Протон Экстра, 20 г, комплект 3 шт",335 ₽,2 отзыва,"10 мая доставит Ozon, продавец EURODEZ.RU - средства от вредителей",https://www.ozon.ru/product/sredstvo-ot-bolezney-rasteniy-proton-ekstra-20-g-komplekt-3-sht-515237248/?asb=0ln4Ov3cU4Acebm3Hzfi2Ai33X9rCHJrHL%252Foh4B%252FuAg%253D&asb2=abr8mWYEhjHUjk4R6rV4veXNou_7wzJLBukL9_sz78ojC5Nwm8YN8jrj62oG1SN6
Отпугиватель птиц. Виниловый 3D-шар с глазами хищника отпугивающий птиц,950 ₽,1 отзыв,"8 мая доставит Ozon, продавец Ros36",https://www.ozon.ru/product/otpugivatel-ptits-vinilovyy-3d-shar-s-glazami-hishchnika-otpugivayushchiy-ptits-272691954/?asb=nTu%252FyCxg6b9zp1tl1SgibNKLwYlGrVM8E6mdjPv1gxyPNWFhC4zimUgqG0GmkK7d&asb2=jOXlb_nKUsDNn5VDccxAB8zdmRb-GiUK1oXODHjQjx-vnMghu6PLR0uIPthazVgEeOKlIfmJFJfBYk8KwJTrdRkXpiZCe_uILIE3zBYqZtFtdvQZcKuQLR7wfLtTmvy2HI9NA3LA_jMF9F_g-XVTew
БИОГРЯДКА отпугиватель кротов 100 грамм набор из двух упаковок,531 ₽,1 отзыв,"10 мая доставит Ozon, продавец EURODEZ.RU - средства от вредителей",https://www.ozon.ru/product/biogryadka-otpugivatel-krotov-100-gramm-nabor-iz-dvuh-upakovok-229404811/?asb=TEVCBRVUxfA4oSvAnURZ4pRmPGC3E524lWqI%252FcUHA8XYrhpLbcWeRS3pUSjV3kLW&asb2=jQ9eLMiPZ3g4MgP3miGr80zGBpFr0wldyz4fEEOPp4Sp4paz00VQciBS4u4qoAAuTiTBmLCuEFFrheX__U19_cYpwYYIAKnipigpZiH_8EVUFoXwmJGtm7UZAthg-T0kAoRL7l2AmaY4ga2ur5yICA
