Отпугиватель грызунов ультразвуковой / Средство от мышей / Отпугиватель от комаров ультразвуковой / Отпугиватель насекомых ультразвуковой / Ультразвуковой отпугиватель от тараканов и грызунов / Ультразвуковой отпугиватель от крыс и мышей / I.G.Store,349 ₽,60 отзывов,"Завтра доставит Ozon, продавец Твое",https://www.ozon.ru/product/otpugivatel-gryzunov-ultrazvukovoy-sredstvo-ot-myshey-otpugivatel-ot-komarov-ultrazvukovoy-525556652/?advert=RgSSL43TMGdWH0zJRl71NY25Sr5f7GJLJ9dBnYjaOkoLoN16vRbjXctL3dMSRuMxdgX6T4a-Zlj5d5Kr-7krR9hl4VkBBXC2ZFmpibgEqii0jk2c9i2VfwA73ykAxPQb2LBEClG0I4QHddOHt3iTkVA4HzVhCxU0aqd8qPC8cf3cufWt5lbranZPZJzOxJaEQzOYaJB4a9-frApuiYRCdRU71f5CFhEK4UDI6417ADV3yp4kgiuAjKWll1Y3C7N4WTjvREbgImuCLps-iX5F0tTqNWJMtcylhbSf56D6M5Sd51hnP5jfdml2fC8tJxHDGRlYCMCb3VP5LN18fqNIlHbcgv7K8_jHPhZo2Q_9yygs8hL4tW1hntCCZ_S8g2BChyj-s3G5TMSfKFA-r9f1imtqWifX-b4BCVuffs53BRj3ox8v7kJ0ro2m_-O4p9bpHdAD9r_47tOyGXu0wWP0m0jsaWl_co8b5dfe1IjYVre-xYL1V8Jt0aukqcy5DgnCzb8eHVfDgeLB-YD0x0kMa4VeNk1Kqb7oQk_a23F-BbIRYROoymHnSyZ9pnwWXoht
Ультразвуковой отпугиватель насекомых и грызунов Pest Repeller Aid / Средство от комаров мышей и крыс / Средства от комаров тараканов в розетку / Ультразвуковая защита от комаров мух / Отпугиватель грызунов и насекомых ультразвуковой / От тараканов и крыс,429 ₽,92 отзыва,"Завтра доставит Ozon, продавец Надежный продавец",https://www.ozon.ru/product/ultrazvukovoy-otpugivatel-nasekomyh-i-gryzunov-pest-repeller-aid-sredstvo-ot-komarov-myshey-i-krys-324054086/?asb=meZNIbzmYQUaP%252FT8ADdVPU5iS2ocj1u%252B0qSn2HizsIsbFdj%252FJGKYl5DiyeCAb6t2&asb2=1Uv09gj5mhwNI_Mr2p6tnDkd7FtLwYnMFaO79C5carZGhAqlVf3EaziYWyK7Zyaj7cn0WusdLsLWhFOjDXny6zIDWVvSVoHzb_HUuauEaDMHbRiVsCTNg7ZAcAnctd5azY4WfCr_Wv22vzQdfVZNPQ
"Устройство для отпугивания кротов и змей,UNIEL,UDR-S20 SOL BLACK, на солнечной батарее.",566 ₽,43 отзыва,"Завтра доставит Ozon, продавец Союз Света",https://www.ozon.ru/product/ustroystvo-dlya-otpugivaniya-krotov-i-zmey-uniel-udr-s20-sol-black-na-solnechnoy-bataree-235227276/?asb=gT958oUllf9CITitTU2z0jj5hZ3uXCBWo0sHiLfzRtN%252Fvx8LpG3xT558aM7z3ag7&asb2=1IRD7MLOKlKaPp8wfSZYwtBnfbdNyHQXn0XRulQfok_iT7aJqiWa931FgWeebHz4jST5sotoetAA0xBwXetMYDw90fyMgcfG9iWtv2R2pSxECUx25qRxaCGF0mo5v4BB91ZN4I1EjxKDZvbt6TBzrA
Ультразвуковой отпугиватель насекомых и грызунов/От тараканов/От мышей/От крыс/От насекомых/Отпугиватель мышей/Отпугиватель грызунов/Отпугиватель тараканов/Средство от тараканов/Отпугиватель насекомых ультразвуковой/Ультразвуковой отпугиватель тараканов,369 ₽,19 отзывов,"Завтра доставит Ozon, продавец I Like Shop",https://www.ozon.ru/product/ultrazvukovoy-otpugivatel-nasekomyh-i-gryzunov-ot-tarakanov-ot-myshey-ot-krys-ot-534450360/?asb=3PWn4SLJgJektqqi%252FE7kgyub4%252BsdJ6D7BJSYHBFtJ0CEZOppLxtFU3zGUHjykw4Z&asb2=iIDPeGmJLOZM8FAkPGVx4ybSf9N_LnovqfXpCZqTXSSyoEZrBAkZyUoBpnXJN8zaL-MUsg6SBGCZOH9TavatnDGVXiywv9iS43veCKt8pG5TZ1-n6NY-Qci-M82UINJnQnBTPv38iUl38MF8hdfAqQ
Ультразвуковой отпугиватель насекомых и грызунов Pest Reject / Средство от грызунов и насекомых / От грызунов / От мышей / От тараканов / От крыс / Отпугиватель грызунов,340 ₽,104 отзыва,"Завтра доставит Ozon, продавец Best Store",https://www.ozon.ru/product/ultrazvukovoy-otpugivatel-nasekomyh-i-gryzunov-pest-reject-sredstvo-ot-gryzunov-i-nasekomyh-496627625/?asb=OwrtQsa1ZI%252FwU1NcxAS0uXl2ffb7G0bGsM0I2Jr3by3xEPk%252F%252FdtYs1al15kWr0pJ&asb2=s7EijeqcdVr6cwFRfy1J79QxH3Z2RZ_tBrPu5eOjaZCgC8h1NXMIe3W37HB6Po73x8H4_wbMPOfKZeiHTa3OHvWa6ABHj_ccIsCVicqskjWFIxmsWQThm4PlhD7T0SGB-Ga5GHREhnTeJF5SzbZPaA
Фас серная шашка Универсальная 300г,180 ₽,94 отзыва,"Завтра доставит Ozon, продавец Город Животных",https://www.ozon.ru/product/fas-sernaya-shashka-universalnaya-300g-277447504/?advert=P3auKZdEUQeBQjLaZ68WNLO-iwbn7htxuhZyBxJrsdrtxA9V-gX4Zne-lKJJqkATRA_bmOKSG7gFavd_GgpO86ZlVimwZJKrxUuxtbfz9b8Ttvt3EExeqxKDmEun4mBhV1tG9yrSA0ZwCS_EWXLC9Z5gv8sFuD2sOyiuqCfDJb0Qby9wCc0x117hZHWFuRJ5uCnMHkYoObpJFcThX8pL5VGEUlQZ-vu_xGyRaKxUKNq2V9CCTMBBN0VjeJyLz8_QAQzv6-mk-QW6FDbgHWbDERmjTCxRp3mVyMgM4D6wI9SoVbO0nP30A-0rhsnanpH511Dt2nrsUjikR9ji3N6QscAH3AWGuiord71DIgJ9YwnTXoJWjlkp4xHndLmh2lCg4_ShhHFwNQirMFhYxJSXNZPV8Wzh7LhoczpuKLUuQvT_AYWYypwIjBQ64zvJarK-3qKp3O3Yyjor-UPSNKrRe0J2PDoq1AiqBYbAHRcl3VZ5HLusP6iXRbrkKd1BekBg9wRQ8jDCJ7C2aLz8a_HAvEDqaVPLKfS1a22H8Pg7CYE0Sjo4i3TQOIO64uAqPb9p
Отпугиватель собак ультразвуковой с фонарем,636 ₽,89 отзывов,"Завтра доставит Ozon, продавец ИП Тимохов А.Г.",https://www.ozon.ru/product/otpugivatel-sobak-ultrazvukovoy-s-fonarem-284593387/?asb=Gko4l3aD09ualyPpDai62%252B7WOjnIDPGv14IcbCHRMSIrxKacRCAx1gdS6EQblgkB&asb2=-0J8UHtgoN3xYgBhRbf9ktOElQN8G6zGZg80CiqZdGMc0fTteaqjBNn_bl7izyavJ1MaMVdyXtcxBZYTwitEOgfqRTo0x8b0pcSBUb-dbYTdgTxPAxLshBioG_UPKf_oqpeb-qVeJ6cY3I3tWiGN0A
Ловушка для насекомых/ Ловушка клеевая (10 шт в упаковке)/ Ловушка клеевая желтая от насекомых для комнатных цветов/Ловушка для мух/ Ловушка для насекомых купить/ Ловушка для мух купить/ Ловушка для уничтожения насекомых/ Ловушки для насекомых комаров,220 ₽,2 отзыва,"Завтра доставит Ozon, продавец VMK-VSS",https://www.ozon.ru/product/lovushka-dlya-nasekomyh-lovushka-kleevaya-10-sht-v-upakovke-lovushka-kleevaya-zheltaya-ot-nasekomyh-533604245/?asb=MI3UgikT1YanqubZ0Vg%252FqTJdhl%252FYaUMnvuJ%252B1EWLOJs%253D&asb2=Rv0z_cu74dJIMfVSIis3X8ZMjjlzLFtou2Gtjf_MPQM3ByX7RIp06tsgt1A5OOsn
Отпугиватель собак 928 TYPE 21-7,769 ₽,7 отзывов,"9 мая доставит Ozon, продавец Sibir",https://www.ozon.ru/product/otpugivatel-sobak-928-type-21-7-536420119/?asb=kArDNr2AXecjOvaZOAlYx1s5qP3FF8w7OQoaC5OQLxo%253D&asb2=6VVpYpbUhewhZdOP2pJfpjCnyB7o0PvwmF6gKhhNuPJht-0OmGeL6L0pIE5VilX3
"Отпугиватель кротов BROS ""Sonic"", электронный, ультразвуковой",509 ₽,35 отзывов,"Завтра доставит Ozon, продавец АРКС",https://www.ozon.ru/product/otpugivatel-krotov-bros-sonic-elektronnyy-ultrazvukovoy-172166932/?asb=Y5AGjw8LdNWC9YU75WAN3PxdMIbdaZtWAlseCRbiwnU%253D&asb2=_rcqcHM1nqBJnNkbypwJeK61FbrO_KyBPIKWqrwGjDLSqOaM3d4uzX7bF26lB1tU
Фас серная шашка Профилактическая 300г - 16 таблеток,153 ₽,61 отзыв,"Завтра доставит Ozon, продавец Город Животных",https://www.ozon.ru/product/fas-sernaya-shashka-profilakticheskaya-300g-16-tabletok-277447210/?advert=vkwyStx3pXiOX-A0MN-wUGNeLyp3etq8A40xNyZbSsPrxJEeZg-xYKppvjTd8nZRLN3U3mFDwFRZZ3wwUIOQRP6OUqo-jUSiddIpbOYoBvrTBoXq3s3t5eP_CV6IBX4QSylbOWeG7T5LUvY1gR-dlyQU6h9dK93bcnTAPdATTQY_Iq5BDeAr9mTTqfU2nqwdLpx9IDFkjeo1BTxC7lgBcW-meTFXJ3meKBTkg6wysF3h5k4e-Mch0uAobxjz-Izt3lhnzlLJfhmpWP2O4P3OVA-cfUdw5WHeDMHsd5Xw-_Xw022XMj1e8Yv_Ev3bF1Q7QoKih3mSeKzfVZRcqF4Tj0i0qEC4Z5R9JgBUk-_hAD0s_9ZvN1imkKch5yvuy_lLjk5Sg202fZ3mWG3UTKFyVAA3sKUK311yTXc4727FvPbpleyXztuFcL6hG31RJ2SCu26FUK3vZwkcVbRw2JxFefyySTTkLZ6suEUys3bCOZSddHW32kt02eYWXj7ZUzLXqItV4nl5HsOMP0yQ9-k1yAjSkRkRjbycQ4TefLGr_Upgj9oQpB1o8yLpKXLKAUq_
Комплект от комаров ДЕТСКИЙ 60 ночей.(Электрофумигатор комбинированный + жидкость - флакон 40 мл.),191 ₽,2 отзыва,"Завтра доставит Ozon, продавец ООО ""АДИС-777""",https://www.ozon.ru/product/komplekt-ot-komarov-detskiy-60-nochey-elektrofumigator-kombinirovannyy-zhidkost-flakon-40-ml-511599346/?asb=gSnN4dS3saio95QgKFZHLmBCraBy6n4gwOCxanjjq3o%253D&asb2=ka9BN-TX3dItZA5wRVyts6p5kJLNaXhCh8FV4fuIamxzht-0HhttX_Csbf3nS4Lj
Отпугиватель грызунов и тараканов ультразвуковой Pest Repeller Aid / Отпугиватель ультразвуковой грызунов и насекомых,477 ₽,77 отзывов,"Завтра доставит Ozon, продавец Повседневные товары",https://www.ozon.ru/product/otpugivatel-gryzunov-i-tarakanov-ultrazvukovoy-pest-repeller-aid-otpugivatel-ultrazvukovoy-gryzunov-444962756/?asb=Picuiu6SOhYN7JJdbH0kJnTLMza437xqXJ%252BqFx2xECDmAdNVztah0MVina7PYbol&asb2=ZvOLzPFxXintGxL4iHQOZcGcWtkvZb3Mq8JzJpJmITm0e6dUjvSC6nCNoUfOyziqyCrF5VnLXrmDg7rEBfeLgnrjSjNmFxRkb0NFBRrZlaoEcohGoI57H-t7D67JZTao
Пластины от комаров Gardex Naturin 50 шт (5 пластин по 10шт),228 ₽,3 отзыва,"Завтра доставит Ozon, продавец Рускинг",https://www.ozon.ru/product/plastiny-ot-komarov-gardex-naturin-50-sht-5-plastin-po-10sht-535968969/?asb=x3Qdq4Fv3rR40NqiqxgKQVdlK%252Flxp10aGek3oBCxTts%253D&asb2=Bv3F-QfJgR95zfyGzJ8oubmrQ3Bjscz8DMluMtxmAcXLhEZIBQe-MLnunuPq08P7
"Отпугиватель птиц HELP лента, 2,54х5000 см (80420)",659 ₽,1 отзыв,"7 мая доставит Ozon, продавец Ю-март",https://www.ozon.ru/product/otpugivatel-ptits-help-lenta-2-54h5000-sm-80420-507584040/?asb=SB72wrq5thIwQDfJY%252BYVKaEi4lj3g6mfhfhK1qQptxU%253D&asb2=9osccSkybqyou25ypNW-QI_VX9v7tC4R7LBTBly2Hs0Fw3xTZf8rqDslhibJKhFF
"Nadzor Концентрат универсальный от всех видов насекомых (клещей, комаров, клопов, тараканов, муравьев) 200 мл",877 ₽,1 отзыв,"8 мая доставит Ozon, продавец ИП Хайруллин",https://www.ozon.ru/product/nadzor-kontsentrat-universalnyy-ot-vseh-vidov-nasekomyh-kleshchey-komarov-klopov-tarakanov-muravev-562607756/?advert=w6Yp2d2yI_1kqlYCBIyaapGhFnUcCySfZRCgefGmXhnSSgekFiQMARW9QwM2aJSeFuUGdR9AX6SmhmzZv2muLoV-qOPwpi7zWaqfCKbyWMP9Kfxo8iVBLb89xAp5v_qMUwNIPxhg_9htzpyyDIpCXKyGB_9UrLq8FFmdW8IU5IkE2eHwnUDvGzUetK9aC9eVUACReFGX0MQA5LDXsv-S26Vmy-rn4TZh_clfZdOpTho6_7r19gtK5yLFxcjHCwW5aYZqenmX78RnZRzxfqOiJTfLs-MRmi7hJ9WGpdKI_vj-AWd-kCQ7Bomm6WrjB5FSHuuSurbCSoFn5Eypbg1mS35rX3O82MP3tYziYIdc_hs8VhC6r-P6mzES1F0uYa7OCK0iys4qyBjcKYnIAM2HesKofIdQq5nq3mTovA5BEoyLKtUw5RfOA8ETTbAM5sXBV_0vvOIteDOTSk5Pkw4wVCgXIlsrqaD3xQJYBZyCTPvdUuiaBwctk5KGK0tTnW5o6zCD3j0qYeHiRzi7iMK55Xnz4hcKpZc93axurNRRekyEJSHRneC6lx_0EQ2E38bf
"Средство от насекомых Искра БИО, 10 мл",250 ₽,8 отзывов,"Завтра доставит Ozon, продавец Чистый Мир",https://www.ozon.ru/product/sredstvo-ot-nasekomyh-iskra-bio-10-ml-292169627/?asb=dzByYH9az91UHPOXKDs3maaTf4cMtAB4n2x5PEqXaxI%253D&asb2=V8yWRw0UYCu6yH_v_Tao_ANfK-rLoYzIdHVkcgnngiiZN93gfSKGAN-_deeRWcLo
Отпугиватель кротов и грызунов Космос KOC_KR102 на солнечной батарее (ультразвук),779 ₽,111 отзывов,"Завтра доставит Ozon, продавец ООО ""Меркурий трейдинг""",https://www.ozon.ru/product/otpugivatel-krotov-i-gryzunov-kosmos-koc-kr102-na-solnechnoy-bataree-ultrazvuk-260801560/?asb=xt105e7Qk2M26PCHW%252FrTvV%252FEBDDy0kZDQHoIxlQpEsE%253D&asb2=HN1PNWdGd2QjJTScGQGQvwe4Ikj5GAo8I5DO2QNLrOv2zG8Gks6He7hC3cTh3-LO
Ультразвуковой отпугиватель тараканов (зона покрытия 30 м2),369 ₽,146 отзывов,"Завтра доставит Ozon, продавец Официальный магазин СДС",https://www.ozon.ru/product/ultrazvukovoy-otpugivatel-tarakanov-rexant-175587291/?asb=QVT1DCa5RBZbjLzC2L6Pkk3W2wrBQmii2XEEThKHGk0%253D&asb2=6cIJMTKD4vdDick6_gWMYB5aNqmsDWdaC51BrLkQrxRKrJyG_4kompPvA68clKfc
"Отпугиватель тараканов, грызунов и насекомых ультразвуковой, от грызунов, от крыс, ультразвук от тараканов, отпугиватель от грызунов, ультразвуковой отпугиватель",450 ₽,3 отзыва,"Завтра доставит Ozon, продавец ООО ""ШОППИНГ""",https://www.ozon.ru/product/otpugivatel-tarakanov-gryzunov-i-nasekomyh-ultrazvukovoy-ot-gryzunov-ot-krys-ultrazvuk-ot-461379435/?asb=FxoAQG05p%252FEchloK0QQVnLqyeoal23crQf7gxk3e%252FyPomEHQ720jwVtiexWCgDER&asb2=F9v0SwTIsOMi4EQ03MQoiljYwoKAe4VVEYrmX9tbDZnEH461qYTz6KyEvzlWFXaDbm0Uj6MjNaDwCZdZjyiGgKC9hw5rQWMh_O9Fb_M-kY8OFdsWLNLbFjDo9J7DfZjQ
Ультразвуковой отпугиватель от собак/Ручной отпугиватель от собак,598 ₽,11 отзывов,"Завтра доставит Ozon, продавец ООО ""ОРИОН""",https://www.ozon.ru/product/ultrazvukovoy-otpugivatel-ot-sobak-ruchnoy-otpugivatel-ot-sobak-512091796/?asb=waNVS697S%252BDDBAx%252BnDA4pBIjcRQU0EpZU49i7Ytr3Ws%253D&asb2=hd_fpDUJsXFCtO8FdVF2hgLCwUYZHAdV9yW1X_qLN5KAFc55g0dA22rz3NWdsWJx
Средство от змей Змеед ЭКО 50 шт.,460 ₽,9 отзывов,"8 мая доставит Ozon, продавец MY HOUSE 1",https://www.ozon.ru/product/sredstvo-ot-zmey-zmeed-eko-50-sht-283803150/?asb=YIY%252F0PjW3hpJ2QdVGzszj7A9K9ZiK0h%252Bk37%252Frv1M%252Bfs%253D&asb2=1zdidbmf-f_T0VqVLKNWhnJhbuNozTvmOs7K17nOCyqILOsST8fBo6MQRF-_dWKH
"ISOTRONIC Solar Diamond Ультразвуковой вибрационный отпугиватель на солнечных батареях против кротов, мышей, змей и муравьев, на 1000 кв.м.",981 ₽,4 отзыва,"Завтра доставит Ozon, продавец ГЛОБАЛ",https://www.ozon.ru/product/isotronic-solar-diamond-ultrazvukovoy-vibratsionnyy-otpugivatel-na-solnechnyh-batareyah-155545995/?asb=dfLbJW%252B1ZUvcvBqbmdx%252FtfPomrk7EYDdhDn3z2%252Bd9%252B7cHt2%252F8697akaNRN%252BNIHKV&asb2=OWe9-jmYmXF3PbAuS2P29hK2rkgKM_waSAuIv28WzWxAl28A38_FgZahXnzc9M_3Ndi6i86lAD28GN25Q2tnB2nNs1_v761rKtqHonsMRPOHyz6cbagzj3UzIXxg0V4VA4eN-Elkg-_mawHyUsD7cg
"Средство от слизней и улиток Аксела Рубит, 210г",348 ₽,1 отзыв,"11 мая доставит Ozon, продавец ТОРГОВАЯ ФЕДЕРАЦИЯ",https://www.ozon.ru/product/sredstvo-ot-slizney-i-ulitok-aksela-rubit-210g-549004507/?asb=BLoglSj8LH7LoE%252Bfxq6VXNGfU%252Fwyeed%252BHTJCAmg2dNNA1Tbxb7pikVgxC4nzr32A&asb2=-FK0UgFq2AhIY4KYzGjWiBxAPGpPb5B_w_BKzwCyoSY7cByS7MsODnCYgcS8Az3W5JWbIxECCVj5o6bjwQ6Fiq3zFjCvvf8Ty3ilHk56vDiW_CMwB1QS0DG8My5Y135RXDfUox5xEdh8UfewdWj1Pw
"Профилактин ""Avgust"" от комплекса вредителей 500мл",663 ₽,18 отзывов,"7 мая доставит Ozon, продавец Семь Семян",https://www.ozon.ru/product/profilaktin-avgust-ot-kompleksa-vrediteley-500ml-262785090/?asb=hztjiCA7LKbjpIqH%252BV2xMaRzLEkhIq26fMPfl9qiVmg%253D&asb2=MxdxYIUwvllfjDs8lJ5-DayqKKDotW_MQqgOWCwPn_WFVcr9_4tYOG2wBzOXuclU
"От комаров/ Ультразвуковой отпугиватель насекомых (и от комаров) и грызунов/ Отпугиватель комаров 220В/ отпугиватель насекомых ультразвук/ отпугиватель грызунов, кротов в розетку/ отпугиватель комаров ультразвуковой 80 м2, 5 Вт",570 ₽,13 отзывов,"8 мая доставит Ozon, продавец Home Сomfort",https://www.ozon.ru/product/ot-komarov-ultrazvukovoy-otpugivatel-nasekomyh-i-ot-komarov-i-gryzunov-otpugivatel-komarov-280239493/?asb=4qTcXQQFjR2L6Tye0WOirGBKt%252FW9NBC89HjNh8sBRP8%253D&asb2=UtI9WqE3fSS742Sb6oLz2nKzCtp_AC3Oy2SztaSBS4x70tk7AGiQSidAew8zUCmF
Средство от змей Змеед ЭКО 50 шт. Набор 2 штуки,919 ₽,10 отзывов,"8 мая доставит Ozon, продавец MY HOUSE 1",https://www.ozon.ru/product/sredstvo-ot-zmey-zmeed-eko-50-sht-nabor-2-shtuki-298286802/?asb=n1n2fxdX2JxePErriIHGdcZaKXzwm5%252BzT%252FO82eRyJgA%253D&asb2=lRkVhNy7JWBEFFlRL8FlItPq3_iBjbk-OpNI60C-hah5P64XSFnbJQoiGWInDUM3
Отпугиватель собак КОБРА ультразвуковой / отпугиватель животных/ ультрозвуковой отпугиватель для собак / отпугиватель от собак звуковой,949 ₽,9 отзывов,"9 мая доставит Ozon, продавец ИНТЕРНЕТ-СКЛАД",https://www.ozon.ru/product/otpugivatel-sobak-kobra-ultrazvukovoy-otpugivatel-zhivotnyh-ultrozvukovoy-otpugivatel-dlya-sobak-501208097/?asb=KoCm0639kpPnh4PsvBIKLmN3Fo1GMuB38Ecv8Lci%252BEM%253D&asb2=pJnSUBGLlorApE8QrBOj_fSHfT68RTOBjgZE_1Q3VKEbsCQ2iDGQdfIHmkZkU-EH
"Ультразвуковой отпугиватель насекомых и грызунов, UNIEL, UDR-E11 WHITE.",439 ₽,45 отзывов,"Завтра доставит Ozon, продавец Союз Света",https://www.ozon.ru/product/235325581/?asb=kcVtooBkW09Ch5s2sTymYQC0tYEdF3Vm2aph1ZrX9ms%253D&asb2=EQzb4EBn2VeIm2k3jnFY-JQfgsJ2vZUfQIvLRBKu13FrV9EXiRjTUR-DaYPWQR5X
"От садовых вредителей Актеллик 2мл, Децис 2мл по 5 шт.",840 ₽,6 отзывов,"8 мая доставит Ozon, продавец ИМ Белая аллея",https://www.ozon.ru/product/ot-sadovyh-vrediteley-aktellik-2ml-detsis-2ml-po-5-sht-432561153/?asb=AgVS9rdkY2chRoNGvJwAnJ87MUxgHjM5y6RFLO5SU2w%253D&asb2=9Y2KTLkzxY_uDQCUoeT0ydNPlP1tsIc7B10y5ylj4o3ILQObQyOEJ4am3TkC35u1
Ультразвуковой отпугиватель от грызунов и насекомых,496 ₽,10 отзывов,"Завтра доставит Ozon, продавец Good thing",https://www.ozon.ru/product/ultrazvukovoy-otpugivatel-ot-gryzunov-i-nasekomyh-416604614/?asb=PnBCLxCcFbHkkrjdvpLLNSgQJaB9TyfCd%252BZq8JjFMqKhZNfMsHMtUZoTwysJcgWU&asb2=UPSIgHEpCM4X9pkIo0Ch1m6aolv09JncXDhC0fm-B1zhDFl0gMY20a88z96JnC0ozHCib9AMjZIuq5iNgWrfaDJy9XX88-AMToJO1SwXNQ7SbbuaDIqUivdLCqhNBLs1tBvCD19lgvzBhICmQtQzmA
Спрей PYRBIO Expert Натуральный от насекомых-вредителей и паразитов 500 мл,950 ₽,13 отзывов,"7 мая доставит Ozon, продавец Vikimarket24",https://www.ozon.ru/product/sprey-pyrbio-expert-naturalnyy-ot-nasekomyh-vrediteley-i-parazitov-500-ml-268829571/?asb=zMp7g4n%252FfjglqO%252BwoyToZNB35m%252FRx7RrZbarwsGk030%253D&asb2=SDXbk5PWgwFJ88wpYymYwjzj7svCD54X_ckFYelPGzy600XvBQOSzmrJUCoEl4Kh
Ультразвуковой отпугиватель насекомых и грызунов,338 ₽,92 отзыва,"7 мая доставит Ozon, продавец Дог 60",https://www.ozon.ru/product/ultrazvukovoy-otpugivatel-nasekomyh-i-gryzunov-235770588/?asb=XELzoFYH1dXkNuuIJKhs4%252Ffd6knSZSKz%252BKtULBmy7Ys%253D&asb2=HRJH0ut6m0OjWOem1JDoEoV7hQl_MQKftqJhNXp0tiOMVf14IdztXNUDtpvHCM5u
PyrBio от насекомых-вредителей и паразитов 5мл,338 ₽,15 отзывов,"7 мая доставит Ozon, продавец Семь Семян",https://www.ozon.ru/product/pyrbio-ot-nasekomyh-vrediteley-i-parazitov-5ml-262786209/?asb=W01pRb7pH20QBSetVJlQMnbH0iYCC%252BcqhQ6zu2Di%252Bf0%253D&asb2=L3pJaoasvdXAT9qqBRe1-_Ge8P6mT-vcC56SYiOPe2FpWDFF8469NMqnPhokDaU7
Ультразвуковой тренер собак с лазерной указкой /дрессировка/антилай/ отпугиватель/ контроль NewClassic DG-07 (черный),815 ₽,19 отзывов,"7 мая доставит Ozon, продавец Армасток",https://www.ozon.ru/product/ultrazvukovoy-trener-sobak-s-lazernoy-ukazkoy-dressirovka-antilay-otpugivatel-kontrol-newclassic-dg-400543280/?asb=Aq1i7MU%252BXh13DiQ0wiEtonx2SfnAIgo%252FVUjAih8Enl8%253D&asb2=fg1SCcZn-8lC57aINb_tR4rNvLeHCgu2gCL16QHYJUbX-kT7rb5UcLxgUTUauirM
Средство от змей Змеед ЭКО 50 шт.,659 ₽,20 отзывов,"8 мая доставит Ozon, продавец Эксперты Чистоты",https://www.ozon.ru/product/sredstvo-ot-zmey-zmeed-eko-50-sht-240524689/?asb=6vmLOz4Drx4u9I5FQvMzS%252FSMSgXTUmndWS8kDRVspZ8%253D&asb2=d_jIddj70PoTmONsj-z9iN2SE36RUXoQU1A1jf8ObaPHpmFRDSohOyJ-mDhPsMws
"Ультразвуковой отпугиватель насекомых, комаров, мух, тараканов, крыс, мышей и грызунов в розетку 220вт, радиус 120 м2, мощность 5,5 Вт, бесшумный и безвредный для людей и животных",625 ₽,13 отзывов,"8 мая доставит Ozon, продавец Home Сomfort",https://www.ozon.ru/product/ultrazvukovoy-otpugivatel-nasekomyh-komarov-muh-tarakanov-krys-myshey-i-gryzunov-v-rozetku-220vt-280214966/?asb=1Fxf4IhBYbp3VKcuhOyL%252BIkw6yr05mvSfbNjCHKYphA%253D&asb2=ofG8Zry7PE2MfYnCYX3LTdjhjj9G4vb5QdnCwLBZT7HFRHRLedBbEgkklLLS05Qy
Отпугиватель животных жгучий перчик 25мл,899 ₽,4 отзыва,"8 мая доставит Ozon, продавец Animal World",https://www.ozon.ru/product/otpugivatel-zhivotnyh-zhguchiy-perchik-25ml-373763319/?asb=tALKypG8K5ed%252FwBvH92TnyYKdeB6RSA86CUDSLT4jWA%253D&asb2=aoLDyzrgRtKYwBcdECqiiVMaZ5oFmp9FeAe4Sfs0hGM194tgU7k1raHBRhyzQGjr
"Отравные крошки от тараканов и муравьев ""Сгинь № 59"", 50 г",110 ₽,14 отзывов,"Послезавтра доставит Ozon, продавец ЗОНДЕР от клопов",https://www.ozon.ru/product/otravnye-kroshki-ot-tarakanov-i-muravev-sgin-59-50-g-302053087/?asb=cfKtXu1WkC96pMHoMmH%252B67ryoCMskm5Rvm2jLDeACek%253D&asb2=ZAIIBjly1RiKv93zzdn7ZLrCG_NdHuO3lYj0Xnz-eKJV40cqZfeUC4QTp_41M4y0
"Побелка садовая AVGUST 500г, для обработки деревьев от вредителей, от болезней, от солнечных ожогов, для побелки деревьев, белила, для садовых деревьев, для саженцев, для черенков, посадка плодовых деревьев, защита от насекомых и личинок",239 ₽,2 отзыва,"10 мая доставит Ozon, продавец ПромТоргАльянс",https://www.ozon.ru/product/pobelka-sadovaya-avgust-500g-dlya-obrabotki-derevev-ot-vrediteley-ot-bolezney-ot-solnechnyh-499558799/?asb=dCRZzAe%252FVsQ1k3ZGIC1WHQWuGg1li0oCVzSzFTWSGNM%253D&asb2=GbKaPr2P8oWiD7KTklngYXBiQzmsA0lvjVrwBMAs_pssx-vc5PTZhk7W__b-5BHe
"Средство для защиты садовых растений от вредителей Биокилл, 24 мл",210 ₽,2 отзыва,"10 мая доставит Ozon, продавец EURODEZ.RU - средства от вредителей",https://www.ozon.ru/product/sredstvo-dlya-zashchity-sadovyh-rasteniy-ot-vrediteley-biokill-24-ml-515237207/?asb=c26ijcnL%252Ffw4F5nPrfUsEJC%252BGtGkxzR%252FNjU4wuERL1M%253D&asb2=lVXyISuiA8zEfjNKjgdysnzG7FWTChzxNxA9GTe9kB7YGJ-ngvi8Gr0hthNpkSIG
Отпугиватель кротов АнтиКрот - Макси БИОС,656 ₽,8 отзывов,"7 мая доставит Ozon, продавец Розовый слон",https://www.ozon.ru/product/otpugivatel-krotov-antikrot-maksi-bios-243281035/?asb=ou%252F0AvDgFOfetCF0rq4esDo0IQqe8p6ndVjN8oQeZVfs16OnCw%252B4tURyApejH%252F8M&asb2=gOIdfHW311fcfH-K7Rtqnx9JeXxABXzjVN3oVtBPN1LMHbA2-NmXiTl7K1SrkCQ03X094d1oWdmd0MIM3z7lizvi_pX7vaSM-o5E7DQqtt8tY0cqpbPwNfZGFxVpWs3W5itPdUeRkwsjSYBGfNx9dQ
"Отпугиватель кротов BROS ""Sonic Solarny"", электронный, ультразвуковой, на солнечной батарее",934 ₽,34 отзыва,"Завтра доставит Ozon, продавец АРКС",https://www.ozon.ru/product/otpugivatel-krotov-bros-sonic-solarny-elektronnyy-ultrazvukovoy-na-solnechnoy-bataree-172092276/?asb=e9X136UZ%252F2gCpR1rsnoJmNCVK7NGiTi8pAxyC4GgTM0%253D&asb2=yzC8fa2uFXQMPtdbfP8KDDmigGU6xTH7V9Ot1RYlZxjsEHkulxdSxf3IhpAz77gC
"Гранулы от медведки и проволочника Рубит ""Рофатокс"", 3 кг",769 ₽,11 отзывов,"9 мая доставит Ozon, продавец home",https://www.ozon.ru/product/granuly-ot-medvedki-i-provolochnika-rubit-rofatoks-3-kg-306863710/?asb=ZxpunvJhnGi8Tko7%252FWgCurLpzzAienB2Zy6VYy6GEs8%253D&asb2=AV1xeRBuxwOTBmPYg1wqSc63knVIKtt8fhIpwcCA01DzPZD2Dwvs5a4xzdf_JEMV
Отпугиватель птиц и других мелких животных REXANT на солнечной батарее с яркой бабочкой,510 ₽,7 отзывов,"7 мая доставит Ozon, продавец Официальный магазин СДС",https://www.ozon.ru/product/otpugivatel-ptits-i-drugih-melkih-zhivotnyh-rexant-na-solnechnoy-bataree-s-yarkoy-babochkoy-295501547/?asb=fStLUHzyV%252Bwj1IVOFF01D3OWjxZxIScnwmljKSQbJ%252FE%253D&asb2=Os9PwYwCrrXIvOH0IVSBQxi4vBmtXI-rI6EKYd7ElZIAsEnVbshigWMmwjsVu8U6
