"Пули пневматические 4.5мм 0,49, 0,52 грамма (250 шт.) / Пули для воздушки / пневматического пистолета / Пули для винтовки / Пневматика / Пули для пневматического оружия / пневмата",330 ₽,80 отзывов,"9 мая доставит Ozon, продавец Есть!",https://www.ozon.ru/product/puli-pnevmaticheskie-4-5mm-0-49-0-52-gramma-250-sht-puli-dlya-vozdushki-pnevmaticheskogo-489078438/?asb2=lDIU97rMTYloyK7gdCze6vHtWgvAqsJAvGqUucRFsCP9ZLyPHOb0j_f86Ru-rGUAAydWv4qPM4gpSW0pw5K5xA
Ремкомплект ЗИП для пневматики МР-654,196 ₽,62 отзыва,"9 мая доставит Ozon, продавец Rocket",https://www.ozon.ru/product/remkomplekt-zip-dlya-pnevmatiki-mr-654-283629584/?asb2=TuKopnd8iMIz_yGXvcAnEYl9M7VOqjzkOKJrF7zXKtBDQdQIiUdCZsumDuBLMmn8
"Баллончики CO2 для пневматики Quarta, 12 г (10 штук)",599 ₽,31 отзыв,"10 мая доставит Ozon, продавец Pnevmat24",https://www.ozon.ru/product/ballonchiki-co2-dlya-pnevmatiki-quarta-12-g-10-shtuk-437099777/?asb2=50GtyUJeM75Sr3DkZaKdfN2pbY46qqPmwEocVZO2YrY030QxrystlTectbczMdwI
"CO2 газ для пневматики, Пули для пневматики Quarta Баллоны Со2 5шт + Шарики Сталкер 500 шт",628 ₽,142 отзыва,"12 мая доставит Ozon, продавец OvoD",https://www.ozon.ru/product/co2-gaz-dlya-pnevmatiki-puli-dlya-pnevmatiki-quarta-ballony-so2-5sht-shariki-stalker-500-sht-325569449/?asb2=h43NmwtvErWS-jeiCYDXdclmMBIFkhTqK3ooJ-LbMVZeHf7E9Y618SP7rM45equE
"Пули для пневматики Квинтор Блик 0,25 гр, 50 шт, серый",249 ₽,102 отзыва,"Послезавтра доставит Ozon, продавец PIRAT",https://www.ozon.ru/product/puli-dlya-pnevmatiki-kvintor-blik-seryy-175364532/?asb2=A4gzaGQPAVXyR2VE0D2CJJJbeJnggt4t4P0GC1ahXkg7ZOf_bGTk8MhMyMGuo7Mk
"Баллончики для пневматического оружия в коробке ""Crosman"", СО2, 12 г. (в упак. 10 шт.) (США)",619 ₽,1 отзыв,"16 мая доставит Ozon, продавец ОхотАктив",https://www.ozon.ru/product/ballonchiki-dlya-pnevmaticheskogo-oruzhiya-v-korobke-crosman-so2-12-g-v-upak-10-sht-ssha-569189617/?asb2=1PgBrKK9GVQaGi_f4UbBmjflDfHWi2elyeUJKNX9pBzuf7R_OiHr4DgdGEenJURt8knc0lH876-mMYpyULMhmQ
"Баллоны CO2 Gletcher, 12 гр. 10 шт.",655 ₽,26 отзывов,"9 мая доставит Ozon, продавец ООО ""Дигитал Директ""",https://www.ozon.ru/product/ballony-co2-gletcher-12-gr-10-sht-501450795/?asb2=iLP_osGXZUxvrfifyowHA4YxzgfqEOLtLLJADAA3nfvv0mgYrla1rDQyQLHXF1Fx
"Пули для пневматики Квинтор Гамма 0,8 г, 250 шт, серый",349 ₽,182 отзыва,"Завтра доставит Ozon, продавец PIRAT",https://www.ozon.ru/product/puli-dlya-pnevmatiki-kvintor-gamma-4-5-mm-seryy-175364524/?asb2=jvaXwsGmWxpU2Et2AMinBVXm8Nbp2Fd4c2lIsYy3gRF_iwBkS04d_gIDd0no_SyR
Рем.комплект ПМ-49 / Набор прокладок PM 49,305 ₽,162 отзыва,"9 мая доставит Ozon, продавец Пневматика на Пражке",https://www.ozon.ru/product/rem-komplekt-pm-49-nabor-prokladok-pm-49-264414168/?asb2=HinZddw6g1vDELH4NCxahhyJBXnIjKAicAHZgG4zZD2UGJJ4UA6I0lEk-3rjUbu3
"Шарики для пневматики Borner Premium BB 4,5 мм / оцинкованные / 500 штук, серебристый",204 ₽,22 отзыва,"10 мая доставит Ozon, продавец Pnevmat24",https://www.ozon.ru/product/shariki-dlya-pnevmatiki-borner-premium-bb-4-5-mm-otsinkovannye-500-shtuk-serebristyy-437103656/?asb2=eaTF9sjON9JVYd1PDiaWwxAkxz9YoYVhlJ3tWLWehem_HbC8dmb5dsSqxvNvYhN7
"Пули для пневматики Квинтор Гамма 4,5 мм 0,8 гр 250 шт, серый",395 ₽,46 отзывов,"9 мая доставит Ozon, продавец Пневматика на Пражке",https://www.ozon.ru/product/puli-dlya-pnevmatiki-kvintor-gamma-4-5-mm-0-8-gr-250-sht-seryy-251699147/?asb2=JO7dR_xlJjPEzMS6J_UW2wN6t1NuCVDEouj3QnEQri2m5rjflKTXOLPSTjDDU8sl
"Пули для пневматики Спортсервис ""Барракуда"" 4,5 мм / 0,56 г / 500 штук",192 ₽,23 отзыва,"10 мая доставит Ozon, продавец Pnevmat24",https://www.ozon.ru/product/puli-dlya-pnevmatiki-sportservis-barrakuda-4-5-mm-0-56-g-500-shtuk-508438085/?asb2=USPSLLG9BICwbpcQOxMVztathwyjGX9MwXeed-NSPBW0XJknju73qfHqr1LSWTQI
"Пули ""Торнадо"" (300 шт) для пневматического оружия калибра 4,5 мм",214 ₽,1 отзыв,"Завтра доставит Ozon, продавец PIRAT SHOP",https://www.ozon.ru/product/puli-tornado-300-sht-dlya-pnevmaticheskogo-oruzhiya-kalibra-4-5-mm-539444193/?asb2=Gt1qUTgUHzsc32l6xGmy-29AJ18CfrvXsZKqzeLO_VL-DGtQxVbYq1ORy8waSkPc
Пули для пневматики Люман 0.3 гр. 550 шт.,231 ₽,72 отзыва,"Завтра доставит Ozon, продавец Market990",https://www.ozon.ru/product/puli-dlya-pnevmatiki-lyuman-0-3-gr-550-sht-279802020/?asb2=VJO6qlzSkjXIsxn01TRtMBthFSSOukCgzjAyUwvDPmwOyATSPqvDhho2y6_Q9VJe
"Пули для пневматики Квинтор Торнадо магнум, 4.5мм, 100шт",210 ₽,25 отзывов,"Завтра доставит Ozon, продавец ИП Спектор Дмитрий Геннадьевич",https://www.ozon.ru/product/puli-dlya-pnevmatiki-kvintor-tornado-magnum-4-5mm-100sht-491579316/?asb2=ex_qn-D2-iXicRhALhow-aHf_NwkkdDBne89SVoZMQY5902EWWCSTb6GfBnQtKwV
"Пули для пневматики Gamo Rocket 4,5 мм / 0,62 г / 150 штук",845 ₽,13 отзывов,"10 мая доставит Ozon, продавец Pnevmat24",https://www.ozon.ru/product/puli-dlya-pnevmatiki-gamo-rocket-4-5-mm-0-62-g-150-shtuk-495230900/?asb2=4TomcKMjV8kIwPySWdA67ykUWjdZPfRLYj8ghQMZ0VpSUhTa_bd9KMdvUio-N2iF
"Пули для пневматики Квинтор ""Блик"" 0,25 г. 4,5 мм. 50 шт.",240 ₽,178 отзывов,"9 мая доставит Ozon, продавец Сейфы.ру",https://www.ozon.ru/product/puli-dlya-pnevmatiki-kvintor-blik-0-25-g-4-5-mm-50-sht-260229304/?asb2=UjGf1BWBJzXhQxEIFsJKhXjRdr-pUib4DwEU57JWfEu_LV2Hphrmid18HugX6GCC
Пули для пневматики Квинтор Блик_11 светошумовые,274 ₽,112 отзывов,"Завтра доставит Ozon, продавец FactoryNN",https://www.ozon.ru/product/puli-dlya-pnevmatiki-kvintor-blik-11-svetoshumovye-317331888/?asb2=SuKULbTOIqNuqLBM9EckDNLgbEVy9pNsnFaAT1-p40LSfCavsOM8QyWaBHD54TuX
"Баллончик СО2 ""Borner"" 12гр (10 штук)",699 ₽,51 отзыв,"13 мая доставит Ozon, продавец «Спутник-Туриста»",https://www.ozon.ru/product/ballonchik-so2-borner-12gr-10-shtuk-358720906/?asb2=ZrFdle_fgQF0HXMAgYYe_XvsmSjXACE33zCTkk9Uu6qEy_gyyywh0pcscIWjFLFP
"Пули для пневматики Двойной улов Пули пневматические Super Oztay Diabolo 4,5 мм (0,58 г, 250 шт.), серый металлик",269 ₽,42 отзыва,"9 мая доставит Ozon, продавец Двойной улов",https://www.ozon.ru/product/puli-dlya-pnevmatiki-dvoynoy-ulov-puli-pnevmaticheskie-super-oztay-diabolo-4-5-mm-0-58-g-250-sht-415338035/?asb2=euwvsO-ETWQN3qPq-UHpaDid7eqA8wxU0K9ARTIqa7Pmoku4SyyjCtbhUQsqTPBJnOusDlngNXtWWojLZMiuAg
Пружина боевая МР-512* Магнум (длинная) + Усиленная манжета,549 ₽,36 отзывов,"Завтра доставит Ozon, продавец Stilsmart",https://www.ozon.ru/product/pruzhina-boevaya-mr-512-magnum-dlinnaya-usilennaya-manzheta-325277930/?asb2=ogAuWdbD_V5YnO5mAwmJTTu40EMKrXCo79fQvRCnRqzN-bIRCZ4VWn2I1kFikOSS
Манжета поршня усиленная для МР-512,197 ₽,63 отзыва,"9 мая доставит Ozon, продавец Air-Gun.ru",https://www.ozon.ru/product/manzheta-porshnya-usilennaya-dlya-mr-512-363249318/?asb2=-BEOTaOxlgy_fwuQfBojVNbj8MTZ-6zJ4rOxBMVMRkCia6ZhMByhLSMVclYFFIUI
"Пули для пневматики Люман Field Target 4,5 мм 0,55 г 500 шт, серый",499 ₽,142 отзыва,"Завтра доставит Ozon, продавец PIRAT",https://www.ozon.ru/product/puli-dlya-pnevmatiki-lyuman-field-target-4-5-mm-0-55-g-500-sht-seryy-202866183/?asb2=uhnCLdNrGT2ZF_Q4B-8PjrbZjXQ4DDRf0J69W9yTbSZUzU3kUZOcEGnQVt9YUFGL
"Пули для пневматики Квинтор Альфа 0,5 гр, 300 шт, серый",298 ₽,107 отзывов,"Завтра доставит Ozon, продавец PIRAT",https://www.ozon.ru/product/puli-dlya-pnevmatiki-kvintor-alfa-seryy-175067575/?asb2=jLVVtSzdbC-kMR6d4GXsTwUF4rb7MtpUBPydVOU04jaRYWCNHoGGbflAdsO8oXyZ
"Пули для пневматики Квинтор Пули ""Торнадо"" 150 шт для пневматического оружия",140 ₽,24 отзыва,"Завтра доставит Ozon, продавец Kalashnikov",https://www.ozon.ru/product/puli-dlya-pnevmatiki-kvintor-puli-tornado-150-sht-dlya-pnevmaticheskogo-oruzhiya-229416765/?asb2=uLIFiBgmW2SeHUyAu9lxUTCal1H43duU5lxUEyFiMqveIP8O601IjR4iLVzJyS4H
Ремонтный комплект для пневматического пистолета МР-654К (7 колец),235 ₽,95 отзывов,"Завтра доставит Ozon, продавец Stilsmart",https://www.ozon.ru/product/remontnyy-komplekt-dlya-pnevmaticheskogo-pistoleta-mr-654k-7-kolets-399574130/?asb2=F5AcK2y_Q9uVe5FQxBRenV3mN_2uZREL1_AtoqQc7GubfdCJ9XFzuEXX7Mqll8zn
"Пули для пневматики Квинтор Дротик, 4.5мм, 0.63г, 10шт",220 ₽,10 отзывов,"Завтра доставит Ozon, продавец ИП Спектор Дмитрий Геннадьевич",https://www.ozon.ru/product/puli-dlya-pnevmatiki-kvintor-drotik-4-5mm-0-63g-10sht-491544163/?asb2=aLtujAr4g_grOdk85_JZFhatRaLN8tfpQXASxqrgqsfHZ9Cd2sSmLmvq9btdAlQy
Шарики для пневматики Gamo Round500,399 ₽,81 отзыв,"Завтра доставит Ozon, продавец ООО ЛАЗЕРХАНТ",https://www.ozon.ru/product/shariki-dlya-pnevmatiki-gamo-round500-300338710/?asb2=K8DKWUCWHGecX3flDG97mDiKOHXb2jYKYTkdsB5C8qCHqxcvN2n67FQOuVS4Zc6l
Пружина боевая витая МР - 512 +усиленная манжета,477 ₽,28 отзывов,"Завтра доставит Ozon, продавец Stilsmart",https://www.ozon.ru/product/pruzhina-boevaya-vitaya-mr-512-usilennaya-manzheta-354664718/?asb2=3c1JE8LKOf-u7B3w1Pv269qc2jGfihWNbwAJK0vlRsJt4PBi7ImXn17_HIqASNCd
"Пули для пневматики Квинтор Гамма №4, 4.5мм, 0.83г, круглоголовые",300 ₽,7 отзывов,"Завтра доставит Ozon, продавец ИП Спектор Дмитрий Геннадьевич",https://www.ozon.ru/product/puli-dlya-pnevmatiki-kvintor-gamma-4-4-5mm-0-83g-kruglogolovye-491653123/?asb2=wmEtOTNR7IYZMLoYNxpR--FZg31AZcDq4G1Ull5CC4Vx2l2dH2sawE8oRkBQwYPl
Шарики для пневматики Universal Guns Шарики стальные омедненные для пневматического оружия 500шт.,199 ₽,22 отзыва,"9 мая доставит Ozon, продавец Универсальное Оружие",https://www.ozon.ru/product/shariki-dlya-pnevmatiki-universal-guns-shariki-stalnye-omednennye-dlya-pnevmaticheskogo-344239045/?asb2=9eEOzyq0AHrmYj2Vv2In5sAG100lq1dSwSatFGEC_ENx_D_rnjfphCqSc9kujdFV0M8ZLOyw0EnS0s3KzRYEdg
Патрон 5.45 мм учебный инд. 7х4 TYMONA 9112-82 (5шт),397 ₽,2 отзыва,"9 мая доставит Ozon, продавец Air-Gun.ru",https://www.ozon.ru/product/patron-5-45-mm-uchebnyy-ind-7h4-tymona-9112-82-5sht-468942968/?asb2=WTiRsan_KmWCGLiUBJ4fUTYnWl00xZVwIkysyHgTJzu4CT7d8M3HNdgmKulPhmI-
Ремкомплект Аникс 4 кольца 1011,389 ₽,15 отзывов,"9 мая доставит Ozon, продавец Rocket",https://www.ozon.ru/product/remkomplekt-aniks-4-koltsa-1011-316074351/?asb2=zsHxxuT-tuLx87OTY1TH9edLodHkmFzzwLRdNA6PrH06HlHEkKHGHDm5wi9cjlrK
"Пульки 2000шт. Bullet, набор пластмассовых пулек для детского пистолета, 6мм",386 ₽,3 отзыва,"10 мая доставит Ozon, продавец Eldrago",https://www.ozon.ru/product/pulki-2000sht-bullet-nabor-plastmassovyh-pulek-dlya-detskogo-pistoleta-6mm-223359358/?asb2=_TVJ_JdSzVIOBLDo4qYmWYXQzQGo3sBnPUoctoMslEOOOiA51HMBps4mWSAMdQ07
"Пули для пневматики Квинтор №1, остроконечные, 4.5мм, 0.53г",205 ₽,16 отзывов,"Завтра доставит Ozon, продавец ИП Спектор Дмитрий Геннадьевич",https://www.ozon.ru/product/puli-dlya-pnevmatiki-kvintor-1-ostrokonechnye-4-5mm-0-53g-491638267/?asb2=oW8lxqQvsSZx-9V1CuEkvI-maJq3Wg6wMwP6UTIlq9JbpzF6Ix72QAdEtyQOvro5
"Пули для пневматики Квинтор Domed 6,35мм",344 ₽,106 отзывов,"Завтра доставит Ozon, продавец FactoryNN",https://www.ozon.ru/product/puli-dlya-pnevmatiki-kvintor-domed-6-35mm-396611083/?asb2=t--Dw6tVPTdvYMUz3hC6Hy0bmrDDWz-cVLuX28FgFd3OybIoB5a0n4X_JOVePomV
