"Кошма противопожарная, противопожарное полотно ПП-600 (1.5х2м)",534 ₽,10 отзывов,"8 мая доставит Ozon, продавец Центр Поставки Товаров",https://www.ozon.ru/product/koshma-protivopozharnaya-protivopozharnoe-polotno-pp-600-1-5h2m-323513383/?advert=Rw9jEEtmvx1l91r_AjipidpEFeT0kon7jM6mJKmfu_jN9XKrnH_SWrIHV-NWCIE367RIjlnZkt8V_gehmJQx3uZfxqROdvvkxcvZWcDhUBRrL7SFkFMc1HZXdF7nbqgFhZRzFwSxx2tjiQXf1wcCZFQ0Za4vyFQgIV7p4GsZ8QdcYU2gMJZz53lXdL6ws9kjRcvZZZudHPweLGCBGSjfQswXyT9Ewj1YFBTQjU482zRGc__6WudPGV2UWvmdbyYA2oFd17lEMIBitz3LvyG87AGUNykn_Fx0KEdFvt4blfkSg3rDrZAL4ktnFB9P4dGJ05wCFUG9KgEP2g6U5lnszzkr3fx5FOOKpYQAB_GO28Axgw-l9r5INf9IQXMT-Z7iXTVFP5foakcRxFK_8TwC8e07b-VtyeZfY0vzEkJ7RJtMCyj3WLbFLx2ukLNVPk8HHuTA2nptgnQUekBmtxCQBG07JsWHvt1NgXD7eoXO35lbum0S7IqLREpH77WZy_xLnaWHby7BI3p6LbT8zA8Ivnrx5gA6tBrjJHbSR88ojtOz2n2tTvu5uU-1Pq-WrZYU
Кронштейн для огнетушителя,470 ₽,80 отзывов,"Завтра доставит Ozon, продавец Фирма Мастер-Мир",https://www.ozon.ru/product/kronshteyn-dlya-ognetushitelya-170018083/?asb=HZQmmBteUTKLH1OmOtQ9hAYQ6ol7%252B57KeyzLice4vys%253D&asb2=U_hKx332k-KVQ2ZUQAsM7nHnR5MGxcF8EO9yQGa17NdhByi9JwXwFHLKa_EWWtDu
Головка муфтовая ГМ-50 Алюминиевая внутренняя резьба 2 дюйма,250 ₽,40 отзывов,"Завтра доставит Ozon, продавец Fire-not.ru",https://www.ozon.ru/product/golovka-muftovaya-gm-50-alyuminievaya-vnutrennyaya-rezba-2-dyuyma-243607506/?asb=NuRQltBQlcswGX1EfiyADAPu%252B%252FYm45WC3XK%252FCnoHDHc%253D&asb2=qjb1eaFJ1bEuSmN8ki-_SOmmqt3zlQplrsICj-s2i9nSKUuux2BFzmptAypYY_qu
"Кошма противопожарная/противопожарное полотно ПП-300, 1,5x2м",473 ₽,45 отзывов,"10 мая доставит Ozon, продавец Fire-not.ru",https://www.ozon.ru/product/koshma-protivopozharnaya-protivopozharnoe-polotno-pp-300-1-5x2m-239922107/?asb=1By%252BhYsKU8LhVlrboqiURvCdlzTaM%252FH7f213U37ojbU%253D&asb2=BW-9UxSognbS0mKwLR8ktddcJIzz-nNlK1dv2HL9Zf4E4M1ib-AcAMjwE88QJAJa
Противопожарное полотно ПП-600,560 ₽,42 отзыва,"8 мая доставит Ozon, продавец Полный Спектр Плюс",https://www.ozon.ru/product/protivopozharnoe-polotno-pp-600-206103031/?asb=mUutqTahM7l4hQS1o9eG9wUJ62yuyrxSKH%252Fj%252Fpf82np4xsPnY3OUebsmrJ3wHXRV&asb2=Z7pjyX68JoajR_U2CYdH3GoRaiMPhwDFZWRspb0yzG61i8D21LTF30e24afHDo18kcrF0sx53wYkmox_jg7sNxCcofDTXEN1zXV6rN0TpgB5SmtpJMVekH1mnc0u9rADzH40RAmuOsgxjW4yIy7COA
"Переносной Бытовой огнетушитель Ярпожинвест, Порошковый",990 ₽,4 отзыва,12 мая доставит продавец Fire-not.ru,https://www.ozon.ru/product/perenosnoy-bytovoy-ognetushitel-yarpozhinvest-poroshkovyy-239551553/?asb=mKyqWUs01ST33QUNUAmQ5BKADtAqI6rD6G5tq3R952M%253D&asb2=-9kEXhygwJkio_2yvUubnCQcyNy7YOuQDXyu85XgTzdhbM4Gl6FxSy_ZtDLjwPTi
"Переносной Бытовой огнетушитель Ярпожинвест, Порошковый, ОП-4",948 ₽,24 отзыва,12 мая доставит продавец Прометей,https://www.ozon.ru/product/perenosnoy-bytovoy-ognetushitel-yarpozhinvest-poroshkovyy-op-4-171594089/?asb=Mhm4DuXsuSoj1cCkHxNAFjNDLt1L8m%252BBbysOQ2EUa0rWHUrUBKyLfhG6RjMOtUjg&asb2=A2L1WOA9FLOt4M6paUh14K47nSosj0mHD0pkFH5rcsR78ElKkxZj36qAPxrd3POBw3D5M7XoxPPRkgprRTzQkNtu8w8j_Pxz8po_H8UQPvmq2DSS-iX9ZUpNEOs6qZp0gplxsVvuN7y8v17ujuj34Q
"Переносной Бытовой огнетушитель Ярпожинвест, Порошковый, ОП-2",615 ₽,9 отзывов,"10 мая доставит Ozon, продавец AtlasWeld",https://www.ozon.ru/product/perenosnoy-bytovoy-ognetushitel-yarpozhinvest-poroshkovyy-op-2-391077245/?asb=NfclzXXT8G1QfSB4O3Z%252Fvnl%252BxNVQ18kFksk4ioOPIVWxz0q9G7xn2BXwhui2Kz9I&asb2=1KLXv9wbega9AOvteWNTmgXYHQDK0-IfAMx6jy0BsD9yHFvWchDEGM8NAwqESTbDohDIHGPDRA_N4t1DcM3rQrPafrKnHHKylc8XSf5tEeM85ycOMQb7YfvKQZaR3a_RabGfq465jgQVP7VXiGMUQw
"Переносной Бытовой огнетушитель, Промышленный огнетушитель Ярпожинвест, Порошковый",1 050 ₽,79 отзывов,"10 мая доставит Ozon, продавец CarComPro",https://www.ozon.ru/product/perenosnoy-bytovoy-ognetushitel-promyshlennyy-ognetushitel-yarpozhinvest-poroshkovyy-334485019/?asb=J0E5NOZa1iOea3IDHTTp3BFj5H%252F3YLia3XY8nJMXjDg%253D&asb2=jEJYcldLo-sgFjaWMdnqxcCP0En-lU0yTBR1pq9fxKFeEFANwycssK017ZtUwWw4
"Переносной Промышленный огнетушитель, Бытовой огнетушитель АТЛАНТ, Порошковый, ОП-4",850 ₽,7 отзывов,12 мая доставит продавец Fire-not.ru,https://www.ozon.ru/product/perenosnoy-promyshlennyy-ognetushitel-bytovoy-ognetushitel-atlant-poroshkovyy-op-4-258961585/?asb=ATYb10jyxUX86%252BDQ1nbVHKIuZkuwg1GD1ZQ55Ir%252BQt8%253D&asb2=E0wN3qFEbjEVOJa39cBmqABGYs3jV5oemAOxeST4SbB_Gx24y_bcHL9entAIvYBs
"Переносной Бытовой огнетушитель Ярпожинвест, Порошковый",690 ₽,4 отзыва,"Послезавтра доставит Ozon, продавец Торговый дом «АВТОПРОФИ»",https://www.ozon.ru/product/perenosnoy-bytovoy-ognetushitel-yarpozhinvest-poroshkovyy-259020922/?asb=%252B96j0zJQoZPDVQz%252F27rBx3pPNpz9G%252FATi5fvFFidYxnQasG5nGv5qZTT5ZnbSyIs&asb2=J6sgZPUFnrYtuzJ_NmbT0PTYJR14hGRemsuD3vEpCRZ3WrNmQgDtU0mxIEN2EB2veN4FWr1Xwm0UpaspxsQ2ATkVpcY8_afOQrWdyRYjAWXRn6XXq3IuCpaajGbRiII1e8RX5u3mWSFA_IwXejKa3Q
Головка цапковая ГЦ-50 Алюминиевая наружная резьба 2 дюйма,233 ₽,40 отзывов,"10 мая доставит Ozon, продавец Fire-not.ru",https://www.ozon.ru/product/golovka-tsapkovaya-gts-50-alyuminievaya-naruzhnaya-rezba-2-dyuyma-250327813/?asb=PUpPOLnp%252BW5dgnnqJhAoCmkX5Hal51id%252BTQNELQSZCU%253D&asb2=3Bb-d9pNGWCnZOwTpvB8aohehy-NjOTLzrZ0ATZJWruxM4CHmwb83bFoEv8DnAbL
"Переносной Бытовой огнетушитель Ярпожинвест, Порошковый",594 ₽,1 отзыв,"Послезавтра доставит Ozon, продавец Торговый дом «АВТОПРОФИ»",https://www.ozon.ru/product/perenosnoy-bytovoy-ognetushitel-yarpozhinvest-poroshkovyy-259019730/?asb=0o0RvqRJBpvF8JYytwQ1Hrw4pDh6M2rwpiwuHyawked8sxuehfqVnOdUUX65BZuY&asb2=8jLVnWfXqZ6VzbI4odSkSVsWLogan1s7oc89_feBP8NdMfZoCeud5mqTdMtGYYixFFzYfUXZO3HPzXnAB-ukkNgM62ZVYsf_GLANMLHm6n9hYsDALZQiDQ-u3oFa8f9ZQ4OfPZiof2YkwKTsNLdYLA
"Шланг рукав внутриквартирный ПВХ 19мм, 15 метров",338 ₽,7 отзывов,"8 мая доставит Ozon, продавец Центр Поставки Товаров",https://www.ozon.ru/product/shlang-rukav-vnutrikvartirnyy-pvh-19mm-15-metrov-497089179/?asb=eJuKSqIx1nViNxthBsgh7qmKIC9q%252BZiXu5q0GDDfvig%253D&asb2=6Puvc3r9yTL2LzHLJ3qLFbo83W1FcLLIQt5Bi2cqDxHJojMP58taaDRRKhMRv0vm
Бытовой огнетушитель Ярпожинвест,745 ₽,1 отзыв,"12 мая доставит Ozon, продавец VipMarketplace",https://www.ozon.ru/product/bytovoy-ognetushitel-yarpozhinvest-194434054/?asb=AUZW2ISNJa6u3Sfz%252BVnVtsWFKRziNpYIswyFUfFK5J8KpOFUgM9ltgpwBw21OaQ0&asb2=gePTJjwozSlQkjtZRWzi1zE3Cl2ULBy-8uFpJMfyYuNUaeyOinxNP3H9jDwmUjlICqLxowPLA8yBu3VkAxMH6wHCpCsRgYFthniVa2zjeGByfQRDDMpf61c227FS27z0QTaC0B5WCVBgJJPUVPytag
"Кошма противопожарная/противопожарное полотно ПП-600, 1,5x2м",557 ₽,29 отзывов,"10 мая доставит Ozon, продавец Fire-not.ru",https://www.ozon.ru/product/koshma-protivopozharnaya-protivopozharnoe-polotno-pp-600-1-5x2m-239891853/?asb=jDklKHzvOnMJ73%252FR4TmCnvG%252F2qdBYmwaf40Syz8FJ78%253D&asb2=-BU9FEml82-Hy-8eR-2I7IdaZ2J4zaV2ALGZnIac1K3gI5VCR61dCIXOqpg6tmdc
"Рукав пожарный Классик 50 мм РПК(В)-Н/В-50-1,0-М-УХЛ1 без головок 10 м",936 ₽,41 отзыв,"10 мая доставит Ozon, продавец Fire-not.ru",https://www.ozon.ru/product/rukav-pozharnyy-klassik-50-mm-rpk-v-n-v-50-1-0-m-uhl1-bez-golovok-10-m-426383854/?asb=vxtCWxZNzN6JslUDzBD0tCgUK6arXYKzrljDOuSSlqY%253D&asb2=cYdHqc_wSpRsK0vibnMD1wUb0ZZ_p2mebkzlyR2Dy6vFVhA8GqXfPMCm3WsjdAXV
Крюк для открывания крышки люка колодца,473 ₽,10 отзывов,"10 мая доставит Ozon, продавец Fire-not.ru",https://www.ozon.ru/product/kryuk-dlya-otkryvaniya-kryshki-lyuka-kolodtsa-348311706/?asb=KCJPPNPHkXwTnLgoYgUW2TxgDYh86M31oJdxYc2gNe0%253D&asb2=YKynJymNA3smv9bUAVSGZpnbOFNXFpjQ3op93KSoG3Ael4os47uhe8AhKZx_NdvR
Подставка для огнетушителя П-15,579 ₽,5 отзывов,"8 мая доставит Ozon, продавец Центр Поставки Товаров",https://www.ozon.ru/product/podstavka-dlya-ognetushitelya-p-15-485925612/?asb=Rvlu%252BTn0gP5Z3S98aKjBiBMy5IDNugtumgSJLs3I70A%253D&asb2=NKkYlpiVNVtnr-cvTgb0OHEoH5CpMX5A4Bmg5R0zozF1g1-N3Aaju3gPe6b-Q2hx
Барашек к вентилю (11*11),274 ₽,6 отзывов,"10 мая доставит Ozon, продавец Fire-not.ru",https://www.ozon.ru/product/barashek-k-ventilyu-11-11-327288724/?asb=spzot%252FMv9k%252BxRIYftIMu8F0ZJ858ISBLiFVlICvauSU%253D&asb2=2zVKRtHDF4uCeAnsCpY_Div5p5CobAVWWw0AkmMTCgzqzYwW3OAcUkgUqahlulcu
Подставка под огнетушитель П-10,568 ₽,14 отзывов,"10 мая доставит Ozon, продавец Fire-not.ru",https://www.ozon.ru/product/podstavka-pod-ognetushitel-p-10-241784555/?asb=i2lHDsMvMOExzh0RAtyf0IQGgRATX9Bzeg7ONAG91PQ%253D&asb2=Eab0VLiX8YDehu6iknClthtl8irN8rQpRtn1WQksgfgcbBvqUAtd7hSoj1OtZxgu
"Ствол пожарный РС-50 Алюминий, с гайкой",379 ₽,25 отзывов,"10 мая доставит Ozon, продавец Fire-not.ru",https://www.ozon.ru/product/stvol-pozharnyy-rs-50-alyuminiy-s-gaykoy-262384546/?asb=CxGVGjaH8yIfpSQtQ%252B0nWD3DMsAankuFg3BWw5gB0iw%253D&asb2=KV0be4lqEJ_L7R4vNMhrF2iQhmm_5TNcZdQnlmB2vzbSw7gcU7kCshB5zgVZz6O3
Подставка для огнетушителя ПО-20,587 ₽,11 отзывов,"9 мая доставит Ozon, продавец ООО ""ТАЛИОН""",https://www.ozon.ru/product/podstavka-dlya-ognetushitelya-2-169866559/?asb=cSzM7B7NNObMqnm22f2JNpLiCM%252BybA5MXIh2zgBUCGsNNtidu3USBiujlEqZJkWw&asb2=0rwr3hn5SPVWo77-uaR4OgbVLZODyCYbyfRZyZ0xTclNcpyL2sVaoaUlGs-tFreHrq3ZEPEkMHtmcA-JRdpGl2xNg5C87qTHEdiXkbBqnIz8r3vKoIkGRp0385bVS4IsvZRjkUX8CePpUQEdF34jiw
"Рукав пожарный для ПК 50 мм, 10 метров, без головок",798 ₽,2 отзыва,"8 мая доставит Ozon, продавец Центр Поставки Товаров",https://www.ozon.ru/product/rukav-pozharnyy-dlya-pk-50-mm-10-metrov-bez-golovok-498118345/?asb=UfNc0sr0y3EoIlwskB40d%252Bwoquy0hlW1eZ1ytbCv0ARpQcbOsUJcLp7cp0k4agqO&asb2=P65OLJaO-Q8hwn3hPBzJs1vBZNWRTuN2BXZVNQVchng2u8dRA3Ip5iqDiXrraNhq9bFUjwvoYEQEBTCW-jNXrIB-Q874YbEYH5jJrHb77_ZcFVhOKnWBJhPKpyLnXgxg_U_uZ-iVRsiYqWWWeIMUbw
"Кронштейн ТВ5 настенный транспортный, с металлической застёжкой для ОП-4, ОП-5, ОП-6 d-133 мм",388 ₽,6 отзывов,"10 мая доставит Ozon, продавец Fire-not.ru",https://www.ozon.ru/product/kronshteyn-tv5-nastennyy-transportnyy-s-metallicheskoy-zastezhkoy-dlya-op-4-op-5-op-6-d-133-mm-343623560/?asb=L5l8VQkHZvNsMKmlnlAi9d8ekznGWcaj67EwD98ZHoQ%253D&asb2=u5N4UClgWa1DPAhF-h3nnrtiDnmN-9SuNp48lQYRVMLIvGc9w1PHtvsAy5n_HLGL
Подставка под огнетушитель П-15 Спасинжиниринг,640 ₽,41 отзыв,"8 мая доставит Ozon, продавец ИП Шитова",https://www.ozon.ru/product/podstavka-pod-ognetushitel-p-15-spasinzhiniring-205047248/?asb=Q949fZJ5M86cE5JszxxFvYd6WpqzP6z%252BKz%252FK%252FPbheVQ%253D&asb2=8f-Nn_igxPvBGoozG99ZDdGrbShjy6CRtcv2yHZFKK8TCXm9Lmq-NRlw3w6Qhbtt
Головка рукавная ГР-38/50 Алюминий,327 ₽,2 отзыва,"10 мая доставит Ozon, продавец Fire-not.ru",https://www.ozon.ru/product/golovka-rukavnaya-gr-38-50-alyuminiy-400616852/?asb=97GT8y2yv6Gne2nZV26i%252Fw%252BZg%252FonNTdxK%252B8UN1TPQMw%253D&asb2=OTht4wA81dG-QpfQMubeSMVL0DZ21FWWCOcdvNQ8lhFZXiceXgmcPkH5mVOrPFzI
Подставка под огнетушитель П-10 круглая,429 ₽,3 отзыва,"10 мая доставит Ozon, продавец Fire-not.ru",https://www.ozon.ru/product/podstavka-pod-ognetushitel-p-10-kruglaya-395529096/?asb=aRMWj%252ByJGKr%252BjibOiXgA5HpqYeEsgZ1czEynYpCg1Gw%253D&asb2=rmwmB5q8Ja3oqHe-JdH-CXCQhZfJ4xIxLFOFrPyBgySpS3ntEzOfGv5gSszSw8xc
Подставка для огнетушителя П-10,510 ₽,14 отзывов,"8 мая доставит Ozon, продавец Полный Спектр Плюс",https://www.ozon.ru/product/podstavka-dlya-ognetushitelya-p-10-199293576/?asb=3zGTUCzzECWdJ2Qplh8nqtkfT2E2bxpi%252FZc2ppAiPm7U3wV8rcDbGPKy4djuRVxz&asb2=Lw3zdNq1KcXjqM9IJyU0svVfCtTPdL0ub4nlEwfVjxGSnNNeYqizspJLNd3PDSP18qBFY7gKBTZPt06BNzuU4zNhg7etZBQ7HtMH0SIIUbRw_cuiqraR8xIHXGwstvmcZpe_T4Fhgw-kg97x58EjVg
"Подставка каркасная для огнетушителей, до 5 кг., диаметром баллона до 180 мм.",449 ₽,1 отзыв,"10 мая доставит Ozon, продавец Fire-not.ru",https://www.ozon.ru/product/podstavka-karkasnaya-dlya-ognetushiteley-do-5-kg-diametrom-ballona-do-180-mm-445661711/?asb=xSRvEizDDVOwBUo1RZI5R7RkYtLO%252FYOvIpcqY%252Fmf5lA%253D&asb2=muZfxVYClXNN-FU1mrzbnvV_PxT5v35it33YUzI6LDRHcWwm3BByQAH2fz7uNRQ8
Полотно противопожарное ПП-300,550 ₽,18 отзывов,"8 мая доставит Ozon, продавец ИП Маев В. В.",https://www.ozon.ru/product/polotno-protivopozharnoe-pp-300-349426490/?asb=qumuUzkOdFOieiJzSNrIUFui2aQpP9GKNCTB%252BckuKGw%253D&asb2=kYDkMi7VZQAISOw4yPYXiLgi0dk-4r39XfywvB_T50-ay1WM_s9EhxD1yzmgtyf-
Совок пожарный для песка,410 ₽,10 отзывов,"10 мая доставит Ozon, продавец Fire-not.ru",https://www.ozon.ru/product/sovok-pozharnyy-dlya-peska-483837960/?asb=w477OMZg%252Bk66hYyM9EHshvzPuaxZWS5hxzeI6j7aG6s%253D&asb2=hEQWGUgCbwLgzj3SGPccENtwWaHnadrl0f6fmSDzO7FTOoXgo4-VR17540agRbdG
"Раструб к углекислотному огнетушителю ОУ-1,2,3 (5шт)",500 ₽,2 отзыва,"11 мая доставит Ozon, продавец ООО ""ОГНЕБОРЕЦ""",https://www.ozon.ru/product/rastrub-k-uglekislotnomu-ognetushitelyu-ou-1-2-3-5sht-438474154/?asb=PW5SNxq50whp0%252FcRP6Et2fcVbQYrljyfC3cWPe7KH3Q%253D&asb2=JQmAanxUpzXhRU1OVXNPE05ppqRg1DEuZYa5BqkAza1-YFWrh1QJvrDS7O8vygfm
Головка муфтовая ГМ-80 Алюминиевая внутренняя резьба,410 ₽,7 отзывов,"10 мая доставит Ozon, продавец Fire-not.ru",https://www.ozon.ru/product/golovka-muftovaya-gm-80-alyuminievaya-vnutrennyaya-rezba-347994964/?asb=HP%252B9h0uVDlLMANoWfBMo6PYJ8aJi7los3OD5YMgBnyA%253D&asb2=z6p2U6mkAErRo6UEc38v2tsLLsx9JCAEvwPHSCeIgAnwzdU2SIs5LFrlcjzBFsGg
Ведро пожарное конусное пластиковое 7 литров,408 ₽,2 отзыва,"10 мая доставит Ozon, продавец Fire-not.ru",https://www.ozon.ru/product/vedro-pozharnoe-konusnoe-plastikovoe-7-litrov-341081378/?asb=1stH2Wm9cTOocSkUVCjJ8xtN1a72V1aLRnndimlzFM8%253D&asb2=6NmOvWre5b7V7_jhcDuou2b0PM7f-_X5kRXK2s76ldUgrgtfCIjj6I1MMIfjCv09
"Ствол пожарный РС-50 Пластик, с гайкой",227 ₽,2 отзыва,"10 мая доставит Ozon, продавец Fire-not.ru",https://www.ozon.ru/product/stvol-pozharnyy-rs-50-plastik-s-gaykoy-343085295/?asb=V9znTy46HduBibXSX4q0PCP5QrLIwrkT3eS%252BTsSGvBE%253D&asb2=gmODl2mze__ZIr8SEtb9s_SxkRJRkRC_KDhPhxkdhwMRNj1Nnj3ADpMIWmonSqOm
Головка заглушка ГЗ-50 алюм-пласт,233 ₽,2 отзыва,"10 мая доставит Ozon, продавец Fire-not.ru",https://www.ozon.ru/product/golovka-zaglushka-gz-50-alyum-plast-341693149/?asb=AyLamD2BScw%252B%252BV7bhDg%252BvQeEfrop7fmQuNc5njPxx%252Fw%253D&asb2=22CQ8Lghfvyqkyf9y7LUf5eB3M-rElM4l6GVW3L_-OgpJPC8H99sMnDKV73fS0SQ
Подставка для огнетушителя ПО-15,617 ₽,8 отзывов,"9 мая доставит Ozon, продавец ООО ""ТАЛИОН""",https://www.ozon.ru/product/podstavka-dlya-ognetushitelya-po-15-181704698/?asb=WxrDUpMUhJkyxrIE01mP9FpE8r0GvIeqjajx%252FPTxoycoMQVlOHMwSNDrmQn3joAB&asb2=xCts9ikefZBNURJbJBw9NXts_n5l7BFU-9GEYBI6CviCEZCdjXEBHZcDPRPsFKhePRm1JKncG8-imPsfZP-lVwWTbTWaTLU3mcqBEimU9DjWJ_0xKW9-tSyt0e1jGRiLRRcGKzYGCDNAytYjDPcuIA
Переносной Бытовой огнетушитель Ярпожинвест,657 ₽,18 отзывов,12 мая доставит продавец Прометей,https://www.ozon.ru/product/perenosnoy-bytovoy-ognetushitel-yarpozhinvest-171594124/?asb=G%252BXqhayjK2mT4c%252Fuc8StV7IqN4psDBSjjFIyAG26eTBirOCQfQ7QOlqlhiBcP18q&asb2=zTJXB8dvfg5DrOF9zeisuC928-kLP88Hr0BeXGbVjt1TUC2wH7g2sf_pm1usaEDMhHJhm_DaBE8B9_GFR2L7KOCyuyKdi0Og764RHKqqxtW429bH2NAQ2QKMy41gZz-sk9JXxnFtiLwu2tuM5KvcOA
"Клапан пожарного крана муфта/цапка чугун угловой 125, диаметр 50 мм",999 ₽,2 отзыва,"8 мая доставит Ozon, продавец ИП Шитова",https://www.ozon.ru/product/klapan-pozharnogo-krana-mufta-tsapka-chugun-uglovoy-125-diametr-50-mm-284410782/?asb=bsZcxeMntSKHw8YUS4TWIR67maxisUApNzCujnjsbaA%253D&asb2=WZHoywIT5G8mXQBQtyI5hoVkhMJqjbr_y0_XVtivkeF6CFcKbAvty4yHcgHlpilY
Подставка для огнетушителя Спасинжиниринг,520 ₽,15 отзывов,"8 мая доставит Ozon, продавец Полный Спектр Плюс",https://www.ozon.ru/product/podstavka-dlya-ognetushitelya-spasinzhiniring-199293575/?asb=txXvm6IoQVr65c8oO8T4MJqTkeyXL105PvPJraCqVhQB5nxarrRORiPtj1bdHtEM&asb2=FD82ru8xNM-fkHi5QQOm5QB0dmMoBF8yftOJKp3-bod1SMzOHqk0xHwKHrb-GHZtR1Wh2LTcQ2jK7nXqWu7ZzwkYDvvQDyfuj22EszJNtO6OURL0a39YCGQlEjdLQ011x7pCIC-XKFm2B5IyI3neKA
Шланг к огнетушителю ОП-4/10 (комплект - 5 шт),550 ₽,6 отзывов,"11 мая доставит Ozon, продавец ООО ""ОГНЕБОРЕЦ""",https://www.ozon.ru/product/shlang-k-ognetushitelyu-op-4-10-komplekt-5-sht-442559026/?asb=jr02kw3RxvvV8oh%252FhOOJK6OLbaZzxo2HRVkSAwftsjs%253D&asb2=-cZK1nigO6YjoQ6HPx-YlOuiq6qQlgpivpwxuUmZx1P_trMbVv_KqgaOhejOXv1F
Головка рукавная ГР-80 Алюминий,531 ₽,2 отзыва,"10 мая доставит Ozon, продавец Fire-not.ru",https://www.ozon.ru/product/golovka-rukavnaya-gr-80-alyuminiy-400615355/?asb=xPQY4QRI%252FXaOE5rQhlx4s4FGrRj5dA1nIHXl5F%252BJNLg%253D&asb2=9NHtEO3eF2rPi9WZhodHTIdJHnbnte3cMi9RicfYevtrGEavtqYdzvzi9cDEwR4G
Клапан пожарного крана ПК-50 муфта/цапка чугун угловой 125,967 ₽,1 отзыв,"10 мая доставит Ozon, продавец Fire-not.ru",https://www.ozon.ru/product/klapan-pozharnogo-krana-pk-50-mufta-tsapka-chugun-uglovoy-125-262378464/?asb=iHO8HfFfKFrFaP%252BjROQCPUtBLE3T4tVxW0Z69DB4hCE%253D&asb2=CQwdv0SB0_W_omPhxBQ8xITZKzpMTwYg7CfCzzcf5he-hFQvMrMLruj-MI6FrGT3
Кронштейн для огнетушителя D-140 мм,428 ₽,1 отзыв,"8 мая доставит Ozon, продавец Центр Поставки Товаров",https://www.ozon.ru/product/kronshteyn-dlya-ognetushitelya-d-140-mm-497037776/?asb=lIT1DJx4EsJGBqpn0kgwGA7XeifDxVL9xsXpRurQZIM%253D&asb2=-iIR5tVhIvL9bopfV3TzHoNFnd0NTOVVzhm8-gYcaB4yKeH4AyFP_rn3kNSMOm_2
"Шланг для углекислотного огнетушителя к ОУ-4,5,6,7,8 без раструба",295 ₽,1 отзыв,"10 мая доставит Ozon, продавец Fire-not.ru",https://www.ozon.ru/product/shlang-dlya-uglekislotnogo-ognetushitelya-k-ou-4-5-6-7-8-bez-rastruba-400894655/?asb=gAnPuBUJ%252B70koAqWffr0HbCvFgMYVeJiSyeRKepF%252B20%253D&asb2=ySKdoJE4g7CLe7zk5zI95Uyg4irscU_D47UfwR_Z69LOV9NOwTLXxe2q5LGVBQva
"Кошма противопожарная, противопожарное полотно ПП-300 (Кошма, 1,5x2м)",520 ₽,21 отзыв,"8 мая доставит Ozon, продавец ИП Шитова",https://www.ozon.ru/product/koshma-protivopozharnaya-protivopozharnoe-polotno-pp-300-koshma-1-5x2m-205048339/?asb=caMC4HsR9ILd8c5tjpTz9xffyAw57ATYKHx5uQwnzqM%253D&asb2=T-DjFmOhzHD3GzdA47LBRpuhhVsj3hu6UZ1Aq_j3xwaskp6IEG50EO46H9RHszSj
Огнетушитель порошковый ОП-2,684 ₽,8 отзывов,"9 мая доставит Ozon, продавец Хоздепо",https://www.ozon.ru/product/ognetushitel-poroshkovyy-op-2-251187966/?asb=CcI6MNgsFjo0or9QnL5s6%252F8cd8ut%252Bkx4cJ7WLk%252B4aRFpPqUpIu26gSxNlUwo2q1S&asb2=7BbcajvXPcrV_6zSZsQ7h0w7Pf26HoWCZD3-XstnlPeI3UE5B2-M5hki72PApJ9wI8QcsnXjzaIJh7CErPsVYuc4faTVo-Duhda3FpjBXOIdm8g7L70bvYO1FqYoH6A1iLvMe3AQW8px9Mgy_S0N6g
Настенное крепление для огнетушителя,321 ₽,1 отзыв,"17 мая доставит Ozon, продавец ИркШоп38",https://www.ozon.ru/product/nastennoe-kreplenie-dlya-ognetushitelya-497101524/?asb=PQngc%252F4y6ExrBC7XtByJtooxB%252B95HFlIMcogsPm8QzAjAQySUy5zPlXhZzuRQwoZ&asb2=4mfzrdXrOWEScfOkaZuWMOtRAb9PKYxAz6AawX70t4UerT9mC4kqHhrM5LOsGZGUdrGlBnFQqCan3a0CoQHeDRegGicO2dm2pwDaGVKz7h2DMP_iMdTCwQuuSNleIQBDQHOji5qzkf3bhZJVpnoMjQ
Головка рукавная ГР-65 Алюминий,387 ₽,1 отзыв,"10 мая доставит Ozon, продавец Fire-not.ru",https://www.ozon.ru/product/golovka-rukavnaya-gr-65-alyuminiy-400617165/?asb=pN5AZxvs9pNd0UYqbesQMe3ZDcrlz7W1iWekunyZ6Tk%253D&asb2=hSNeCrgn-yE7ntLex-5g18md1_adK-sDO317OSpSh2dU4A-7rGZz_1AWvD7rbDg7
Противопожарное полотно ПП-600,750 ₽,1 отзыв,"9 мая доставит Ozon, продавец СВАРГОН",https://www.ozon.ru/product/protivopozharnoe-polotno-pp-600-348455302/?asb=9UMJXR3%252FS33D6zvonpMES917NbC9ak4gHlZ%252BEIBjXsA%253D&asb2=0__VCAmv3cWEfTOykOmTS3LWrE4s9xkbmcakBavrqvwn9iUJB7ibruWVNS_tUseK
Бытовой огнетушитель Airline,902 ₽,5 отзывов,"8 мая доставит Ozon, продавец Proauto",https://www.ozon.ru/product/ognetushitel-airline-ao-op2-154425084/?asb=xJTnKgx7EBRsCN8f%252FrNEL%252BvAqrGCkAk%252Fh8RT60mFUhsc38Wu7ojExX1Z8%252B24UGK2&asb2=0CJCtZDJBUr_J2R1P33a-VKdIWcxnNn8sSpWcDhfSYyN8dwqSg2Ie5HF4Ift-kSitV8-9xl3f43SDMHcOyhHYDdlhghThvfM65Tx79vV1HL2jOGr6g-p0cnhLANQtLzqLmkCaeTgUQbUOo1smogLEA
Противопожарное полотно ПП-300 (кошма),540 ₽,1 отзыв,"8 мая доставит Ozon, продавец Производственная компания ""Армонс""",https://www.ozon.ru/product/protivopozharnoe-polotno-pp-300-koshma-444596653/?asb=pq%252BrgVG42wCKcAHXZ%252F7y540q%252BbiVXBqpr7jwInhaHEw%253D&asb2=CzhLmazW-j2QdM4x-g9CZj6HkZ1rxSmKsgmHDRUfewzTNtZwDI6-D33bF10EA8dy
"Переносной Бытовой огнетушитель Ярпожинвест, Порошковый",870 ₽,1 отзыв,"8 мая доставит Ozon, продавец Trialgarag",https://www.ozon.ru/product/perenosnoy-bytovoy-ognetushitel-yarpozhinvest-poroshkovyy-521882654/?asb=%252FhlPUc7i1KTWZLO%252FGtC0ZkQgUnLHskeS5o5snM6Ssvs%253D&asb2=lVrfHmVpnHV4CKHWIcRCT_QtnPDhe_qbIy5B3HfVdUtHvUnYleTTdeHCn1wFWQCa
Бытовой огнетушитель Airline,908 ₽,1 отзыв,"9 мая доставит Ozon, продавец Княгиня",https://www.ozon.ru/product/bytovoy-ognetushitel-airline-253254818/?asb=qdzpUG2cb8h3CByRfy40FYk3mf8DBDaVPuDxBEUXjZ0NZIy4f%252Bdh%252FGphZOBADWU4&asb2=Kam8pZE0Cfz8W81ybMrQ2fUTU9Nk6AqEh8oAN-mo4hvawdMEoXpjElgLqvIUqJ4u7cjFNtjg7owhwGUsGs25hHCr5_cezD9e3NbnIk3bCvzfXiBBeWYkgP5Waw5_cuao5QUxPjOXv8SJSLjJvG1gLw
Подставка для огнетушителя П-10,501 ₽,11 отзывов,"9 мая доставит Ozon, продавец ООО ""ТАЛИОН""",https://www.ozon.ru/product/podstavka-dlya-ognetushitelya-p-10-181698293/?asb=hTjDJiOSyRAJ2ZRTDF2VONwsoHCzhedbn0UX4fRXPVU%253D&asb2=2DhUugfhLCYP_AQ1OaHOOhkNOTLE4iaUWYPpsFPu5KsT3TOq1_shAVMbKZOgeuiaWQzmC5kkBRGfzdRzojqrbg
