"Многоразовые пробки для бутылки вина, шампанского, масла HYGGE 2 шт, сталь / Пробки для бутылок / Пробка для бутылки шампанского / Вакуумная пробка для бутылки вина, для шампанского / Пробки для вина / Винные пробки / Новогодний подарок на Новый год",375 ₽,135 отзывов,"Завтра доставит Ozon, продавец Hygge",https://www.ozon.ru/product/mnogorazovye-probki-dlya-butylki-vina-shampanskogo-masla-hygge-2-sht-stal-probki-dlya-butylok-probka-213262202/?asb=MKoUEI6UESoSYnwLiVqmFluLSWbaqA0SYMsb5ECGce6f2M2lfimXiXXbXS7OgFHz&asb2=ehfFwnIiRahdllDufEbpcNdh6-px3MHtJ88A-Y5wn4aTix8ojYJFx_Plwb4RiCTluxMhHGa3-r8gYE0q0fiQYbRld-EHyz5pRmF-Ug4bdZCmsjBU4vuC3hLb2XzPsOjJ
Пробка для вина Сердце/ Универсальная пробка для бутылки,161 ₽,41 отзыв,"Завтра доставит Ozon, продавец Keto Home",https://www.ozon.ru/product/probka-dlya-vina-serdtse-universalnaya-probka-dlya-butylki-349474639/?asb=m7Zkw1HeGiqz6jVTbmFjP7Una%252BFmwF6ItXgOgN2Huh4%253D&asb2=RRsJ7LYwZTV9WY-2KaGz_rdq9dDRyEww_tDFZ-X07vgGHby7yboNIVjSEOgIJ14V
Пробка для вина и шампанского вакуумная,218 ₽,14 отзывов,"Завтра доставит Ozon, продавец Товары широкого потребления",https://www.ozon.ru/product/probka-dlya-vina-i-shampanskogo-vakuumnaya-383047780/?asb=uZRL3Nu0VhBwagYs2Rf3%252Fw56A7JESIGaFbCnQYGYwKU%253D&asb2=tasUPdvRWOqH58qMqI27dCV54MOIIqFIRlhvArSqj6hoU1leDcbYvnCDGWfslA-N
"Дозаторы для бутылки вина (Пробка - аэратор , гейзер барный для масла, сиропа, соевого соуса) набор сомелье 2шт",170 ₽,12 отзывов,"Завтра доставит Ozon, продавец ИП Ремнев П.В.",https://www.ozon.ru/product/dozatory-dlya-butylki-vina-probka-aerator-geyzer-barnyy-dlya-masla-siropa-soevogo-sousa-nabor-499104059/?asb=Md9nFivzpGBpETA5XA6HMlfWauxMdcEoJJOrz8d3b7%252BXQk82TBkhFU7Beb9OLnOO&asb2=0KbBceAhTbR4Aw6K6RYFBJdhF69rvJ4M1UTGrLvQRWhtn_EpAQSxIT3pRinme0G95V7ONlwWn6Y76XpQAkvUNDeFwsd9h6f__2YU2l-2cLuFVov1DYi5FVbDfmG-VAmm
"Пробка дозатор для бутылок KitchenMaster, 2 шт",225 ₽,81 отзыв,"Завтра доставит Ozon, продавец riders on the storm",https://www.ozon.ru/product/probka-dozator-dlya-butylok-kitchenmaster-2-sht-302634409/?asb=HdzzXu%252FEKDTgq5KMx1PMbTbKlbV%252BXtr%252BGHNdRUK2i06lTHo7gagxduzHEEEW%252FPJC&asb2=TH0Yu6KR50aUqFmSZDlw-042gsvaxxW29fXgVkFHTHHg5sJQ4B7XYx-L2-lzVnvS7apZP6WxWD_tMg-2MaFpyAOCdr-_M4Ji7a8BIZbDCGG_FxCfiMr38KuWnwa2RkMpIhaxaZmh6UHXAAK1SDcWMg
"Набор корковых пробок для вина Gadgetut, 20 шт., 3,5х1,8",379 ₽,50 отзывов,"Завтра доставит Ozon, продавец Gadgetut",https://www.ozon.ru/product/nabor-korkovyh-probok-dlya-vina-gadgetut-20-sht-3-5h1-8-246992300/?asb=2jnOERH1z2RCBhQCdEJhhRPxOZYcE7kPk6yxI0l%252BEGk%253D&asb2=cup9hrEBtsK3LIeRk8aMIr91Pc83d1TV8OVvrDux-E2Y_vsrFTS_xrUaliz5VZIl
Гейзер для бутылки,611 ₽,18 отзывов,"Завтра доставит Ozon, продавец Food Star",https://www.ozon.ru/product/geyzer-dlya-butylki-474309435/?asb=9u5cLlYkpItT%252FF7Q%252BzmDnH4aGGPHYP4Tf6w6BMs9N70ZKfeL1yp5LfBRexaKv96c&asb2=HFgKD0-_yLcEtRGqO0jPzjzfUluXjEcaxQe7pSlgIANRmF3m7CmLOlq_HA04GLrH8bRDMh1nb85KtQW-erorWjLjULxJj5_BTaOILCfeuCLiqEO_F2t9qeyhiO3le9R0M-YRjB9_NNVRs1WUZ0MrpQ
"Пробка силиконовая для вина Pozitiv, 2 шт",215 ₽,139 отзывов,"Завтра доставит Ozon, продавец ФЛОРИН",https://www.ozon.ru/product/probka-silikonovaya-dlya-vina-pozitiv-2-sht-236900136/?asb=78Ze46A4fkduwpLrF2MTPqlF5dey5LCLrrSzsuBSdsU%253D&asb2=gUpIrIuIuh_-RXF9h2o4MKaoGNn4pAOQH6Z1AT6AgTzD21aoKMN7jCT4AKwWRDxl
"Многоразовые барные пробки для бутылки, гейзер, дозатор для вина, масла",323 ₽,28 отзывов,"Завтра доставит Ozon, продавец AMO",https://www.ozon.ru/product/mnogorazovye-barnye-probki-dlya-butylki-geyzer-dozator-dlya-vina-masla-357720106/?asb=Mqp7ZmmdBdzghH4UkHpHHffG3Ksl2Ckhb40P5GcWiQ8%253D&asb2=hIdsfhMulT_FVlF9x-t_EIgVbWe-M043xp8cDWa1ABDOLQYg5MOHYuDMSb4WvxCx
Крышка на бутыль 20-22 л. / Крышка бутылки с резьбой.,170 ₽,19 отзывов,"Завтра доставит Ozon, продавец ИЗИКО",https://www.ozon.ru/product/kryshka-na-butyl-20-22-l-kryshka-butylki-s-rezboy-378436252/?asb=uQGglwkjqt%252BcQGaVefBmynLSzh532fVTbsi%252FcmlPKcM%253D&asb2=GxwvuxyvZI0gDQK5xRHpFzFQVwuyIcuqBTpgctXtdjPUnaIWv67m7IpHxOGtHtn2
Пробка для вина стальная,271 ₽,7 отзывов,"Завтра доставит Ozon, продавец Южный Берег",https://www.ozon.ru/product/probka-dlya-vina-stalnaya-233240852/?asb=o3rgeR%252F4hp%252FzgBf8RGv%252BkvEwztzFRY2ipsAQgBp%252Fq7Y%253D&asb2=zmiW2oqZxfbkgsbAoA_LWLSY8QAWKnvGOuBMyWfXQs2u78bH44Z1hlmp0h010A7r
"Набор пробок для бутылок Walmer Home Chef 2 штуки, цвет черный",389 ₽,27 отзывов,"Завтра доставит Ozon, продавец Домострой",https://www.ozon.ru/product/nabor-probok-dlya-butylok-walmer-home-chef-2-shtuki-tsvet-chernyy-321089716/?asb=1G6zllYQQasbwneGH7ceXAj8uzf%252F3%252Bq6qMB3H321QCh3VsCbeqGaUUtswDtgyTr2&asb2=E9cUM1E5nuKwU2PKk2vch_xKgjSWxpnwqR44JEC5k-vtJCpwgSllepZxHNLGfUidgLAFQK9992qeIXyRXzhelIlH7i_9LZrMkT2i1HEtrwh_d-mblH9KmgKloG1WxneAXh0ksGs4NoFqlfYRrGbX4g
"Большой уплотнитель для гидрозатвора, для бутылей 20 л., кулер",289 ₽,87 отзывов,"Завтра доставит Ozon, продавец Pick&Nick",https://www.ozon.ru/product/bolshoy-uplotnitel-dlya-gidrozatvora-dlya-butyley-20-l-kuler-304406289/?asb=XFSHck8P6FXenN5y96lkEYtK9FoN%252BHqedStcNMHB%252BYM%253D&asb2=hlZEdpGDOJbn7pdBoDdUa6iY8yp7q4Gcx3TOsDWWhUVr8aWXQ5zs1QJR4ev2FPsX
Пробка для игристых вин и шампанского,399 ₽,140 отзывов,"Завтра доставит Ozon, продавец V&V GIFT",https://www.ozon.ru/product/probka-dlya-igristyh-vin-i-shampanskogo-249136090/?asb=VtDVpRhY9nuYT8ICWToLttheE%252FfsH1XlpE8C%252Bhs%252FjkAAoywYudDGpmFjeXy0L%252BY3&asb2=wJYLCHnFPGQSnNtadJiv3XdbJhKfnRLpzUNuwM6bWHitgdbKMh50TN7fvjWNkdWmZf6j3XcyU2HW4deyl6pFsrVVkno1gO9LXezJA9Faa2wdaXAcSIO1liDQezArr8a48gAhuhW_VzNmcbN0xtAC0Q
"Гейзер металлический для бутылки, пробка дозатор, Дозатор для коктейлей/Пробка для бутылки/Гейзер металлический для бутылки/Дозатор для коктейлей/Пробка для бутылки/6 шт",499 ₽,150 отзывов,"Завтра доставит Ozon, продавец Южный Берег",https://www.ozon.ru/product/geyzer-metallicheskiy-dlya-butylki-probka-dozator-dozator-dlya-kokteyley-probka-dlya-butylki-442109503/?asb=lmBsOT6PLbihWx4G2f4smLDMs%252B91gEWLdfwRx3G5CTY%253D&asb2=tQ5CvFEr7qYAgVZzrG679mspLZkYn4xmS2SehPdlkt5ubOevG-Kko5q34iZc5hm0
"Набор пробок для бутылки Walmer Wine Time 2 шт, цвет разноцветный",349 ₽,40 отзывов,"Завтра доставит Ozon, продавец Домострой",https://www.ozon.ru/product/nabor-probok-dlya-butylki-walmer-wine-time-2-sht-tsvet-raznotsvetnyy-324431430/?asb=dQSd1YeD3SpamxttzK%252F9fwxNguTy4ZrFyGFcJGdDBSOhRryIM8yAHYUI73eZaHYN&asb2=A03Q7hUT9E1uMXolG0i53Wv3aItw0ngejNOn7eSZlIj81WsO11xE9KGNwS0sELH1-vYsP0_F-ghhauVV-jvPsJoEEHpw3JElviVy78JDamDqtFOGkxxOuS3857VJ7mZQEankfEpmwek3F3liL6vy0g
Пробка для игристых вин и шампанского в бутылках с фиксатором,265 ₽,50 отзывов,"Завтра доставит Ozon, продавец Товары для дома №1",https://www.ozon.ru/product/probka-dlya-igristyh-vin-i-shampanskogo-v-butylkah-s-fiksatorom-283389553/?asb=K8QlnYQU%252BSrYJH6Wr4iPnGEUOE7raS5auu2%252Brle1h2C%252F7IPk7WnTFNbqR4GXGbB%252B&asb2=s9labu9v1t9fC2LvTp78H1H1aH_8T5K-uZ9S38LTbY16C0fmis9hXXaDraf-4az7-O9GMoOL3BWqlx9ABHQsgQcdgollUEQRu9NwJd90Ozqn8coGPFFch3VNK7D6T5rVUslDZBmz-q6LjQ4AoUAltA
"Многоразовая пробка APOLLO ""Rioja"" для шампанского и игристых вин",359 ₽,46 отзывов,"Завтра доставит Ozon, продавец APOLLO genio",https://www.ozon.ru/product/mnogorazovaya-probka-apollo-rioja-dlya-shampanskogo-i-igristyh-vin-229714779/?asb=bVI7GpsO3wTYZfRbiTQdqMVp%252BTn702ulmuDDowunAtM%253D&asb2=SHwRWttn70tTXtMpaGb-f4WxjDNo3qepT2tbS3kZpmNNdCCeIEakoKWsg2-7EnbV
"Пробка для бутылок ""Мультидом"", 2 х 2 х 3 см, 2 шт",162 ₽,57 отзывов,"Завтра доставит Ozon, продавец ООО Мультидом Трейдинг",https://www.ozon.ru/product/probka-dlya-butylok-multidom-2-h-2-h-3-sm-2-sht-164019703/?asb=GjeYpqH5LFJPcuyPEbWipewFaA9CwOAqdfKet%252FhP40o%253D&asb2=-sa-AUtrud2H37HF7wLW0NEf4J4OMZuTJPAvtq4zwbyEe_Wmibs-RGhZhpiMIiHE
Вакуумная пробка для вина WINSHOT,369 ₽,27 отзывов,"Завтра доставит Ozon, продавец WinShot",https://www.ozon.ru/product/vakuumnaya-probka-dlya-vina-winshot-306537538/?asb=AQYz7Ja45Mik8I7WraSynb4HFbF%252Bxwr7XZ6Mxt3%252F174%253D&asb2=5mFrIMo3qtQfFQUMqRO7BtDbKpuhtwOso9qO6uTnyik-7VWxL8JwB770wCUsvCGg
Пробка многоразовая вакуумная для винной бутылки Avocado+ 2 шт / Пробки для бутылок / Многоразовая пробка для бутылки / Пробка для вина / Пробка для шампанского / Винные пробки /,407 ₽,38 отзывов,"Завтра доставит Ozon, продавец Avocado+",https://www.ozon.ru/product/probka-mnogorazovaya-vakuumnaya-dlya-vinnoy-butylki-avocado-2-sht-probki-dlya-butylok-347912516/?asb=Vnfm856AVBtRWndNBS9F6PZpBqUxUkakPU5pKLf7qbZm8pPVObKYn3fNJqwQj9Fi&asb2=SxDhdtH0BE7kQ3ix-cBPk5yRrMNzqdZaPA9TxE78H3zAduA-RH_t7XvdQdHZpoI_uvPHg4PE6xuazO9rddMkt0XZlYyoU4ytHL22HcP4_0ZVynEEG649l03j0BLam2XuTJ6sAWSTlBqJpRmlXhq0WA
пробка из нержавеющей стали для бутылки,93 ₽,5 отзывов,"7 мая доставит Ozon, продавец SweetHome",https://www.ozon.ru/product/probka-iz-nerzhaveyushchey-stali-dlya-butylki-491340365/?asb=RISpVmYnhWmiJcpW3NVO%252FZ6OrXB3HJPHd%252B1MJhDysSw%253D&asb2=WLFJOVMWxUYvUr6jHiJUuEikdTBmkiPGJP7G3Z--KKuFbq7naHmO9Fwiuu9p4NUb
Гейзер для бутылки,144 ₽,18 отзывов,"Завтра доставит Ozon, продавец Food Star",https://www.ozon.ru/product/geyzer-dlya-butylki-466146215/?asb=zXbYBTuMwcSBbX946nppxouNluYwcVHl2Mx9gWt7NtRF8qip0lodzgfktr7w9C4W&asb2=X-NPkacJ3VG8XWQhmozjyfqWAvNQ-2rQg0geJIgw2hGKiB432HmuEJsP8c04DrNYJlQ10BRHMowYIEcpSFzWJMuujU1mbBxkQrwz-CFKu1bRiz4RZrf1Pa0Oh7edTR3m9NopKy62nYnjnuWBzWOYFQ
"Пробка вакуумная для вина ""Блеки"", 5x5x6 см, цвет чёрный",177 ₽,1 отзыв,"Завтра доставит Ozon, продавец HOME STUFF",https://www.ozon.ru/product/probka-vakuumnaya-dlya-vina-bleki-5x5x6-sm-tsvet-chernyy-532874724/?asb=EWx5PUJmlon%252BAu%252FPjJpxqVbFStGnSIdcldcPlCh1gck%253D&asb2=iyIO_f-7OcL2gocutdHPMTYN7EoTdSX-l5VjoOJpvA3Ve8tHMHNFuyHmsDVjlsqa
Fidget Go/Пробка-дозатор,137 ₽,3 отзыва,"Завтра доставит Ozon, продавец ИП Семеш А.Я.",https://www.ozon.ru/product/fidget-go-probka-dozator-185355988/?asb=VYVuAsxZAkxWFFXE3mhSGrVNbEHJlcl2K42MrrU0Cao%253D&asb2=HYGMx-k2XgILGMwi_UJ-X5Aan2Yn6VuxeGM0Fsamxypi-7bgIWTD__vwqPbbH1GK
"Пробка корковая винная 23*35, 100 шт.",890 ₽,9 отзывов,"11 мая доставит Ozon, продавец Самогонщик&Садовод",https://www.ozon.ru/product/probka-korkovaya-vinnaya-23-33-100-sht-271633515/?asb=84A5WEjRr9UCGoNwn6SONn7FPD1GssVXn2BXDBp7GbXYhOKiO0OT1UP3Oe7yk3dV&asb2=AgXwaY2kND1ToDibQG1ERxE9BQTYihb1Vdr_lgk6N_yHQHdajmeXEVJsEYnsLpTlLKb9cPkpPix9CbcDAMahks_qI0ejc26tZyWvVPWmOiYPtfsqW3_SCxeHl5gK-HAYfOxb-cxwtUneKWOq7kw5Mw
"Пробка для бутылки Шар, 9 см",207 ₽,50 отзывов,"Завтра доставит Ozon, продавец T-Groupe",https://www.ozon.ru/product/probka-dlya-butylki-shar-9-sm-192409799/?asb=C1oRhJH52xHws5CNm9adzOGK7IGHoShSehD81mdMGEY%253D&asb2=gWY_f4AAvsxXMtEYYYf2FYf7Mjuleneuw4r4a8Bs_7R2tVuiW6ut9ZTcy3HbV8nn
"Силиконовая пробка для бутылок, 2 шт, Migliores",265 ₽,5 отзывов,"Завтра доставит Ozon, продавец ООО ""Юпитер""",https://www.ozon.ru/product/silikonovaya-probka-dlya-butylok-migliores-155432440/?asb=5Mq3DE3BjsUl5WHJlSxXFyAd8F917RFZISyTaa1edjg%253D&asb2=wa1zBIxOB64p9TkGbzI9SBde35yYhrC7fJGPi8VPHJyW-MWZzEtQCAcDWXuBhysA
Пробка корковая 50шт,495 ₽,1 отзыв,"7 мая доставит Ozon, продавец Вимпак",https://www.ozon.ru/product/probka-korkovaya-50sht-420708731/?asb=qHT6aEJ3%252FjbS0CmPTqUtAHkFA7VNOrHOzWHojTPbhco%253D&asb2=OFOLAIf7WlOiGaRD3g_-ROmADnRtbz47vIEkPO-iqVQ4JEwE2k9yEqkuap1J7-6v
"Набор дозаторов для бутылок, пробка дозатор, гейзер, 2 ШТ",138 ₽,6 отзывов,"Послезавтра доставит Ozon, продавец AKRAVAZ",https://www.ozon.ru/product/nabor-dozatorov-dlya-butylok-probka-dozator-geyzer-2-sht-488370213/?asb=NrhlByZkD6LeZS4F9UKook0eKX8iLk5PpJYQRfAvrJHX3hlzTBZGMOrjBPn3TVvf&asb2=9spfYe7nUnKKrq-bk8MDIvFkfBF7o_6GHGJRQ5DU4WhT-XKPBwlmPp2MkhIKzV0ZpkRKne210pKd46F6rYccGQUZyUboiD2qgGF9xwhsSnB_NIWCNf6VW6644_zvHWgWaNraPS30JJ7EbG7IpQtdpg
"Гейзер металлический для бутылки, пробка дозатор, Дозатор для коктейлей Пробка для бутылки Гейзер металлический для бутылки Дозатор для коктейлей Пробка для бутылки 12 шт",899 ₽,150 отзывов,"Завтра доставит Ozon, продавец Южный Берег",https://www.ozon.ru/product/geyzer-metallicheskiy-dlya-butylki-probka-dozator-dozator-dlya-kokteyley-probka-dlya-butylki-556785842/?asb=NglCNGb5H8RMperVZpgC%252FauLHPte9s1TUPQABTFkUoo%253D&asb2=OFpWyiXwHqrtVgabzvP37KdgOmJHcLGyxqaIvTi9elDu1nJWGvfiuLe3X2cIMC2A
Пробка для бутылок универсальная.,254 ₽,3 отзыва,"7 мая доставит Ozon, продавец Диксис",https://www.ozon.ru/product/probka-dlya-butylok-universalnaya-448084964/?asb=WBKmEcL8sWlkiBEWXkDOw3clJtIqudA3oJpIzHreS5OfnYsKnqjUdDPmH4iYIHxm&asb2=iP8I1G1mgwRJMGOpzEnmRti6KkfMdpDW5ZSYGgqkLW6QAZtb41iNeKKUywPblY75hNA3pvgVKa53DNnggf0yIwQly9Brp5pGbh1uofUKoY2cDbFjdrwrTIfobmJwweyhPJs3EgkvlPby0cepHGXK4w
"Пробка для бутылки Камю, золотистый алюминиевый верх, 18,5 мм (20 шт)",316 ₽,3 отзыва,"8 мая доставит Ozon, продавец ИП Кузнецова О.Н.",https://www.ozon.ru/product/probka-dlya-butylki-kamyu-zolotistyy-alyuminievyy-verh-18-5-mm-20-sht-425656277/?asb=agZyR%252Bo2shBvqAIrymstoK8Ggcmddi%252FpoGLkhlihS%252Bk%253D&asb2=4zWkzIeVw7qHn4CEMZVFtY3CV8wnPj-lWR0c-HccDcdsakvLc64b-bU80Jk9oDLm
"NEONOLY Многоразовая пробка для бутылок вина и шампанского, винная крышка, в виде сердца серебро металл",230 ₽,175 отзывов,"9 мая доставит Ozon, продавец Магазин распродаж",https://www.ozon.ru/product/neonoly-mnogorazovaya-probka-dlya-butylok-vina-i-shampanskogo-vinnaya-kryshka-v-vide-serdtsa-342367461/?asb=8OZkqs9a891dsUYXss0f%252BPGtUDyNeruZGANkmQCtD%252B4%253D&asb2=tGFxjgcNUzmxk6HXkcES1YXkbErotClzgku2PdvTBImQ5FmLZnzx40V4XvhyoabQ
"Пробка корковая, конусная 40х40 1шт.",308 ₽,3 отзыва,"8 мая доставит Ozon, продавец Новопермский пивовар",https://www.ozon.ru/product/probka-korkovaya-konusnaya-40h40-1sht-417882290/?asb=DuokMFeMJ9AvsjMXzVF81XrD9i3ZaS0VgNarAFvaJq0%253D&asb2=x7Tm4vxsfS782mv8T-QQMKlUp6p8vZ35-wP_hwPX07jxe4aUucT8xa4xBuqDx4-k
ПРОБКА Дозатор с КРЫШКОЙ для Бутылок,150 ₽,1 отзыв,"Завтра доставит Ozon, продавец Multi Goods",https://www.ozon.ru/product/probka-dozator-s-kryshkoy-dlya-butylok-490256623/?asb=dHMgQpA%252F1EF3vNXYdFJSONU%252BN8%252Bpn30GDNXY0l9utpQ%253D&asb2=oK7c7lGLjHmGxjXXzUeumbN5RvN7H66ZiFCsHckEKdSoYZL3afgHNvPn9MHta50W
"Пробка корковая, конусная 45х40 1шт.",323 ₽,6 отзывов,"8 мая доставит Ozon, продавец Новопермский пивовар",https://www.ozon.ru/product/probka-korkovaya-konusnaya-45h40-1sht-417882690/?asb=DnivBiOHE3NQVCxKz4WfvEHxxG5L45JtFu7phSdyS1g%253D&asb2=wGGfAXKhSorEPH9X4gpx92wg4K6OUa9GXT8QDVTG1acwDJBPI3BADub8ChsSV5xK
Пробка для шампанского и вина розовая / Пробка для вина / Пробка для шампанского / Пробка для бутылки вина / Пробка для спиртных напитков / Пробка для бутылок,288 ₽,9 отзывов,"Завтра доставит Ozon, продавец aGoods",https://www.ozon.ru/product/probka-dlya-shampanskogo-i-vina-rozovaya-probka-dlya-vina-probka-dlya-shampanskogo-probka-395300793/?asb=Ta6t5T0ylpHKCcuX7Q6wc7NsNwp2hM3qcq%252B3teyF9cg%253D&asb2=g4F1JJa_0rdynHkdj2pxjqMnINLoCoCX0z2Hpy1raNHpTixioKP5LCabkpSPD-ss
"Пробка для бутылки шампанского и игристых вин ""Close"", пробка для игристого вина, винная пробка для бутылок",317 ₽,6 отзывов,"Завтра доставит Ozon, продавец DENEZO",https://www.ozon.ru/product/probka-dlya-butylki-shampanskogo-i-igristyh-vin-close-probka-dlya-igristogo-vina-vinnaya-probka-293717606/?asb=7DBlSNmvD9CmnsVdfUsxIs6T4FEieY7Jlb4F%252ByX7cIG8Oyfc7qWusI1rpcQ5s61B&asb2=A3ItaQoP0FPj0LJda9imeq2Ay9vEgGX4BaC3fz3Is5QrR8xQJfMGPH0n-7wNMch-EeO_WvvJuqc_RpKT_5gT7a4BbiwT9p5dSI7ymLyT9YvI_3mFPWugzGFEJs9VCrU2JzrGXWZEjRtYweDojK_jvw
"Пробка для бутылки ""Бабочка"", 10,5 см",241 ₽,10 отзывов,"Завтра доставит Ozon, продавец T-Groupe",https://www.ozon.ru/product/probka-dlya-butylki-babochka-10-5-sm-307096949/?asb=yFs%252Ba1Z8pX5ybUlXUn7Jmi5ulgEF1AhP1zP4apdnwC8%253D&asb2=LjWV4DI_tkgrbUZHZdD3tvsK4OIOjLrPaijyDrYoPtEnXN5ccouXsIVD3QcC1aPx
"Пробка для бутылки Камю, колпачок под дерево, коричневая, 18,5 мм (20 штук)",316 ₽,1 отзыв,"8 мая доставит Ozon, продавец ИП Кузнецова О.Н.",https://www.ozon.ru/product/probka-dlya-butylki-kamyu-kolpachok-pod-derevo-korichnevaya-18-5-mm-20-shtuk-425626486/?asb=CFekn80aegYRRNBq4D%252FRHlINzaH70XLfqsUKjx00rqY%253D&asb2=FTxCiANc3MkUMDQtjPq4EVuwSDlP5y5QnJJ4KJTXr4au7y84EA0j9tDfnleFrYLs
"Крышка 58 мм на бутыль 20-22 литра ""Кладовая Василича"" зеленый, 2шт",220 ₽,3 отзыва,"Завтра доставит Ozon, продавец Seal Store",https://www.ozon.ru/product/kryshka-58-mm-na-butyl-20-22-litra-kladovaya-vasilicha-zelenyy-2sht-471164579/?asb=qn8llvHIe2Ug5V2SRM%252FOIvVgeA%252BKttwLkoLdJ2sW7Rw%253D&asb2=vSxSLkmfIaK8CLBUoey-mV4zB4rYMRadSAJhiYskyHmDP8rztF1TXIhVe-I-jgVg
Пробка вакуумная KLT SP-011,350 ₽,23 отзыва,"Завтра доставит Ozon, продавец ROMADA",https://www.ozon.ru/product/probka-vakuumnaya-klt-sp-011-252720488/?asb=8CG7wb6v5FB7wPryw0Ay4TWlGfgw3zEUWg%252F1Wn44h3J3uQBbeMYWL%252Bz0207RS6TD&asb2=vcumIP-9ph1Zj4OvUG5Gyfl16aOlBjRLKU1VgkSSScDfAfLQXQ-1kSjCMCyaubpykOlQQzKZYBHYovh_GzooiUvxzMU5gEwkV3eWNdAYQyMeHPThGff286IYhe9MDfeAB_YJS-gENKRxBoiH2PX0Zw
"Крышка ""РЕАХИМ"" с прокладкой на бутыль 20-22 л / Крышка на бутыль 20-22 л / Крышка бутылки с резьбой",249 ₽,1 отзыв,"Завтра доставит Ozon, продавец IKOM",https://www.ozon.ru/product/kryshka-reahim-s-prokladkoy-na-butyl-20-22-l-kryshka-na-butyl-20-22-l-kryshka-butylki-s-rezboy-496446960/?asb=cuubnOxGcvdPnjLw3d4VQI6zC%252BApcFeFlJppBINwMaA%253D&asb2=Vceslrk9kKvi5ZZdhBgbWQN_NR6-Vl5sXoRiyNv1zrk-pBaoEtaRKD8opmgPJ1pw
Вакуумная пробка для вина Circle Joy Wine Stopper Silver,833 ₽,31 отзыв,"Послезавтра доставит Ozon, продавец Circle joy",https://www.ozon.ru/product/vakuumnaya-probka-dlya-vina-circle-joy-wine-stopper-silver-190429664/?asb=CkhC4IexWjsiLdkCAlyn6np56q7gtU4ySlkl59fhrhwrg5a8sJjMm1VhV90riXds&asb2=s9sSe4Wrkuu7SOWZN_sApjj4yu-cEQo9QoLw5PbU16dn40pqEiSszAoBISOK-StBXZQjqjt-ZbHTQo2MMZJJzP6zslv3Ijo0FV_2RHG7NTvaSmv67o745J5vvzFlLekfT5Mz2D2WOIN9ysEEReRVOw
"Термоколпачки короткие бордовые, 40 шт",368 ₽,41 отзыв,"8 мая доставит Ozon, продавец Пивикс",https://www.ozon.ru/product/termokolpachki-korotkie-bordovye-40-sht-355333998/?asb=Q4PgK0w003sp%252Bs%252FsXl9qLcCclw6e3cHiOX1e6bTAOcg%253D&asb2=alshx5M0uMoc_HMXg5_uo5sP2F2YWv-tlGnMCkVkdSZYLt9yfNGCpqeVxgB5DuxA
Пробка NewClassic для вина и бутылок в виде попугая,599 ₽,9 отзывов,"Послезавтра доставит Ozon, продавец Армасток",https://www.ozon.ru/product/probka-newclassic-dlya-vina-i-butylok-v-vide-popugaya-259040543/?asb=HovxI0ST%252FDtOO%252BAARnU%252FsFOMY1n%252BzVsWNDuivTBMqE0%253D&asb2=sy-bjMwpPT_EscW-3nvpLjxn_a4Lg1kUPV9TLtEgLz7LaHOmKDyhKYBJJ4lE6K3c
"Термоколпачки короткие черные, 40 шт",368 ₽,41 отзыв,"8 мая доставит Ozon, продавец Пивикс",https://www.ozon.ru/product/termokolpachki-korotkie-chernye-40-sht-355310455/?asb=xfYPJw89JYrFPVAYj0uStY1BAIsV9EkxomM%252FoKpgdKU%253D&asb2=MydeIlGA43jRVetr7HY6NUHXkPHe-uizZx5qClqqBxM6SfbPaGAN20xdsflF9HHt
"Пробка для бутылки ""Кролик"", 3,5 х 3,5 х 10 см",461 ₽,11 отзывов,"8 мая доставит Ozon, продавец Let it home",https://www.ozon.ru/product/probka-dlya-butylki-krolik-3-5-h-3-5-h-10-sm-228299500/?asb=BQ3YOpkipvCyjglexE47V7WGIGMBn7JbMCYMOqdDyeg%253D&asb2=jeK4vmyikZovgoCBKSXA33mlSzX-0pnlFGPctuK2GKu603_Rt1hSjA23Gv8CDCHl
Вакуумная пробка для вина Circle Joy Mini Stopper Black,972 ₽,36 отзывов,"Послезавтра доставит Ozon, продавец Circle joy",https://www.ozon.ru/product/vakuumnaya-probka-dlya-vina-circle-joy-mini-stopper-black-189466238/?asb=vanpFlzySXcOMa6THd6qk3EMKcN6CpKYv1dNOSZxn64%253D&asb2=n2KfRYhCLa010NzIA3fyHx9gzFpvDRk9Eyxl3dS_4_O5-ln7bdckbB6uIBN5knNm
"Крышка в сборе с вкладышем к Канистре 5;10;20;30;50л ЕВРО, диаметр заливной горловины(резьбы) 50мм, шаг 4мм УЗП",113 ₽,1 отзыв,"7 мая доставит Ozon, продавец Еана",https://www.ozon.ru/product/kryshka-v-sbore-s-vkladyshem-k-kanistre-5-10-20-30-50l-evro-diametr-zalivnoy-gorloviny-rezby-523499343/?asb=8WI0WVYIcTH70itXU7HJhYdujeJY5PVlGnFdkUKkIwQ%253D&asb2=wSOoub3qEVWp69kVvojhGu_nFQAVdPbNFFetXYamYRefjgyatX851NeL_Y1Op4y8
"Набор пробок для 19 л. бутылей, 10шт",261 ₽,12 отзывов,"8 мая доставит Ozon, продавец Present Shop",https://www.ozon.ru/product/nabor-probok-dlya-19-l-butyley-10sht-317410821/?asb=3m8EXgnpzo2REBe5iebYFDHDcNJa4iORvZU8mGwWgVg%253D&asb2=wt3IF0lr3oc1pqeRC171HhAdEFnLRrapwO1FTBRNngSrIw9jdIaFbnaMb-vhVd9m
Вакуумная пробка для шампанского,279 ₽,1 отзыв,"7 мая доставит Ozon, продавец Самогонные аппараты",https://www.ozon.ru/product/vakuumnaya-probka-dlya-shampanskogo-305983430/?asb=IUIc9QCQiMdWv74kLSyMHnTETneiU6dm5goL7KoYP1s%253D&asb2=Eoku5oRqHMSFARCgbtqPNGpf7mKL4CG8B4nDgcm6kMFY-OtxbxBsmGHvwTWcLh_F
"Многоразовая вакуумная пробка APOLLO ""Otara"" для винных бутылок",399 ₽,6 отзывов,"Завтра доставит Ozon, продавец APOLLO genio",https://www.ozon.ru/product/mnogorazovaya-vakuumnaya-probka-apollo-otara-dlya-vinnyh-butylok-229715687/?asb=ZI5jnHpfGiXdMh486bo1tL8oSfhwVA9bp4%252FnixQD3%252Bg%253D&asb2=gNNcXNwGY0ebvt8DgSBXo1UjfupObh43n8CnHHmCG1T3ojYH1GpBmhOtV6vhKHYD
Вакуумная пробка для вина / Черынй,614 ₽,11 отзывов,"7 мая доставит Ozon, продавец Discount Market",https://www.ozon.ru/product/vakuumnaya-probka-dlya-vina-cheryny-522744945/?asb=lRamug1wA4Nvew%252BBBWgcv46ItwKBtHIVx7%252B7clbO4jeWQ5vDdgjD2bAjgJHsLA0G&asb2=IGOUt0LQ7wRkOcAhdIMQhEyEadecMAY14WpdJrsl9FUIQ8NvdLvdjbrW4AEF8mH1OuLjRZi-D-URBxDDqJ77kOZZCStHD6YCWQbCk2yXk2QUX6FBVz_0IBEHaDBhIOBe
Пробка для бутылки с маслом,121 ₽,16 отзывов,"7 мая доставит Ozon, продавец SweetHome",https://www.ozon.ru/product/probka-dlya-butylki-s-maslom-456538824/?asb=4RPAmNdYemQPFQY%252FbrGf%252BNVWPubMZPIj0JZR7978j%252Bg%253D&asb2=zXb-YuqG-f4QBguolDqFnPTq50IP5MONCm2V8pORxHetjHv1hMCCe7hpecfJmrES
