"MERTZ / Ножницы парикмахерские филировочные. 17 см, 25 зубцов",239 ₽,103 отзыва,"Завтра доставит Ozon, продавец MERTZ",https://www.ozon.ru/product/mertz-nozhnitsy-parikmaherskie-filirovochnye-17-sm-25-zubtsov-308061646/?asb2=KnRgmwQz_kWXxaiZDic8YGNHhy3ClFfGkw2U6olXOYjKdWsDo4CBPPbp38LKN-jt
Пеньюар парикмахерский / пелерина / накидка для стрижки,350 ₽,190 отзывов,"Завтра доставит Ozon, продавец Фабрика текстиля №1",https://www.ozon.ru/product/penyuar-parikmaherskiy-pelerina-nakidka-dlya-strizhki-320526828/?asb2=xaUA3dsa-uhI8mnKayXFCOLALCHIiyhT05boakoVoP1C6rpo2LzqMQaQUTOYfwqzE-6hI-p_h1sAX1IfL_5hnw
Венчик профессиональный для смешивания краски и составов для волос,149 ₽,144 отзыва,"9 мая доставит Ozon, продавец Keratin Botox Club",https://www.ozon.ru/product/venchik-professionalnyy-dlya-smeshivaniya-kraski-i-sostavov-dlya-volos-301189858/?asb2=Se9YcsWUXTI1xJ6EcMmO0phQCOP0F17q0CNxEFCQdJRcW0xRPJnuERuQ2byg33yB
"Queen Fair Ножницы парикмахерские с упором, лезвие - 5 см, цвет чёрный/красный",129 ₽,26 отзывов,"Завтра доставит Ozon, продавец Фабрика счастья",https://www.ozon.ru/product/queen-fair-nozhnitsy-parikmaherskie-s-uporom-lezvie-5-sm-tsvet-chernyy-krasnyy-177723029/?asb2=qrFNHC-ye9rkkHf-zgEsUqL7DoOlYkQzCTCQEytBCV3XthSfMMWxbkg9zHX6Hkj4
"Воротничок 8*40 одноразовый в пачке , спанлейс (100шт)",160 ₽,57 отзывов,"9 мая доставит Ozon, продавец ООО""Клин Грин""",https://www.ozon.ru/product/vorotnichok-8-40-odnorazovyy-v-pachke-spanleys-100sht-286062846/?asb2=LdtsRmx4v0qQfwXqHPhkdykHJQRzqMKJw5PGyDB4ourmnfOX8NKmT1zlnSiF4SYb
"Зажимы для волос карбоновые профессиональные 11,5 см, черные, набор 12 шт",331 ₽,181 отзыв,"Завтра доставит Ozon, продавец Keratin Botox Club",https://www.ozon.ru/product/zazhimy-dlya-volos-karbonovye-professionalnye-11-5-sm-chernye-nabor-12-sht-262785561/?asb2=VOR9jVBVeDSzqvUw4EIYTLNU88uihy-7Sr72ldPRQkzuoY_8igSIypsBTvE2MPbk
"Набор ножниц парикмахерских 2шт 17,7см + расческа 12,4см GALANTE",368 ₽,83 отзыва,"9 мая доставит Ozon, продавец 4SeasonS",https://www.ozon.ru/product/nabor-nozhnits-parikmaherskih-2sht-17-7sm-rascheska-12-4sm-galante-263051763/?asb2=S5g748OYaBvMBiEMX_c1ABtMREp5NXT5sn7HO9ZA1s1hS-im9MVNCSAYdHYMS5YA
"DEWAL Распылитель пластиковый, черный, 250 мл.",250 ₽,17 отзывов,"Завтра доставит Ozon, продавец Малина Мания",https://www.ozon.ru/product/dewal-raspylitel-plastikovyy-chernyy-250-ml-409338722/?asb2=rB2O9MAJgRBy5GD-VzZUtqcFrcNluI-b-uogqIAPW9qIgtvNLNHiPkX4p130etja
"Перчатки одноразовые нитрил-винил Wally Plastic,черные,размер S,50пар,100шт",426 ₽,24 отзыва,"9 мая доставит Ozon, продавец Set_shop",https://www.ozon.ru/product/perchatki-odnorazovye-nitril-vinil-wally-plastic-chernye-razmer-s-50par-100sht-504703701/?asb2=wcGk00v8oXhzaMdA5IlKBSuPMnzKrEgqJMq5NGuy_CJetiSh1B5bgu9ZosSDGtoj
"MERTZ / Ножницы парикмахерские, прямые. 17 см.",239 ₽,74 отзыва,"Завтра доставит Ozon, продавец MERTZ",https://www.ozon.ru/product/mertz-nozhnitsy-parikmaherskie-pryamye-17-sm-308038521/?asb2=EFUa53cn0honZUCJVEgs5Iodh7XI34XWeGel23LnUdXuDmwyWBy2bEBqXNQw6ViM
"Набор расчёсок, 10 предметов, цвет чёрный",279 ₽,24 отзыва,"Завтра доставит Ozon, продавец Фабрика счастья",https://www.ozon.ru/product/nabor-raschesok-10-predmetov-tsvet-chernyy-269984020/?asb2=s8-0eoaBhGFAiW3yUYVC3jG9NdGuyZxigaRkIYK70z6a_xS4TRYxAU2l3tGQItaf
"Перчатки нитриловые,Wally Plastic, черные, S, 100 шт, 50 пар",395 ₽,5 отзывов,"9 мая доставит Ozon, продавец Начистоту",https://www.ozon.ru/product/perchatki-nitrilovye-wally-plastic-chernye-s-100-sht-50-par-378823042/?asb2=QU2b__bKZRym-9FQBR5RsIqjES11h1yoFUGbLhX7Q6hHuV9ZJSFqwMe7pizvjIqY
"Полотенца одноразовые 35х70 см, спанлейс, 50 шт",417 ₽,74 отзыва,"9 мая доставит Ozon, продавец ПРИМАТЕКС",https://www.ozon.ru/product/polotentsa-odnorazovye-35h70-sm-spanleys-50-sht-300577006/?asb2=SQeQP5XArvUo3BBxqaf5tTmIaR5bTcxeALDexF-dxZ7AP1-COoxJsg4QEbqa9wjN
Флакон с распылителем прозрачный 75 мл. 3 шт. / флаконы дорожные / дорожный набор флаконов / флакон распылитель / флакон дорожный / флакон / дорожные флаконы /флакон косметический / флаконы для путешествий / флакон,199 ₽,69 отзывов,"9 мая доставит Ozon, продавец La Bell",https://www.ozon.ru/product/flakon-s-raspylitelem-prozrachnyy-75-ml-3-sht-flakony-dorozhnye-dorozhnyy-nabor-flakonov-flakon-454736033/?asb2=RKkbKtgC0lWdvnP_RcQJib6m3hzMiwIOwUVZYaLXFDhOoT5v1ndUkSt912JKNJoG
Пеньюар парикмахерский 140х90 см,312 ₽,30 отзывов,"Послезавтра доставит Ozon, продавец aGoods",https://www.ozon.ru/product/penyuar-parikmaherskiy-140h90-sm-282460660/?asb2=X1EQ-GmYhG8cXr9RjP9teQvs8CfpU3z0l_vdZq0Jdi1-d-9y57ZsVy7sj4GPM2YgLCPABXK7-fuPBJ6ZI3TctA
"ГУРМАНДИЗ Набор резинок для волос черный, 10 шт.",140 ₽,160 отзывов,"10 мая доставит Ozon, продавец РИВ ГОШ",https://www.ozon.ru/product/gurmandiz-nabor-rezinok-dlya-volos-chernyy-10-sht-258620907/?asb2=_QVWukAeVIzkolJRwGyEchO4oqo2i1bPoVgWyUpkIOT-IHe81g94wshWOG_tJ1za
"Зажимы для волос, бабочка, 12 шт",284 ₽,46 отзывов,"9 мая доставит Ozon, продавец Keratin Botox Club",https://www.ozon.ru/product/zazhimy-dlya-volos-babochka-12-sht-260522192/?asb2=XxltowPkRDwm7Y34FnJ0Lfx7y6kcEDef3gbLYiL1kLG_qR8wAB65hwwzIFrOctqx
"Гурмандиз Набор невидимок для волос, черный, 5 см, 28 шт",132 ₽,116 отзывов,"9 мая доставит Ozon, продавец НеваЛайн",https://www.ozon.ru/product/gurmandiz-nabor-nevidimok-dlya-volos-chernyy-5-sm-28-sht-258942966/?asb2=Okd_PCXV68Tgl3xHQMPr29dKjhJg6YJRSPnmusVkLbgnKO3TYhPZ4VBlPM0csUZb
Крючок для плетения,237 ₽,4 отзыва,"17 мая доставит Ozon, продавец Paints",https://www.ozon.ru/product/kryuchok-dlya-pleteniya-393256208/?asb2=sEHLzbRSlmEbLRsLb1eqPo1HAgKy_bvHDVBmHCOL_xBiFGd4Q4rAW-QoOeoKmSct
"Пеньюар парикмахерский ЛАЙТ одноразовый, полиэтиленовый 160х100 см, накидка для стрижки прозрачная, Чистовье, 50 шт.",378 ₽,99 отзывов,"Завтра доставит Ozon, продавец Планета Солнца - Чистовье",https://www.ozon.ru/product/penyuar-parikmaherskiy-layt-odnorazovyy-polietilenovyy-160h100-sm-nakidka-dlya-strizhki-308377182/?asb2=AL5x1WXD7JQqHIjpzhosl4UozaLzUvn9solsVj-xr2R557TRvBysVywXmv_EWJDq
"Набор флаконов с распылителем/дозатором прозрачный , дозатор для жидкости/парикмахер/100 мл спрей, 3 шт., для антисептика и т.д.",250 ₽,129 отзывов,"Завтра доставит Ozon, продавец PROFI STAR",https://www.ozon.ru/product/nabor-flakonov-s-raspylitelem-dozatorom-prozrachnyy-dozator-dlya-zhidkosti-parikmaher-100-ml-sprey-3-252683493/?asb2=4MAwyKWOpQNIexjzxHNpfYYqqt7K-5fRaEMK7vDnjcKHDsKkTqxOfI53m8paGnsK
"EPICA PROFESSIONAL Shape wave Бумага для химической завивки 1000 листов, 75 х 50 мм",210 ₽,9 отзывов,"10 мая доставит Ozon, продавец КРЕМНАДО",https://www.ozon.ru/product/epica-professional-shape-wave-bumaga-dlya-himicheskoy-zavivki-1000-listov-75-h-50-mm-524268722/?asb2=Z90mpi8LLu9CmGytbxcRjc6NXmcE2e-dV8NgzsbSpL18TWAdpI689KfJ-3jteqX1
Зажим для волос Harizma 12 шт.,390 ₽,20 отзывов,"Завтра доставит Ozon, продавец ТОП МАРКЕТ",https://www.ozon.ru/product/zazhim-dlya-volos-harizma-12-sht-488133906/?asb2=kYQu--ruXuo40pkPeKXn3FOShct11KUHiUczaSefr-l2g74mu3R7-bf8eq7yB2hK
"Перчатки нитриловые одноразовые,Wally Plastic, розовый, размер S, 100 штук",399 ₽,147 отзывов,"Завтра доставит Ozon, продавец Market-PRO",https://www.ozon.ru/product/perchatki-nitrilovye-odnorazovye-wally-plastic-rozovyy-razmer-s-100-shtuk-375695542/?asb2=MiR_6qxBJnAxPZSDJ8bvgkTZWB8djlwKVivDvCwVzpdi3g2sGLgAKt0Esfs9X674
DOMIX GREEN PROFESSIONAL Подставка под салонные принадлежности. Цвет чёрный,258 ₽,138 отзывов,"9 мая доставит Ozon, продавец DOMIX",https://www.ozon.ru/product/domix-green-professional-podstavka-pod-salonnye-prinadlezhnosti-tsvet-chernyy-299486995/?asb2=IhHAUiDPjIreaC1I6yQnJGkUfiQZ4ypw6yK-CKMVHCe_OLhrqCzNeymR8z9WOQXU
Уровень для ровной стрижки волос / Фиксатор для ровной стрижки,394 ₽,8 отзывов,"Завтра доставит Ozon, продавец Star&Tok",https://www.ozon.ru/product/uroven-dlya-rovnoy-strizhki-volos-fiksator-dlya-rovnoy-strizhki-484681469/?asb2=eGAK3oNrBSNaAXtosnedJPpcKixImi2USpj5Q8wayxRNOs9rn7wAZ6ShprrUmM0VAp-mjQHep5wVyxHhNT0FgQ
Harizma Ключ для выдавливания краски,174 ₽,53 отзыва,"Завтра доставит Ozon, продавец Космо-Стиль",https://www.ozon.ru/product/harizma-klyuch-dlya-vydavlivaniya-kraski-243333564/?asb2=aFMglfS66ARrICcRRHDs4S7P5Zh1T-zRiJ6QvnkOgtzz44aOpdckQCb3n5XCCn77Z2ZplXsCIth63Fpi3cAm1Q
"Зажимы для волос типа ""Крокодил"", 6 шт, черный",379 ₽,141 отзыв,"9 мая доставит Ozon, продавец Keratin Botox Club",https://www.ozon.ru/product/zazhimy-dlya-volos-tipa-krokodil-6-sht-chernyy-296804123/?asb2=DpY88dyJ-7f9o7Lbd7-wR3rKtuaaD8eVVunaMVH1qVVjHJum-kiN7Gp4t-4o02KA
"Ножницы парикмахерские филировочные профессиональные, нержавеющая сталь. 21 зубец, 17 см",233 ₽,21 отзыв,"Завтра доставит Ozon, продавец OKEAN STORE",https://www.ozon.ru/product/nozhnitsy-parikmaherskie-filirovochnye-professionalnye-nerzhaveyushchaya-stal-21-zubets-17-sm-313158115/?asb2=Pqxd9AjbvFKCakSpymnXYYkFUwEdvbObCemsaQclwm_gpG2tNMixj66vANV_QTiF
"Воротнички одноразовые / Воротнички парикмахерские на липучке / Воротнички бумажные / Воротник для стрижки, розовые 100шт",246 ₽,19 отзывов,"10 мая доставит Ozon, продавец Top-store",https://www.ozon.ru/product/vorotnichki-odnorazovye-vorotnichki-parikmaherskie-na-lipuchke-vorotnichki-bumazhnye-vorotnik-493408037/?asb2=xex7u27Gh6_rQL81p4TOFPPYXpSSAzxxD4fiMfT3BzFwepFkR7tcfYgKwX-vn5Rc
"Расческа профессиональная изогнутая, продуваемая, антистатическая черная",284 ₽,131 отзыв,"9 мая доставит Ozon, продавец Keratin Botox Club",https://www.ozon.ru/product/rascheska-professionalnaya-izognutaya-produvaemaya-antistaticheskaya-chernaya-265583270/?asb2=GeR0iEFmfG2idO_Xjwp6UfNqkxDAb_63FuvEyzcvYNdkXK9NzdLG5pHUit7rJ2VW
"Полотенца одноразовые для парикмахерской из спанлейса ЭКОНОМ 35x70 см, 35 г/м2, тканевые салфетки для лица и рук белые, в пачке, Чистовье, 50 шт.",461 ₽,91 отзыв,"10 мая доставит Ozon, продавец Планета Солнца - Чистовье",https://www.ozon.ru/product/polotentsa-odnorazovye-dlya-parikmaherskoy-iz-spanleysa-ekonom-35x70-sm-35-g-m2-tkanevye-salfetki-309919316/?asb2=WoAxJZGcUx2tN9H5n5Oso6BvsXaqLkdLCJQ_lS-1JsaJCZMzBdk2a1NnuCeaGmM7
"Ножницы филировочные парикмахерские профессиональные для филировки, тушевки и слайсинга волос, односторонние",650 ₽,4 отзыва,"12 мая доставит Ozon, продавец Bolo",https://www.ozon.ru/product/nozhnitsy-filirovochnye-parikmaherskie-professionalnye-dlya-filirovki-tushevki-i-slaysinga-512203541/?asb2=0b3jRhMdAjjerkD9_7GBMQs6Hue9t2_wMXwfAUobCk8SBhGcMTjEVX4DQv-QyASL
Расческа Цилиндрическая брашинг круглая щетка для волос украшение металлическая натуральная щетина для девушек аксессуар женский новинка женская оригинальная качественная подарок топовые брендовые игрушки массажная косметика лечебная маникюрные ножницы,237 ₽,10 отзывов,"9 мая доставит Ozon, продавец Diamond",https://www.ozon.ru/product/rascheska-tsilindricheskaya-brashing-kruglaya-shchetka-dlya-volos-ukrashenie-436821891/?asb2=nYaFqrOBpQ7RnzrBAWKpGYEKk7fEWmDbWmRlyjeY2-JfoMsHw13_q3-p84wtJZUF
"Полотенца одноразовые для парикмахерской из спанлейса 35x70 см, , 35 г/м2",409 ₽,4 отзыва,"12 мая доставит Ozon, продавец Бьютиголик",https://www.ozon.ru/product/polotentsa-odnorazovye-dlya-parikmaherskoy-iz-spanleysa-35x70-sm-35-g-m2-513047674/?asb2=yEJGAPS5eg4L-pSHTPTJ_YkaxtRpAMlFFNKQREtpNSFzWYd4vpiOyVfaP7IbieYS-DWN6J2VUw7fIhnBp56fOw
Зажим для волос JONSY,305 ₽,25 отзывов,"9 мая доставит Ozon, продавец ИП Шафикова Д.Р.",https://www.ozon.ru/product/zazhim-dlya-volos-jonsy-500847581/?asb2=APyjwa2nb5NOccxu820DyyGL-1S-ebYwJJ-5HdRw12WkLdgZgyyqMTsL2zwoBhiaWiIDQNLlodjD4TowA0LHIQ
