"Семена Чиа (черные семена для похудения, суперфуд в зернах, подходят для проращивания и десертов ), 350 грамм",413 ₽,44 отзыва,"Завтра доставит Ozon, продавец Guru",https://www.ozon.ru/product/semena-chia-chernye-semena-dlya-pohudeniya-superfud-v-zernah-podhodyat-dlya-prorashchivaniya-286681974/?asb=RoEzajaHLyEgDy5GSBYL0af7p38LzZ4SBq57LO%252B4rd6fSV3UjSrvO%252Bcewh1BuK2q&asb2=w7NjZtMdTgjbqZkURMS3vYxG50GjGYMrLSpHSe8i9FTGyoBsd8m9tdICA78giuyDDTQvNpaFx6aZ4hC9T_IoANV6_7Bm7vXSQI_8UT1KB-GPb-ju_w2gQLQI--cdZeFQi6iTJlLc4r7siDY1wXI5ug
"Семена чиа для похудения 1 кг,Семена чиа чёрные 1000 гр/Семена чиа очистка 99,0%",705 ₽,79 отзывов,"9 мая доставит Ozon, продавец Натур мир",https://www.ozon.ru/product/semena-chia-dlya-pohudeniya-1-kg-semena-chia-chernye-1000-gr-semena-chia-ochistka-99-0-458696937/?asb=bBQWs9MkqaE51rvvoywg2KpdcBqgZKQ%252FNO7Fv1QoNlmYIuhflOFGXTf%252Bffcbyjff&asb2=I4a37MZ3nuzbMNqWcXetYmCdl070xVX6YOXgxIsOapwRZW6yMAvIhS_DQgiC7mE3OoshntLUCBaoSfJGib43sjmuu3vdlDbvZlKoy2StUVP2c0_nCfJk6-be5B-hwCtJyED8OawMIfO_ElAQjiiKIQ
Семена Чиа чёрные 350гр,306 ₽,3 отзыва,"8 мая доставит Ozon, продавец Вимпак",https://www.ozon.ru/product/semena-chia-chernye-350gr-521262153/?asb=UPCjb1gVHpgCLVYlKKaS8l3qXDf1Wh0VPPuwzT08zViFK%252FegFyn96BXv5jpEQbe%252B&asb2=j9rI9NTqARIx6p0zGxISasgT1MZ9rLNZh3ngoqkMFBMFvoor29QAOZGmnbNxOAeu9ZM6ZsGMtPyDx4ttG1I_zKE0OmP0mCSmUQrsh_WqRXelOmuFcaak9GdqGGmHOHNK6See1VXbOo2K1Oh6y8ldow
"Семена чиа Здоровая Семья черные, 500 г",474 ₽,36 отзывов,"8 мая доставит Ozon, продавец Здоровая Семья",https://www.ozon.ru/product/semena-chia-zdorovaya-semya-chernye-500-g-275443633/?asb=pkWAFShmH%252FtVBXcaGaqYoa0nNBAC61gu%252BjQCxZkklF7C9XAFD90AjDcbFJfrmW%252Fj&asb2=HjRnxjHbrKXq7f-9WjZbJBMoUUX2HeOe_paaQQW4vzlaMuSYfEjTbozUjhI5pnxq4hX5dHhefKyF0AeGM3HN8i5XRLGyr8sSJBjFU-UFr2gvhlv2G9BWX5Dah5dAbdeF7S1q-ewI6m9Vtg6cCzfIIw
"Семена ЧИА ЧЕРНЫЕ И БЕЛЫЕ 500 г пищевые для похудения и очищения TEABREEZE суперфуд, клетчатка для похудения, детокс, пп продукты диетические, здоровый перекус, полезное питание, вегетерианские снеки в дорогу, низкокалорийные продукты без сахара",469 ₽,157 отзывов,"Завтра доставит Ozon, продавец БИОЛАЙФ",https://www.ozon.ru/product/semena-chia-teabreeze-chernye-i-belye-v-pakete-zip-lok-500-g-169019133/?asb=KX81h9X6YRcIqjAu%252FUrogsFLyE0ylElEpzPE96pJYCs%253D&asb2=s8nkPPmNErvMfptMuvNZtOzSJAcoM5kW0vNaGPz056guap8RZob-DulQ-8ubtScH
"Семена ЧИА черные для похудения / Для правильного питания / 500гр / ""ПП продукты""",505 ₽,28 отзывов,"8 мая доставит Ozon, продавец ПП продукты",https://www.ozon.ru/product/semena-chia-chernye-dlya-pohudeniya-dlya-pravilnogo-pitaniya-500gr-pp-produkty-474144073/?asb=84oypjOGoffOyUNl%252F938sbjk48bU6dqtAF1TNP%252B%252FYC3hm5Dt9t%252F0G8tWSTNWjRpg&asb2=804R_DyF5IYuPgFeYkQnBMSxzqYCV3pzf5NVScvGI1z0Z4m5VkZoRSyNa_Uzm-icMX1T7VND0vMwRMJxC6tak8zvPaB6ALzNrR3iDv43jTK3fCyg_Fmzw5xFghm6LOD_hClL5g9Ww0ooGYobntLjZw
"Семена чиа (черные зерна для похудения, подходят для выращивания, для выпечки и десертов, суперфуд), 500 грамм",535 ₽,44 отзыва,"Завтра доставит Ozon, продавец Guru",https://www.ozon.ru/product/semena-chia-chernye-zerna-dlya-pohudeniya-podhodyat-dlya-vyrashchivaniya-dlya-vypechki-i-286703535/?asb=9zzq%252FJS2IrdOvW21dxXNHDeM0gA9YD%252FGQxVt%252FGuKUzBNhm0z1KB8IsXmkUW%252BF4YU&asb2=9SfTAAdzcOkrjpXaklwh9VSfF75SsUdPlietektMIUp4HGOobe0QffxBU9GKdY7A4poHf1zNfAsey9zPU7Pl1rJQU8Y_QdlrooNIiXmlz17x93yLaJ24G9JlO6dSQ4IqezwO_Ytf6cIM3nyxtFfoDw
"Семена чиа белые (светлые) Здоровая Семья, 1 кг (1000 г)",758 ₽,7 отзывов,"8 мая доставит Ozon, продавец Здоровая Семья",https://www.ozon.ru/product/semena-chia-belye-svetlye-zdorovaya-semya-1-kg-1000-g-372019736/?asb=ZkhkoRjSbmyPkJJ6nM%252BGU%252BU%252FWHByGWLZN9P8uuC1vSc%253D&asb2=KmpTY2KTjhk-u4GlMXQ-s1hgRA834v2uAwYoC5xxaMWkYAltOWsf8NOeHuf2WDth
Семена Чиа 500гр,492 ₽,7 отзывов,"11 мая доставит Ozon, продавец ООО ""ПАРТНЕР ПЛЮС""",https://www.ozon.ru/product/semena-chia-500gr-197876423/?asb=S0kM5WP%252FkwN8CVJNa66cPIgsmSIm9L%252FZddP9DrK4dnw%253D&asb2=h6xstGAGswb7GYj8h_P_TaBVb9uzdaydfrSRLW3otPH_3YOAAs1QEqLHuJIN66rb
"Семена ЧИА ЧЕРНЫЕ И БЕЛЫЕ 800г пищевые Healthy Lifestyle в банке, для выпечки, салатов, суперфуды пп, снеки, здоровое питание, диетические, веган, полезный перекус, клетчатка для похудения, детокс, добавки пищевые, низкокалорийные продукты без сахара",699 ₽,118 отзывов,"Завтра доставит Ozon, продавец БИОЛАЙФ",https://www.ozon.ru/product/semena-chia-chernye-i-belye-800g-pishchevye-healthy-lifestyle-v-banke-dlya-vypechki-203299335/?asb=oO%252F2DQI9Q6mnqeuOTqZyuE%252FMt19vkLgWYXcOuhAfPg3Q61DTGHrMfs%252Fcg%252BvlC%252FWO&asb2=T6BRbmBykOdft9C2TShvSEgRtqWCTFlkXEuoEOE-b0VIq6_nZVP-8hjU-C5L_XK9tW2BiKcfALe1rVMQuYve26-anlGDcrjJIemf8Uz4Le8tubLJeYM6O_JB4J-utGOm2RLViWccfUShh2bqSim0sw
"АМ/ Семена Чиа, 450 г, черные, Для похудения, Детокс, Для веганов и вегетарианцев, Правильное питание, Фасовка (450 г, 500 г, 900 г, 1 кг)",399 ₽,23 отзыва,"Завтра доставит Ozon, продавец ApriMall",https://www.ozon.ru/product/am-semena-chia-450-g-chernye-dlya-pohudeniya-detoks-dlya-veganov-i-vegetariantsev-pravilnoe-518227089/?asb=94TsvTzFk9e4Ma8kEYQc4mRdoaIlX3Edbwa6mma3wzRrG8eD525CxEjNr81yTi8q&asb2=rXmrrgfLDjESe2Oa2I_Z5aTVo4piAd37A7vfG0EL8ClZs2fjxHmoxFs_J_t8egXggGlsVft7JC07rOAuSa-Vj9FTuWpf4w5wXSO4c5TUw9q-OjMVsqpkaHnLmoId7iP4aqOrfSC7HYriwEFG57bySg
"Семена ЧИА БЕЛЫЕ 1000 г, 1 кг пищевые TEABREEZE, продукты для похудения и очищения, суперфуд, добавки пищевые, детокс, пп, веган, клетчатка для похудения, полезные снеки, здоровое питание, низкокалорийные продукты без сахара",819 ₽,64 отзыва,"Завтра доставит Ozon, продавец БИОЛАЙФ",https://www.ozon.ru/product/semena-chia-teabreeze-belye-v-pakete-zip-lok-1-kg-169019134/?asb=QRKkoHuo%252BLa6imZI9GRQg2DOwIEtVpu6%252BBwyL763Wzo%253D&asb2=YzbNNug9iRREQpeBCub693iCVJArJlJqsl9FiJ0QJe0j2tTkVAduhEl-tQkLwDgI
"Семена ЧИА БЕЛЫЕ 250 г для похудения и очищения TEABREEZE, здоровое питание, диетические продукты, веган, полезный перекус, клетчатка для похудения, детокс, добавки пищевые, суперфуды, низкокалорийные продукты без сахара",279 ₽,36 отзывов,"Завтра доставит Ozon, продавец БИОЛАЙФ",https://www.ozon.ru/product/semena-chia-teabreeze-belye-v-pakete-zip-lok-250-g-169019131/?asb=Zew6pdWo4%252F1EkNk7f8uFYVciJF9QRiu6lm53lg8h504%253D&asb2=PkuopoZpkZ_0UnF_mffPXYmuXwJpo_NjioaYYNUWFZwCbrkzccUf57gPZBDoh6qg
"Семена Чиа черные для похудения, 600 г пакет с зип-локом",503 ₽,113 отзывов,"Завтра доставит Ozon, продавец ProDOZA",https://www.ozon.ru/product/semena-chia-chernye-dlya-pohudeniya-600-g-paket-s-zip-lokom-207268523/?asb=jEdIPoraJYnJq6Tafb6ZFK1OD47A6T4CdNKZF2wHz%252FfEavGYXjC9CzoG85mkzIrI&asb2=KQ3ZLCVIWEM7cAtWJL3oUWJD1vS6QgZT64ZMucGbV2ymA6O3TPEvoVHw5_zwkmPcaTjtOgFPRI8WRwh8T0ONYEw9mJ2StvWxqkBgFB63QFQaS2F37fTAEpJxMK4NiqXHDo0GLG41_f9XnYynTILNeg
"Семена ЧИА БЕЛЫЕ 500 г пищевые Healthy Lifestyle, продукты для похудения и очищения органические, суперфуд, добавки пищевые, детокс, пп, веган, клетчатка для похудения, полезные снеки, здоровое питание, низкокалорийные продукты без сахара",459 ₽,70 отзывов,"Завтра доставит Ozon, продавец БИОЛАЙФ",https://www.ozon.ru/product/semena-chia-healthy-lifestyle-belye-v-pakete-zip-lok-500-g-159883837/?asb=xcOobptupSIRmDzfd%252FAP78GgoNA4amZs7mTrg2DAS42RNd4gG8M0iUV19zvPvPt2&asb2=tstqNv9d3EN0bQQIYw2hQwGDtfZfsfb4uA2_Q1QqK7tJGegGevmT8Mh6mYfWsirIu1FXvKSM2h3mrDc5ZKudzUK7Z812rfIbmsRJTfgVxV4oOlZorEkl4z7euVcGQgVXRQCMu7BEgk0SFo0aIsvmvA
Семена чиа череные премиум 1кг (1000гр),713 ₽,31 отзыв,"8 мая доставит Ozon, продавец ИП Заслышкин А.С.",https://www.ozon.ru/product/semena-chia-cherenye-premium-1kg-1000gr-383504207/?asb=USp0pWl%252FRgDmKhfPjb4hYGFbw%252FSktqg%252BbITKZkCAV6PPhK4q221sOgYjGmEEIA6h&asb2=iS7OpPAooLa2oGLKPc29MeJOPzRaIRZnIElBD_7yLVJ5d6vjJSQU7HNoR2Edh9R-_14TmtY47PLwOBfUc3UAaq4DOCEcSgCWXFoD6GWQgV1ovFkJ_Le7PtTQZkNgTiLLLHroREWiOPWt_FQqHKVj_w
"Семена чиа белые (светлые) Здоровая Семья, 500 г",417 ₽,7 отзывов,"8 мая доставит Ozon, продавец Здоровая Семья",https://www.ozon.ru/product/semena-chia-belye-svetlye-zdorovaya-semya-500-g-372019183/?asb=az9CYLUWblk5Nl8NBNYUgpdbEI%252F6TahYSjNgbxLRg5o%253D&asb2=AwySxXmLGhr1i2ufwy4ysLtlfVrONNeZ7ZwHGSWbIyCbJmHX6JAbqA96IeacvYKR
"Семена ЧИА, 150 гр.",234 ₽,25 отзывов,"10 мая доставит Ozon, продавец 101 чай",https://www.ozon.ru/product/semena-chia-150-gr-150901752/?asb=jh32Ak9AJLhz0%252FL2MomwYjYsaDg0YdqvJR7k7mzbAZk%253D&asb2=fL8NxEQzaH5p1vvL6CrgW30wSLCak9PUTPU-T9awWADdphH1pEczCwK5lCNKqdZb
Семена чиа био Vila Natura organic 300 граммов,824 ₽,27 отзывов,"8 мая доставит Ozon, продавец Грин Трейд, ООО",https://www.ozon.ru/product/semena-chia-bio-vila-natura-organic-300-grammov-175254680/?asb=73yFEB5mPfBYcL%252BbEXlrzVOiOKfY2MpgVA0AkiuE7%252B4%253D&asb2=KigkZ3cojdO7lWz3lSdp2mOeHFsXuvLpXGDs7iChP_72BKf9dHmFHTGr0i6CFImv
"Семена Чиа натуральные, 1 кг",997 ₽,116 отзывов,"Завтра доставит Ozon, продавец Super Food",https://www.ozon.ru/product/semena-chia-naturalnye-1-kg-178981547/?asb=33PMAwOb9TVcw%252F4%252B1Ae4ndV3vYd87vCpuJVmttHKUvLu00mc0Amk6cib%252BuYih%252FQH&asb2=Nf1tQlMskvGqMOhsk0YtXVi8tWLy5whZquusBETUM_TZC9jWUDTMUW7xEsRQS7ce9oLdFH2rG--GKO4qKXQQDoSGxI8plYvjlKWVOeL22eATD-ZXXA0Eear0iGKrYKGz3qmrwTjpOEyO7Ub6aXgDMw
Семена чиа черные премиум 500 гр,475 ₽,31 отзыв,"8 мая доставит Ozon, продавец ИП Заслышкин А.С.",https://www.ozon.ru/product/semena-chia-chernye-premium-500-gr-383505608/?asb=c8jW%252FupJdnvfM%252B%252FiFNWgjbYr4SbrmdD3hAkVutSartMoIFS4wpQJ340fk71iW0gS&asb2=y8_bYzesbh826eeSBEI62uqa0tsrF-3rCn5TSSTtqVNcar3JsIDQlNQzDjicmCbaJv0xKjODSuYwV-y3DI-Dq1U35Ja1ToyOkuebVx6IGM6grOM0b37NJgAatp_6C-KJnIvMc4aC6lIfFCCN24CZ0w
"ЧИА семена отборные, 800 гр., здоровое питание / Семена Чиа для похудения Premium",689 ₽,2 отзыва,"9 мая доставит Ozon, продавец Healthy Foods",https://www.ozon.ru/product/chia-semena-otbornye-800-gr-zdorovoe-pitanie-semena-chia-dlya-pohudeniya-premium-543905917/?asb=tePRw9W9%252FpkHjW1q7q0jCy0VVR%252ByHTjDKvu5cb55tPmSKxR1xg5wokkaygWrNBVu&asb2=nJ_zvwI4yjlJE4a6DwO6T9iISgUZYu_pru6HwX89zPQDXsWGkgyfBjlyXTCYGxvF_ym5hYmqKDNF0j_bnoVbfZTZkU9YEoIGTrywPdhp2-wICsQ366yoHKp6J9SLXmn_LIlIVKtx0ZOyFFc_f--4Aw
Семена Чиа 500 гр,450 ₽,1 отзыв,"9 мая доставит Ozon, продавец Кетоша.рф",https://www.ozon.ru/product/semena-chia-500-gr-372329341/?asb=lpgYXOgRQypbnWiagl2dMaRY%252B6IxRuMaF7VcrL8Zeypu8QLzZdk6rmsL25544hV1&asb2=4b6WmiwiLzvc8QYViITC6RU8in-J_AUEEWuWx_0QkZDUwIVjBJEx5sYi_30ATdVKLl0RpHidji6UFVHol0tKiv4QUzyy6I65fQJZYndPdUBDhgEPVcKl9uInFzmKK8Besh5gLgVrTX5CPpS_kKRVKA
"Семена Чиа 150 гр (дойпак) Fit Feel, набор 2 шт.",332 ₽,4 отзыва,"8 мая доставит Ozon, продавец ТД ПИТЭКО",https://www.ozon.ru/product/semena-chia-150-gr-doypak-fit-feel-nabor-2-sht-294110824/?asb=3FGXebeuVZJWPT1v0laappFjZ01O3G%252BjGOasSGsUSvw%253D&asb2=8A-po6e8LvuMC0bywTUksrnZNeQw9CnAtN57sgujOZv80vSKaPpgR_VyCIBeywHw
Семена Чиа / продукты для похудения / суперфуд,327 ₽,17 отзывов,"Послезавтра доставит Ozon, продавец ИП Бокарев Н.Н.",https://www.ozon.ru/product/semena-chia-produkty-dlya-pohudeniya-superfud-248025750/?asb=KgU4oj2LRdyx2edR%252B%252BEm%252BKdfmppj5y%252BBWwhxg2CU1ts%253D&asb2=fJJynLBlXkJSRVI6wORsgkvtti2VCsAv7M9I7i4mgCHBnGnzc_uoWTSdhkJrvddR
"Семена чиа 1 кг (1000гр) Премиум ""Сибирский добрячок""",809 ₽,1 отзыв,"16 мая доставит Ozon, продавец СИБИРСКИЙ ДОБРЯЧОК",https://www.ozon.ru/product/semena-chia-1-kg-1000gr-premium-sibirskiy-dobryachok-339569380/?asb=9U69LLMYuomPnKgC8JRLw0JgWfn9KkMvgYlsmf3jt9kIosu5WwXuALRJOu%252FL2uDD&asb2=MraudyX_IuGiP2k7My4QN5GCQxCKc1jOGEZbBkxKMfM7rXyKGpTwZVHAKXqagHeq5A4V_o1yLsMqHCA5v3709QTdiqEimZJavYb_KKVyAnKBAAnIbLRL6ji5rz5Jl02pOMFWXnyHgr2TB5Qu4oQ4NQ
Чиа 500гр/ семена чиа Боливия,595 ₽,1 отзыв,"12 мая доставит Ozon, продавец о2 Натуральные продукты",https://www.ozon.ru/product/chia-500gr-semena-chia-boliviya-441340919/?asb=paK6PvNTmCBQjK%252B4At1qul8Z7fgsujMOAH%252F7EVX3%252Feo%253D&asb2=_c3fgaNAZ26z5cm9jhwpcfKGeg4I4kEpbqrN10U3oEJR-rA1oksKzD5p4TEtcfqY
Семена Чиа черные 500 г / для похудения,339 ₽,13 отзывов,"Завтра доставит Ozon, продавец Naturalino",https://www.ozon.ru/product/semena-chia-chernye-500-g-dlya-pohudeniya-567732420/?asb=1H1Ok3aFw0B4U5QXGheUDeVifBDSAKTXwF0KFYpM3MY%253D&asb2=6HWiC-JpgPjZg5TsH_7I4XhoFwRo3zoOgSuMRvHrgTeA5KyOYVzXh5LjUk-wzdv9
Чиа / Семена ЧИА черные / Чиа для похудения / Детокс / Полезный продукт / Здоровое питание / Суперфуд .500 гр,600 ₽,1 отзыв,"8 мая доставит Ozon, продавец MAKSиFOOD",https://www.ozon.ru/product/chia-semena-chia-chernye-chia-dlya-pohudeniya-detoks-poleznyy-produkt-zdorovoe-pitanie-superfud-432454301/?asb=3ctrby8wN21eUYrWivWOUWRPrvBkhF3hY%252BAv8SG1U4MjARSwanW6FqHqt0sfLQT4&asb2=joaYZLpZ8XiKNMTLtN9Tie0o-ocG2y0daD3o3A945alFAe9UlXwLFtag2ZEtcNZG9SvTXcURLcw5w21SUloNX0Lgj5CmzJ4j78U6FM_-BmedE6GU0Um62fi7bQZDMwJk8tUFGHkLcWjEUH92NTQLcQ
"Семена Чиа (Chia seeds) Оргтиум, суперфудс (superfoods), 2 шт по 200 гр",630 ₽,21 отзыв,"8 мая доставит Ozon, продавец МагЗОЖ Оргтиум",https://www.ozon.ru/product/semena-chia-chia-seeds-orgtium-superfuds-superfoods-2-sht-po-200-gr-205776727/?asb=YcV5MKC79cUX%252B%252FQP6DBRax5QFxs22IjksNPAaR8ySX%252BfZDjupqaQE%252FeV2N4zjSWR&asb2=pbWIvHIP0oc2IzoUrvkFVjeZk4lo3-DxLf5MljdxfdHQDtALCygZakI-AfSC7ELY5mez_uD9yMbUfDkgodiyqooCtHdIyYD8S_HJlr5OAJHUxEAlpw3W_-4zUfvjNWEjL-q82ZOxBiZKhAth1z6Pgw
"Семена Чиа, белые, 500 гр",618 ₽,1 отзыв,"10 мая доставит Ozon, продавец Мак&Над",https://www.ozon.ru/product/semena-chia-belye-500-gr-234456451/?asb=PfiavZcWbOyZ9AJa3IoS58erJyw9ZHoEwmR2M03QwOQ%253D&asb2=HpD7xU3_bbfy_Vp8kYXz7tpBCx7uT6ShmppDUOcwprTnquFebCDSFw8XsCYfvmsC
"Семена чиа, Жив Здоров, 300г",400 ₽,70 отзывов,"Завтра доставит Ozon, продавец Жив Здоров",https://www.ozon.ru/product/semena-chia-zhiv-zdorov-300g-266406455/?asb=R4rMlb6Ned94g3bWk%252BGP%252BdL7oRuWjXnLhbrrdaQoHc8%253D&asb2=0HZWUEuXLP50ioGL3sdK7qv1-dPp_BR-BsXI6TDwQynwUn6UrESwWe3gkxJcwVvY
Семена Чиа BARBARIS24 500гр.,598 ₽,1 отзыв,"8 мая доставит Ozon, продавец BARBARIS24",https://www.ozon.ru/product/semena-chia-barbaris24-500gr-307787831/?asb=za%252B8d73bgrhHfj19d4YaXTHD7TQTN53If7PZ%252BGGnEtg%253D&asb2=6dhPIOOe4miq5mVVGjtxn96HxXKUTM4tWeOIzdVi9VRbtDZtXPoUe7KDMoYYf68s
"Чиа черная, семена, 50 гр",305 ₽,1 отзыв,"Завтра доставит Ozon, продавец Астра",https://www.ozon.ru/product/chia-chernaya-semena-50-gr-191290475/?asb=EqgmdDto5xWM%252B%252FW0BPyKjZR61IwPnIez0gUwR%252BqqSZ074n%252FZwTJ%252BOaiDe1BwewmB&asb2=mOsxGqmtAUBE7EAU1T3OGoJngWInIDk3-upGxRzQ7aQ5xoNOroCdZe1-xcrGQZ1u52rf1IBUfkSanBGQHEtQCScCjZlwkHWJIIkbqkPSXPe3RegyKL5pGpaJYiuBku7HRWysqNtMUD29wkmgcVGW8w
"Семена чиа Premium Freshburg (черные, для похудения, суперфуд) 200 г x 2 шт.",827 ₽,13 отзывов,"9 мая доставит Ozon, продавец Freshburg",https://www.ozon.ru/product/semena-chia-premium-freshburg-chernye-dlya-pohudeniya-superfud-200-g-x-2-sht-514074639/?asb=UgvyikvUZGLbravP%252FP96jy0q2huygNKjL6GP8ATVxqc%253D&asb2=4URZtXZLFhWzVyGqyuC6uHWOIXfBEybthM_a-1YYAgnB8ldYLONi17mG4WQsumbS
"Ecotopia Семена Чиа, 300 г",538 ₽,2 отзыва,"Послезавтра доставит Ozon, продавец Лакшми",https://www.ozon.ru/product/ecotopia-semena-chia-300-g-173784103/?asb=DfirmN6VeFN8ewXe8H1SfkoMI5IN%252B%252B5SfgqHvssstNY%253D&asb2=wxvwEZSPUyHFcraZ4upGc-91L12-wjUugA2OE-5Q7O4RBCiyWSdFOynAj4kon-vv
"Добрые Традиции, Семена чиа, 200 г, суперфуд, правильное питание",363 ₽,8 отзывов,"10 мая доставит Ozon, продавец Добрые Традиции",https://www.ozon.ru/product/dobrye-traditsii-semena-chia-200-g-superfud-pravilnoe-pitanie-247118987/?asb=x%252BAyYnTwQNBgvHGW59Wzy7SFHO33Or2L2mfUh249Ijk%253D&asb2=7Gy6mfsQioFpuKgle5Xg_lcHPpFpImWdbLPgt6XQikcww8ISHCAa3uftkTiehccn
"Семена чиа, черные, для похудения, пищевые семена, суперфуд, 500 гр",501 ₽,1 отзыв,"15 мая доставит Ozon, продавец Vababay",https://www.ozon.ru/product/semena-chia-chernye-dlya-pohudeniya-pishchevye-semena-superfud-500-gr-447093293/?asb=ns%252FHFPNJxff4GiBECuuYW14eNVRzn4F5dgvwsNt8paE%253D&asb2=WNfK207DMqcDpuSLlqpb10fqm8bptTie9ZKbxNDZOaEjdIw27nxfmNcC78aFLgEp
"Nutvill, Семена чиа, 500г",683 ₽,19 отзывов,"Послезавтра доставит Ozon, продавец Здравпродукт",https://www.ozon.ru/product/nutvill-semena-chia-500g-202981899/?asb=MceEqcQUbKsz6XQSf28UN6jZycAGdOG3M%252FMqUzs%252B6o3qZlyEmORehG%252BK%252Br2HwZSf&asb2=51m2jYWGe9PlyDnj5uOnEkN7Fc_QjUU7_RNIKSf24CUs5nuCW4Cqxt1XC_aQQQQDX39yvUbrRRvq7W_H4_21GP7NYO0rWXZ01tSe9MAdgPcBTr6efZ62SKfLWGcpL7x0Mis3ofOHNfRS2qsV_KVCag
"Чиа семена (Chia seeds) суперфуд Anastasiya Blizkaya, 100 г",279 ₽,2 отзыва,"9 мая доставит Ozon, продавец Anastasiya Blizkaya",https://www.ozon.ru/product/semena-chia-anastasiya-blizkaya-150-g-167746063/?asb=YExono9LAL0rApTjsiAB7eB5gU4jOBEkQBvDN35zQEE%253D&asb2=mtAybRHlO0QyXId32poMB3R9p6kiq1pAWk1CepbuniRmYjqT4XCbhQ2TNZIuSHYn
"Семена Чиа натуральные, пп продукты, для похудения, здоровое питание, UFEELGOOD 1000 г.",999 ₽,47 отзывов,"9 мая доставит Ozon, продавец Ufeelgood",https://www.ozon.ru/product/semena-chia-naturalnye-pp-produkty-dlya-pohudeniya-zdorovoe-pitanie-ufeelgood-1000-g-171831494/?asb=c2AF9eVR0zymSQHSQYZblQ%252FXe4Wc0z06c%252FCBWxbuR5zVhYqHVhu0yrsYDLyL4vl5&asb2=OvGJqHZMEXc4_T_vixKyuy3igxzrbV3BDAnRj4wbXc7KU_VkgxuDj-telx1Y3SFnXqgbuvmQnwlt67Qbce5OD4PxFLnO_jIfp8TnxvIpm4k0ZBMwUBt6bOMRHKj1c8S0cZ_fn8L7Q7N8zdD2Yl1CzQ
"Чиа белая семена Пряная Симфония, 50 гр",315 ₽,3 отзыва,"Завтра доставит Ozon, продавец Астра",https://www.ozon.ru/product/chia-belaya-semena-pryanaya-simfoniya-50-gr-191290474/?asb=nqp%252F8PnXpWftg%252FieEXt2Yt6vzAhF589BfhCUIzAqPw4nIwLyP4DjmbdG%252BFU%252F8BzF&asb2=bMki9oCtjB0YxzJKFFztqKN5a7Q85-oItv3Cf7bfMUbhutyFZ39JmkBX-vXVYvVqSpiNUtzO7g6-e1TZ7bF8xZRRur2T9cj-C1OQXqQEdHhaqB-tnjb5Kh00FUs25kqfKgRM9_wqoysiOSmUO-xQwQ
Семена ЧИА / черные и белые / для похудения / Фарсис / 300 гр / Дой-пак с замком,608 ₽,1 отзыв,"8 мая доставит Ozon, продавец АГРОМАГ",https://www.ozon.ru/product/semena-chia-chernye-i-belye-dlya-pohudeniya-farsis-300-gr-doy-pak-s-zamkom-466572669/?asb=cPVs2fDH%252BFFZ476Wk0DGWAD%252BozRSLV%252Fq2HXYdggIy1o%253D&asb2=z37afcxbzgQ50CxTEK9i5T29wPtfE1vfkcVRIV6nWD-ShdFdBB34lLRFyFv3CUl4
Семена чиа 1кг,851 ₽,8 отзывов,"9 мая доставит Ozon, продавец «ОРИЁН ГРУПП»",https://www.ozon.ru/product/semena-chia-1kg-241489654/?asb=mlU%252B2FIe8GvGk3H0o28h83v7hHVIF0%252F%252Budw5jltVZtnGcKR0gM14nstgKsoyHKeg&asb2=iW4-tWI7Pav1JbssXYyjBl_JtZvVO9WsmHPOAG-_iJKRQfaXqBnnb5aH6WGa_lj5XtXGSlFJCF7wNMQOoqE2yX0bqXUWl38kNmPdGvAluXhMA2OEmenpS_CpkSz4g3yp2JGqsISawD8MZtVMt6aE1g
Семена Чиа ФУНДУЧОК 500 г.,541 ₽,3 отзыва,"9 мая доставит Ozon, продавец Фундучок",https://www.ozon.ru/product/semena-chia-funduchok-500-g-204469127/?asb=Z5HxZ2IZf8oVJFhAiFUjRCiHLpmDGptJGUbr56Ljh68%253D&asb2=Ftm0l-opKDiUlI2acpGwq3saNNfuaWgUvbcr3qcIkVYV5QUkflHnrmCVafJiYHuk
Семена ЧИА 100 гр. SAHRA,263 ₽,2 отзыва,"10 мая доставит Ozon, продавец NaturMarket",https://www.ozon.ru/product/semena-chia-100-gr-sahra-416321231/?asb=Yfdmw9%252F8BFEmOpAOCZfKlK6cy0k0P%252BuLavYVKb148p0%253D&asb2=Yg3PP5IQzMUG99eHeR-F_czcWNDXme83-ohNWSBSk8eNwkICu2VgDW2H6lT4iO1C
Чиа 250гр/ семена чиа Боливия,329 ₽,13 отзывов,"12 мая доставит Ozon, продавец о2 Натуральные продукты",https://www.ozon.ru/product/chia-250gr-semena-chia-boliviya-227819422/?asb=IXYf7LqIT2qezTUjhYAH1kk9X%252Fv7olpPhWmUdyT3Ols%253D&asb2=o5fdfhjWF46QCZzTsQeS7C6QOpNu-U3nZVhchwLIgbYg1S4_pSDvepl7dyeu_9l0
Семена Чиа 200гр,420 ₽,1 отзыв,"9 мая доставит Ozon, продавец ФерМира",https://www.ozon.ru/product/semena-chia-200gr-395266657/?asb=86oFegcmC54r%252Fum6Dzb9Vu2cajbQ%252FyB7DNWoV0WjYOg4cGdibK1SULKc3tXr70A9&asb2=-P7o7AkHs7ablhRaEH09f5z2Y2Hbect6NulnuajUf_vSvZveDR8iUHk4aIN3Gn16IH5ITVGF7LPpuwrheuD7w1EM1445fj-mU8DI3r_EFJMGmBAK7TWMJ9aQ3fVJL1lb4KbMavdu9NAhR7QWQyuCzw
"Nutvill, Семена чиа, 1000г",699 ₽,19 отзывов,"Послезавтра доставит Ozon, продавец Здравпродукт",https://www.ozon.ru/product/nutvill-semena-chia-1000g-202991009/?asb=10KsxD6NcmvTrGMbfgxeBoD%252BCUMldEQGYKVhdHi7dte0ggSDd%252B97ajLbUwQRfiM2&asb2=8FtrJi3VWQHfIVO6WFE2HPFjETDVmWA309ac0CtHEskUBMZ8LbZvfnnpX_vb8qZmnKUuFzQ8xPJ4zpyX_izm6qV_u2Albm5gio8SOqM4Nuuh7_yfXi6OtWob1kfCBtapIlpk0etm16IeTn9EP-XJtw
"Семена чиа (Chia seeds), Перу, 2021 урожай Anastasiya Blizkaya, 1000 гр",882 ₽,2 отзыва,"9 мая доставит Ozon, продавец Anastasiya Blizkaya",https://www.ozon.ru/product/semena-chia-chia-seeds-peru-2021-urozhay-anastasiya-blizkaya-1000-gr-200982222/?asb=JVWlzl31aMz5N%252BOvKEECVlwY86%252FxeJ16kXIss87RVLM%253D&asb2=bnOgFDT0GZ8oGI3C0vfiqoiVoPNUIW9aCGPnYVPJhhGFiogNyXCgGRfyTrQ3hfpj
"Семена Чиа (Chia seeds) Оргтиум, суперфудс (superfoods), 2 шт по 100 гр",465 ₽,5 отзывов,"8 мая доставит Ozon, продавец МагЗОЖ Оргтиум",https://www.ozon.ru/product/semena-chia-chia-seeds-orgtium-superfuds-superfoods-2-sht-po-100-gr-205772496/?asb=GRqBpGH5YMHJ92MaLX%252F%252BCymJwIHOM2FCcksVyewudEM%253D&asb2=YHMc0tZtFavNCpSIqE91p1hXk66Gjuw8PUXqRqSGvj459Gh0jCMQ18g8Sa5SKkdc
"Чиа белая, семена, 250гр",435 ₽,3 отзыва,"Завтра доставит Ozon, продавец Астра",https://www.ozon.ru/product/chia-belaya-semena-250gr-233677571/?asb=fK2%252B8Hl1tBF7kqY3RjDQfgu4ruJfuJ%252Be7HeQeA3Ixp4%253D&asb2=w09PXbaF6YechXdiv0oxOh3GczEeobQJCeLpqxYyE-913wuyStxEcRRiK95jfPqs
