"Семена ЧИА ЧЕРНЫЕ 600 г для похудения и очищения органические в банке Healthy Lifestyle, здоровое питание, диетические продукты, веган, полезный перекус, клетчатка для похудения, детокс, добавки пищевые, суперфуды, низкокалорийные продукты без сахара",559 ₽,148 отзывов,"Завтра доставит Ozon, продавец БИОЛАЙФ",https://www.ozon.ru/product/semena-chia-chernye-600-g-dlya-pohudeniya-i-ochishcheniya-organicheskie-v-banke-healthy-lifestyle-203272728/?advert=0KUv1np-aKSyEDyqDns4GHtM5lXvXuXZw6L-66tfFSgegrbglJV73eokfQFlFK5Fk75k1htf70m_LnqRWsxrN1EIGhDd7pAdddnnT3XBbpPGX5NjmBhNkY1DV46d8t8iop-KRsVspRyF7bU44V01ht3cvC6MUod_W4V5tnabUKpl_Ltxj3Rqmca2W1TdWye9hjWOAUXJMemZWQqdO2l1SraQ1gROaIMx7H_lAZdB2PpNXoQUqEJ77MHCEbcIcCvtmjVMBKdnuNZIjBavAi0uXjvSLl27L3tDKySFEIvldkfAcd7w7AeTeOZw1FpvzDyi6MmwFzBKkxTtkY7GoWfFJ3lCelwikbpEAe9ibaLkRoFg_Lw-AH_fWeMzO7IJPAhS65MNAo8aL5k73qkNiQ43HFIfyt2AkaOpt14smbR-mw1woU7asmwEh1gVzcJ_qdH35oEParbC9O_q9Y7SuMXm6R0onL0-aCLifvTYg1jao_oF5AkzA70MkfYLcQHTwU1tm2GgZnCeAB5rkdHmEzBUwi3eIunS640yAPFjcx2TPstTGRjfN1XmUBb-6tJ3ZTcc
"Премиум семена Чиа (испанский шалфей) для похудения, Щелкунов 100 гр",157 ₽,175 отзывов,"Завтра доставит Ozon, продавец ОрехТорг",https://www.ozon.ru/product/semena-chia-100-gr-151999016/?asb=g%252Bzd3q6FGd6WYfJBOTnowkinb3mWQUH4bqGsr7uDLyrzVYEA9kb3JkeAUKb9XSSC&asb2=GM-ntexFnoyluhPRhxeiIuJRcY3UOtkzjjYX57IZD3PTJgcr3QfFwUCkvUkGqwj1T1WyLiH2ROhsL0sm9Ex4279LzC7oBVP49QXElhfrkuylBPEqzBIOkD4WPzuQhdG9lJ0fX1rh_OGa-RqlriNGeg
"Чиа черная, семена для ЗОЖ и похудения,для каш,десертов,выпечки,соусов,суперфуд,150гр",193 ₽,55 отзывов,"Завтра доставит Ozon, продавец БИФРЕШ",https://www.ozon.ru/product/chia-chernaya-semena-dlya-zozh-i-pohudeniya-dlya-kash-desertov-vypechki-sousov-superfud-150gr-477016979/?asb=gIjLR6cW2%252F0Lbcj4IgjkzcMjLdTjqMlAvZlJi14YfQkMifNM18GHdQPsU5iZCzsM&asb2=bgzkcQ5RtYV6sN8v_x5tAaeUdGUr9eVEpm9R-hSbLqpdOKqCpTDrCGi_56akXNreEyzQpDlQRKS6mgVomRom5Uqq58uY6jw6KH88MywuNm1sctjkYJvcVhwhyvU9bEkC2dVWbKPahz4YgO6VUa7ZSg
"Семена чиа черные для похудения Dattie, 500 г",399 ₽,127 отзывов,"Завтра доставит Ozon, продавец Dattie",https://www.ozon.ru/product/semena-chia-chernye-dlya-pohudeniya-dattie-500-g-513426354/?asb=tunn6xwbgYMBX5ybe6RH5pGLedcukxe33HUgeQXCA4U%253D&asb2=xCV-x6jqxz4oVqJtb0Ft3Fi_Fb6ppzF_MlrYTlPvIQevb6yT3f5UbY5PmaKW46VA
Семена чиа белые De La Sierra 220 грамм,199 ₽,69 отзывов,"Завтра доставит Ozon, продавец De La Sierra",https://www.ozon.ru/product/semena-chia-belye-de-la-sierra-220-gramm-215299644/?asb=kXeO7pcyerShCjDwqdxYG5GBRN%252FgR%252FLiAtMofIPlLxJOsobVLZ6gL3hjomjd4gFZ&asb2=CH_lqZep04eMbgchJs3M_FZp_RiTE-w64jclsb8acykTosCYjsmakUu5Ur3q8KvYA_AUXdDRI5uwJhC31W1SGG5agOB39DaZK8d23MAjNswnmw5MlqdG6rG40wiAFJgbIhuPWKaB_8hT8kSmji265w
"Семена Чиа черные и белые и Асаи ягоды молотые Healthy Lifestyle в пакете зип-лок, 150 г",249 ₽,143 отзыва,"Завтра доставит Ozon, продавец БИОЛАЙФ",https://www.ozon.ru/product/semena-chia-chernye-i-belye-i-asai-yagody-molotye-healthy-lifestyle-v-pakete-zip-lok-150-g-167451939/?advert=lqHBy2_idCnD4Oz07yokqS6x6YuxKnPn_P_Z-EDNYmWqt-gnco-insiWYnPwYOFiv1JQ6JjDYsF1ELTi5dK-CxdPpA5AIh0p7M57fRp418Xt7bZMaSiLdUeiL6c9628yKgr6foLuzKPKVTCwpL4Cm8X1xu0mHdQWU3YqEx7aT_Hvr4m0MMTV_fhxiTCqcUDBN4GsgsZ3RitByUcYJWWWnlG6c6SfXHh_rLHjPfL9_8MFVWauJAFn01-rpoMZMSGaEFka-KdkaZPB9_Qnft6azMO4fXqtowy4NszoC4kSlMqnbkMeB_aDHh4R_hZRut3-_BgT-CFiJFD4W8PX4Fnm8RfmZasOL0nyihy5x3D4Gur1C_yqiWmvz1KJjDYhDL3JeVNd0ACJFcbOQE77KoIsCCezmit1fz9zMepQQBLDibglIda7vl8ZkAAg0Gn2YybguQEDeglCBGY5dm2HrircFgI-B-18kLekv2IURadW1XPojQm-xF3_1978puQrAW0rAJV--MiBRExVGxcBhSbQLEy7gcDwMB2gGOWSdB5XPXiDqoxgf2qYhpQP8W0wFd_w
"Семена ЧИА черные (Аргентина), 200 гр.",237 ₽,179 отзывов,"Завтра доставит Ozon, продавец PremiumNuts",https://www.ozon.ru/product/semena-chia-chernye-argentina-200-gr-252347240/?asb=DcafbKz7SELhyPnNvtQPrZVM%252BjXuSVDRZlUlyvgY1cIcacVVixYaN5vd0og8GUBT&asb2=2C08tvDoOm8IuwEgYsw0gspSQOeveIEhm7WqxaZJMuD0GTnsoHIFsBLxnevxPPCaCXqqTAmXiNFK3TkWPBNTCvURxQHe1ETld0IoViYr0MbSgApAL5qNqqsrib73iTpI3VhzYrP-CgYXjXhs9v2_0A
Премиум семена Чиа (испанский шалфей) для похудения Щелкунов 100г*2 (спайка 2 шт),219 ₽,175 отзывов,"Завтра доставит Ozon, продавец ОрехТорг",https://www.ozon.ru/product/premium-semena-chia-ispanskiy-shalfey-dlya-pohudeniya-shchelkunov-100g-2-spayka-2-sht-176708183/?asb=pUJ3R5v7RywZB3lRJLIaGdygJHuGmjnL%252BkgtA7p2e5yxDK1rKY2pfmxaxDHs4FT6&asb2=QpS0ohg47-PDHkco9gBd92Jx1_V0A8JKOgW1TUaqB6E_ILD1TMGazT3NIyFBj4WhDkBNkAGghXIFlxFEnOvUIzFBqlUsaLBDM6zHZvFMIO4BZFm8NDO-iMJWwGGI7cVMdLrLGQpwaTJC6iwTYFlkKw
"Семена чиа черные для похудения Dattie, 1 кг",699 ₽,127 отзывов,"Завтра доставит Ozon, продавец Dattie",https://www.ozon.ru/product/semena-chia-chernye-dlya-pohudeniya-dattie-1-kg-235806721/?asb=n6LXN8lA%252FXB6VLOmuI5c3c235T2uoiRODvKxyDiLldY%253D&asb2=NI9sFPYlyw7yTwSM4xCCcLILWBUFre-UT3QhCg9Guv8nCy9Mqeu3y6TNyjDyZFhm
Чиа семена черные HOBBYHELPER в ведре (600г) для похудения,499 ₽,101 отзыв,"Завтра доставит Ozon, продавец chapshop.ru",https://www.ozon.ru/product/chia-semena-chernye-hobbyhelper-v-vedre-600g-dlya-pohudeniya-242531280/?asb=%252BrZp%252F70pFaWdFaX0jMx0LOeLsfBTjJXSxMRxQT3QL%252FR9B%252BE9iAUSM122jIrXOs%252Fl&asb2=6aVicax7oF0ywN4peYv6pPSbqUIZEnQrjzhMMYRxfT4BKIyOLwPFS7qNK0rntN1V4Ocp1NP30jraF4hhPAar6Yy150lE7diPb0lSuiXO0CvpuXHgomA-CDouyYsaZ86l_2TkO2oUQYndwxmgpyv43Q
"Семена Чиа черные и белые и Кокосовая мука Healthy Lifestyle в пакете зип-лок, 150 г",219 ₽,153 отзыва,"Завтра доставит Ozon, продавец БИОЛАЙФ",https://www.ozon.ru/product/semena-chia-chernyye-i-belye-i-kokosovaya-muka-healthy-lifestyle-v-pakete-zip-lok-150-g-167451472/?advert=H4dy-379KmGKWa5ZE0aUmI9WHMaj9niSobhE_m3hJuI6sFbZWbWPfASqM_7nVcFeVGekKA5PQqDzH9iBtsV82Rh4K3zZmf-BITTr9Wy6qiYbtt-SMg8XhxoHPdAil9HA2FfiMoxIIyWDm1zuPKed6k99PRojAZMQs1n2-N1MmE8ymqLT_LgzTfUx3rRHk7BMVlc0hSA6pekiTM50QcBFaCJFGO4qPJGGxNUVG1Ea74hwAUSjmaZ3KDLxEvoXxGahhOop_gCTJe5KJFlOXKhpg__dzmJjBg6D6lMRWjdQ3BvR-9nBap2IQiS79xqhOrziMDIe-NTblGEkk0WlfdFtBrIy0nBEuQZGsswR0-_sL_wgEH5vfbDLfOM2gGIGBJC7lbPqUWG2facyUIx-LeqUhpufx5Yl0s0ACrkvG6qWQ-OIYkoGR622kYuRDPopEoAj7oit5GMB8gI23ugbGMBzHgFSDBrQ9qOB8lFunPXUZFL3O6-QAkiH2HF47wNM3l3M2MlNuEJ8nFMsdXuCmIX1VyKGXX6F4V07bIttW1gcqhvjujQMbllW9RrMWe_EWorH
"Семена чиа THEOBROMA ""Пища Богов"" 250 г",237 ₽,6 отзывов,"Завтра доставит Ozon, продавец Theobroma Пища Богов",https://www.ozon.ru/product/semena-chia-theobroma-pishcha-bogov-250-g-284874048/?asb=lKEe9ih%252FUbwzvPuTUzVUOCyFkcYjlriTA%252Fv3ZmnMsZ4%253D&asb2=ea-H3YK3OJYlvfGox4XeeM6zIG2rc6Xnytcb9oYMYYg4SZFuqtn3gcQ5XUEmmfrO
"Семена для похудения , Чиа суперфуд , упаковка 350 гр",299 ₽,46 отзывов,"Завтра доставит Ozon, продавец ООО АГРОИМПЭКС",https://www.ozon.ru/product/semena-dlya-pohudeniya-chia-superfud-upakovka-350-gr-398777234/?asb=sQQSPRqhUH7MWU6Db7z1FN5zZN4J2SNKiwPNyep50dNpd6DR7%252B6YCrd9XwscBoDP&asb2=vr6lt_Nl9zIweehi7LPWLBasjYPjZb8vDqeVd5o54fE9hj1inluypLTXmdMalsDsikRobrkgMgyi5hyPm8ojxTGm9GljdOqdQPQQtneuPUKqR3DqPGhzjCukz7CFB1yq3gRktPhICw75iioUNwDwpQ
"Семена чиа чёрные, 1000г",686 ₽,134 отзыва,"Завтра доставит Ozon, продавец BARUSTA",https://www.ozon.ru/product/semena-chia-chernye-1000g-407809867/?asb=EN%252B3qao998CcDBIKucZUVTkD86LrsU5URXKOBJQ%252Fs4U%253D&asb2=_qSxQskqFIayKiOoevcMVam5uKk3amd4uRPvln0DnO7GaY34EQb5v2RvRwwM7wHK
"Семена чиа, 200 г / для похудения / суперфуд / веган",272 ₽,60 отзывов,"Завтра доставит Ozon, продавец ООО ""ПОЛЕЗЗНО""",https://www.ozon.ru/product/semena-chia-200-g-dlya-pohudeniya-superfud-vegan-259163459/?asb=YmJvnGLOumVNzCDCg6gOh2eaQPjf4JCsg%252B1bVYL6y4acsfsWJyBbyFiDjAqLe63J&asb2=sDkWTgfP00RLlSnyZVTa238JJcR67_J3qbgAu25NThDmI-RQkSBzdyqXCwHi7KPy_czwqVwSqbMiLrCzdJ4C-UD_Qw7M3lDjX8zNmw8S89ZWDjJI7B78RAMgVZ1aDIkUCxJPzKQePUQWCIkv3EZBQA
"Семена ЧИА ЧЕРНЫЕ И БЕЛЫЕ 600 г для похудения и очищения в банке Healthy Lifestyle, здоровое питание, диетические продукты, веган, полезный перекус, клетчатка для похудения, детокс, добавки пищевые, суперфуды, низкокалорийные продукты без сахара",559 ₽,193 отзыва,"Завтра доставит Ozon, продавец БИОЛАЙФ",https://www.ozon.ru/product/semena-chia-chernye-i-belye-600-g-dlya-pohudeniya-i-ochishcheniya-v-banke-healthy-lifestyle-203313083/?advert=5sCH7E3ok0CkcuHl6vTqSRePK-SwcD6usFayUjson0nyOkcEJ6MmlBzM0WflqCHpRYxm4cGXCQOCyAis9gWKgZ_DBg1M5jG7-b02Eov1TB_HNc_lx_eyxa1LacqLyCJPy1IYU0bHiXQ8XwmPnh5cVyrNc_wqSdnpHpM27aRQNvYVEiFum1gACdBxob2PKPxS_BEVWCakpdB0PzOaoTdSmL1-a6Gi-9cO3W2xa0vjhoF3rFCaR75YEUJ6fd3kR6Ng8cTrLM9FVxDhP_JmjRf3R2jB1VTaUcBsIeAZCqVCFotMcWuMpAGAqN7tocDBYSUFBkPXgwL7mTlPHloPdcdS3EiSMOZZOpnetsYehp42QmqPXWO-ugmbvg5Ft-OMnOCkoSpSJY4FMbOnAQhKCe9FT9brlfR2PETPmTPtFAqcDT4QM8u-yfkNgjrPOhLBdaWJP5CQNrJ_j0YLI2vcmIOzW9zNJWsc44OFcg0gSOi30lcfznX4RjX48ISFdeFcYyGs5YlQcc-NqzeB8eWDiFEKHeSzT6iWezXokjnr5JuClaTU1GqVhzl-sSgnz8lIkwOj
"АМ/ Семена Чиа, 900 г, черные, Для похудения, Детокс, Для веганов и вегетарианцев, Правильное питание, Фасовка (450 г, 500 г, 900 г, 1 кг)",599 ₽,23 отзыва,"Завтра доставит Ozon, продавец ApriMall",https://www.ozon.ru/product/am-semena-chia-900-g-chernye-dlya-pohudeniya-detoks-dlya-veganov-i-vegetariantsev-pravilnoe-518277838/?asb=L9SSNcexnVkThCm%252FrIO2c4L5mV0SCMRECOG67DFK%252FHFMLVnRzCjYKc%252Bk2XsVR3RJ&asb2=9K25yb-6Et-c-4v50wd_vb-kG5Z682EMvA4qNHzmPi8ppoAZsk3tTBpNcgrKtuYTvZCdsAYQEOuaBgkbo6B5d5x_w3WiCLVQx2IZBrF46Db5PWQvLv2UV4PZOYaqli4RykoVQpm0-q4Bp-dVVxB29A
"Семена чиа черные, Здоровое питание, Правильное питание, 600 г",435 ₽,4 отзыва,"Завтра доставит Ozon, продавец ОРЕХБЕРИ",https://www.ozon.ru/product/semena-chia-chernye-zdorovoe-pitanie-pravilnoe-pitanie-600-g-512245131/?asb=BfCcX7RTzGiotfAhH2IqLOmEaxHd%252BdgBE4V59MfOZhM%253D&asb2=aea7yYOLON1oY7bGdLisQ44n2afMxr9Q9DwXeYChSPmph61maOSvmP5KhvSXfUO3
"Семена чиа, Жив Здоров, 50 г",160 ₽,23 отзыва,"Завтра доставит Ozon, продавец Жив Здоров",https://www.ozon.ru/product/semena-chia-zhiv-zdorov-50-g-271761471/?asb=ryOxdYoey3C%252BT8gcFL5AXXT9L2Ng406YDlo%252F%252Fj6cSyY%253D&asb2=deyftsYXS0GCP5SlkrEgw8Yt7BoiipH4l1lpZmA6z6nbJFpVyO5AgiIvr2YjZp87
Семена Чиа (100 гр),191 ₽,108 отзывов,"10 мая доставит Ozon, продавец ""Руслабнутришн""",https://www.ozon.ru/product/semena-chia-100-gr-299123001/?asb=fgPRQGn3IplaN3w2e15iucOWuxyO1PVDR96zog92rRc%253D&asb2=am-nkFPKvCxXAV9UzBosnEydedY2Y9CqIKjLysMzLXGp53EDSUvMq_CRuWp1n99S
"Семена ЧИА ЧЕРНЫЕ И БЕЛЫЕ 800г пищевые Healthy Lifestyle в банке, для выпечки, салатов, суперфуды пп, снеки, здоровое питание, диетические, веган, полезный перекус, клетчатка для похудения, детокс, добавки пищевые, низкокалорийные продукты без сахара",699 ₽,118 отзывов,"Завтра доставит Ozon, продавец БИОЛАЙФ",https://www.ozon.ru/product/semena-chia-chernye-i-belye-800g-pishchevye-healthy-lifestyle-v-banke-dlya-vypechki-203299335/?advert=DG1sCzYkMO8i4K3MEHj-Ij8rbVcTZZnEPXP13nFzjqCKpVZh0vVJxCjNNKBbqyhBraBT0kz7kTU5ZcyvgVOFJe1HSqO6v9MlhqrAM62RlvTMy1_jQKijkmJ78Yiy0ElDuTpTjE64Rf7x5-bHlqWGE0xbU5nI31lfGSwhFux8NeI2tyyost63fEnUTeC1OMgWKaRl_YJ4x5b9AZGFXNvGh9RJgzZkiLPTHM3qMcWSDdoV6etJ8fYJkZTjpXWS7dzH3fRyKhu3vHkxmyugNUh64pfLj1zAF7pbV94o6ZR5TKQft_-4YeC26uCV7jDzPA-huec661OjBVl_DAVHFAvnvVv9c1j-kJY9qOQUAJbNAnqM9Q7NjGqgl1Y277O4NAPrVpvAswP6DWfEYP46gIUz5Zc0pjEmRKW26TDFj7CDpTWtytfeyEqkszEtO0PRzYtIvAm43xKt-bJF8f_kKwlkzvYnHqciPQtiDjU6ZZUpbUs-prTscm148HZhy9hi9MBSbdDyeRL57g1HSut976Sa0hfAlMhDD3K3v4aKJyC18IOdBplvLXx5-xaIMm1lfB1W
"Семена Чиа черные для похудения ""That Way"" Премиум / суперфуд детокс, 100 г.",230 ₽,30 отзывов,"Завтра доставит Ozon, продавец ИП Крейденко А.О.",https://www.ozon.ru/product/semena-chia-chernye-dlya-pohudeniya-that-way-premium-superfud-detoks-100-g-302407740/?asb=71%252BEZl%252BZIGeYrUN1oNUCrmtngSMMGDV2TUSnVg6i6Sg%253D&asb2=UkADtUmCxiYeJuax-NSJIYsTuQqOOvAMYDk0aoqMMGXX6PnrcxZR-9VBAU6WcKug
"Семена чиа THEOBROMA ""Пища Богов"" 100 г",195 ₽,10 отзывов,"Завтра доставит Ozon, продавец Theobroma Пища Богов",https://www.ozon.ru/product/semena-chia-theobroma-pishcha-bogov-100-g-286608484/?asb=6m%252B1TAc7NwgZivTkAay%252BEet2Oolyi%252FFB941ykdnGCXM%253D&asb2=l21U6YeCclQ4-LOokqKowisfodXy6xfYY0veReRQZBq2cPkO3UcGypxpj76Qrb5N
"Семена ЧИА ЧЕРНЫЕ 250 г пищевые Healthy Lifestyle, продукты для похудения и очищения органические, суперфуд, добавки пищевые, детокс, пп, веган, клетчатка для похудения, полезные снеки, здоровое питание, низкокалорийные продукты без сахара",289 ₽,157 отзывов,"Завтра доставит Ozon, продавец БИОЛАЙФ",https://www.ozon.ru/product/semena-chia-healthy-lifestyle-chernye-250-g-149505342/?asb=833DMzQqwJLzidbWyFx%252FUJAr8oZu6W7ho3LJm0Mjh%252F4%253D&asb2=I_dXgm5uh8MrxTXguG0zpJBwboXTVGGObqY6DfhpZV1AEfjX5bHkS4lskBLbjggu
"4fresh Семена чиа, 250 г",290 ₽,9 отзывов,"Завтра доставит Ozon, продавец 4fresh",https://www.ozon.ru/product/4fresh-semena-chia-250-g-499863259/?asb=JcliTxkrwdyQruROb7rHtElT04yOnRJn9YCnWZo%252FgphDBLnA7yn1R4blnDbL3HmQ&asb2=IZhNHcRNtpNARhFQDf_miKaukpGAtSdVoyLXwyph21BAAYWWe5f99d5AXtgIa4S9tRmV-aTZi6mbLb_zFsHc4cGRNPvfR_yZuZrGTEHvMGZ7_PLEVCtassYUvTJeI6Dqv6_wTFk_WJm6H0yvNAKesA
"Семена ЧИА ЧЕРНЫЕ И БЕЛЫЕ 350 г пищевые в банке TEABREEZE, здоровое питание, продукты для похудения и очищения пп, веган, суперфуды, диетические продукты, полезный перекус, клетчатка для похудения, детокс, низкокалорийные продукты",379 ₽,169 отзывов,"Завтра доставит Ozon, продавец БИОЛАЙФ",https://www.ozon.ru/product/semena-chia-chernye-i-belye-teabreeze-v-banke-pet-350-g-169069638/?advert=qTQSMlU4Imvuzahf-oriqMlKhnbhyJczAdHPrJ4hFtzelw5xj7xYqAhRAIxyEM0roFokc-zLReHrqAfVc6ILI0VJKy9yOtHx0a4Sl6KCbRIs0LkJez_8BsEgzEqtApnGC_ns9_B2s3EJM7uSbBjW0khqJEFR_Mq0i2VWfQG1ANmV-IEMEESppSCm5O4FFhKkCp4cyQahismnnNY--_a9pDuTm5HffisFORRQ3O78M-hwHo2ZdmfEA47ko1WLbbuXhPOQ_aTCPNTnFU4Rg43JhP8OqTWHCdQN_aCUQRYMbdkdicDObZct0FV3ew1gPurDsB1t0WJvd9jZK1rSL6kqNQ6f-suYzwq1tSVOraB3pGl4S8ri4RtJkxw-d9PhYR5IRWmasvHOzwoNY_sJJrrY3ALvwE0OSkoQo8ap2xpV99fW-9QFZ3efG8X_isZKimna06FaKEZxkAureEG3i_urlJRo0n6sRkgHLTgMeRChrX4Nq1XbH69QmTI02yR92xMyqyu6UJ1phYO_YvJAw8NMAccqef2mrU1FAzRodnFbavaZ_x0agIRYPKK8dkrd-qbL
"Семена чиа Premium Freshburg (черные, для похудения, суперфуд) 100 г",205 ₽,13 отзывов,"9 мая доставит Ozon, продавец Freshburg",https://www.ozon.ru/product/semena-chia-premium-freshburg-chernye-dlya-pohudeniya-superfud-100-g-560945054/?asb=xELRIWzzRpwunKWfTBMx4p2qZiBCGszsp274X%252FHNK14%253D&asb2=5Y4VdXl6JVMqa8p2VDYo_rBl5UkvXi2BhFYbdFPRp4ZIWVJ64PrSZ-_95IeP5uVs
"Семена ЧИА ЧЕРНЫЕ И БЕЛЫЕ 250 г пищевые TEABREEZE, продукты для похудения и очищения органические, суперфуд, добавки пищевые, детокс, пп, веган, клетчатка для похудения, полезные снеки, здоровое питание, низкокалорийные продукты без сахара",289 ₽,54 отзыва,"Завтра доставит Ozon, продавец БИОЛАЙФ",https://www.ozon.ru/product/semena-chia-teabreeze-chernye-i-belye-v-pakete-zip-lok-250-g-169019130/?asb=v9WfwoK9ZFdvfnVWjTu5%252BfXxpAvzcHNnqoAUiJqOlSk%253D&asb2=mtax16MaLXhIHiga2i5muI4HeWJVc-Ts-BzAa8IirQSPLsBlGza7yrOrmwr69DG6
"Семена чиа Premium Freshburg (черные, для похудения, суперфуд) 200 г",289 ₽,13 отзывов,"Завтра доставит Ozon, продавец Freshburg",https://www.ozon.ru/product/semena-chia-premium-freshburg-chernye-dlya-pohudeniya-superfud-200-g-513473491/?asb=WUY4yIkt83eZ0LAxXqT872%252BnTHPOMgGC9zSAevDtdYE%253D&asb2=mhViq4peZBVyjXIWwaYO4wwMGnCYM76wUYWx8Dd2nJqozlxwZTtL9Q4oDWvmea8s
Семена чиа черные PREMIUM / 500 г/ Чиа / суперфуд / для похудения / Chia seeds superfood /,529 ₽,39 отзывов,"Завтра доставит Ozon, продавец Концепт Вкуса",https://www.ozon.ru/product/semena-chia-chernye-premium-500-g-chia-superfud-dlya-pohudeniya-chia-seeds-superfood-254889203/?asb=EMcTf9lOuajSFxSnOtCj%252FjjIAwj7C8ZqVxQdbkrXavY%253D&asb2=wDHlE9tHenWv0JHGi0AwljX1mOVwjyzyjNTmoHZbB-9x7TVBUdiRsT3bWfishmfV
"Семена ЧИА ЧЕРНЫЕ И БЕЛЫЕ 500 г пищевые для похудения и очищения TEABREEZE суперфуд, клетчатка для похудения, детокс, пп продукты диетические, здоровый перекус, полезное питание, вегетерианские снеки в дорогу, низкокалорийные продукты без сахара",469 ₽,157 отзывов,"Завтра доставит Ozon, продавец БИОЛАЙФ",https://www.ozon.ru/product/semena-chia-teabreeze-chernye-i-belye-v-pakete-zip-lok-500-g-169019133/?advert=u59yOyxdYUOh-rdbyQWUgIBR8KDzoW9BECqW7YVffn_Cwj5I4V12j35_0ef73hDWMVphIU273uBvO1bQwve5oi6GcB_psIcpg67SThk2cgBtq42EKlX0pdFq0TZ5wIZOHEYdJHlWbCfLhBNWek7BGjYWf7wcFhaScuLH7yQslsuU_fnu0YjA4ydBZ_RppmEJcj9qXD5A-iu7So_ero7fW8BkeGjEOBrGSTcvHIJNqxREW2IaNS4PO36wEOvIi-W3nzCPens4KjHwEiQF87DWeIuICApawYGe3x4bIPlyix9TnzgtLUdw6t3V6l9gQ0BeG-W8FSyOSN6Y8poZNHivQxkMDg0A3mxLaA0KISxbVWkcfACU2eDOXBEjTzG08ex-5Jbe0SagPD2TAS9ZfNPKRnlBVDCGJfgQ-AABm5d-YajynA5IF8ETEUxyyaibbA_ZcP9T_90X-SxKrPUh1fRpva687y1tKrAo7mWJj-0ihxzR_TW_L8ohpwAI6Dp8Qoa5CNw3aky6uWybHHjTmxFtZucbWetLclwvk4O6rLM-g_9EIhZbteLyzVNaZMhIu1QA
"Семена ЧИА ЧЕРНЫЕ И БЕЛЫЕ 250 г пищевые Healthy Lifestyle, продукты для похудения и очищения органические, суперфуд, добавки пищевые, детокс, пп, веган, клетчатка для похудения, полезные снеки, здоровое питание, низкокалорийные продукты без сахара",289 ₽,177 отзывов,"Завтра доставит Ozon, продавец БИОЛАЙФ",https://www.ozon.ru/product/semena-chia-healthy-lifestyle-chernye-i-belye-v-pakete-zip-lok-250-g-149505392/?asb=VeQTGoYicduPKlgpSEdPAGFECG3AkaQIjPlq%252B3Z%252Fqq4%253D&asb2=v70Shr8KtXD42Z0OnGOzkuFjsDZPFcj4hQopq18GfMjOwzqS3TsuXnScrmACc1B4
"Семена Чиа премиум черные и белые для похудения отборные ""Грядка"" 150гр. Суперфуд, ЗОЖ, для десертов и выпечки",225 ₽,1 отзыв,"Завтра доставит Ozon, продавец Грядка",https://www.ozon.ru/product/semena-chia-premium-chernye-i-belye-dlya-pohudeniya-otbornye-gryadka-150gr-superfud-zozh-524346857/?asb=qHvJuWLTow8xjQ5DgYmcneK3gqSCWqZyyeutyJiD9vPNFbLif6LISlwG%252B15Vccyp&asb2=yUU6dKdx5UoD-tZqMVeMsnXIW4d3bh94MZd32daRrfE5NWNXtSf5L8yd-U32NP7vhcyZMSfl2OygTVqbJ6_6MW5sNyCqa8odbsVur2eqyaGzTs8EgDyJzy1unVTO3yama6QuIyOzMr34zy1tRP00Jg
"Семена чиа черные натуральный продукт , детокс, для похудения",193 ₽,15 отзывов,"8 мая доставит Ozon, продавец ФитОрех",https://www.ozon.ru/product/semena-chia-chernye-naturalnyy-produkt-detoks-dlya-pohudeniya-482976105/?asb=EXdzv%252FtnNYV3jPpYfnvBIvIN4xXFP0QXJ8n%252BjugDJvo%253D&asb2=QitmPtXLMjwmbbjPh2iStwkZuC22ECwxvgrnFSw__V-qoiuAfCypO-LnH231Oju0
Семена чиа,215 ₽,49 отзывов,"Завтра доставит Ozon, продавец Вкуснятина",https://www.ozon.ru/product/semena-chia-411129424/?asb=CxvLY3xq9EwEgffwL%252BjBOdMrybDBgtikUPbFHzG2dLs%253D&asb2=v_YGco_tyY2-TRV-FixMzrbbB5pfeF3UFNxiWxioRLqkvQG1xfESnYZA3UM_s2ek
Семена Чиа для похудения,275 ₽,1 отзыв,"Завтра доставит Ozon, продавец ООО «Ваша Дельта» SUPERNOVA FOOD",https://www.ozon.ru/product/semena-chia-dlya-pohudeniya-513081091/?asb=m92rNb%252B2xAVZIl1bsypRH8rxeT9dr%252BoopsYVlzj2scirnQoDDK2D2XHJfZwyMZav&asb2=w0kOEB6woC2ZuKnoL5s8oEh7Il0rPfr6TGcYMQETtxzICRJAX9sy11cNK9PgN5uJOXaoyFveZ1AaWetS45F1AGjCBa8xuQfmCQoXD_252QtH9PKstEyDhwh2xlDgPTj96g4iqJdzIOQ1WIFduxl67Q
"Смесь для салатов ""Настин Сластин"" с чиа и амарантом/овощная смесь/семечки для салата смесь (90 гр.)",164 ₽,146 отзывов,"8 мая доставит Ozon, продавец Настин Сластин",https://www.ozon.ru/product/smes-dlya-salatov-s-chia-i-amarantom-90-g-163183262/?asb=2dx9Bq%252FoSlz%252F4KNClMD0ttCr3AiTnQHV4O%252FgSiNn6LU%253D&asb2=gmvZLXYYX2fBzCzy8W1JpRG_SsBptLhjrbC38xxwvhcNxBA6w7hVMYBfTDhXUncr
"Премиум семена чиа Guarchibao Chia Seeds суперфуд для здоровья и красоты. Для похудения, детокса, улучшения пищеварения, снижения и контроля веса. Богаты растительным белком, клетчаткой, Омега, комплекс витаминов и микроэлементов. Зип-пакет 300гр",416 ₽,157 отзывов,"Завтра доставит Ozon, продавец Guarchibao",https://www.ozon.ru/product/premium-semena-chia-guarchibao-chia-seeds-superfud-dlya-zdorovya-i-krasoty-dlya-pohudeniya-detoksa-170872748/?asb=ydc%252BVy0c50rrxfKXQ2uXJBxyYLi%252BttxxDmenmLsU2sw%253D&asb2=UNtuxdwaTdXEXzld0hdcnyaMMrtgkx22O63iDEk8mqZIfiluWDV7RXvrT6M-TKpz
Семена чиа UFOOD / очищенные / 250 г,317 ₽,29 отзывов,"Завтра доставит Ozon, продавец UFOOD.MARKET",https://www.ozon.ru/product/semena-chia-ufood-ochishchennye-250-g-410209671/?asb=nZGgl2%252FPc819uABJ9LFMOnwUrAHuGgs3GM6Xg7LIcqvsy44Rq5mRsWbU0q9SktCX&asb2=TY-AvnQ-yVXsdDSKSQX9ZEZRfcdgqMtTBpkU6YKK9dqARzeDMuqQ7Tz9OqS-t6i01ftbva8ExiEUacftAP5hqBSOtFrh6jIDOoCbW2KJ68g_3BzevrvP_AL7bJylxoOsHz37C1alR8fbw5lgqSe4XA
"Семена чиа, Жив Здоров, 100г",198 ₽,70 отзывов,"Завтра доставит Ozon, продавец Жив Здоров",https://www.ozon.ru/product/semena-chia-zhiv-zdorov-100g-264611693/?asb=BgjAjXRgx9LEek07pInKwGyCF2DY%252FMRTdFPSlqIffUA%253D&asb2=zNNLK1zIPkCR2sIevByVr-M9xagsp9HMdXuN6iiqaZ7RIfk1VCptWIq5sjHHgya-
Семена чиа для похудения Суперфуд/чиа/семена чиа черные/чиа белые/семена пищевые100 грамм,229 ₽,18 отзывов,"Завтра доставит Ozon, продавец Лавка Вкусного Чая",https://www.ozon.ru/product/semena-chia-dlya-pohudeniya-superfud-chia-semena-chia-chernye-chia-belye-semena-pishchevye100-gramm-272315962/?asb=C05TYK0ak54n8iNNHjg9HCPGRGah%252Bpcdh9UmDV48xSYrNjjwMXE9NsFBEjpUhK4X&asb2=DLkSEE2XYP_UVgjnL7aBY1K2CwqDGms2_ogc06QJkZgy1sA2xBGYVRGWOOwx6vObmOLVnFnSpxB5qE1Wi0g9xP08oGFv7iFbjq_N4M_rDYr7jrsiJlU6-cLM0hGsBq--lpxRnhFga1DQhdykFB8Jcg
"Натуральные семена ЧИА 300 грамм, черные и белые Чиа семена Premium",414 ₽,157 отзывов,"Завтра доставит Ozon, продавец GOODPLUS",https://www.ozon.ru/product/naturalnye-semena-chia-300-gramm-chernye-i-belye-chia-semena-premium-195644424/?asb=ceuRArfck1jwdvWXdASCtVJduaUgThTS732mAf0vxudQ08EXl8cHJKegqqOAFist&asb2=tRFN9T6Ma71q30cj5YGJLfYGxiKhaPH_0ZAuc5UdgSEVE1zf3sIjXOa44h-YGoa4AapWspu_NWL08mvt--sHOCdk_s1-pPV5s0p7sB00wxidwfaH3TK1AfXtlblZqOULxQl5DBzyfeCV7u3LY3P6Uw
