Поводок автомобильный / Поводок в машину / Ремень безопасности для собак / Универсальный поводок для автомобиля/Автомобильный ремень безопасности для собак и кошек/Ошейник для животных в авто,424 ₽,8 отзывов,"Завтра доставит Ozon, продавец Я&R - товары для дома",https://www.ozon.ru/product/povodok-avtomobilnyy-povodok-v-mashinu-remen-bezopasnosti-dlya-sobak-universalnyy-povodok-484268913/?advert=18KEzVftlVez0jCiluEYoxMZ7-doytjWOaKmnIppnC1D343aJyix60Xj-bcI2st6FmxNlbiFUI6HpxkrFcTexGh5ACzrsCXKhgLPTuPCT_sKmGvr6zFpVNmrDNKb9nG177FUMya4NV2EUylPt3kh-0q0GCvuf5uA33wgKerjTinturqDNpIKsLou3AaIQ_ZY8ex1UuoIdmAmgdUOFluK3qJXlRTBYFVBA7L0NCJnK_gQ2VS-ZG3ZX2sWsABbpt7yprC4JY9evr_A_RK3kR_OoL62aD5oIU2V-UcVyzg1BLj5FMoYgBGag6d0hSVHxiCQKmfpntArnim-SUaNOgxQzmaYTUmrqL-t1wcyhDIbrsworBknbYnAyM7stfY37xB4uXCIKMtpgVw1a26Rl9YaZLfxL9nYDoZdzhoJvXZpxKSKUj8M9R4p2wEkhOwSV-t5JIUMw3L44Nh5aOiGb0ueDrNYeMuRtAnlzYCPYfKE053-Li9uABcEHD8Lmtkp4aOszPf7Wrp4FFQhBUTpiE2UH-unWr2Hf0fNI_lquM8B4bw5jc7bVL6mEJQNSh6usFo5
"Шлейка - поводок КИСПИС 130см, синий",191 ₽,148 отзывов,"Завтра доставит Ozon, продавец Котофей",https://www.ozon.ru/product/shleyka-povodok-kispis-130sm-siniy-157535239/?asb=sYdqu1TgMIJc2dSupURXY3qpXAEZ3gvf2%252B9ZRygsw21FPFb6HdK3yx85yjSBSFCI&asb2=pVaLxNV1pkFEUK0J6L1AfrSV6bNwd-RbQrWm5j3dTQpQ-0M9JBBbatSf0l2MXXLkLdl0cYKpj1qIJOdFoM7x-btk5GSwC7UddcrfsMkr20nHzvgtFaP3vqTiecfwKCPqKfXt5ID_iKUIkDJLzyHyDw
"Шлейка для собак и кошек с поводком 1.3м, дышащая шлейка со светоотражающими элементами для собак мелких, средних пород и кошек",494 ₽,24 отзыва,"Завтра доставит Ozon, продавец KINGDOM pets",https://www.ozon.ru/product/shleyka-dlya-sobak-i-koshek-s-povodkom-1-3m-dyshashchaya-shleyka-so-svetootrazhayushchimi-527512159/?asb=TrqHANQaRrtWjhGk3G6enL3CZ%252BTfaSSgZAv%252BpfqtjJM%253D&asb2=-NAVYr-O98gYP7zwLO5QB0T3DgbyPJdhOlX7aPTEC48opnXLv5Ck0yNpmT0z3cti
"Поводок рулетка Синий 5м до 15 кг для животных (собак, кошек, кроликов, хорьков, шиншилл) лента",500 ₽,118 отзывов,"Завтра доставит Ozon, продавец ИП Максимова Л.В.",https://www.ozon.ru/product/povodok-ruletka-siniy-5m-do-15-kg-dlya-zhivotnyh-sobak-koshek-krolikov-horkov-shinshill-lenta-455382088/?asb=3UpDPwUA%252B4SCPpeBGUKYUQtShpzfEd%252FZrWaO7B514ggjbYRcP%252B7ywnPFmvRU3Z62&asb2=JbA4GOxeJfJEBquHYe6zh2JPH_8JPvD_4sdRNosscBvxlvdcCq4au8WqMjYEwUDFvH0liG1ozKlg9gZekKraxBjWxMC-pUnVxsW75Z90PaakyopoxAZ36zZx0P7Y8zd3cKoyBkpUvUv2qk8Lqp48JQ
Ошейник светоотражающий для кошек и маленьких собак 19-32 см,189 ₽,8 отзывов,"Завтра доставит Ozon, продавец Безусловная Любовь",https://www.ozon.ru/product/osheynik-svetootrazhayushchiy-dlya-koshek-i-malenkih-sobak-19-32-sm-501011490/?asb=IUfY4cgCh0jWYOnolB00M0xWVso23uWTLTax9LRdzXAG2N4qEQ85K%252FouAhnWdH8S&asb2=RzMQtJcHdf9VNk-eolBw057Ju3BMENFIsNkik6bt2GZx50U6IVVfDfX3ewGL-7xc8zgj5UVnyKBWHS1KwNE1BkQhlvMU3b1tO1KNfKjtrp-aed-h6Inb7w_aG7aWsfNBTCxuerkaPrH-ndp7zB9_0w
"Поводок рулетка Синий 3м от 1 до 10 кг для животных (собак, кошек, кроликов, хорьков, шиншилл) лента",432 ₽,118 отзывов,"Завтра доставит Ozon, продавец ИП Максимова Л.В.",https://www.ozon.ru/product/povodok-ruletka-siniy-3m-ot-1-do-10-kg-dlya-zhivotnyh-sobak-koshek-krolikov-horkov-shinshill-lenta-455373039/?asb=bUJM0irUlH6gZ7%252FDDtjSYVYK9qjB9RFX6xs5yqQRgZMQZIpB2RSBzIQ7%252BvKeaeEi&asb2=NUVl1Wfs4F7F5M8KnF0WT720vDpuipm1bV8-eD5kCAlOsUA1UEKRuRkerzJdhbRVn7BgAq6wrczOLbGOAmZJi3YSPofAtv-BdeN9mZ0mLapOT2C1GY1uCKXJyNPn5Z5c3ZG3-9EYzd_8aJmr5NJNWw
"Шлейка - поводок КИСПИС 130см, черный",185 ₽,161 отзыв,"Послезавтра доставит Ozon, продавец Добрый выбор",https://www.ozon.ru/product/shleyka-povodok-kispis-130sm-chernyy-230610793/?asb=FSBVk16sUYSeDUwB9y%252BbWZhImsSRtM5UqRizHz8vA%252F0h0PUwkmOiKXsm3CfiH5F4&asb2=HdB9ly-2dygsPHbKdt2jTlxvUQjldK1Z5JGcWKS-ir2sAnbkwaca90s7IiWTK4k8ST-8OcCjwq0Mc4Ae57PduzHms-HzddJc16K3lPMSeRyJ3-BRLSf3xDxHVe3Y8EBvHPmPyPtEa0MANd8eBUcKjQ
"Поводок для собак усиленный, светоотражающий нейлоновый поводок для собак мелких, средних и крупных пород",456 ₽,15 отзывов,"Завтра доставит Ozon, продавец KINGDOM pets",https://www.ozon.ru/product/povodok-dlya-sobak-usilennyy-svetootrazhayushchiy-neylonovyy-povodok-dlya-sobak-melkih-srednih-i-527458183/?asb=g0np3cl4HV0ZYff%252BP5k4jzCFb6eD63DwJij%252FOcbQ9j0%253D&asb2=anSoTOGCWsLhGCQ62trCFx7JhL_skCWA4u4V6ySSJ2jXyN3QuFqGasF7RaPO-o4l
"Ошейник светящийся для собак и кошек светодиодный нейлоновый зеленого цвета, размер XS - 2,0х28-40 см",219 ₽,29 отзывов,"Завтра доставит Ozon, продавец АвтоТрейд",https://www.ozon.ru/product/osheynik-svetyashchiysya-dlya-sobak-i-koshek-svetodiodnyy-neylonovyy-zelenogo-tsveta-razmer-xs-519823655/?asb=VLOKHFHVUIpdXC9cBz%252FUdIzBkZGy5KygHCyS%252BVHXTZ0NgOuuDCRCVst3jpy4Fu2Q&asb2=2lKL7jYh5IzCEHbRXgVVfw_SOvm72_d772y7r9JWQGNRdEct7RJHsH5nc6IhWFl1bs0c3mrSta_9WtFyL8TLGhjyk0bgdgSlo2fODAdaluQr1inAajez7he1eoJE-XTyPSH0QUJDeTzZVqHIP9rM_w
"Ошейник светящийся для собак и кошек светодиодный нейлоновый розового цвета, размер XS - 2,0х28-40 см",219 ₽,29 отзывов,"Завтра доставит Ozon, продавец АвтоТрейд",https://www.ozon.ru/product/osheynik-svetyashchiysya-dlya-sobak-i-koshek-svetodiodnyy-neylonovyy-rozovogo-tsveta-razmer-xs-519639501/?asb=KLGEQ%252FSSDQOO8IJgEqvaUiEgPBZxWl70m9U0Ufo8RO8BSyNt%252BVuhZ2gfduMa4vOO&asb2=FiKbfua9zISDmAX5Vwm-fUA2a8a29qXgBzj8T5i50StMkBnCNK0DuTzxzhr7sUO3fSTlzTb7mdNvMADfFbpgZBbKm3FPqJBaOA2m5pYVNCKsmXw-YakvkvG0aUWSoQwWrid6A_FiIQKlXN3pXw6J8A
"Шлейка для хорьков с поводком DUVO+, розовая, 15x5x1,8см (Бельгия)",440 ₽,35 отзывов,"Послезавтра доставит Ozon, продавец ООО ""АС-Капитал""",https://www.ozon.ru/product/shleyka-dlya-horkov-s-povodkom-duvo-rozovaya-15x5x1-8sm-belgiya-304564702/?asb=1gKUzNzJGUz%252FPRnAAznFnUpEZaNKVWVi45l3g9%252BDgWo%253D&asb2=_XRVprcFwGN1q29ZnvwHuGNT3s5LZ_IvffWf9grlWwxXMm9w_3iNiTRf9Hp9Xc_J
Ошейник кожаный с утепленной подкладкой для собак средних и больших пород 30мм/62см/Ошейник прочный/Ошейник крепкий,549 ₽,16 отзывов,"8 мая доставит Ozon, продавец ИП Якунин Игорь",https://www.ozon.ru/product/osheynik-kozhanyy-s-uteplennoy-podkladkoy-dlya-sobak-srednih-i-bolshih-porod-30mm-62sm-486083723/?asb=Z981z%252F%252FTwIdtmwQ5Y1JkYWnW2avfddjhcl%252BlRuEiU5FZYcZtN70hMmoW6pbBd%252B%252BW&asb2=ar3b3vbYwOQrOg_CslHiR84HyJQ7aqXEXUtuIBlGtKp1PMNaApkUvLSO2fFh8_Ty3sl84aOVcPXcma5ehnpvR7s-ktkyepOEVY9YO8WCbkBdactKxgrdiNzoGHaUxJJm
