"MAMELLE 1 cмеcь молочная cухая, 0-6мес., 350гр",246 ₽,7 отзывов,"Завтра доставит Ozon, продавец Детские Продукты",https://www.ozon.ru/product/mamelle-1-cmec-molochnaya-cuhaya-0-6mes-350gr-546396297/?asb=5ygt9aM5KxWKunDqhl8LT7IMBaxtcLbMuVuUEUHp6aw%253D&asb2=_IIzi_OJKnu5eYBkSh1jfl1d-xhw3tzGeSlMrcVCm6Ti5gWOChiwIriEYqsygvu8
"MAMELLE 3 напиток молочный сухой 12+, 350гр",246 ₽,2 отзыва,"Завтра доставит Ozon, продавец Детские Продукты",https://www.ozon.ru/product/mamelle-3-napitok-molochnyy-suhoy-12-350gr-546399597/?asb=PhLusbXIhaiIl2acrGJtaQQNzORXKCoB%252BgFZ2d7w%252BZo%253D&asb2=-7Bf0xhSOwDG6CJD2jPHhimk203lk15YzWKwL57dzpOEvAMIahZ9gIXrQ1YbfGEw
"MAMELLE 2 cмеcь молочная cухая, 6-12мес., 350гр",246 ₽,2 отзыва,"Завтра доставит Ozon, продавец Детские Продукты",https://www.ozon.ru/product/mamelle-2-cmec-molochnaya-cuhaya-6-12mes-350gr-546397251/?asb=gndEm43gLEO0DPnKL7Y4dGtfMpdeJ3cFUoOAMP2SBTM%253D&asb2=7vRwWDL99lFsovTvdFWg8iFtld0pKwkOS8UXWHWTQRDHjJuaMRu7SiOsGadiqq4W
"БЕЛЛАКТ Напиток ""Bellakt 12+"", 350 гр./21",358 ₽,176 отзывов,"Завтра доставит Ozon, продавец Детские Продукты",https://www.ozon.ru/product/molochnaya-smes-bellakt-12-s-12-mesyatsev-350-g-202299732/?asb=P88dyyTnye6l%252Fjnoxz4KjoOlttvvM6wg2hof4o7Ek7E%253D&asb2=MfzUbmjao945zFxtfSFUqJ4OQ9MmicW4lgR6J9xV3mk2JA3Qks5skgy4Z_znY8EV
Беллакт молочный сухой напиток Мама плюс 400 гр,395 ₽,135 отзывов,"Завтра доставит Ozon, продавец Детские Продукты",https://www.ozon.ru/product/molochnyy-suhoy-napitok-bellakt-mama-plyus-suhaya-400-g-184439182/?asb=322NzZ2FWxiHBUegg1NvHk6z8PmjyiIxJBs%252Fyq7IF8s%253D&asb2=_oT8K4FZDRgxH9B4-xMyEvTTPjLrsVtFyVZQk_Mcr3MoeqGb8sFFiS7aYhQfHzEp
"MAMELLE PREMIUM cмеcь молочная cухая, 0-12мес., 350гр",345 ₽,2 отзыва,"Завтра доставит Ozon, продавец Детские Продукты",https://www.ozon.ru/product/mamelle-premium-cmec-molochnaya-cuhaya-0-12mes-350gr-546400654/?asb=CMTae2lNyTFTvllTejkhn9swCpYyDmqjhyA6roi1bpM%253D&asb2=MlmY13_AWs6pvUwMdbJLqvrOXi2cPZXL2icvfOwWDAXGXvExdJJjGViN6DEuvjbd
"Молочная смесь Беллакт, сухая, безлактозная, с рождения, 400 г",493 ₽,139 отзывов,"Завтра доставит Ozon, продавец Детские Продукты",https://www.ozon.ru/product/molochnaya-smes-bellakt-suhaya-bezlaktoznaya-s-rozhdeniya-400-g-177014195/?asb=e9Ev4phE81RRX06gEmH4L814I1kdXjQYKRjb7hMHE5w%253D&asb2=xUmcxIMP9scjfFIgZcFShBojOewZud4tldGlmT2vZQyoy4XzpEVUW7jHrwUrRZ2-
"MAMELLE PREMIUM 1 cмеcь молочная cухая, 0-6мес., 350гр",345 ₽,2 отзыва,"Завтра доставит Ozon, продавец Детские Продукты",https://www.ozon.ru/product/mamelle-premium-1-cmec-molochnaya-cuhaya-0-6mes-350gr-546393820/?asb=auvUCH9qLvXZL4v422TzBEtlMC4hSlf3vxx%252B35C7m20%253D&asb2=SBrc80_PH2YTLXJJj9VprKdeo15XnblGyKQsJ-KEdHlEGZ4XYCnPk_ksq-Q1Q0V6
"Беллакт сухая молочная смесь с 6 мес до 1 года, 2 уп по 300г",533 ₽,2 отзыва,"Завтра доставит Ozon, продавец ООО ""Технотрейд""",https://www.ozon.ru/product/bellakt-suhaya-molochnaya-smes-s-6-mes-do-1-goda-2-up-po-300g-557041640/?asb=ubwRrogaH6Gi%252FUhdh47BOBQsLazuQP85KCkV8lPdv2U%253D&asb2=EOB-5nDEf5-bbcVcRLeL3w_BUD1ojewacRjq3UDU9EGN2Df2eoxtsR931VVCMytU
"Пробиотик в каплях, NANCARE FLORA PROTECT, с 0 мес, для микрофлоры кишечника, 5 мл",869 ₽,11 отзывов,"Завтра доставит Ozon, продавец Ozon",https://www.ozon.ru/product/probiotik-v-kaplyah-nancare-flora-protect-s-0-mes-dlya-mikroflory-kishechnika-5-ml-495800644/?asb=2nuQBDZr1TDCY13a8pjrJs5O0piBeiZfslbA67%252Fnpkk%253D&asb2=SRtu7EyLuUOfuGqPFnnRJT8oSb8U4385Zx97iHqcRyg4fvxvPFoeCjjMaL4IoqEo
Смесь Similac Gold 1 c 0 до 6 месяцев 800 гр.,908 ₽,59 отзывов,"Завтра доставит Ozon, продавец Similac Shop",https://www.ozon.ru/product/smes-similac-gold-1-c-0-do-6-mesyatsev-800-gr-483933904/?asb=GnxkFGH0kmwTDQM8BHxpPfACvYyJh50vHxcSI%252FeutcI%253D&asb2=MocVnxzAq25xECM9Ffj2w45Lll2Jt2LixCWslOOJ_GGT4VFYZMgcrsMCiX6-h7rR
Смесь Similac Gold 1 с 0 до 6 месяцев 400 гр.,599 ₽,47 отзывов,"Завтра доставит Ozon, продавец Similac Shop",https://www.ozon.ru/product/smes-similac-gold-1-s-0-do-6-mesyatsev-400-gr-422002401/?asb=UPRuTQj4Eq09zLAGP1bzqPGeO6mTY3KjTOurVHH4Yw8%253D&asb2=5oD-1UwdfqTdZGhyjBSlX6wsiRb2Wf0ceHg3F9GmIl0peNjATdbXSFKIi4HeO3kc
Смесь Similac Изомил на основе изолята соевого белка с 0 месяцев 400 гр.,829 ₽,9 отзывов,"Завтра доставит Ozon, продавец Similac Shop",https://www.ozon.ru/product/smes-similac-izomil-na-osnove-izolyata-soevogo-belka-s-0-mesyatsev-400-gr-485932895/?asb=irGPQ2Ew0K2q66OMoiQvVTpfXE4Ij6%252Bbf9DsSqSZSdA%253D&asb2=Sw6uj0Ok_yASk7kPXQjNogD980G7papPIHXWPXfsSHmdUBDRAr6pOQHIgUyBKXOR
БЕЛЛАКТ Сухая молочная смесь АР 400,733 ₽,17 отзывов,"Завтра доставит Ozon, продавец Детские Продукты",https://www.ozon.ru/product/bellakt-suhaya-molochnaya-smes-ar-400-272372830/?asb=dmJsWyCM2WT9ejNWEW7v7LB0b1am5ciw%252F6Dk31sP2Mo%253D&asb2=xC3K4AflxlR8GWrIzO2e31eCoLsOyJ_KEhbAwRAkqwWX12BYHCYyiviIszq-Kb1G
"Сухая молочная смесь Fabimilk 1 от 0 до 6 месяцев, 400 г",895 ₽,12 отзывов,"Завтра доставит Ozon, продавец Л.Арго",https://www.ozon.ru/product/suhaya-molochnaya-smes-fabimilk-1-ot-0-do-6-mesyatsev-400-g-507178954/?asb=RtASMw2gduHAtc4pWTLscH%252Ffoi2sQ8TjvjTo5oess%252Bc%253D&asb2=srMWBqlBQ0Z_xlyRAPnoZdg6S7sp83ZyLtShQ4I3hyt5xjpOjqbYkbQZ1uYxamQK
БЕЛЛАКТ Смесь КОМФОРТ для питания детей раннего возраста 350 гр,787 ₽,2 отзыва,"Завтра доставит Ozon, продавец Детские Продукты",https://www.ozon.ru/product/bellakt-smes-komfort-dlya-pitaniya-detey-rannego-vozrasta-350-gr-272685402/?asb=AAtsZ3jJ5AtfTNfNO7QuWjgx8D2kHdodjnB%252BBbA0Uis%253D&asb2=gbfuoCOuR8EEFvnFk2rr_zG3zhNZhkOsz19z5QtuXFJBqAMdksfBl2oM3bUshBrT
"БЕЛЛАКТ Смесь сухая гипоаллергенная для диетического профилактического питания детей раннего ГА 0-12, 300 г",576 ₽,81 отзыв,"9 мая доставит Ozon, продавец Детские Продукты",https://www.ozon.ru/product/molochnaya-smes-bellakt-ga-1-suhaya-gipoallergennaya-dlya-dieticheskogo-profilakticheskogo-177014157/?asb=r9NjKjbTfmpDw%252B8TmiwvGNSNMQcldnTWRj8nTWkBE%252FY%253D&asb2=fnxvYco96pxXr1RRXzQtadffsUU5FOPxRZNWeBP9zgOtqHIPTPF3HC_bFW9GuK7b
БЕЛЛАКТ Сухая молочная смесь ИММУНИС-1+ 400,421 ₽,29 отзывов,"Завтра доставит Ozon, продавец Детские Продукты",https://www.ozon.ru/product/bellakt-suhaya-molochnaya-smes-immunis-1-400-273068166/?asb=4HKiuAGzQmjSW0aY1%252BDCudTXmZpWsxYQEdzjiPSrq%252Fg%253D&asb2=AchzCHrMrdtH6zbPvLgNHYMiNIHSBhL6Z-za5-LU4AgbGtU3MQf0HP_LE_hzcG5X
Смесь Similac Классик 2 молочная смесь с 6 до 12 месяцев 600 гр.,589 ₽,17 отзывов,"Завтра доставит Ozon, продавец Similac Shop",https://www.ozon.ru/product/smes-similac-klassik-2-molochnaya-smes-s-6-do-12-mesyatsev-600-gr-483921282/?asb=I2haBEcyq3x1ONiGeWk%252FopCaWWgwzSIwfuzZTlcYOi4%253D&asb2=INGDlaNGQ1lk-wgokZuukQAUxW-hykXpCyS58wC6uXzd4kQI0xFzDPgBKzg4OEHy
Смесь Similac Антирефлюкс для уменьшения частоты срыгивания с рождения 375 гр.,899 ₽,4 отзыва,"Завтра доставит Ozon, продавец Similac Shop",https://www.ozon.ru/product/smes-similac-antireflyuks-dlya-umensheniya-chastoty-srygivaniya-s-rozhdeniya-375-gr-425985045/?asb=dQwNJ2PyCnPTpsygnzt6sFL%252BlZrvBbu%252BI3UTU2xUHYQ%253D&asb2=DDm_vb2cUDeEnx6bQlUwZDrEyVFm-YEpYtDXGPnbJMKiHPEpjnDffJuirgv2Cgjw
Смесь Similac Комфорт 2 для детей с коликами и запорами с 6 до 12 месяцев 375 гр.,808 ₽,7 отзывов,"Завтра доставит Ozon, продавец Similac Shop",https://www.ozon.ru/product/smes-similac-komfort-2-dlya-detey-s-kolikami-i-zaporami-s-6-do-12-mesyatsev-375-gr-421961494/?asb=mDV1QTcUxl8KjH2NyEeHKlpxZiYQeFa9Q3fP3tQeKI4%253D&asb2=_D-RJm4LkdqDwWWOr76_e09uqow4B9MHzVcRkvM5gVq7lSMnrvcPpUq_tfaoJne4
"Молочная смесь Nutrilak Premium 1, с 0 до 6 месяцев, 300 г",345 ₽,30 отзывов,"9 мая доставит Ozon, продавец Ozon",https://www.ozon.ru/product/molochnaya-smes-nutrilak-premium-1-s-0-do-6-mesyatsev-300-g-473002804/?asb=hvvca%252BiTId7L4I28CcxLSiop5Y%252FuS0wHRAuj1lnY4Q%252FwIEH4iyxJtEQpXG5IwR7C&asb2=uFBe3Chpz_-Vv2LJ5Eq3Bmb3e_NUPHtn1KpJK2deUHWOE3Wu9qj2BOk5qUAi38_5vJqdy5w2sFsRXhjnsAsEjNmbrKEuQJZGYl9vQrsXrSfWmkQ384Syws0MIVWru0NpVr4ci0mkBvnExoiEBRBAIw
"Молочная смесь Abbott Similac Антирефлюкс 1, с рождения, 375 г",880 ₽,184 отзыва,За час курьером Ozon fresh,https://www.ozon.ru/product/similac-antireflyuks-smes-s-0-mesyatsev-375-g-141531160/?asb=4RJzH3pGitb9JBwn9bOKiNzXrsDJPpK6kiQ4L2YxcsE%253D&asb2=fGlAV4QNibrKZWMBDlGDO0hZVmsKYNt-xYMI4nJ5crXgMJ8yK2kjglr8Eh9fx_MW
Смесь Similac Классик 1 молочная смесь с 0 до 6 месяцев 600 гр.,507 ₽,17 отзывов,"Завтра доставит Ozon, продавец Similac Shop",https://www.ozon.ru/product/smes-similac-klassik-1-molochnaya-smes-s-0-do-6-mesyatsev-600-gr-483915493/?asb=UBtE76MmoEug3S2sDzajKEUJbCPawKxvEw59qgUkgc8%253D&asb2=nnnYktBroJNlF3j4dzgIHdUnMbeaYWZ49OGhraQT4ouFJluiYJdLbNVOF6fVZG_i
Смесь Similac Gold 2 с 6 до 12 месяцев 800 гр.,960 ₽,10 отзывов,"Завтра доставит Ozon, продавец Similac Shop",https://www.ozon.ru/product/smes-similac-gold-2-s-6-do-12-mesyatsev-800-gr-484058081/?asb=QZx%252BMjw%252B8tpdkGEgXjmPOtN8CcUz21fnxEVl5%252FnQChc%253D&asb2=tk_1iZqRFT7fYAR4q6DP9qqV3JnYWlEYzJa5rXaYsbwGLWzfp4cm2RcjTNzKOOFt
Смесь Similak Gold 2 с 6 до 12 месяцев 400гр.,619 ₽,24 отзыва,"Завтра доставит Ozon, продавец Similac Shop",https://www.ozon.ru/product/smes-similak-gold-2-s-6-do-12-mesyatsev-400gr-422013587/?asb=BweA1E4i73I8GIWxfl3zxqpzM1CotnIGISyJgs57QMQ%253D&asb2=IPEXdWu4WIU0uUlWvDT7y6Jz2qvjE5j-xm3Rio4Suib0CfJYPqMci9IYqk-t8z9b
Смесь Similac Комфорт 1 для детей с коликами и запорами с рождения до 6 месяцев 375 гр.,839 ₽,20 отзывов,"Завтра доставит Ozon, продавец Similac Shop",https://www.ozon.ru/product/smes-similac-komfort-1-dlya-detey-s-kolikami-i-zaporami-s-rozhdeniya-do-6-mesyatsev-375-gr-420249946/?asb=rWeIRVPp%252BLJGxWAMqdFyjavxQthkBffPjrkBcL9FRaw%253D&asb2=cwWnXTYzMj42lOmu-BVhSEb2JXLGjtFBb_b9DEQ5oyowJGqGtGQPB8K2EsHL_wq8
Детское молочко Similac Gold 3 с 12 месяцев 400 гр.,599 ₽,7 отзывов,"Завтра доставит Ozon, продавец Similac Shop",https://www.ozon.ru/product/detskoe-molochko-similac-gold-3-s-12-mesyatsev-400-gr-422015471/?asb=0rmHsZ9vdXE3HBywwP3dHAm%252BEYfiK6SmHlgobp0jSpE%253D&asb2=Z3TwN7vOjHhaHIdfyTYxYqEUlhi4NsrmMCX1LG1P0j_OIRBXEG3ezlnrnErkCfsd
"Молочная смесь Беллакт Пре, сухая, с рождения, 400 г",668 ₽,46 отзывов,"Завтра доставит Ozon, продавец Детские Продукты",https://www.ozon.ru/product/molochnaya-smes-bellakt-pre-suhaya-s-rozhdeniya-400-g-177008385/?asb=TtQ9gsOnJa1Y3Dsrqw99L1rAL6RgaVL1%252FBXLOX9%252FDmo%253D&asb2=XCzR-7g-YPgpk2mkWNB8A6fauqkh4o-bVqEnJ_F50ypTtX-x2DOvNBxT4nXjgKcx
"БЕЛЛАКТ Смесь сухая молочная начальная адаптированная ""Bellakt Opti Active 1"" для питания детей с рождения до 6 месяцев",509 ₽,21 отзыв,"Завтра доставит Ozon, продавец Детские Продукты",https://www.ozon.ru/product/bellakt-smes-suhaya-molochnaya-nachalnaya-adaptirovannaya-bellakt-opti-active-1-dlya-pitaniya-259609515/?asb=MNUxCwAe07leQDlLD6QVBlZf3DjTjFDtSnylErtDdXg%253D&asb2=iZq_9yEC3qCjUbZF0kzgY3OlRkfESNQKoBK8wc2h1BvF6vzzcsxh5r5GAUu4rytn
"БЕЛЛАКТ Смесь сухая молочная последующая адаптированная с бифидобактериями ""Bellakt Immuno Activе 2"" для питания детей с 6 месяцев",471 ₽,21 отзыв,"Завтра доставит Ozon, продавец Детские Продукты",https://www.ozon.ru/product/bellakt-smes-suhaya-molochnaya-posleduyushchaya-adaptirovannaya-s-bifidobakteriyami-bellakt-immuno-259609541/?asb=QavMSXxcWzY6pCf%252Fm8h49cAIrLh3ije3Y6tMWLbf3Io%253D&asb2=Wp5LTC6DfBleuhpnYk73qTDHeNuArA4ULa3krXEWCqezDhIrF545WpEbGq0iNwgt
"БЕЛЛАКТ Напиток сухой молочный ""Bellakt Оpti Аctive 3"" обогащенный витаминами и минералами для питания детей с 12 месяцев",454 ₽,21 отзыв,"Завтра доставит Ozon, продавец Детские Продукты",https://www.ozon.ru/product/bellakt-napitok-suhoy-molochnyy-bellakt-opti-active-3-obogashchennyy-vitaminami-i-mineralami-259609600/?asb=Wu0D%252BhalP4qltzyJWPGCCH0LALsfvcsWO9X9JedVudM%253D&asb2=pm3AX3BdDTB1zZ2MDKTFndDiKhrWjuNGlw_2u-Qp4VmLHf8BiSvY8tdVaHaN2xgD
Смесь Similac Гипоаллергенный 2 для детей с риском аллергии с 6 до 12 месяцев 375 гр.,995 ₽,2 отзыва,"Завтра доставит Ozon, продавец Similac Shop",https://www.ozon.ru/product/smes-similac-gipoallergennyy-2-dlya-detey-s-riskom-allergii-s-6-do-12-mesyatsev-375-gr-426034297/?asb=CuJ%252FBCRZeuhFaadPVquEOeHRjkXhWb9t21byEhhvKfc%253D&asb2=mIZINJ837k3rbNvo4WNfwiViiGquiT43Ro2Jvb3ODWD0aqLXDIPzahoRAEQdJH6R
"Детское молочко Nutricia Малютка 4, с 18 месяцев, 300 г",281 ₽,88 отзывов,За час курьером Ozon fresh,https://www.ozon.ru/product/detskoe-molochko-malyutka-4-300-g-141817618/?asb=0Yj8D597z3Sxemfv0JjDcfKKhnjQGVK6Kc9A04JjLxY%253D&asb2=P-IJovT9KG25sFxmOhAy7SDx1q0h-lxyjKmaxbQBmrJOQfj_X2A0R8om7U9hNia1&ectx=1&miniapp=supermarket
"Сухая адаптированная последующая молочная смесь Fabimilk 2 с 6 до 12 месяцев, 400г.",957 ₽,1 отзыв,"Завтра доставит Ozon, продавец Л.Арго",https://www.ozon.ru/product/suhaya-adaptirovannaya-posleduyushchaya-molochnaya-smes-fabimilk-2-s-6-do-12-mesyatsev-400g-504528227/?asb=CvMHFaxze2sNFMAXx6iEB63kPgOe2IsmIi1xS6EQsPc%253D&asb2=FxxGJ7_a2JnHiNNSvXGQkIf2KNJA7GMkg16rVvo7uWKLvNiyMDH36aVkRuSnNzMS
