"Страховочный шнур, тренчик для пистолета, шнур пистолетный, ремешок пм с креплением на ремень (петлёй) и карабином, 1 шт.",299 ₽,27 отзывов,"Завтра доставит Ozon, продавец AtomSales",https://www.ozon.ru/product/strahovochnyy-shnur-trenchik-dlya-pistoleta-shnur-pistoletnyy-remeshok-pm-s-krepleniem-na-506129876/?asb2=r05GkX0b0U8epcyK3OBr0Oqw0D5zvTu6c-ax7huv8Bng1bh8KxCGKjz38sd7GJnwQnJIbum2I_FPLoo1_JWg0w
Дротики Centershot для арбалетов-пистолетов пластиковые (12 шт.),300 ₽,180 отзывов,"Послезавтра доставит Ozon, продавец Centershot",https://www.ozon.ru/product/drotiki-centershot-dlya-arbaletov-pistoletov-plastikovye-12-sht-344315306/?asb2=UARDnUJTy5M5maQcrDByW_PohPLCHmFjRBzkz3-XIf5IB62YuXm5StQpgmz35wq6
"Тетива для арбалета Скаут (MK-80, MK-50)",400 ₽,3 отзыва,"Послезавтра доставит Ozon, продавец Centershot",https://www.ozon.ru/product/tetiva-dlya-arbaleta-skaut-mk-80-mk-50-538863210/?asb2=sveOvhUraa0Y_OcUZSTYK2Gbpg8vaVDWmjJs1lwUPqm6Spgg7oKN4FBC3ymKGgEc
"Стрела лучная фибергласс Centershot Sonic 30"" оперение Parabolic 3"" (6шт.)",990 ₽,120 отзывов,За 2 часа курьером продавца Centershot,https://www.ozon.ru/product/strela-luchnaya-fiberglass-centershot-sonic-30-operenie-parabolic-3-6sht-319228863/?asb2=Jo-fH5h-JUIERPwwLZspe1IrR3xQreSXTJ3LhmdBCBfW1CwZbbYdFODmy4S3RmFZ80KTPpHZVzGjRvbPrq3GGg
Резинка для рогатки (3 шт.),294 ₽,52 отзыва,"Завтра доставит Ozon, продавец Things 4 Happy",https://www.ozon.ru/product/rezinka-dlya-rogatki-3-sht-258904611/?asb2=3D-GVjc1dnMxN2VVYrC4VRA_luteISDW8ZdrVLcGvsRr_I-WDLlgBbC17njjmN3o9kRT1Ic2eDat62oOkcTp-g
"Стрела лучная фибергласс Centershot Sonic 26"" оперение Parabolic 3"" (3шт.)",450 ₽,23 отзыва,"Послезавтра доставит Ozon, продавец Centershot",https://www.ozon.ru/product/strela-luchnaya-fiberglass-centershot-sonic-26-operenie-parabolic-3-3sht-319233166/?asb2=hPy4G2YPhl_cj2AJ7zdLMiOuFIDq_NO_6zt5r_BMu95348dFYWxEDlBWb9GeRX28
"Стрелы (дротики) для арбалета-пистолета Man Kung MK-AL, 12шт.",762 ₽,54 отзыва,"13 мая доставит Ozon, продавец ООО «ДАЙМОНД»",https://www.ozon.ru/product/strely-drotiki-dlya-arbaleta-pistoleta-man-kung-mk-al-12sht-233481066/?asb2=EfzygiGFvxNhuF7mjJqBNpzcsHUxlctmGZKsv_K2a6Eqbtgvwwfr9OerdAXLLkgj
Резинка для рогатки (4 шт.),372 ₽,41 отзыв,"Завтра доставит Ozon, продавец Things 4 Happy",https://www.ozon.ru/product/rezinka-dlya-rogatki-4-sht-258505720/?asb2=vqyAryUhqDdmnq-86137wYCMgAL1JUBmegwlvw_s6JgLB06ktcggsDiskvxiqGgVMXeAvjGR_Fh1MWiMoSbmFw
Колчан Centershot на руку для дротиков,350 ₽,25 отзывов,"Послезавтра доставит Ozon, продавец Centershot",https://www.ozon.ru/product/kolchan-centershot-na-ruku-dlya-drotikov-306384250/?asb2=7ddxEXlflAmlGT9tgeAPRbjTIB7fARcjreOn3A_Hm1wtMQEIHwpqaUGEIsmpYMhH
Крага №1 (пластик),300 ₽,44 отзыва,"Послезавтра доставит Ozon, продавец Centershot",https://www.ozon.ru/product/kraga-1-plastik-315231839/?asb2=9472jJL5ucBTLCBKRevjAYma1sMTc-kSav_tLzgXRhJF_pFLSN5y8s3x92xBzK5f
"Стрела лучная фибергласс Centershot Sonic 26"" оперение Parabolic 3"" (6шт.)",900 ₽,23 отзыва,"Послезавтра доставит Ozon, продавец Centershot",https://www.ozon.ru/product/strela-luchnaya-fiberglass-centershot-sonic-26-operenie-parabolic-3-6sht-319232826/?asb2=6wVA6FcCgKp6zl-KzznecXdVQlRwuqUf9xdLRuZ4LgAEPGgupkyqUuuykJtXkFmf
Полочка для классического лука пластиковая Centershot Solo (5шт.),500 ₽,4 отзыва,"Послезавтра доставит Ozon, продавец Centershot",https://www.ozon.ru/product/polochka-dlya-klassicheskogo-luka-plastikovaya-centershot-solo-5sht-396672482/?asb2=jZ_PvHVbKtBOmZpHNZQqOjlGgEgti7lwnYst7oHy8V33BgFPlB5tLPCtk_2ValxA
Выниматель для стрел Centershot зеленый,400 ₽,32 отзыва,"Послезавтра доставит Ozon, продавец Centershot",https://www.ozon.ru/product/vynimatel-dlya-strel-centershot-zelenyy-322690445/?asb2=kq8t_FQP1DNNhoEu0ETjd1bSx5IstuC-HDHNtnXUthgIbNQpSPw6grhpZzDl1i4-
"Дротики (болты) для арбалета-пистолета Man Kung, чёрные, пластик, 6,5"" (16,5 см), 12 шт",518 ₽,30 отзывов,"Завтра доставит Ozon, продавец PIRAT",https://www.ozon.ru/product/drotiki-bolty-dlya-arbaleta-pistoleta-man-kung-chernye-plastik-6-5-16-5-sm-12-sht-382998660/?asb2=Xr_81qL242giyquHkYdM-edo3Y1nfQbmXjjKGPKrc-m4XeOZoPxoMdkGXVardGGe
"Стрела лучная фибергласс Centershot Sonic 28"" оперение Parabolic 3"" (3шт.)",480 ₽,12 отзывов,За 2 часа курьером продавца Centershot,https://www.ozon.ru/product/strela-luchnaya-fiberglass-centershot-sonic-28-operenie-parabolic-3-3sht-319231476/?asb2=ynbmOtKInnGoGrefcBFMJHS9xUT9_H96FWg8k4F3lt-QnJTpH3R7LL-poqzdycCj
Наконечник Daoci 3 шт.,950 ₽,19 отзывов,"Послезавтра доставит Ozon, продавец Centershot",https://www.ozon.ru/product/nakonechnik-daoci-3-sht-306381237/?asb2=Ja83REMkCcerWzcdVgEvJG1KZ5TP2no5fP9cZ9TBSbDnQIppbxspD8ArVv3VmwL6
"Стрела лучная фибергласс Centershot Sonic 30"" оперение Parabolic 3"" (3шт.)",495 ₽,120 отзывов,За 2 часа курьером продавца Centershot,https://www.ozon.ru/product/strela-luchnaya-fiberglass-centershot-sonic-30-operenie-parabolic-3-3sht-319230652/?asb2=Ah08MpXCDCzYvbivnn-BAcKQdY5jlSmYXzqeb2qjJ7B57DQX6paSIy1BIKoOvpQCnYDobN9z5ARAF_ksVAuC0Q
Дротики Centershot для арбалетов-пистолетов алюминиевые (12 шт.),600 ₽,124 отзыва,"Послезавтра доставит Ozon, продавец Centershot",https://www.ozon.ru/product/drotiki-centershot-dlya-arbaletov-pistoletov-alyuminievye-12-sht-344280070/?asb2=CoiHn0z59uGwHe7s_j4RzxlxhcXyYoPWHOgCc7-HN3DNzXM-xiWNuNZijF4H1BKk
Полочка для классического лука магнитная Decut Pita,650 ₽,3 отзыва,"Послезавтра доставит Ozon, продавец Centershot",https://www.ozon.ru/product/polochka-dlya-klassicheskogo-luka-magnitnaya-decut-pita-469820199/?asb2=LIfmvepu_cz0KwH-TnzVEXuJTA4ia9mScPld_prO8PYJ7Q26nPF19gvkT5TMphFQ
"Дротики (болты) для арбалета-пистолета Man Kung, оранжевые, пластик, 6,5"" (16,5 см), 12 шт",449 ₽,30 отзывов,"Завтра доставит Ozon, продавец PIRAT",https://www.ozon.ru/product/drotiki-bolty-dlya-arbaleta-pistoleta-man-kung-oranzhevye-plastik-6-5-16-5-sm-12-sht-382999118/?asb2=IUrkSQspSDCdys_JAbqKoHIEO_OL-J4a2MDPHKq1yAOSwtyZTBqUSDPBxv3imEH1
"Страховочный шнур, тренчик, с креплением на ремень (петлёй) и карабином, 1 шт.",299 ₽,37 отзывов,"Завтра доставит Ozon, продавец Mads can",https://www.ozon.ru/product/strahovochnyy-shnur-trenchik-s-krepleniem-na-remen-petley-i-karabinom-1-sht-489197842/?asb2=Maf84eAb8hLDF9Ozg9IYMZ_nUrsOo4PZRPW22d0hX02je6MiFnZxAqQco6HC4MUawLK4DXQrLypthPV5j4k3rw
Защитная перчатка для стрельбы из лука GEOLOGIC х DECATHLON,699 ₽,52 отзыва,"9 мая доставит Ozon, продавец Decathlon",https://www.ozon.ru/product/zashchitnaya-perchatka-dlya-strelby-iz-luka-dekatlon-174564388/?asb2=fxhlGTm06XXh7vQJiy3h1JVORjcISOoO3KAh75agvcYP_VAfICKow4fh1ZjWeeMI
Наконечник OZ Traditional 100 гран (3 шт.),800 ₽,11 отзывов,"Послезавтра доставит Ozon, продавец Centershot",https://www.ozon.ru/product/nakonechnik-oz-traditional-100-gran-3-sht-310016301/?asb2=G-RLG0STPwJLfXEoY_U1kFU7o3T714HXQlUaenZ2LLCUjEpRQvBjeF_v6oTG9j2L
"Мишень для стрельбы из арбалета и лука, 40х40 см, 5 шт",250 ₽,11 отзывов,"Послезавтра доставит Ozon, продавец Сладкая жизнь 💕",https://www.ozon.ru/product/mishen-dlya-strelby-iz-arbaleta-i-luka-40h40-sm-5-sht-256944889/?asb2=DRo3eXjNE1_vY_aQS3dO2EnWtIHkloZJsZxKeq2OD3kpggg0mS0m6sTDYOSyPabgH5BhUaqOwDmj2xa5XDY3nA
Наконечник свисток Centershot (3 шт.),500 ₽,3 отзыва,"Послезавтра доставит Ozon, продавец Centershot",https://www.ozon.ru/product/nakonechnik-svistok-centershot-3-sht-309783039/?asb2=DN2ZXlc0vo71RPpwAHyXqjB_A0vayN5jxQ-Ale5BD1PZiKr7A8uoUhox-gNnqK-K
"Наконечник с 3 лезвиями из нержавеющей стали для стрел лука или болтов арбалета, Beri-AH06",675 ₽,1 отзыв,"Завтра доставит Ozon, продавец LukBeri",https://www.ozon.ru/product/nakonechnik-s-3-lezviyami-iz-nerzhaveyushchey-stali-dlya-strel-luka-ili-boltov-arbaleta-beri-ah06-534581739/?asb2=cPE6y56Ik63AG61hGxKPscY0OPE2bL3-Auqx-GjwX8LZ_6y1gdvmiJC1IMF5iBYU
Резинка для рогатки утолщенная (2 шт.),367 ₽,7 отзывов,"Завтра доставит Ozon, продавец Things 4 Happy",https://www.ozon.ru/product/rezinka-dlya-rogatki-utolshchennaya-2-sht-466289802/?asb2=n9soGGAiaOeJC1Ybd9YK7qCNJsmeaKOOtsI8120eoX9eJpid1fcH7P7Q9i8MqZWsGB-N0ieLdjgpYCVdy84FhA
Ремень тактический,625 ₽,1 отзыв,"12 мая доставит Ozon, продавец ТипТоп",https://www.ozon.ru/product/remen-takticheskiy-553861255/?asb2=iQRlv1-5OK5ZSbYS8j4lGFSKYQ27f3JyybxUG3PUbxxdddp7M3AqbKFAEXN2yhSo4r07ASqtBpdFqJxtjtwAcA
Защитная перчатка для стрельбы из лука GEOLOGIC х DECATHLON,699 ₽,52 отзыва,"9 мая доставит Ozon, продавец Decathlon",https://www.ozon.ru/product/zashchitnaya-perchatka-dlya-strelby-iz-luka-dekatlon-174564387/?asb2=xqodN4iY41I_-D8OE6B0auZQ2mj14aXQJnUCv5KMsBluqslAx1Yo-HHYWHz1XK4s
Лучные стрелы Bowmaster Pioneer для детских и спортивных луков (6 шт),935 ₽,4 отзыва,"13 мая доставит Ozon, продавец Bowmaster",https://www.ozon.ru/product/luchnye-strely-bowmaster-pioneer-dlya-detskih-i-sportivnyh-lukov-6-sht-383188036/?asb2=oWliKYjDwGJ2jgDo7XINhZWa4AV4c2EGOqp5Cz6dVocRN-gAc6W2N3Z86hT0EPZiuTNDbT65_mFE5bIjN4vLOg
Ремень тактический,625 ₽,1 отзыв,"12 мая доставит Ozon, продавец ТипТоп",https://www.ozon.ru/product/remen-takticheskiy-553123623/?asb2=F7sLK89b34vYOHLWyv9bBzx3EeCTt-tGkzpCYNIEDnfQ2CieXUhQq9nxMlZ7b1gVnxXdxAqacd1P0MjVwhzT8g
Карбоновые лучные стрелы Bowmaster Patriot 400 искусственное оперение 3 дюйма (3 шт),900 ₽,2 отзыва,"13 мая доставит Ozon, продавец Bowmaster",https://www.ozon.ru/product/karbonovye-luchnye-strely-bowmaster-patriot-400-iskusstvennoe-operenie-3-dyuyma-3-sht-362621486/?asb2=drI8gD9DqcOdkOGV745gGZjh-Q-iQock17peDEIJ11MoHxC0A-SatCP0YsX50stD
"Оперение Blazer Vanes 2"" Red (12шт.)",300 ₽,1 отзыв,"Послезавтра доставит Ozon, продавец Centershot",https://www.ozon.ru/product/operenie-blazer-vanes-2-red-12sht-388064514/?asb2=ufbDspD5yaLyF77sBCLcOevzg6YcV5Y-nHGDhYNxbSmxVP1k-Slyql9eNT8xzcG2
Рогатка металлическая спортивная с упором и подпальцевыми выемками,348 ₽,8 отзывов,"Завтра доставит Ozon, продавец Happy Toys",https://www.ozon.ru/product/rogatka-metallicheskaya-sportivnaya-s-uporom-i-podpaltsevymi-vyemkami-521284117/?asb2=tYCWpVymFWubgQT8YdltLPu9_40dxuR21uVe7b426LbPyqpYjSxilEHwwSfow_nR
Воск для тетивы Bohning Tex-Tite (28 г.),500 ₽,44 отзыва,"Послезавтра доставит Ozon, продавец Centershot",https://www.ozon.ru/product/vosk-dlya-tetivy-bohning-tex-tite-28-g-323525706/?asb2=kR3RwRcoB0GaURYAf2zdHI7aWMCf3plIxYhj3c8wGlGJPw_eOAp_tbibcZI4gXvZ
"Стрела лучная микс карбон Centershot Crash 350 оперение Parabolic 3"" (3шт.)",855 ₽,11 отзывов,За 2 часа курьером продавца Centershot,https://www.ozon.ru/product/strela-luchnaya-miks-karbon-centershot-crash-350-operenie-parabolic-3-3sht-405279855/?asb2=VyVwS__-AvaYwIm608fQStnVLcOH4M7VUlA5CIMLHbnGCSEuE8e7gf1DXiq9zB_4
