"Витаминизированный тоник для волос склонных к выпадению, серии Karmasin, 100 мл",765 ₽,77 отзывов,"Завтра доставит Ozon, продавец Дрогери Русь",https://www.ozon.ru/product/vitaminizirovannyy-tonik-dlya-volos-sklonnyh-k-vypadeniyu-serii-karmasin-100-ml-150204876/?advert=bFCiL3QH-wQsZDtYVXUISWxnhmxWVUT1IRaO1AKOb6IBKJ7K84LCUT5JFruQl2nXoBXlDm37RMAziWCYZygt_lzWuxQ232LdbkUih-Yu_dlMmGW8X8JMoL8xFlgiXIMfHRqlDRoYfLa-KJm6lakn1Sqd8s6Rnk4uCGXXRDhC-o8rHygFn6Fa9lGkk8Ttv4ltCtkQseMynKXt7xRQLyomdBqJEBSKLTxmJxJzQN5l4v1nJaSjyvmVPzOzse-NV4xltGiD0UykNvA3Qf70rsMa1LIh29Iw-IM6VN4ainufeqy512fs0V7W6RvPLZNZYipiCW0F8CxCX3pNTPtJbQS-ww7XNx4xnJOSHZ-OclrMXdDOm3iwHx-30kB1Z0_Lcu7c8MoUg4CCwXHzPNTjVpiMTdtIYZ32Az1FB36PJenid23Gk22Nhs3uQ8_BaY_YOh5g-_fXqn6XBRHMvl5_NhvUT1CR3yeB9hHqmKK-lFglq94DC_ifMzZxKOB9kSpUcQXEYqLqaNO7nGJJImmwqcIb_MBpUXyruEXlM9W7RkZXZEaTarrNgPSqiT6OZuBIVlhj
Спрей для волос уход за кожей головы натуральные экстракты трав Prreti Herb Therapy Scalp Mist (80 мл.),437 ₽,7 отзывов,"Завтра доставит Ozon, продавец 4СКИН",https://www.ozon.ru/product/sprey-dlya-volos-uhod-za-kozhey-golovy-naturalnye-ekstrakty-trav-prreti-herb-therapy-scalp-mist-236178242/?asb=b5G93%252FscmT9Fe7xhxmMHBO8fA72CZ2cnJxsbFMGxWj6F3F14gQsvp5t6SgbFybtk&asb2=qc1Q30bvzRX3-xiZ96Df23eMNAE1O_oVlDIgmroVJZwQcKgM90xyupO63qk5mB4Nr812RwO1US_9kvgyiVCKUB3k6QEx_zvaVy_FUSsxUFmMVAeE4vpIRcq2k9yBNUqT8bsF4vu7ZmsKFK9m6JeCvQ
"Natura Siberica / Home Spa / Маска для кожи головы ""Теплая. Активатор роста"", 100 мл",190 ₽,74 отзыва,"Завтра доставит Ozon, продавец ООО Органик",https://www.ozon.ru/product/natura-siberica-home-spa-maska-dlya-kozhi-golovy-teplaya-aktivator-rosta-100-ml-238393500/?asb=jvMPa1fmiC85%252BhHmBlO3yr1Kx7ko%252FFmk%252BtZIT5PiRzIn8jkygNvA0zMMn0v%252FRZqj&asb2=SA48FAdJi7y5tzG-HsRfqvKmFkQQHsScqCCG9TxyGRFPKUsSSPLTtoh9bVnPnQxDZ-q_LD9wGto8HG-ZDLmUbXj_aOYNZRP0dZMEDHWFN5owerVrBQlP60mWmM9BTQFRPbn7iFcEqpfRMVvwTMcOBw
"Сульсена Паста для волос против перхоти 1%, 75 мл",408 ₽,108 отзывов,"Завтра доставит Ozon, продавец Медикалфорт",https://www.ozon.ru/product/sulsena-pasta-dlya-volos-protiv-perhoti-1-75-ml-208138285/?asb=cFjsUPv1PF7KUKlcB1XqrLveOhKWstomcvQktnD3IoI%253D&asb2=alQbUroc_0doZEtNAppcrUaqUe_I5DGp77F_p6x0fK7EsQYVkZ6H00YuSyOX0Hvi
"Mirrolla Гель-мыло Сульсен Мите профилактика перхоти для всех типов волос, 100 г",191 ₽,30 отзывов,"Завтра доставит Ozon, продавец Mirrolla",https://www.ozon.ru/product/mirrolla-gel-mylo-sulsen-mite-profilaktika-perhoti-dlya-vseh-tipov-volos-100-g-170830105/?asb=hg0205WQukEAJjiix%252FE0%252ByplJ5WTmyJlVUc2hevVdjc%253D&asb2=O_GjTSMCQEszr5gUjsRwkbuJLXkN78rNFd9Jht9zEwOmU9H2KRsbR79M4TlBjVdV
"VALMONA Спрей для кожи головы ПРОТИВ ВЫПАДЕНИЯ Earth Anti-Hair Loss Scalp Tonic, 40 мл",770 ₽,43 отзыва,"Завтра доставит Ozon, продавец Icon cosmetics",https://www.ozon.ru/product/valmona-sprey-dlya-kozhi-golovy-protiv-vypadeniya-earth-anti-hair-loss-scalp-tonic-40-ml-223529148/?advert=WnKYiZQVzuFxiomXNPbYoFLr8XBl5dLlWNcoEV7kPzx5xj3btxAOicC0hG3sCdt606ZEvdR2SPjcSXwkzffCILMQDvK5FamKBewZm718TCiu8c6lUUOyHJ93hCQdKFaa3tEgqUAr6af4WlKFBec3Xhv9f503SvJ4p7X_bd8ec5AT5kNYMloiCMqmYdetQAZMpa90REMdALtJSqfjpQrmbGPL-xHFZS4MHgAvXolLJN4RWk8G9TUKut8WBC3JAfHWyw4Cyd9VFg8BUW1oF35yl_7qT7Xep2QGSe60295doeDw_OB_-bkOCo0F_Gtgxy7OQRs62ms63t63d4Naqkj_Sx15vkFE4eoHDXh51f2P4vWs8mp2sleTFrr6L0uWlAX-nH99R_ibGOw6hcwlM5xaguG7UKNQ_i_3q_fUlpvKbAmIvXgc4XxW2kXDcAEBHNgLHnncrRioyHqis5-viPU6k5mgs5wzqyXqW_Qi8xaXc8wyOkgkiXjQvq6k1s6LHEgizkM0_GkoFmH4vBeAPlq8VLkk95MdHbszqnbX0ybqmZSgulVXkiPACtWV2ZGgHhZ3
"Витаминизированная сыворотка для укрепления и роста волос серии ""Mama Comfort""",345 ₽,35 отзывов,"Завтра доставит Ozon, продавец Наша мама",https://www.ozon.ru/product/vitaminizirovannaya-syvorotka-dlya-ukrepleniya-i-rosta-volos-serii-mama-comfort-180461928/?asb=ZiXeSRmMbDYnz%252Bi5K4cFQYgBMV3Hb2LFbB5nRdqKJUjDqDMQCevaHg5JgxfZdedR&asb2=Earu-NU9WrpLZuCdgIriE0uxvE6WjisSwF0z-F70pr7WYKijqOZM1f6BFUJN2QesrX0iO038FYCGrHTNdjtlcYM4JBEh1Lwv7GHEM5GfJEV41RR28fUD8g3zp5ufEO423RrhpDDO9r9gGlnIrOBGgA
"Mirrolla Педикулицидное средство Фора+ перметрин 1,5%, 100мл , Средство от вшей и гнид",293 ₽,91 отзыв,"Завтра доставит Ozon, продавец Mirrolla",https://www.ozon.ru/product/mirrolla-pedikulitsidnoe-sredstvo-fora-permetrin-1-5-100ml-sredstvo-ot-vshey-i-gnid-479737025/?asb=ktMpvSi1FxtnVNw%252Bjzc5XtLkAmufu9DX00sYi3qVeOo%253D&asb2=pxR0HjaHZvnwbljgFh0Sf7j8oGbo6PBo9ZO7T1p4kZn9lNPptVfMUVMlUCCB9MvE
"Lador Пилинг для кожи головы набор Scalp Scaling Spa, 4 шт х 15 мл",647 ₽,101 отзыв,"Завтра доставит Ozon, продавец My Beauty",https://www.ozon.ru/product/lador-piling-dlya-kozhi-golovy-nabor-scalp-scaling-spa-4-sht-h-15-ml-232536892/?asb=rDuLXeuNqWW03fCxdtgzpMXaoIZeC%252Fiucdg9kSNnFC4Y4TsYg4E6n5vadRozSate&asb2=NyMq9Jhzvyw4wV-7YVmyNyUAr0AYbiyN89_evQfrJo7Az_D3oNwfLmTEiFA81YdTRySFWZI6o50TyWvB9YqlECPWpJIBcM9caHLuMEFkr4Oq2GRjNvwieEwl-1ngWntDRcFnQCaXSE1ssXR0qRuMOA
Селенцин ACTIVE PRO Лосьон-спрей для роста волос 150 мл,855 ₽,116 отзывов,"Завтра доставит Ozon, продавец АЛКОЙ-ФАРМ",https://www.ozon.ru/product/selentsin-active-pro-loson-sprey-dlya-rosta-volos-150-ml-172252763/?asb=vA6ny2BKcl6x42upksda09kvUVMcm26HtlNGjSUujJg%253D&asb2=15F-43xxiqaQ6Z2WlXyLF7hkplUcLdJC89_wClwkR0FJ5iwz5RQy3fDZykITXOT9
"Мультикомпонентный комплекс Увеличение объема тонких волос, серии Линия HandMade 5 ml",282 ₽,41 отзыв,"Завтра доставит Ozon, продавец Дрогери Русь",https://www.ozon.ru/product/multikomponentnyy-kompleks-uvelichenie-obema-tonkih-volos-serii-liniya-handmade-5-ml-150619464/?asb=9U3RxSez0oJfgrktIt%252BFGxzkaQs6Yxt4Qq1sQIp5ilg%253D&asb2=htqGs9aIanJCq8Wc2SNhluzkhe9vfhW0S-UQD9rI4-SCJYlD7hWlACwuWbK64kH9LNsv39SNpybBMNxAj1tvcO_x-8uS8S4BsewnCTUVV2-4OqiQXwrjfjXu-oM9GsMC
Repharm Гель-стимулятор роста волос 250 мл / маска для волос / бальзам для волос / маска для волос профессиональная / увлажняющая маска для волос / против выпадения волос / для роста волос / профессиональная косметика для волос,440 ₽,68 отзывов,"Завтра доставит Ozon, продавец CityNature",https://www.ozon.ru/product/gel-stimulyator-rosta-volos-repharm-flakon-250-ml-163344688/?asb=%252FH%252FC6LQOdERvi7k1UARuEFmhrAGXCFdImfzTuEZwzVoVbIrpzbvBOeuH6sit%252BYCw&asb2=8BSRUxlxUhe5VuPxX9U56iWXkgt43GQ2ool0Tu8gODee-wmE7GKOoMQdUoqay-trTXkkfgc2vwmJ7hz6vaXxxKQ3sLgkAgq6mwY0GrK40CelE31yVat_ofXxI4XMBq5mewisgKwA3CD39QxzesL8cg
"Белита сыворотка против выпадения волос, 200 мл",289 ₽,40 отзывов,"Завтра доставит Ozon, продавец ТД ЭК",https://www.ozon.ru/product/belita-syvorotka-protiv-vypadeniya-volos-200-ml-252925217/?asb=O81C1Ehos9Zu6HswvpyPESfPriJ4K0NTS1mSLzIT1CHb1jhGeMmaUJe0Gzs8Yvca&asb2=uFllMmwmUEVjnaLJbz06i8nX_VZ3ACkYriEDqU2VCtSpiSnYKxszkVGq6mKI2qE0ZvuLNyiJ_aGepbJJ_N7J0aOMObO-lyqxijlh29gQjsXlmAJ6-B6pFjHgUbjSkUnQDGKkYUW0LX6ahz6EXB8Uvg
"Indigo Style Спрей-маска ""Матрица"" - катализатор роста волос, 200 мл",315 ₽,37 отзывов,"Завтра доставит Ozon, продавец ООО ""Мидеяпроф""",https://www.ozon.ru/product/indigo-style-sprey-maska-matritsa-katalizator-rosta-volos-200-ml-172044015/?asb=9XfhM2sVUNyUWFaAeOznCOvinMNtQR49J9jyedNdT00%253D&asb2=13pEECwGWFu7Cna_tJ0JGEfp7HXTlD_2SVB_1Y4q1PZxkBMgjRyzdZB_NWpK_PIK
"Compliment ""СЕЛЕН+"" Активный Комплекс для волос Активатор роста, профилактика выпадения 8х5мл",484 ₽,68 отзывов,"Завтра доставит Ozon, продавец Индивидуальный предприниматель Жукова Надежда Петровна",https://www.ozon.ru/product/compliment-selen-aktivnyy-kompleks-dlya-volos-aktivator-rosta-profilaktika-vypadeniya-8h5ml-224105148/?asb=EaDOm2wmdJEty2VZ76A3%252FfK0ihGBSQp9LapCHDUAM3vQho%252BQcTVf4LP9MibyAnDt&asb2=ML2WAxFpLSiqcGXVMiUNP9iEuxWSGzwViTlbObuyB7crHriAyHshzqkAibfQRllIbHdhdgrjh7gumW9TboOKXtDzz0gYUdqYnWElBL1nYjweasyt3sn2EyyUJ6dAJMv9fq9sNbd0dBWD9MdD55ougA
"Активное репейно-перечное масло ""Репейник"" 100 мл",241 ₽,5 отзывов,"Завтра доставит Ozon, продавец Фабрика счастья",https://www.ozon.ru/product/aktivnoe-repeyno-perechnoe-maslo-repeynik-100-ml-239424945/?asb=CGu1kZsKpQhQZ3BAqVgNDE8pTePDPOnm%252FtTjSiNcSzM%253D&asb2=w3ldMdExsKnscwP4KdRT_JqglRfgFvAYc_sSKTNWuCf6sB1Peb4_HKepf1IMZIwe
Elfarma Шампунь от перхоти лечебный c пиритионом цинка/шампунь против перхоти/шампунь с цинком/средство против перхоти для мужчин и женщин/скинцинк/ 250 мл,419 ₽,122 отзыва,"Завтра доставит Ozon, продавец YONEST",https://www.ozon.ru/product/elfarma-shampun-ot-perhoti-lechebnyy-c-piritionom-tsinka-shampun-protiv-perhoti-shampun-s-tsinkom-285656892/?asb=PY53xijAENE80c8SK%252FJMdw3MozQ6qPFzV3XZm7gk2BsPigm3c3nuFGe6LOa6zHSx&asb2=Eo6dssUY0yYa_oWA3EJRif_E9k_9_zy7IVItJVdEh9494INu-9NFAdbYGNqrZff36x-xGNsQChwiAp34sxjtNoUlCsFTyJwBTLW_lDzPi_asujBZSCcwVpMnkKCwmU4XYf6bmvUZ0S2CztThCiuYsg
"Мультикомпонентный комплекс Стимулирование роста волос, серии Линия HandMade 5 ml",330 ₽,104 отзыва,"Завтра доставит Ozon, продавец Дрогери Русь",https://www.ozon.ru/product/multikomponentnyy-kompleks-stimulirovanie-rosta-volos-serii-liniya-handmade-5-ml-150619466/?asb=G1MkG1AHodCPgRJzxz1deCvj1tORE4xPBOl4BRwD%252FBQ%253D&asb2=S4TLZiJ8MYVZ5373wezYAe3ib_HDujxhgEaSDoZXfWIBezWq9JsBrOQfRFF8RebR5kbMXt6fmJu6NJvgdq0tQI2qWX7ew1zqlJbYNubCw-oU5JhbZ7Tf-5UQtwEb1ort
"Аргинин с комплексом аминокислот, серии Линия HandMade 5 ml",282 ₽,23 отзыва,"Завтра доставит Ozon, продавец Дрогери Русь",https://www.ozon.ru/product/arginin-s-kompleksom-aminokislot-serii-liniya-handmade-5-ml-150613909/?asb=OwF4NfSLyS%252BCS9lb6d2XEX4q4qOmiiXS9u9xjUqFoPk%253D&asb2=8cmwze5sgJ4X1lOOx6FDGye4LlARzdLRsOj9in95mtkrpJZKSJCF2IAulzaw5YNBMLPgqTS7qvXtMkBz5IceCDCAso4LceW9No-4WkTlV5e8ba2RKIrewgDJd6qDtyLn
"Мультивитамины для волос, серии Линия HandMade 5 ml",282 ₽,104 отзыва,"Завтра доставит Ozon, продавец Дрогери Русь",https://www.ozon.ru/product/multivitaminy-dlya-volos-serii-liniya-handmade-5-ml-150619680/?asb=abUP4O9ywY4gzWi5HoWdBhFY7hfnsmj32tbafZ6tFf0%253D&asb2=fABI51uTypzQNboxK989pttgg8C7Vyoj9IX1aZHvNwL-1TfIfMP3G6CpAp9hZczFWiwx_XVY0_m0Cj1uqnI3fN_S4vBIgOo5kbu40vCzYZeDfptuA6d6nt2GpFRf7mEg
"Живица Сыворотка лечебная для кожи головы, 70 мл",415 ₽,33 отзыва,"Завтра доставит Ozon, продавец Beauty lab",https://www.ozon.ru/product/zhivitsa-syvorotka-lechebnaya-dlya-kozhi-golovy-70-ml-170006648/?asb=zho0flEB5VnDBHgZoUEIeAIykDkrmHlBgbwMIwthnM0aM5TcGJt2%252B8esdgqnWO4K&asb2=pzWR-nsfldenqTAIoAz3PMu1jaBWSU--zeTApsQu5QocZtZFGKDcVGeWbTZ21dmVWxvZzyJO6tI7BEum_0rbVjrOnmVPjn1Y9OQPtASvvfhpy_EkoFie2BfKxcgBrZNiYb6QTTFJkiB-rts6SXWs-Q
"Натуральный Коллаген, серии Линия ""HandMade 5 ml",282 ₽,42 отзыва,"Послезавтра доставит Ozon, продавец Дрогери Русь",https://www.ozon.ru/product/naturalnyy-kollagen-serii-liniya-handmade-5-ml-150619472/?asb=bbI7jDN9%252Fjzvl%252FMnGUkev%252Beo8aVMH94KTaLfkycyJD8%253D&asb2=b6qe0XeO_bKVycYxYGA5riOGqkCsppPZASsXCe1AMTdztSViYhj6cwoPgUZ9ZvAPxZpZM5tHd5mEK9i5EIM6g5A0B6nqEHQnhzzaKg9SYQGBh6zTIvnhU1es7Ox9cswH
"Mirrolla Гель-мыло Sulsen Forte твердое против перхоти для всех типов волос, 100 г",198 ₽,43 отзыва,"Послезавтра доставит Ozon, продавец Mirrolla",https://www.ozon.ru/product/mirrolla-gel-mylo-sulsen-forte-tverdoe-protiv-perhoti-dlya-vseh-tipov-volos-100-g-170830104/?asb=1jptzRkxwrYcI0K05Syd0H%252Bd6iJfTD6y9Cieyix%252BCyc%253D&asb2=8v1J_p14caLFKG0DD3r1AkF_HJL_u-DTaV5FFC2HxHlkHPApBgArBySAx3ZQwLN3
"DNC Активатор роста волос, против перхоти, 3х15 мл",141 ₽,34 отзыва,"Завтра доставит Ozon, продавец ДНЦ ПРОДАКТС",https://www.ozon.ru/product/dnc-aktivator-rosta-volos-protiv-perhoti-3h15-ml-221723983/?asb=oYcN6jwR%252FkdBuWCDKq8nPbz9FEyXQZ%252BtCgAVBrxafgQ%253D&asb2=XjX3Fk0t7T805GqvcuGzvEseFlYAS31c-SbKm16gBjwslx4UQ1aGBKqZ1euBjQjN
Natura Siberica MEN Чёрное Мыло для тела и волос с антибактериальным эффектом 500 мл,599 ₽,15 отзывов,"Завтра доставит Ozon, продавец Аквакосметика",https://www.ozon.ru/product/natura-siberica-men-chernoe-mylo-dlya-tela-i-volos-s-antibakterialnym-effektom-500-ml-245449916/?asb=17LYD2Lm2LWDtIi2NDdna0lX7aYYoUvX6KcyQ%252BxZDpA%253D&asb2=oUdMHJXATnnQFBs8h9AL_efPw1U0LkE2zRuAPkdsGz-rQ8pKL_hoD_2dLXxTlnq3
BIO Шампунь стимулятор роста волос Лук-шалот от выпадения и облысения bio selection,399 ₽,59 отзывов,"Завтра доставит Ozon, продавец ООО ""ФЛОРИКОН""",https://www.ozon.ru/product/bio-shampun-stimulyator-rosta-volos-luk-shalot-ot-vypadeniya-i-oblyseniya-bio-selection-232791649/?asb=q07MSra%252FJ2qqoINxrxXDDGHJR%252BX8bJe0vW0mWEwR0TY%253D&asb2=WCbX0AaWH5LGC_KvWkk1ksFJK0iVT3Mbq6TrHkmvwqVQ_PecynfSWEaXNfnDsBXu
Миноксин шампунь против ПЕРХОТИ 250мл,420 ₽,19 отзывов,"Завтра доставит Ozon, продавец LAVVEX",https://www.ozon.ru/product/minoksin-shampun-protiv-perhoti-250ml-390916958/?asb=yLT8E1cwb3O1ePOccSanWJl8a8MBWlG13Yffr%252BLEJEY%253D&asb2=Aa_Dt6zpobEADYcDwsp4A84Rihwg8lMC4YdlOrtcz4tAaW5XKyzuNtQk2xViqO_F
"DNC Биокомплекс для волос, против сечения, 3х15 мл",151 ₽,109 отзывов,"Послезавтра доставит Ozon, продавец ДНЦ ПРОДАКТС",https://www.ozon.ru/product/dnc-biokompleks-dlya-volos-protiv-secheniya-3h15-ml-221724020/?asb=nrnDT%252FvMNt5yrXvp58UYGE5kI0pOIYhdVlHuVqxuJEw%253D&asb2=SBCS0FpTBZzhQ0jp5l8cDz9XFQmkUE5Zq563Pe1fhwTjQhHvKl3LJnQugVjg5h2Q
"DEMI Японский рефрешер для кожи головы, насыщает кислородом HAIR SEASONS AROMA SYRUPS ICE POLARIS BLACK 140 мл",583 ₽,3 отзыва,"9 мая доставит Ozon, продавец ООО ""БРАРУС""",https://www.ozon.ru/product/demi-yaponskiy-refresher-dlya-kozhi-golovy-nasyshchaet-kislorodom-hair-seasons-aroma-syrups-ice-183434082/?asb=ksFP5ndPf2SChBphVrEbLmQ4bishGPvLmz50wXQjbBA%253D&asb2=0kYrLVPMdfRB95Wg08FpuXTeQlEFwYM3wmKs_NX4_28t5YbKmWFuvfvtzkadzOzm
"Natura Siberica / Super Siberica / MINT&BERЁZA PRO-PEPTID / Мусс-пилинг для кожи головы ""Свежесть&detox"",150 мл",534 ₽,18 отзывов,"Завтра доставит Ozon, продавец ООО Органик",https://www.ozon.ru/product/natura-siberica-super-siberica-mint-bereza-pro-peptid-muss-piling-dlya-kozhi-golovy-svezhest-detox-238649281/?asb=f27xXIr%252Bgt3XnIf6pELvFdJ3Ke%252B%252FylY2IvVyMutxBhBfq%252FzODi%252F4cE%252FJliZTsjCu&asb2=DVDhT2a3nMT9fIQQ4DuMZNchWUt5SvWxoOBsZjvHJRap8xw0qi2FxwJWxNysN7Br_fXfQvryFDW5MXip8bhza8rBPuSVAP2I_ap1vGtQj2Um6MlNYchQXKqivj50XYL1NImjtjD2-n8RXpeN_Cw7EQ
"Активатор меланина для волос и кожи головы, серии Линия HandMade, 5 мл",330 ₽,72 отзыва,"Завтра доставит Ozon, продавец Дрогери Русь",https://www.ozon.ru/product/aktivator-melanina-dlya-volos-i-kozhi-golovy-serii-liniya-handmade-5-ml-154619438/?asb=icIuAjA5psX%252B9Z1rPFJUKNCVelonKL6gyEKzt6Gxnj0%253D&asb2=ocSPi8PUvHNBQ5nj6Y4D_7Iqov1tdqSN-c98FwN3sblvDbnYEfRJSIoC3OHpVvJLN1zHgeOLxclg5jl46GeNMevvxbuFvnL79rsuUEfDO54eWSmCDyzNq0Qtn5AS4sBp
"Натуральный Экстракт Крапивы, серии Линия HandMade 5 ml",330 ₽,72 отзыва,"Завтра доставит Ozon, продавец Дрогери Русь",https://www.ozon.ru/product/naturalnyy-ekstrakt-krapivy-serii-liniya-handmade-5-ml-150619470/?asb=1kmEulFOAiif5dHR1Z9trHnbBJmNRk3C7KG4YwmoGZs%253D&asb2=d-ba4pvfJcYanenT8ZEJHlJemUGOa-ss5mVw23jqfkBLrGdASCOtckD2G8YkmpGoUssFeyDaR53O_lGVl2VW-_zvdcXYfT74Y1IgBDATM1ytkLegScTTcdg9Dqtjn-2t
"Mirrolla Гель-мыло Sulsen Forte твердое против перхоти для всех типов волос, 100 г",200 ₽,89 отзывов,"Завтра доставит Ozon, продавец Mirrolla",https://www.ozon.ru/product/mirrolla-gel-mylo-sulsen-forte-tverdoe-protiv-perhoti-dlya-vseh-tipov-volos-100-g-380344022/?asb=Gx5Qpld7Ny3fcOs5OJTe8Qj1RqtrxHER6nCccNthruTEJbRLaIY6fbIyJfr%252FOTbv&asb2=6T3crqvDkdxcarEoSrShr4Zypvho3xclF_h3hXNBQRjjTxM-Omswk335ig28Tde8vVY0w5cdEj4i5dV6HVTsGKJbO2lCnGVnDl2KV5Wqsa2VORzy64HFhuWwW5rHkjZxa9OEAbmPTnD5ww6KgT87MQ
PHARMA GROUP Экстракт Корня Аира усилитель косметических средств для волос и кожи,282 ₽,63 отзыва,"Завтра доставит Ozon, продавец Дрогери Русь",https://www.ozon.ru/product/pharma-group-ekstrakt-kornya-aira-usilitel-kosmeticheskih-sredstv-dlya-volos-i-kozhi-169052487/?asb=Xx1P9wjpoNICF08RgusywV1796a4w%252FDLB36HTnWkipKUn%252B8u8IQ2iBXlTGbPoQ6Z&asb2=I52Gdej5XiM7WUbNsIRBcW4P2oO6c2k2d1MXorJZJPE3C9mdV_Bb9gZz2OmxIqhd0O2PxseYdl1y0oG1SDR8SHSJUH6427tyQlECpzBC5yH9IccT56OKkPRCV0fuMhBu
PHARMA GROUP Экстракт Ашваганды усилитель косметических средств для волос и кожи,282 ₽,63 отзыва,"Завтра доставит Ozon, продавец Дрогери Русь",https://www.ozon.ru/product/pharma-group-ekstrakt-ashvagandy-usilitel-kosmeticheskih-sredstv-dlya-volos-i-kozhi-169052474/?asb=gDX3bLsU84n1MYykmu5dYeRUwRktR0G9%252FXLA0uAe4QXvhHKEmN4w078FNKYOC16l&asb2=9kgZlVjtjAFcB2tvAkAuzO9kOHKL7TPicWemziO6sOS0vzWF0DW5CZRGAAoGOwTFB4j8AKWm67B-cj2j1OFQ-kVSJbeG3HPhnKO3r8MitZnQE1Sb6XSu_xopLshsl0Ba
Lador Пилинг для кожи головы Scalp Scaling Spa 15 мл - 2 шт,387 ₽,59 отзывов,"Завтра доставит Ozon, продавец My Beauty",https://www.ozon.ru/product/lador-piling-dlya-kozhi-golovy-scalp-scaling-spa-15-ml-2-sht-233125120/?asb=4L8bJphQLr0wc3Lio3CmUL%252F6Hu2QIZUfSiP9JtwOpeGFhcrJb1eRf4kWWECMOVrg&asb2=a9QbjzafTbGCNMpI3tAXxhDmRUYlkeY9g9YkJTJxyAe1j8wRTU9UeMnV4ZaN2ZIg2tlYrKuW3kZSePXjj5B1C-hPiplQ0Mcow6Zk2PoMOAz2pD5ga7-BQPEXtwUNEJDl8ivHrZSQ-OqgNKJbErBiww
