"Набор для украшения пасхальных яиц Украшать не значит красить"" Единорожки''",291 ₽,140 отзывов,"Завтра доставит Ozon, продавец Pink pie",https://www.ozon.ru/product/nabor-dlya-ukrasheniya-pashalnyh-yaits-ukrashat-ne-znachit-krasit-edinorozhki-516260731/?asb=9tmiRkf5er7YAH3W0e1djYehuuNK2GRmtHLJbx5D5sxygxX6oSNVnneb%252FY8CVoWA&asb2=DGvf8BV1CoCByrK7IXq5p9_Ts8SWpKlOOOrRwXzrLe6XQYnyiiyfGRRmDBarGyBZ_FeDHCalbTNgb13lkeSMGTHDKuT_rg3aAWrOfh8Daw2NpOIh6fsloZG8h2udoEDRUIUIzDE7DFP7bKDMJtYfaA
Набор жидких красителей для декорирования пасхальных яиц 15 оттенков. Подарочный набор на Пасху,95 ₽,43 отзыва,"Завтра доставит Ozon, продавец >Радость в дом<",https://www.ozon.ru/product/nabor-zhidkih-krasiteley-dlya-dekorirovaniya-pashalnyh-yaits-15-ottenkov-podarochnyy-nabor-na-pashu-244996220/?asb=zu8FELOQkyN6Uw3V4KU8h%252Bq8nR4%252ByAuGx4gd4W9X2es%253D&asb2=1N0yQ7XthqSac3JBmggA2LkqZtL27eIKB1YcYkJExeZiEyV8ueYiyyPirBi6wMGv
Набор красителей для декорирования пасхальных яиц 3 цвета. Подарочный набор на Пасху,104 ₽,28 отзывов,"Завтра доставит Ozon, продавец >Радость в дом<",https://www.ozon.ru/product/nabor-krasiteley-dlya-dekorirovaniya-pashalnyh-yaits-3-tsveta-podarochnyy-nabor-na-pashu-245026289/?asb=VJ3qE3LnMZHvc4IOA4D6JalCY4N2FzCfWE9KCN%252Bpsgk%253D&asb2=9cY5K4aWqPAf-uN6_ZAmcAIXP8f9Q6wfp7hifJwmw6dsBnatCeGbLAq-1ETs0qGE
"Набор бумажных форм для выпечки куличей ""Пасхальный"" 0,5 л. d 9*9 см., 3 штуки, дизайн в ассортименте MARMITON",169 ₽,2 отзыва,"Завтра доставит Ozon, продавец ИЗУМИ",https://www.ozon.ru/product/nabor-bumazhnyh-form-dlya-vypechki-kulichey-pashalnyy-0-5-l-d-9-9-sm-3-shtuki-dizayn-v-537115138/?asb=96Xh860JX66pwBs3yLBG71OTmq5smUx71lm34AWjO3Y%253D&asb2=JFR7MHhoiaLejlk-HG9itcSYPbiDQo_wBSnRCxr70bjCRaJOpxAI-MN0DTMh04EQ
Набор сухих красителей для декорирования пасхальных яиц 6 цветов,159 ₽,29 отзывов,"Завтра доставит Ozon, продавец El-Store",https://www.ozon.ru/product/nabor-suhih-krasiteley-dlya-dekorirovaniya-pashalnyh-yaits-6-tsvetov-256615287/?asb=Syu7DpgYSka8oiIGH18Bmi9PaVgVipQ4hc07KuA9uys%253D&asb2=4G-pJvzCpOjeKSQR5aBGU23s4f4iQQ6hGXjlyu1CN2qn47i6Kxih0yP_ifHdCZUN
Красители пищевые для пасхальных яиц / Пасхальный декор /Краска для пасхальных яиц,210 ₽,59 отзывов,"Завтра доставит Ozon, продавец ИваБис",https://www.ozon.ru/product/krasiteli-pishchevye-dlya-pashalnyh-yaits-pashalnyy-dekor-kraska-dlya-pashalnyh-yaits-521894973/?asb=UxrYfWoyEd8uaZmPUxnrO7d2Fg5WwtL7jGwLcAJ2ZWI%253D&asb2=hglB-L2xYER3g2FwOV83JVJeeNpWJqM2Tp0yJJbh3RjW0ZY28-gdvv9I3rPeEk5R
Набор для декорирования пасхальных яиц . Перламутровая краска для пасхальных яиц,499 ₽,72 отзыва,"Завтра доставит Ozon, продавец El-Store",https://www.ozon.ru/product/nabor-dlya-dekorirovaniya-pashalnyh-yaits-perlamutrovaya-kraska-dlya-pashalnyh-yaits-546051207/?asb=c2mreaVvFcPFK5uPUPbNMOkNMq5CN5%252FLN3ttGQh0i9o%253D&asb2=kR1voOYaYMheG1AELcP-3o8Mg07jxYGHlEp_AklGQU5PbI0egzGoPuZHhiuUhsWz
Пасхальные наклейки,99 ₽,36 отзывов,"Завтра доставит Ozon, продавец То, что нужно!",https://www.ozon.ru/product/pashalnye-nakleyki-513944022/?asb=mdDr3LqAYPfJIN%252BYeyW3eoYc976%252FlCRHwsH%252Fug9f2R4%253D&asb2=dXF7GJbvV_nzHoZx-HJR3jhRoFXaZ3i-VBIloepbzkd0pjWzyrKj0OCufOC3Laua
Набор для декорирования пасхальных яиц . Перламутровая краска для пасхальных яиц,297 ₽,72 отзыва,"7 мая доставит Ozon, продавец El-Store",https://www.ozon.ru/product/nabor-dlya-dekorirovaniya-pashalnyh-yaits-perlamutrovaya-kraska-dlya-pashalnyh-yaits-259386184/?asb=TKvEcqdVy9lHkhgagO4AQWrCRpFJIHsLbhdx9Eeg7HY%253D&asb2=kTUNJ0JisEzQwGc7XbC2x3VpQE8uBazJLLaxqo7RPEaVNhWOvdbYzOhxv5OT9a6R
"Набор для декоративного окрашивания пасхальных яиц ""Перламутровый блеск"".",294 ₽,27 отзывов,"Завтра доставит Ozon, продавец Pink pie",https://www.ozon.ru/product/nabor-dlya-dekorativnogo-okrashivaniya-pashalnyh-yaits-perlamutrovyy-blesk-488623706/?asb=BJNHvgIvVA%252BzEoh9s7mYeatiyDiDy%252FgGIdAvjn%252B3TK7nFrjdOVuZGBf0Cd4C0TIW&asb2=FcDEcU12MEuEI7n4yQ9ppLnASIFbFmZpkeXyLZJGUTzZXO8Y-KHTmR8yE85DXOzBqr3n3_nRKYGC5MqbhuntGyr1qmfAWMfDgSzIH4mEScTN0SsVdkvR7yP8T4IFQMw3ridIlow8_EHK_i3fgrWq8A
"Формочка кулинарная для творожной Пасхи 11х11х11,5 см.",310 ₽,1 отзыв,"Завтра доставит Ozon, продавец Gumballs",https://www.ozon.ru/product/formochka-kulinarnaya-dlya-tvorozhnoy-pashi-11h11h11-5-sm-526489895/?asb=ba9eWkP2M7a3ZwMyuZoDcO%252Byf74rl89FRjWV9AKZokg%253D&asb2=iQvSqjFC7QMlxGD07b_iDcgBdoI6IseZccni7U-dJWY3PLZ_oBB_bOSxreplpB_s
"Подставки пасхальные под яйцо ""Пасхальный петушок ,зайчик и курочка""",150 ₽,22 отзыва,"Завтра доставит Ozon, продавец Golden Plane",https://www.ozon.ru/product/podstavki-pashalnye-pod-yaytso-pashalnyy-petushok-zaychik-i-kurochka-518513564/?asb=Vu4zYIIfpNRwHi6Rp%252B97%252F%252B28o7f%252FMbaz2G2YfoEPyBs%253D&asb2=_dLJecXC_icGlX2s9RmRdwdg-ukce-ZwgZtN6yimjcWZfK_4IEeNUMecelOdZQOk
Красители пищевые для яиц/ пасхальный набор/ декор яиц/ наклейки на Пасху/ для декорирования яиц,145 ₽,8 отзывов,"Завтра доставит Ozon, продавец Dakhova",https://www.ozon.ru/product/krasiteli-pishchevye-dlya-yaits-pashalnyy-nabor-dekor-yaits-nakleyki-na-pashu-dlya-546289273/?asb=h%252BVCDUMuOTJ3NfcFmqFz%252BzG5Io8Uc8cH48CNV4NPm8I%253D&asb2=iAt1VBkQyYAV5K_7Gy1FFpRWb4YrQ3Vajy4YwNYaSXqLl25qyTgU1fQVSTVQOOga
"Пасхальный набор ""Воскресный праздник"" подставка под кулич, краска для яиц, термонаклейки на яйца, 4 предмета",140 ₽,10 отзывов,"Завтра доставит Ozon, продавец ValMar",https://www.ozon.ru/product/pashalnyy-nabor-voskresnyy-prazdnik-podstavka-pod-kulich-kraska-dlya-yaits-termonakleyki-na-yaytsa-521893671/?asb=isHKPEkTk4g%252BXajnc%252BiDSvQYiRQVfumTgNBhBqGD21c%253D&asb2=Q1F_qolz-ZA_GISVybVt1Twp3RHsCBRdB0eY_F_X6-bu5p3ukV_WQwSPkXd-QuJV
Красители пищевые жидкие для пасхальных яиц. Металлические,244 ₽,7 отзывов,"Завтра доставит Ozon, продавец El-Store",https://www.ozon.ru/product/krasiteli-pishchevye-zhidkie-dlya-pashalnyh-yaits-metallicheskie-256331500/?asb=4FN%252BIBCcolmkXFeP0ect1eMLWpJ1%252B9NJrUxt6p7OA1I%253D&asb2=YRoXWEmRj4US-ju996wZioPbsH6l1SaZwu6yZGsEGoCnU7oeMgIlobuyepO5AAre
Пасхальный набор Ми-ми-мишки,99 ₽,4 отзыва,"Завтра доставит Ozon, продавец То, что нужно!",https://www.ozon.ru/product/pashalnyy-nabor-mi-mi-mishki-521874064/?asb=rWPjvwa%252F%252FFnubUpPM%252FwQgcHpFypBRjIXXxZDDG1LgRw%253D&asb2=oTW3vGmUGAqiZmkcJKkbr-MKfRqo1SXZlHPbfSKOp3f3s7aRJtBxHSLfhOzcucuZ
"Подставка для 7 яиц пасхальная, 20*20 см",169 ₽,3 отзыва,"Завтра доставит Ozon, продавец HomeTim",https://www.ozon.ru/product/podstavka-dlya-7-yaits-pashalnaya-20-20-sm-538371414/?asb=UqY3RLQQ2aEzc5HCbNORF%252B3gqRGLdHvs%252FUaPBJ4HcaWkGcVsDgCN4JYP3L3xFkEJ&asb2=kyvCSv0-3ff4CQzjta7LKfYtfe-51lvBMIEb2ZfCPfxJLfuJRojAVUAZM_Sxn_r2ZOBvv0GzbyRk8kJE0zoQEdUu3HSq4XEg12BYXl8tHkR62ONq0AHUndLBdPXOMlRXrynPM0aTlKtE1JmbELyu_Q
Блюдо пасхальное/Подставка под кулич и яйца/Тарелка для кулича и яиц/Блюдо под кулич и яйца пасхальное,161 ₽,12 отзывов,"Завтра доставит Ozon, продавец JUSTART",https://www.ozon.ru/product/blyudo-pashalnoe-podstavka-pod-kulich-i-yaytsa-tarelka-dlya-kulicha-i-yaits-blyudo-pod-kulich-i-538309225/?asb=xjLPmVQuhZpB0CZwFGOX7B4pxVbtX1tnELL8Xqdd%252B8vCqfylFzFlGeOQfqOS8syQ&asb2=ymaUjDz0rvqB6DoOYaTagMK_IWSuaX6bHGXvF1p_Rk-2tE6GmSJiIzA2w1S6UoMwarI2jUkCh8-qxac2V4UxIn-3mWITLmuqXcsLrOiBBK6W7Wp2yP_fjMalUP1wVFvzIJMxgdyhucMi8S3HMIexjA
"Пасхальный набор жидких пищевых красителей, краска для окрашивания яиц - 6 пастельных цветов, пищевой краситель для яиц на пасху",249 ₽,8 отзывов,"7 мая доставит Ozon, продавец ИП Щербакова А.А.",https://www.ozon.ru/product/pashalnyy-nabor-zhidkih-pishchevyh-krasiteley-kraska-dlya-okrashivaniya-yaits-6-pastelnyh-tsvetov-529190603/?asb=bFCxejdTp5BdD5vFtGDyCOvAZgZr8OQNCdqctS9oq%252Fv4hLcGkA9Vk08W0eiVy4UD&asb2=fVD2D0OVKIRYtd_tIh79kYjQQnkaT9jW2A8FHKXcEATWAnmbP_CjQrr_mREnleaJgCXAPspHR9QHvdiBIw34aRSaz2GtWFw1AHoQzhfgNV7H1TpKCRAqkwlXvVT3Y7OlTjEiCO1P1-jcPllD0XcZiw
"Набор для декорирования яиц Домашняя Кухня ""Природная коллекция"" ""Черный орех""",108 ₽,4 отзыва,"Завтра доставит Ozon, продавец ТОДИКО",https://www.ozon.ru/product/nabor-dlya-dekorirovaniya-yaits-domashnyaya-kuhnya-prirodnaya-kollektsiya-chernyy-oreh-526372191/?asb=ccuDq9Hr05SpMk84MNa1z%252BscoqgyQPtmjQav1O60owQ%253D&asb2=4Ks7ncQf12aa4kBS7Q9CO5600nKbgfSmgiLQvohc8IgELC6cMZ2uppsXLuMgPMV2
Набор пасхальных наклеек для яиц / наклейки на яйца,492 ₽,31 отзыв,"Завтра доставит Ozon, продавец Lisadecor-shop.ru",https://www.ozon.ru/product/nabor-pashalnyh-nakleek-dlya-yaits-nakleyki-na-yaytsa-480042900/?asb=dCUc7JAchxKJOaEOnfhIyyZjdJBDj19ATTe4KeCPPT16XXO%252FGAbpCKTkA6Xi97lJ&asb2=TDECTj1PYVATVjEHYOp-RND4A3-GBUpWOnYaS81FbxccRXnKyhPUYIyaTPEzazhgAyb24GGGR0khTyzCj5BJEuBSzpnHc0ZdQiRkORrgUGdKKS5auZLnXqJ-7rvsR4D4hkGFv6oiZWf1UynuBmwXHQ
Набор сухих красителей для декорирования пасхальных яиц 6 цветов. Подарочный набор на Пасху,163 ₽,84 отзыва,"Завтра доставит Ozon, продавец Pink pie",https://www.ozon.ru/product/nabor-suhih-krasiteley-dlya-dekorirovaniya-pashalnyh-yaits-6-tsvetov-podarochnyy-nabor-na-pashu-524351056/?asb=r0lIC2MSjx21genQ9e4s%252FMJNByiT9bfpT42KscHeUCAWu3N9FN14k7V4YFkq1AV1&asb2=toXRCRW6f67Wsne-fZYfegkQrYABZDZB0DItDuRJq0_rT8zxzRH_SYMrBIAqtxmOxrqZEBWUDcXzsB6HcBCMS2MXY8i6r2PmBeWMWp7A4DU-iA63I2PgGRom055Bf8U7kDQwL-3OidJQyMpie6GN9Q
"Пасхальный сувенир Цыплята с гнездом, 2 шт",298 ₽,2 отзыва,"Завтра доставит Ozon, продавец ТОДИКО",https://www.ozon.ru/product/pashalnyy-suvenir-tsyplyata-s-gnezdom-2-sht-531903229/?asb=AzKajmKlL1PM8HDGkRECAFlDvtmxJ%252FN8s6HfXWJpAu0%253D&asb2=EL75wbaD_EhLDvuo2vkwfsk2gJh7CGh71WQgbXR-RR9-NsHxqSGifuRxpcUlCLYT
Полотенце Христос Воскресе Пасхальные яйца + термоэтикетки для яиц в ПОДАРОК / Полотенце для пасхи,169 ₽,18 отзывов,"Завтра доставит Ozon, продавец Diadem",https://www.ozon.ru/product/polotentse-hristos-voskrese-pashalnye-yaytsa-termoetiketki-dlya-yaits-v-podarok-polotentse-537125347/?asb=VaXy9Yw0Y2mA91gwOyrKZB%252F49riJDZfqyU3WhwEgAkOWaBgOca3%252FcguhVoe8N%252FJF&asb2=S5_5M4Tk8hLNbl4qvPpJCPQW3mKW_NHSq8QcPelauRoMxf9Vz56a5WVnee-TRlTp8IwNJe75S2bJHV48P2jDRa4MYhyVVteirSYveMgVu3bRyn8yqaDFaAkY85a0G1jY
Красители пищевые для пасхальных яиц / Пасхальный декор /Краска для пасхальных яиц,229 ₽,59 отзывов,"Завтра доставит Ozon, продавец ИваБис",https://www.ozon.ru/product/krasiteli-pishchevye-dlya-pashalnyh-yaits-pashalnyy-dekor-kraska-dlya-pashalnyh-yaits-521882165/?asb=7Tfb1InU8c8P6EbO6CJ9t3podMNzGDuUWrYSfwq4nJk%253D&asb2=Ptd8CU7JaUX4-RWRYTJrYIe6n52HYYp_aEdxNbgZHFM8-i3cCLIUm_exeN26Y2tW
Пасхальный набор декор для яиц (70 шт) термопленка Кемеровская роспись,169 ₽,11 отзывов,"Завтра доставит Ozon, продавец Кубышка",https://www.ozon.ru/product/pashalnyy-nabor-dekor-dlya-yaits-70-sht-termoplenka-kemerovskaya-rospis-521246237/?asb=fejuQteGA8VAoTYmNw1r5wMs5cSX%252BTniSx7eop0g22M%253D&asb2=x8xtxuUOs4o3oGwCEvOwn_W1P2iHucFLmHG66XywaTx6f5Xo9uinm6kHmhHj1xxq
"Набор для декорирования пасхальных яиц ""Перламутровая краска для пасхальных яиц""",570 ₽,72 отзыва,"Завтра доставит Ozon, продавец El-Store",https://www.ozon.ru/product/nabor-dlya-dekorirovaniya-pashalnyh-yaits-perlamutrovaya-kraska-dlya-pashalnyh-yaits-256299174/?asb=tpiQs9501k%252F40SvGgZAX2X%252FKFRbswZITtwKzbfYwgn8%253D&asb2=B9Jpku7PKKtmaoSeWBRHUmB6qr3dm0Mp2R7VaIlL-9ubjXrDssyclbqOMjtRslAy
"Пасхальная термоусадочная плёнка / наклейки на яйца ""Природа"" на 7 яиц",130 ₽,1 отзыв,"Завтра доставит Ozon, продавец Barberry Home",https://www.ozon.ru/product/pashalnaya-termousadochnaya-plenka-nakleyki-na-yaytsa-priroda-na-7-yaits-542773567/?asb=C6GyrKcj5cBimY5rf%252FYLvLzlj1a4IEOODZl71VeJQcg%253D&asb2=ug7IGo9gQj5FANcXnmyviH4XOcjv7Zi2FzqIb5cNTtusXN6WGGTf-bjbynrVEEUo
"Набор для декорирования яиц Домашняя Кухня ""Природная коллекция"" ""Марена красильная""",183 ₽,2 отзыва,null,https://www.ozon.ru/product/nabor-dlya-dekorirovaniya-yaits-domashnyaya-kuhnya-prirodnaya-kollektsiya-marena-krasilnaya-448285703/?asb=H0RgVU4TQnmfXVJdb0aGcILCQZmq8LP2dDXyiHo9QoU%253D&asb2=n9r5iF4cCD-8pBtp23HaeUWxo_ZHUf-3l_8wZ0tPVUwgpaTUwlb-KHakNLSgonDL
Красители пищевые для яиц/ пасхальный набор/ декор яиц/ наклейки на Пасху/ для декорирования яиц,145 ₽,5 отзывов,"Завтра доставит Ozon, продавец Dakhova",https://www.ozon.ru/product/krasiteli-pishchevye-dlya-yaits-pashalnyy-nabor-dekor-yaits-nakleyki-na-pashu-dlya-546290408/?asb=hnl9pdEd0%252BoLH9ANgnlcQsErg3nR46a3WHBhatjuDq8%253D&asb2=8aomvpyEB8Z9Q0SL6NxPKdkXeVzb-TH9li4mVWMgJMtFM370o-JjspMa6Kni6nT-
"Коробка для кулича, 15*15*26см, 2 штуки",252 ₽,1 отзыв,"Завтра доставит Ozon, продавец СамПакуй",https://www.ozon.ru/product/korobka-dlya-kulicha-15-15-26sm-2-shtuki-543266912/?asb=%252FmGJG1KI4ki94WtyIqV72tZA7NMm72EgqbFeWp95LRc%253D&asb2=DZrdkOlUsbUF8hwQ8sXBJL0MDbvyNWIDcAJbBFXNqUZl_zLybEmNysKM8157ZDcO
Набор для украшения пасхальных яиц Украшать не значит красить Зайчики,427 ₽,12 отзывов,"Завтра доставит Ozon, продавец El-Store",https://www.ozon.ru/product/nabor-dlya-ukrasheniya-pashalnyh-yaits-ukrashat-ne-znachit-krasit-zaychiki-257914996/?asb=jeXMstOy4sC%252FgZ0L1UrBayweIE706UnFBLQs9VqJMHE%253D&asb2=Bcbey6i_aYXk8a95tkgQXY9cl-Ps34J_GyE-5O2E6E6VPk8yYsOFYNHBgT6CrzVM
"Набор для украшения пасхальных яиц ""Перламутровая Пасха"". Подарочный набор на Пасху",297 ₽,72 отзыва,"Завтра доставит Ozon, продавец El-Store",https://www.ozon.ru/product/nabor-dlya-ukrasheniya-pashalnyh-yaits-perlamutrovaya-pasha-podarochnyy-nabor-na-pashu-256838459/?asb=LiEBglQba%252B05EHOHQRci5xDwSNn51GrXOhy6MWPkg8E%253D&asb2=hLsWraD07wSqma5aF0rj7ENAVnbuBENW1gGDDZUwE2r0G5OfmRQoNorxAG_cYdOL
Подставка для яиц / Пасхальный заяц / Пасхальный символ,690 ₽,20 отзывов,"Завтра доставит Ozon, продавец sweet_home",https://www.ozon.ru/product/podstavka-dlya-yaits-pashalnyy-zayats-pashalnyy-simvol-239172082/?asb=cXQ7vV3kImgagGuixNGAumP92BGRZVMB%252FGkGCqeAZOc%253D&asb2=F9Uwes_dqFKZZBMHPTFEwiFY3VNcSQa-1W9XHH0rsDvvj6Snj4BoY-037jlCcI4W
Полотенце Христос Воскресе Кулич + термоэтикетки для яиц в ПОДАРОК / Полотенце для пасхи,169 ₽,18 отзывов,"Завтра доставит Ozon, продавец Diadem",https://www.ozon.ru/product/polotentse-hristos-voskrese-kulich-termoetiketki-dlya-yaits-v-podarok-polotentse-dlya-pashi-537125485/?asb=vNoT5RQgSYXLjaPGFxkyS6PkhjYuVjz4iVcrQyQKsMrYXRleeTf29PKlBR4II%252Fq9&asb2=YmzWsiaC8g6UzeSNN2nYgpt8N1Dyi7pEqmSTRL993RlllbrxDE9Ur1Nrwu3QgGz_hXdvRVBmlaFEHWl64T80cOhmxN0LHdt7BEiNrbAYrLwIyA3i40rwW9RJypOau0nboAQtR1waRRUlVRS7qQKq6w
"Формочка кулинарная для творожной Пасхи 10,5х10,5х10,5 см",299 ₽,2 отзыва,"Завтра доставит Ozon, продавец Gumballs",https://www.ozon.ru/product/formochka-kulinarnaya-dlya-tvorozhnoy-pashi-10-5h10-5h10-5-sm-526540548/?asb=2GYpDaU4ajfwQIrCyizXmq05zdIHLMOe%252FRzF2Maq58g%253D&asb2=elAZDauY77I0aGIAzRJc2D1P1xfBuDFajVSEJjOFMMtLEd9dgQaecnmbC6S1yKvq
"Набор для окрашивания,декорирования пасхальных яиц Блестящие оттиски, краситель для яиц, Пасха",369 ₽,140 отзывов,"Завтра доставит Ozon, продавец Pink pie",https://www.ozon.ru/product/nabor-dlya-okrashivaniya-dekorirovaniya-pashalnyh-yaits-blestyashchie-ottiski-krasitel-dlya-537970814/?asb=dQ7xPsGPU5yFClTSR%252FkyOcnnoBZiVKL6JjdMXlSX1q0%252FYqX8UFqHErBh0pz52505&asb2=9BKMNlhBu19dp2u99SchmALRSFCTjKm8eKNvy4rCbNdX1vwbfgf_e41q6SsS1vFQnMjE3hPamplQB_1i7gd4HASWxAmTwNTaYeLmW4iee22GGDKnAIXH4IaJPM8P5YF442ofqG9lPYHkW9_ZaFfenQ
"Набор Красителей для украшения пасхальных яиц ""Перламутровый блеск"", 3 шт. (Морская жемчужина, Мрамор, Нежная жемчужина) / Смеси для окрашивания пищевых продуктов",390 ₽,17 отзывов,"Завтра доставит Ozon, продавец Поиграем Вместе",https://www.ozon.ru/product/nabor-krasiteley-dlya-ukrasheniya-pashalnyh-yaits-perlamutrovyy-blesk-3-sht-morskaya-zhemchuzhina-241671417/?asb=WkulxgAspIpg8W4gDXSbjchh9lXIF%252BXjpyvUJ0KN5iE4l%252BMk%252FHQ31dxMXOFfH2Lv&asb2=QLBJCiGNo6duBXJUCsDiZxKx5DR4PYukFCUzbnahdxwHCCAhbjhiWB_9m6idDE7EhVNQkNwK5OHMdYyPp_N53SVGWLT1IFjJbrOh55U8BWlb0LFd2JOx6-lv_hA9PnceTF2ULCX9uRdOAcLi0hmmdw
Набор сухих красителей для декорирования пасхальных яиц 6 цветов.,175 ₽,8 отзывов,"Завтра доставит Ozon, продавец El-Store",https://www.ozon.ru/product/nabor-suhih-krasiteley-dlya-dekorirovaniya-pashalnyh-yaits-6-tsvetov-257927221/?asb=qx3E4yv41s%252Fijvyv63ClpDKyzSr21PxLYFXy11D%252FS7o%253D&asb2=9X0RPdrAMiT-82DrGJGqsvRu9xy1PBuCWbF8wA2JG4JIwiDZY3woeOkmz9QpF9SB
Яйца пасхальные для декора 2х3(36шт),450 ₽,1 отзыв,"Завтра доставит Ozon, продавец Diverso",https://www.ozon.ru/product/yaytsa-pashalnye-dlya-dekora-2h3-36sht-498518620/?asb=pZKM5vWWAXvaVrN0lms7tIa7rnwaYZw8thE8up%252BN%252Bq7csBaNTsk2xpLcFJ7mTidq&asb2=McFZZXfSYzjDjpzye9dCYwQ-7XihIpjYL-b2aHRNM0LbrzB0FVTY23O6shlzw6JJm0rjlNnRfS4umvoEmUvfmP5m9q0s7ZK-_wkv4ST70Jjd9pQJbDz04d5inh9cl0mpngWFcP8lPXA5L86_uOuL-Q
"Подставка для яиц Зелёная полянка с цыплятами, из фетра",378 ₽,14 отзывов,"Завтра доставит Ozon, продавец Оранжевый шарик",https://www.ozon.ru/product/podstavka-dlya-yaits-zelenaya-polyanka-s-tsyplyatami-iz-fetra-536261078/?asb=ku2JFBKmkN%252FBi697BcyCrxXjqaE9RnCxirwvcm8i%252B31Ug4hvpFuogBqGB3jY184L&asb2=mu3otYHpx73zVecomyL4IA8xamsi5x5XIVIa7cXKsKoJLJyxqfphfdWEuYREqf0bZj3gBD9tcvWxcVf7rlteNINKBn_GKzkWJaBbIltIQwGa99BPw3wTcQtmvb8auwlcJFtxY1iZOe5LJ-egqx359g
Набор для окрашивания пасхальных яиц Пищевые лаки. Подарочный набор на Пасху,118 ₽,31 отзыв,"Завтра доставит Ozon, продавец >Радость в дом<",https://www.ozon.ru/product/nabor-dlya-okrashivaniya-pashalnyh-yaits-pishchevye-laki-podarochnyy-nabor-na-pashu-244832552/?asb=KOXUkwSaF3VcEhaiuhyeQi9O%252F4yrYvyLrXDAevkgzds%253D&asb2=xy-0v_BEX6qrE2XdwsHCEZSU4ZIe1aHmO-MS9Y7hibH-NWvMqUiX-5NlwgSNAQcF
Пасхальный набор декор для яиц (70 шт) термопленка Родные просторы Природа,169 ₽,11 отзывов,"Завтра доставит Ozon, продавец Кубышка",https://www.ozon.ru/product/pashalnyy-nabor-dekor-dlya-yaits-70-sht-termoplenka-rodnye-prostory-priroda-521250071/?asb=kLqnmyd326%252B2fh3ed8GANI52INxXYakUZ%252FxuthrHvd0%253D&asb2=ip6fqJ7uVaMJAmr6fxxVK5cjm6wJGNEu0tUporB1Dn4ZnGZWr83EMSdZjeAvKQ7D
"""Пасхальный набор ""Хамелеон"" розовый",115 ₽,2 отзыва,"Завтра доставит Ozon, продавец ТОДИКО",https://www.ozon.ru/product/pashalnyy-nabor-hameleon-rozovyy-525508773/?asb=Jh63OtGqWqW60ZuFTrA%252B4z7A%252BggoEA5vwubjQuTkYYM%253D&asb2=GebtDUKTq489Ecrr5wOIMTF1VZALT5Q-AkvjZE6KZT41tqPPfyJCNo0XZcumqvK8
"Набор для декорирования и окрашивания пасхальных яиц ""Пасха красная"". Подарочный набор на Пасху",282 ₽,4 отзыва,"7 мая доставит Ozon, продавец El-Store",https://www.ozon.ru/product/nabor-dlya-dekorirovaniya-i-okrashivaniya-pashalnyh-yaits-pasha-krasnaya-podarochnyy-nabor-na-pashu-259283372/?asb=cYclnUnS4%252BJUV82y1WXVb3wAzLftALyRpjabj7JOUfw%253D&asb2=AXokgPxCVKY5Bf_znwyQhfukfiWwdgc4TmVu7BoQFf7tRuX7Ch3xUdvq6xHWgyIH
"Блюдо пасхальное, подставка под кулич и яйца, тарелка для кулича и яиц, Блюдо под кулич и яйца пасхальное, MarketSalesRu",181 ₽,3 отзыва,"Завтра доставит Ozon, продавец Market Sales",https://www.ozon.ru/product/blyudo-pashalnoe-podstavka-pod-kulich-i-yaytsa-tarelka-dlya-kulicha-i-yaits-blyudo-pod-kulich-518732678/?asb=cLtS8HzHs8ISBte8i0itgwtv6ni5MK4m9FQBs7wajDA%253D&asb2=h-Sr1He1HpV0QViE4dJU0KS_psFBnx4SfD_DyQnOGdFpuYe4NIooBl0-xFq9qbzV
Термонаклейки на 7 яиц,79 ₽,1 отзыв,"Завтра доставит Ozon, продавец EGO DAY",https://www.ozon.ru/product/termonakleyki-na-7-yaits-527713882/?asb=u0l85GpwJ6%252Bodh3FptovKZORhBnF%252FjIazfGddTt0Hqg%253D&asb2=oUwtiJ7OVEXplahsZnrMwQwoqt1vfT9mygslz0gsGq-n6WaaXFE3LmtcdsYXYHwE
Красители пищевые жидкие для пасхальных яиц,317 ₽,84 отзыва,"Завтра доставит Ozon, продавец Pink pie",https://www.ozon.ru/product/krasiteli-pishchevye-zhidkie-dlya-pashalnyh-yaits-519214189/?asb=e7oukAUgxBLuv1IGjq%252Bd65ImeiBaKEIXbz2fmlb92qejaBcoyZyR4bIFynZ36oIV&asb2=0ov3TK1sjPFxSq3he110h3mxY0R1hsjzFjgZp_xUikE27duZUiIhwVsj1jIj4WaEGhf7iwZJTiUx___m5WHP2gy0Bgj8KdaKAsCKbCKRtFsFqbNfo9AfvqNpTaQmSREm8VQ7cUioFGe_wm2VatvLPQ
Форма для творожной пасхи / пасочница 45мм х 120мм х 110мм,199 ₽,30 отзывов,"8 мая доставит Ozon, продавец Diverso",https://www.ozon.ru/product/forma-dlya-tvorozhnoy-pashi-pasochnitsa-45mm-h-120mm-h-110mm-486935997/?asb=ak9EgWI734I7%252FoVF7g%252BJmzEVK4Bt1PSHENUkgPzAd5uQUaFgwS4m8PZE%252FK0yvKzy&asb2=V5XjruLf7y4J3Q_UaQ4mPa4kLGG5ZJqdEveNaEDQhVJprrDf64JRYp9_R75Fedzk1ZZbQkweq4fmkqOrnpWkkJmLLcTqAaUkqDjRGnVm8qtSUSSjQF5DlcedcITW9gQagYp16CxwYQjb0EpDFZygxQ
Набор сухих красителей для декорирования пасхальных яиц 6 цветов. Подарочный набор на Пасху,178 ₽,84 отзыва,"Завтра доставит Ozon, продавец Pink pie",https://www.ozon.ru/product/nabor-suhih-krasiteley-dlya-dekorirovaniya-pashalnyh-yaits-6-tsvetov-podarochnyy-nabor-na-pashu-488619753/?asb=5Qh1W7KHqhW5xzuAF5SzVYxybA4vw%252Bn11AV88Ee598K493pJ0uhkVvvQ0eDoR%252F2E&asb2=uHaDh-lkrh9qJAMbceOKIBDeVKjV0dWsMPdQ4GAYDJ6kEJrQezeUzt3XrCbLMI7evs-pIhXlYirt0684u1iNDHVgw8_t1xP8fieZ6xRYmIZW-TtiM0SCrrIOx3gv2yuUc55sJevKuPrI2w4riP3LKw
"Пасхальный набор (красная пасочница + подсвечник ""ХВ"") в подарочном мешочке ""Пасхальная композиция""",390 ₽,1 отзыв,"Завтра доставит Ozon, продавец Barberry Home",https://www.ozon.ru/product/pashalnyy-nabor-krasnaya-pasochnitsa-podsvechnik-hv-v-podarochnom-meshochke-pashalnaya-kompozitsiya-542809062/?asb=Bn9rzISNSFEcQ1Qu6YYvARGUtGlifoVBk0J4DTxrYXs%253D&asb2=XYlp5eYbD9n5aqaVX3q8HBJG3s6kkg0E_gn8yB_FCyHHQvuhAiLC85L03_W3N2Fw
