"Красители пищевые для пасхальных яиц / смесь для окрашивания Хамелеон с мультиэффектом, фиолетовый, краситель для яиц сухой, жидкий",199 ₽,2 отзыва,"Завтра доставит Ozon, продавец ИП Щербакова А.А.",https://www.ozon.ru/product/krasiteli-pishchevye-dlya-pashalnyh-yaits-smes-dlya-okrashivaniya-hameleon-s-multieffektom-529206815/?asb=dORYwWzImRGwiK9HN8biOphSg9ocwocjW%252Fx7scy62Z0ZscZWDLA8ovXyPCeq%252FTXg&asb2=nmdGFXCDRoxVWoonnltmXeyVdDijOMwBjTOGaocwjF_ZVOXoHjDeqEWRpitsJXphPhZIikLAEOpFt2OyaNyA030h_ThVKv5mxi6Ds46j8sr9e0ZG5DfQ7NBrRYrPR2KqhC8cGgiYBPTQoh37r-Tihw
"Сувенир пасхальный ""Курочка в платьице с корзинкой-яйцом"" 13х7х5 см",599 ₽,11 отзывов,"11 мая доставит Ozon, продавец GiftsStore",https://www.ozon.ru/product/suvenir-pashalnyy-kurochka-v-platitse-s-korzinkoy-yaytsom-13h7h5-sm-239194437/?asb=KNm%252Fo5m7gdQJrz7KjDtnhCXKkg6tvGgzQWMDWAUaBiDwND%252B0S8qlZ7X8GLScDMIt&asb2=cSIhVjo2BjxqEYuuPqAiu0AwQH9lPjC2Qkz3FcQlzdE9jSHVh_lyFyMI3KGGZG8d7HNfZivNcoxno0AcUrn3LI89BOhNucvbvHgOBPPhXMSMxtYVD2LKM-m6Vn7oJ1les_ckz0U-wVujGlgNgFZuvw
"Посыпки кондитерские ""Арахис, Семечки и Рис воздушный в глазури-МИКС"", 110гр., украшение для тортов, декоративная посыпка, для праздника, для дня рождения (в наборе 3 вида по 30гр.,20гр.,40гр.)",284 ₽,59 отзывов,"12 мая доставит Ozon, продавец Pinesslime",https://www.ozon.ru/product/posypki-konditerskie-arahis-semechki-i-ris-vozdushnyy-v-glazuri-miks-110gr-ukrashenie-dlya-522731680/?asb=i30ksVc%252B22WFs7oDu34XE8yfdeKCweGAm4ddWVPnxjA%253D&asb2=AdFfn48vim29lRo9kboKB75AiunhDAWjzysAnHxidibZ5AF-b1pX6vF_hUvqMGqM
Венок пасхальный Пасхальная композиция 27.5 * 28.2 см,379 ₽,13 отзывов,"10 мая доставит Ozon, продавец МЕГАлэнд",https://www.ozon.ru/product/venok-pashalnyy-pashalnaya-kompozitsiya-27-5-28-2-sm-251570497/?asb=E2Rn6sQuBhPSVu6%252BN8634rq%252FSfDvZ61q6IL42rtD1NcoOHi6Hr%252FT%252FR15a78VpO1v&asb2=S_m7EQ-psKC84JsZHnKcWY1vNzwa2qCUMtrgDDhC5laqpAfTYkxS_ObwRBWVAf_pymjRPJ-hTvenrJt_R4zt0XotFW5VGmWz5aZUc_DPn3JM-hQPW4Md78sKEZQKfdNb
"Штекер ""Пасхальное яйцо"" (6шт) 11*3*29см (026666)",292 ₽,1 отзыв,"14 мая доставит Ozon, продавец Садовник",https://www.ozon.ru/product/shteker-pashalnoe-yaytso-6sht-11-3-29sm-026666-544586583/?asb=CoifmdCXtj7dmTu330yxjd803TFfYVpI1PvdYtLh6FA%253D&asb2=mJeSV-Hska8AIqvuEj06xasiHmnjbq2WmzD7pOA8y5Ex84LUCeEGSzVEbCPye-Yd
"Пасхальный набор термоэтикеток, набор наклеек для яиц на Пасху, №2",238 ₽,8 отзывов,"Завтра доставит Ozon, продавец Gold leaf",https://www.ozon.ru/product/pashalnyy-nabor-termoetiketok-nabor-nakleek-dlya-yaits-na-pashu-2-523191345/?asb=BkUUc1qiBH03NdRh56dQEE2GnGMtSLFbGLHtgZ76DHzpBeEpaHocLzfYyXLDoRfg&asb2=DEGLX3qH_KVbBFtWsauCJkNYtqwMtMicSxPb4qcnrkw2hQqdBCRHgAUfiK1WN3591Ea-UB52v1K4diBzU7A-yT-MzpvJtm47Wlwa0i-OYM8bAUeq6OdkkC6Fy_kmt67UjmLfK2mTNNxuwLZ5Hwq6VA
Яйцо Пасхальное деревянное икона Матроны Московской/пасхальный декор/пасха/пасхальные товары/деревянные яйца/пасхальные украшения/пасхальные яйца/яйца пасхальные декоративные/яйцо деревянное/яйцо деревянное на подставке/яйцо сувенирное/яйцо в подарок,482 ₽,5 отзывов,"7 мая доставит Ozon, продавец Русские сувениры",https://www.ozon.ru/product/yaytso-pashalnoe-derevyannoe-ikona-matrony-moskovskoy-pashalnyy-dekor-pasha-pashalnye-tovary-248395596/?asb=K6OUs6SeHiJSoiI1qI1FCDbhptK7Sb1HTaerAil9fgw%253D&asb2=Ra01dD7j6E_noZM0j38alOrd4LdtCzLDw2lOyWTAofDZxCQfybmB_KqlIMJrjukL
"Яйца пасхальные декоративные, размер 1.8*2.5 см, набор 48 штук. Разноцветные",420 ₽,12 отзывов,"7 мая доставит Ozon, продавец InterioGrad",https://www.ozon.ru/product/yaytsa-pashalnye-dekorativnye-razmer-1-8-2-5-sm-nabor-48-shtuk-raznotsvetnye-514810559/?asb=HvjXsqotANxktfuAS43IY85WM6M%252FiCXSIOwsuxKpZEM%253D&asb2=ma6Nn1AEApNQ00H2wISzhZ9bTqovcbuq2wIziQdshSUBLIBYXQfdXUzmQOs_laB9
Пасочница / Форма для кулича Зайчики 110x85 мм 10 шт.,361 ₽,5 отзывов,"12 мая доставит Ozon, продавец Домашние приятности",https://www.ozon.ru/product/pasochnitsa-forma-dlya-kulicha-zaychiki-110x85-mm-10-sht-511963596/?asb=P%252FjLqqdSXW060EVJ5DuxJPM8vuV3oXTUrbLIo6vS%252Bt0%253D&asb2=9yRV7LMwKYohw3hTxEwg8aKt-7nZ-WVXfdGUMT1zSizpP-NaPJBWRD9qRiqQGV8l
"Пасхальный набор для украшения яиц ""Монстры"", 9,8 х 15,3 х 1,1 см",287 ₽,2 отзыва,"10 мая доставит Ozon, продавец ProПРАЗДНИК",https://www.ozon.ru/product/pashalnyy-nabor-dlya-ukrasheniya-yaits-monstry-9-8-h-15-3-h-1-1-sm-515135224/?asb=buhHB8EpqD9zGjzzy7gB0LH4eFDAUlC%252FOgxgvYnXVrA%253D&asb2=W2y61iMXwlaAdQx44JD6nbrDovFwWi1WD12rmtKl3Au21lZqumu3oocJ1K-_KF5-
"Подставка для пасхальных яиц ""Зайчик"", 20*20*16 см",328 ₽,4 отзыва,"7 мая доставит Ozon, продавец FOODWOOD116",https://www.ozon.ru/product/podstavka-dlya-pashalnyh-yaits-zaychik-20-20-16-sm-533540132/?asb=dHU7v3ayFowfBqMzwpaa59pRLYMB536W9%252BzUsofUWW8%253D&asb2=Sqn0m1fwibZe2ZkrinddnUQJVhAs9rrqcbA8hGLIUd4Xvh4Vx052e4A8X84C0Jk5
Пищевые красители для пасхальных яиц / набор для декорирования пасхальных яиц / перламутровая краска для яиц,409 ₽,2 отзыва,"10 мая доставит Ozon, продавец SaleZone",https://www.ozon.ru/product/pishchevye-krasiteli-dlya-pashalnyh-yaits-nabor-dlya-dekorirovaniya-pashalnyh-yaits-539276721/?asb=lde6R%252FLdY%252F9wNLFe6VCCjDCxCLcGU4DU%252BdW03g7LO7o%253D&asb2=ALPc5_cm1CfeD-zZ8TJq8uHOhBfbqxTBwS3VyrbuEb2DCcmfJHfaQU7vMM93svqV
"Пасхальный набор для декорирования яиц ""Серебряная роса"" + Сухие красители 6 цветов в ПОДАРОК!/пищевые красители",314 ₽,27 отзывов,"7 мая доставит Ozon, продавец Поиграем Вместе",https://www.ozon.ru/product/pashalnyy-nabor-dlya-dekorirovaniya-yaits-serebryanaya-rosa-suhie-krasiteli-6-tsvetov-v-podarok-516969157/?asb=7mCKRc2dpzc%252FU4siiVLjGNzzU6dL%252BfQ7mtsAlD3a0uM%253D&asb2=m5yGwS9OClLxdz253Y1xaEpm_zVdX1iPnocnzIihoW8XlOXr92AfSH0oLmOT4XTF
"Наклейки для пасхальных яиц: украшения подскажут - как быстро покрасить и украсить пасхальное яйцо на пасху ""Пасхальные зайки"" - 40 шт",198 ₽,33 отзыва,"8 мая доставит Ozon, продавец Стикеры Nabels",https://www.ozon.ru/product/nakleyki-dlya-pashalnyh-yaits-ukrasheniya-podskazhut-kak-bystro-pokrasit-i-ukrasit-pashalnoe-yaytso-565148686/?asb=y2sdcHPXX15N5z91Z4PkggJjoaLaPfZrgdq2kyhkO84%253D&asb2=Pp3R40ZN1me8SNUegxcas72cmVuBBcLRDTCNudvFMtvW5-aT41SWT9CmQo5r4BWO
"Яйца пасхальные декоративные, размер 3*2 см, набор 24 штуки",405 ₽,12 отзывов,"7 мая доставит Ozon, продавец InterioGrad",https://www.ozon.ru/product/yaytsa-pashalnye-dekorativnye-razmer-3-2-sm-nabor-24-shtuki-514811814/?asb=zyoodmy6vGSPmgglvMeMCr0tTsw84b8%252B%252BdnFVvQIZeU%253D&asb2=MZF4XowSkydZZomhfQZqj_eAHTe1JNngEitj3gGIYbHSaaHxdh9cRp-YIW7W3Pa2
"Набор для декорирования яиц Трафареты+Пищевые фломастеры +Сухие красители ""Кролик""/пасхальный набор",320 ₽,12 отзывов,"7 мая доставит Ozon, продавец Поиграем Вместе",https://www.ozon.ru/product/nabor-dlya-dekorirovaniya-yaits-trafarety-pishchevye-flomastery-suhie-krasiteli-krolik-246631943/?asb=SUiYwaFifEgQtA5VCPxrzoLgNMRLWPM63Z2%252Bi0okdS0%253D&asb2=TaC8Ko66GRFEqH57J5n7i1UTuNSmP__5SjYn2jYY0JItStscvMMtYwawk568lkCj
"Посыпки кондитерские ""Весенний-МИКС"", 80гр., украшение для тортов, декоративная посыпка, для праздника, для дня рождения (в наборе 4 вида по 20гр.)",369 ₽,59 отзывов,"12 мая доставит Ozon, продавец Pinesslime",https://www.ozon.ru/product/posypki-konditerskie-vesenniy-miks-80gr-ukrashenie-dlya-tortov-dekorativnaya-posypka-dlya-544538469/?asb=OxzlxAuLdfInV0PIdZL8o5pxjcU%252BlFevXmrraVFyDpo%253D&asb2=rdqngr4L_qRa8HCAoh-th7TfTFoliTi0eZ45l4pNtnWvnEJkcSNXvyECcIMieFK4
"Набор для декорирования яиц единарожки, Пасхальные украшения",359 ₽,1 отзыв,"8 мая доставит Ozon, продавец BABYBOOM",https://www.ozon.ru/product/nabor-dlya-dekorirovaniya-yaits-edinarozhki-pashalnye-ukrasheniya-502868291/?asb=VRr8Ugk1DT%252Fem6YgMF7yzqNtV4anyXITDf2GL8Zl43Z7UgDozv8p9PwFu6xqlZQG&asb2=Qmq7VUC2RVgDviEhBC3O4dWGcnjKnB1B74RWBb5YcK6jQ8k91Ne1meur8YS0F-uIgzNUYFhLua3EqhZdWM0swiNLFbeEjxL3DD_C6dT4Sx7jwcfITOq8FHn8jbGqSqv4KWf1viV7BPGQ7Uh298_VvA
"""Пасхальный набор ""Хамелеон"" синий",115 ₽,1 отзыв,"Послезавтра доставит Ozon, продавец ТОДИКО",https://www.ozon.ru/product/pashalnyy-nabor-hameleon-siniy-525511460/?asb=IOFtwNM5sLEJ5F4nm0Zli%252BW%252BVkxNzetWiXvrQdhGPnk%253D&asb2=ZY6ylOoW_bFtFkYFJR8DMkfqh015Roq4WsM6hYSx7fyoK44b7NnL8MDO9-0dWNyB
Пасхальная сумка Ветхозаветная Пасха,399 ₽,1 отзыв,"Завтра доставит Ozon, продавец Рушники",https://www.ozon.ru/product/pashalnaya-sumka-vethozavetnaya-pasha-505937311/?asb=zUuXQmuJcgLtNcUJ4gnVbTVoSBGEUwWoMLFBEBojM5w%253D&asb2=WaJ9rJbd4Sx5xN09j1VGyIiQlRVsT0DGzMaylMp0TGwWFbCw6-AnZqb8kLchSxrf
"Посыпки кондитерские ""Яйца перепёлки в гнезде-МИКС"" 110гр., украшение для тортов, декоративная посыпка, для праздника, для дня рождения (в наборе 3 вида по 30гр.,20гр.,40гр.)",284 ₽,59 отзывов,"12 мая доставит Ozon, продавец Pinesslime",https://www.ozon.ru/product/posypki-konditerskie-yaytsa-perepelki-v-gnezde-miks-110gr-ukrashenie-dlya-tortov-dekorativnaya-544570787/?asb=v1Eiuw7j4NDGUwZjYW0FAGJKcgQJl%252Ba17q3t%252BW21ZX0%253D&asb2=WR0p62L_BE-vmRsmzg7EqPsaRhY1p8PWW_LYydj1YbCp1-B8BWbzWg63ogr8QqOE
"Сувенир пасхальный ""Гнездо с яйцами"" 2 штуки в наборе",311 ₽,9 отзывов,"9 мая доставит Ozon, продавец NBORN",https://www.ozon.ru/product/suvenir-pashalnyy-gnezdo-s-yaytsami-2-shtuki-v-nabore-249351060/?asb=pzNscoqUVD1BKHk1udIUWZchFnLeG4bpro3zyV8bAus%253D&asb2=VbUNAV5f1rra1jCwJCwtIVWo6AIK4_afL9Qf9dgLCk_qcaBQN0MEqyFXSj17Cc0-
Пасхальная подставка для яиц,305 ₽,19 отзывов,"10 мая доставит Ozon, продавец АКАДЕМИЯ",https://www.ozon.ru/product/pashalnaya-podstavka-dlya-yaits-254790272/?asb=rgf4RuWapL4p7hHW6U%252FUzrCLCUIkgaVwYWPx2Bt3zP%252F9TcDTWBtqODLrLfl88iLS&asb2=Ex6Y0H1AIzrA9bQkSfcLW0hz22pgdwe7e1XHPKmaDpp0xuXjkIV6dCm7OlQ8ZqnjGB6J3EMR0eAlrEpx4rUslyYRh7et6Q03iYtYVHXJiqrujqc0t9LpbXbV9AyCQkZyK1S9Iec8cS3xRyUm2dFA2w
Топпер. Пасхальный декор.,186 ₽,1 отзыв,"12 мая доставит Ozon, продавец Wood♥Love",https://www.ozon.ru/product/topper-pashalnyy-dekor-543332954/?asb=D4XaKxec%252Bl%252FPfisHotezEwF%252B2ccsI1fwdMw3J%252FRVUYo%253D&asb2=nZdFILPEHyCMyjgMZAxV2TSalMQNWOLuCd1R5YxUjJXCfnMgXyu4VfC6DtBYISx2
"Копилка ""Зайчик"" 19х11х16см золотой,GiftsStore",533 ₽,5 отзывов,"11 мая доставит Ozon, продавец GiftsStore",https://www.ozon.ru/product/kopilka-zaychik-19h11h16sm-zolotoy-giftsstore-330715529/?asb=YS6dGJO4gpgTPougcV%252FCWgkRsI8Hu802JMAZ5ySVP%252BVHzbmco1UXQ7TG%252B2S3ruV3&asb2=61reELQ_pxXMvRbnGgEvMD7_1QJvFiF4W1Lhq9SOPeRBLbdhFadO7BtOv6Yz_UJL675qTx0ZRcOGnk444NBagrtUNqMouISEC4Y3mqJuT-fPRcMdLUOVhE73pfVgow3BVUU7KcVR2EOY5bqce4uNDg
Набор топперов и свечей ХВ (3 шт),259 ₽,1 отзыв,"7 мая доставит Ozon, продавец ООО «НПЦ «Новые Агро Технологии»",https://www.ozon.ru/product/nabor-topperov-i-svechey-hv-3-sht-529704652/?asb=2%252BEvXaUbLlPPLMaFKBN4wyIxn%252BfHj6ADXnVJpnin09g%253D&asb2=mDr5lQXbCFD0tMaIfDI5d0x2uFe1CuApZ_9Zo33B--A3pi4HEjca4iyZuBm-oI5V
Красители пасхальные жидкие/ Красители для яиц / Пасхальный декор,205 ₽,1 отзыв,"7 мая доставит Ozon, продавец ИваБис",https://www.ozon.ru/product/krasiteli-pashalnye-zhidkie-krasiteli-dlya-yaits-pashalnyy-dekor-521827476/?asb=%252F46J9B3eVTNlILvFrdbBpJ60ezlylKn9Tpm6DO8y0uY%253D&asb2=7J3807XSZ94w_MeMRJgeAfllTpgPrWwB3yR3zNMed36WjAuLig31WKqvGmQeLpIF
Наклейки на Пасху Союзмультфильм,157 ₽,19 отзывов,"7 мая доставит Ozon, продавец АлексБокс-Все хорошо, для хороших людей!",https://www.ozon.ru/product/nakleyki-na-pashu-soyuzmultfilm-533818510/?asb=%252FpoXv9GwXm6FKAZ3bJ%252BB%252B7xyhH2XYUqb%252B4%252BLeDjqbBg%253D&asb2=FMRL6YuTMwIX7r-7lt9DmNuceaIEIanYI8_TvqS0bVsTshROPvB_ou9c9x3q7e7N
"Мешочек для кулича 30х35см, лен 100%, кружево машинное, вышивка, белый",900 ₽,4 отзыва,"13 мая доставит Ozon, продавец Кружевной край",https://www.ozon.ru/product/meshochek-dlya-kulicha-30h35sm-len-100-kruzhevo-mashinnoe-vyshivka-belyy-523702115/?asb=5QL4BucTAJNw9u%252F82A%252FyfjX5p0OcbZfR7uWMdevJ4IRVV8FHX6orStbZFt6E02NL&asb2=-R18wZ3LCgXJdTWI3f9yT7Hm7N7MKE-3v-7OLNaWNjfty-fv1VtqL3rBksyg1yr-Q66E9J0yMCc-f0QP6b8b_REAL-j4bG44ZcQm0CasSFet91j3aGGkivVWiwkNAxu5
Пасхальный день / Подставка для яиц и кулича пасхальная деревянная Тарелка для яиц на пасху Пасхальная посуда Пасха,370 ₽,2 отзыва,"7 мая доставит Ozon, продавец OBBM",https://www.ozon.ru/product/pashalnyy-den-podstavka-dlya-yaits-i-kulicha-pashalnaya-derevyannaya-tarelka-dlya-yaits-na-547219718/?asb=vKEwpC5BFhVgfODcnCNFgMXheW3MYYyApPwbMlrOksM%253D&asb2=A-mBx2TqIIW8IsColwMtEL3RY8fdx6N3he7CSyhx59Fp33706epKNLZH-iIKoGo4
Пасхальная подставка под кулич и яйца. WoodFlame,560 ₽,80 отзывов,"12 мая доставит Ozon, продавец WoodFlame",https://www.ozon.ru/product/pashalnaya-podstavka-pod-kulich-i-yaytsa-woodflame-230805806/?asb=5R2Zb2V1GNyA%252BAYmAZapk%252FVBXBMEHWVjQLPiNI8av98bLfZBQSibTV1goHpTvix9&asb2=dK0i07VKlewkOydvA6HxSFomPsJ7Zzoaufe737Toj_bts3c_LYw4GbunjJbbHL5pjy7dhwM_W570rlAxHfeBGp8FnKa0hiLRjfwaitg_swCdfQ0oSlox9ftcdVeDXebL0H3CRgyYQj-6illgoSHVFw
"Деревянная заготовка ""Яйцо"" для декорирования Набор 25 шт, р-р 6.5х4.5 крупное куринное яйцо/пасхальное яйцо своими руками",971 ₽,29 отзывов,"7 мая доставит Ozon, продавец Поиграем Вместе",https://www.ozon.ru/product/derevyannaya-zagotovka-yaytso-dlya-dekorirovaniya-nabor-25-sht-r-r-6-5h4-5-krupnoe-kurinnoe-yaytso-246723179/?asb=%252Fm39VRYcvwMXYJbnt6JEZzcjhyJUUcJBG6%252FuDS50xw8%253D&asb2=f_PDb_O0vOOWwpt1yWXQFiEkQA78QrUE9_6niTAGuDh9LngwQmIshPbg73KPPWox
Пасхальный набор топперов. Деревянные топперы. Пасхальный декор.,269 ₽,1 отзыв,"12 мая доставит Ozon, продавец Wood♥Love",https://www.ozon.ru/product/pashalnyy-nabor-topperov-derevyannye-toppery-pashalnyy-dekor-542644519/?asb=a1CV0752r8MWL3lw0tvm56QDFHAZfQt6i4wImbhuF9o%253D&asb2=ewFjPTw66rTz37286OzkWgO0HWFbwjSO2twM--IbdISZO7Xs8fLeszffMWrjd0ix
"Сувенир пасхальный ""Яйцо пасхальное"" 4*6см, блестки, в пакете 6 штук",294 ₽,3 отзыва,"9 мая доставит Ozon, продавец NBORN",https://www.ozon.ru/product/suvenir-pashalnyy-yaytso-pashalnoe-4-6sm-blestki-v-pakete-6-shtuk-249357090/?asb=LJIyT5lh9WYNbHtWlCCEV3rCd1A5HMGATL9KLc1RKco%253D&asb2=5zxajWYjktgTJDLcjjHVR1eeYLQAsba2pCtHYhOdCphE2KT3wJyoeg7bB-QpiOcT
"Пасхальная посыпка/Кондитерская посыпка на пасху/Посыпки кондитерские Preston декоративные ""Радуга-вермишель"", 7 г",133 ₽,8 отзывов,"10 мая доставит Ozon, продавец Nozo",https://www.ozon.ru/product/pashalnaya-posypka-konditerskaya-posypka-na-pashu-posypki-konditerskie-preston-dekorativnye-477201139/?asb=O923WmUxYQYNd1yWhJFD6ZkXvT5bQwf839raBmnh0SrtynTXh6vcOkZQmxgvUy%252Fb&asb2=aTLXxhyEQKdDSa--vo1h-rD_R6QvJnQhH6T25iVVugT6a2Sn8G6uFDSJsi3L08SiPc-3-wNrPDlgP5eOtTupKqWGETDXBS9wPfriIr89ZvuOSa_wf-t_dD3FFDtB3pDb1ViLxon36QXagJya7WacAA
"Пасхальный декор ""Венок"" 15 см Зеленый",250 ₽,19 отзывов,"12 мая доставит Ozon, продавец Pinesslime",https://www.ozon.ru/product/pashalnyy-dekor-venok-15-sm-zelenyy-245129811/?asb=UotL%252FLbW8cvuBQCg1lij4VCndzgfHowkKM1Lr2t14c0%253D&asb2=l4M0jkEzU8ItIiM1cK0ALr1e_2c1Xk-lcKobbgiC_VDK0a-LinSKDrHpGMtS5iy1
"Набор подсвечников для кулича ХВ, 3 шт.",249 ₽,4 отзыва,"8 мая доставит Ozon, продавец Магазин кондитеру",https://www.ozon.ru/product/nabor-podsvechnikov-dlya-kulicha-hv-3-sht-513173145/?asb=9wafCb8YfXGO1KpczCYmCQA5cd%252F8AdZB7KWChf3llBs%253D&asb2=8O1f-ZvbiDUPlwJLXe91R0XIDrznlF40N-ZbE44ikw_ExRPGnX_VXmzU7dqhWpIf
Подставка под зубочистки. Кролик Белый,270 ₽,3 отзыва,"11 мая доставит Ozon, продавец ФЛЁР ПОСУДА-УЮТ-ДОМ",https://www.ozon.ru/product/podstavka-pod-zubochistki-krolik-belyy-562231982/?asb=eSJhkhL0kuq6jSPN2rLCmd9PuTUcD4jeVL4FafdWV5rlBX9Ddl25VSM51tTR%252BJTM&asb2=VqLiBL7JPOKXEeDNZ46W_kxLIRM2oseOjrGOK-z9_fGXgmqhHVdRJz5_LjDK8lzpvqkF3mM3sGbp9iCQPyoGnKI0ahn9t3hPjvJiNbAJtxpL8FRpoQtnslUKtIbQ4PH_He4uVp11WWuMe7RjKEI2YQ
"Салфетка Пасхальная 40х40см, лен 100%, кружево машинное, вышивка, красный",700 ₽,8 отзывов,"13 мая доставит Ozon, продавец Кружевной край",https://www.ozon.ru/product/salfetka-pashalnaya-40h40sm-len-100-kruzhevo-mashinnoe-vyshivka-krasnyy-523707183/?asb=eZoWfP8Zq7CvSj166v4vmT9RPauJqP2oT7%252B4VLwxLngHMxZNZg4%252BwCs4MUrCRDR1&asb2=GGUDRCeE7CbL64Xqpsp0-X03djHmn2jKJEjMnSyqN2s0Y-6gvffgF3s1uMAw2lfSCByNzEzCA7YaNY67q-ypFOiphofefOoxS9pqJ_frI7US-y-7vGfpg59e34YN1MRj
Термоэтикетка для пасхальных яиц пасхальная лента Гжель 5шт пасхальная термоусадочная пленка для украшения яиц наклейка пасхальная,320 ₽,2 отзыва,"7 мая доставит Ozon, продавец Spring",https://www.ozon.ru/product/termoetiketka-dlya-pashalnyh-yaits-pashalnaya-lenta-gzhel-5sht-pashalnaya-termousadochnaya-509493242/?asb=LiBa2jw0klAdu054SW%252FxhaBdwHzBF1l91kmS0Fl9jFc%253D&asb2=waj7tuUGDpXoX4H-fp0cWRQ4sA3Kmvi8gJBIq5S_3hl5miQzZPtym7ZQfO-lG959
"Набор для декорирования яиц Трафареты + Пищевые фломастеры + сухие красители ""Цыплёнок""/пасхальный набор",333 ₽,12 отзывов,"7 мая доставит Ozon, продавец Поиграем Вместе",https://www.ozon.ru/product/nabor-dlya-dekorirovaniya-yaits-trafarety-pishchevye-flomastery-suhie-krasiteli-tsyplenok-247451525/?asb=jqcE7QZF%252F2twfc8Srby2EHkRhimkVujGONX%252BH5uph3E%253D&asb2=Sx_dM2JDp0Kb0h1dLP4dASjEQPA77YRY7ZqsvYVrphJznCnswluiujHlcd0eZsjf
"Пасхальный сувенир, декоративные птички на прищепке, 3 шт.",445 ₽,1 отзыв,"Послезавтра доставит Ozon, продавец ТОДИКО",https://www.ozon.ru/product/pashalnyy-suvenir-dekorativnye-ptichki-na-prishchepke-3-sht-531814810/?asb=0vXHWpLdLJKEqVz7S1ItzMaP4qvDJ0Jq1VrAkMpVgQQ%253D&asb2=O3i5vhu2dOOJ07sc9kC_ykeulsDc82539xWYiGfAi8b3wDmLCdu1SILZ0eBNIjzx
Подставка для яиц Dolodom на Пасху под 12 яиц и кулич из берёзовой фанеры,482 ₽,17 отзывов,"9 мая доставит Ozon, продавец Dolodom",https://www.ozon.ru/product/podstavka-dlya-yaits-dolodom-na-pashu-pod-12-yaits-i-kulich-iz-berezovoy-fanery-221239341/?asb=Nv5tKun0j%252F0cJkgS25VD2IKupvVTUiOOr9udPs60U7Q%253D&asb2=UnDrk99j8DUhhjyuR3bJJA2QTke47ZwuYkXNb2BWaj2QPIEJi64Q4aGffdDEb9mQ
"Набор для окрашивания пасхальных яиц ""Хамелеон"" фиолетовый с мультиэффектом",237 ₽,6 отзывов,"10 мая доставит Ozon, продавец OnvA",https://www.ozon.ru/product/nabor-dlya-okrashivaniya-pashalnyh-yaits-hameleon-fioletovyy-s-multieffektom-497254960/?asb=ertyXWfoUcQDZ14gB8uqtOccyPbj1j2VuKatumWk4UHFFLH0E81%252FOtPWuOFsxFAs&asb2=X-hi7p3uemIHleItgETzbAwozjrh_tP8ohYEQ2IZ3gu36MSPDII3HVN9ostJ7WuSHugXT0obhgAIv0XFKkX84dHMG1nfuVnDeKDhkTdcsmlRcE0ssaEkmsf0lsp15BRdu2Rd1xPFkkKToRuoS0wIEw
"Игрушка заводная ""Цыплёнок""",297 ₽,4 отзыва,"10 мая доставит Ozon, продавец ProПРАЗДНИК",https://www.ozon.ru/product/igrushka-zavodnaya-tsyplenok-511405171/?asb=0aO7YKa9VfJXUbhwfdBZjnsf71IcH03ezxKxCOn5Fwk%253D&asb2=bkV76cfenJtMeaXShE_FbO9tbz38EUFkyNRpqr7kCMJOakBOWhlPJ6pW36p8sEH9
Наклейки на Пасху Ангелы,140 ₽,19 отзывов,"Завтра доставит Ozon, продавец АлексБокс-Все хорошо, для хороших людей!",https://www.ozon.ru/product/nakleyki-na-pashu-angely-533818515/?asb=wHHFMRQTpyfQIMqoF808tm6K7s82MVAhX5mMjToAMjw%253D&asb2=TKD8y5argVSTrQ-2QpXz4-nP2IzlvT_jV9q-gIXebRLw657q2MxMy2X_gD2bxPs3
Смеси для окрашивания пищевых продуктов перламутровые,282 ₽,7 отзывов,"7 мая доставит Ozon, продавец El-Store",https://www.ozon.ru/product/smesi-dlya-okrashivaniya-pishchevyh-produktov-perlamutrovye-256423858/?asb=swT3Bcp8BWTjwNBWhRQ4WLEOi1d0LxOqwpyM1g6Xs4M%253D&asb2=-h0I1L_M_Xv3mk7Kf8Yuf35BE713eX6tNFbMtLnL7jjE7jzqxwudi5eL8j5kJeBI
Пасхальная подставка для яиц и кулича /подарок упаковка деревянная корзина Пасха,420 ₽,3 отзыва,"7 мая доставит Ozon, продавец art_home_116",https://www.ozon.ru/product/pashalnaya-podstavka-dlya-yaits-i-kulicha-podarok-upakovka-derevyannaya-korzina-pasha-524237223/?asb=HBZdmSgvcL2lRvg8UBWP13JijdBGJBaZ7FLE6BufJ5M%253D&asb2=ZgULVMhZlQDj8qXAnXBphommMGq4jNMjRrun6dw4DXy2Mr5vU3oPruobvkwufweE
"Пасхальный набор для украшения яиц ""Подарочки"", 9.8 х 15.3 см",294 ₽,1 отзыв,"10 мая доставит Ozon, продавец ProПРАЗДНИК",https://www.ozon.ru/product/pashalnyy-nabor-dlya-ukrasheniya-yaits-podarochki-9-8-h-15-3-sm-511221975/?asb=8Ha6EVkKISkAjzbgdnQyL4fgbAMOYXrbGjQ77pFZGrQ%253D&asb2=DBdgyc03d-URmwo5_ugW2_r8CEc3PqeF_b6MfZyNuqiJrAF7IwaXJ0MBqPOYMD-x
"Стеклянная подставка на 8 яиц ""Цветочная"", 20.5*20.5 см",379 ₽,1 отзыв,"Завтра доставит Ozon, продавец Фабрика счастья",https://www.ozon.ru/product/steklyannaya-podstavka-na-8-yaits-tsvetochnaya-20-5-20-5-sm-244919643/?asb=MMy6TLcxfZd1qvyRhIQKWv9IU9M%252Fwv796zhz2f3q8Ac%253D&asb2=GuvFTqAoK0uW-NC8M-ZNxnnY8q85FibMIkllC-GykY8vekWaYK_2qAPSDhvdJANO
Свеча фигурная. Свеча интерьерная. Свечи. Набор свечей. Свеча Пасхальная. Свеча,489 ₽,2 отзыва,"Завтра доставит Ozon, продавец Made in Home",https://www.ozon.ru/product/svecha-figurnaya-svecha-interernaya-svechi-nabor-svechey-svecha-pashalnaya-svecha-540092539/?asb=a1SziOcNhdxLkWPt%252FNuidFYiuAWEC665BSxFchaNzbA%253D&asb2=-uNrvdIvbCze14PSedUv3UAPBt7SEmE0wpwJwqGXyaamjVUxRyMoaQiHaCTZDmx2
"Посыпки кондитерские ""Шарики-МИКС"", 100гр., украшение для тортов, декоративная посыпка, для праздника, для дня рождения (в наборе 5 видов по 20гр.)",284 ₽,59 отзывов,"12 мая доставит Ozon, продавец Pinesslime",https://www.ozon.ru/product/posypki-konditerskie-shariki-miks-100gr-ukrashenie-dlya-tortov-dekorativnaya-posypka-dlya-518291328/?asb=HwabjlJy9sdZwxyFbLecmBRaq%252BjOlkVfassgexhVnzQ%253D&asb2=NdAsmuAX6DNnErTvth3-8TAoitisWbLYfTXiQUVqmrnakR71bQ17-8_E0CML-a6S
