Перчатки кожаные с нарукавником для пчеловодства,687 ₽,14 отзывов,"9 мая доставит Ozon, продавец Wonderful&House",https://www.ozon.ru/product/perchatki-kozhanye-s-narukavnikom-dlya-pchelovodstva-281289072/?asb2=DDPdMg4nmtm-17UKoLZv7_v9vFvDdDfEsH_GCLqlyQpBiS2zxHkZjJcgCaups3ft
Перчатки кожаные с нарукавником для пчеловодства,687 ₽,14 отзывов,"9 мая доставит Ozon, продавец Wonderful&House",https://www.ozon.ru/product/perchatki-kozhanye-s-narukavnikom-dlya-pchelovodstva-281285191/?asb2=NoK_gwWOHVvus_RorlPYQaHK338dOJrFztBrUfYwlr23wbngYLkt3_qyWJMRV_sB
Средство для поимки роев Апирой,399 ₽,3 отзыва,"9 мая доставит Ozon, продавец Bee-Box",https://www.ozon.ru/product/sredstvo-dlya-poimki-roev-apiroy-544007727/?asb2=sLQQ8KyV65uACb0kM-C9aYw_JAPWwFemjA7g-NJmP5IoHvAb34PfCnCJlVzNfF0-
"Стамеска пчеловода ""Канадская""",530 ₽,9 отзывов,"8 мая доставит Ozon, продавец Пчеловод",https://www.ozon.ru/product/stameska-pchelovoda-kanadskaya-429759891/?asb2=jRztqaiFJUYgLMUm7FYHnJ_GWTBRGDF3AjQD28r1w37t3ag1mpqSJEUZG--b4SWh
"Успокоишки, топливо для дымаря",390 ₽,2 отзыва,"8 мая доставит Ozon, продавец Пчеловод",https://www.ozon.ru/product/uspokoishki-toplivo-dlya-dymarya-556512718/?asb2=bYR4blKLIJdtYFFs4hEKr5nxajyk5px2n29BxziaLbvtcWdVnTa9iXAhgac-RIgo
"Клевер луговой красный (2х0,5 кг)",429 ₽,5 отзывов,"9 мая доставит Ozon, продавец Bee-Box",https://www.ozon.ru/product/klever-lugovoy-krasnyy-2h0-5-kg-539410809/?asb2=HS5gYwyn-kNLTd9RN--yDIpdqFsSiSJ-7_ulhg8LDQuuo9u49opfvxx4qsDddg5c
"ВарроНет (Спрей от клещей варроа (варроатоз), на 50 ульев)",301 ₽,100 отзывов,"8 мая доставит Ozon, продавец Beecompany",https://www.ozon.ru/product/varronet-sprey-ot-kleshchey-varroa-varroatoz-na-50-ulev-228392353/?asb2=M98zND8dFACk1A9iQzsMVYxjkzrZCNImfWuDg9t1uLke_vHpjeyncQpsDH_-2APc
Стамеска шлифованная с пластиковой ручкой,337 ₽,27 отзывов,"15 мая доставит Ozon, продавец Агро63",https://www.ozon.ru/product/stameska-shlifovannaya-s-plastikovoy-ruchkoy-205261006/?asb2=TlEmbxommty-JI8RCmKFqRv_uezuaGqPe0S_12mldS10u9qCzHCZ7Z8uHYrdoP5M
Дымарь ДП1 оцинкованный со стаканом (Высота 290 мм),829 ₽,16 отзывов,"9 мая доставит Ozon, продавец Bee-Box",https://www.ozon.ru/product/dymar-dp1-otsinkovannyy-so-stakanom-vysota-290-mm-494966611/?asb2=hFSxSKlgZsnoBeAllRtea85PcG284ztp1NAy4jwfQqFWHZeysSxm-sBd0eao6fKLY0AD0fyRZGZQP9HNqdqapA
Средство для поимки роев Апирой 3шт,967 ₽,45 отзывов,"15 мая доставит Ozon, продавец Агро63",https://www.ozon.ru/product/sredstvo-dlya-poimki-roev-apiroy-3sht-210385902/?asb2=tg1zrqto3twjLbl5wfPdiBjJiNNWrWEtXsthHJu1bj9vn9C0QKJgAY1D3jHRgIfM
"Пчеловодная проволока 0,5 мм 0,5 кг. Нержавеющая сталь. Пищевая нержа, Для пчелиных рамок в ульи для пчел, для пчеловодов, вощины",794 ₽,83 отзыва,"14 мая доставит Ozon, продавец СТАН Нихром Фехраль Нержа",https://www.ozon.ru/product/pchelovodnaya-provoloka-0-5-mm-0-5-kg-nerzhaveyushchaya-stal-pishchevaya-nerzha-dlya-pchelinyh-219369831/?asb2=WuTIyE5jBBIRotE6zo_s5yjMEh2fL1ghg3egRqhNIihrSC9xeLLovsWw4iHSeag_3djq-yxC4x7OqcYvuu-ppQ
2шт! Шпатель пчеловодный пластиковый/шпатель для пчел/шпатель для маток/шпатель для личинок/шпатель- 2 шт.,495 ₽,2 отзыва,"Завтра доставит Ozon, продавец ДримБи",https://www.ozon.ru/product/2sht-shpatel-pchelovodnyy-plastikovyy-shpatel-dlya-pchel-shpatel-dlya-matok-shpatel-dlya-229431685/?asb2=IIOJA0UdQ9B8uF_wW6ti_jiyPW1seRtAWEXQ8Zg8OaH_nknn1sGqeoFD992uGcH_
"Втулки для рамок 4,5х2,5, 0,1кг",379 ₽,15 отзывов,"8 мая доставит Ozon, продавец Пчеловод",https://www.ozon.ru/product/vtulki-dlya-ramok-4-5h2-5-0-1kg-429762478/?asb2=-5jXILZTrAvns6sMPHR1FTL_-fNAmx2aoEDlVfRRaiwhf37oR_7NyZFZpihWFgec
Вилка-комбайн,499 ₽,41 отзыв,"8 мая доставит Ozon, продавец ДримБи",https://www.ozon.ru/product/vilka-kombayn-217032210/?asb2=wlHBDc5yFBtg83XtQvBrFwB0x3tWisYQeNUMXMX7jCVu8nfCO-HuNuUIVcbcxNhp
"Нож для распечатки сотов, пасечный, стамеска пчеловода.",646 ₽,14 отзывов,"11 мая доставит Ozon, продавец ДримБи",https://www.ozon.ru/product/nozh-dlya-raspechatki-sotov-pasechnyy-stameska-pchelovoda-249990498/?asb2=CxreWT-xoTxZoyktJdh719FqHh4IiNutr9_8VMPlTBgEWlvotFBmS6zixgJt-sC2
Щетка-сметка для пчел 2-хрядная конский ворс,521 ₽,41 отзыв,"15 мая доставит Ozon, продавец Агро63",https://www.ozon.ru/product/shchetka-smetka-dlya-pchel-2-hryadnaya-konskiy-vors-205259822/?asb2=9e-Xw_9C7MiXJNKH9CGBFUGFkcp8TRVZUg9B_hKl_vaGpfL_m_2tFYCiIEEcCmaW
Муравьиная кислота 60% 500 мл,515 ₽,9 отзывов,"13 мая доставит Ozon, продавец YAMD",https://www.ozon.ru/product/muravinaya-kislota-60-500-ml-345811387/?asb2=pCTvK7nx14h7QxbmawHQOpPh_g0vAT3wFAhNcnb-qnOb1fyF8JIDpoUAPF3mqOUN
Кормушка рамочная для пчел 3 литра с плотиком ( 3 штуки ),936 ₽,18 отзывов,"15 мая доставит Ozon, продавец Агро63",https://www.ozon.ru/product/kormushka-ramochnaya-dlya-pchel-3-litra-s-plotikom-3-shtuki-286201645/?asb2=6oUOYTawriUDtH26zLdlHSjYwtDkh1oOyIIvZGu0t-5HbVfkl69L46BKRlQ_MoO4
Муравьинка 3шт,725 ₽,21 отзыв,"15 мая доставит Ozon, продавец Агро63",https://www.ozon.ru/product/muravinka-3sht-264741023/?asb2=GIE0YoT134QwFJ5dQS9qETVOgpXPIf4lUey3u6eMpgjm6-dlCpXCRFwt6ThbVDWm
Стамеска многофункциональная козья ножка 2,424 ₽,6 отзывов,"15 мая доставит Ozon, продавец Агро63",https://www.ozon.ru/product/stameska-mnogofunktsionalnaya-kozya-nozhka-2-265035388/?asb2=VGN9YxIeUu9OvV416mTfIH0kGO8c-zQb5kthl6zu9voUZ-57bFprSJaMfc3rqY6B
Маркер Uni POSCA для метки маток желтый,467 ₽,6 отзывов,"15 мая доставит Ozon, продавец Агро63",https://www.ozon.ru/product/marker-uni-posca-dlya-metki-matok-zheltyy-211174092/?asb2=HIoSjC1zbpa5JuxUSt9zFTlCbd6Gue4opJFn9TapxiLLeihnrUGaqHQIM6QR8GR7
10шт! Скреп ульевой/крепление корпусов улья/скреп-защелка ульевая/ оцинковка с отверстием для фиксации-10шт,589 ₽,9 отзывов,"10 мая доставит Ozon, продавец ДримБи",https://www.ozon.ru/product/10sht-skrep-ulevoy-kreplenie-korpusov-ulya-skrep-zashchelka-ulevaya-otsinkovka-s-otverstiem-dlya-403083809/?asb2=UPNa5H9Vb_gCdT2hHRUS3yv9hyfpsCqGJm942wUJ0Zwe7yuzDOgr6KTxJIqcA32E
Каток для наващивания универсальный,410 ₽,17 отзывов,"15 мая доставит Ozon, продавец Агро63",https://www.ozon.ru/product/katok-dlya-navashchivaniya-universalnyy-210403018/?asb2=OZiTheh1tWiJA8SGUyvHrJQEG5TUE9WWxOREIVKeR54j6cAkqWifhFZVDSMRXwx6
Семена фацелии 1 кг,566 ₽,9 отзывов,"15 мая доставит Ozon, продавец Агро63",https://www.ozon.ru/product/semena-fatselii-1-kg-205301543/?asb2=CzfgfhM98NL1bANlvKcRVcxTP4yxMmCPQ-WW_OES5R4ThnVeCM9MJJp74gokJ3Vb
"Стамеска нержавеющая многофункциональная простая, с деревянной ручкой",569 ₽,92 отзыва,"10 мая доставит Ozon, продавец ДримБи",https://www.ozon.ru/product/stameska-nerzhaveyushchaya-mnogofunktsionalnaya-prostaya-s-derevyannoy-ruchkoy-217826524/?asb2=HqT2UMOGD2l7-w1kWx5pkCWx5W5mrvcLJ4vTLhuu8CR30LCqWy-xEX5D4FY7CZqQ
"Проволока пчеловодная стальная диаметр 0,5 мм 500г",528 ₽,4 отзыва,"9 мая доставит Ozon, продавец GelandSab",https://www.ozon.ru/product/provoloka-pchelovodnaya-stalnaya-diametr-0-5-mm-500g-467980714/?asb2=4pIglXso03agQYxtw4SVtGoulBRNLu_dnzqiebiGEcykeg6I0o9C3cGJsRRbS-7f
Щавелевая кислота порошок 500г,285 ₽,3 отзыва,"Завтра доставит Ozon, продавец Просто Фасовка",https://www.ozon.ru/product/shchavelevaya-kislota-poroshok-500g-551563911/?asb2=ZXJS188zCVghQwjMaD6obbv92xnCkynRXRbemgY89BK6qJauyNVxCaVs2yKHcG2C
"Пчеловодная проволока 0,5 мм 0,25 кг. Нержавеющая сталь. Для пчелиных рамок в ульи для пчел, для пчеловодов, вощины",482 ₽,11 отзывов,"14 мая доставит Ozon, продавец СТАН Нихром Фехраль Нержа",https://www.ozon.ru/product/pchelovodnaya-provoloka-0-5-mm-0-25-kg-nerzhaveyushchaya-stal-dlya-pchelinyh-ramok-v-uli-dlya-218266819/?asb2=flIawzgdzW24J-0qV6gshUsXcbYAVWBRULg-NgNmb2-HG8oq5MLpEEVrDsQ5L8nqrFPmrs6FM8ckPQK7lLLwhQ
"Щавелевая кислота 99,6%, 200г.",303 ₽,185 отзывов,"Завтра доставит Ozon, продавец ДримБи",https://www.ozon.ru/product/shchavelevaya-kislota-99-6-200g-238788014/?asb2=_r0eV_eKiqcDQoWo_wGS5BTgw6IuKSNDBAt0oS514eBHqUvyM-3Gif2eTD26VNNXnJgKMwwfcCsv5Qe4EBX1Bg
Электронаващиватель для вощина/для рамок с втулками/пасечный/для пасеки/ДримБи - 220-12,934 ₽,12 отзывов,"Завтра доставит Ozon, продавец ДримБи",https://www.ozon.ru/product/elektronavashchivatel-dlya-voshchina-dlya-ramok-s-vtulkami-pasechnyy-dlya-paseki-drimbi-220-12-302623678/?asb2=SLru29_VOduzckRSxxQjVAx70yZg4E1pfxWBnaD4zI_mOw_nX05SZpFMj4Kcyghx
Муравьинка (4 пакетика по 30 г.),319 ₽,2 отзыва,"9 мая доставит Ozon, продавец Bee-Box",https://www.ozon.ru/product/muravinka-4-paketika-po-30-g-546061353/?asb2=JGuVflfIWqYKnjmmo_TBi4thHJxe215tQQhvt-K0jrkmtAWg27LkRzgSFkYgguuA
"Семена фацелии, 1 кг",525 ₽,1 отзыв,"10 мая доставит Ozon, продавец Природа Мёда",https://www.ozon.ru/product/semena-fatselii-1-kg-533486183/?asb2=3QLr_PUvTA6_QIy5_rvVt4_kdYoHqis3g42-Nr1o8h4KSKCCEpE_UTrAqT-TnHzC
Натяжитель проволоки на рамки для улья,671 ₽,2 отзыва,"8 мая доставит Ozon, продавец Пчеломаркет",https://www.ozon.ru/product/natyazhitel-provoloki-na-ramki-dlya-ulya-523576191/?asb2=EBP3reg2sup0yG7wyaxTkXS-3E0rzSx2x74UuY8M6EXxLMujrvCzASNZK5PIsoJO
Семена донника желтого - 4.5 кг,735 ₽,4 отзыва,"10 мая доставит Ozon, продавец Природа Мёда",https://www.ozon.ru/product/semena-donnika-zheltogo-4-5-kg-533455272/?asb2=upcDeC59EtMCAMgdd38vpUOShL7OyNUpSFt7lVhFdewqXbUCBST7aRPyrCF5ZwHL
"Щавелевая кислота, для пчеловодства, чистящее средство, 100 г",169 ₽,1 отзыв,"8 мая доставит Ozon, продавец ОЛМАС-КОЛОР",https://www.ozon.ru/product/shchavelevaya-kislota-dlya-pchelovodstva-chistyashchee-sredstvo-100-g-526478166/?asb2=fCN-rKDQ27cNG1Bg3V7xXASea7E0AdtlEqd0o4RXM8YBsaaHBks_fQnjiW5I4xju
Шпатель пчеловодный пластиковый 2 шт.,590 ₽,10 отзывов,"8 мая доставит Ozon, продавец Агро63",https://www.ozon.ru/product/shpatel-pchelovodnyy-plastikovyy-2-sht-202138793/?asb2=y43cvSOT9WPYz7Hc4BGi5EFpstzN4aS6CsuqtTxPpVUa9_39Nx8CpVCh2KXADxmA
Средство для привлечения и поимки роев Апирой 2 баночки по 25 г. / феромоны для пчел / роеловство / товары для пчеловодства,750 ₽,2 отзыва,17 мая доставит продавец Зоомагнит.РФ,https://www.ozon.ru/product/sredstvo-dlya-privlecheniya-i-poimki-roev-apiroy-2-banochki-po-25-g-feromony-dlya-pchel-502393068/?asb2=1Y2fCIHyohDUh8VDhxy8CPy3WwjUT9cQqD92gUd3v9om35rThuwArUbZwae8NVML
"Корм для пчел ""Нектар"" (стимулятор) Подкормка для пчел. Концентрат 100 мл",350 ₽,16 отзывов,"8 мая доставит Ozon, продавец Beecompany",https://www.ozon.ru/product/korm-dlya-pchel-nektar-stimulyator-podkormka-dlya-pchel-kontsentrat-100-ml-228388338/?asb2=Pz-puWt8mqLNa_1JN7wMy-QfZNjS59a2ijP_GeY6pCIdX14F4hUpFcwpY1246IOs
5шт! Заградитель летка премиум/летковый заградитель/для ульев круглый/леток дадан/- 5шт.,226 ₽,15 отзывов,"10 мая доставит Ozon, продавец ДримБи",https://www.ozon.ru/product/5sht-zagraditel-letka-premium-letkovyy-zagraditel-dlya-ulev-kruglyy-letok-dadan-5sht-277477137/?asb2=eoLUNxpr_X6zDxR4vCoMsh7Pfbpw4kqcVEQumRdtORrNSgkjKl6WBV4f_XWA0y27QySO7LDhQJf_J4gYd3kRGQ
Сетка лицевая защитная камуфляжная,449 ₽,1 отзыв,"9 мая доставит Ozon, продавец Bee-Box",https://www.ozon.ru/product/setka-litsevaya-zashchitnaya-kamuflyazhnaya-539026030/?asb2=8jkDgtCSjMWQYMg49AjbctaJxMtm-5TrDB41OhSs9kujYzGJCrCNpJ_Klfw9uipr0ehGVP0riJe4pRRjcmlgXw
Щавелевая кислота порошок 200г,190 ₽,3 отзыва,"Послезавтра доставит Ozon, продавец Просто Фасовка",https://www.ozon.ru/product/shchavelevaya-kislota-poroshok-200g-548772955/?asb2=2LhYC5FJmlsChXg61XjMppRquORH5ZkdvMI_FHNvQhuxXkq4V6iRecwFfNY6V1-M
Фильтр для меда двойной 200 мм оцинковка,799 ₽,1 отзыв,"9 мая доставит Ozon, продавец Bee-Box",https://www.ozon.ru/product/filtr-dlya-meda-dvoynoy-200-mm-otsinkovka-554636154/?asb2=KR9wn6w20xnznsBDR8gIFQWx3CG-OaQOLRGeTIShJGWH0OqGpUnIckG4Yi_YY74i
"100 шт! Мисочка для маток/мисочки для никот, nicot/-мисочка для пчел/вывод маток-100 шт.",605 ₽,1 отзыв,"10 мая доставит Ozon, продавец ДримБи",https://www.ozon.ru/product/100-sht-misochka-dlya-matok-misochki-dlya-nikot-nicot-misochka-dlya-pchel-vyvod-matok-100-sht-220661144/?asb2=WZfI6fmldQvGnx852PV281n7eDlliude2olkA0ZvsZh5WNNhxOIc3QkuYxgk97LatOpcig0p34nvN_blC5Xj9w
10 шт! Заградитель летка премиум/летковый заградитель/для ульев круглый/леток дадан/- 10шт.,313 ₽,15 отзывов,"10 мая доставит Ozon, продавец ДримБи",https://www.ozon.ru/product/10-sht-zagraditel-letka-premium-letkovyy-zagraditel-dlya-ulev-kruglyy-letok-dadan-10sht-277476478/?asb2=3QBHXrrB_voy1KGp7bBdeh2XMel6QF_1b3s-W6eXR6HyVQCQSJPuOBf1CKXa04yX
Холстик-положок 540 х 540 мм двунитка 5шт,515 ₽,12 отзывов,"15 мая доставит Ozon, продавец Агро63",https://www.ozon.ru/product/holstik-polozhok-540-h-540-mm-dvunitka-5sht-207871565/?asb2=eDHpsp5fNWmccVnXPxfJK7k1kQnsMvuJ7Q0ZX7jkvbUbKsP7RuVhv6v1iLmh4bwP
"Семена люцерны, 1 кг",630 ₽,4 отзыва,"10 мая доставит Ozon, продавец Природа Мёда",https://www.ozon.ru/product/semena-lyutserny-1-kg-533454923/?asb2=b2DBYckN5KZgpaLV0Ot6S5ftd8ObhWqTtJYCbfDjf9_BLeNG5dQZLuhzrO9RGxc5
"Банка для меда с ложкой ""Пчелка""",300 ₽,5 отзывов,"13 мая доставит Ozon, продавец JUST.RU",https://www.ozon.ru/product/banka-dlya-meda-s-lozhkoy-pchelka-541654079/?asb2=Ec0XWWgS1oqttI9M5uTxPvp_0I6kYghhq2KfU3vnRswq3cknOHEbpp5FfX6w4RL3zExsYJyuTcFAy0kD_yc0Xg
Кормушка рамочная для пчел 3 литра с плотиком,472 ₽,18 отзывов,"15 мая доставит Ozon, продавец Агро63",https://www.ozon.ru/product/kormushka-ramochnaya-dlya-pchel-3-litra-s-plotikom-287711603/?asb2=epf69VWwI7TeiVP53j2bABlw7o8ZfqK6lgO0vE-d5kV28ifQLf92eIHQJOpo7h6F
"Семена люцерны, 2 кг",1 050 ₽,4 отзыва,"10 мая доставит Ozon, продавец Природа Мёда",https://www.ozon.ru/product/semena-lyutserny-2-kg-533455281/?asb2=UK6RsVM2Luakss21U7MHs4ZuIpTZMzXnLuYBF4prO5XtogunfjREFGtNrEFgT-uG
"10 шт.Рамка для улья Дадан Евро, с отверстиями-5шт., пазом в верхней планке для вощины, разделителем Гофмана, пчеловодная, 300мм,разобранная-10шт.",614 ₽,70 отзывов,"10 мая доставит Ozon, продавец ДримБи",https://www.ozon.ru/product/10-sht-ramka-dlya-ulya-dadan-evro-s-otverstiyami-5sht-pazom-v-verhney-planke-dlya-voshchiny-327794809/?asb2=hw71M_4fVjiilJEfqswKZ-pssKYW5LaUlFNBzmID6jHPQqQoukn7cPHK5Cgfa-nS
Семена донника желтого - 1 кг,336 ₽,4 отзыва,"10 мая доставит Ozon, продавец Природа Мёда",https://www.ozon.ru/product/semena-donnika-zheltogo-1-kg-533454954/?asb2=Pf-g43srYwrkox7bfcBH5rjT7qzLaNGQqzMwFFf_wuJoFjAmaTdb4RE5oSyggspn
Заградитель летковый 140 мм с доп. отверстием д.2.5 мм ( 10 шт),457 ₽,1 отзыв,"9 мая доставит Ozon, продавец Агро63",https://www.ozon.ru/product/zagraditel-letkovyy-140-mm-s-dop-otverstiem-d-2-5-mm-10-sht-471779701/?asb2=6UPvJ1Qk8o1BhiuSfJVYgX3F26v6WGi9JH5ODi4ejCszCw99I0HStrLw1nwWkXEa
"Заградитель летка нижний пластик 2 элементный 5 шт. цвет синий верх, желтая задвижка",515 ₽,5 отзывов,"15 мая доставит Ozon, продавец Агро63",https://www.ozon.ru/product/zagraditel-letka-nizhniy-plastik-2-elementnyy-5-sht-tsvet-siniy-verh-zheltaya-zadvizhka-206826403/?asb2=-Kd_XQHRSYcBcUjNFy4clAtjQncQPHWj5cn9gPYWvaFmX9B1kaY3w7oJ7-WOm6_x
Клеточка для пчелиной матки пересылочная 100 шт,999 ₽,3 отзыва,"9 мая доставит Ozon, продавец Bee-Box",https://www.ozon.ru/product/kletochka-dlya-pchelinoy-matki-peresylochnaya-100-sht-490474508/?asb2=cLtN3AxlXOopRCO8zSZH7uaFNDsN2svPlZvsi7oYzOmqtFNRprlyhgK_JNSU6gho
Мисочка для маток аналог Никот 100шт.,631 ₽,2 отзыва,"15 мая доставит Ozon, продавец Агро63",https://www.ozon.ru/product/misochka-dlya-matok-analog-nikot-100sht-273170628/?asb2=32rnDj8FhGPQvFjXgxNo8NWZXMKy5fZ3_SPBLt0H_RamxZW2Wr1EE61IItTVLZM_
"Летковый заградитель для ульев круглый 5-ти позиционный, 10 шт.",299 ₽,21 отзыв,"9 мая доставит Ozon, продавец Bee-Box",https://www.ozon.ru/product/letkovyy-zagraditel-dlya-ulev-kruglyy-5-ti-pozitsionnyy-10-sht-242769779/?asb2=n7kVYPyTWo6HVHepey9MMeNRjGV5YJBXT8rokzAKnLEhnVr9GlTyWffeSoao6CLBAIo1rChQqQkLI3P0WULIww
Семена Синяк обыкновенный 1 кг,493 ₽,8 отзывов,"15 мая доставит Ozon, продавец Агро63",https://www.ozon.ru/product/semena-sinyak-obyknovennyy-1-kg-205294893/?asb2=h0CDvvh86xVzBcPiZKHxgVUk4FOw_XuMRUcwFjB49kog38qs7ENVmMl5ePsbbGSP
"Семенной сбор 250 г, смесь собранных и упакованных медоносов способствует привлечению пчел в сезон сбора нектара, служит зеленым удобрением для почвы в вашем саду.",373 ₽,5 отзывов,"15 мая доставит Ozon, продавец Pro Gadget",https://www.ozon.ru/product/semennoy-sbor-250-g-smes-sobrannyh-i-upakovannyh-medonosov-sposobstvuet-privlecheniyu-pchel-v-sezon-249730821/?asb2=5_LsHSmx5QZq-E23y2m_KaL7AhOiFzwIp6kVmP0sMC924TftWP5ml1iqbohvPemnB1aB5pWxnIyeuityYRk5PQ
"1 кг! Канди для подкормки пчел, /углеводный корм/корм для пчел/, 1000г.",308 ₽,159 отзывов,"10 мая доставит Ozon, продавец ДримБи",https://www.ozon.ru/product/1-kg-kandi-dlya-podkormki-pchel-uglevodnyy-korm-korm-dlya-pchel-1000g-246806270/?asb2=7Fhq4f5UJ-sMhWt3MnjWXPSsUgQg3q1xqmqwjGKiP5VqejE2_MVOl-JKkzqVTZmc
Семена фацелии - 2 кг,998 ₽,1 отзыв,"10 мая доставит Ozon, продавец Природа Мёда",https://www.ozon.ru/product/semena-fatselii-2-kg-533502878/?asb2=Q7Cg55TQHB8uLN31TPKxh2zOPgxrIuBVAzBDmFrLeen6KvyAimdKmdmn06Wak9Di
"Проволока пчеловодная стальная для рамок диаметр 0,4 мм 0,25 кг",404 ₽,6 отзывов,"14 мая доставит Ozon, продавец Pole1",https://www.ozon.ru/product/provoloka-pchelovodnaya-stalnaya-dlya-ramok-diametr-0-4-mm-0-25-kg-177336935/?asb2=KBH4A7NS6ZYlCwdbmE41E2UODfHA5XYW5b0qMIixMxMuKj8LZyXvZOlhsnLqc6ak
Проволока для рамок нержавейка (AISI 201) 500 гр,715 ₽,1 отзыв,"8 мая доставит Ozon, продавец Пчеломаркет",https://www.ozon.ru/product/provoloka-dlya-ramok-nerzhaveyka-aisi-201-500-gr-538629902/?asb2=6FOAhf1JDB_jHoTKYeOqsTd8sayUX7g06DRUMIBVn58oqx-OhONv8yhObNuAQ_vl
Поршень для извлечения перги (на пружине),540 ₽,10 отзывов,"9 мая доставит Ozon, продавец Bee-Box",https://www.ozon.ru/product/porshen-dlya-izvlecheniya-pergi-na-pruzhine-248054777/?asb2=dyaIg4V6d2xUPHrrYNClqXIDuTyWRLtze4c8Pm8A-RWssBR1fp2dXQxTBgvQTv0n
Семена донника желтого - 2 кг,472 ₽,4 отзыва,"10 мая доставит Ozon, продавец Природа Мёда",https://www.ozon.ru/product/semena-donnika-zheltogo-2-kg-533454177/?asb2=hMksY8FHSlGjURThphQaZDJhkruNNR0sSUT2YJ6uCsD6fqxu4aGXlK1k3KH7gPIO
"Проволока пчеловодная стальная диаметр 0,5 мм 250г",395 ₽,3 отзыва,"9 мая доставит Ozon, продавец GelandSab",https://www.ozon.ru/product/provoloka-pchelovodnaya-stalnaya-diametr-0-5-mm-250g-520642649/?asb2=od3XUNXNzU2DJhMU656bSkZVqiHDKf1_Fgqr4jUXf9PwnJdzZ_HORDcj2yuqiJ8W
Поилка на банку для пчел ППЧ-2 12шт,700 ₽,3 отзыва,"19 мая доставит Ozon, продавец Пасека России",https://www.ozon.ru/product/poilka-na-banku-dlya-pchel-ppch-2-12sht-442417108/?asb2=tDFKMRxqJjtZLq5cHIZYDiaZEGQhtYrBtqXFYWDeKdtP_O-7INECBGSrxxvxSSYdWpbi2lI0NuezTPcZrbvUCg
Поилка в леток для пчел под бутылку 10шт,682 ₽,4 отзыва,"15 мая доставит Ozon, продавец Агро63",https://www.ozon.ru/product/poilka-v-letok-dlya-pchel-pod-butylku-10sht-205820042/?asb2=hqDQSVuW1KqXNCQzUEqIKY4AyN0kETuPGjA1GA5eXSkiNUosutfTfHhM5Kw49Njj
"Летковый заградитель для ульев круглый 5-ти позиционный, 20 шт.",459 ₽,21 отзыв,"9 мая доставит Ozon, продавец Bee-Box",https://www.ozon.ru/product/letkovyy-zagraditel-dlya-ulev-kruglyy-5-ti-pozitsionnyy-20-sht-442293433/?asb2=3_0hfkNJBInnrS3EBQ0suNeI-qaUmuOgTNhpDoaolvBwRHO6yM0Eif8t_6JrShWl
"Вощина для свечей, набор пчелиного воска Пастельные оттенки, 10 листов",735 ₽,32 отзыва,"Послезавтра доставит Ozon, продавец Дизайн74",https://www.ozon.ru/product/voshchina-dlya-svechey-nabor-pchelinogo-voska-pastelnye-ottenki-10-listov-309706227/?asb2=nGgX07xbzTvNqqkeNLnNpF43YGDoMLRX8ATl0_-1D2-id1ysZf9VORxHtFJVORR68m_ps8-ccUhIMT8g-yawVg
Поилка для пчел 1 шт.,264 ₽,2 отзыва,"9 мая доставит Ozon, продавец GelandSab",https://www.ozon.ru/product/poilka-dlya-pchel-1-sht-521274127/?asb2=NSAfNGLrqtg-Pf7LoRWmyZn3876T2rI_DWspFXjNskOC6EuRSdF0RlRhf0CFNhC0
