"CHIKALAB Комплексная пищевая добавка Готу Кола, 60 капсул",890 ₽,1 отзыв,"Завтра доставит Ozon, продавец Bombbar",https://www.ozon.ru/product/chikalab-kompleksnaya-pishchevaya-dobavka-gotu-kola-60-kapsul-266985557/?asb=oWhAOwnS%252Fsy5dbCOMtpBDryBtkGP%252F2bGc%252FH3EHoPMIfTd8vQgWrX6qEmwXuxEnu7&asb2=FCSbJKCg0H23g9X3wi2dCTk25DQ4qGwTm2lAmcn6vn3iylucYeGvDih5Rrdi3GR8PCXOrIKPhTrsT66067ahHMj8Sdvn8rCd6GhuoOHEWr-acZYqcSfOceqQLbNmgMOsJyd--UV4z1fCRiPjyMN4gQ
"Восстановление SCIENCE IN SPORT (SiS) REGO Rapid Recovery 1 пакетик, Клубника",305 ₽,4 отзыва,"7 мая доставит Ozon, продавец GoSport.shop",https://www.ozon.ru/product/vosstanovlenie-science-in-sport-sis-rego-rapid-recovery-1-paketik-klubnika-406267770/?asb=I5t78oCaiACmkKIXt0lLEmJBEmNU85IsafvPi7h5F%252BM%253D&asb2=vEu54wtGv7G-YM1JpaVpzg-8kyv-11v_bjYwPlFRW7xIXCmUgzKSCcX7G45DkpFV
BCAA Энерджи Be Steel Nutrition BCAA Energy Powder 200г (яблоко),799 ₽,1 отзыв,"Завтра доставит Ozon, продавец HealthStore",https://www.ozon.ru/product/bcaa-enerdzhi-be-steel-nutrition-bcaa-energy-powder-200g-yabloko-247679348/?asb=8%252FpHC6A2p%252FQcYuew4IvG9bbIGwIlYhlZYIMfWBPKINM%253D&asb2=R8_RpUwCJrpwrsxdxQY0Do5IZeE417sGXSTjazAjwnOwIeQNq2wtdf3pwdrYnHi7
КОФЕИНОВАЯ ВОДА НАПИТОК СЛАБОГАЗИРОВАННЫЙ FITNESS FOOD FACTORY CAFFEINE WATER вкус ЛЕМОНГРАСС 8шт по 500мл,699 ₽,1 отзыв,"Завтра доставит Ozon, продавец Напитки для спорта",https://www.ozon.ru/product/kofeinovaya-voda-napitok-slabogazirovannyy-fitness-food-factory-caffeine-water-vkus-lemongrass-8sht-397435465/?asb=xwVPSK7vRHv2PokdqWxQjdp8OvqP6nOw5s0QIK15LZQ%253D&asb2=1ZZ7705tPBf9NXubECaauxsxOpC63wVuZV5-MQkctqB88yA5dCsRItLZeGO_40Hd
КОФЕИНОВАЯ ВОДА НАПИТОК СЛАБОГАЗИРОВАННЫЙ FITNESS FOOD FACTORY CAFFEINE WATER вкус ВИШНЯ-ПЕРСИК 8шт по 500мл,699 ₽,1 отзыв,"Завтра доставит Ozon, продавец Напитки для спорта",https://www.ozon.ru/product/kofeinovaya-voda-napitok-slabogazirovannyy-fitness-food-factory-caffeine-water-vkus-vishnya-397499416/?asb=K5k3ITkNeJ417Xs0QQnIndfefm3ShUkwTNsfxYH6vw0%253D&asb2=uRH3GQzvhO6dVrWy-Jbk3Kj9KzXGpnhl1ulMfGwD_XS8zOCu3pzJPO6XMJMEk763
"Комплексная пищевая добавка CHIKALAB ""Виноградных косточек экстракт"", 60 капсул",932 ₽,3 отзыва,"Завтра доставит Ozon, продавец Bombbar",https://www.ozon.ru/product/kompleksnaya-pishchevaya-dobavka-chikalab-vinogradnyh-kostochek-ekstrakt-60-kapsul-242375487/?asb=%252BueG%252BqZMgnd1qmBYcDER6p3UZsJElV2dPNrnxrDBq5RhH7gncSu51U5f9qUMMwsS&asb2=9iJE8EpRwzt4aQrg2VjFz-VF0xYD3fdQMVEa2Dl6CuMwhmhfs-p8iP5O7uj9qSGheKmw4cmdsGrLerDgz4zEsULFGhMvJvCrBPN6g26m-ue5l4Pzw_Lm3ZEjJmWjejq3wBlXsBgw6ZHbQd5-ZI2LAw
"SiS Напиток восстановительный углеводно-белковый в порошке REGO Rapid Recovery, 3х50г (Шоколад) Протеин, Изотоник",857 ₽,19 отзывов,"7 мая доставит Ozon, продавец BESTFIT",https://www.ozon.ru/product/sis-napitok-vosstanovitelnyy-uglevodno-belkovyy-v-poroshke-rego-rapid-recovery-3h50g-shokolad-550160782/?asb=NYkJ8eAawnYs9On26V7AZospy2EaB308mO7lCwM4%252FO0%253D&asb2=6MHN_173f1uKYSIiBKk8Ipo0Hx4X4HAnUiAoOfty5bqrZbR1_VfQfvpwQFMMEBW2
"Комплексная пищевая добавка ""ДМАЭ"" 60 капсул CHIKALAB",890 ₽,4 отзыва,"Завтра доставит Ozon, продавец Bombbar",https://www.ozon.ru/product/kompleksnaya-pishchevaya-dobavka-dmae-60-kapsul-chikalab-244181684/?asb=U00QvU8RKJbh2YXq9iasNbQopxwJWl73JtMMsMP9S0JuVIAwv1HkMGeILiqC7dl5&asb2=TBqeLVxjOVjCrOh6j8xpfYNNeX-QuNdePXJSPSyphyKOOtomiOHFl_-GMZzbOUyNtHbmfdtZf_9-pGdcd_UTA39aAy2FzHw-hvKKlGDHVgFmAmpsFWGeaNCImsoCrMsPkMGblPuDPJvAZ79SkHZHUw
L-Citrulline Malate / Цитруллин малат 100 гр,656 ₽,8 отзывов,"8 мая доставит Ozon, продавец Protein66",https://www.ozon.ru/product/l-citrulline-malate-tsitrullin-malat-100-gr-328125971/?asb=L1N73WBLddXtCs0F7dFD4Q5wVKixLdHXWoEfZmA9oDU%253D&asb2=6c0POc0Axc6F8dhJGs5qn9Z9R7_grzXvL0wFMqkaAWHOQULoDSKDIl3b6CJFbZrV
"SiS Напиток восстановительный углеводно-белковый в порошке REGO Rapid Recovery, 3х50г (Банан) Протеин, Изотоник",857 ₽,19 отзывов,"7 мая доставит Ozon, продавец BESTFIT",https://www.ozon.ru/product/sis-napitok-vosstanovitelnyy-uglevodno-belkovyy-v-poroshke-rego-rapid-recovery-3h50g-banan-550165033/?asb=PR129iXBOvbCLp1DyKhB0q1Xf55oSlSKkc6TXW2xnHs%253D&asb2=NXPvkPleQYNfwMnWrth8q-SAl7o7Hjap8lVQLwzLzhaQ-g5wbM9a7EF9HfEiWaXm
"Набор 4 шт Предтренировочный комплекс Floo Sport Pre Workout Complex Fruit Mix, 60 мл",417 ₽,12 отзывов,"Послезавтра доставит Ozon, продавец МЮЛЕБАР РУС",https://www.ozon.ru/product/nabor-4-sht-predtrenirovochnyy-kompleks-floo-sport-pre-workout-complex-fruit-mix-60-ml-198213310/?asb=zmLUmVD4uF%252BVRlhGwVnWO%252FVjtZhxbNgnYG5WERyQdEU%253D&asb2=BybtTNmBFpOBMWhCKOptA9iy1-vRaPUbr4DrHLDdRlFm4bGNuOM1T1PBqyIIkxHl
"L-Citrulline Malate / Цитруллин малат со вкусом ""Апельсин"" 100 гр",681 ₽,8 отзывов,"8 мая доставит Ozon, продавец Protein66",https://www.ozon.ru/product/l-citrulline-malate-tsitrullin-malat-so-vkusom-apelsin-100-gr-390458586/?asb=mIFkeJyi1JYURu8w2jNFVfBU95LJ3H8My4i8cYC5QiE%253D&asb2=v9vEZ3H0L-vONwmX89vcTPN40rXEdnG11xI6acuDj2u2ZnScdZLhBxlbcQZVjIHs
Торт / Пирожное / Чизкейк / Лимон / Без сахара / Десерт / Протеин / 51% белка / Спортпит,331 ₽,1 отзыв,"8 мая доставит Ozon, продавец Tartufi_Фестиваль итальянского трюфеля",https://www.ozon.ru/product/tort-pirozhnoe-chizkeyk-limon-bez-sahara-desert-protein-51-belka-sportpit-307908969/?asb=skER3zHilC0SaMqEd4t2GCz71RAzlNBeRE3L7%252F3f7GWMnCYmtsmXmtmopHxhbsMi&asb2=iWyxdRj4snTRYim8lHY0gnLG7RtZE-oua9NSJx9S81krd1HYHCMlCVOPB8U-KiXULhq_udRljt_lzyuPD47qvN3hpvU106nmQGiDAfoa9cwHFPE--lwlGHbRWDgKcyOqogXc0ED1DT3ZspQ_PIgp5Q
Предтренировочный комплекс с кофеином для спорта женщин и мужчин Pre Workout complex 5 шт флакон 60 ml фрукт пунш,750 ₽,1 отзыв,"7 мая доставит Ozon, продавец Space Nutrition",https://www.ozon.ru/product/predtrenirovochnyy-kompleks-s-kofeinom-dlya-sporta-zhenshchin-i-muzhchin-pre-workout-complex-5-469157668/?asb=rIs7ZXMVLf6PAAlnuBSxPcj50VsQs%252F8s2qJqMjZUh1c%253D&asb2=DrObhs80eS3JwYHCORGnQrOtqH5YxwxAtCyfTvRjxngxPGC7uBiuFUV6WEH_CMwq
Предтренировочный комплекс с кофеином для спорта женщин и мужчин Pre Workout complex флакон 60 ml цитрус,750 ₽,1 отзыв,"7 мая доставит Ozon, продавец Space Nutrition",https://www.ozon.ru/product/predtrenirovochnyy-kompleks-s-kofeinom-dlya-sporta-zhenshchin-i-muzhchin-pre-workout-complex-469171351/?asb=wiikfXzWb3v0PP8rgPRlJIkRoMzU%252BIV%252F6kc%252FNsEVJUY%253D&asb2=-FCgvNJoPEYHF3MleA4g4UHSzqqglhQL3jrDTmFpNncpJVy5y59XIR8nB_0oyOQ2
