"Аминокислотный изотонический и предтренировочный комплекс ProDOZA: BCAA, цитруллин малат, Бета-аланин, 6пак. по 40г.",620 ₽,65 отзывов,"Завтра доставит Ozon, продавец ProDOZA",https://www.ozon.ru/product/aminokislotnyy-izotonicheskiy-i-predtrenirovochnyy-kompleks-prodoza-bcaa-tsitrullin-malat-beta-246912597/?advert=EgEq5YOZiAbapVZpo4QUM9cxvAJtObYTbZiXxPtmeY3kifhAZITKEEsU5ZUNgSd6ZfMF2Umdj_PR5_DjyWIsxH3GeXqPPGdhi50nk0emGCycK9EwBNNhk0-0CHLTdzXcEjzcsrNGJS98Uf-EoonjyEWCg8KSZcWSo1GwFZRjheJVrysC_-JaDjMLsNIYSoBBjpdDxQ2iWk7rYkZyXpMd46WeYLnkWJUPcgmbBxFGdlVI96Eo-ko3YytLjpASBr6BmRQ4sykNzbuXbOgNEC6pNCxQ9BPc1sQn97_K9MCtD29UDNRPXd99vsZ7B1NorKrxkxUoP8yObAil02wrHvtgmGM67pDAG81ZoGryT1sLI858DEPb8SL5NAfWz1hBsLAsMhYyPF23l_nw0gGIVZ8Q5Ae0ZsUXOw65SlV9fwjWli6r8t8xOtRByPSMaNhjV8Y5Cyk0sproQSggEmxBJHobDuHaDdrz5ofKwuIAvHDnO4RyUSgBdp6KzFruH-iHQIfmDsyGmGcQmDgz8VPkI6159kCeFG5iMGznXrFyIwuO7lc2FX5grDABrH0E93WBe19o
"Предтренировочный комплекс PRIMEKRAFT PRE-WORKOUT BOOST со вкусом ""Яблоко"" 300 гр / Аминокислоты",949 ₽,101 отзыв,"Завтра доставит Ozon, продавец PRIMEKRAFT",https://www.ozon.ru/product/predtrenirovochnyy-kompleks-primekraft-pre-workout-boost-so-vkusom-yabloko-300-gr-aminokisloty-523275665/?asb=RK9RBfljIAfkYTP55UJW0hHOYEM2i0Z%252Bm3AnuzuRPJc%253D&asb2=U7USHUmoITeRfKM2fCw0RPq-owdL8n0Ci-SturZ-gZygBaS9mRDBNhSonDcNN_7_
"Solvie / Протеиновое печенье/АССОРТИ/35% белка/без сахара/низкокалорийное/спортивное печенье/4 вкуса/8шт ( малиновый чизкейк, розовое мороженное, соленая карамель-арахис, мокка-латте)",720 ₽,27 отзывов,"Завтра доставит Ozon, продавец Solvie",https://www.ozon.ru/product/solvie-proteinovoe-pechene-assorti-35-belka-bez-sahara-nizkokaloriynoe-sportivnoe-pechene-4-vkusa-547742357/?asb=RAeNI0HxisWA4EhNOlq28tV7BGsul%252BD5cJYCj3xmOVQ%253D&asb2=XaHsQZ41TAI064Cd_MDmTuGWYQBWT-Mlna18Z81-7kPm1h6xe7y4P_itgDjRM5Rc
"Предтренировочный комплекс PRIMEKRAFT PRE-WORKOUT BOOST со вкусом ""Кола"" 300 гр / Аминокислоты",949 ₽,101 отзыв,"Завтра доставит Ozon, продавец PRIMEKRAFT",https://www.ozon.ru/product/predtrenirovochnyy-kompleks-primekraft-pre-workout-boost-so-vkusom-kola-300-gr-aminokisloty-523216110/?asb=QhoWfhPtdhOmQ8SgIORDg80fmstMfU8WtT1cmKbGg1I%253D&asb2=Szr-9QyStp6lGxf2RRz_ur3I7XbVw7aRsPTZAFCZFCwsp4cTOWIqZuUzdaGxS6zF
"Предтренировочный комплекс PRIMEKRAFT PRE-WORKOUT BOOST со вкусом ""Ананас"" 300 гр / Аминокислоты",949 ₽,101 отзыв,"Завтра доставит Ozon, продавец PRIMEKRAFT",https://www.ozon.ru/product/predtrenirovochnyy-kompleks-primekraft-pre-workout-boost-so-vkusom-ananas-300-gr-aminokisloty-523200822/?asb=7furWXCKVgbGHMTSmFcQZbUM7KEwpN2fv%252BS%252BYrfbT6E%253D&asb2=qGGg1HyDv3w1EvFkfniLMhqPrfXjsmW-9oSXeAkYH0fIpgJhvRCS0O4YU6ftPX96
Предтренировочный комплекс BiotechUSA Nitrox Therapy 17 г голубой виноград,169 ₽,170 отзывов,"Завтра доставит Ozon, продавец BioTechUSA",https://www.ozon.ru/product/predtrenirovochnyy-kompleks-biotechusa-nitrox-therapy-17-g-goluboy-vinograd-304572461/?asb=Q9PYSLPTm64zYubyVlfu0z%252BUdjAq0RI2UUy7Vajz2eg%253D&asb2=NnZuWAa1NsHQWlVeqJM-7RGZfthJoyPu9LGcR6fsNovQvC2FOHuLV3c9ZbD_4VNW
"Цитрулин малат, Цитруллин капсулы , Аминокислота Цитруллин , Сitrulline malate , L-Citrulline , Сitruline , Для набора массы , Памп и энергия , Смесь сухая для приготовления напитка Цитруллин малат , 4Me Nutrition , 120 капсул",790 ₽,88 отзывов,"Завтра доставит Ozon, продавец ИП Бурганов В.А.",https://www.ozon.ru/product/tsitrulin-malat-tsitrullin-kapsuly-aminokislota-tsitrullin-sitrulline-malate-l-citrulline-292410761/?asb=EEciTivdjOgyL95ILwWAnVbmChmXhFwzFsJ98BShC4sEwJFdQa%252FtlpaHmJiOfsmE&asb2=j6aimBMVhOUEZ5HBR7uAxBtmgIgHaY1V-nocKa1Zaz070TMBMHYx8gRV9BMJOvYlUkc81xGDef2meo2svnQn5DwFt1JWiZj8vQq7YJ0Llmq9QeloNvXa4h5Bm-ZZJDC5DnQOKIOLDtvhMeeDHpzAbw
"Детокс протеиновый коктейль смузи для похудения Иван-поле Immunobooster растительный без сахара, веган, 300г",484 ₽,17 отзывов,"Завтра доставит Ozon, продавец ООО «Иван-поле»",https://www.ozon.ru/product/detoks-proteinovyy-kokteyl-smuzi-dlya-pohudeniya-ivan-pole-immunobooster-rastitelnyy-bez-sahara-438001618/?asb=ek6RuHfSPChwSl7X2FYErq7VVmwSFf4IDfKyTxcV8rI%253D&asb2=k71kuVq0pJ4Hc8SSYVmb7E5UGnH3jMIsbuxV2XhG0KD--aeCNynZn-ExR4Zl_sqE
DMAE 350 mg / ДМАЭ диметиламиноэтанол / 90 капсул,599 ₽,191 отзыв,"Послезавтра доставит Ozon, продавец PROTEIN.COMPANY",https://www.ozon.ru/product/dmae-350-mg-dmae-dimetilaminoetanol-90-kapsul-177808052/?asb=kOgVSmmGdMWJoz4P%252FkDmlprBHErNObVWlQl3sJ8uqvlbq5CWJw91m%252Fs9i6cTe6cV&asb2=Xz7DvxB4jCUYPAFLf25k2wt4jInkwVjFVpg5jSSoVVGqBoyCNTTNNXKBcsEDoIMGXxOZGhag1zsFlvlMxHhJD1J_lcdcidirIlgAt_C3I1IbuB9Iv_j4-SMAhNqUbHud9xc71MPV14Jg4p8wJwD2Xg
"Изолят сывороточный, 200г",466 ₽,45 отзывов,"Послезавтра доставит Ozon, продавец Мечта",https://www.ozon.ru/product/izolyat-syvorotochnyy-200g-322889602/?asb=iUH2ZPISMrg1wfQR9nym4tUZipvD9GkNPWhxejcn5P%252BBoUubAr6Ry%252FhpgEXHw77e&asb2=RD3nLnPEmC7mfdOzzKHxvI0PrG4kzZIGMQyzi8xQQ1GFLx4JyOm3Kio0AErMcJIaEbRLQjTKL5H9lllzbQ3I6sNdK8OZswqFy0zyt9EFUfkuqJyoNmW2AmaWp6S2NBxOajZaqVgfacX7IuPe7t6zUQ
"Функциональный коктейль ""YEDA"" 200г. (Кокос - Банан)",630 ₽,17 отзывов,"Послезавтра доставит Ozon, продавец YeDa",https://www.ozon.ru/product/funktsionalnyy-kokteyl-yeda-200g-kokos-banan-437733530/?asb=xYgrt0JD6gEkfg%252B8JZ9SFW6qXx%252FC%252FY%252FFehKEN2KcV0ZqFoxokKN3m84%252FQxI9XL8u&asb2=Dnm2t4kRI5B6I6oQVXns_Z2lllNbi1PULpn4ouADT-a6XgdVH0fG7s7u_22OvoSXy3-atDSjEh2GKVPFvGXfO9vc-mVP782kiy1laVF9h9p1E5pVhzryue99D_ZJ4klXKkDodnUwXPXLyfBaIlqVmg
"Цитрулин малат, Цитруллин капсулы , Аминокислота Цитруллин , Сitrulline malate , L-Citrulline , Сitruline , Для набора массы , Памп и энергия , Смесь сухая для приготовления напитка Цитруллин малат , 4Me Nutrition , 60 капсул",540 ₽,88 отзывов,"Завтра доставит Ozon, продавец ИП Бурганов В.А.",https://www.ozon.ru/product/tsitrulin-malat-tsitrullin-kapsuly-aminokislota-tsitrullin-sitrulline-malate-l-citrulline-292252528/?asb=kopOdfL%252BqHS4lYXThl7DIzoWSOawHnArtiOvGr6gRzWGw0QkzUG0J2wRBemn3BnQ&asb2=k4Xp_xsiLoWVu7g5o1MRZaIN9YoRnfShB8I8wFGNEA7aXvTGG_iUNkVl51d8-QqjibYFyHuFgXkiei2RCnrt-Ob3tfxX03dKy9AT8ihfKfvddHx_TbMthVrsn7vkFN735IYS40Oct6i--_tCtrqVrg
Предтренировочный комплекс BiotechUSA Black Blood NOX+ 19 г тропические фрукты,199 ₽,55 отзывов,"Завтра доставит Ozon, продавец BioTechUSA",https://www.ozon.ru/product/predtrenirovochnyy-kompleks-biotechusa-black-blood-nox-19-g-tropicheskie-frukty-304182861/?asb=G9BwHysk5ROJxch0JKFKZ1AFN1w2EeeV3LIKCht0nIw%253D&asb2=MnqS17Qe2HGFqQMnkt5-hb-BWQuO-C_49TRGf32_6J7CsXtT8WTuViQ7i2hGDQ0_
"Коктейль заменитель еды для похудения Digital Meal 1 бутылка 0,5 л (вкус: завтрак с кофе). Заменитель пищи в порошке сойлент (Soylent). Порошковая еда, суперфуд, superfood.",318 ₽,13 отзывов,"Завтра доставит Ozon, продавец Digital Meal",https://www.ozon.ru/product/kokteyl-zamenitel-edy-dlya-pohudeniya-digital-meal-1-butylka-0-5-l-vkus-zavtrak-s-kofe-405962825/?asb=4bwwd%252BAVsO4QwOFRS4DG7PgKlbRRaPdFdp6bTzuNQmiFCJNjGxBDa1XcMVGlZBg%252B&asb2=4zluKCFsVd_7zOu3A9fi3XBr1BmefaTwixU8XXGUeYHmCO3EnMEgbJXge87X0ehBX33fk3VGjQS8DCgDDgg97-Kck5Jnjok73ehm3x97_djOrvhNDzaa5l-RKfkO85bd94wI1aGc_-2LxzImd_opQg
"Функциональный коктейль ""YEDA"" 200г. (Кокос - Банан - Шоколад)",630 ₽,12 отзывов,"Послезавтра доставит Ozon, продавец YeDa",https://www.ozon.ru/product/funktsionalnyy-kokteyl-yeda-200g-kokos-banan-shokolad-438156012/?asb=RvCNZS0T2tqovdtf3egeKfQeFFmAwd0LLpT91LQUzADcafPvML%252FXB51tByFhvDF3&asb2=dTtDFAPEdMHbc2wiXPQDrTeieMe74qmXY1K0zo7aZEAlJJXSqnq3jI5Dz9F2AQK8X0nLQPbwMYTqx4HmmlY7nKtAfLGma-E2Yhvhq_ilnv9nK5H0jjx_y2vz4Ic-0sApIeMC-dIAfrkbFHkmsH0cKg
Предтренировочный комплекс BiotechUSA Black Blood NOX+ 19 г черника-лайм,199 ₽,55 отзывов,"Завтра доставит Ozon, продавец BioTechUSA",https://www.ozon.ru/product/predtrenirovochnyy-kompleks-biotechusa-black-blood-nox-19-g-chernika-laym-304570397/?asb=mT30TffN1pRhx9TTIp%252F7UMk6%252FMozceSPK9oHpYbK7Ts%253D&asb2=5TCDJNSaL_6UJAXi4oszAEUvYOPHH4KX2MI6eSw8baTJHhV-RtzzaSQ-6OB143MC
Паста шоколадная без сахара / Для похудения / Ореховая / Фундук / Протеиновая / ЗОЖ,250 ₽,32 отзыва,"8 мая доставит Ozon, продавец Tartufi_Фестиваль итальянского трюфеля",https://www.ozon.ru/product/pasta-shokoladnaya-bez-sahara-dlya-pohudeniya-orehovaya-funduk-proteinovaya-zozh-289981785/?asb=iPuUs7AyBp94pOjzUX1NgszZhlEcrudpBBuvhRvY3HoxuJPsR68pP4Zcw763eMCV&asb2=E8qKhYXIHgw6siKt-laeRBUz9rzcv-ZAddsE-xljXZ1b3278otluoFSt8HKaRL0DWgrphSiyHRfZY-3OSPz03K9mpF_G1hyhHuITLep9Yxjam4MlTIa9gkh0jyJedAFDUvAQ3U8fcIF0hM7Cga3iKA
Предтренировочный комплекс BiotechUSA Black Blood CAF+ 10 г черника,199 ₽,37 отзывов,"Завтра доставит Ozon, продавец BioTechUSA",https://www.ozon.ru/product/predtrenirovochnyy-kompleks-biotechusa-black-blood-caf-10-g-chernika-304143313/?asb=BGxRwI5PjauUYvDtFfXhyqb6e8Vso3T8p3oDUh5Xmmw%253D&asb2=5AJwrGA8JhJ95o2eRP9EMzCE0px8caRPJkS9stWFddUpK5UGC8iGjicLYtez_P2c
"Функциональный коктейль ""YEDA"" 200г. (Кокос - Ваниль)",630 ₽,11 отзывов,"Послезавтра доставит Ozon, продавец YeDa",https://www.ozon.ru/product/funktsionalnyy-kokteyl-yeda-200g-kokos-vanil-437955435/?asb=9QkLTd46Td3uMeuss2z8yvqqBLvL7z4vLQcMmvxE1nK6cptl3LTTIEIpjxWi8hUs&asb2=FDnO8QimRGsgXMKfltHtmgPj_fBgVf-45XfdEZW5mAw8nAHqI-rXg0VTCKFu2dgWTU8MddXemn8XYXau4QunDfg-mXO8g5O9K4KgbIGgw1xYJVa8NUfRhw3lYwyKsJCZ7fjejBRbBXYCNqq-Tn1dYQ
Предтренировочный комплекс Upgrage Апгрейдж энергетик со вкусом ваниль 100 грамм Geneticlab Nutrition Генетиклаб,814 ₽,45 отзывов,"Завтра доставит Ozon, продавец Geneticlab Nutrition",https://www.ozon.ru/product/predtrenirovochnyy-kompleks-upgrage-apgreydzh-energetik-so-vkusom-vanil-100-gramm-geneticlab-199586471/?asb=6vfiKGzhI%252BDrEbaQqQzpezbLraUpO7IR4%252FSuOiu8EO8WDKQc%252F43cD8rfNd7g8NNG&asb2=EhD-XCnZZiSWeSWnjhCiIJGFlkPLQ5mLR4_tMUliUY5igaxoXHqzYAWAOAyDKvzt8fVj4V7icmmfylNwImNxuj3--RVPh-dCEErQo6QJnbrSu1Ehvl1Fnq0NGBvlqIdPlNnfMgb-P6S9Y6v_zRwZBQ
Предтренировочный комплекс BiotechUSA Nitrox Therapy 17 г грейпфрут,169 ₽,170 отзывов,"Завтра доставит Ozon, продавец BioTechUSA",https://www.ozon.ru/product/predtrenirovochnyy-kompleks-biotechusa-nitrox-therapy-17-g-greypfrut-372731269/?asb=G1WGzh3XRw7daAwBALS4OJxnkK0MMSERAfBl1HMYk%252Bo%253D&asb2=wbVLcI7Ly8Ck5JttrFqCd7oJ56p82UcTKWBHLPuEgbGQ5KEIcR-YzYR8JAdlcwgm
Предтренировочный комплекс BiotechUSA Nitrox Therapy 17 г персик,169 ₽,170 отзывов,"Завтра доставит Ozon, продавец BioTechUSA",https://www.ozon.ru/product/predtrenirovochnyy-kompleks-biotechusa-nitrox-therapy-17-g-persik-304184495/?asb=DXLN7p%252BxNCUc8eYap3figCiMCbXj6yVDv9UcdkRRaQU%253D&asb2=I1kJxDkhevQdpxzt1mEWnpVsZ1Z0O0HMp38hwpKxE1aWue7XD4sbJJ1ljAs8Evio
"Восстановление SCIENCE IN SPORT (SiS) REGO Rapid Recovery 1 пакетик, Банан",240 ₽,4 отзыва,"7 мая доставит Ozon, продавец GoSport.shop",https://www.ozon.ru/product/vosstanovlenie-science-in-sport-sis-rego-rapid-recovery-1-paketik-banan-406267833/?asb=yfp09%252BrsiCD9ex0dNhP3tQeV6gsE2kQWHN4TQ5nASfI%253D&asb2=zLIjCOYSgBRyzqvjFibvO1oaklRfSFbs2dxgI29xqVpR1_VM1tJCw9jS2IXawoUA
Предтренировочный комплекс BiotechUSA Black Blood NOX+ 19 г красный апельсин,199 ₽,55 отзывов,"Завтра доставит Ozon, продавец BioTechUSA",https://www.ozon.ru/product/predtrenirovochnyy-kompleks-biotechusa-black-blood-nox-19-g-krasnyy-apelsin-343468957/?asb=sS7lU6bSoxwGsNfPnyz2RI8qFdrhoUnALLgzMtHto6Y%253D&asb2=3gCzTw-m_yilWl8Y5pvd2BqQ172Lkm6vsRBs69sf01ce1kLXjabXKVXYmteX291P
"Коктейль заменитель еды для пoхудения Digital Meal 1 бутылка 0,5 л (вкус: ваниль). Заменитель пищи в порошке сойлент (Soylent). Порошковая еда, суперфуд, superfood.",301 ₽,13 отзывов,"7 мая доставит Ozon, продавец Digital Meal",https://www.ozon.ru/product/kokteyl-zamenitel-edy-dlya-pohudeniya-digital-meal-1-butylka-0-5-l-vkus-vanil-zamenitel-pishchi-406017642/?asb=rWjnq2TSzZqaVrf3LWh5HjVjwYpRqZo9u8Ldh2CZGG0%253D&asb2=N1tKvQ278Mredr2TmMe9Is5WN_J5Pj60PPfb9AAUyHCWZojWToVT1IExnm2aazsd
"Предтренировочный комплекс Binasport ""Preworkout Advanced Pro"" (c кофеином) порошок 200 г со вкусом арбуза",692 ₽,152 отзыва,"7 мая доставит Ozon, продавец BINASPORT",https://www.ozon.ru/product/predtrenirovochnyy-kompleks-binasport-preworkout-advanced-pro-c-kofeinom-poroshok-200-g-so-187086473/?asb=lJHcOnNszUYU10Py1%252B7uUOlqNpIPffUjaaJ3ShpGYBk%253D&asb2=6BkgGTZraz2QFlt2a35--lQG6kFsl-qjcyCeEf5NGisiB6CAq7o_2_XkKc_Dh71F
"NaturalSupp / биологически активная добавка к пище ""Гуарана 700 мг Naturalsupp"" (""Guarana 700 mg Naturalsupp"") (капсулы по 700 мг)",730 ₽,29 отзывов,"Завтра доставит Ozon, продавец Naturalsupp",https://www.ozon.ru/product/guarana-ekstrakt-guarany-60-kapsul-151981486/?asb=OL%252BSZ%252Fvl0YMpOsjm8U5efG5fUoJ44YKf2kvv78gsTkw%253D&asb2=sjcIP24hteVwlEaegOAO3leBa4UxOUlvzZ8ErY2ZnV0s15dW9APX-JPVtpVT0g7g
Паста шоколадная без сахара / Для похудения / Протеиновая / ЗОЖ / Спортивное питание,259 ₽,33 отзыва,"8 мая доставит Ozon, продавец Tartufi_Фестиваль итальянского трюфеля",https://www.ozon.ru/product/pasta-shokoladnaya-bez-sahara-dlya-pohudeniya-proteinovaya-zozh-sportivnoe-pitanie-289980944/?asb=eMWEMYvne8Cv64hcuYnTLdBqB6hkxigRL6antYL6eQby%252Bq2U3Bwc20ziE7qakxBu&asb2=JVUC9KHHfhC-zQ-y4BwFRNCt-UBu0Ui707ePk44Oe3bBngqVfZGIMv_nvWJ1euTxs2dvf7h04wCeyHVnbNvHM45BZ4eZ83JooRclocy-dCpuDEapvV6c8bfmowxoBxnkhj1W6n6iiaRWT3BKKTQE_w
"Комплексная пищевая добавка CHIKALAB ""Токоферол комплекс Витамин Е"" 60 капсул/ Витамин Е для красоты, иммунитет, антиоксидант",827 ₽,4 отзыва,"Завтра доставит Ozon, продавец Bombbar",https://www.ozon.ru/product/kompleksnaya-pishchevaya-dobavka-chikalab-tokoferol-kompleks-vitamin-e-60-kapsul-vitamin-e-242394535/?asb=mXs5zvzgAnLvAZ15fCPFm5gm%252Fbf0B67Z4n83QJMRfkdMhadizck6L92gghG3Z84P&asb2=6Sw4j00G62ZTL_vAR0PR94ggFdzW36q5wvCydChFlU3ZHzDuZdp513nWOgHo0wH_XH9Jy-Whs1_sBk-K8mzplvdjl0Pd7R6qxCAhxmFDFLAl7BJqixQwDVKHQz8ZskdO5nslEH1DvywN422uQt-q7Q
"Предтренировочный комплекс Binasport ""Preworkout Advanced Pro caffeine free"" (без кофеина) порошок 200 г со вкусом арбуза",692 ₽,152 отзыва,"7 мая доставит Ozon, продавец BINASPORT",https://www.ozon.ru/product/predtrenirovochnyy-kompleks-binasport-preworkout-advanced-pro-caffeine-free-bez-kofeina-poroshok-200-187086628/?asb=IWO9Ux4fknKkNtuQ3ayPhMv3dNBdvseL4fc1taELbAA%253D&asb2=4gpvU-XbQAMHpzfOhkQOSxO3nqpUZgjTSSYVjXnV90B1yqMd91icRthMSl_qviy6
Детокс программа Detox Organic Woman Active. Очищающий комплекс на 40 дней. 80 порций.,940 ₽,25 отзывов,"Послезавтра доставит Ozon, продавец Boaa organic",https://www.ozon.ru/product/detoks-programma-detox-organic-woman-active-ochishchayushchiy-kompleks-na-40-dney-80-portsiy-320386656/?asb=9p4XmfDHh%252FIpmGDhs0bb9oJCZfFNREaRrjS0zQSo660%253D&asb2=JkMTEMN75q1LQIpTDxoRUMqrESLQWLlBeQBPZK9aLJ1g0ZUVJbbF650kXOzOI-mH
DETOX Formula Очищение Печени. Программа для очищения на 40 дней. Кишечник / ЖКТ/ Похудение.,940 ₽,16 отзывов,"Послезавтра доставит Ozon, продавец Boaa organic",https://www.ozon.ru/product/detox-formula-ochishchenie-pecheni-programma-dlya-ochishcheniya-na-40-dney-kishechnik-zhkt-pohudenie-320611216/?asb=FzLtXteMV0bYRoUhRoUCdoXAVcO768xo13FGhJ2tDXo%253D&asb2=sFs2-5BVn8aplr3kgj4H3dh7fzaZdgxYo-t9jR-6IDh0mWUJ1PJqQJvnZsVcDlNw
Паста шоколадная без сахара / Для похудения / Шоколад / Бисквит / протеиновая / ЗОЖ,233 ₽,33 отзыва,"8 мая доставит Ozon, продавец Tartufi_Фестиваль итальянского трюфеля",https://www.ozon.ru/product/pasta-shokoladnaya-bez-sahara-dlya-pohudeniya-shokolad-biskvit-proteinovaya-zozh-289980919/?asb=cbtSEuithLjTFV5yTCyhH8%252BJSPFKB71hRS4UVzA4Lo09bed5tfnCDAVw43tpL%252BvT&asb2=WvaGVGcnm6LOPsGQaaqok-CEXH3jz5X8P0TrcutEIq-dYjRjPWPDRKWXZnbkcawAjBLFMdcj7Yw97B6A4dSoq1Uyz8lZ_SQtoL4CXDfsCIeMrJLhTa9GWPu_Od44vKZdxsda56VoBQJpOkfDhFcBFA
"Предтренировочный комплекс Binasport ""Preworkout Advanced Pro"" (c кофеином) порошок 200 г со вкусом ананаса",692 ₽,152 отзыва,"7 мая доставит Ozon, продавец BINASPORT",https://www.ozon.ru/product/predtrenirovochnyy-kompleks-binasport-preworkout-advanced-pro-c-kofeinom-poroshok-200-g-so-187086626/?asb=mY%252F2jm24bi%252FsOjuojJ1mxhvcDgud6lqEFWEYZD8%252BH%252Bk%253D&asb2=QRIR3ytnOeeIHBOwJa-zfr3uHWResXJr7X2IYEMngPWhbLkBq016jLTqs1-n1_fL
"Восстановление SCIENCE IN SPORT (SiS) REGO Rapid Recovery 1 пакетик, Шоколад",240 ₽,4 отзыва,"7 мая доставит Ozon, продавец GoSport.shop",https://www.ozon.ru/product/vosstanovlenie-science-in-sport-sis-rego-rapid-recovery-1-paketik-shokolad-406268780/?asb=OVLGkPf8rqoFIGJoU1C82XFZnqasDbtOarMTs84He2Y%253D&asb2=T1HENRpxmMTjtUGfcw6Lljv7dsIm2tZLMtD9dntFLKTV5wAwX-5xPpNDZN-vovMW
КОФЕИНОВАЯ ВОДА НАПИТОК СЛАБОГАЗИРОВАННЫЙ FITNESS FOOD FACTORY CAFFEINE WATER вкус МОХИТО 8шт по 500мл,699 ₽,1 отзыв,"Завтра доставит Ozon, продавец Напитки для спорта",https://www.ozon.ru/product/kofeinovaya-voda-napitok-slabogazirovannyy-fitness-food-factory-caffeine-water-vkus-mohito-8sht-396935879/?asb=I0%252FONKr%252FJoE%252Fal5CXdybOyRmC9IM0%252BMK1JGarK8201c%253D&asb2=3QoKr-Rb0lbSRMPqTPVrYLSRXHdyTEk43ObmE9yg8yA78hNXEpEU-fanM7AShHg1
"Предтренировочный комплекс Binasport ""Preworkout Advanced Pro caffeine free"" (без кофеина) порошок 200 г со вкусом вишни",671 ₽,152 отзыва,"7 мая доставит Ozon, продавец BINASPORT",https://www.ozon.ru/product/predtrenirovochnyy-kompleks-binasport-preworkout-advanced-pro-caffeine-free-bez-kofeina-poroshok-200-187086673/?asb=eYU8pr9aLiTcRx%252FyZYuBy%252FGIL3WAfNVTnCzebGVu3JE%253D&asb2=pVuawe1JeasEMY6pmxLhFyAoHyRg2i5eM07o0BBdVMppBiWc60LEuHunPo9Wec-e
"Предтренировочный комплекс Binasport ""Preworkout Advanced Pro caffeine free"" (без кофеина) порошок 200 г со вкусом ананаса",692 ₽,152 отзыва,"7 мая доставит Ozon, продавец BINASPORT",https://www.ozon.ru/product/predtrenirovochnyy-kompleks-binasport-preworkout-advanced-pro-caffeine-free-bez-kofeina-poroshok-200-187086627/?asb=QbgS%252Bb%252Bs5LMho2t8uZvsOq0eyep5xeB%252FcSLLaYjhD4E%253D&asb2=78F5VX90akGFeumfp4GuMm88QeTbUei_x5ilKOVnhzl-6v4FM8bSXxQMpY1xusAw
"БАД Капсулированная Конъюгированная Линолевая Кислота, 60 капсул",946 ₽,1 отзыв,"7 мая доставит Ozon, продавец Супермаркет «Гармония цен»",https://www.ozon.ru/product/bad-kapsulirovannaya-konyugirovannaya-linolevaya-kislota-60-kapsul-279409108/?asb=iWEQM31S94EvjPC6rNvcBf5kpv3ZSN%252F3G5G3Qt8s1N0%253D&asb2=eTT3aPjWL1bgjBRjEQF3pOe6WKUInJPTNEuo_9PhEFDFspBA7KZKm-XYXyEuROmD
"Комплексная пищевая добавка ""Теанин"" 60 капсул CHIKALAB",890 ₽,3 отзыва,"Завтра доставит Ozon, продавец Bombbar",https://www.ozon.ru/product/kompleksnaya-pishchevaya-dobavka-teanin-60-kapsul-chikalab-244181553/?asb=z6ZRvEFH1A8sFOmGUd8ovDglwIEhiCHPvNb3ZZQl6g7g3eoFEOKTlZ5eqkFXGcyN&asb2=W5arfNcBCeD8v_5lgpMZ4HSuZkyb9BOpPmfP40cfORisOkEfhVjLy3n9f0zAjpcrzMSsB2awqhZAVMB6rpeWOs8It0baqdkFU4YZm8_MVMIRpgLJDLZq1ZptrvKVG6k5LglLOy0pudFLSakcpZ9KFg
"Предтренировочный комплекс Binasport ""Preworkout Advanced Pro caffeine free"" (без кофеина) порошок 200 г со вкусом апельсина",692 ₽,152 отзыва,"7 мая доставит Ozon, продавец BINASPORT",https://www.ozon.ru/product/predtrenirovochnyy-kompleks-binasport-preworkout-advanced-pro-caffeine-free-bez-kofeina-poroshok-200-185868343/?asb=BLO%252FfMqtXCCPxWhvlV%252FRnkHJrp210dnYtEwZvi0f9q0%253D&asb2=kuJo7i0OaB-RPz8Oj2wg6U-kQCdL9sYcLW4a3Y9PI_gSq4HEO55rKgXwznlZ27fx
"Цитрулина малат 2/1, порошок 200 гр.",1 005 ₽,41 отзыв,"10 мая доставит Ozon, продавец Bombbar",https://www.ozon.ru/product/tsitrulina-malat-2-1-poroshok-200-gr-242424580/?asb=%252BYQ2jvLuV7Kn%252FREeEfg6Ju0VhgW6y8ktWxtB14UU%252FcO4xO3JE%252By4vdaex38mfmAr&asb2=uQUtux80yGVc5-Kx8-mLp0sEh02fIWbuLKk2yhnawa-n_jYUvPsJkjRwQ9PeAqJv2y2xcRG9aUR7JnnDjzPOwEaihjcShGvloW-Yzf_IK1bllfcjD0FsTZhOtL2yex5KUTyg3JxgxTh917NmPKR8vg
"Предтренировочный комплекс Binasport ""Preworkout Advanced Pro"" (c кофеином) порошок 200 г со вкусом апельсина",692 ₽,152 отзыва,"7 мая доставит Ozon, продавец BINASPORT",https://www.ozon.ru/product/predtrenirovochnyy-kompleks-binasport-preworkout-advanced-pro-c-kofeinom-poroshok-200-g-so-187086672/?asb=ZGKID1SZhhlzjYl9D0cZlAj8G6NkpuayFP2iK7w1fWY%253D&asb2=wJ8Ct2pLM-9RxI0C8QVrNgVR3sg5UXjVqeXXZliqC-S9yoy3QfsVowhhLqiVxUxb
"SiS Напиток восстановительный углеводно-белковый в порошке REGO Rapid Recovery, 3х50г (Клубника) Протеин, Изотоник",857 ₽,19 отзывов,"7 мая доставит Ozon, продавец BESTFIT",https://www.ozon.ru/product/sis-napitok-vosstanovitelnyy-uglevodno-belkovyy-v-poroshke-rego-rapid-recovery-3h50g-klubnika-550164842/?asb=%252FahtNDWYYUP9qhTVbDczjMOOKFQL%252BETS%252By9jaMeWLiE%253D&asb2=Ax2uf0TxpU0ItaicpDwICZu4ZtXJoqSnuAbrbgFpPY8aAGyPJBNKHo3B8VWIzFog
"Коллаген в порошке, говяжий I и III типа, в порошке 100 грамм",570 ₽,28 отзывов,"Послезавтра доставит Ozon, продавец ООО ""УДАЧА""",https://www.ozon.ru/product/kollagen-poroshok-100g-254665059/?asb=AxM%252FntxwglsRSiaAGSKeIozfRWKiIKoo4oeZX3vJ7pI%253D&asb2=08AHNIAgY2Xeg4B7Sm_wNG1cITRbJzTNkEqwSseY5OEQxtE9m725QgpYE5DLFlOg
Хлеб цельнозерновой / Без глютена / Без лактозы / ЗОЖ / Похудение / Спортивное питание,420 ₽,1 отзыв,"8 мая доставит Ozon, продавец Tartufi_Фестиваль итальянского трюфеля",https://www.ozon.ru/product/hleb-tselnozernovoy-bez-glyutena-bez-laktozy-zozh-pohudenie-sportivnoe-pitanie-302450292/?asb=Hf20o54IibKOI4Y3HUvBkutPk2SlEMUrGQ3hnqYaMOVWAzt3%252FhQLjjVAve%252F%252Bus8N&asb2=uojUVkeRms-ZSoGghoEQoxyr1AGWZKNd1Da1vjH-N6b-L7YFlm-o2Wz3o7UWkWCyJR3KpbrRtDgtHzuWS2CCqup3HYkclG7-VSWEsH1zvymBLFSSN0bFm8u6X2CTQ1U1lFDkQWzg2MhqfYgroO5WHA
"Предтренировочный комплекс Binasport ""Preworkout Advanced Pro"" (c кофеином) порошок 200 г со вкусом вишни",692 ₽,152 отзыва,"7 мая доставит Ozon, продавец BINASPORT",https://www.ozon.ru/product/predtrenirovochnyy-kompleks-binasport-preworkout-advanced-pro-c-kofeinom-poroshok-200-g-so-187086705/?asb=%252F4WuObL%252B16y%252FEvu4hteDDjUmoBPb%252BzKpgnuui6%252F8DZw%253D&asb2=4fUFsZr9ScvBtMg3XETwBhP-1zjrw0AvZuwJQ6oxfN-af7tXsttel97wzIbrACjH
