Термос Крышка-чашка DECATHLON,699 ₽,30 отзывов,"9 мая доставит Ozon, продавец Decathlon",https://www.ozon.ru/product/termos-dekatlon-0-7-l-173498961/?asb2=_-9fhWbK4xy4r7Xx3ThBUnTxZgiuycCocCSx5ZqQGqJ-SBwCjPYuIYw4-CA4sTPp
"Фляга Фляжка походная 1 литр 1000, темно-зеленый",729 ₽,15 отзывов,"13 мая доставит Ozon, продавец Сеть Армейских магазинов «Гарнизон»",https://www.ozon.ru/product/flyaga-flyazhka-pohodnaya-1-litr-1000-temno-zelenyy-389616612/?asb2=m_JPZzrEv3dqCNPzNMw5ppnlSWk1qI3bLoVGWYlwj_mtMzuutZZQ3cDtz2ap10UJ
"Фляга BY Фляжка 240, серебристый",333 ₽,77 отзывов,"10 мая доставит Ozon, продавец BeriUN Market",https://www.ozon.ru/product/flyaga-by-flyazhka-240-serebristyy-389448578/?asb2=0Z7Zoyu_WbV2YdENF8w3nhAIxNviwl1BpHwwAP_YT9gTgNloCDV5VhRa8o4Uf1-1-yfQMtNbjjmjj0U3kBxNNQ
"Термос Крышка-чашка, Непроливайка, Вакуумный Swiss Diamond",799 ₽,2 отзыва,"Послезавтра доставит Ozon, продавец Мулин Вилла",https://www.ozon.ru/product/termos-kryshka-chashka-neprolivayka-vakuumnyy-swiss-diamond-523585871/?asb2=lWBWU3bqEGXFBUFMfQUV9AnKGON_JWHdN_pWiN_22ekIPOeC2o7DYc1bFRli4J6fHjrUw3iUWSXfK2GfToIQhQ
"Миска походная ""Следопыт"", диаметр 17 см, 700 мл",216 ₽,25 отзывов,"11 мая доставит Ozon, продавец MAINSTEP S",https://www.ozon.ru/product/miska-pohodnaya-sledopyt-diametr-17-sm-700-ml-327374072/?asb2=Vz1mRivx00AFL6llRBePeO7hNChZTNxq7AfWM0SEWaD0jzcPwBUt270YkUilXqU7Krg9HKnoc7bQGgnmBClwbA
"Канистра для воды складная, 10 литров",370 ₽,4 отзыва,"Послезавтра доставит Ozon, продавец First Discount Shop",https://www.ozon.ru/product/kanistra-dlya-vody-skladnaya-10-litrov-443878477/?asb2=0kWe8xadFFBej6xCTAnf6Kf1nZs-5rb5b5RzEGUK8g0pYW4v5uBYYkVUXlouavx4EOEFZ2KpcfhT6AFHLWkF9g
Многоразовый стакан WOWBOTTLES 400 мл,158 ₽,38 отзывов,"Завтра доставит Ozon, продавец ООО ""Компания К""",https://www.ozon.ru/product/mnogorazovyy-stakan-wowbottles-400-ml-500079372/?asb2=nqv2906AZHWjifL7PuThOat5lebSlMv7vWpZ7sKl4YvR39HMjvGfQu_VMVLUY5mMNJGqHrqaqsc5df4hR-WzHw
"Котелок туристический ""Калитва"", 6 л",763 ₽,184 отзыва,"Завтра доставит Ozon, продавец Ozon",https://www.ozon.ru/product/kotelok-turisticheskiy-kalitva-6-l-139504873/?asb2=It45zbEeYuuqliEoPDFp1QkniFUOJphJdMnE1OTd7Kb7M9IEvlmDxIF6UaoU-lWa
"Кружка походная (туристическая) из нержавеющей стали (500 мл), 11,5*h8*d9 см",349 ₽,16 отзывов,"9 мая доставит Ozon, продавец Home Depo",https://www.ozon.ru/product/kruzhka-pohodnaya-turisticheskaya-iz-nerzhaveyushchey-stali-500-ml-11-5-h8-d9-sm-522667626/?asb2=iYUUo7vTH5NOa7b0_DEoC6MXcGj_klj-BwQUPRHRx2OAhjoEvoq7rTvLLwYL3sw28BhB8iAZnmNzduKarDeppg
"Фляга СССР 800, зеленый",850 ₽,82 отзыва,"13 мая доставит Ozon, продавец Батальон61",https://www.ozon.ru/product/flyaga-sssr-800-zelenyy-272973730/?asb2=ehR2Tge8k35FEsuHZtt90jZqeywEQZ0y8dGIXvt9UJB0_3pHz86cqt8mnq--JiKK
"Фляга армейская с чехлом (СССР) 800, хаки",780 ₽,37 отзывов,"10 мая доставит Ozon, продавец Армейский оптово - розничный центр ""КОМБАТ""",https://www.ozon.ru/product/flyaga-armeyskaya-s-chehlom-sssr-800-haki-325235783/?asb2=iw8aJeMElNzefmPzzATg1wN8dUkbxLGJ4xAnArXtexeoyRLhg6xE-mmEbNsKYOsU
Многоразовый стакан WOWBOTTLES 400 мл,158 ₽,38 отзывов,"Завтра доставит Ozon, продавец ООО ""Компания К""",https://www.ozon.ru/product/mnogorazovyy-stakan-wowbottles-400-ml-500240899/?asb2=_Fph6AgDE7Ts8dFvj-dwqVHukKOhQdXIjv8oYMNzcMHKOL7ivPAnwcT5Uo3umOuMcL9GZbe57atfL08ewlRiJw
"Ланч-бокс Gipfel, 600 мл",356 ₽,14 отзывов,"10 мая доставит Ozon, продавец GIPFEL INTERNATIONAL",https://www.ozon.ru/product/lanch-boks-gipfel-600-ml-477458404/?asb2=gioljT7Jc8R1Vr25m6nvf-g8jXLlxf6xxmfKCZkhSwIhHLR_Y-aQUaKCn0ea5R0T
"Набор туристической посуды ""Турист 1""",489 ₽,1 отзыв,"12 мая доставит Ozon, продавец МЕГАСЛОН",https://www.ozon.ru/product/nabor-turisticheskoy-posudy-turist-1-560796937/?asb2=_KGH9hlF0JQw5T-nLoX8esy8xsCvG44dL3qnj8s6gX3On8x1Hi1UqZ2OaruHWwH6QD9ZxdTD6Au6J3bHIHv-bw
"Котелок армейский СССР алюминиевый туристический, 1.3 л",885 ₽,27 отзывов,"9 мая доставит Ozon, продавец Radix9 Tourist Shop",https://www.ozon.ru/product/kotelok-armeyskiy-sssr-alyuminievyy-turisticheskiy-1-3-l-484859995/?asb2=-lILP9MGNlqoEpmP054YCtdubd4kcsRu7dLYMwoh-INOWfXNBku3a-LQRmAFqrO2Hy6ORNx_l3Ne8tcxv3zyBQ
"Набор туристической посуды, посуда туристическая для похода, кемпинга, 5 предметов, нерж.сталь",595 ₽,64 отзыва,"Завтра доставит Ozon, продавец Разумный выбор",https://www.ozon.ru/product/nabor-turisticheskoy-posudy-posuda-turisticheskaya-dlya-pohoda-kempinga-5-predmetov-nerzh-stal-262501327/?asb2=fOkAJ8mGlARdse6FD8Bang7CxMb7y_g9j_K554-Wo8CT6YZSm7NY_pzVhW4hc3Ak
"Ланч-бокс Gusya home, 700 мл, 1 шт",595 ₽,115 отзывов,"Завтра доставит Ozon, продавец Gusya home",https://www.ozon.ru/product/lanch-boks-gusya-home-700-ml-1-sht-297946980/?asb2=HYOcYzpJuA7TrwQ3GONf0efC-vg3Snjc25nhRRIDn-7S7B5pfrLKJb8Wf95GQk9d
"Термос Непроливайка, С LCD дисплеем, С термометром PAPILIO Home",555 ₽,106 отзывов,"Завтра доставит Ozon, продавец PAPILIO HOME",https://www.ozon.ru/product/termos-neprolivayka-s-lcd-displeem-s-termometrom-papilio-home-371983808/?asb2=cBapku3VdPhDXpZc8aq6zNvDycFllemejdEGoaGxb-w_GbyJJDpNf5Jog7Sxxy3YOKCk-P1pcnmHfaY5M0_K1g
