Сиденье для унитаза с крышкой BATH PLUS пластик Бежевый,806 ₽,29 отзывов,"8 мая доставит Ozon, продавец ТД АРГУМЕНТ",https://www.ozon.ru/product/sidene-dlya-unitaza-s-kryshkoy-bath-plus-plastik-bezhevyy-336241029/?asb=Al4acmSH8db2h48H9gK6JTQUpVnzPdYQSOoQB3crtaU%253D&asb2=fpfih9wGI89w70nOP_EDHOTcjAHrVZZ-ZO8pJ00-6WhtYemaK3X96SY6p-m3R1R7
Крышка для унитаза Bath Plus пластик ПОПУГАЙ,978 ₽,29 отзывов,"8 мая доставит Ozon, продавец ТД АРГУМЕНТ",https://www.ozon.ru/product/kryshka-dlya-unitaza-bath-plus-plastik-popugay-464337949/?asb=IUeqIr4u7JtZf3KTWKb5TCnQqXWb%252BlzITnrQfrn4S2c%253D&asb2=n4D3O3tv_6c-YpqCumFBfnMgiziu7yEMMyEVZpGjBEyawwmFHv-AhwC4jmClad3A
"Сиденье для унитаза daux premium 33х40см серое в горошек, многоразовая накладка для унитаза, мягкий",453 ₽,63 отзыва,"11 мая доставит Ozon, продавец Хозторг",https://www.ozon.ru/product/sidene-dlya-unitaza-daux-premium-33h40sm-seroe-v-goroshek-mnogorazovaya-nakladka-dlya-262666728/?asb=M3t%252BQ%252Fx5XIcFNN0EW5SMdg7pNTD%252B3YrIONU2AoSlV68%253D&asb2=z_j13ElABdyU_AS3pPa-GVQH0NnoBO9LIYdDqfRQHcVwdD7-za1uDSHu94E8URsp
Сидение для унитаза пластиковое фотопринт HD.05.2038,670 ₽,10 отзывов,"8 мая доставит Ozon, продавец Home Decor",https://www.ozon.ru/product/sidenie-dlya-unitaza-plastikovoe-fotoprint-hd-05-2038-415255332/?asb=ok3cy8qkWqyKbJrTXpSiiztVMiXTW0LzERoipyRl%252Bgc%253D&asb2=Ll9APQjYdO_pDaS3sl6XqyR_BBpGiUTShI6lM-WvuXO__pIVJ5oUWUol5nZ-9WiI
Гигиенический душ Ledeme M34-1,980 ₽,3 отзыва,"8 мая доставит Ozon, продавец Ledeme Official Store",https://www.ozon.ru/product/gigienicheskiy-dush-ledeme-m34-1-381823039/?asb=icLjC7JN%252B%252FdkIWkJ4wVLPZsfqAbdrg7TRYYvZkjNTDU%253D&asb2=sS9s0w-WsbfDlf4oE9FHwn7XzYJ39Hvv2AnyU1DsOk-A5v1nWwG4aFro-mfWFwEg
"Накладка на сиденье унитаза, универсальная накладка на стульчак. Для всех типов сидений.",299 ₽,27 отзывов,"8 мая доставит Ozon, продавец WAROZ",https://www.ozon.ru/product/nakladka-na-sidene-unitaza-universalnaya-nakladka-na-stulchak-dlya-vseh-tipov-sideniy-223572539/?asb=Ciwik9ZcILTLzwx6HVQ4AHihCx63xYAyCosgMLWhH0A%253D&asb2=oYT_py4862-PvJ8-IlJzZUEUqFU5Z2czH1MJkhi53fHDUDHCQfwe9hMtpxOFpZqC
"Предохранительный клапан Euros 1,5 BAR 1/2FF, 1 шт",980 ₽,2 отзыва,"9 мая доставит Ozon, продавец Биарм",https://www.ozon.ru/product/predohranitelnyy-klapan-euros-1-5-bar-1-2ff-1-sht-266672110/?asb=ZOo8Sp16h53YqQsGKCXG921lKl7uF%252BYIvVzrESGo7fY%253D&asb2=s6n142VWthMCBW8ge0dKN03-CI3YFAlEohrO_H5zNzT9a3EcBGXA7ntDsXVjQqG9
"Кран угловой с накидной гайкой 1/2"" ""ViEiR""",672 ₽,6 отзывов,"9 мая доставит Ozon, продавец -VIEIR-",https://www.ozon.ru/product/kran-uglovoy-s-nakidnoy-gaykoy-1-2-vieir-277497055/?asb=luwtIAhlhSqAA0p%252FQmS688JXpE29GkzTZErlHGPvnC5Qzf%252FVMW%252FOvJWPmetOgXg3&asb2=HX3ET1Uhvj_M2IyuT28zgzRGGId-fTWDjepN3Xwg-lJ5GQEYrHos8VLZMTa1ZoJ7SMEKDwFhL6VqOtqJZIpj9TJrADK0tE3taRSjHX0BF4VeqjVZFXFR7u6xqQeNiQtfBxBI9x_WJUlJiGK6IyFWZg
"Крышка пластиковая для унитаза ""Бантик"", DD Style ,45х37х3,2 см , зелёная",926 ₽,2 отзыва,"12 мая доставит Ozon, продавец ВСЕ ДЛЯ ДОМА",https://www.ozon.ru/product/kryshka-plastikovaya-dlya-unitaza-bantik-dd-style-45h37h3-2-sm-zelenaya-467497510/?asb=kBJ5KxYZGe5TDxONPUTY6Gab6fSEEwjNw%252FsyRvhSvnU%253D&asb2=uI1-qWF_XU0e-_qvTt3IPFy007QaR7quum4Sr-AmWbxisve_OGx0ayQdDYEh3q95
"Сиденье для унитаза мягкое S-500 (Париж) ""Сантис""",809 ₽,70 отзывов,"12 мая доставит Ozon, продавец Индивидуальный предприниматель Латышева Нина",https://www.ozon.ru/product/sidene-dlya-unitaza-myagkoe-s-500-parizh-santis-194844634/?asb=690obUu3kKnefx5yNwL4bRrQq3lpsh7eZEIzvhJFWTQ%253D&asb2=0YsfeWqq6qGin295ylu9knoQZV3oU37oex9fgo4maALu5lMLp0sO3kr4kpSsuAqb
Клапан впускной для боковой подводки универсальный КБУ-50 РБМ Псков,467 ₽,5 отзывов,"9 мая доставит Ozon, продавец SANRIKS",https://www.ozon.ru/product/klapan-vpusknoy-dlya-bokovoy-podvodki-universalnyy-kbu-50-rbm-pskov-199635138/?asb=RzSkoG6VJ8QG6kHCnrQxHAbHBzVNXnLnMZ56CM4sQ5k%253D&asb2=wdNc_kL2YyAslTzmeaULckVDvXVQ3Ejd4ymE3C7yO52tZH1febPZhiZU_XpweOrO
Сидение для унитаза пластиковое HD.05.1013,573 ₽,15 отзывов,"8 мая доставит Ozon, продавец Home Decor",https://www.ozon.ru/product/sidenie-dlya-unitaza-plastikovoe-hd-05-1013-416568481/?asb=%252B8FawmWxX2UyRY4eg7YkA4FHzul%252FQKUMQ5uEHRYk4CE%253D&asb2=-SH9YW301NB_LPSUspEEE3ThxEazUGfvlf1UqK7LgsetkV_G7auSLJ8FOJgOMqS5
"Подсветка для унитаза с датчиком движения и освещенности, 8 цветов",400 ₽,2 отзыва,"Завтра доставит Ozon, продавец Casalinga",https://www.ozon.ru/product/podsvetka-dlya-unitaza-s-datchikom-dvizheniya-i-osveshchennosti-8-tsvetov-295301745/?asb=%252Bz0xqRLnBfER%252F71bcwJ1SZ%252BepCws5kiNR7AlfSqQxaE%253D&asb2=Mcu5DiHZhmpDFDxrwTo5lHzi2lKpZd6yWut-tFxk5EnLSZw4HlHWTWOQ4fGaXI08
"Клапан отсекающий, обратный STOUT 1/2""",348 ₽,1 отзыв,"10 мая доставит Ozon, продавец Бойлерная - всё для отопления и водоснабжения",https://www.ozon.ru/product/klapan-otsekayushchiy-obratnyy-stout-1-2-377652347/?asb=y3uL3KjLyTJsvO9vGXmp5RcVkx5Mn94855K%252FKLMjk78%253D&asb2=8WKrBNPqMIcOEWPeu7RibYNl2L49zzXxIGx_8htX1fk3x5qy1t6JDbUBtWf30fwx
Сиденье для унитаза с крышкой BATH PLUS пластик ПЕРЬЯ фотопринт,872 ₽,29 отзывов,"8 мая доставит Ozon, продавец ТД АРГУМЕНТ",https://www.ozon.ru/product/sidene-dlya-unitaza-s-kryshkoy-bath-plus-plastik-perya-fotoprint-337591363/?asb=AWfKLcQqSOwRjVEpuvFpM24iwg8VJCtA6vMjC3m4TnY%253D&asb2=TPoD588KNpxVzds3CCoVwDTbk8ua6uGg9ZVjsXQYnCaHSfC2vyqDFodBGvRkwz2a
ПП Коллектор d25х20 с кранами 2 выхода БЕЛ Ростурпласт,481 ₽,1 отзыв,"9 мая доставит Ozon, продавец poryadok",https://www.ozon.ru/product/pp-kollektor-d25h20-s-kranami-2-vyhoda-bel-rosturplast-474002946/?asb=73B3J1UAE5CPaoXOBnKKlLBxCIhFPGPUCSGfS5qjW4U%253D&asb2=5pdwQIVyG8rafDvFhvpLB6kOpju1sgl41L1PhQY4UbmZkMgSCurkfW3YoBkuaEx5
"Ручка для сиденья унитаза ""Ангелочек""",129 ₽,5 отзывов,"8 мая доставит Ozon, продавец Sova",https://www.ozon.ru/product/ruchka-dlya-sidenya-unitaza-angelochek-248554668/?asb=dhR%252FiDDIT%252Br23OyiwyFDlXOhlXP4pdGzcri5ouc6FCI%253D&asb2=iwNHB4pvT_hDzmDWhQRucatkYThSNADMJqvGpjrYYnxXK37EcnPaA7CpUUNy-LGW
"Крышка для унитаза ""Бантик"", цвет: розовый",679 ₽,2 отзыва,"11 мая доставит Ozon, продавец SellerShop",https://www.ozon.ru/product/kryshka-dlya-unitaza-bantik-tsvet-rozovyy-472558231/?asb=RjFMXhHX79Ro3q3pEJPkIjJ1kyqoVNdZCzt36Zvln%252Fc%253D&asb2=aRPRUgPxLS84z_StSQufuJyFYS9yMrdqaQEmRbsPYw3fpdnsOcPLKrBlejDd3RrZ
Сифон для стиральной машины AlcaPlast APS1,829 ₽,5 отзывов,"Послезавтра доставит Ozon, продавец Гамма",https://www.ozon.ru/product/sifon-dlya-stiralnoy-mashiny-alcaplast-aps1-232144231/?asb=Ypct%252BQxKJ4G8ULZc1D3gjC6H2%252FgJckS11zgRyqzr9So%253D&asb2=eiV10IIJM7Qy3r8QLgKRykmUWN-jhbFlHcAbZIkQruqcHsbl00e1ZcNxWkh28Acy
Гидрозатвор комбинированный AlcaPlast APV0020 Smart,754 ₽,3 отзыва,"8 мая доставит Ozon, продавец Центр сантехники",https://www.ozon.ru/product/gidrozatvor-kombinirovannyy-alcaplast-apv0020-smart-253602450/?asb=5xhMSnEwviJ3ZmhFMyWH8NtEX5g802Fll%252FgDa5fRrGg%253D&asb2=nwcLdDtNdRfl3rmzZUSRq9Tli8M9-Lx7AUAdFY3BBo4432tmNs5kjuaNkHnGh-M-
"Клапан для сливного бачка WIRQUIN ""Compact"" (10975010) 1/2 дюйма (нижний подвод)",685 ₽,5 отзывов,"8 мая доставит Ozon, продавец Sales-Santehnika",https://www.ozon.ru/product/klapan-dlya-slivnogo-bachka-wirquin-compact-10975010-1-2-dyuyma-nizhniy-podvod-175270646/?asb=4xnJGSRn11KemtTErzU9YI%252Fhw1deQLRLVLx7Wd1Ez1k%253D&asb2=z7w4kpAKCHLaNN4zCTLHjaja777M6i4cUXUszUf8k3_bLAUG-JNM78KOTB-HE20T
"Клапан для бачка унитаза, подводка боковая, клапан для бачка, клапан для сантехники, арматура в туалетную комнату, слив для унитаза, кнопка слива, ремонт бачка унитаза, сливная арматура, арматура смывная, кнопка смыва, смыв для унитаза",499 ₽,1 отзыв,"8 мая доставит Ozon, продавец ИП Свирин Андрей Андреевич",https://www.ozon.ru/product/klapan-dlya-bachka-unitaza-podvodka-bokovaya-klapan-dlya-bachka-klapan-dlya-santehniki-armatura-539375383/?asb=7aNqDMloeAFhJVf5cFs1Dmvdg2CLjz1waTs3ORuaPw18k9yPwp3a7tBKm%252BgE0V8H&asb2=DAjILmQSdgs30XYaBXcTDU9e2LABF_03t9F-AwuhjvYL3gv3yoS41xp4B_Fspjn76kRVOPkOnNRUCi32hSchxHkJ6szNooJ87j2RWuYWsZw1-OQIwcd_nBg64TYcO5AnpQFwgNzkh6GxbzHaM4fydw
"Кран угловой с накидной гайкой 3/4"" ""ViEiR""",890 ₽,6 отзывов,"9 мая доставит Ozon, продавец -VIEIR-",https://www.ozon.ru/product/kran-uglovoy-s-nakidnoy-gaykoy-3-4-vieir-325247545/?asb=9FMZ8Nbw5vMYjEq%252FcPMOk%252FC9LEw2y17%252F3Dvinv%252FAm361%252FktvRHZLdGcYc3rqZ9W0&asb2=ORfIeI6sX4MoUFbv8mA1397rX-wuGFy01aLeOTeva5Rh95c79KLPctrlw1Lmsvkpx3okloyq7wzmbX7RMVi_LKeqPV0QCIbPGJfNN6gbkoMMpKPujJTyGabnRCI36iMySdPYuG4F3Tt8YnJu_jUcaA
Клапан выпуска кнопка белая Ani WC7010 Арматура сливная,763 ₽,1 отзыв,"10 мая доставит Ozon, продавец МАРКА-МАРКА",https://www.ozon.ru/product/klapan-vypuska-knopka-belaya-ani-wc7010-armatura-slivnaya-314429064/?asb=sAWoizX8f12iB7uXR8m6Oq%252FP9k8PoKb4GHbAZeVdNU0%253D&asb2=vqbtYZ4_2ctMWluVvxv-U3jM9dmFGyPRva_iBOMcl1fLqua8-wG1gqv5jPkpotwb
"Арматура для бачка унитаза с боковой подводкой 1/2"" WC4050M АНИ пласт",745 ₽,3 отзыва,"9 мая доставит Ozon, продавец SANRIKS",https://www.ozon.ru/product/armatura-dlya-bachka-unitaza-s-bokovoy-podvodkoy-1-2-wc4050m-ani-plast-170800216/?asb=i1SxmcGRW%252BUtkEkBp6g5nDyaShnGiRNYsEYyhG1bBrE%253D&asb2=Lnq6x9hOiU1baay4o5_faq9u1XA-8Wre9cPApReLL7lnv4zQAN9oDNr5MfyPHZy-
"Обратный клапан с пластиковым сердечником, 3/4""",400 ₽,3 отзыва,"10 мая доставит Ozon, продавец ИМ Level",https://www.ozon.ru/product/obratnyy-klapan-s-plastikovym-serdechnikom-3-4-400596024/?asb=rUBz%252Fcg7hoyV0SdUsA2r0iPLJlUXHUgISO%252FLPrIyNaA%253D&asb2=5BAC7i6YMYZCtIgjlh-iIXs55xvGsyYFSP3oMUE_dkWigujbMljFvmeCsI8kKG18
"Сиденье для унитаза ""Подводная одиссея"" SYM-5004, DELPHINIUM",882 ₽,3 отзыва,"11 мая доставит Ozon, продавец Антик",https://www.ozon.ru/product/sidene-dlya-unitaza-podvodnaya-odisseya-sym-5004-delphinium-191711716/?asb=wQNigS1wUw2RWo%252FnEARUO%252BGZ9%252FXNXPWOcOFWCUXk6ss%253D&asb2=bsKbM95Lqbyj4dDunu3PaIPDrOOIgRv5S19L0L6EbUL7AczJoSooZNgXymJ0YIMz
Сидение для унитаза пластиковое HD.05.1006,573 ₽,15 отзывов,"8 мая доставит Ozon, продавец Home Decor",https://www.ozon.ru/product/sidenie-dlya-unitaza-plastikovoe-hd-05-1006-416567595/?asb=DhCQn8UoQWO0EaHuPptadUKoycdAgI43sVrq6Wpdmd0%253D&asb2=gUOPoNwKfKFy8HBhGeJyb8a3k00957WEaWDhF7tbGPEEubw-DHykzD9kEpn7qKDc
"Valtec Пара кронштейнов для коллекторов из нержавеющей стали 1""",938 ₽,1 отзыв,"9 мая доставит Ozon, продавец Сантехлюкс",https://www.ozon.ru/product/valtec-para-kronshteynov-dlya-kollektorov-iz-nerzhaveyushchey-stali-1-223354108/?asb=G0rPiDVobp5T9EJ%252BeunVDxyq39jYQlAUFZW7rxj2ED8%253D&asb2=faX2GR6rcZgADmxb3X7WNnR6pmdwzxcZkJDg4AofgNj-GCv9hpDZMC_NR7738POg
"Клапан АНИ впускной, 1/2"" нижний АНИ пласт WC5550",366 ₽,1 отзыв,"10 мая доставит Ozon, продавец Коралл-Сантехника",https://www.ozon.ru/product/klapan-ani-vpusknoy-1-2-nizhniy-ani-plast-wc5550-225715281/?asb=y%252Bh9Jl7HnTkxkgrVXlUMJa7wWDN7D90JF3kh%252F0v4CcrhPTvKc1yvYv%252FC7a%252BzLoN5&asb2=lfhAw2jcCNB5i-EMwNRD1OBdu8rKSUQh1QnxENFFyUFHK-qLeJKBgW3RQH84AylzQ77Ssir7gDJoMTlrYqXFqtcf3afiJIHmDM7f3gHaLUlH4ROpikOmytewtGDVsZpAG0-uzcH8bTzThMrJhLUSdw
Ручка для крышки унитаза Гигиенический подъёмник крышки Девочка Мишка розовый,284 ₽,1 отзыв,"8 мая доставит Ozon, продавец Fulmar",https://www.ozon.ru/product/ruchka-dlya-kryshki-unitaza-gigienicheskiy-podemnik-kryshki-devochka-mishka-rozovyy-305643245/?asb=Mi94WVyfEsIJdFtNV4tMJXrPixwXHmXlN7Fo22aLrHusRE44eCukGxJVKhfvfx%252Bm&asb2=5Urp7J56QykJM-WCoDt4oXh2cWUN8MZh50hmotEyZH1V0jGVEAyyOUyF-ddtf--EoBAAxhzl56Vwvm5_KVEQbbSpNEMNvGkBRoGA7TQHKpVaw4VvBuzYvMgBg6HhlVuBTyiyaZuO-QaYfwYiRWBhDw
Звукоизоляционная плита для подвесного унитаза и для биде AlcaPlast с принадлежностями и колпачками (белыми) M930,606 ₽,3 отзыва,"Завтра доставит Ozon, продавец САНБРАВО",https://www.ozon.ru/product/zvukoizolyatsionnaya-plita-dlya-podvesnogo-unitaza-i-dlya-bide-alcaplast-s-prinadlezhnostyami-288589644/?asb=ZcSVKcMSLIKS0rHohEBelG0S%252FOri4%252F3Ztb5WC01yBeYT6Si%252BaVWBtQ22bPhJipAD&asb2=x3RQUI7ldis7pfcCV_vXfKbwC_dxI63L_q-7zlQXw3-O2eiXwLevVPwQxmNRHVtUKmvjWrrDWOzydo3QC4PpIMx-XTku8wLzJTToeXQgRv1iXm5_JISyQTqCdJnyvvAoXXqNOTmjTjtv5JwAUKdPuA
Сиденье для унитаза мягкое Морские акробаты Аквалиния,939 ₽,55 отзывов,"8 мая доставит Ozon, продавец ООО Изюм",https://www.ozon.ru/product/sidene-dlya-unitaza-myagkoe-morskie-akrobaty-akvaliniya-293784061/?asb=SLB7RBbLWMLmpEdcBH9y0VDGIz32E4t8B72TSJq%252Bpl4%253D&asb2=0hpY0ApXlKVbZhlJRhnxh33Nqeqi_8Zk9t0-GfHxywwaFmwwAYNaCwIVhd1t5__t
"Сиденье для унитаза мягкое S-500 (Бруклин) ""Сантис""",809 ₽,28 отзывов,"12 мая доставит Ozon, продавец Индивидуальный предприниматель Латышева Нина",https://www.ozon.ru/product/sidene-dlya-unitaza-myagkoe-s-500-bruklin-santis-194531817/?asb=QucMbD%252FOhhh6utklZC0JNPYUj88l%252F0WuZgtt784j5rM%253D&asb2=35_aUn4QGk1FqTaN8I5d4LtkfVc2IMqFH_EJOeWUDWEdWUlUUvOduEry3605Rg2M
"Слив для унитаза раздвижной, Гофра для унитаза АниПласт, Отвод для унитаза",597 ₽,5 отзывов,"8 мая доставит Ozon, продавец ИП Свирин Андрей Андреевич",https://www.ozon.ru/product/sliv-dlya-unitaza-razdvizhnoy-gofra-dlya-unitaza-aniplast-otvod-dlya-unitaza-327538284/?asb=MnjHC0HRX5%252B9utliuyg9e0hXcMImOEYObupezCkotqoovPc9KSXqdEdLDP8MVy77&asb2=-NcPwKCZPT00IHK-mHXAggMiBm6-mCwW0tsA4zskPdp2P3tnOk08GExevlzvkfXWh8Y8fv4PrMIqZ8N4qkvKwDG4Uo2hRZZc5-AvJ9wcXtR36fbI_kF1vXnkYqzdbq89ZZaTKZTbppW4k7TMu62jpg
Донный клапан,684 ₽,2 отзыва,"8 мая доставит Ozon, продавец Сион-Групп(ZG)",https://www.ozon.ru/product/donnyy-klapan-240919524/?asb=oWtpazfqM9kivEV4RrBFGxGi5%252B3MnZeiwnDBXLP%252BwGCyvOOej3iPree8tXDo0jMK&asb2=a9QiFmqCU4VKFbr9sLrR-45wE6o9oJtIsJtPygJj3hBitNJAMhg0u-qKpLWkXHQ1sZcnT9NhjxbDQMRII5y3oPg-9mvzvUFIy-pcqaL5D3Jux9MAmB-j-Pnc9REnju8hX5UxrN_-0t-fOY89ueLJIg
Арматура универсальная Тула РБМ красная ас 1-1,379 ₽,2 отзыва,"9 мая доставит Ozon, продавец AqueProm",https://www.ozon.ru/product/armatura-universalnaya-tula-rbm-krasnaya-as-1-1-494318934/?asb=GzQ5TUuFXkO6M%252Fi3cKuA8Gj1iUwkxDgMVzwt%252FivzI40%253D&asb2=gO_a8x3t1eHnYDb7g4qU3os7Asj83-XbocO_ATWGlrfoFJkR_DyiIPPgi9ewNa_Q
"Крышка пластиковая для унитаза ""Ракушка"", DD Style ,45х37х3,8 см , белая",729 ₽,1 отзыв,"12 мая доставит Ozon, продавец ВСЕ ДЛЯ ДОМА",https://www.ozon.ru/product/kryshka-plastikovaya-dlya-unitaza-rakushka-dd-style-45h37h3-8-sm-belaya-468751798/?asb=W0XM8FLOdVMAi0kB%252B%252BZeyFJV7MA1KgmBeKcOUNzl%252BR4%253D&asb2=EkSj41ExZXIg3U4cLSEvmwt3A8eHKT-lyPuwFOztADIYnh0hzNt79LCMgZdZdHJf
"Кран шаровый 3/4"", усиленный (никелированная латунь), бабочка, наружняя резьба-наружняя резьба (штуцер-штуцер)",378 ₽,1 отзыв,"8 мая доставит Ozon, продавец Калипсо",https://www.ozon.ru/product/kran-sharovyy-3-4-usilennyy-nikelirovannaya-latun-babochka-naruzhnyaya-rezba-naruzhnyaya-rezba-238905590/?asb=ALBtIHkYOjIpAUQhIuudbuM1GVO%252BB6LrljX%252F0txPAbQ%253D&asb2=7OhioRTaKKRUytDynlAqrbEL7fdu6Wf93L8ddU-ALSl30zXnAobvfQzeBqvIw85s
"Шланг для душа двойными замками 1/2"" -200см",637 ₽,10 отзывов,"10 мая доставит Ozon, продавец TIM",https://www.ozon.ru/product/shlang-dlya-dusha-dvoynymi-zamkami-1-2-200sm-177350454/?asb=fUX1VJSBz82tBpLRLWE9VolVwRwHuy3%252FIO1lalOPrzglbvktdzaomayWu18frURA&asb2=3-9UJZVsvcLa071quvPMIQsofhFVogSo6Wp86L8IB7kzjWzTUnwCjEnSLe7CIwZvyEPv02CEKmUo3kOmDzgXFMimFYDkspL8F4dKxEgxSCONilaLff2QEIU3QMLwP6G1GuAc1juyc8UpM1VqPM0Ymw
Мягкое сиденье для унитаза / Чехол на стульчак / Накладка для унитаза / Чехол на сиденье унитаза,387 ₽,1 отзыв,"8 мая доставит Ozon, продавец Proshka House",https://www.ozon.ru/product/myagkoe-sidene-dlya-unitaza-chehol-na-stulchak-nakladka-dlya-unitaza-chehol-na-sidene-unitaza-419680998/?asb=4dXj4JHoxtZvcoJtOd8y2sXKuR%252FKzilzEt89RUL2P2I%253D&asb2=KUHQ65Mjwp2A_Fh_uAWqBZQegIzgxtX6mNfvOMmg4MsU5FK99wwGG_RuwJGtB7n-
Сидение для унитаза пластиковое фотопринт HD.05.2039,670 ₽,10 отзывов,"8 мая доставит Ozon, продавец Home Decor",https://www.ozon.ru/product/sidenie-dlya-unitaza-plastikovoe-fotoprint-hd-05-2039-415255031/?asb=MqlluOtiSnk4KAPDPfeh%252BQfvo7JYewEHg1iLZoiFaf4%253D&asb2=284bd8OvuB7GKgwKTJyrPNojOii7MMvlVXcQc5jOy3CRdO3LxNUvfEhPaGkWXC-S
Кольцо уплотнительное 45мм Geberit 362.771.00.1,802 ₽,2 отзыва,"8 мая доставит Ozon, продавец ЧАРУС",https://www.ozon.ru/product/koltso-uplotnitelnoe-45mm-geberit-362-771-00-1-365918954/?asb=BmFN9DFBdADw5lKtv%252FWPtsQx6EsOb4kdX90bi%252BKk8AQ%253D&asb2=qwyXeaWV2rPjWge3OZLJ-VbyrNeYgjT7w-ozjiCRZ4tvECJwXKm3eVfEDaBeASxI
"Евроконус для металлополимерной трубы 16(2.0)х1/2"" FAR TIM",414 ₽,3 отзыва,"10 мая доставит Ozon, продавец TIM",https://www.ozon.ru/product/evrokonus-dlya-metallopolimernoy-truby-16-2-0-h1-2-far-tim-181989414/?asb=RqIv9xdG9jL6MNtd%252FqncOLaO7PPcEa5k6Xztu29z13M4JdmbOq2uJbD8bTYzGsYN&asb2=OYPmqtgzb1db8xQjRhNQ60rn4S5njuzBd8A_oUKfATi9zQ8yAE0H-pciZIhpYC6bXbMuYGWGXLXtdoPkKqx-HGuXqrirQBBDns2jwSBAKFT5uKFYo9_vaebkDad52w8dtRcD23iYkt6hBkBjzDadoQ
Арматура для бачка унитаза А 105.57.14.3 с нижней подводкой,890 ₽,2 отзыва,"12 мая доставит Ozon, продавец Пашино - Перекресток",https://www.ozon.ru/product/armatura-dlya-bachka-unitaza-a-105-57-14-3-s-nizhney-podvodkoy-501088896/?asb=5Eu8oSWqNBcrZ6XD055HtX65PBEsv6wSzkLKmaD4tGA%253D&asb2=PUvYmGqvrnSpQhXDQbIqZRwynQPsRZXJNyFqrI1zIzeKNFrDAO0pXvct88m22x9L
Мягкий чехол для стульчака Зеленый,199 ₽,1 отзыв,"8 мая доставит Ozon, продавец SeeWay",https://www.ozon.ru/product/myagkiy-chehol-dlya-stulchaka-zelenyy-522423002/?asb=WSoUhQg%252FV86UPGVeuBGCDSfOKfbK7AFq9OLjpL%252Fu4R0%253D&asb2=zfnEb6P3E3QS5ej3i0o7A28JimZJ7VxJxfMp0siqaFQYY_cIpSKRVw-lJxpbcq1y
Донный клапан,714 ₽,2 отзыва,"8 мая доставит Ozon, продавец Сион-Групп(ZG)",https://www.ozon.ru/product/donnyy-klapan-240919391/?asb=gCDQwCEDRC2t%252BfhXWTqzgOmax8q%252BD2yGDjPxpu37IKgJkYrWJTqqrRBP6576EkeY&asb2=PQUBj6pMN6zSyjNKxgR4alIixS2vqS4xxUYZbFZKmnii4JG8FvFGzqdteox5ePMb-iSr6ATFnWkjhux5WyFOJ8LZv58juCRFBNx3Uy3ijwjxu9Pg4cd0K6knRfwsss_Sphe9OCFKipE1qE5b2oAuVQ
Крышка для унитаза Bath Plus пластик КИТ,872 ₽,29 отзывов,"8 мая доставит Ozon, продавец ТД АРГУМЕНТ",https://www.ozon.ru/product/kryshka-dlya-unitaza-bath-plus-plastik-kit-464344524/?asb=s6a8TC3Q3dVuzAhkBO6NHQB9bHULKrTBnBIYtF2GlR0%253D&asb2=G0RenB1V9p-5eHVVlr15-cRqLqxuLhl6SjFieSghdjbES43tpSsiG1zRsPRRth4O
Манжета эксцентриковая для унитаза Ани Пласт W0410,323 ₽,1 отзыв,"8 мая доставит Ozon, продавец Твой СтройМаркет",https://www.ozon.ru/product/manzheta-ekstsentrikovaya-dlya-unitaza-ani-plast-w0410-229097523/?asb=cW8%252FBeMUU%252BMrdrBTTlnd%252B57faPOvcoG0khlsZHyLxrI%253D&asb2=KTB7ld1F47r5A8MNLz7zdpXUkFOP0wU3m3WuAZ6KqB7WZeIMrmQCw-3kKYKCgH9j
"Набор стопперов для сиденья унитаза, 5 шт",734 ₽,2 отзыва,"10 мая доставит Ozon, продавец Dimart",https://www.ozon.ru/product/nabor-stopperov-dlya-sidenya-unitaza-5-sht-307169801/?asb=d3%252F4oQlHoepqvlYD3lldHAh1eFzkrPyVKQHsbSSoAac%253D&asb2=KQsDXRw4CPo2Sc-Ol_d7wOS-VNSLVxL1k6kPpHHcVBPfoxVI7iyo9b8E4NMrQTXV
"Чехол на сиденье для унитаза на липучках Лёгкость , 35x39 см, цвет МИКС",616 ₽,1 отзыв,"10 мая доставит Ozon, продавец РусЭкспресс",https://www.ozon.ru/product/chehol-na-sidene-dlya-unitaza-na-lipuchkah-legkost-35x39-sm-tsvet-miks-464950790/?asb=Yvtiyjc2PdBwb1S6yWxepYTqoRt8dEvOGAAH65M%252BpDE%253D&asb2=bC7UIXnn3lJ4TLC9yIW4kW1rc_1BiZERnQ9XUKGHs0IG1xY3V2baGcWhYUzlTv7R
Розетка для трубы белая 110 мм,474 ₽,1 отзыв,"Послезавтра доставит Ozon, продавец ФАЗА. ВСЁ ДЛЯ ДОМА, РЕМОНТА И СТРОИТЕЛЬСТВА",https://www.ozon.ru/product/rozetka-dlya-truby-belaya-110-mm-307993831/?asb=R8HsF1%252Bz5VYn70vaVnonf2n9qFR%252Fk6OLXPHOBMlc%252FKOtEkR5Kpau0OXeUt5fS%252FzE&asb2=skJG68QEhoT8ObwjB9wPc8FxMOIjXMzOHqUBOvxdz0a-7eBhHIO_GEWbQRDkWYzOjWTVoRMXdHydu-OGBzldBaXy3yooUsk_tfkbiSAUGSaVfCtuHZ1fgVlAsj-Ry5-zKmuHmfvcZpzwiMPtiiFMKg
Мягкий чехол для стульчака Коричневый,199 ₽,1 отзыв,"8 мая доставит Ozon, продавец SeeWay",https://www.ozon.ru/product/myagkiy-chehol-dlya-stulchaka-korichnevyy-522380773/?asb=42ORj64w0I6GPIKjg2rt%252BS1Odtx%252B4l1dMDE8rDW4qR0%253D&asb2=nZswbrORxDGCWCq-w4gBw_RYBcNt-MBPAyQfsYTZGsDkDRN25BE7DIk347oe8YX5
"Фильтр косой 1/2"" в/в НИКЕЛЬ",525 ₽,2 отзыва,"9 мая доставит Ozon, продавец -VIEIR-",https://www.ozon.ru/product/filtr-kosoy-1-2-v-v-nikel-334530880/?asb=FZ05mt7%252FB9DHsrWQEAqOh1dUcVXW3Qyhhwchk9Cz5%252Bw4MObZxpq77KvdA1RVgdbw&asb2=j4FR5bm3YlMPaZ0IqhWWNT-zwAyJdc-zQBlORA4ROvRe3GkOW8ti63devy7B8Gn_X8bGnuy7oSsasVZB6d_o-c-tBXHXh-YrMAJ119TwTd7FNsw7Izf8EclQaTdwXZqU_Laq3mbhECeSeOHzuxBurg
"Регулирующий клапан угловой FM 1/2""",579 ₽,7 отзывов,Послезавтра доставит продавец itemcity.ru,https://www.ozon.ru/product/reguliruyushchiy-klapan-uglovoy-fm-1-2-303328637/?asb=AbbNRJq8kz0qDderL0BY9Lip09EJ9m9EDEJ3shNQax4%253D&asb2=OfHXSlIPH5_Ah4deys_bWmmHPzWQpzNfd_meiVn6aLeJxXziq5oM3XEg7jkUJo5s
RBull Подсветка для унитаза с датчиком движения,511 ₽,8 отзывов,"8 мая доставит Ozon, продавец RBULL",https://www.ozon.ru/product/rbull-podsvetka-dlya-unitaza-s-datchikom-dvizheniya-302479970/?asb=1WnDrOsX4qXZZLFCIX4CcSJQ%252B%252BLtbE5A5%252BMmRarNwL8I%252BTisInmxyfrPopM6oFI6&asb2=vyfcRXA-nWmL9MgRFZplAWA3k54HxDBbzah2rj4w4evYCgTuE9J5hiN60mIj04i6t5J0HTVU9nPDEQVwqCp4I2G4nUP598u_GVl3cXNa4w23kKoLojzcmcD16dvoJKUCLOYcbmf-PkHXG9V2vZV8uQ
Сидение для унитаза пластиковое фотопринт HD.05.2036,670 ₽,10 отзывов,"8 мая доставит Ozon, продавец Home Decor",https://www.ozon.ru/product/sidenie-dlya-unitaza-plastikovoe-fotoprint-hd-05-2036-415255321/?asb=vH%252BweEIZoCSTA2kTEvKecSXzNEJ6Ut1nLvW%252Bi6yGGWI%253D&asb2=oMkP_DInBv6cI-ZDu7iDywbVCuG0SGgUD7ueSGQKJn2d7rs7eZ2unGYxsCf51nQc
Донный клапан,816 ₽,2 отзыва,"8 мая доставит Ozon, продавец Сион-Групп(ZG)",https://www.ozon.ru/product/donnyy-klapan-240919360/?asb=k44p1am%252FATHQ2A8k3B07dEP9E9NiF%252BPTLT2nupr81s%252BoU5EQgfgIXJeVQIaOoWxo&asb2=35pfZ88uPcXZc4pt-H-jIBAHeiSUrJCvTMoMYgTZ39Btg5cpMhfmRVRPtoVmsGeZ8swUqFfH-dej3FAt4q97ojWl6OT3k-rhCS75oq6MbjbXLA_PGg8p9cx9WMmhVv_hyamcLVdIP5Ciq6QTR8m6rA
