"Сиденье для унитаза с крышкой, белое, АНИ Пласт",849 ₽,11 отзывов,"8 мая доставит Ozon, продавец Intel-eco",https://www.ozon.ru/product/sidene-dlya-unitaza-s-kryshkoy-beloe-ani-plast-204165617/?asb=TEvdAhegK1v3pffW48pBZegXLRZCfQqCP%252F8%252FaPgg3MiykN75x3W7MqnQmp1yXW85&asb2=Kp0RIZ0Rf6sdUwYTP7-UjkQKpCsEDCUWT0bFa_FfQkvr5ev_9yMTtzgKyLRjlw3rLZHFrFLqe7l5YbnMdxkmbM9ajd-VMHcE-Jj86X0THkvC3KfS9sBz4LQw5R_c7N0pf77RJWtlMrHI0vLOz3WKuA
"Cиденье для унитаза, тёплый чехол на сиденье унитаза бежевый",240 ₽,160 отзывов,"Завтра доставит Ozon, продавец ИП Кочетков А.А.",https://www.ozon.ru/product/cidene-dlya-unitaza-teplyy-chehol-na-sidene-unitaza-bezhevyy-523085116/?asb=IIy1%252BnXb%252BcbAHJanMAVw3D9xDLtbg%252BBjBxo3HBAnO%252FM%253D&asb2=-sYfnqH51KnrjucsOx_XgHcdDawZyKdITOba-u-EPwhIy3NOlvtLZ46aDtRwP7xB
"Сиденье для унитаза мягкое с крышкой ""Ромашки и бабочки"", белая основа",887 ₽,2 отзыва,"11 мая доставит Ozon, продавец Exstra",https://www.ozon.ru/product/sidene-dlya-unitaza-myagkoe-s-kryshkoy-romashki-i-babochki-belaya-osnova-370851609/?asb=e1VNJ7g30ajSrKfyIMyPU9gte4L6EBLzozgXFrmrJX0%253D&asb2=0ZaFMsMgMKOjRAb7K4iZTAgVHfpw-ma5V-IzmDsUH49aHKuAL0Q4mK7j0aNyrvxj
"Cиденье для унитаза, тёплый чехол на сиденье унитаза серо-голубое",250 ₽,160 отзывов,"Завтра доставит Ozon, продавец ИП Кочетков А.А.",https://www.ozon.ru/product/cidene-dlya-unitaza-teplyy-chehol-na-sidene-unitaza-sero-goluboe-476850945/?asb=%252B%252F2qtSLzviVIMUlDo%252FAY%252F0yvXn26aQD1JgtWqs3r2sg%253D&asb2=smw_uZb2Wq1k_T_GVfK9asrZfzW1FQsWiOJjxHcq06WO2nZZuI-qw-bBJOLvJxO4
Прокладка универсальная для инсталляции / навесного / подвесного унитаза,418 ₽,3 отзыва,"8 мая доставит Ozon, продавец ASM-Market",https://www.ozon.ru/product/prokladka-universalnaya-dlya-installyatsii-navesnogo-podvesnogo-unitaza-524286719/?asb=a41DPFgWMl1y0whfLHRPSfYKItN5wxFGzoKreBRb1rA%253D&asb2=6rX-_Zx0ebOHRaPJ8emCS7qlk60kggegd2qiys_iBB6tHZGIUFYFlG-I6D1ojzxf
Гигиеническая лейка Kaiser LH-033 Хром,750 ₽,11 отзывов,"Послезавтра доставит Ozon, продавец SantehSeller",https://www.ozon.ru/product/gigienicheskaya-leyka-kaiser-lh-033-hrom-211436701/?asb=49iUtpCzuyr2ZxGGMaPKsl8bDAyGyrRfiMZdMy4rVds%253D&asb2=uRNhsp9p83-8NNaKTHYM5ock_id-6vlNvsiifQj86njp2uJlB9VF6IH6hxmGlEhg
"Крышка унитаза ""Декор"" ""Ракушки на песке"" белая РП-813",611 ₽,32 отзыва,"11 мая доставит Ozon, продавец Донхозторг",https://www.ozon.ru/product/kryshka-unitaza-dekor-rakushki-na-peske-belaya-rp-813-396313898/?asb=qKcz4StzjSn%252Bqe3ZS0gwJSwZroArFRu2uS48E9s6YBricBVW0hwIlt%252BIPW1%252B0wwq&asb2=85w8IUaX31rbipmvh4E070IW3K7HXvbywnArhm1e6aBx7Y2CFoECP7B8lAXF47DRDUX9SNt_LC2UQhglP4aDCibsCMYptoKaARmM_dosAube85lPboeLQhR4mEQralJRCUy7TX3v4UDqA1fkmhqmGg
груша с резиновой гайкой (под мет втулку ) г ТУЛА,309 ₽,1 отзыв,"9 мая доставит Ozon, продавец AqueProm",https://www.ozon.ru/product/grusha-s-rezinovoy-gaykoy-pod-met-vtulku-g-tula-503433228/?asb=qux1dU%252BTs327GwSkFrFORX5dwgaSwdsj5OwDRIdazJE%253D&asb2=njIEudg8ke7dgTd8LbpaQvPpGT3eTOV9UxzEtS1FdKf4s45PIa4cRZEj3EBZS44t
"Ask Gecko Накладки на сиденье унитаза с клейким основанием, Чехол на сиденье унитаза, Накладки на стульчак",148 ₽,1 отзыв,"8 мая доставит Ozon, продавец Sheldi",https://www.ozon.ru/product/ask-gecko-nakladki-na-sidene-unitaza-s-kleykim-osnovaniem-chehol-na-sidene-unitaza-nakladki-555010269/?asb=4A258CCdt7lZDdytjSyMmGMgfNVyFnQvM6udDq3rMkVTBLtPJcE%252BBQoi0zMNmkts&asb2=7LbmZmUbEKptwnxHorF1TcLk3DngPcgMxKjs_EE86dVNG66CsgbBkuyGRLeGyPxWGQKWT0Tl8YGSvdbejIDkIhog6facIi2Y7BJFyrKk-ME7Ptnd_EVWzGQCNHvpJQrJy6TdGWM4h7RE4UC-5jUNZg
Гигиеническая лейка/ Лейка для биле Hansen H6012 Хром,744 ₽,1 отзыв,"Послезавтра доставит Ozon, продавец Sanshop24",https://www.ozon.ru/product/gigienicheskaya-leyka-leyka-dlya-bile-hansen-h6012-hrom-536183982/?asb=ZbQH%252BJogrVcd971nS5es141rL7c7UxzU5h806EJn1G8%253D&asb2=jap7WnFq8tcFHB-ze7Ck0-1gMJFIRbO117iqY0wLCZOJNOi1O6CI2tiRouVjwZ8z
"Сиденье для унитаза, мягкий чехол на унитаз, чехол на стульчак",243 ₽,6 отзывов,"Завтра доставит Ozon, продавец ИП Шихалеев А.В.",https://www.ozon.ru/product/sidene-dlya-unitaza-myagkiy-chehol-na-unitaz-chehol-na-stulchak-477456228/?asb=GwNrWPlzgh2b%252Bh8dViJ62bzHyOgd1PoqqBx3HJ6RRjA%253D&asb2=cPetimMrxCYlEm0unV5eXvZ9QtmJLAyqP93EP8MW4TGguHRLGAPIaOpOsPlj_ChR
Накладка на унитаз для ребенка 35x30 см зоопарк / Сиденье адаптер для унитаза детский / Сидушка для унитаза детская мягкая / Детское сиденье - накладка на унитаз / Горшок детский,645 ₽,2 отзыва,"Завтра доставит Ozon, продавец Беговелы и самокаты",https://www.ozon.ru/product/nakladka-na-unitaz-dlya-rebenka-35x30-sm-zoopark-sidene-adapter-dlya-unitaza-detskiy-sidushka-dlya-500571121/?asb=8iKgIEZE9u%252BCWCDz41pNX8aCm1d9T3QMgogWib04lsronQr8jfmtWwZsrHISwIm8&asb2=Gay7PzMEnNdU3fojarLd--GPAt42RvZZzuy-UHl4mn1zLIpIFAzHlIhaOH5EzZ92OCzZNuIWpKjWJVVQPKPzXP87rbCREQPNq46K5PMW06h-ZXBRbYBV8xVEbR4C5sr36_8_hlajKnLG_X4-xPVnSw
Теплый туалет накладка многоразовая бархатная blue,405 ₽,41 отзыв,"Завтра доставит Ozon, продавец Везде удобно!",https://www.ozon.ru/product/teplyy-tualet-nakladka-mnogorazovaya-barhatnaya-blue-176759399/?asb=%252F%252F9crevGFxHVkkXUAQtvKi%252Fbmray7bKj9d7bAzVM02c%253D&asb2=y1zeyCd1cYpTaL30GbVfhxVEXs4RygdLnzooWvyXW5gORZylSFMbAluVNcn3rBoZ
"Подсветка для унитаза с датчиком движения и освещенности, 8 цветов",395 ₽,3 отзыва,"Послезавтра доставит Ozon, продавец Sweet Home",https://www.ozon.ru/product/podsvetka-dlya-unitaza-s-datchikom-dvizheniya-i-osveshchennosti-8-tsvetov-536722658/?asb=RtE7WSjIcQPIrPizdcO1NvzaxLhQueHJCZe%252F3HenH7M%253D&asb2=2ePkVOBRCMvIw9nAbnT8W47CfIgy34MR4SrC6oGeyV5xW5WkkEelEEV3eYveKwJo
"Сиденье для унитаза, сиденье для санузла",543 ₽,13 отзывов,"8 мая доставит Ozon, продавец ИП Свирин Андрей Андреевич",https://www.ozon.ru/product/sidene-dlya-unitaza-sidene-dlya-sanuzla-288607174/?asb=dqidKaSrIh9NIwiVJpecP9Bqx%252BOmiEEEOpwBvEp7UqkqCpggphp9uRxSEB%252BYKSUc&asb2=EnbhtA5VN62_cubg4-M3PIkA7peYM8xsNuPT7VI4anEvJZnTNzgJGgwb-6P4dtwAlTpwnHxuBRN987N0ZWZRWG-TA-ANRTvaHtIVmhz74ZPES2iX5wWdrC4QSza7WtZcxamNMmyMTBEIKtCoaFIevQ
Подключение для душевого шланга Lemark LM8086С встраиваемое,431 ₽,2 отзыва,"Завтра доставит Ozon, продавец LEMARK",https://www.ozon.ru/product/podklyuchenie-dlya-dushevogo-shlanga-lemark-lm8086s-vstraivaemoe-215369139/?asb=VX%252BXeW51LyC9GcAxi513lzGEQbK%252FOuP7VvMV3l1zUOo%253D&asb2=Qx4Gln5cImUj2qnPXTV9Vx8tgEmIAer_szzHVStdnAmsrXMSLVStKG1lbcRtKFy6
"Лейка смеситель для душа с вентилятором и фильтром, синяя",999 ₽,5 отзывов,"9 мая доставит Ozon, продавец ИП Гайворонский",https://www.ozon.ru/product/leyka-smesitel-dlya-dusha-s-ventilyatorom-i-filtrom-sinyaya-448443547/?asb=eOh%252B1HUwF6HtpvvI0OusJWOgQSbRp7G2maj4iBPAAMU%253D&asb2=jwQgY7Q0medPrswuvyrkT6Lw57Ut2PwD9PFe9lisSJr2559zYKIdnSXyltY3YhUd
"ИнкоЭр Сиденье для унитаза ""Каскад"" белый, полипропилен.",746 ₽,6 отзывов,"8 мая доставит Ozon, продавец GBArt",https://www.ozon.ru/product/inkoer-sidene-dlya-unitaza-kaskad-belyy-polipropilen-282840976/?asb=UXWjQjzDI0fNlkW1TM2uRV4O7S7d6DqP%252BWPhBtDBz3nnWiN2s7TnGnl3Zj63VTw9&asb2=2MOSXJzH6ldu0BYyYtIxW57ILcurwdIdqdqbAEs1jpzUZ_E_-S4APt_Ai5H5Z4EdzPyMicL6ZV9Vg3ADP186I3YN77Rn0O3Zfw_-tl4yvpxqECJdtrY_Kqm15vHyBncTmG3ZwISAS_b_BhdZuBpw8Q
"Сиденье для унитаза Santek ""Лига"" 1.WH30.2.199 СУ-68.07.80 (полипропилен/пластиковые крепления)",974 ₽,1 отзыв,"8 мая доставит Ozon, продавец САНИНВЕСТ",https://www.ozon.ru/product/sidene-dlya-unitaza-santek-liga-1-wh30-2-199-su-68-07-80-polipropilen-plastikovye-krepleniya-342306598/?asb=mCtag1T5Yv3wisH2z0HUEvKNEZhlKac%252FyJy8dIKilcI%253D&asb2=EUa1zYzmPm5XW1ZtB6zgVCV7PGAFwsuHk07ukr31D2jVyS5InBTLCKnjRtdLQaVp
"Поплавковый клапан для БОЧКИ 3/4"" (комплект, без шара) ЛАТУНЬ",802 ₽,20 отзывов,"9 мая доставит Ozon, продавец -VIEIR-",https://www.ozon.ru/product/poplavkovyy-klapan-dlya-bochki-3-4-komplekt-bez-shara-latun-271368391/?asb=Nx5BJ78xPauEqWJypNlZhwSPgHf5v%252B2IypPY9wInw8IkuCgoc3nk63zjDFjS1e5l&asb2=CEB5vPd-7xg2LHVGkKIr6PlYx-eePHi6D5As8b1mBATahPIr85T45R1PKKNWIx8tEyiHMOLjZiin015rEoEt6JMmLf_i-CGE-ML4SL_2b1S1XOx6hQnH7ZSiB5jEhuSPc0G0nlpe0tPh1rYqIiWyhw
Оригинальная подсветка для унитаза 8 цветов с датчиком движения и освещенности,524 ₽,30 отзывов,"Завтра доставит Ozon, продавец Mirus Group",https://www.ozon.ru/product/originalnaya-podsvetka-dlya-unitaza-8-tsvetov-s-datchikom-dvizheniya-i-osveshchennosti-214525139/?asb=1aqueKFNWns9Tp3Y18GAYJf3qh72jeD%252B6kV227dQpWE%253D&asb2=2TkJYdQ0R1WZabfhPsUZ8PMl2N5BDmUfgWs0uR4dnWyE8pVJAnAp9cu3WqE1QLu5
"Сиденье жесткое, белое, пластик",797 ₽,1 отзыв,"11 мая доставит Ozon, продавец Exstra",https://www.ozon.ru/product/sidene-zhestkoe-beloe-plastik-369371299/?asb=HDmfgVn1n5S%252BAiTh%252FrUtcTYfzTmL0Del2T1HnYDA0b4%253D&asb2=N2db2DxyfC6tDQeC0FSI9X7GcLCffpfdyNUHitxB4rZSKeBlK9do2g9priI-CABx
"Мягкий чехол на унитаз, накладка для ободка унитаза на молнии, бежевый",445 ₽,116 отзывов,"Завтра доставит Ozon, продавец Proffthings",https://www.ozon.ru/product/myagkiy-chehol-na-unitaz-nakladka-dlya-obodka-unitaza-na-molnii-bezhevyy-370063507/?asb=hudpK8KZ6JU4Al8Qi3zYr9D2DAOQf79HyYONlYHPoKY%253D&asb2=mrShTQlR2QxB5Vd0Vx2SaTN6PIhtAoSxdV-1OdXKrxEjppavvpJEdAt-bMmTLhnt
Сифон для стиральной машины AlcaPlast APS3,710 ₽,3 отзыва,"Завтра доставит Ozon, продавец TOPSAN",https://www.ozon.ru/product/sifon-dlya-stiralnoy-mashiny-alcaplast-aps3-202197168/?asb=c5Dhq7w1UM6S0Bnzs89ZcnDVXgs6sK%252FSt9Dl%252BoNc4DRRlX1m85Mw%252FPQBjc86MiEM&asb2=SvMGtxQehI-Cmbj8Li-jaRJABqcr0i43xaTXJOEZoViWdGRvGbF3o5atY8dUsMPBOkZMJ2HE2W1LOfXJ6VTAT1jCU79bzgP8h6Q5OKvTk5BYD3HxnrKpG2GrnBAK7aqsbRxETQoMql1Mrh-pdkKbJw
"Сиденье для унитаза, цвет:белый",689 ₽,1 отзыв,"11 мая доставит Ozon, продавец SellerShop",https://www.ozon.ru/product/sidene-dlya-unitaza-tsvet-belyy-402831684/?asb=n1Ye%252F5nHoieoULwckPjrwkaxF384gc%252BEOmR%252FDU4JfoI%253D&asb2=dxHCmTHQIVahucEbOTREM0p0CbsXSedcpFKJVKEnylA2TdKiaDj63ZULkPIyxUtr
Лейка гигиеническая BRIMIX для биде.ХРОМИРОВАННАЯ.,400 ₽,5 отзывов,"11 мая доставит Ozon, продавец САНАКС",https://www.ozon.ru/product/leyka-gigienicheskaya-brimix-dlya-bide-hromirovannaya-302272062/?asb=h7t7S6a1ATSElqIqd%252BUaWbJoR6Xf6EPqOstZAfN%252F%252BC0%253D&asb2=uGJqTCspV-nvMjA1UvK6mVnZeyRJpM7qQDDqJPXzQ95LDEBWqVnnYaH1OLzBSnBd
Лейка гигиеническая Oute TH109,826 ₽,5 отзывов,"Завтра доставит Ozon, продавец Сантема",https://www.ozon.ru/product/leyka-gigienicheskaya-oute-th109-175028095/?asb=158%252BWa9aW%252FSDnDiCvNmq7GreKVQU0k5RRgH0CVn8AVfehGBXLbCniX71BicunWZH&asb2=Xv_k-lh3dwrmRw_gP-lb6SReIq6OGMItHTca-5c8gp8UInuv1tOQKWh1DbJD8KSaWqIfCEw5lvAdrZWK-lqPq8DV31uDmC9uNOLwTq_5Tn73TEl-rLs4Qp8JB7Lg3DYuCD6ZxU3kgQUUzjr3oPrMkA
"Сиденье на унитаз ""Ракушка"" бежевая РП-812",547 ₽,32 отзыва,"11 мая доставит Ozon, продавец Донхозторг",https://www.ozon.ru/product/sidene-na-unitaz-rakushka-bezhevaya-rp-812-397235831/?asb=LheU0QHLBuCX9C6pn6o%252B%252FdPJ8%252B%252FM5U3%252FxOQU0wdfZ%252BaSUp3xznbSBIzdcOc%252F2bxV&asb2=OtA2uemnbJnal3XkcJFirdMR-yWtlvTP9KKU69Nr7XrPb60Tdn_TypW3S-yPqXKAw_FERGDfK2Dk4Y_taA8EmMmRkE8HwBkOxy0aXyyN9pp1aMY9tm3UGFFRcq2sEIORXLGcBrcfKvDs9U05DGEVWw
Клапан для трапа механический 40/50 мм,598 ₽,77 отзывов,"Завтра доставит Ozon, продавец Vidage",https://www.ozon.ru/product/klapan-dlya-trapa-mehanicheskiy-40-50-mm-351659811/?asb=XWDyVVfBbNvBP8HhwisOJfckmAQ2oAhdRglKVy5oFQ4%253D&asb2=-9lW02L4yKiZUNU45CMcuFEzbpb7jlKglL1JWZlM0N4CpAWcKBMUlF8V5Ndt_4-6
Донный клапан кнопочный с гофрой для душевой кабины (click-clack),540 ₽,14 отзывов,"8 мая доставит Ozon, продавец UDGEE",https://www.ozon.ru/product/donnyy-klapan-knopochnyy-s-gofroy-dlya-dushevoy-kabiny-click-clack-257321873/?asb=HhEVM%252F9OPLoL%252FD8Zsuz5o82srvoTyGQruWfhThl6keEkrAhia5WkOKWLR4zU9ztF&asb2=NB7gAZ3eMr-KN-aaJMMF3i22qX765erlhJXw127vqHO88EEjTJcbubSIXP_5pYmFSkHKgaqPR1kdDUgp48_wFrvsSk2p0pdd-UPEwct1QgOrr8O8U9MErVBc_maMr7wfEYSaQUoUozjloQxrri4T8w
WIRQUIN Сифон для раковины гофрированный 1 1/4х32/40 мм L800 мм,335 ₽,12 отзывов,"Завтра доставит Ozon, продавец GBArt",https://www.ozon.ru/product/wirquin-sifon-dlya-rakoviny-gofrirovannyy-1-1-4h32-40-mm-l800-mm-178057286/?asb=b11EnSOHXFMVp7Jt6qyVmllVl9%252Fzh%252FicaBPfVI4u9rkCQJi62M78u4jBAvuL3GTS&asb2=LNsJKE2Ahb9gEEa9eQwcKAikJQr3HJK0rVO22B2v6gnqp7s3gJQF9gs_n8Am6bxgzFfj-_LuLVAW6mMjoO8Jq-eFg1TCbN3Ve9NFUVwBfRPDexEEyjWCcgcjq_judblLILU_7SGF40ouzPwil7VF9Q
Лейка DEVIDA гигиеническая из ABS в комплекте с пристенным кронштейном,374 ₽,3 отзыва,"9 мая доставит Ozon, продавец ООО ""САНТИМ-СТОЛИЦА",https://www.ozon.ru/product/leyka-devida-gigienicheskaya-iz-abs-v-komplekte-s-pristennym-kronshteynom-439386664/?asb=dG4H3wzVZ0K8yTB157CXHgNyykO6JSAIZQgVectiIew%253D&asb2=oHDxutHuVOlmDOBn-AD9yzLx33d913yxfqgHvwYEo10E0qsW_e4CQgLec5j7c1mB
"Сиденье для унитаза с крышкой, цвет снежно-белый",846 ₽,1 отзыв,"10 мая доставит Ozon, продавец ХозТорг",https://www.ozon.ru/product/sidene-dlya-unitaza-s-kryshkoy-tsvet-snezhno-belyy-279035238/?asb=NJR%252BMl%252B86q4EwpT3TVc%252B0phXH6PV3iIFMf0fO2mJJH4%253D&asb2=h2Um6jZA4lzjiosL4eFC7BOwPcLMzC3_aRPR3llUJmYZn3uRLWLmd83xy2W42osa
"Orange HS001cr Гигиенический душ, хром",490 ₽,1 отзыв,"8 мая доставит Ozon, продавец Orange Mixers",https://www.ozon.ru/product/orange-hs001cr-gigienicheskiy-dush-hrom-420699154/?asb=KG1mWjnzveFFzepdbQXTpAIDPndnnNNFOIDg09QrNZNCzd5ApPHS3b2bc3xu2ImX&asb2=vzpi19MMOyBkLgak2ILcWJ1tMwiwlo9VjZNN9Bu8fcHB_m8VrQXwI5-3mwfzU3odNslk2sva6i6wgYxlg9uHaimVEv3OIcbWihravbAmOgyh2R2EqVA8qh8acGO2dGQOIAqjPWxxYFfYq5t6ds4lhw
"Картридж для смесителя 40 мм / Картридж керамический / для одноручкового смесителя, Juguni 0402.100 ТЗС",240 ₽,2 отзыва,"8 мая доставит Ozon, продавец ТК Торгзнаксервис",https://www.ozon.ru/product/kartridzh-dlya-smesitelya-40-mm-kartridzh-keramicheskiy-dlya-odnoruchkovogo-smesitelya-juguni-0402-410308337/?asb=gamRiwTcix9E%252B7YqTfQaMQjcnRW32W9jlTXrLSBR8Ok%253D&asb2=xR5psHLZcYQtjBsqzdRDFPgZr6mVDvOt3v_ZwXKWGZRyV0kOaJpCdO_Oye8wYbt1
"Термостатический клапан для радиатора угловой 3/4""",985 ₽,18 отзывов,"Завтра доставит Ozon, продавец itemcity.ru",https://www.ozon.ru/product/termostaticheskiy-klapan-dlya-radiatora-uglovoy-3-4-303774872/?asb=rFkaLKZivksChN3I2OxdDfDzqjdE6%252Bm5Fn7Qnoev8U8%253D&asb2=3aXKO-bPvRDdkEl5W31DHIYHeNeqIswK98hCSseVTJ6ey2VSSJ9jhbA9tCryMNJX
Сиденье для унитаза 44x36.5x3 см мягкое Libero фиолетовое,894 ₽,15 отзывов,"9 мая доставит Ozon, продавец SANRIKS",https://www.ozon.ru/product/sidene-dlya-unitaza-44x36-5x3-sm-myagkoe-libero-fioletovoe-200525472/?asb=yVTdRLpUcwAIEeCjOD2crK1qVn7nMEoSl6dvZlbb10Q%253D&asb2=71CfgjhvETDJ2q5-ok3lO_MNQ7GSf5AX9D2U622A_WatP1vdDOgWDgNO_6dn_Qgu
"Кран шаровой Stout, полнопроходной, с ""американкой"", ВР/НР, ручка бабочка 1/2",718 ₽,7 отзывов,"8 мая доставит Ozon, продавец skladsantex.ru",https://www.ozon.ru/product/kran-sharovoy-stout-polnoprohodnoy-s-amerikankoy-vr-nr-ruchka-babochka-1-2-324803986/?asb=pVoXFbE6fTb61ignhqw7aalucqnPK3J7yXPDBoJ%252B3R3ha8kdD%252BTFqy6N5vKfCAIU&asb2=3i-Ie6mO4D0ePScTWM_dXB0O_0D8eqX1tveqPmwa0290hXgEHcHZNDOx98e1sm1S8gg-QvqeaYTcYqixmIUm-fgJyCw3a1P6oYpfn_WIwkryafxEFKEzXGkp52aMtyLw_EYTCcjCmhAwhLmA269u5Q
"Арматура для бачка кнопочная (1 режим, универсальный сливной кноп. клапан, боковой подвов)",670 ₽,5 отзывов,"Завтра доставит Ozon, продавец MasterProf / MPF",https://www.ozon.ru/product/armatura-dlya-bachka-knopochnaya-1-rezhim-universalnyy-slivnoy-knop-klapan-bokovoy-podvov-400803805/?asb=lW33IZXNVyEMzuAlQeTd4NeC%252BYH7%252FVWyYiCjfpl5RlU%253D&asb2=zH0uS11whNXsSxrV5Lnb_I63Yr3VfxJjIxoLzfMDvL7wOEgWzYf_1dyLwREnYDtw
"Светильник ночник-проектор ""Звездное небо"" вращающийся, фиолетовый / Ночник детский / Ночник-проектор ""Звездного неба"" / Детский ночник / Ночник детский для сна / Ночной светильник проектор / Светильник детский ночник / Ночник / Ночник в розетку",679 ₽,64 отзыва,"Завтра доставит Ozon, продавец Best Market",https://www.ozon.ru/product/svetilnik-nochnik-proektor-zvezdnoe-nebo-vrashchayushchiysya-fioletovyy-nochnik-detskiy-389926926/?asb=PWtvmriw0w2qIogvA1hT6C6ZCncNhQnuqZ%252FAK4GmuJDcM9fUL7nbf1jYeVpeBYhU&asb2=HKC_0d-wshAr-40zUnF_oUVUKfZeFYaRcMwRHkPoWn8F0oBUvGcwt3d3nw4lBuejRcUvTsSCtXEWBqu-KBoFpDiXchyI252e8ZkT3nmizaLc1ANfuwV4PcPfxPUiXmwfD535ikUtEnVwGz4eL09VNA
Арматура спускная AniPlast WC7040 Шток пластик,401 ₽,8 отзывов,"9 мая доставит Ozon, продавец Сантехлюкс",https://www.ozon.ru/product/armatura-spusknaya-aniplast-wc7040-shtok-plastik-293607517/?asb=T2%252Fe1Lji4sDDXObzLb4Z1AP4St6dP4sp2rtbdZl9E2w%253D&asb2=IYTUPJbqoqu6UXhDuMbBsVFLM-13R8IFzdsGWsu4-xJAfkvymrOj0jhW5BCHhrQH
"Арматура к сливным бачкам АБ 66/110.56, с боковой подводкой, тягой вверх",582 ₽,5 отзывов,"12 мая доставит Ozon, продавец ИП Ильинский Георгий Алексеевич",https://www.ozon.ru/product/armatura-k-slivnym-bachkam-ab-66-110-56-s-bokovoy-podvodkoy-tyagoy-vverh-385787112/?asb=36km4LgD8h8znClDhTyPqL2ZYt9jNjOvijNlaWP2K6M%253D&asb2=QR4QUyanakO9XkayVKOBEmCM3WrRaxrWd4tk6CL52xSaP_RqHl7aLCKoxTVJuruu
Сиденье для унитаза 42.5x37x3 см овальное бирюзовый мрамор Melodia Della Vita,600 ₽,38 отзывов,"9 мая доставит Ozon, продавец SANRIKS",https://www.ozon.ru/product/sidene-dlya-unitaza-42-5x37x3-sm-ovalnoe-biryuzovyy-mramor-melodia-della-vita-200525796/?asb=csSPERRpzpOnExPwJku0NkO5jVuaQXIU3W6HTMNl0jg%253D&asb2=rQojgkaCD5jLRIN3OMGaU3v7YuO0Ugf2qamCXT18HRAiz3S1OuZVRMTQXB_04eE4
Клапан для бачка унитаза с оцинкованной тягой и поплавком /Тула/,288 ₽,5 отзывов,"9 мая доставит Ozon, продавец AqueProm",https://www.ozon.ru/product/klapan-dlya-bachka-unitaza-s-otsinkovannoy-tyagoy-i-poplavkom-tula-501698537/?asb=noPdh13wr93lc6x%252BsT%252BgRR3Ml1ZEPy9YNdeVDn3enz8%253D&asb2=wleLaW4bMMZGKF06Eah4YPeGVlQFMTZtOExY5FCOU6GFl2FwfAfTD8MSuU9ZwD7i
"Врезка для бочки с контргайкой латунная 1/2"" SDF022",445 ₽,4 отзыва,"8 мая доставит Ozon, продавец СантехМаркет",https://www.ozon.ru/product/vrezka-dlya-bochki-s-kontrgaykoy-latunnaya-1-2-sdf022-216259554/?asb=o4xorW94EXR8ziop3jzXe9072%252F57O2aBjs6dW%252B0%252FYnq%252Bvx3miZgAoFFHvMqp3yy9&asb2=fXRQh5XSNdhBs0y7TKeksAXI9hb4mXZzE5nooT8I-e345v6ka36ES67iOQeLyWzuOpNxchMQfH9i0SjqkxFt0juLvcXMwY7DRA_5QxO5l5zcwW6T_apNDacx_g5Wrajir5y90Q9WfIHXLt5JwRGzEQ
Манжета Анипласт W0410 для унитаза эксцентрическая,328 ₽,1 отзыв,"9 мая доставит Ozon, продавец Сантехлюкс",https://www.ozon.ru/product/manzheta-aniplast-w0410-dlya-unitaza-ekstsentricheskaya-321574387/?asb=ukiNbyOgXVTht9swX3Cgn7rY7It0EHU7FaZPLzh9qeE%253D&asb2=BDB_rsTzeFgObYK3KSGkiSrd5xefsnULtihnEGTA5aUm6oUSa2EyJHBMd4yUiQbo
Клапан переключателя смесителя Sirius New Vidima B961634AA (B950256AA11),500 ₽,22 отзыва,"12 мая доставит Ozon, продавец Центр сантехники",https://www.ozon.ru/product/klapan-pereklyuchatelya-smesitelya-sirius-new-vidima-b961634aa-b950256aa11-222592513/?asb=8IwRQVInGNAVTErtS9bAUpbZ8UmXJOIezU9agPwFPQw%253D&asb2=OlJvzZSToV96uECadQVtoRCaqJ5qe0hahaLmtByL0W5zogAsXz-jZhvWMHUbl4xN
"Донный клапан Elghansa WASTE SYSTEMS WBT-121 для раковины с переливом, хром",1 000 ₽,12 отзывов,"Послезавтра доставит Ozon, продавец САНТЕХСТОК",https://www.ozon.ru/product/donnyy-klapan-elghansa-waste-systems-wbt-121-dlya-rakoviny-s-perelivom-hrom-296314165/?asb=C2%252BgD9mfmQNCmLzEArAWnY%252BZrWB5vG18LqlDt0LsXpo%253D&asb2=hJ8QtoROjNpqsT1LdZbK4XRC7Hv2uysN_kVt9CWTaU2WOcERF6DOuWRhL49p0Cqp
"Сиденье для унитаза мягкое голубое ""Мультипласт""",889 ₽,8 отзывов,"9 мая доставит Ozon, продавец ВЕРТИКАЛЬ",https://www.ozon.ru/product/sidene-dlya-unitaza-myagkoe-goluboe-multiplast-327936252/?asb=0%252FMrsYFMKzOpz3dgrcDvC3Tl8UyMX5P1CBROQ4y9JB4%253D&asb2=kwt5Rote-xqoLZVDv2rjPiqHyTPbaQMGOzueRPovLZzdIuTVatGYYGrcV85r2IsO
Подсветка для унитаза с датчиком движения и освещенности / Креативная подсветка в уборную / Подсветка для туалета / Светильник ночник для санузла / Оригинальная LED освещение для унитаза 8 цветов / Аксессуары для ванной комнаты / Товары для дома,349 ₽,7 отзывов,"8 мая доставит Ozon, продавец Sunmix",https://www.ozon.ru/product/podsvetka-dlya-unitaza-s-datchikom-dvizheniya-i-osveshchennosti-kreativnaya-podsvetka-v-484922374/?asb=3M9ko1L9uPkbcBJOvoH9zWkZ6QlyHZhxAQKNEx8V7eg%253D&asb2=_3CKfryjC8MQTlTJvAaPNJFxjdAUmgc3fTwsS0uhHzkbva5GT8zbPztVl4EVY2GH
"Арматура УКЛАД ""68"" А 105.56.14.3 (АБ 68.56.00.3 б/п кн. хром.)",600 ₽,1 отзыв,"9 мая доставит Ozon, продавец ООО Сантехцентр-1",https://www.ozon.ru/product/armatura-uklad-68-a-105-56-14-3-ab-68-56-00-3-b-p-kn-hrom-492788425/?asb=fRW1KHQLPExhRoayL2t03%252B%252BDFVRnaiogfy8oXNKd4vM%253D&asb2=yMnaoLlD04VTLgYUdoVYzf7-tHB5sBKToOoLUQtgTMT0OcJxjrtWkI598Yp_RzI1
Кран шаровый нержавеющий муфтовый Ру 63 AISI 304,730 ₽,2 отзыва,"8 мая доставит Ozon, продавец Армасток",https://www.ozon.ru/product/kran-sharovyy-nerzhaveyushchiy-muftovyy-ru-63-aisi-304-491590758/?asb=olUQ5%252BntG8eRA0W2ESlY6oB2t3IO72jprvokGuLbis8%253D&asb2=IjmsPrw5GYfLjTJqv6hJPWZ6n72_5iAvXmRZEL4igIzBirniCSDaXTfkgGDvvLRS
"Кран игольчатый, нержавеющая сталь, 1/4G мама",990 ₽,8 отзывов,"9 мая доставит Ozon, продавец Дело Вкуса",https://www.ozon.ru/product/kran-igolchatyy-nerzhaveyushchaya-stal-1-4g-mama-305076667/?asb=ir8PNJ2VY15ODb2ValThMgfhZP6F4Y974W4CfbpcnYA%253D&asb2=9Rzi9y5rw1kwRZAoe34_DNIzE5NY7UuPGHaJmGxV9nT-C5ZUFq9NqiYifDOLX-vj
"Cиденье для унитаза, тёплый чехол на сиденье унитаза серый",499 ₽,2 отзыва,"Завтра доставит Ozon, продавец ИП Кочетков А.А.",https://www.ozon.ru/product/cidene-dlya-unitaza-teplyy-chehol-na-sidene-unitaza-seryy-545561719/?asb=74P%252FruAW7hkiJh6d5rgy3vgFSQzIPCjU6Umxjs5jL3I%253D&asb2=4xeDMZWE4uMG4dZZhVSP9iPOxT8ljmqEWmbsPLx0fBB9WpNn1tcECEU0K9ucEB3f
