"Мягкий чехол на унитаз, накладка для ободка унитаза на молнии",445 ₽,116 отзывов,"Завтра доставит Ozon, продавец Proffthings",https://www.ozon.ru/product/myagkiy-chehol-na-unitaz-nakladka-dlya-obodka-unitaza-na-molnii-315582297/?asb=fHS2udMaaQJYl4HkP6TSzwDDoaBq1OgEhL4STuFRiqQ%253D&asb2=Jn5ASlQ0ZAoTyQfTgB4o2LZyAL20flkqsdRNIldb-tZ9A1b1HuZygd3-3bNL3GVP
Универсальный наливной механизм (клапан),990 ₽,1 отзыв,14 мая доставит продавец Сантехмани,https://www.ozon.ru/product/universalnyy-nalivnoy-mehanizm-klapan-300631110/?asb=gapwoymazZ57UOPFDVt30xbbIBo7uXo9apdp%252B7EDnts%253D&asb2=slsuey34oAeQckoA_Bdu1KDU9k1wBf8yH3pjt393mlAVFAJZokqHxU4AMSPrzmID
"Фланец для гидроаккумулятора .оценкованная сталь 1""",619 ₽,1 отзыв,"10 мая доставит Ozon, продавец SANIPRO",https://www.ozon.ru/product/flanets-dlya-gidroakkumulyatora-otsenkovannaya-stal-1-477474340/?asb=ldxV009jExCYVDWm7VHboNaXXMRV%252FhnP7iF9IPmXK7LmcnbuIu70arXBK0NMj%252BNR&asb2=V86GD8Q6_Js9IMPWr1sTAFAhAgV4bzj6_DIsHyZeGzo9BsE65kdEdBBDXju4agK6UcOYszFxw026FGbPkwA7yTh6MJE4ecLsBycBse8NaYXfPIAW1hmDreXMfEhIM_I4wnOnEpNp2PEI-NdVi_6o_w
"Подсветка для унитаза с датчиком движения и датчиком света, ночник в ванную и туалет, 2 штуки в наборе",786 ₽,138 отзывов,"Завтра доставит Ozon, продавец ИП Карпачев",https://www.ozon.ru/product/podsvetka-dlya-unitaza-s-datchikom-dvizheniya-i-datchikom-sveta-nochnik-v-vannuyu-i-tualet-2-shtuki-416562480/?asb=gG5XAzsUi%252BPZuSEF3P23WFrxcqr4R7dCRXkLIoc3dEE%253D&asb2=aBs83-zTfxvmmIAVrDfJCH_1u4ZOeGpTgxuGZawm9--0EVfV5m_b7oH81rZTth1b
Сиденье для унитаза 42.5x37x3 см овальное белое Melodia Della Vita,597 ₽,38 отзывов,"9 мая доставит Ozon, продавец SANRIKS",https://www.ozon.ru/product/sidene-dlya-unitaza-42-5x37x3-sm-ovalnoe-beloe-melodia-della-vita-200525786/?asb=%252BvJyfxs1kBrLYYC5B1WO%252BlpjoaGgLnvXFpIauIpZx6k%253D&asb2=PLyZ_kWE9EEHxmwQnnkDDLYY-49EN3Vm_M5ZnmHuvEr6cKw3XljUF2bC1sLBgFK6
"Арматура Уклад ""77"" (2 кнопки) АБ 77.59.14.3 н/п 2-х кн. Хром с кнопочным двухуровневым клапаном выпуска",800 ₽,1 отзыв,"9 мая доставит Ozon, продавец ООО Сантехцентр-1",https://www.ozon.ru/product/armatura-uklad-77-2-knopki-ab-77-59-14-3-n-p-2-h-kn-hrom-s-knopochnym-dvuhurovnevym-klapanom-vypuska-492913526/?asb=cO9TIz%252Br4qtcr8vQZP%252BUXcH91Boc3C5o4qoL%252FIXJd74%253D&asb2=IE1IqkYrL7ZVlkm3dRmJiXNAVWd3f-zNufzrbXjpQrtv3aGZgNLrcnMg0aPHgsXi
"Теплое сиденье для уличного дачного туалета, ""Дачник"", пенополиуретан",665 ₽,16 отзывов,"9 мая доставит Ozon, продавец RASMART",https://www.ozon.ru/product/teploe-sidene-dlya-ulichnogo-dachnogo-tualeta-dachnik-penopoliuretan-250837328/?asb=MPc8XhaIBwC9IMJzgki%252BFF5u9DDyZ3ralPCjk7ae9ps%253D&asb2=xrE3W1wcwmOGf2cdbIcH2l0_i69LGXGYd4EWCkP0dR73mzAbuKt6Gn3fgez5bEf8
Манжета АниПласт W0420 эксцентриковая,370 ₽,2 отзыва,"9 мая доставит Ozon, продавец Сантехлюкс",https://www.ozon.ru/product/manzheta-aniplast-w0420-ekstsentrikovaya-296100622/?asb=IDm5rlY9ks6xKaSwkX%252FPlGZSGhAIjgZWpTCLmyrP%252F40%253D&asb2=rqWTLVEFuRUWnbFUt8FZYI6c1BeOkPmLB2fpvSkBEpTp6TKEN3slXS-P8KXdCbWi
"ПП Кран д/радиатора d25*3/4"" прям БЕЛ Ростурпласт",490 ₽,1 отзыв,"9 мая доставит Ozon, продавец poryadok",https://www.ozon.ru/product/pp-kran-d-radiatora-d25-3-4-pryam-bel-rosturplast-474002964/?asb=xFB5sAogH0X4YX5cKtdRHRGh0QNnzoxe9k8gjb52lkM%252BXx5Vkx6njI%252BHgSq5UNyx&asb2=SSD4QQQvCy9s74IRttdgkwD8ol7wWubP9PL7-pYDtgf-rF2B3qttoAwZjtNkVLTlaUoaUU6Iec8x4WFe7aL_I0-tbr6mIDu6wpHVtbiy9gJiaWQHwE8Yb4weV-3mAmBIUa0sC10H-rz50fhF8vXomA
"Сиденье для унитаза мягкое S-500 (Подсолнухи) ""Сантис""",809 ₽,70 отзывов,"12 мая доставит Ozon, продавец Индивидуальный предприниматель Латышева Нина",https://www.ozon.ru/product/sidene-dlya-unitaza-myagkoe-s-500-podsolnuhi-santis-194531584/?asb=v27dbiulvibF8x8SnFBrrkmyHzw%252BPqxMFswq6nQKA3o%253D&asb2=pOz9KKbuPXocrA0vct60gK6BSkm4d3UAHA6IUppDVgisEaNY2ILARoKrpVKZg51t
Сиденье для унитаза с крышкой BATH PLUS пластик Белый,806 ₽,29 отзывов,"8 мая доставит Ozon, продавец ТД АРГУМЕНТ",https://www.ozon.ru/product/sidene-dlya-unitaza-s-kryshkoy-bath-plus-plastik-belyy-337593165/?asb=51kGw10TGpMqNp0pUw1EMC4TK3mLfA%252Be7Svy6gerFlk%253D&asb2=mJPOt_8jZnCgZuzFEuNrLhEKwIj13rhpymFQnQmF9f-sPojRcHQ8-eLDvqdPzI2r
Теплый туалет накладка многоразовая бархатная light pink,405 ₽,22 отзыва,"Завтра доставит Ozon, продавец Везде удобно!",https://www.ozon.ru/product/teplyy-tualet-nakladka-mnogorazovaya-barhatnaya-light-pink-185251779/?asb=NulTSANCAAv8dvIpmLp10nUqbJMYef%252BGRSPj1aS5hYI%253D&asb2=HTs5xUpLPz_e8GCKkwNmNMWsMWvQLx2ZP9CIAo3c2Pioxz14dyviFk85oopX3A-w
"Кран шаровой Accoona A473G-4, 1/2""х1/2"" наружная резьба, для бытытовых приборов, угловой, красный",514 ₽,1 отзыв,"Завтра доставит Ozon, продавец Фабрика счастья",https://www.ozon.ru/product/kran-sharovoy-accoona-a473g-4-1-2-h1-2-naruzhnaya-rezba-dlya-bytytovyh-priborov-uglovoy-krasnyy-204221742/?asb=ExmRfy5bLaNqLcVrCyGkaIwxeupzGAJaQ51Ux4Iw%252F%252FM%253D&asb2=Omg7OIrsR07DjY3gxk8HmfUvY66_bIuA6_CwIO2RhqF_Lic8g4ycCNkxnxoj37SM
"Сливная арматура для бачка унитаза АНИ пласт WC7010C однорежимная, хромированная кнопка",789 ₽,1 отзыв,"Завтра доставит Ozon, продавец ANI PLAST",https://www.ozon.ru/product/slivnaya-armatura-dlya-bachka-unitaza-ani-plast-wc7010c-odnorezhimnaya-hromirovannaya-knopka-446130918/?asb=ArmvDZgHbcYohWax5ZOZLA3Bc5IwB1KBvdN2JeMy86w%253D&asb2=-f-iuQyENvKMY2lQDrUeu9wDf1E9sLmXJlffvb0FsyGROGxZgD53bdfgL95JnmXy
Лейка для биде Kaiser LH-033 Chrome,750 ₽,6 отзывов,"8 мая доставит Ozon, продавец ULMAX",https://www.ozon.ru/product/leyka-dlya-bide-kaiser-lh-033-chrome-172699735/?asb=Kyr09M3YiPyq5tVhJrtDrXtpQy4%252Bhdd7gmC6WANeKrQ%253D&asb2=R4_y-y2MzN-vsOY5fk3f9XL_21cpPdLN3_K16RLiyVYrO4rMp51M3RlbofBUCN21
"Сиденье (крышка) для унитаза Ракушка, 44,5x37 см.,+комплект креплений, бежевая",599 ₽,34 отзыва,"8 мая доставит Ozon, продавец Бум Маркет",https://www.ozon.ru/product/sidene-kryshka-dlya-unitaza-rakushka-44-5x37-sm-komplekt-krepleniy-bezhevaya-347729666/?asb=7%252FNwp7NYn%252FY4zMz9VLLCVNRrllhwPPMksBkWC3ggiHk%253D&asb2=W0TxqxZA3OcRLqfftshGzFCTCFAMqVDXacAe1ySOByZxy3g8DZ7sGyIuDHlvls0g
Кран угловой (усиленный) матовый хром 1/2х1/2 Vieir VER33,536 ₽,21 отзыв,"9 мая доставит Ozon, продавец -VIEIR-",https://www.ozon.ru/product/kran-uglovoy-usilennyy-matovyy-hrom-1-2h1-2-vieir-ver33-318582418/?asb=2kn%252BuKjOU9UucX1HDrh3ZMD8pRnl5TzyzxlyFFbMGe1t7hZVYa1TEpRmMgzweBwc&asb2=QUDD4EKehLjLBZEDT9eZ-k1stJ0sSQ57L4aPf5WTudereUXrSHSbzbfXD1oRpyOdHCESlvQnp_ygCoSr6RapYWfQcAXKa-uFBLPVyLYIi2T845i8hC6gagbBj89-8E1FWv5OKjptsNIAsUZEpztbGw
Сиденье для унитаза с крышкой BATH PLUS пластик ПАРУСНИК фотопринт,872 ₽,29 отзывов,"8 мая доставит Ozon, продавец ТД АРГУМЕНТ",https://www.ozon.ru/product/sidene-dlya-unitaza-s-kryshkoy-bath-plus-plastik-parusnik-fotoprint-210639938/?asb=TFqCYK8EEWPpCTlnOmHWNbMr5H6OemmUZWdG1yLg6No%253D&asb2=U8nJwvXJNZfd0o_5L2hYfMBduFaoQ_R2SJMxcuVj1XDL8LCMiDre_TtYhJYoC04V
"Предохранительный клапан 3 бар 1/2"" TIM арт. BL22FF-K-3bar",694 ₽,1 отзыв,"10 мая доставит Ozon, продавец TIM",https://www.ozon.ru/product/predohranitelnyy-klapan-3-bar-1-2-tim-art-bl22ff-k-3bar-182151881/?asb=nXISHPsdIqLy16L3gbfsSlr9L7TFGT7aECvPQWVWCj%252BXa9cIgdq%252F7buFA%252FejqAzL&asb2=XjaX_WM7EJXiDv0ePo1FrdT4LyEP-yjPtTMXu3F2-qbO19RHO2n3Q6DnIHRzR6381N6baRzS8ME7f6L7DQAE5kSKxNZA86GYKxuis0eEBo3bOr-j6Ikyd4I3F4gSyPYW1EECmFg7qLPHYK0Kj4dSZw
"Клапан для бачка унитаза, подводка нижняя, клапан для бачка, клапан для сантехники, арматура в туалетную комнату, слив для унитаза, кнопка слива, ремонт бачка унитаза, сливная арматура, арматура смывная, кнопка смыва, смыв для унитаза",434 ₽,1 отзыв,"8 мая доставит Ozon, продавец ИП Свирин Андрей Андреевич",https://www.ozon.ru/product/klapan-dlya-bachka-unitaza-podvodka-nizhnyaya-klapan-dlya-bachka-klapan-dlya-santehniki-armatura-540505098/?asb=IYUsadXo0%252Fh7rw731AQSkNSy%252BVrqCZCDMnnaGKC9isIqmbLsj8eHNG9wNgvQMXLo&asb2=hTUwUUNkBrI1_pXw8svFY2V0UxWxPD9572_8iI9tXtIGLppiWq_NEsNmw8Cm3FQQWv5zznCLyAu_TynVmA0aBeLsHRXstqJrqv4t7BC-K2Dz6N8UybmE_N0V-8xgUlkl7rk3J1999xNAOwaBkVP9Xg
Болты для крепления бачка унитаза,245 ₽,10 отзывов,"8 мая доставит Ozon, продавец Твой СтройМаркет",https://www.ozon.ru/product/bolty-dlya-krepleniya-bachka-unitaza-229127910/?asb=r6Y%252BA6pTnIKGKAJV2YOLaqHeP53VfyFso9DMSNBGBWY%253D&asb2=DbYO7hpkyUdM6DljVs3n7OgRwx2qHuvhwuSg1IiNvBjrgL9zHW1hNGrh96SZzwI4
Мягкое сиденья для унитаза.,356 ₽,1 отзыв,"9 мая доставит Ozon, продавец THE ONE",https://www.ozon.ru/product/myagkoe-sidenya-dlya-unitaza-491228597/?asb=bxg8tdsrgylf7uhx%252Bwax%252FeOodnTXWb9NRwkbPnO6%252FmE%253D&asb2=ERRzHjwnQ_dtnMDA-O4op9ehx_N8brtuuK_Q4pLFxUvOLbj2HVacjNJfl4AZTIrM
Теплый туалет накладка многоразовая бархатная coral,405 ₽,20 отзывов,"Завтра доставит Ozon, продавец Везде удобно!",https://www.ozon.ru/product/teplyy-tualet-nakladka-mnogorazovaya-barhatnaya-coral-185070079/?asb=2c1PRh3xo%252BNqnrJnTu2LJU1LxkfNcAllL1SdNS5jYjk%253D&asb2=NoXDe4PdPZ-yXeQw6Z2Te97APVC7lU5QtkDu_pcmc33Ftjufn0jRuC1SXhAvEyvx
"Клапан запорно-балансировочный Stout, угловой 1/2"", SVL 1156 000015, золотой",575 ₽,9 отзывов,"Послезавтра доставит Ozon, продавец Термокит",https://www.ozon.ru/product/klapan-zaporno-balansirovochnyy-stout-uglovoy-1-2-svl-1156-000015-zolotoy-204489752/?asb=sWKZgaoCXEgEjZj%252BUTtvL9riK67uWIEjJlX48Y9NE6Y%253D&asb2=aSyHdtM1LXbZkyZ9a9_-X3TgCb4ntdrZ_sCyZYvmR_gyY5Xgr0PLdSSC6DE63tyn
5919 Дивертор шаровой,405 ₽,1 отзыв,"Завтра доставит Ozon, продавец ООО “Склад Директ”",https://www.ozon.ru/product/5919-divertor-sharovoy-171606487/?asb=Q7vEm8c%252BmDi1jv%252F%252Fx%252B4ZfFqRl4CLkvx7zi%252FK2QLH%252BBw0P%252F4F6kahkFOEtYSWbdrK&asb2=bcWCXthqyoiYErdgS2EGJToAcIu5GSrjian1Qc4R2oD_Oh4_ECJvew3gubY-miEug0vGx4sk8krmXHbjiPQhIW59Br3gC2Y7P6_I1Kf8MCSaV6X6Ud3dX7D3KbSV5z69u4WNtyjvGdX_xx-GpZ_7AA
"Арматура водосливная Инкоэр СБа-БпрН-А-В Р шток (хром) Стоп поток, боковой подвод",686 ₽,2 отзыва,"9 мая доставит Ozon, продавец ВЕРТИКАЛЬ",https://www.ozon.ru/product/armatura-vodoslivnaya-inkoer-sba-bprn-a-v-r-shtok-hrom-stop-potok-bokovoy-podvod-352591166/?asb=r9IbwcTt8Y7ykmnQFqAgmjqYeSIGNoYNaDKpcvo4yY0%253D&asb2=32aETtVnEa0LQuY8avao5jSa8HOhXELmXvm_cBlv0LqfL0hiKt4-ejmUEN5t51xK
"Прокладка сантехническая для унитаза, для герметичности соединений между сливным бачком и унитазом при сборке, стандартная, цвет белый",279 ₽,5 отзывов,"8 мая доставит Ozon, продавец Т.Г.С.",https://www.ozon.ru/product/prokladka-santehnicheskaya-dlya-unitaza-dlya-germetichnosti-soedineniy-mezhdu-slivnym-bachkom-i-375786053/?asb=uhMwq0Qdm2AwPdJYYiZfUYMIfGZl4ld0VZxTm1CrDhM%253D&asb2=eT5lDKBj04x6YQxzAEpaa1Hf2LN0xwr1wiwFg9deNi9wxQFTb94Eg1qxNHNfognE
Лейка для гигиенического душа Haiba HB36,395 ₽,3 отзыва,"8 мая доставит Ozon, продавец ООО ""МЕГАПОЛИС""",https://www.ozon.ru/product/leyka-dlya-gigienicheskogo-dusha-haiba-hb36-417790327/?asb=B3Da67Y2R3zC5EQsb3j0rK9VPST%252B5Q58SUpTpjsdMwo%253D&asb2=6rCismDIpWo0O0idS0lnAjQGJu0og6YWynVbPPxXsIXgpLZfY3vN3wr5K1b1sa9X
"Запорный клапан для радиатора прямой FM 3/4""",835 ₽,3 отзыва,Послезавтра доставит продавец itemcity.ru,https://www.ozon.ru/product/zapornyy-klapan-dlya-radiatora-pryamoy-fm-3-4-364411746/?asb=kG21oZPbQrvMEF1nEz0glLUDho86jFAiAlF44gKbY9U%253D&asb2=p4WrnL_XPU3xuV6uMRrixwyJB9JwetDpg_80bIqu3Figqh9KlaTaObjvRNQICAqz
"Удлинитель гибкий К821, гофра для унитаза выпуск 110 мм (200-360мм)",582 ₽,5 отзывов,"8 мая доставит Ozon, продавец СантехМир",https://www.ozon.ru/product/udlinitel-gibkiy-k821-gofra-dlya-unitaza-vypusk-110-mm-200-360mm-300450700/?asb=rF79bA%252Fosl%252BDrg6Zi0csBGPgO9eDEYIP68sRQ%252F5hds0%253D&asb2=5dqcuY595d6O-f8WoW195FHVZnhPq4JDwInMtiCrT3Px1S2-dQ7qEJTxizBIyyLs
Кран шаровый 1/2 Bugatti НР-НР 327,640 ₽,2 отзыва,"8 мая доставит Ozon, продавец Твой СтройМаркет",https://www.ozon.ru/product/kran-sharovyy-1-2-bugatti-nr-nr-327-224669956/?asb=%252BN9O%252F4YY%252Blyh%252FucvQ9juAjTMugXzdvmjAP2nLixnBmk%253D&asb2=FTuR_HCDfNNPI-2oQTX3IMgLcyl9VQxxxvZ6zcgQMyTfumAOdAUkIsNQTyGhoGg9
"Сиденье для унитаза ""Ракушка"", накладка на унитаз, крышка для унитаза, стульчак для унитаза, сидушка для унитаза, ободок для унитаза",882 ₽,16 отзывов,"8 мая доставит Ozon, продавец AllSaleShop",https://www.ozon.ru/product/sidene-dlya-unitaza-rakushka-s-kryshkoy-belyy-nakladka-na-unitaz-obodok-dlya-unitaza-s-kryshkoy-349276368/?asb=9JYHuFWVWC%252BmFA5U1oTAX7fSmRDzHOOQOWhq3Qc6yrE%253D&asb2=dU7HyoqB8R7FWZcN92aVoZtW8abfTxrnq0KE82C383vJFNmgt_SYrbRisr3zXN6P
"Подсветка для унитаза с датчиком движения и датчиком света, ночник в ванную и туалет",449 ₽,138 отзывов,"Завтра доставит Ozon, продавец ИП Карпачев",https://www.ozon.ru/product/podsvetka-dlya-unitaza-s-datchikom-dvizheniya-i-datchikom-sveta-nochnik-v-vannuyu-i-tualet-361162230/?asb=wmtkeMAspQF4z%252FWxkZyu2WxtekNhoaK4%252FtmLSAkZmqE%253D&asb2=43hNclDmcoS2L8wiDCVbwHX38jiXaV1B8fETlolHzTbGKamXFlXW-sRNB7DFJCX6
Сиденье на унитаз с рисунком Пальма РП-813П,608 ₽,32 отзыва,"11 мая доставит Ozon, продавец Донхозторг",https://www.ozon.ru/product/sidene-na-unitaz-s-risunkom-palma-rp-813p-397236415/?asb=2dH1dqoy5M7i4Sz01xF3vUznETR5vdG0h0Rrix8YFSBseGAiDKgFTMkgzQfCzNaB&asb2=WiAMhl2hH1HYzIf38OelyvGaMJGJWBk2c-bR9G0TMMbhMb2uo3iehmMPqJezRDjdKmjWJwp9RGJ19dgfue2_VMdNw28KRjZLGLXzJtHAiWHck547ZFj9i6EKpHsqFXZ-OxXk7-waKmwYMU3gl3tJkg
Сидение для унитаза пластиковое HD.05.1012,573 ₽,15 отзывов,"8 мая доставит Ozon, продавец Home Decor",https://www.ozon.ru/product/sidenie-dlya-unitaza-plastikovoe-hd-05-1012-416568476/?asb=%252FdqzpuB8TQXdd2htyp43e9dgZjNZ%252FzqiaHJJunClyqE%253D&asb2=AehTgPC6xgPH3Thd1HAByX1DQFCM4UdCBTXZwh6_qyFkMxOS4MWmLMPi4Vqu9YFg
"Комплект мягких чехлов для сиденья и на крышку унитаза, 44х38см, искусств.мех, ПВХ, на липучке, розовый",865 ₽,10 отзывов,"Завтра доставит Ozon, продавец ООО “Склад Директ”",https://www.ozon.ru/product/komplekt-myagkih-chehlov-dlya-sidenya-i-na-kryshku-unitaza-44h38sm-iskusstv-meh-pvh-na-197945476/?asb=JXB04T4P1zFo%252FKSurDbgfx6L9u1Q%252BWO%252BWFgsRzmM790xcB2ghedjsQkcdd2RCXI%252B&asb2=1cgUVqe73SuDYRg9rjoTzpCQQ-hoNj5JTvRPLGWlzLiZATP4ajwkfWYyKR7-PdoDLNz_SN4S8BzJlF9L4Ru-Dddm1iQwntxnvmsj4kIhatpTAEDXH7RWNWKP74_3wQ11zrPRurpsCJMwBSboU4rdRg
Сиденье для унитаза VIRPlast 20980523 белый мрамор,718 ₽,1 отзыв,"8 мая доставит Ozon, продавец САНИНВЕСТ",https://www.ozon.ru/product/sidene-dlya-unitaza-virplast-20980523-belyy-mramor-342307243/?asb=NujDEpH%252Btg7rUCetJ74V%252B1%252FMr7ssQWejhlAHuZtGruo%253D&asb2=UTtXp3_KGWxeZmDdbymVCmJr-aPQtilEuZ6Xr-MeBsMk_hv_QXMCJbT0U0iRJjav
НАКЛАДКА ДЕТСКАЯ НА УНИТАЗ GIRAFFIX,378 ₽,13 отзывов,"9 мая доставит Ozon, продавец Домовита",https://www.ozon.ru/product/nakladka-detskaya-na-unitaz-giraffix-282312412/?asb=rohGeIDgbewAcYGGXNGbcNRBxg5FDdCiDTFVglo7tCs%253D&asb2=q6XmC66LEAaKYyOswCAQWaeq7T-trfdPwzsckOgpUUMsy6D9KSNkvB1MtjCIshKp
"Гигиенический душ BR-07-White для биде с держателем, без шланга, белый глянец/лейка для туалета с кронштейном",600 ₽,7 отзывов,"Завтра доставит Ozon, продавец ELGHANSA",https://www.ozon.ru/product/gigienicheskiy-dush-br-07-white-dlya-bide-s-derzhatelem-bez-shlanga-belyy-glyanets-leyka-218842132/?asb=wL2c%252Fam2oY6uchXsh8kZpJqEFFNi5%252BGlZnUB14pgqnTT4SWzxRP5bsOplkYFlTiZ&asb2=2lQJILZ8otA3gpKnMGqrvHkRz6eHBeEFiGAqQSfwHf7C1lN8bP4W9LcFQd0SQfj3jSSgGw0x_15qhyq4xgERIEfStMLVPJZuHU86xJF7dDbNC9ADU1DOSscbesl6K4RHmB7JcManM_-x2nNNTaY3rQ
"Сиденье для унитаза мягкое S-500 (Воздушный шар) ""Сантис""",809 ₽,100 отзывов,"12 мая доставит Ozon, продавец Индивидуальный предприниматель Латышева Нина",https://www.ozon.ru/product/sidene-dlya-unitaza-myagkoe-s-500-vozdushnyy-shar-santis-194531714/?asb=VjEtQcOYktkHz%252BM8stRwfzZBh2IApd7u82dvLueObCo%253D&asb2=FZs_F_1T2H_6mptBKCSF8t1MvDIR0rHBW_uL_pqTwepDeuXmPFt6fNr-ph1qAKFZ
Сиденье для унитаза 43x35.8x1.5 см Стандарт тип 3 розовое ИнкоЭр,872 ₽,77 отзывов,"9 мая доставит Ozon, продавец SANRIKS",https://www.ozon.ru/product/sidene-dlya-unitaza-43x35-8x1-5-sm-standart-tip-3-rozovoe-inkoer-200525572/?asb=UUu03EEnt4k%252FLkKm0xpEnPUogQf3VqflWLG%252F0CIOPmM%253D&asb2=wRPXwIlOJ3pbt9BTfvILIDmTDDGLBIEZFg6ZLlzsvfzGNzgqwgfSgRELfUC3jAdz
"Сиденье для унитаза мягкое с крышкой ""Водная иллюзия"", белая основа",887 ₽,2 отзыва,"11 мая доставит Ozon, продавец Exstra",https://www.ozon.ru/product/sidene-dlya-unitaza-myagkoe-s-kryshkoy-vodnaya-illyuziya-belaya-osnova-370849368/?asb=HQjyIXJ3m0vKcrTTTGItKGskihyvG5QM6tUUNlX%252FGYk%253D&asb2=E__NAeOmpLxLYzNLTZPL67tpVaUgzqZyB5-wWaBwwiIqnnHCkIlFm44k0hgB2G4c
"Звукоизолирующая прокладка для унитаза, биде Grohe 37131000",929 ₽,3 отзыва,"8 мая доставит Ozon, продавец SANTOP",https://www.ozon.ru/product/zvukoizoliruyushchaya-prokladka-dlya-unitaza-bide-grohe-37131000-496271233/?asb=n7RRsToyAP7ftB4Ch2jjLGFrdbjXW5kJv34YZdRfiM4%253D&asb2=LxXDglMZy5EzbiaebaDuL-yOaeAco4WHF3UtoeOMEuSP_0tU-qixMXFazNFI8cr4
"Крышка на унитаз ракушка, цвет: зеленый",689 ₽,1 отзыв,"11 мая доставит Ozon, продавец SellerShop",https://www.ozon.ru/product/kryshka-na-unitaz-rakushka-tsvet-zelenyy-471456088/?asb=EeXaS8JbM2rNZPHq9VQDO68T21zNBsgy%252FnxIJ%252FmXuYQ%253D&asb2=yKhJhJ7Vzg-K6pu7_1QZTYIg304IGYVqvUq7wJYfSOy6SmN8vx049ckUSWhDBzjL
Гигиенический душ Rose RH82,673 ₽,7 отзывов,"8 мая доставит Ozon, продавец Rose Official Store",https://www.ozon.ru/product/gigienicheskiy-dush-rose-rh82-278856279/?asb=bpmYkUZI5gJc%252BKmIu4V9oqksVkJXBN2taMV6wCPfwIA%253D&asb2=TpxXKsU2EpRYn32I9QEpqCvR8pYydxNyu1eWE3Fju2llPHk-26bslBsywg__cCfs
"Сиденье для унитаза с рисунком (ракушка-бабочка) ""Мультипласт""",793 ₽,1 отзыв,"9 мая доставит Ozon, продавец ВЕРТИКАЛЬ",https://www.ozon.ru/product/sidene-dlya-unitaza-s-risunkom-rakushka-babochka-multiplast-327936024/?asb=8ZVBiEmwVH5lhgW%252BHSTIkNthbT7TNfI3NZ%252Fx30aA%252FvI%253D&asb2=-hWhdWLCRm4cpLzTcdp5UsqMO1A5ZA1StQbl2G8FhKhYKIAooKV20W_l4SKLKf16
Гигиеническая душевая лейка HB35-2,709 ₽,5 отзывов,"8 мая доставит Ozon, продавец САНИНВЕСТ",https://www.ozon.ru/product/gigienicheskaya-dushevaya-leyka-hb35-2-287434912/?asb=ypYzjdNuMzQJGK53QpTG8fK9qq2Ncad7qatTgtVOJDIKLjXsYL4kK%252BnlAPocBvZ7&asb2=OMTUQ-E2yOZFznGLe0Hwd8RJStjnDU1JDkW0P64wJJf8_jLbtnhioB2LOE8IEUACq7JpaFr9kuM_-rRqTRwO2p-0Tk2d-YaA5SZHPScebcUZX6TvKBAiN-Lq3Y5vJDppreLQlMfyxtmTaMfQz-5HDw
"Гофра АНИ 1.1/2"" 40/50 удлиненная 1500мм К116",342 ₽,13 отзывов,"10 мая доставит Ozon, продавец Коралл-Сантехника",https://www.ozon.ru/product/gofra-ani-1-1-2-40-50-udlinennaya-1500mm-k116-225819230/?asb=UzKZSd6RHlP8OGGqKh4pN%252BG1ApON2aS2vb384TMY0ctdh%252FNxScb13RbHFCYD6ydq&asb2=HHat0NpC68D06lETN_vsBf-KpKuunhkTjn17v7LE2tsxhGvI6-WfKcQ9l_xcUfPAHx782Ku8G7gc9UY4sKEmBYxMpcL92I_BvXqfq9AddE6K93de3UuYFB1RQObuHYINRrs2IkW7Sy7RCtcuUIulJg
"Сиденье для унитаза мягкое S-500 (Камни) ""Сантис""",809 ₽,28 отзывов,"12 мая доставит Ozon, продавец Индивидуальный предприниматель Латышева Нина",https://www.ozon.ru/product/sidene-dlya-unitaza-myagkoe-s-500-kamni-santis-194531583/?asb=gFTiyDoeE93IXcq5%252FAi%252B2Og13Y4SLW0CCXubd3slZrw%253D&asb2=HQDvnASQXsEfcO7LT8XYqGK7ifbx1zlG-Tsx4ggupDiGPC4gLRWnnAul9lJNE9Pr
Лейка для гигиенического душа Haiba HB35-2,708 ₽,2 отзыва,"8 мая доставит Ozon, продавец ООО ""МЕГАПОЛИС""",https://www.ozon.ru/product/leyka-dlya-gigienicheskogo-dusha-haiba-hb35-2-417769791/?asb=O33ZzdHmmbYpJcEk7sC6xXisc4p6w61BZ0YjMFYdp6I%253D&asb2=0P2Qt-MB7tP8-JKdQhu5ggMxkoEEVsJ715ZMVG4QoFNme7PG7A9r0mjQjePSxZLu
"Регулирующий клапан угловой FM 3/4""",843 ₽,7 отзывов,Послезавтра доставит продавец itemcity.ru,https://www.ozon.ru/product/reguliruyushchiy-klapan-uglovoy-fm-3-4-303725836/?asb=sTTkjUut1e8Ekl%252FzaAjONdDEXDEnpZrAVDSCfrd6eVo%253D&asb2=Ypr-Oit3vOlejupO6662wBL52Q0bBUn4UOAQbeKnzXbZRcrMxKMe9lLyjvSrYWik
Клапан для сливного бачка SIAMP ВАS 24 нижний подвод,649 ₽,16 отзывов,"8 мая доставит Ozon, продавец Sales-Santehnika",https://www.ozon.ru/product/klapan-dlya-slivnogo-bachka-siamp-vas-24-nizhniy-podvod-175053893/?asb=mBzkxHnut1CO6c1OCIE5VuPgQP%252FWBqoHU8OroCzBWvg%253D&asb2=ALb8cS2ZbaiO0CpYPxVGwQbV-slsnPtdC98PCnjlmRe2fy9Xgnq9YBk-Trr1CmxL
Комплект арматуры для бачка унитаза АНИ с боковым подключением (сливной механизм + заливной клапан),922 ₽,27 отзывов,"9 мая доставит Ozon, продавец GL",https://www.ozon.ru/product/komplekt-armatury-dlya-bachka-unitaza-ani-s-bokovym-podklyucheniem-slivnoy-mehanizm-zalivnoy-klapan-325359921/?asb=Xi3U4pl7A%252B8ylNK7j2NlBDjw5nshe8pBuY4r3ukYHmNGnxl0ekSgVMNs%252F2D1qtWS&asb2=6VUZrI7zGG37MpO-MJhWKHlqqw-FD85vIcnVR5auJkoopxH5VBZ7xcMd8zivvs9tYdEK5dsh0f8irWYWC7CqXQA-9pKOje0oD2eXECA9Q_No1720um1PpSWcZs302XVW2y5_gFdcWdMj8LBgNETacg
"Клапан впускной боковой Vigo Espana, 1/2"" с металлической резьбой",900 ₽,3 отзыва,"9 мая доставит Ozon, продавец ХозМаркет",https://www.ozon.ru/product/klapan-vpusknoy-bokovoy-vigo-espana-1-2-s-metallicheskoy-rezboy-203819601/?asb=iS2ZAgVJZkFsh7x7WUG43q1fZuLYikyn3k1DffX%252F67s%253D&asb2=fFoutKdkO3ixklOApjO5fj9d1wOTn-MpHttnry6jl6a02wfb30PHofBk_RD_egiq
"Сифон для мойки AlcaPlast A80-DN50 трубчатый с накидной гайкой 6/4""",576 ₽,6 отзывов,"12 мая доставит Ozon, продавец Центр сантехники",https://www.ozon.ru/product/sifon-dlya-moyki-alcaplast-a80-dn50-trubchatyy-s-nakidnoy-gaykoy-6-4-252650223/?asb=R7YINHmzJmn3x8s8poWvXHpyNu2FJXO411luLlNejeY%253D&asb2=BhwA618-M7ItXfTb1zJO1S6UcknhaXFioACk_Iyj65CtrSrSqOJCVOhXpjyJi4c8
