"Набор для биде BR-05C-White с держателем и шлангом, белый глянец/лейка для туалета с шлангом 100см, резьба 1/2 и настенным держателем на саморезах (входят в комплект)",750 ₽,13 отзывов,"Завтра доставит Ozon, продавец ELGHANSA",https://www.ozon.ru/product/nabor-dlya-bide-br-05c-white-s-derzhatelem-i-shlangom-belyy-glyanets-leyka-dlya-tualeta-s-shlangom-218849504/?advert=ibht1JGMm3YDRRHGlcK_d9ew0GoqvxoDl87HQb74R6gNMI6SakIC-No8zriA-vJSqYnOqsNqbJkH58dlGgE77zS3YXfbi2spxYjoVh8HTfPSL9ZF_QumN-UeSlqi3FZT6eopSKV-5FLOo91b_Hof0Wt2xb1i69gZlx03l2nCYD8f-vlLp-a1olyzneknDzSMgqoEdBgLPsP7S1M1hn1fidV65kvMt50AAlKMeMBlIHXRcL5li2hbxUy9qMOP7SfgburHptqs_qtTEIRclveH0_GKP6RXehdMzYZBFzY_qmb9-nDKIhLsrOON8DXF9sb1-qy_0vqEzClaUyWjU_YyOr2GIJUYxOtMXxPY_B0WB3t40TZqBpdLgVuN0Q9uHmkSMZJNa0UXRYHArTKfIQhdO6rbaQTZmfaJHP750pQGkCpJEwAZllccWrbVHFDyOP-njMUxsWyF_GmWcOEjhtLppxcAnEXTZ7FfYZpJKjmAOX45oR7FIWJSkhZ-tNa9xP-5UhjqfECnABPQre01yRGpYPwXCa21iaQCOSsa6hXgLXQEPK_zUTab96ab1Wmbt0IA
Подсветка для унитаза с датчиком движения/Светильник для туалета/Ночник в домашний туалет,365 ₽,91 отзыв,"Завтра доставит Ozon, продавец Хит Продаж",https://www.ozon.ru/product/podsvetka-dlya-unitaza-s-datchikom-dvizheniya-svetilnik-dlya-tualeta-nochnik-v-domashniy-tualet-480451683/?asb=7mzWDx8H9mztADIoazUaIMY72Qh8fbpvloXTgC%252Ftf25k5AvPNggUXS64A9UUQcBr&asb2=aOpcsktkDh_XLtlxTJLjn0eytkJJaqRj6qpCoGk4k1GdM-U5q0hNh52uBWE6LoV8aDqodC4e43H71hbol7CliMpTgthD9rNezpqc7tdg2p8NvQ5cuY0Rdu3_GLu4pBvwCm60I-BrXHFY-tcdMSGMGQ
"Сиденье для унитаза АНИ пласт WS0100 с крышкой, с пластиковым креплением",493 ₽,69 отзывов,"Завтра доставит Ozon, продавец ANI PLAST",https://www.ozon.ru/product/sidene-dlya-unitaza-ani-plast-ws0100-s-kryshkoy-s-plastikovym-krepleniem-445668066/?asb=YPr4Zn%252F%252BU0YYAu4C1cY3QzsFD51CxiikTMFYADSsXJE%253D&asb2=8PbgPf_hlpJPGxPLuh99phYibYPxoeQq8BfFwpW4pLkc47huhBgNE1UTQPz16wCV
"ИнкоЭр Сиденье для унитаза ""Каскада"" , полипропилен, белое",774 ₽,50 отзывов,"Завтра доставит Ozon, продавец GBArt",https://www.ozon.ru/product/inkoer-sidene-dlya-unitaza-kaskada-polipropilen-beloe-238394947/?asb=vlAwxzo1z%252BSA9dq0imp1ZRy2AL6q7YMHWRTHi88qcNU%253D&asb2=vnwLGVrUyRFkpH-IVXMTPOjpKlOgKu5-ZTM4_qhHYTpHCwdbHaVA9MGQ3etKTlJH
Клапан заливной для бачка унитаза с боковым подводом воды(Псков),365 ₽,89 отзывов,"Завтра доставит Ozon, продавец Termo_Profi",https://www.ozon.ru/product/klapan-zalivnoy-dlya-bachka-unitaza-s-bokovym-podvodom-vody-pskov-337590119/?asb=jCyIyvAZImtGeD48heoMTcJjHJUGddJ12OXlZKjWaOhRx3ErEQ7CkcZa10Vvn3oN&asb2=hjWGHxxwlasLmhZz7ATG3VKsN1q3m5U7eRSF5N0TKEpTfaQvGR6O1VYW-0ez5sFaWDT7qBpVLp9L5ByTJqXJi81gGX6riwYesELAWVQe6NMesF6mNCbjX93rEkrUX85QORzVv3u1GAUmHV5dWUQJ3g
"Набор для биде BR-07C-White с держателем и шлангом, белый",850 ₽,13 отзывов,"Завтра доставит Ozon, продавец ELGHANSA",https://www.ozon.ru/product/nabor-dlya-bide-br-07c-white-s-derzhatelem-i-shlangom-belyy-218841642/?advert=OueRc4Mw27RqjZWeEgUNK_DkSbAEtXo_QjAae30P8P2u68Mav-IXyXqaKU-nhXgJkGKTHiOr5AR5mbOgLpe9uv3TjQnG4TevzwvEUdIs9Xg_JKcSpgYoXcm3KbbynfCk5D3xoOAEoYZg6qPqvph9JDZRKDhJCSOuqYckkQMmBycRigm4LsgpQ6QuDCEVXu3nmhWGE65hge4L2VFk_R9ndgwGT8VxLE9bEgnJAvhtHT4M4FT3qq4iiyADtFyizqcSOkjmii5w01ywpsG4y6ME2DsnZJDvS2DCodmvEDUjWKpELPYiF8IeSZ7pKovXUh-JEoBCiYrI1TMY9ZzRm9NaLEpA1WvBOkfJwnrhDXxXA7B8mI6JFc-ftEUgEDyg57h_aXJEd5Z2fnMgbJDPVev-0rKCGx8ldZF_eCqeIv0HSLVy1nbbI6PAzfnsRSxXWQ1_a0D2yHNvyGlEbBNYvhX92p10eINrLbzvVJBxgU2_rK0BkO1GT4mauoaYaqrp67s8qafFgZr6JgQ8i0I_1jSlp3W1wlpHmKTan7U3Q-tM89g5n4GDwLLbetieBU7Uyv1g
Поплавковый клапан для бочек/емкостей/бачков унитаза FL1 Прямой 1/2,615 ₽,66 отзывов,"8 мая доставит Ozon, продавец Армасток",https://www.ozon.ru/product/poplavkovyy-klapan-dlya-bochek-emkostey-bachkov-unitaza-fl1-pryamoy-1-2-281263737/?asb=czUNVoK8nRMflcG1f4ZmA6Gx1dElXTzvWdKLJ%252F%252FtSk4%253D&asb2=k2FMi-MfxIV7Fl1ltAiT68CSj2fnvI8m7EcthkHHFgqEGucrgAHoUHocUGF3cI_E
"Подсветка для унитаза Exort с датчиком движения и освещенности, 8 цветов, GU10, 1 Вт",349 ₽,147 отзывов,"Завтра доставит Ozon, продавец Very Well",https://www.ozon.ru/product/podsvetka-dlya-unitaza-exort-s-datchikom-dvizheniya-i-osveshchennosti-8-tsvetov-gu10-1-vt-248604677/?asb=vqITP%252BzkB8FOhJgZO1zCdrRTN71v4o9tbvXGl1TjCRKX6Ywn3bLMtA0CX%252BY27rld&asb2=s4AGIcmNT6BPUHpM6lzfbhcyHq3C7qET79mON44DbLwp4flz7cxyZmHWL2I_Tn2TQeBdU1uolKqbr-0rzai57qN-xSXxh_H_vp5-itxMi_bm5bT7U0uwo0F-hQbWaCa5Va-xIBtWxdXYA2U9HZwWwQ
"Арматуры для бачка унитаза АНИ пласт WC6550M однорежимная с нижней подводкой 1/2"" металлизированная кнопка",539 ₽,47 отзывов,"Завтра доставит Ozon, продавец ANI PLAST",https://www.ozon.ru/product/armatury-dlya-bachka-unitaza-ani-plast-wc6550m-odnorezhimnaya-s-nizhney-podvodkoy-1-2-446128103/?asb=pjwk5C8aBHpTYGaOkk0TWX6v16tr3qJGNudgUuWW3iE%253D&asb2=LxSJMOz6DODFS7TqYpXF8pz8XI4Xdt21j9HelTIRZiuyqZomO86epvGJCV_afHkO
"ИнкоЭр Арматура для бачка сливная/наливная с нижним подключением, кнопка хром",506 ₽,13 отзывов,"Завтра доставит Ozon, продавец GBArt",https://www.ozon.ru/product/inkoer-armatura-dlya-bachka-slivnaya-nalivnaya-s-nizhnim-podklyucheniem-knopka-hrom-217223436/?asb=utZDK2CXXcI4EFxy1dC7nzodWPOIeMAaOIr33ZBlZcc%253D&asb2=1YBP_jcFl-ayuayOmwoCnJlHFcWkAMoOs030ceQNGKlVLSqpvtxbv3mCn7Cqhxgq
"ИнкоЭр Сиденье для унитаза Универсал, белый, полипропилен, крепления пластик",776 ₽,43 отзыва,"Завтра доставит Ozon, продавец GBArt",https://www.ozon.ru/product/inkoer-sidene-dlya-unitaza-universal-belyy-polipropilen-krepleniya-plastik-238395421/?asb=%252BZuP8Ava4d5A3oE9b2Fp26BWrlnJoYtgB8Er896X6Y4sgVzZgGzpj8Xsrp4q010r&asb2=vaGCHEv9rEaNYAaaC_HTmV6caU9afWF6HXw81wZCeTvnQ-1lKKP1iYMFIIIHYsmOZ6BWoI3WJXqdy2kmejXolh4Pk-8cvkuSnHyfzl6kTMzVLjS49eH3uXKGKpPE_jYiZcSPyR9nXAsfCNywZ6mzDQ
"Сиденье для унитаза АНИ пласт WS0300 с крышкой, с пластиковым креплением",659 ₽,13 отзывов,"Завтра доставит Ozon, продавец ANI PLAST",https://www.ozon.ru/product/sidene-dlya-unitaza-ani-plast-ws0300-s-kryshkoy-s-plastikovym-krepleniem-445649569/?asb=GdwOVLjogHb8WF%252B7%252BL0GjKVV3mUkmIBGeAe%252B0O%252BjJlI%253D&asb2=mio4sYdJy5Y2dpUu4Qt5vkttIL5NLxFq9EZAUFLRL5M46NvY0TiyIv_T6VsKT69c
"Арматуры для бачка унитаза АНИ пласт WC4550M с нижней подводкой 1/2"" металлизированная ручка штока",489 ₽,24 отзыва,"Завтра доставит Ozon, продавец ANI PLAST",https://www.ozon.ru/product/armatury-dlya-bachka-unitaza-ani-plast-wc4550m-s-nizhney-podvodkoy-1-2-metallizirovannaya-446112267/?asb=XkVuEi3ihB65BAY2B%252BHp%252F7PZTzwCnygdK4tI2hpE4Uw%253D&asb2=wI1gw_vKhFJHJSF415tY-t93bTxQl9NwvQYV3hptxlSvu_zlRf70PAqPEPARGhOs
Комплект лейка для биде со шлангом 1 м LIDER-SAN (125) /Набор лейка для биде и шланг 1 м/ гарнитур душевой / лейка гигиеническая латунь,851 ₽,1 отзыв,"Завтра доставит Ozon, продавец LIDER-SAN",https://www.ozon.ru/product/komplekt-leyka-dlya-bide-so-shlangom-1-m-lider-san-125-nabor-leyka-dlya-bide-i-shlang-1-m-garnitur-474648809/?asb=oV962kL8WZJ7KnHnBwwq9164pJQSBltO5IsPR1XN0ZU7ReZgXL3r8vMYxMbfMy4A&asb2=ek8_UXLglG8fYb4myVd888J51YaCtrAnpBbWCNtWI6IUs2igy3G0IZRZc-N8MttrfS8EHCqTVPASaQ2lIxOr35uxHc9maWQlKBvtiKWWS7k8jpqklDaqTKdmCp2Rk-kg7aUJVhJ0rZ9LeRuC28J1Iw
Поплавковый клапан для бочек/емкостей/бачков унитаза FL-1 Угловой 3/4 (20мм),670 ₽,16 отзывов,"8 мая доставит Ozon, продавец Армасток",https://www.ozon.ru/product/poplavkovyy-klapan-dlya-bochek-emkostey-bachkov-unitaza-fl-1-uglovoy-3-4-20mm-281288082/?asb=5gEmb1iwqKeppYr%252Fs9Ak9%252BcfTKaclneXO6SK0v4Dl1A%253D&asb2=Su1i-T5xsk5I0hM8VLuIbG8zsygGqzf11cwtEs39x8HM_1kNh5z0LhK7nPEyb4RX
Набор крепежных болтов для унитаза Wirquin,220 ₽,48 отзывов,"Завтра доставит Ozon, продавец Wirquin Russia",https://www.ozon.ru/product/nabor-krepezhnyh-boltov-dlya-unitaza-wirquin-271881986/?asb=sL9TylPcULOlUcJOuvHkv62RopjsZSk2Tl6auGeC6AH4PkVAbCWUo4fUHHlP%252BUe7&asb2=Uk_sqEOs6dd3Uil1lYiy-EbQrG3H95JA30f4QI75ySxx99qWwB_kJe4omk8n-u1h8HMBpzx-j_DQOb1KK_k35G497zisSbF5J1tYgVms37kvi5Kbz_9PK_nLQyZemx7l-Z7vE0MFnyS_qZANWbEFnQ
"Универсальный заливной клапан DOBLO WIRQUIN наконечник латунь 1/2"" для нижней и боковой подводки",899 ₽,18 отзывов,"Завтра доставит Ozon, продавец Wirquin Russia",https://www.ozon.ru/product/universalnyy-zalivnoy-klapan-doblo-wirquin-nakonechnik-latun-1-2-dlya-nizhney-i-bokovoy-podvodki-358123194/?asb=lXq5k69uc1mTgS9I0Y9%252FDEWtXvJeOkv%252B%252FfH9WEXJ4qunxhnv890gFvgVpVQ%252B0YT7&asb2=OOKRCS2lGZiY0Hwdxs6CQChuwfW6ZVTouvW8Usy5BZBfGSaIzW8SQdg8OSO4H6pO9bjkb99XBrAJw2IqICIV6-Wlx6P2Kcysv37IkMK9RP_lx9gofSVBUsbWgfiFponC7B9ct21sdyoalpALRRxndg
Лейка для биде с нажимным механизмом и настенным держателем LIDER-SAN (039) / Лейка для гигиенического душа водосберегающая,451 ₽,54 отзыва,"Завтра доставит Ozon, продавец LIDER-SAN",https://www.ozon.ru/product/leyka-dlya-bide-s-nazhimnym-mehanizmom-i-nastennym-derzhatelem-lider-san-039-leyka-303178985/?asb=l3KGhIZNctMzxgQYbbgPFbKsvT1TGg0ags4LeXAPqE8%253D&asb2=onUIBK5l8ypPlhrf_yrWc-RTl2y4UkNkVvvEnqhhMZdW5ij1J2lg4vptZo8I2Ld_
Подсветка для унитаза с датчиком движения / Для унитаза / Аксессуары для туалета / подсветка / для ванной комнаты аксессуары Освещение и мелочи для дома,371 ₽,4 отзыва,"Завтра доставит Ozon, продавец Турецкие Товары",https://www.ozon.ru/product/podsvetka-dlya-unitaza-s-datchikom-dvizheniya-dlya-unitaza-aksessuary-dlya-tualeta-podsvetka-dlya-483933186/?asb=DaNqUbTdANNNekAmKup0fB6VywuwD2NXTE2QbpYS%252BXvnnUD029VNtMe2b%252FuJTCZA&asb2=0fU3heA05Ldnpcvb1LD21UA9WxUy-gUCDMyyxtIBTJ4XbVdc7PzIiHvnSLTvIkNERm-ab1Lbuy9vMhw9PmbhJtQric35v7MNFmN5eKFGwvMAKDipv991Pfn6InzBPRjLIV88ycLypFRb1PtmeK7FDg
Крышка для унитаза пластик ФОТОПРИНТ Лепестки,505 ₽,4 отзыва,"Завтра доставит Ozon, продавец 000 МастерСтрой СПБ",https://www.ozon.ru/product/kryshka-dlya-unitaza-plastik-fotoprint-lepestki-390009772/?asb=isqw9CByWNrUK6lhHGwBqaQyIby8Zhu8tPU2Ey1hMRiC3L98vnEtpTght9UxD6vO&asb2=enLVQpmSCthyGBEBQuiwTjqdKiu7AApaE9OonMXUpwN5BZWZmyLq0ItuRixR9LTVYFd2ACGvxYVgIufC_EAzMz-L09GV_9FtJf8hXsaA-9JMg66LKnk0juKt-J-0qU63r_AE0pTBcbVVd--wO5LDhA
"ИНКОЭР Сиденье для унитаза Ирма, голубовато-белый, полипропилен, крепления пластик (Россия)",856 ₽,20 отзывов,"Завтра доставит Ozon, продавец GBArt",https://www.ozon.ru/product/inkoer-sidene-dlya-unitaza-irma-golubovato-belyy-polipropilen-krepleniya-plastik-rossiya-238381189/?asb=%252BgrDFjUbWs3l8BRvQSaJWgaZNakH0TcDif7i%252FJNEI38%253D&asb2=Ho3fT42q5Yb1Qsen2A4eWReJkocu2zA6MX275Jbl8MNWEfM3m4jEFbo4dq1t9-wz
"ИнкоЭр Универсальный спускной клапан для бачка, с одним режимом слива, кнопка хром",322 ₽,19 отзывов,"Завтра доставит Ozon, продавец GBArt",https://www.ozon.ru/product/inkoer-universalnyy-spusknoy-klapan-dlya-bachka-s-odnim-rezhimom-sliva-knopka-hrom-217223455/?asb=Jw8RNEq9EyrNeNIQHrKtT9w3d%252FeZYqP4CYi8DIiaOSgAkTh%252BeN9fP3Zx2eNIgK6P&asb2=fH2hCuvkDHUGpsrCFQDt2iwbcQyJwInDED81zoBuv5ykqCfasa7WGalwzEytBkVJ235jut1ZB8mDfEgQRwIkKAvC40nr2dVNAECeAh6_dNK_ylY_Uza_cIr3RBhue607i5enckT_dhnQqYtFq_xwig
Гигиеническая душевая лейка HB34,331 ₽,52 отзыва,"Послезавтра доставит Ozon, продавец Посейдон",https://www.ozon.ru/product/gigienicheskaya-dushevaya-leyka-hb34-261706253/?asb=ZGOX7cFwIFybjaoVQnHjIThAFVLqxxPqhI85CyP5TDsiIgxwDQHm2igpeENph397&asb2=PT2TsBNwsGzUIZXuJosOMEhH-HqLg5xCb4WNO_QGE2ZQivEqLeaIw6tbbYqb9uLLr4TWOfp8hiVhV8pwqrES39JHWGOGfzHvi9EkgEE5f7AhkXII5ZCeHhxhuAiTkj-HEZtTcuMrrri1IJdebLVZfg
"ИнкоЭр Универсальный спускной клапан для бачка, 2 режима слива",344 ₽,31 отзыв,"Послезавтра доставит Ozon, продавец GBArt",https://www.ozon.ru/product/inkoer-universalnyy-spusknoy-klapan-dlya-bachka-2-rezhima-sliva-217223274/?asb=AbWv84Sc5Z4nyZuExRFP%252BZ5aW%252FbooPceXmKukxTZdRA9Jr9EOCM6o3hlIems7Qy0&asb2=ohF62MMhwN631MwtwM2yvLH5BI4u4-E2Sp5VSfWdYSKpqWDDuCeZpzLKEhsdoJPq-c2xm-_znfOKV9GZYtfSP1bOYLxQOpE7wI4SEeDpF3Jsu1jLNiPjMCwNNYbw0DWL6wzBOgsVwsHXuxk5V4cDiA
Крышка для унитаза / Сиденье для унитаза / Крышка для туалета / Сиденье для туалета / Сиденье с крышкой для унитаза,605 ₽,20 отзывов,"Завтра доставит Ozon, продавец АКСГРУПП",https://www.ozon.ru/product/kryshka-dlya-unitaza-sidene-dlya-unitaza-kryshka-dlya-tualeta-sidene-dlya-tualeta-sidene-s-kryshkoy-180136726/?asb=C17FUQLAFtQWD3SNmGotEGTKhqk2uwxtuSz3ds1GDCZlyg%252BNnECfhOQvzm5dv4hI&asb2=mYIlciQ7viUdpNa37lnL7qf5TCTbQBU2_RW7WC5NJF3DNMGOOnOvpZHuKSDzMkF12xvDunE5UY1L_GEOP2tsORe6VigOh9wgLF-5fNZWqkdpI2AIUj0AvgZYGob3O2PQk6LghQIZe11IFCFqR8g0nQ
Набор для крепления унитаза к полу (комплект),145 ₽,31 отзыв,"Завтра доставит Ozon, продавец ТехКреп",https://www.ozon.ru/product/nabor-dlya-krepleniya-unitaza-k-polu-komplekt-282179168/?asb=IiG8WCdDSSa%252BbqQsXBzSjq652GPEo46RJ%252F7ZtwFDBRw%253D&asb2=9AiozUDoz4-5boknNn_KU0-kVuQTTRbuOq-_fOkDxh03eTFCoPcQfTcMplY8SzgY
"Впускной клапан для бачка унитаза IDDIS, F012400-0006,боковой подвод",960 ₽,43 отзыва,"Завтра доставит Ozon, продавец IDDIS Official Store",https://www.ozon.ru/product/vpusknoy-klapan-dlya-bachka-unitaza-iddis-f012400-0006-bokovoy-podvod-257759578/?asb=DZfiwzwIyRSs8F38aBFxOpdnhmQmUWpxhWNAOy1fENDVp0uKhPfvl6rCMo0hnaYe&asb2=Uhf_94mUFEwFREWa7Y_RldDPuE3HnekoryOa0P_xhAGIQmRQgOiPOma1IAjJ88ATQJTBfUF1TRJQFFK2E2aGw_epbnw5d03HL-jbm2nhH3e4RyylSTtrD4X0F8SzqPsJJNmbvZtEmlUYZ8kfc3ug3g
"Мягкая теплая многоразовая накладка-чехол на сиденье унитаза (универсальное покрытие на стульчак унитаза), светлый аспидно-серый",360 ₽,87 отзывов,"Завтра доставит Ozon, продавец Картофан",https://www.ozon.ru/product/myagkaya-teplaya-mnogorazovaya-nakladka-chehol-na-sidene-unitaza-universalnoe-pokrytie-na-stulchak-270735619/?asb=CWie39zxBiBmI7meYqndbQnrFZw55xcrBtUmk4UumTwLB9%252BRbIqu8ovBK0WJgtaY&asb2=ujtYPA4ySK3WNWqtzSQR6MJ6LcOaZ_cV1Tq6XMe_Wq9BcVCswlMqCrLgQ05ilaC7F-y1jb9y0PiqQW33r25YlhIAuGmM4uI_hDv33V0_qEAiZjN9q0C15BW9KJrkyYpSkWfQ2KhGyK9IyxTVduVUEw
"Подсветка для унитаза / подсветка с датчиком движения, Led подсветка, 8 цветов, BEST SMART CHOICE",395 ₽,48 отзывов,"Завтра доставит Ozon, продавец BEST SMART CHOICE",https://www.ozon.ru/product/podsvetka-dlya-unitaza-podsvetka-s-datchikom-dvizheniya-led-podsvetka-8-tsvetov-best-smart-choice-331936264/?asb=B0d4Hmmu8YCo6wcpj2BsDFYjAz6wOjrcBsgVT5lmmnTYtx0Du2tiT83bGWaVHPEG&asb2=NWHjnDVM2e_FS-EZDNWTt4KINmqCXQJ7JeYuTzWkZeXeafmf4oQiPZAZqzIpp2lBf0oFAzZWAqajQw8RDyTDx7kvm1LHM_OliyhqhV9m8qLaSpCaxVlkk6LlRQ-H-yKoqQX0r38wqz5q435uLvhPMw
"Сиденье для унитаза с крышкой Гладкое, цвет белый BranQ",680 ₽,8 отзывов,"Завтра доставит Ozon, продавец ИП Эргашева Дилшода Хусниддиновна",https://www.ozon.ru/product/sidene-dlya-unitaza-s-kryshkoy-gladkoe-tsvet-belyy-branq-365207823/?asb=0a%252F058pGn3a0KWefa%252BhoLAvqY2s72w1yf4s%252Fe5c3N9w%253D&asb2=cBt4AK_zbBXcqpQTfkM1pSuQrdnDMqRd-mVQdoxbl6jfMufQToXWecgsv4Yj8DkU
"Сиденье для унитаза АНИ пласт WS0210 с крышкой, с металлическим креплением",777 ₽,8 отзывов,"Завтра доставит Ozon, продавец ANI PLAST",https://www.ozon.ru/product/sidene-dlya-unitaza-ani-plast-ws0210-s-kryshkoy-s-metallicheskim-krepleniem-445670948/?asb=3nnXC%252BubTBF%252BNUiFQDEntn5QKRheMfRsyd3WaKCw9hc%253D&asb2=wFTPYJzMoUnbFRwlxxecAxa78aZyHHAE4GmaEhhsVm9sydqqbycd1Rfjq6boDWL_
Гигиническая лейка SIROCCO для биде,440 ₽,45 отзывов,"Завтра доставит Ozon, продавец ИП Ивлев Филипп Игоревич",https://www.ozon.ru/product/giginicheskaya-leyka-sirocco-dlya-bide-200015065/?asb=MXtfRO48J0XQxOUN7JVZ5ptkMGUt7ymq9bxJ2SE95ow%253D&asb2=ArZh6q9TMaFDrMDEnOMCtDUwu4HXRVUVBRd9zFoMNUNNFeclEO0aD082ACpSVtVx
Сиденье для унитаза детское/накладка на унитаз/адаптер для унитаза,379 ₽,6 отзывов,"Завтра доставит Ozon, продавец SoloMax",https://www.ozon.ru/product/sidene-dlya-unitaza-detskoe-nakladka-na-unitaz-adapter-dlya-unitaza-522885977/?asb=N%252FjTAAWeBBrd9PFmqVRY1DQ%252BMU8Uz6jZFWtNItLMIMU%253D&asb2=0-OdvxulY6H91GvP3wSL7EZCwa3275N1knPM7CSlThym7Rqp78cKTC1fts_Hd0w8
"ИнкоЭр Универсальный сливной клапан, штоковый механизм слива с функцией ""Стоп поток""",451 ₽,22 отзыва,"Завтра доставит Ozon, продавец GBArt",https://www.ozon.ru/product/inkoer-universalnyy-slivnoy-klapan-shtokovyy-mehanizm-sliva-s-funktsiey-stop-potok-217223229/?asb=emudskQC4%252BxVb1H6NP40lBSYJLtdz3d2uzJit9jKDO4%253D&asb2=ffG09ufi9_mHcNkP0MbYfi0fTahY_4rbUPWtZBM7YGe24pG-P7Fot_voZ5V5KnmE
"Арматура для бачка, кнопка пластиковая белая, нижний подвод эконом 1/2 АНИ WC6550",389 ₽,1 отзыв,"Завтра доставит Ozon, продавец Сантехлюкс",https://www.ozon.ru/product/armatura-dlya-bachka-knopka-plastikovaya-belaya-nizhniy-podvod-ekonom-1-2-ani-wc6550-223358181/?asb=5rc5oQHCCqGrbyTTYIVv2gWLjfXlS3rOXzPfOiFzJOg%253D&asb2=zsV8Uy2L5WMfJPp78efyg9XASUj0658cT9NRnvi7u_pSl8QZC1aykRv8QXoP4hnm
Теплое сиденье для Дачного туалета с откидной крышкой (накладка стульчак для уличного туалета),464 ₽,5 отзывов,"8 мая доставит Ozon, продавец Doski4you",https://www.ozon.ru/product/teploe-sidene-dlya-dachnogo-tualeta-s-otkidnoy-kryshkoy-nakladka-stulchak-dlya-ulichnogo-tualeta-556076372/?asb=qKkPfK%252B7PhO3yP8BKA%252FaNdFKZKaiIckGqi89qWF%252Fymo%253D&asb2=ORPH-8GYc7Jpb-J8GhKNk67__cnmOOeG06tOgm3xStxO6i3hXYW08gQaDCz_UM1_
Крышка для унитаза / Сиденье для унитаза / Крышка для туалета / Сиденье для туалета / Сиденье с крышкой для унитаза,605 ₽,49 отзывов,"Завтра доставит Ozon, продавец АКСГРУПП",https://www.ozon.ru/product/kryshka-dlya-unitaza-sidene-dlya-unitaza-kryshka-dlya-tualeta-sidene-dlya-tualeta-sidene-s-kryshkoy-180137509/?asb=Rbq4%252BDxHE4llKBnqgGPqpIem9uawz8xUfbsgmwXRLYTq1Mb8DAr2RSXwcJUO7BHd&asb2=hrpqPkvVi7jAwgcaRHS6K7W94ysBhokriHP1S64zu8fCs_Vp3tSmNn-tENjtmSEVZIoUdq2nskCXcgVnoZZlqgOvE3g86GOy4X0F1ZIkQ-yJN8HFH_0f3J4wDBDXX7hyPA-XlIJh-5qWZybTaYCGjw
Гигиеническая душевая лейка HB36,325 ₽,169 отзывов,"Послезавтра доставит Ozon, продавец Good price",https://www.ozon.ru/product/gigienicheskaya-dushevaya-leyka-hb36-231500263/?asb=IPNUkOlXfRAxclToi0SREql7q4rQrZPS2XDMCZyd8Uep4m1Z42AbFl%252Fge3AQV3hH&asb2=kVdyOMOvjgad7wzrX8ObnB4TBzJa6LkTkQuxNx9rYJHr9vnUuMNgmrMj5Ugpy_zQ_kPfJBebOYzBNV2sQcz9aMHwBIoj2h3ovp_ptSJvimD11uKpXHDXTqAljml4ImN2m2XtP-VZaO2czwVaoxzYjg
"ИнкоЭр Арматура для бачка универсальная с боковым подводом, кнопка хром",451 ₽,22 отзыва,"Завтра доставит Ozon, продавец GBArt",https://www.ozon.ru/product/inkoer-armatura-dlya-bachka-universalnaya-s-bokovym-podvodom-knopka-hrom-217223427/?asb=GNywPg7qHc3p%252F4NQA2KGKjTN8d%252BNRgIe2m5GFTPdCM9IhJF%252B7aqhz4rliMOjxP%252Fh&asb2=o1UX91AedZT6QMODk7ufKA-B3N9-dbm1CB4BcOiWM0NFJT8GvSi0xSBy4R473x-nmTX96KWDwe7Rg6WimhvjAzDYnGF-aPifoJmmaTJge_UxWADrrcJqUdmLhhLp_qnxG_y_l4v-YgEdncHZ2N6Tgw
"Арматура для бачка кнопочная (2 режима, регулируемый малый слив, нижний подвод, металлизированная кнопка) ИН",688 ₽,26 отзывов,"Завтра доставит Ozon, продавец MasterProf / MPF",https://www.ozon.ru/product/armatura-dlya-bachka-knopochnaya-2-rezhima-reguliruemyy-malyy-sliv-nizhniy-podvod-metallicheskaya-162394468/?asb=ec5arHfuA3SHe3fnpctGfxe8q0Yx5A0AqCyAPrHcrCw%253D&asb2=Z64JvR5UZJ_wSSHovE4ljy6r1eDX9BllUWjihvO7miwjnlPX4z4Dyv_dPWe_l4r-
"Сиденье для унитаза, Тип Элита",400 ₽,16 отзывов,"8 мая доставит Ozon, продавец ПТГ Центр Сантехники",https://www.ozon.ru/product/sidene-dlya-unitaza-tip-elita-519735741/?asb=d5POO%252BZlMFXsHmcSIC419WzJNs1aPwDAAajDoW7nWS8%253D&asb2=e4VQcM6Nv6jJcVRFaxcwvIoPIsqu1ajR36iZMW1UUYw2r7bWERM2AeeBhaotbciM
"Сиденье для унитаза ""Стандарт"" (Белый)",626 ₽,10 отзывов,"Завтра доставит Ozon, продавец MasterProf / MPF",https://www.ozon.ru/product/sidene-dlya-unitaza-standart-belyy-400682203/?asb=G4%252FOtunYFlaNArzyWp%252FZntr1JLn7jmsrVRlS5ZQauV0%253D&asb2=8CTM_fpbbhdReemLlsVNSmjYuIibdRjOyIaDAYHR5hD72pTQ1bndj75dycjWXM_C
"Переходник кламп 1,5 дюйма - 2 дюйма",880 ₽,11 отзывов,"Завтра доставит Ozon, продавец Сопутка",https://www.ozon.ru/product/perehodnik-klamp-1-5-dyuyma-2-dyuyma-212331295/?asb=izHsV3ZO%252F50G6wC7dxBSLxE%252BD7ny2Y9U6HuObIaDFUY%253D&asb2=CJrSEwzxq5h2xsunwQMKekcqN_twmFTUiuCQnMrhtN-K1O1GsA9z67YGKwzgB_Kr
"Набор для биде BR-05C-White с держателем и шлангом, белый глянец/лейка для туалета с шлангом 100см, резьба 1/2 и настенным держателем на саморезах (входят в комплект)",750 ₽,13 отзывов,"Завтра доставит Ozon, продавец ELGHANSA",https://www.ozon.ru/product/nabor-dlya-bide-br-05c-white-s-derzhatelem-i-shlangom-belyy-glyanets-leyka-dlya-tualeta-s-shlangom-218849504/?asb=gIaEUQ75%252BystHzdVwPdvSJQsMOnpfz2Lr%252Ff4%252FVQZTCGiN%252FwDjfAszvut0gaSzcNr&asb2=Rh-LXZEocX5DZsXLze2bP4QdINYSJbbqp9GUvPMYjw9uAI3LbvnkCPVHgqjZwd_WLTiOxEcw-Jsewyv0haIWWLYMMYD1zKvIrbHHbE6w3X2LQjWgOCexHqOXHx_VKEw_2CvrV-xzUcW4OWEE0ll2TA
"Сиденье для унитаза АНИ пласт WS0110 с крышкой, с металлическим креплением",674 ₽,15 отзывов,"Завтра доставит Ozon, продавец ANI PLAST",https://www.ozon.ru/product/sidene-dlya-unitaza-ani-plast-ws0110-s-kryshkoy-s-metallicheskim-krepleniem-445680411/?asb=PpvaZSrbDlAKRzbOx2BQsZSSE2qjZyP4dBSrj0p4NZo%253D&asb2=XOkrFq7yT8xRsWm3yw68s7YKPO9qKDzx3oRycBQHkPmueFLiGVuk2MjqwcZVyRAI
"ИнкоЭр Арматура для бачка универсальная с нижним подводом, кнопка белая",476 ₽,4 отзыва,"Завтра доставит Ozon, продавец GBArt",https://www.ozon.ru/product/inkoer-armatura-dlya-bachka-universalnaya-s-nizhnim-podvodom-knopka-belaya-217223465/?asb=OB8YJdyAnGYFGfnRhKP1ILSDEEOVf5AiNph%252FwXF%252BEkw4jSKd2eiSDbdgNRO6%252Fu84&asb2=VxTt7YYHXDXIHY6V_TJ9f4pKqOHtlhVtcXDp1s56Rp1Rl1-ipTStgsIWmkVUXd9ob15tOylNkqH7ZQ5_jf6wTvNCpnt6_8Rn2GzJ45ANuOsMVnukYvL_2zO0ZvbxSqdoI1ZBjRmRnRwWSVSklcnjHA
Мягкое сиденье для унитаза / Чехол на стульчак / Накладка для унитаза /бежевый,194 ₽,1 отзыв,"Завтра доставит Ozon, продавец Artin",https://www.ozon.ru/product/myagkoe-sidene-dlya-unitaza-chehol-na-stulchak-nakladka-dlya-unitaza-bezhevyy-546614908/?asb=%252FrCdNl%252BLFpB4%252FDh1nnLCMbppgLoHp%252FZIC5EHnAZqKis%253D&asb2=3Xs44pVS8vZvY0hRGiA4RbegijZ61HxV4_i9-C8Jfx9-3qyp0ZPWW6aR3JoUfT8o
