Вакуумный набор ( с насосом) для закатки банок Вакс. Крышки для закатывания с вакуумом. В блистерной упаковке (насос +9 крышек),359 ₽,1 отзыв,"Послезавтра доставит Ozon, продавец VogaHouse",https://www.ozon.ru/product/vakuumnyy-nabor-s-nasosom-dlya-zakatki-banok-vaks-kryshki-dlya-zakatyvaniya-s-vakuumom-v-blisternoy-562803576/?asb=0fAyz6rkQ6sFfkNJikK0PAB95Qx1IWp9FRyVEJdyvpk%253D&asb2=bXq_VZzsF7mOER5PS2Lovot_HcTKNX4YaNu7Wx622ggRG9gIOLoQMob2bHw4Icib
Пакеты для продуктов пищевые универсальные полиэтиленовые 100 штук в коробке заморозка свч хранение,354 ₽,5 отзывов,"Завтра доставит Ozon, продавец БРИЗ",https://www.ozon.ru/product/pakety-dlya-hraneniya-produktov-goroda-150042598/?asb=A3a9NRbdYIPMpxjdHBz3MKKAuCS1z%252FsCSEfuegdSKRo%253D&asb2=qfriq_AlOEvd7z1GVLk9QvxUVQxrjzWS85b0La8-Iz2u11udbSJMtNIMDxl2IisP
"Насос вакуумный ручной механический для откачки воздуха из вакуумных контейнеров, зип-пакетов, винных бутылок",499 ₽,7 отзывов,"7 мая доставит Ozon, продавец SunKit",https://www.ozon.ru/product/nasos-vakuumnyy-ruchnoy-mehanicheskiy-dlya-otkachki-vozduha-iz-vakuumnyh-konteynerov-zip-paketov-468402808/?asb=eppoj%252B2BXWFduMWntuYH1u0vSB6lybXT7FK%252F2rJjo%252Bg%253D&asb2=iuHZBUuWc2oUV-QlcQqPMZZMQt6f4OXvIdURa8NNNQi4JF1VhaE6g-K95DwnD3ZN
"Мини насос для пищевых вакуумных контейнеров и вакуумных пакетов, ручной",324 ₽,17 отзывов,"Завтра доставит Ozon, продавец ООО « Найтов »",https://www.ozon.ru/product/mini-nasos-dlya-pishchevyh-vakuumnyh-konteynerov-i-vakuumnyh-paketov-ruchnoy-147466981/?asb=2a%252FQ49J1aPhbyODucxYsMu9tPbcMz7ckROeisVzU6Q3NzNesdT2zJ3Oc%252BKR87X4%252F&asb2=jCFfWxlfeNEDyZ2B7D8JS18VCQRnbv7wr0UMyvQcigb46iF1lQC7IUTzoG1hghwCknXAlQ_211eRN3Nx2qk5QcUzjsNllPblgM4Dz1xpbl0lJR1wlroIArs5VTDnOUCUSq02HC8Qpf27v8Kg-Ksw_A
"Держатель для мусорных пакетов 25 см х 17 см х 6 см навесной / Держатель мусорных мешков кухонный, крепление на шкафчик / с открывающейся крышкой, встраиваемое, на кухню, для кухни под мойку, для офиса, Мусорный контейнер, бак, корзина для мусора, Урна",599 ₽,13 отзывов,"Послезавтра доставит Ozon, продавец Trendz",https://www.ozon.ru/product/derzhatel-dlya-musornyh-paketov-25-sm-h-17-sm-h-6-sm-navesnoy-derzhatel-musornyh-meshkov-kuhonnyy-482305815/?asb=4iWIvpqufV0oNpZkdt%252BcNgQJyZzKTIpUuJN9ZryWK%252FlGVUoauXh3zY%252F8G%252Fvs0443&asb2=mdfTNsfFOcOURH0xm5N5TJLhKeYZRM3qbqxLdj43XEX82RKyxvPwK1BsXk3TDk5mayWybVsgL4EeCrT67uR57Mgo5OFYllp450SpSSiKUAv8fRnr3FNqFyXvWxZPt4FF6vXxdSUisz8O6IBruyc9KA
"Насос для пищевых вакуумных контейнеров и вакуумных пакетов, ручной",278 ₽,10 отзывов,"7 мая доставит Ozon, продавец ООО « Найтов »",https://www.ozon.ru/product/nasos-dlya-pishchevyh-vakuumnyh-konteynerov-i-vakuumnyh-paketov-ruchnoy-147546210/?asb=h3WTWL7Z16h%252Bu4UBxKo%252BNubXO8Ei%252F6ZTOqOpNkXl0gY%253D&asb2=mTDrTS04BgV9joVdYpzptI1N5_19dFbJEQdKlFmtEPRWoR9VYD3-Nkeg_OiDaFwD
Ацетатная пленка для торта Лента бордюрная для тортов Форма для муссовых десертов Коробка Упаковка на торт Подложка для шоколада Кондитерская Форма для салатов Кольцо кулинарное для сборки выпечки Украшения для тортик Трафарет Декор печенья на Праздник /,258 ₽,33 отзыва,"Завтра доставит Ozon, продавец 1=",https://www.ozon.ru/product/atsetatnaya-plenka-dlya-torta-lenta-bordyurnaya-dlya-tortov-forma-dlya-mussovyh-desertov-400980231/?asb=lHFI4HWRKxKMue9ABI1YrkSLbOA8J9UxRIUkiQ%252Bff1RlRPUSnLHoxA9tguI1kzxv&asb2=VMIqIOiLi9f8jlD2Wy_hPhVsm9PmDOyG4qjS2PR2DXRUUJhAaEtryVHLi2t0EzJ_ybWtCtPtCl1Bwf6FftVpLalx_pZIXXmyqfYdwUwfwOnwt-fkxu931ijjaMm_A7_o85JAy8isysiGMwkAQ3UwwQ
"Мини насос для пищевых вакуумных контейнеров и вакуумных пакетов, ручной",324 ₽,17 отзывов,"Завтра доставит Ozon, продавец ООО « Найтов »",https://www.ozon.ru/product/mini-nasos-dlya-pishchevyh-vakuumnyh-konteynerov-i-vakuumnyh-paketov-ruchnoy-147546189/?asb=J1ovRcTRs39Ew9HJAgycd2%252Fqv0FvgzZYbmc8N%252Flp1IE%253D&asb2=FxzJDhqWLnLL8WZhvfSCnVH_ysJC-SOGodEEsHyPSyli4XQWeEl68NYLlp5E14wV
"ВАКС-82Б Исток набор для вакуумного хранения продуктов (9 крышек КВК-82, 1 насос НВР-3)",645 ₽,1 отзыв,"8 мая доставит Ozon, продавец БОРНЕО24",https://www.ozon.ru/product/vaks-82b-istok-nabor-dlya-vakuumnogo-hraneniya-produktov-9-kryshek-kvk-82-1-nasos-nvr-3-391230925/?asb=UtJ4V5iTa6SptE49DwqcA52BJZXWTbfy8KamSJIal80%253D&asb2=Lh4k8eweWQ0SRmzBDa0UgaLSPCuUPlKAJndwJHFPYm2lMIRzZyQ-Q0S36c2dKLZC
Насос ручной для воды,442 ₽,2 отзыва,"10 мая доставит Ozon, продавец Dream shop",https://www.ozon.ru/product/nasos-ruchnoy-dlya-vody-294677887/?asb=jg9rsSxJ6BJwiemOSrhZSTO4XLK51tx%252FSMb%252F0jpTM%252BI%253D&asb2=CFKwYbzveTGECUQemLSBz0sqrlWdHufiRlBjZFwcHEF-CR6DAt48HY_L90qqC6tR
Насос Вакуумсэйвер,630 ₽,2 отзыва,"8 мая доставит Ozon, продавец Веста-Престиж",https://www.ozon.ru/product/nasos-vakuumseyver-374372021/?asb=eDlNqreYOT48VriQ7Rbuhah%252BIlbke52nA5%252FrW4%252FxKxU%253D&asb2=-2oG05uloAYYiJr39lqm6FAzDyoJsg8mkyLdJfaigb7C0uPwvTHUE9pWn_-aSdri
кухонная раковина стеллаж для хранения,565 ₽,1 отзыв,Из-за рубежа доставит продавец poasdcb,https://www.ozon.ru/product/kuhonnaya-rakovina-stellazh-dlya-hraneniya-426088098/?asb=krcsKD1NTWdKDsq5IKS%252BFiH%252B5Uqra2oyrTPpe6Q1yAy1jLq%252BpjCRlUy6TdoX2bSR&asb2=cC49BNp_9sXNuj03f50BCcIIG62ScacPr6VJYFb72V3rEMLEOjNLhlYqCxo0n8zMjowzJOhOk-ykHVm2q7rgzKZNhTEmcUGjaFdaVjQZmKLAV3OU6FcVamGr25JBErCe5ZHuicWX6s6uh2u_ckF_IQ
Насос для системы вакуумной консервации продуктов,331 ₽,1 отзыв,"7 мая доставит Ozon, продавец МДС-НН",https://www.ozon.ru/product/nasos-dlya-sistemy-vakuumnoy-konservatsii-produktov-258076082/?asb=NTe9BUFqfvFYEBFjRqEmMzhNb7kcF6jSO5jcPovEWdo%253D&asb2=J_W2KtqHbd7FObeOJII5-elC7B7Awv-TBPaykCyYc95-5pcPW2w-G7wbXV7_UE4-
"Насос вакуумный ручной механический для откачки воздуха из вакуумных контейнеров, зип-пакетов, винных бутылок",499 ₽,7 отзывов,null,https://www.ozon.ru/product/nasos-vakuumnyy-ruchnoy-mehanicheskiy-dlya-otkachki-vozduha-iz-vakuumnyh-konteynerov-zip-paketov-468402809/?asb=D%252B9uhftv6hNa478rEksUdRlXZ5AiRwu4G1d9EiXod5c%253D&asb2=6hLWskXViJxu3SOklabtS12CtwzIv9Vz1klXS50D09bjt-Xqhqf0qPLtNwN5ifnr
"Насос для вакуумных пакетов см, цвет жёлтый",173 ₽,6 отзывов,null,https://www.ozon.ru/product/nasos-dlya-vakuumnyh-paketov-sm-tsvet-zheltyy-213594579/?asb=azgrPXADLrcXXEFzhKlrxrcaLiRNFOjQ7hiBu3cTk2I%253D&asb2=NP9nuB7GTYez3IM99kto9NV04lMJXJBFsQihzfY8NYvue2VQdF60X_VReFZBRsnr
