Про Сон Матрасик в коляску / Вкладыш в автокресло,559 ₽,133 отзыва,"Завтра доставит Ozon, продавец ПРО-СОН",https://www.ozon.ru/product/pro-son-matrasik-v-kolyasku-vkladysh-v-avtokreslo-293491111/?asb2=Tq-ZXWk9AUMS7O8eo9uDDUNiVH22Om4yZNwi_fVmQW7rAX8im6bOd8VZKhCxyTef7EDmiUeATtakSGzIcj-ZwQ
Держатель универсальный для балдахина,660 ₽,19 отзывов,"13 мая доставит Ozon, продавец ГНОМ",https://www.ozon.ru/product/derzhatel-universalnyy-dlya-baldahina-265844660/?asb2=_iIdvq4QZN1xjd63hoEoEo0Is-CAEdPkBmYyJrquLv8ki6zaMHRR5ZH22i0W-w2x
"Детская подушка Мягкий Сон ""Baby"" бамбуковое волокно 40х60, 40x60",599 ₽,64 отзыва,"Завтра доставит Ozon, продавец ООО «Мягкий сон»",https://www.ozon.ru/product/detskaya-podushka-myagkiy-son-baby-bambukovoe-volokno-40h60-40x60-352017829/?asb2=LXNYqs8NQVbS6qyncGVNp-Dg6Nbgb2R60HqN4WWgt-QNF7TyL9TZhonkoy43x26iPz6Wpkm77mAwDhfSYZpzPw
"Наматрасник защитный, Наматрасник-чехол водонепроницаемый с резинкой по периметру 60x120х30см",470 ₽,104 отзыва,"Завтра доставит Ozon, продавец КПБ Уют",https://www.ozon.ru/product/namatrasnik-zashchitnyy-namatrasnik-chehol-vodonepronitsaemyy-s-rezinkoy-po-perimetru-60x120h30sm-339345802/?asb2=uL-oNIq0xhQe5lQS3ZUTN0yzODFKkZGG3rgu3HR4EhHI9y22UFXFjvGTsKU4B50Q
"Держатель для балдахина ""Карапуз""",680 ₽,58 отзывов,"17 мая доставит Ozon, продавец ""Kid_MagКРД""",https://www.ozon.ru/product/derzhatel-dlya-baldahina-karapuz-373382542/?asb2=nsqAFI9GcfhrjFBdglcVcfyODLBOCETm0b5fiKk4tEQaZAgeKBMxBXDyYjvV3TH4aMVxzjGtJYdldzxt189Sjg
"Одеяло детское Мягкий Сон ""Baby"" бамбуковое волокно 110х140",968 ₽,38 отзывов,"Завтра доставит Ozon, продавец ООО «Мягкий сон»",https://www.ozon.ru/product/odeyalo-detskoe-myagkiy-son-baby-bambukovoe-volokno-110h140-352015178/?asb2=38apliHoytSpWCWYRMD5U28roLxK4Zn4iJ3udbMTXhBRI9WqD0-J1Jk4-A0Hcm0NS6uVOwVZ1z7Ki7-CIVZRag
Гнездышко-кокон для новорожденных,850 ₽,57 отзывов,"14 мая доставит Ozon, продавец ZOSIA",https://www.ozon.ru/product/gnezdyshko-kokon-dlya-novorozhdennyh-508909661/?asb2=h_vDivBXFXdZ5f7dmpH4qDsWq9ikslCuW_-M_QlfamEDwQCQRerKO0RLbT4l9YqC
"Детская подушка для новорожденных и малышей, в детскую кроватку, коляску, стеганая прямоугольная, наполнитель Бамбук, 40х60 см",537 ₽,190 отзывов,"Завтра доставит Ozon, продавец ИП Дьячкова Т.В.",https://www.ozon.ru/product/detskaya-podushka-dlya-novorozhdennyh-i-malyshey-v-detskuyu-krovatku-kolyasku-282812074/?asb2=44kR8rX0-9S8VJLjCXpUbn58hwG1NG4NHRUKACJLZ1-fY07kFi6FC4EMhvw4WtbiBVHm8rDehu91b-BGYO2dZA
Защитные накладки на кроватку 2 шт (комплект) 118 см из ПВХ цвет прозрачный Антигрыз Грызунок Накладка на бортики в детскую кроватку,302 ₽,21 отзыв,"Завтра доставит Ozon, продавец Piccolo detki",https://www.ozon.ru/product/zashchitnye-nakladki-na-krovatku-2-sht-komplekt-118-sm-iz-pvh-tsvet-prozrachnyy-antigryz-gryzunok-441083881/?asb2=6LyE-DrSpSJeHsMx4JgSh9j3KQK99nthnAn7t51cM2ybhfbcdR7bli5oo7e-baus
"Матрас детский Беспружинная модель, Беспружинный, 60х120 см",990 ₽,2 отзыва,"19 мая доставит Ozon, продавец ТК Партнер",https://www.ozon.ru/product/matras-detskiy-bespruzhinnaya-model-bespruzhinnyy-60h120-sm-503835453/?asb2=FNsNRRxQH09Xoqrdvni2eGjmQ4owPe3x4FG379MtbRovnfOWZ8SmgY0g9CBoXBOQ
Простыня Золотой Кит Звезды на сером 120x60,359 ₽,149 отзывов,"Завтра доставит Ozon, продавец Золотой Кит",https://www.ozon.ru/product/prostynya-na-rezinke-157597188/?asb2=nLm8R0Ojt4r4AuF9J18G1cakOBHgA27KDNUkfh0TzEDMh4uItuYNd4H-YPLimt-S
Наматрасник защитный Седьмое небо Наматрасник непромокаемый махровый с резинкой по периметру 120x60х14см,504 ₽,116 отзывов,"15 мая доставит Ozon, продавец Седьмое Небо",https://www.ozon.ru/product/namatrasnik-zashchitnyy-sedmoe-nebo-namatrasnik-nepromokaemyy-mahrovyy-s-rezinkoy-po-325237822/?asb2=-QjdzXa_0G8-GjmJJ1VaNu4NNJLfRteiXMrDeCyU9iKiBa7LNHsNZFuJy153SLsCz0x-FriVMyxaSp3t5R2ueg
"Простыня СПАРТЕКС швейная фабрика для малыша Бязь, 80x160, лес",620 ₽,14 отзывов,"Завтра доставит Ozon, продавец Швейная фабрика Спартекс",https://www.ozon.ru/product/prostynya-sparteks-shveynaya-fabrika-dlya-malysha-byaz-80x160-les-534785544/?asb2=4S5VaFbpRxVSI59CZsjK4arqdjQTObXMMZ5SVTbgqrWyB_d_wuSTG5aBN54LDH3e
"Patterhome / Подвесной органайзер для хранения вещей, 4 отделения, складной, 84х30х30 см",737 ₽,1 отзыв,"Завтра доставит Ozon, продавец Patterhome - для дома и интерьера",https://www.ozon.ru/product/patterhome-podvesnoy-organayzer-dlya-hraneniya-veshchey-4-otdeleniya-skladnoy-84h30h30-sm-508856797/?asb2=u_HhDUVoB2xg7ZuaoqM8fGNvKG_oSxiRJN2enAt8tCx-_sNU4Po5FJ-NxQUFk-gYEvIvxJ5bKonQ3bgDaEHm0A
Балдахин для детской кроватки Топотушки Облачко 112,849 ₽,140 отзывов,"Завтра доставит Ozon, продавец Рант детские товары",https://www.ozon.ru/product/baldahin-topotushki-oblachko-112-208001437/?asb2=lPUmFhUFOolU8KyJ9FkuIDEvqnwXO4WVDTWiePMxIKx0WUqf4E1UWbVHlMme6LzMHi96T37l2gZhTisNxPk47g
Наматрасник защитный VarFabric с непромокаемым бортом (водонепроницаемый) 60x120х20см Белый,635 ₽,184 отзыва,"Завтра доставит Ozon, продавец VarFabric",https://www.ozon.ru/product/namatrasnik-zashchitnyy-varfabric-s-nepromokaemym-bortom-vodonepronitsaemyy-60x120h20sm-belyy-240219548/?asb2=0vPuh0stVuEswHcmI3SP7OSOxg2zoO7bODhjtKqCSnlEu4o7sU66pkMqWxs5OzwbXrx9sNu0Q1Fd19Y4JHNL2Q
Наматрасник защитный Baby Nice с водонепроницаемой мембраной овальный 75x125 белый,713 ₽,35 отзывов,"13 мая доставит Ozon, продавец ИП Дьячкова Т.В.",https://www.ozon.ru/product/namatrasnik-zashchitnyy-baby-nice-s-vodonepronitsaemoy-membranoy-ovalnyy-75x125-belyy-322702839/?asb2=n8JZHoxC77SVTYk1bVrpia-pbz72sLhdAt7bJjKVdAhFo_Ithml0a6u6DyNuOK21WzEa-a5T0eKavzNn5udKUw
"Одеяло детское 110*140 см с наполнителем""Файбертек"", стеганое, всесезонное, с чехлом из жатки",597 ₽,87 отзывов,"Завтра доставит Ozon, продавец ТД ""ВОЗНЕСЕНСКИЙ""",https://www.ozon.ru/product/odeyalo-detskoe-110-140-sm-s-napolnitelem-faybertek-steganoe-vsesezonnoe-s-chehlom-iz-zhatki-483753736/?asb2=B5XqtZURHG-wJVaXF7UfoGOfU0wf1LJGp29CmbV38X1Zet_Vb6rE9CJZfPEXtGIp
"Детская подушка Luna HOME Подушка для малыша 40х60 см, 40x60",370 ₽,39 отзывов,"10 мая доставит Ozon, продавец Luna HOME",https://www.ozon.ru/product/detskaya-podushka-luna-home-podushka-dlya-malysha-40h60-sm-40x60-392999243/?asb2=uOr2PK5eG-sY9Azr4C0wwR1ZG89vUGGkjNF79GNIvQn2XIX2jqwiUhImdGoeFZLF41Q6twxMgDYEYQGCZrcRSg
Наматрасник защитный ARLENI HOME Наматрасник 90x200 белый,595 ₽,95 отзывов,"Завтра доставит Ozon, продавец TTH-РУС",https://www.ozon.ru/product/namatrasnik-zashchitnyy-arleni-home-namatrasnik-90x200-belyy-290022311/?asb2=tVN3rk5kqsgwBbNM9evSV8b4Ez2Kf51hijuIqJZiRNIAlyprjFlveut8s9rn-2Vz
"Простыня АВ-Групп Простыни одноразовые в рулоне 80х200 см. одноразовая с перфорацией, 15 гр/м, 100 шт., белые 80x200, голубой",893 ₽,17 отзывов,"14 мая доставит Ozon, продавец WBCOM",https://www.ozon.ru/product/prostynya-av-grupp-prostyni-odnorazovye-v-rulone-80h200-sm-odnorazovaya-s-perforatsiey-15-gr-m-100-376282579/?asb2=tkkiHnGfytNUfaIoEOnNyNQ6uM9fCI-YN1L5xi77hY_jYWncCW9Ss5ckdcpStAZl3QX6Aw6JFH3T6GZHPbcudw
"Наволочки 50х70 2 шт хлопок комплект с клапаном на подушки для спальни , натуральная нежная ткань",357 ₽,159 отзывов,"9 мая доставит Ozon, продавец Атмосфера",https://www.ozon.ru/product/navolochka-atmosfera-50-70-v-komplekte-2-sht-byaz-tsvet-belyy-byaz-hlopok-s-klapanom-50x70-sm-202620252/?asb2=5HoJm_i24DxP8FhK-A-4iPLFdKxKdaxi7hvCEwOwmbBOtpcxORsD2LeYClkOQm1gupR6584qnk0XX2aoox0c9g
"Подушка для новорожденных OL-Tex Baby, 40x60",391 ₽,4 отзыва,"Завтра доставит Ozon, продавец Ол-ТЕКС",https://www.ozon.ru/product/podushka-dlya-novorozhdennyh-ol-tex-baby-40x60-514711772/?asb2=67G8KlPLM2Z3bBjZi_-qFN5aMs2DVDaumTcBSUX2t_2-4B8YXHQe0qYIoi8Gm9iE
"Одеяло детское 110*140 см с наполнителем ""Файбертек"", стеганое, всесезонное, с чехлом из полисатина",618 ₽,87 отзывов,"Завтра доставит Ozon, продавец ТД ""ВОЗНЕСЕНСКИЙ""",https://www.ozon.ru/product/odeyalo-detskoe-110-140-sm-s-napolnitelem-faybertek-steganoe-vsesezonnoe-s-chehlom-iz-polisatina-483712317/?asb2=0qjbLArZw4dLx2TZRUPhU14h0LAy2oY1-94UKpYBBIzDmzPbEQh1PDOv0L_twJiH
Кокон для новорождённого Мама и малыш,998 ₽,29 отзывов,"13 мая доставит Ozon, продавец Мама и малыш",https://www.ozon.ru/product/kokon-dlya-novorozhdennogo-mama-i-malysh-292623260/?asb2=WRMBJvGdqLtx9JJNnOV3FQ_QitCcRMsV31OGJqciA8ajMY8SOo4bbrcknyt2CcwU
Постельное белье в ясельную кроватку Stellina mia,649 ₽,21 отзыв,"13 мая доставит Ozon, продавец ООО ""Мирабелла Р""",https://www.ozon.ru/product/postelnoe-bele-v-yaselnuyu-krovatku-stellina-mia-514072463/?asb2=MfqFXe3gyKKF6P2dCEpI5UlsjXhGLn-BuqPHvSlvaAMkk1Hy0lG9l3McarSb7Hyn
Простыня Золотой Кит Мишки голубые 120x60,359 ₽,38 отзывов,"Завтра доставит Ozon, продавец Золотой Кит",https://www.ozon.ru/product/prostynya-zolotoy-kit-mishki-golubye-120x60-317293902/?asb2=hd0dlkyhlOWZFARXSraDUqgnQEhGAucPeRPbFPKgLS5mk-zCVUPRW8nhLG530IMz
"Наволочка ГК Лидертекс, бязь, Бязь, 70x70 см 1шт, Вензель компаньон",172 ₽,1 отзыв,"Завтра доставит Ozon, продавец ГК Лидертекс",https://www.ozon.ru/product/navolochka-gk-liderteks-byaz-byaz-70x70-sm-1sht-venzel-kompanon-531749649/?asb2=qX5F8R_3fBa9pqM6KAujNGnTOj1hGRJjf-ifUWsJ63wJivTwFlp0jCrUfyT_-7aq
"Наматрасник детский с водонепроницаемой мембраной Аквастоп, 60х120см, с сеткой по периметру, белый",570 ₽,83 отзыва,"13 мая доставит Ozon, продавец ИП Дьячкова Т.В.",https://www.ozon.ru/product/namatrasnik-detskiy-s-vodonepronitsaemoy-membranoy-akvastop-60h120sm-s-setkoy-po-perimetru-belyy-322692817/?asb2=K4xo7GxSk_d-UXDs-FFQjLVsYptvHRZSSLDUZPITTkhVlq3qz_pdVhFbXs3T66gwPEw1HtwzJsHAEmjL4CnOQQ
"Простыня Lemony kids круглая на резинке Africa , светло-серый",342 ₽,33 отзыва,"Завтра доставит Ozon, продавец Lemony kids",https://www.ozon.ru/product/prostynya-lemony-kids-kruglaya-na-rezinke-africa-svetlo-seryy-311230814/?asb2=VMtx5LQPBFGsYtnwUzOhoACEDkUhCD_POBI6Z6BKdHZTBaGOzyM4RqGPG3j4WK0e
Комплект постельного белья Детский в кроватку Галтекс Клеточка бежевый,522 ₽,181 отзыв,"Завтра доставит Ozon, продавец Галтекс",https://www.ozon.ru/product/komplekt-postelnogo-belya-detskiy-v-krovatku-galteks-kletochka-bezhevyy-235110323/?asb2=d0-69oxau1xa9S6lP3k-pF47h18Y6lEuuZiN9Ur_ya-GqLMy31jKVCUvzaoSpOok
"Подушка для новорожденных Облачко Лебяжий пух, 35x55",741 ₽,166 отзывов,"Завтра доставит Ozon, продавец Нордтекс",https://www.ozon.ru/product/detskaya-podushka-oblachko-lebyazhiy-puh-35x55-213527158/?asb2=p20x4MHaDFjdnG-jrUsEGF5DQpE4mwpafod1qVMlRF_qulP3IMWWDJgSouUeviiO
"Одеяло детское ""Верблюд"" пэ 150г/м2 чемодан с наполнителем ""шерсть верблюжья"", 110*140 см",591 ₽,3 отзыва,"Завтра доставит Ozon, продавец Tex-torg",https://www.ozon.ru/product/odeyalo-detskoe-verblyud-pe-150g-m2-chemodan-s-napolnitelem-sherst-verblyuzhya-110-140-sm-476086262/?asb2=qHLdu3HQCgGthHUkxBDspQBTWFLiqVwsy1A79owAfqO5-7jsqCEZUjk-qxhQXEPZ
"Наволочка Золотой Кит, 101, Поплин, с клапаном, 40x60 см 1шт, Разноцветный",259 ₽,185 отзывов,"Завтра доставит Ozon, продавец Золотой Кит",https://www.ozon.ru/product/navolochka-zolotoy-kit-zvezdy-poplin-s-klapanom-40x60-sm-1sht-196511469/?asb2=5oFu6NFLkM5K70yODwp3djk-an21mD9tQyuuj3XMaYPyK0MVGyhxVgY_rS0J7guQ
Наматрасник защитный VarFabric с непромокаемым бортом (водонепроницаемый) 80x160х25см Белый,990 ₽,184 отзыва,"Завтра доставит Ozon, продавец VarFabric",https://www.ozon.ru/product/namatrasnik-zashchitnyy-varfabric-s-nepromokaemym-bortom-vodonepronitsaemyy-80x160h25sm-belyy-239033689/?asb2=-JYYGl6wja9ZGELJ_Z5j9RW-4KCR5zLC7nRcO8VLB1lakJcMdyhnK5pxiRlYCfJUzKYUtED-WAWng9MJKs2X_Q
Одеяло для новорожденных в кроватку на выписку в коляску для весны и лета 100х75 см,453 ₽,12 отзывов,"15 мая доставит Ozon, продавец Седьмое Небо",https://www.ozon.ru/product/odeyalo-dlya-novorozhdennyh-v-krovatku-na-vypisku-v-kolyasku-dlya-vesny-i-leta-100h75-sm-513158837/?asb2=0QmK-GN_6QGfC7MMe9ozW2X6NY6holIUq0UXGuHcMjMo7d91YC-kfg8emUchAFK8YBY6aGbp6wGXIOV46LoLSA
