"Зажигалка кухонная пьезовая, 1 шт.",289 ₽,34 отзыва,"Завтра доставит Ozon, продавец Sibir",https://www.ozon.ru/product/zazhigalka-kuhonnaya-pezovaya-1-sht-287416971/?asb=przB85%252Bp%252BftBYCtBb0FQXQ2kmsr2kynIKd8iM8AyaTk%253D&asb2=bueFyC0ZGXix9LYzh9FVZOs7quod2rdePPcjFS-P3E-GTGOdhNsU7Jb_sWis1jWG
"Birdhouse, Электронная пьезозажигалка, Зажигалка кухонная, Многоразовая бытовая зажигалка для газовой плиты",859 ₽,42 отзыва,"Завтра доставит Ozon, продавец SS&Y Group",https://www.ozon.ru/product/birdhouse-elektronnaya-pezozazhigalka-zazhigalka-kuhonnaya-mnogorazovaya-bytovaya-zazhigalka-dlya-283620309/?asb=mH%252Bm9h6%252Bsk4G2KEisH78m4n9ItoiPGeiEElrr0p5bOg%253D&asb2=Uzi7s5gaA698OxfMJBpB5tPY09LX-VXj-B5z1V5fXl92H9iRPAzkMi9L_nEgNZia
Зажигалка кухонная HomeStar,167 ₽,19 отзывов,"Завтра доставит Ozon, продавец Скрап",https://www.ozon.ru/product/zazhigalka-kuhonnaya-homestar-307854328/?asb=c9ZM%252Fd8kgomV1tUAh6Kd1YbJH3N8kprSSXBty6nt67U%253D&asb2=VYs-_twxX99R4A9pI9exzgYOXiO-TSlJ8QnsNn27NBSTy5ge8WElng3zZlq1_Eei
Зажигалка кухонная HomeStar,179 ₽,27 отзывов,"Завтра доставит Ozon, продавец Скрап",https://www.ozon.ru/product/zazhigalka-kuhonnaya-homestar-308069913/?asb=b7df6sdgPVOW5jZso6aMv4bMyhSsq4Wegcuo5FFT92E%253D&asb2=HGV3RhtGUECaED7i09cI6vqLfNLFlRQE4BXUJiRqgJ7AaWf316eO1c_yWBKs4tci
"Зажигалка FACKELMANN для газовой плиты, 25,5 см пьезозажигалка",327 ₽,105 отзывов,"Завтра доставит Ozon, продавец ООО ""Факельманн""",https://www.ozon.ru/product/zazhigalka-fackelmann-dlya-gazovoy-plity-25-5sm-148273679/?asb=eWSl0bGjTSJoB0mcbwxgKFhSx2wMCN3nqulpJTfEIdY%253D&asb2=adMs4KR5JWXabzdGh-CtutW_oFD338Pz8F53Ej8bhVaciz9bWkp_ifvTKGfzdupE
"Зажигалка кухонная электрическая (от сети), 1 шт.",339 ₽,34 отзыва,"8 мая доставит Ozon, продавец Sibir",https://www.ozon.ru/product/zazhigalka-kuhonnaya-elektricheskaya-ot-seti-1-sht-566589840/?asb=XZYk9B1T2cwnbGauf8TLjxs1V5Dgtzo%252F01pSDWc9AJw%253D&asb2=IHAhg8sNvNtgdcYn6QiOX5OHpaaxDuks4EOpxp9dxBI6JU-yCWDPMHnDM_bAq5w4
Зажигалка кухонная Волжаночка электрическая (от сети),450 ₽,69 отзывов,"Завтра доставит Ozon, продавец Светиком",https://www.ozon.ru/product/zazhigalka-kuhonnaya-volzhanochka-elektricheskaya-ot-seti-347100728/?asb=moNDJz9M%252FTU3YRBKSTatxZVqca3FM%252FBJp8sTVBV8jpA%253D&asb2=LNG6XvV96yCdnfcP7zoNqGpkxuV5Vff8AlwWvPQ4v9X5UCTfJxLhKsQW478kxtiC
Зажигалка кухонная Goods4U электронная,890 ₽,13 отзывов,"Завтра доставит Ozon, продавец Сomfort at home",https://www.ozon.ru/product/zazhigalka-kuhonnaya-goods4u-elektronnaya-343774465/?asb=ox2uV7IoaWCI2dxsljTMBb8J8pq1UkjqLdeabHe%252BQe0qalITWgGQkPjqmGVtVAqC&asb2=uS8c-DdjH5tkU00xPiEHBXpbHZlcld277dHlwfhlarE8qNFqeuoG2g-pBNIgbgwTAdNEZLjh5XvPTahu-gMC6bwOL7D3WdRacBRyKe77j2L0V4S-ArCsMtxEGI1z2G9mxN-thOm_g1pLH-x8KGtKww
Зажигалка кухонная Весёлый садовник газовая,360 ₽,77 отзывов,"7 мая доставит Ozon, продавец Магазин ХозТорг",https://www.ozon.ru/product/zazhigalka-kuhonnaya-veselyy-sadovnik-gazovaya-268952417/?asb=V95kSC3d7yHHBEWvsIbETv%252BgR7xMz2U1DP%252FavieB8qaYELsIuWphXSggDowVVp4V&asb2=IK7ukCgD_Q1yQRdUWHB6uZdxIdseeZgo47X4aiec9G2bDUw7Lmty2xgL8oOK9_GYn5nhXjsBo2GX_4UIH2ftlHtUpnp3QYBIqd0HnmGGsnf_A1QGEXhaysMp88_GPWFso1uhCPG6sWBfL93Hhm6-VA
"Зажигалка кухонная MAXCHOICE газовая, 1 шт.",475 ₽,6 отзывов,"Завтра доставит Ozon, продавец MAXCHOICE",https://www.ozon.ru/product/zazhigalka-kuhonnaya-maxchoice-gazovaya-1-sht-529250885/?asb=YcQYMZtnVdyieU3o3PkBM5EVICQ9foCAP9XpbNAaxw0%253D&asb2=NNTN4nlXKaEBNDLfgDjdjpn483TfA97cnFYF-YYeblk-YIQXwCqRLAkI6kngy_T9
"Зажигалка кухонная пьезовая, 1 шт.",197 ₽,2 отзыва,"7 мая доставит Ozon, продавец Happy box",https://www.ozon.ru/product/zazhigalka-kuhonnaya-pezovaya-1-sht-544563362/?asb=1U81zOjUGp3MNXSCX4GDOhBKsxji8dSk%252F1BJZZB1z4xJ39ombEcMDMhhfuTfSmwo&asb2=MmBfcQ6YiPhFXly53rIeFuahjgf40QX3n_sE85lJiaV2MFOpmDC2DyAifAOMVn8HfBw_yk_z6D1PRTHvaadbCY6o6nLsOFlU0cQnmC_lKq5INNLH7ifH2_zKww40uuw6VzkzuPs-1u_NK7MKJcamlg
"Зажигалка кухонная MAXCHOICE газовая, 1 шт.",475 ₽,6 отзывов,"Завтра доставит Ozon, продавец MAXCHOICE",https://www.ozon.ru/product/zazhigalka-kuhonnaya-maxchoice-gazovaya-1-sht-529250381/?asb=V4Fzq4ZGMYeRb6%252FG5Q6ZpT96qAcQGR%252BAWb9jZcBAz%252BI%253D&asb2=woPWRVdUg7lwB2YE0JFSfsn8VJ6tNxdu_EWzy4u4EC6IVdDq01mj1I1eq_8O5OF6
Зажигалка кухонная QXF электрическая (от сети),351 ₽,175 отзывов,"7 мая доставит Ozon, продавец myStore",https://www.ozon.ru/product/zazhigalka-kuhonnaya-qxf-elektricheskaya-ot-seti-224280399/?asb=eZbpeJnuBDeoba0o4omimEvza87eWjBJD%252FjL7JvUIMiCojFv%252BSGxSL9PnNwcVEf3&asb2=MeOL7GYvons1XmFBsDv5AyaPm53brB2hrlmgevKE6SglmtPT5kdFQfPjKArKrbuddt-43_HDXFQkoCX04O-QJw_ow-DKqGSg-D2KUnkRDOJsOJve0tLGS9OcZsMjoXapVcKAeJxrxVzLQ7qxuYXneA
Зажигалка кухонная пьезовая,371 ₽,39 отзывов,"Завтра доставит Ozon, продавец Callisto",https://www.ozon.ru/product/zazhigalka-kuhonnaya-pezovaya-260633285/?asb=zXHLhOGVpGPkW24xFaOLuPCApJsFHgM%252BoMfWujxe0zA%253D&asb2=xIx7rFrlsNtTTcvOrLe-uVuWNcnVs4YD6AhKGf8hRigm4_xH-KJnlwBplQSNkCGQ
Зажигалка кухонная газовая,207 ₽,163 отзыва,"7 мая доставит Ozon, продавец Family Store",https://www.ozon.ru/product/zazhigalka-kuhonnaya-gazovaya-306663002/?asb=w%252BTttntNP7n%252Fbt1rl7aUITNXK9LCGDuV37GW4FAqKeE%253D&asb2=v-M81AwdgILsaRIJ14z1WaXwmrCuUdrrcUA_n69j0SM0FktoXclAPt0o-sl7Qc7e
"Зажигалка кухонная, импульсная USB дуговая , ветрозащитная, плазменная, беспламенная, для газовой плиты/барбекю XH-702B Хром",900 ₽,2 отзыва,"Завтра доставит Ozon, продавец Русский Паракорд",https://www.ozon.ru/product/zazhigalka-kuhonnaya-impulsnaya-usb-dugovaya-vetrozashchitnaya-plazmennaya-besplamennaya-dlya-471929724/?asb=N4weUnqXHxvlhaqMMvk%252B%252FaeSF0RHuzeeshbwBAIpiVo%253D&asb2=Wma-iEEOK9MS1kXVTlchnYBZ5zvkNMm_qQeTAt7DsZAfaRD7rDSW7myQtZ9Fwvf-
"Зажигалка кухонная Bic газовая, 1 шт.",345 ₽,1 отзыв,"10 мая доставит Ozon, продавец Ozon",https://www.ozon.ru/product/zazhigalka-kuhonnaya-bic-gazovaya-1-sht-449085502/?asb=uWhCLKQ1xAkibv1xto3jKlx7KBEbtShikwv53tv%252Fvhw%253D&asb2=JdkyxhLscCjPRT4tc8ZdRY2ZVleKqDQr00QD_QNbAbV0QesgsqH3FH0WPTIPaz7W
"Зажигалка кухонная MAXCHOICE газовая, 1 шт.",475 ₽,6 отзывов,"Завтра доставит Ozon, продавец MAXCHOICE",https://www.ozon.ru/product/zazhigalka-kuhonnaya-maxchoice-gazovaya-1-sht-529205877/?asb=9t274kCt2%252FVknZbGJVMLD23kkzCPElSqMHygom4FVvs%253D&asb2=RI9-kUxe4qLBgmRatCLfELE96JNdQHEQzHnq6nqw_3zDfsMGjBnO4YsbY6t8nfxK
Зажигалка кухонная HomeStar,167 ₽,5 отзывов,"Завтра доставит Ozon, продавец Скрап",https://www.ozon.ru/product/zazhigalka-kuhonnaya-homestar-307851523/?asb=DKRNfsJfu1SWVWRHZsED3LXneQ8dLcfUSvIw9k0SE%252Bs%253D&asb2=FCSp56NlYo8ZPq3ijVXMNJ4mnxGTEj8_UD2roS27305NgGcFqy6G4Uy2yIKuOQ8Z
"Зажигалка кухонная пьезовая, 1 шт.",209 ₽,1 отзыв,"7 мая доставит Ozon, продавец isport",https://www.ozon.ru/product/zazhigalka-kuhonnaya-pezovaya-1-sht-544536232/?asb=LBnCqsh1MgRoDsm8Z4nltVOnKEy%252FWVA9DPwA5%252Fr81nffGdAhAXw0%252FmVOm33uJ%252Bz4&asb2=hQO-y4ez8gBuhv4vIDUwDL7WrVDoV5rPNNIL9BedwyRR4xSEiCJ1n9O74j8lQxnMbU6Q9Bjo_E0o97l1QsHp4h8hcDNPCN90yuvYzkgGsGVe8_Qyp9IC7MttWzHrYVVvJ0ZQtiMDSSSQzQRq6s8NTg
"Зажигалка кухонная MAXCHOICE газовая, 1 шт.",475 ₽,6 отзывов,"Завтра доставит Ozon, продавец MAXCHOICE",https://www.ozon.ru/product/zazhigalka-kuhonnaya-maxchoice-gazovaya-1-sht-529224749/?asb=Ux6mBHfNxhjrc%252B9yzG%252FT%252BU0yBqKcgafzTPV33E%252FNPXs%253D&asb2=wS5qCgkT5NFYMQrK5PkqnjODsPNbwkHh70s2jqEXK_2-UFLMwvFqzCPcJSTZyglr
"Зажигалка кухонная MAXCHOICE газовая, 1 шт.",839 ₽,1 отзыв,"Завтра доставит Ozon, продавец MAXCHOICE",https://www.ozon.ru/product/zazhigalka-kuhonnaya-maxchoice-gazovaya-1-sht-529268505/?asb=299KvFLmhER22ItJWXLzs26nBvQufGAvA4qow1Nbh%252FM%253D&asb2=Eew4iXDgVpesLgkrYuE_1XbPRhJpEN429U5sU7IcIZTFne1IQBqV1IXoAT3Hh3g_
Зажигалка кухонная LN газовая,265 ₽,43 отзыва,"7 мая доставит Ozon, продавец Уютный дом",https://www.ozon.ru/product/zazhigalka-kuhonnaya-ln-gazovaya-226708594/?asb=GX5LXhPpVI0upU6tAxfAArfs7iNOKvJMRhsDFH4NyK0%253D&asb2=pBYXDUUWaywNQ9rOwL4OWNs0bJgFgWNgg8rHlSYgkCR8l92JG5nphZ1kCqDB6MDv
Зажигалка кухонная пьезовая,606 ₽,33 отзыва,"7 мая доставит Ozon, продавец ЭК ЗИП",https://www.ozon.ru/product/zazhigalka-kuhonnaya-pezovaya-288719225/?asb=Qzd3KZg0ykNQbklJMmNY5bJuir6ua6yBztDrXXjyRY%252Brpl%252FnpHiCfCWDGMn0aw%252Fe&asb2=uDa_qzuiD0YpxayO8znTCYK04ik6iaVuyL007YkWW9727LAkiVRTjcAm-LUDdovx5T2VfoxFvptJy0WFqTqfkO0pxWtB5jCfYeWOZ1TgIJwCg3que4iU8jLIA2F6-u65pBcno66pQqG_G-SsfCRsBA
Зажигалка кухонная пьезовая,345 ₽,2 отзыва,"Послезавтра доставит Ozon, продавец Hinterhof",https://www.ozon.ru/product/zazhigalka-kuhonnaya-pezovaya-465363420/?asb=ZKopOt%252BK12OwuIcXsJ0Ku%252By7kvz%252BSQPDGBsblWTNJKs%253D&asb2=nJd4_Wjz7mc-8nSa88ghKJksklcDcn-wwvvxb_JIVOzN60a5LU0rKO-uA4V-ARYB
Зажигалка кухонная газовая,226 ₽,6 отзывов,"7 мая доставит Ozon, продавец Myshop74",https://www.ozon.ru/product/zazhigalka-kuhonnaya-gazovaya-293596059/?asb=byeFk3LIfeF7yBRBe2N4%252F%252BQX09GKbmq8Tmlzwpwt3XQWdl%252FNz79qpeASQn%252BcZFqb&asb2=X9AVVVVyga6wGNhWupVLgzc0B6VpXvyGjVNYJeEz1OkEhaeTAU_jGtFLBVUV7Xl6e2XBi3QCENV8o34evxZfgRDTWYom26074MkT22QLIpp3AcGEzlIwPght13wRUNIy7oa9eaqjo7MTLEOnKF5SRw
Зажигалка кухонная Energy,240 ₽,6 отзывов,"Завтра доставит Ozon, продавец Скрап",https://www.ozon.ru/product/zazhigalka-kuhonnaya-energy-307848417/?asb=JrG8exT%252FVYD6j%252FRvkHt5GavwmYJuSdurrm2nM86VKfk%253D&asb2=zZKLGPT5WM939vHtqBz5EkrRJkKCdJajqRzA0ccGqyDnLTSRQiWOfENb41mgQLuN
Электронная кухонная зажигалка с зарядкой от USB / электродуговая зажигалка / электроимпульсная зажигалка,990 ₽,32 отзыва,"Завтра доставит Ozon, продавец Сomfort at home",https://www.ozon.ru/product/elektronnaya-kuhonnaya-zazhigalka-s-zaryadkoy-ot-usb-elektrodugovaya-zazhigalka-268577815/?asb=NURswfRO19GQuA1vTCCYSJR2L9x%252BJ6QryrWNXqoS6u0%253D&asb2=aHWCIqjgjqtdO0OpcW5bqS-qCL1mNzUu7B74MG9C7cbHgDUMu7Rnf3eASgj6HR4u
Зажигалка кухонная LUXLITE,217 ₽,33 отзыва,"7 мая доставит Ozon, продавец Luxlite",https://www.ozon.ru/product/zazhigalka-kuhonnaya-luxlite-184649820/?asb=RJYEx8zptwScwTZZZoPtaiXfhYNNlussWEhyx5ntZGo%253D&asb2=ar2VchCg_eY5Ehbrfe2-iZM5-UGVFAki3VcT5OO4EgX1vpmlIWONPjMKzAXBZc2f
"Зажигалка кухонная BARAN GRILL газовая, 1 шт.",194 ₽,4 отзыва,"7 мая доставит Ozon, продавец Aira&Alin",https://www.ozon.ru/product/zazhigalka-kuhonnaya-baran-grill-gazovaya-1-sht-539031813/?asb=zqCXE96kguzuytU%252BP8kmmyuVANaDV7hQgKkK8zeK19fwQM5W0ADilNVpGMVaNIEa&asb2=IIi_ISvQeLdQaFhnyoLGO4frMNdflAL3dPW29a_BDupRw5KeVh3AQOr31ZI8ZFc4iGFJMgQd6JSlR5GMxPOCB2pd2YbXfHI5v8d97S1JIaXgm4yyzxFm7nmNaBKS0Qkk
"Зажигалка кухонная MAXCHOICE газовая, 1 шт.",475 ₽,6 отзывов,"Завтра доставит Ozon, продавец MAXCHOICE",https://www.ozon.ru/product/zazhigalka-kuhonnaya-maxchoice-gazovaya-1-sht-529229726/?asb=DnSk%252FlVN3PA%252FxFT0Aaq4nVWYre2WGkLplo1IIrirTjE%253D&asb2=rrscOUQt-5zqK1Urd8X0M-yYHaKStnIgQxv_xcdmJBBDT9CTkDkS82ibViHzqkN8
"Зажигалка кухонная G&C LINKS SKY пьезовая, 1 шт.",321 ₽,2 отзыва,"Завтра доставит Ozon, продавец ИП Корп",https://www.ozon.ru/product/zazhigalka-kuhonnaya-g-c-links-sky-pezovaya-1-sht-261349123/?asb=iM0uup5E8xDklPtx1wwkZXgcpthltGmO2b6aHpXMUQ0%253D&asb2=BO2W7jGQ9sn-X4ZXiakvX5qGDbAURxRNY9PVErhj7KQclL79FyPqtjdoyd-EmNP7
Зажигалка кухонная МИГ электронная,410 ₽,29 отзывов,"8 мая доставит Ozon, продавец БОРНЕО24",https://www.ozon.ru/product/zazhigalka-kuhonnaya-mig-elektronnaya-369260098/?asb=MVDmxj8FiW3r3%252BAjKOuIsc1Do%252BAeLr67BmNtPs94AwA%253D&asb2=PhqjrNvX4jf2Tp1Rlyf5-GggrmZSU3n2hGcbXasES2lfsuzvUrRUQLWZOrjgD5ML
"Зажигалка кухонная LUXLITE, 1 шт.",217 ₽,30 отзывов,"7 мая доставит Ozon, продавец Luxlite",https://www.ozon.ru/product/zazhigalka-kuhonnaya-luxlite-1-sht-184649818/?asb=KLSy2dSfoxjnRF23D5uuArB3otrH2N5LyiN2cWAmE3c%253D&asb2=QCqY8NqhkXGsEGXQYygxDNhkGuH3V8M6Hja9BGcm3AbtkkGij5OOPO90k7Xfdioc
"Зажигалка кухонная LUXLITE газовая, 5 шт.",479 ₽,14 отзывов,"7 мая доставит Ozon, продавец Kronax",https://www.ozon.ru/product/zazhigalka-kuhonnaya-luxlite-gazovaya-5-sht-373643291/?asb=EvVOpJPGtDH19WjjRuBqzc0RM9Apl%252Bw2nNie1gs22BiWIWOZ8qmzpnChlRkENVg8&asb2=ssKYrf8I3Mt-n_J5pA-mTvUdUaPfgiE0DuskDrIE7sZ53JLhIglWs_KpJYC73UgFjnU1rAYX1T9XTSSwlLDUwwA3Rup0_mBLXvlOzUqdYWlkQbbmgjllj1lidNLjMAQc0db-EYbTAJIQg1oaOTISDQ
Зажигалка кухонная WELMAX пьезовая,441 ₽,1 отзыв,"Послезавтра доставит Ozon, продавец TopAtom инструмент,хозтовары",https://www.ozon.ru/product/zazhigalka-kuhonnaya-welmax-pezovaya-474877053/?asb=hdsnOm5Suf63b9Gr11Bx7DtLejPx5av9pNjQgGmSDzC8hpFwbiwTxOaYk4QyUR0n&asb2=oSlw9HUnQBczmq1LiXeHy6SCunjw_PXXTOupPkzF1GCKllrh-6g0EE7USQP06NBtprqj9OQoliVcNEK7JdtSdNye_YE9XysA6uliw5q1apELDOv8jir7QkOsHi-rf8bVlxSlrWw7xeiYDZEOtAqD4w
"Зажигалка кухонная S&B газовая, 1 шт.",299 ₽,140 отзывов,"7 мая доставит Ozon, продавец Аксинья",https://www.ozon.ru/product/zazhigalka-kuhonnaya-s-b-gazovaya-1-sht-426165273/?asb=OJMkVkXgx1tNLchWCwUlIrV7E1EKT6NosxmcvDeT8jA%253D&asb2=7UYAROCLcO-U0sD8-CybkAUExzqa48zxs3oaKaL63gguvKpoJwEw81-GFJXMcGH1
"Зажигалка кухонная S&B газовая, 1 шт.",299 ₽,140 отзывов,"7 мая доставит Ozon, продавец Аксинья",https://www.ozon.ru/product/zazhigalka-kuhonnaya-s-b-gazovaya-1-sht-426167763/?asb=uP4g6G5lqAxfz9Zjgnra8LJ%252B34dEkNz%252BTtApOzaUgQ0%253D&asb2=Mtz4aKbEBKPY3w8mCXgbQhIRShGy7OZkyn_Y-eD64IAjAoVPz6nofmTKVLHoibgC
"Зажигалка кухонная BARAN GRILL газовая, 1 шт.",228 ₽,4 отзыва,"7 мая доставит Ozon, продавец Aira&Alin",https://www.ozon.ru/product/zazhigalka-kuhonnaya-baran-grill-gazovaya-1-sht-539015561/?asb=gk2gO6x35rUG1wzaZPAxA2jqyTjAMzWbWEeIM8ML6ByWgANwCHpNpzB6%252BaMarMj2&asb2=eA9xHaoO26KpQk3TgVED5ikQRZQLlP8CfjNl4iajnSpvehBfeCYivpsqKpP26k7uBlyEviArCSofmP4g1_OrIxNEUR7cerS3RLVzvxPm2I51zeIIfrFGJEpdJvTEnlz2
"Зажигалка кухонная LUXLITE газовая, 1 шт.",249 ₽,92 отзыва,"7 мая доставит Ozon, продавец Kronax",https://www.ozon.ru/product/zazhigalka-kuhonnaya-luxlite-gazovaya-1-sht-311250994/?asb=w4Td1O0GrpuLVbeuZDGGbIdE1iMKrkUKgbmWc8N371U%253D&asb2=4cgBQs7hCQm3ElX7XVlHX_At6WMCPkuhZJwutVefCPnaFAi3uMBpy4kFXaEJYfQ3
Зажигалка кухонная Ecos,283 ₽,11 отзывов,"8 мая доставит Ozon, продавец ООО ""ДАКОСТАНДАРТ""",https://www.ozon.ru/product/zazhigalka-gazovaya-ecos-68l-l-salatovaya-168095267/?asb=t%252B0Rhi%252FoZrptw%252FLJF%252FnCJAlJjUNdcg64eoKN5%252BS7lbw%253D&asb2=EdmWKjalBnUb3Umb6AJbgzb4y4LV7o-B8Ze_7RswLPs4xs15mckkID5xBNmufQzm
Зажигалка кухонная Tescoma газовая,730 ₽,15 отзывов,"Завтра доставит Ozon, продавец Tescoma",https://www.ozon.ru/product/zazhigalka-kuhonnaya-tescoma-gazovaya-332132747/?asb=p8KbDORsxwSbEhCYVSfEoZsg3hR%252Bq1FgiPJdrhg78no%253D&asb2=VkIT44tcgrU59htPe_L2-nNNYjcHN10ep40Ukc290JfuCSsRtq4s8t1jhgw7e6ue
"Зажигалка кухонная LUXLITE газовая, 1 шт.",249 ₽,92 отзыва,"7 мая доставит Ozon, продавец Kronax",https://www.ozon.ru/product/zazhigalka-kuhonnaya-luxlite-gazovaya-1-sht-311250929/?asb=zhSVtJ1fdxXDBV69q3zBRHzsShs4L3CyXSnM84yo1Fc%253D&asb2=TVFUTFiuT3zSqJuHP_crGXeOSDDdb2Jc26Ab28rAslsWfjU2PwLUhPvrk6ouZ19X
"Зажигалка кухонная LUXLITE газовая, 1 шт.",299 ₽,110 отзывов,"7 мая доставит Ozon, продавец Kronax",https://www.ozon.ru/product/zazhigalka-kuhonnaya-luxlite-gazovaya-1-sht-311247025/?asb=jriJ9vTq1vu6VlYZVHob81g7iduwRNbmjV7T4ELxtf7uXhc%252Ffdfx9F3%252FxW8wCdbm&asb2=4osxi1_HbL82yCUVBKANSi8EifQ_9B4br8SdN_e7NJFAlLNP-8BCXMqO7RrNNJk9I9WFwI1C7B05aoN3MCqQQXw3tfE7vpcrgoAR5lgd-4ivY3DNWq4bg60zVf7n53Sm
"Зажигалка кухонная пьезовая, 1 шт.",360 ₽,136 отзывов,"9 мая доставит Ozon, продавец Ёлочный базар",https://www.ozon.ru/product/zazhigalka-kuhonnaya-pezovaya-1-sht-239600922/?asb=0MvJiRp15uczWdGsLAuxlhSQSRdct9NqsimaseLHseYxHNtFqIr2KG3kJEdiKeOp&asb2=NAhpo_XDdlUahnW1JG1YuNG2DXlKxue1jPSBnmQeg4wA8LJNqQPfjoQJ8Kpqj1nev7Jrao7s6WY5Q5TRU00D2gByg0EZuq3s2B1icqkmVeAD4Sgn5RwA1WoouRkvjs0F2rYKO1acdpHz4BIGxGtL1Q
"Зажигалка электронная, кухонная, USB, серебристая, 23*2.5*1.5 см",1 014 ₽,2 отзыва,"9 мая доставит Ozon, продавец Фабрика Успеха",https://www.ozon.ru/product/zazhigalka-elektronnaya-kuhonnaya-usb-serebristaya-23-2-5-1-5-sm-348301765/?asb=p467gUqC%252B%252BtnG1fCIQQc1g9vAWTOrb07Ey4F2IAY4WE%253D&asb2=efJnnTrbqbLrmZehAg54FWBstybuQ2JapPAH8XUJdBggJMp56mZnNvppx3neFsMY
"Зажигалка кухонная НаВолне газовая, 1 шт.",450 ₽,1 отзыв,"Послезавтра доставит Ozon, продавец Like.mrkt",https://www.ozon.ru/product/zazhigalka-kuhonnaya-navolne-gazovaya-1-sht-485973472/?asb=wExc%252F3%252F8EfD4JOYcXkkrZKueNw4G9UYXaMpXnQ8wc8U%253D&asb2=T7WFCW74jeea_eznsu1zRAnFI1Kmu2Li4VC-uff_X_pLLgSROXHJiHZXH_0u_NCM
Зажигалка кухонная LUXLITE,239 ₽,9 отзывов,"7 мая доставит Ozon, продавец Luxlite",https://www.ozon.ru/product/zazhigalka-kuhonnaya-luxlite-196987781/?asb=YRT7todV%252B1almM94XNDhpCRkoqUSRIYEch6vR6CDI24%253D&asb2=a98GqXhs4wQ4ok67m6V5xjk8hknOCF8D8dTagEATVUOP1GvVDwmpk2EMSq29MwJ7
Зажигалка кухонная Ecos,279 ₽,106 отзывов,"8 мая доставит Ozon, продавец ООО ""ДАКОСТАНДАРТ""",https://www.ozon.ru/product/zazhigalka-gazovaya-ecos-gl-001v-fioletovaya-168095231/?asb=ws8sFBFqBezdSrps2QiSBijR4xv4jmpApcJ%252Fcae9LmY%253D&asb2=IGr9afK6sZSxIYvrBNXzMQ7wlBRdIPVL8L-gBoMhqGZarq-j7d388QG-L6MCWDFU
"Зажигалка кухонная Волжанка электрическая (от сети), 1 шт.",428 ₽,106 отзывов,"7 мая доставит Ozon, продавец Gelberk",https://www.ozon.ru/product/zazhigalka-kuhonnaya-volzhanka-elektricheskaya-ot-seti-1-sht-308388715/?asb=9Vztck%252Bh2%252FxcPfrLeKOYjwLulLtIx5rO1OPJlT%252BNDdc%253D&asb2=02igyFVh_U51Q8vLKgfg8necuBRh3swRk7WTbuqdQx4iBlecB1kkYu3n1TLBLil-
"Зажигалка для газовой плиты, зажигалка кухонная пьезовая",290 ₽,3 отзыва,"11 мая доставит Ozon, продавец Мелочи-Маркет",https://www.ozon.ru/product/zazhigalka-dlya-gazovoy-plity-zazhigalka-kuhonnaya-pezovaya-512266656/?asb=whv%252BeG6sP46MgDr1y%252BTgY%252FGw%252FrCYG03gaY9rRhHkVTA%253D&asb2=ZvhmWYr7bL6zpWHe47mD3rRM9VAK0kf02cndYJKFZmi10wNGvW6CSvE9x1GYKF5i
Спички хозяйственные 1500 шт,302 ₽,24 отзыва,"9 мая доставит Ozon, продавец БИО Брендс",https://www.ozon.ru/product/spichki-hozyaystvennye-1500-sht-417922257/?asb=Rw7SlNGQsLILOcij33ke%252BFqcQHeZraTMqo4N7hflFBA%253D&asb2=4w3olnbOYKetIF_ZIMVKeeFfAZ1iU1y5S8k0Bgofbstzo6ht_PegpBbVKFILZ8o5
"Зажигалка кухонная LUXLITE газовая, 1 шт.",249 ₽,72 отзыва,"7 мая доставит Ozon, продавец Kronax",https://www.ozon.ru/product/zazhigalka-kuhonnaya-luxlite-gazovaya-1-sht-376839814/?asb=ckytP0suFMuNwzMae%252BgYGkvdzmzpB04sLWI8iEpvhf4%253D&asb2=lTWP2Ah3J5yb96FfoFb_uXVQJCi4yuniCvuDjnFUkgnptywMK5-qKyULEZxmHlDx
"Пьезоэлектрическая зажигалка кухонная Arealon. Зажигалка бытовая пластиковая - Зажигалка для плиты, духовки, биокамина многоразовая пьезоэлектрическая Голубая Газовая пьезозажигалка многоразовая кухонная с классическим пламенем (длина 20.5 см)",398 ₽,1 отзыв,"Завтра доставит Ozon, продавец Arealon",https://www.ozon.ru/product/pezoelektricheskaya-zazhigalka-kuhonnaya-arealon-zazhigalka-bytovaya-plastikovaya-zazhigalka-527148008/?asb=X8VNky75%252Bu5KHNghFRScRXk1P0d%252FNrlw7IbcS5BMPI8%253D&asb2=dui4gJ6vh4agkI2jX_nDLLHeWa9X-BWIkhQuM85zcUtCDsc6s7VX8H74v9Y4P0Ik
Зажигалка кухонная газовая,195 ₽,2 отзыва,"11 мая доставит Ozon, продавец Мелочи-Маркет",https://www.ozon.ru/product/zazhigalka-kuhonnaya-gazovaya-513424603/?asb=qXvjxboIlxovpc%252Bu1eltCT11Li07MOpXCTZGVVCy7Tw%253D&asb2=HWdVXSWz6U_zpodqxUTwBV456V6BhTaiKDakQjaZMSHSx5Mdlkh2G-pJNsr66QpG
"Зажигалка кухонная Cricket газовая, 1 шт.",420 ₽,33 отзыва,"8 мая доставит Ozon, продавец ООО Монолит",https://www.ozon.ru/product/zazhigalka-kuhonnaya-cricket-gazovaya-1-sht-250744709/?asb=UKRwxkQC2aXMEvrXU3A80g9cnzZmTWfEUACcFKxlq0A%253D&asb2=SzZJaaZvzPKKYXRJ1ABcAMmf81Zpx9GWPl4ADz2VEEC11v45-TxyCIw_eH50vTNN
"Зажигалка кухонная Nova Home газовая, 1 шт.",299 ₽,15 отзывов,"8 мая доставит Ozon, продавец TALISMAN",https://www.ozon.ru/product/zazhigalka-kuhonnaya-nova-home-gazovaya-1-sht-473078873/?asb=3A94A%252B8Uu79AuyL6vvU2tPkwHrBli2611ntKG9rMEo4%253D&asb2=TNn_ws9wCa1qWTMIwjW0FtODvSI0xJu0K2309dk4Z_2_Bftozto8ozfB2TWpGSBT
"Зажигалка кухонная MAXCHOICE газовая, 1 шт.",475 ₽,6 отзывов,"Завтра доставит Ozon, продавец MAXCHOICE",https://www.ozon.ru/product/zazhigalka-kuhonnaya-maxchoice-gazovaya-1-sht-529248597/?asb=AQ5%252FlaaqWX%252FNStBrRTV0vlz4nR%252FMkAD%252FVU09mjKLnwk%253D&asb2=7-Cr4_ZVP2jac5Ey35DkcEoEmRmnRuFHSmiPRcNcMyFtDmVihBFmNFySbhTvYF_U
"Пьезоэлектрическая зажигалка кухонная Arealon. Зажигалка бытовая пластиковая - Зажигалка для плиты, духовки, биокамина многоразовая пьезоэлектрическая Зелёная Газовая пьезозажигалка многоразовая кухонная с классическим пламенем (длина 20.5 см)",398 ₽,1 отзыв,"Завтра доставит Ozon, продавец Arealon",https://www.ozon.ru/product/pezoelektricheskaya-zazhigalka-kuhonnaya-arealon-zazhigalka-bytovaya-plastikovaya-zazhigalka-527148946/?asb=BAho6%252FKRhL3JWQLcTBBw48TApxyhtIsnPi8xL5My6Go%253D&asb2=_-vGqPbqYrl6KLiDbDjV16N4A3sGoafNSm2kwm5IndVGAbB1O3y3YVafCtEmL9-m
Зажигалка кухонная LUXLITE газовая,299 ₽,29 отзывов,"7 мая доставит Ozon, продавец Kronax",https://www.ozon.ru/product/zazhigalka-kuhonnaya-luxlite-gazovaya-311254092/?asb=Lt8tQHkFDRAVT8jRC7RlFnfgwAQRpwsShT4uFlSQBjY%253D&asb2=dWLNruPrTUg_OvzOodYHhXxTFmp7ueDeKbsOm3jAkT28x2h_mdjI1D8uteAId9mu
